Name,Address,Publish Date,Bid Opening Date,Document Download / Sale Start Date,Document Download / Sale End Date,Clarification Start Date,Clarification End Date,Bid Submission Start Date,Bid Submission End Date,Financial Bid Opening Date,EMD Amount in ₹,EMD Exemption Allowed,EMD Fee Type,EMD Percentage,EMD Payable To,EMD Payable At,Tender Fee in ₹,Fee Payable To,Fee Payable At,Tender Fee Exemption Allowed,Organisation Chain,Tender Reference Number,Tender ID,Withdrawal Allowed,Tender Type,Form of contract,Tender Category,No. of Covers,General Technical Evaluation Allowed,ItemWise Technical Evaluation Allowed,Payment Mode,Is Multi Currency Allowed For BOQ,Is Multi Currency Allowed For Fee,Allow Two Stage Bidding,Cover No,Cover,Document Type,Description,S.No,Bank Name,Title,Work Description,Pre Qualification Details,Independent External Monitor/Remarks,Tender Value in ₹,Product Category,Sub category,Contract Type,Bid Validity(Days),Period Of Work(Days),Location,Pincode,Pre Bid Meeting Place,Pre Bid Meeting Address,Pre Bid Meeting Date,Bid Opening Place,Should Allow NDA Tender,Allow Preferential Bidder,Committee Chairperson/Co-ordinator Name :,Committee Chairperson/Co-ordinator Type :,Committee Members :,Updated By :,Updated on :,Document :,Organisation Chain :,Tender ID :,Tender Ref No :,Tender Title :,S.No.2,Bid Number,Bidder Name,Awarded Currency,Awarded Value,Contract Date :,Contract Value :,Work Completion Period in days :,Updated By :.1,Updated on :.1,AOC document :,AOC Description :,Type :,Summary :,Updated By :.2,Updated On :,Document :.1,Type :.1,Summary :.1,Updated By :.3,Updated On :.1,Document :.2,BOQ Comparative Chart :,S.No.1,Bid Number.1,Bidder Name.1,Submitted Date,Status,Remarks,Status Updated On,Committee Chairperson/Co-ordinator Name :.1,Committee Chairperson/Co-ordinator Type :.1,Committee Members :.1,Updated By :.4,Updated On :.2,Financial Bid Opening Date:,Document :.3
Chief Engineer Operation North,Chief Engineer Operation North HPSEBL Dharamshala,13-Jun-2023 10:00 AM,19-Jun-2023 11:30 AM,13-Jun-2023 10:30 AM,19-Jun-2023 10:30 AM,NA ,NA ,13-Jun-2023 10:40 AM,19-Jun-2023 10:30 AM,26-Jun-2023 12:10 PM,"9,000",No,fixed,,Nil,Nil,590.0,Nil,Nil,Yes,HPSEBL||CE (OP) North,CEON-TEN-14/ LT Panel Box 25KVA/23-24-,2023_HPSEB_74884_1,Yes,Open Tender,Item Rate,Goods,2.0,No,No,Online,No,No,No,1.0,Fee/PreQual/Technical,.pdf,NIT,1.0,ICICI BANK,CEON-TEN-14/ LT Panel Box 25KVA/23-24-,"Tender for supply of LT Distribution Panel Boxes suitable for 25KVA DTRs is required in operation circles under Chief Engineer Op North Zone, Dharamshala",Please refer Tender documents. ,NA ,"8,67,230",Electrical Work/ Equipment,NA ,Tender,120.0,90.0,Dharamshala,176215.0,NA ,NA ,NA ,Dharamshala,No ,No,Chief Engineer Operation North,Internal,SE Works office of CE OP North HPSEBL Dharamshala SE OP Circle HPSEBL Kangra AAO office of SE OP Circle HPSEBL Kangra,Ajay Gautam,18-Aug-2023 03:32 PM,finsummary_112184.pdf (409.12 KB),HPSEBL||CE (OP) North,2023_HPSEB_74884_1,CEON-TEN-14/ LT Panel Box 25KVA/23-24-,CEON-TEN-14/ LT Panel Box 25KVA/23-24-,1.0,354185.0,FUTURE COMMUNICATIONS,INR,"867,230.02",18-Aug-2023,"INR 867,230.02",90.0,Ajay Gautam,18-Aug-2023 03:42 PM,AOC14.pdf (3421.00 KB),"supply of LT Distribution Panel Boxes suitable for 25KVA DTRs is required in operation circles under Chief Engineer Op North Zone, Dharamshala",Technical,as attached,Ajay Gautam,26-Jun-2023 11:58 AM,technical_112184.pdf,Finance,as attachment,Ajay Gautam,18-Aug-2023 03:24 PM,finance_112184.pdf,BOQ Comparative Chart,1,354577,Ashoka Electronics and Electrical industries,15-Jun-2023 07:16 PM,Rejected-Finance,L-3,18-Aug-2023,Chief Engineer Operation North,Internal,SE Works office of CE OP North Dharamshala SE OP Circle HPSEBL Kangra AAO office of SE OP Circle HPSEBL Dalhousie,Ajay Gautam,26-Jun-2023 12:06 PM,26-Jun-2023 12:10 PM,techsummary_112184.pdf (361.36 KB)
,,,,,,,,,,,,,,,,,,,,,,,,,,,,,,,,,,,,,.pdf,Techno-Commercial,2.0,ICICI NEFT/RTGS,,,,,,,,,,,,,,,,,,,,,,,,,,,,,,,,,,,,,,,,,,,,,,,,,,,,2,354185,FUTURE COMMUNICATIONS,14-Jun-2023 06:05 PM,Accepted-AOC,The firm has reduce his quoted rates by 1 percent.,18-Aug-2023,,,,,,,
,,,,,,,,,,,,,,,,,,,,,,,,,,,,,,,,,,,2.0,Finance,.xls,BOQ,,,,,,,,,,,,,,,,,,,,,,,,,,,,,,,,,,,,,,,,,,,,,,,,,,,,,,3,355112,HIMTEK BUILDERS,17-Jun-2023 08:54 PM,Rejected-Technical,non responsive,26-Jun-2023,,,,,,,
,,,,,,,,,,,,,,,,,,,,,,,,,,,,,,,,,,,,,,,,,,,,,,,,,,,,,,,,,,,,,,,,,,,,,,,,,,,,,,,,,,,,,,,,,,,,4,355179,MAHESH KUMAR AND SONS,19-Jun-2023 06:58 AM,Rejected-Technical,non responsive,26-Jun-2023,,,,,,,
,,,,,,,,,,,,,,,,,,,,,,,,,,,,,,,,,,,,,,,,,,,,,,,,,,,,,,,,,,,,,,,,,,,,,,,,,,,,,,,,,,,,,,,,,,,,5,354971,Powerlines,17-Jun-2023 05:47 PM,Rejected-Finance,L-2,18-Aug-2023,,,,,,,
