Committee Chairperson/Co-ordinator Name :,Committee Chairperson/Co-ordinator Type :,Committee Members :,Updated By :,Updated on :,Document :,Contract Date :,Contract Value :,Work Completion Period in days :,Updated By :.1,Updated on :.1,AOC document :,AOC Description :,Organisation Chain :,Tender ID :,Tender Ref No :,Tender Title :,Committee Chairperson/Co-ordinator Name :.1,Committee Chairperson/Co-ordinator Type :.1,Committee Members :.1,Updated By :.2,Updated On :,Financial Bid Opening Date:,Document :.1,Type :,Summary :,Updated By :.3,Updated On :.1,Document :.2,S.No,Bid Number,Bidder Name,Submitted Date,Status,Remarks,Status Updated On,S.No.1,Bid Number.1,Bidder Name.1,Awarded Currency,Awarded Value,Type :.1,Summary :.1,Updated By :.4,Updated On :.2,Document :.3,BOQ Comparative Chart :,Publish Date,Bid Opening Date,Document Download / Sale Start Date,Document Download / Sale End Date,Clarification Start Date,Clarification End Date,Bid Submission Start Date,Bid Submission End Date,Financial Bid Opening Date,Tender Fee in ₹,Fee Payable To,Fee Payable At,Tender Fee Exemption Allowed,S.No.2,Bank Name,EMD Amount in ₹,EMD Exemption Allowed,EMD Fee Type,EMD Percentage,EMD Payable To,EMD Payable At,Name,Address,Cover No,Cover,Document Type,Description,Title,Work Description,Pre Qualification Details,Independent External Monitor/Remarks,Tender Value in ₹,Product Category,Sub category,Contract Type,Bid Validity(Days),Period Of Work(Days),Location,Pincode,Pre Bid Meeting Place,Pre Bid Meeting Address,Pre Bid Meeting Date,Bid Opening Place,Should Allow NDA Tender,Allow Preferential Bidder,Organisation Chain,Tender Reference Number,Tender ID,Withdrawal Allowed,Tender Type,Form of contract,Tender Category,No. of Covers,General Technical Evaluation Allowed,ItemWise Technical Evaluation Allowed,Payment Mode,Is Multi Currency Allowed For BOQ,Is Multi Currency Allowed For Fee,Allow Two Stage Bidding
EXECUTIVE EINGINEER,Internal,SUPDT DAO HDM,Ravi Singh Rana,17-Jul-2023 05:48 PM,finsummary_110370.pdf (38.31 KB),24-Aug-2023,"INR 797,231",180.0,Ravi Singh Rana,24-Aug-2023 04:26 PM,2023_73440.pdf (1631.00 KB),AWARDED TO L1,PWD,2023_PWD_73440_1,Electrical Division-I dated 11.05.2023,Providing replacement of old Out dated Fire Extinguisher with New Fire Extinguisher in Main Building at High Court Building Shimla,EXECUTIVE EINGINEER,Internal,SUPDT DAO HDM,Ravi Singh Rana,24-Jun-2023 02:48 PM,24-Jun-2023 02:50 PM,techsummary_110370.pdf (370.95 KB),Technical,Five number bids were found uploaded on e-procurement accordingly opened for technical part today on 25.05.2023.,Ravi Singh Rana,25-May-2023 01:09 PM,technical_110370.pdf,1.0,348791.0,Acoustic Media Solutions,24-May-2023 12:36 PM,Rejected-Technical,Not qualified,24-Jun-2023,1.0,349211.0,bhupender thakur,INR,"797,231",Finance,Four number bids were found qualified in TQC accordingly opened for financial part today on dated 24.06.2023 in which Ms bhupender thakur was found L-1,Ravi Singh Rana,24-Jun-2023 03:03 PM,finance_110370.pdf,BOQ Comparative Chart,17-May-2023 06:00 PM,25-May-2023 11:30 AM,17-May-2023 06:30 PM,24-May-2023 05:00 PM,NA ,NA ,17-May-2023 06:30 PM,24-May-2023 05:00 PM,24-Jun-2023 02:50 PM,500.0,E.E.Electrical Division No-I Shimla-9,Shimla-9,No,1.0,ICICI BANK,"28,800",No,fixed,,E.E.Electrical Division No-I Shimla-9,Shimla-9,XEN Electrical Division No. 1 Shimla,The Executive Engineer Electrical Division No-1 HPPWD Shimla-9,1.0,Fee/PreQual/Technical,.pdf,Cost of Tender in shape of DD or online,Providing replacement of old Out dated Fire Extinguisher with New Fire Extinguisher in Main Building at High Court Building Shimla,Providing replacement of old Out dated Fire Extinguisher with New Fire Extinguisher in Main Building at High Court Building Shimla,Please refer Tender documents. ,NA ,"14,37,748",Electrical Works,NA ,Tender,90.0,180.0,SHIMLA,171009.0,NA ,NA ,NA ,SHIMLA KASUMPTI -9,No ,No,PWD,Electrical Division-I dated 11.05.2023,2023_PWD_73440_1,Yes,Open Tender,Percentage,Works,2.0,No,No,Both(Online/Offline),No,No,No
,,,,,,,,,,,,,,,,,,,,,,,,,,,,,2.0,348957.0,AVINASH FIRE PROTECTION SYSTEM,23-May-2023 02:24 PM,Rejected-AOC,L4,24-Aug-2023,,,,,,,,,,,,,,,,,,,,,,,,,2.0,ICICI NEFT/RTGS,,,,,,,,,,,.pdf,EMD in shape of FDR or online,,,,,,,,,,,,,,,,,,,,,,,,,,,,,,,,
,,,,,,,,,,,,,,,,,,,,,,,,,,,,,3.0,349211.0,bhupender thakur,24-May-2023 02:09 PM,Accepted-AOC,L1,24-Aug-2023,,,,,,,,,,,,,,,,,,,,,,,,,,,,,,,,,,,,,.pdf,GST/PAN Registration,,,,,,,,,,,,,,,,,,,,,,,,,,,,,,,,
,,,,,,,,,,,,,,,,,,,,,,,,,,,,,4.0,349108.0,Soni Supplier OPC Private Limited,24-May-2023 12:03 PM,Rejected-AOC,L2,24-Aug-2023,,,,,,,,,,,,,,,,,,,,,,,,,,,,,,,,,,,,,.pdf,TQC Technical Qualification Criteria as per Tender document declaration by contractors,,,,,,,,,,,,,,,,,,,,,,,,,,,,,,,,
,,,,,,,,,,,,,,,,,,,,,,,,,,,,,5.0,349160.0,TARUN FIRE SYSTEM,24-May-2023 04:25 PM,Rejected-AOC,L3,24-Aug-2023,,,,,,,,,,,,,,,,,,,,,,,,,,,,,,,,,,,,,.pdf,Certificate of undertaking /Declaration by the Contractor,,,,,,,,,,,,,,,,,,,,,,,,,,,,,,,,
,,,,,,,,,,,,,,,,,,,,,,,,,,,,,,,,,,,,,,,,,,,,,,,,,,,,,,,,,,,,,,,,,,,,,,2.0,Finance,.xls,SCHEDULE of QUANTITY BOQ,,,,,,,,,,,,,,,,,,,,,,,,,,,,,,,,
,,,,,,,,,,,,,,,,,,,,,,,,,,,,,,,,,,,,,,,,,,,,,,,,,,,,,,,,,,,,,,,,,,,,,,,,.pdf,STANDARD BIDDING DOCUMENT Form-8,,,,,,,,,,,,,,,,,,,,,,,,,,,,,,,,
