Title,Work Description,Pre Qualification Details,Independent External Monitor/Remarks,Tender Value in ₹,Product Category,Sub category,Contract Type,Bid Validity(Days),Period Of Work(Days),Location,Pincode,Pre Bid Meeting Place,Pre Bid Meeting Address,Pre Bid Meeting Date,Bid Opening Place,Should Allow NDA Tender,Allow Preferential Bidder,Publish Date,Bid Opening Date,Document Download / Sale Start Date,Document Download / Sale End Date,Clarification Start Date,Clarification End Date,Bid Submission Start Date,Bid Submission End Date,Financial Bid Opening Date,S.No,Instrument Type,Name,Address,Organisation Chain,Tender Reference Number,Tender ID,Withdrawal Allowed,Tender Type,Form of contract,Tender Category,No. of Covers,General Technical Evaluation Allowed,ItemWise Technical Evaluation Allowed,Payment Mode,Is Multi Currency Allowed For BOQ,Is Multi Currency Allowed For Fee,Allow Two Stage Bidding,Tender Fee in ₹,Fee Payable To,Fee Payable At,Tender Fee Exemption Allowed,Cover No,Cover,Document Type,Description,EMD Amount in ₹,EMD Exemption Allowed,EMD Fee Type,EMD Percentage,EMD Payable To,EMD Payable At,Type :,Summary :,Updated By :,Updated On :,Document :,BOQ Comparative Chart :,Type :.1,Summary :.1,Updated By :.1,Updated On :.1,Document :.1,Committee Chairperson/Co-ordinator Name :,Committee Chairperson/Co-ordinator Type :,Committee Members :,Updated By :.2,Updated On :.2,Financial Bid Opening Date:,Document :.2,S.No.2,Bid Number,Bidder Name,Submitted Date,Status,Remarks,Status Updated On,Contract Date :,Contract Value :,Work Completion Period in days :,Updated By :.3,Updated on :,AOC document :,AOC Description :,S.No.1,Bid Number.1,Bidder Name.1,Awarded Currency,Awarded Value,Committee Chairperson/Co-ordinator Name :.1,Committee Chairperson/Co-ordinator Type :.1,Committee Members :.1,Updated By :.4,Updated on :.1,Document :.3,Organisation Chain :,Tender ID :,Tender Ref No :,Tender Title :
Lantana/RMS 8/2nd 2023-24,Maint of Lantana,Please refer Tender documents. ,NA ,"5,03,550",Repair and Maintenance Works,NA ,Tender,90.0,180.0,Ramshehar,174102.0,NA ,NA ,NA ,DPO IDP Solan,No ,No,12-Jul-2023 03:00 PM,24-Jul-2023 02:00 PM,12-Jul-2023 05:00 PM,22-Jul-2023 05:00 PM,NA ,NA ,12-Jul-2023 05:00 PM,22-Jul-2023 05:00 PM,27-Jul-2023 10:00 AM,1.0,DD - Demand Draft,DPO IDP Solan,Tank Road Solan,Chief Project Director IDP Solan||DPO Solan,DPO/IDP/MAINT/PLANTATION,2023_CPD1_76023_8,Yes,Open Tender,Item Rate,Works,2.0,No,No,Offline,No,No,No,500.0,DPO IDP Solan,Solan,Yes,1.0,Fee/PreQual/Technical,.pdf,"Total Monetary value and list of works of last three years, financial statement","10,000",Yes,fixed,,DPO IDP Solan,Solan,Finance,In financial evaluation 03 bids are evaluated all bids are found responsive,Sanjeev kumar,27-Jul-2023 10:36 AM,finance_113783.pdf,BOQ Comparative Chart,Technical,In technical evaluation 3 bids are evaluated and all bids are found responsive,Sanjeev kumar,26-Jul-2023 04:15 PM,technical_113783.pdf,PurshotamSingh,Internal,Madan Lal APO Ramshehar and Sundeep Kumar FEO,Sanjeev kumar,26-Jul-2023 05:19 PM,27-Jul-2023 10:00 AM,techsummary_113783.pdf (1010.40 KB),1.0,361174.0,Mohinder Singh,19-Jul-2023 12:28 PM,Rejected-Finance,Highest,01-Aug-2023,01-Aug-2023,"INR 495,000",180.0,Sanjeev kumar,01-Aug-2023 04:27 PM,8.pdf (834.00 KB),Lowest Bidder,1.0,361148.0,SHIVENDERPAL SINGH BRAR,INR,"495,000",Ved Parkash APO,Internal,"Madan Lal APO, Deep Kumar FEO",Sanjeev kumar,01-Aug-2023 09:56 AM,finsummary_113783.pdf (834.28 KB),Chief Project Director IDP Solan||DPO Solan,2023_CPD1_76023_8,DPO/IDP/MAINT/PLANTATION,Lantana/RMS 8/2nd 2023-24
,,,,,,,,,,,,,,,,,,,,,,,,,,,2.0,FDR - Fixed Deposit,,,,,,,,,,,,,,,,,,,,,,,.pdf,Certificate of movable and fixed assets valuation,,,,,,,,,,,,,,,,,,,,,,,,,2.0,361153.0,PURAN CHAND,19-Jul-2023 11:40 AM,Rejected-Finance,Highest,01-Aug-2023,,,,,,,,,,,,,,,,,,,,,,
,,,,,,,,,,,,,,,,,,,,,,,,,,,,,,,,,,,,,,,,,,,,,,,,,,,.pdf,"Copy of PAN, GST, GST Clearance, Bank Account, EPF",,,,,,,,,,,,,,,,,,,,,,,,,3.0,361148.0,SHIVENDERPAL SINGH BRAR,19-Jul-2023 11:15 AM,Accepted-AOC,Lowest Bidder,01-Aug-2023,,,,,,,,,,,,,,,,,,,,,,
,,,,,,,,,,,,,,,,,,,,,,,,,,,,,,,,,,,,,,,,,,,,,,,,,,,.pdf,Copy of Signed scanned Letter of Quotation for Technical and financial part and undertaking,,,,,,,,,,,,,,,,,,,,,,,,,,,,,,,,,,,,,,,,,,,,,,,,,,,,,
,,,,,,,,,,,,,,,,,,,,,,,,,,,,,,,,,,,,,,,,,,,,,,,,,,,.xls,Technical Bid checklist,,,,,,,,,,,,,,,,,,,,,,,,,,,,,,,,,,,,,,,,,,,,,,,,,,,,,
,,,,,,,,,,,,,,,,,,,,,,,,,,,,,,,,,,,,,,,,,,,,,,,,,2.0,Finance,.xls,BOQ,,,,,,,,,,,,,,,,,,,,,,,,,,,,,,,,,,,,,,,,,,,,,,,,,,,,,
