Title,Work Description,Pre Qualification Details,Independent External Monitor/Remarks,Tender Value in ₹,Product Category,Sub category,Contract Type,Bid Validity(Days),Period Of Work(Days),Location,Pincode,Pre Bid Meeting Place,Pre Bid Meeting Address,Pre Bid Meeting Date,Bid Opening Place,Should Allow NDA Tender,Allow Preferential Bidder,EMD Amount in ₹,EMD Exemption Allowed,EMD Fee Type,EMD Percentage,EMD Payable To,EMD Payable At,Cover No,Cover,Document Type,Description,Publish Date,Bid Opening Date,Document Download / Sale Start Date,Document Download / Sale End Date,Clarification Start Date,Clarification End Date,Bid Submission Start Date,Bid Submission End Date,Financial Bid Opening Date,S.No,Instrument Type,Tender Fee in ₹,Fee Payable To,Fee Payable At,Tender Fee Exemption Allowed,Name,Address,Organisation Chain,Tender Reference Number,Tender ID,Withdrawal Allowed,Tender Type,Form of contract,Tender Category,No. of Covers,General Technical Evaluation Allowed,ItemWise Technical Evaluation Allowed,Payment Mode,Is Multi Currency Allowed For BOQ,Is Multi Currency Allowed For Fee,Allow Two Stage Bidding,S.No.2,Bid Number,Bidder Name,Submitted Date,Status,Remarks,Status Updated On,Type :,Summary :,Updated By :,Updated On :,Document :,Type :.1,Summary :.1,Updated By :.1,Updated On :.1,Document :.1,BOQ Comparative Chart :,S.No.1,Bid Number.1,Bidder Name.1,Awarded Currency,Awarded Value,Committee Chairperson/Co-ordinator Name :,Committee Chairperson/Co-ordinator Type :,Committee Members :,Updated By :.2,Updated On :.2,Financial Bid Opening Date:,Document :.2,Organisation Chain :,Tender ID :,Tender Ref No :,Tender Title :,Contract Date :,Contract Value :,Work Completion Period in days :,Updated By :.3,Updated on :,AOC document :,AOC Description :,Committee Chairperson/Co-ordinator Name :.1,Committee Chairperson/Co-ordinator Type :.1,Committee Members :.1,Updated By :.4,Updated on :.1,Document :.3
Improvement of path Strawberry Hill Chotta Shimla path below petrol pump and path near Kanwer Villa pine House in ward No 28 under AMRUT,Improvement of path Strawberry Hill Chotta Shimla path below petrol pump and path near Kanwer Villa pine House in ward No 28 under AMRUT,Please refer Tender Documents ,NA ,"3,96,500",Civil Works,NA ,Tender,120.0,120.0,Shimla,171001.0,NA ,NA ,NA ,MC Shimla,No ,No,"7,900",No,fixed,,Executive Engineer RB MC Shimla,Shimla,1.0,Fee/PreQual/Technical,.pdf,Cost of form in shape of DD as per E procurement notice,16-Oct-2020 02:00 PM,26-Oct-2020 11:00 AM,16-Oct-2020 02:00 PM,26-Oct-2020 10:30 AM,NA ,NA ,16-Oct-2020 02:00 PM,26-Oct-2020 10:30 AM,07-Nov-2020 01:55 PM,1.0,DD - Demand Draft,350.0,Executive Engineer RB MC Shimla,Shimla,No,Executive Engineer RB MC Shimla,Executive Engineer RB MC Shimla,Municipal Corporation Shimla,2752Dated09102020,2020_MC_41677_17,Yes,Open Tender,Item Rate,Works,2.0,No,No,Offline,No,No,No,1.0,183839.0,GAURAV KASHYAP,24-Oct-2020 05:10 PM,Rejected-Finance,Rejected,10-Aug-2023,Technical,bos,Rajesh Thakur,07-Nov-2020 01:37 PM,technical_61553.pdf,Finance,BOS,Rajesh Thakur,03-Jul-2023 10:21 AM,finance_61553.pdf,BOQ Comparative Chart,1.0,183888.0,Sant Ram,INR,"510,217",EE,Internal,AO AE,Rajesh Thakur,07-Nov-2020 01:40 PM,07-Nov-2020 01:55 PM,techsummary_61553.pdf (1307.80 KB),Municipal Corporation Shimla,2020_MC_41677_17,2752Dated09102020,Improvement of path Strawberry Hill Chotta Shimla path below petrol pump and path near Kanwer Villa pine House in ward No 28 under AMRUT,10-Aug-2023,"INR 510,217.1",60.0,Rajesh Thakur,10-Aug-2023 12:18 PM,2020_MC_41677_17.pdf (380.00 KB),AOC,EE,Internal,AO AE,Rajesh Thakur,10-Aug-2023 12:17 PM,finsummary_61553.pdf (289.77 KB)
,,,,,,,,,,,,,,,,,,,,,,,,,,.pdf,Earnest money in shape of FDR and exemption shall not be allowed,,,,,,,,,,2.0,FDR - Fixed Deposit,,,,,,,,,,,,,,,,,,,,,2.0,183840.0,himesh,24-Oct-2020 05:19 PM,Rejected-Finance,Rejected,10-Aug-2023,,,,,,,,,,,,,,,,,,,,,,,,,,,,,,,,,,,,,,,,
,,,,,,,,,,,,,,,,,,,,,,,,,,.pdf,Certificate of registration with HPPWD in appropriate class and latest renewal thereof,,,,,,,,,,,,,,,,,,,,,,,,,,,,,,,,3.0,183888.0,Sant Ram,26-Oct-2020 06:54 AM,Accepted-AOC,Accepted,10-Aug-2023,,,,,,,,,,,,,,,,,,,,,,,,,,,,,,,,,,,,,,,,
,,,,,,,,,,,,,,,,,,,,,,,,,,.pdf,Income Tax GST and EPF registration PAN permanent Account no and GST No,,,,,,,,,,,,,,,,,,,,,,,,,,,,,,,,4.0,183648.0,Vinod Kumar Shah,23-Oct-2020 12:31 PM,Rejected-Finance,Rejected,10-Aug-2023,,,,,,,,,,,,,,,,,,,,,,,,,,,,,,,,,,,,,,,,
,,,,,,,,,,,,,,,,,,,,,,,,,,.pdf,Contractor has to deposit FDR on account of 10 percent performance guarantee at the time of award,,,,,,,,,,,,,,,,,,,,,,,,,,,,,,,,5.0,183834.0,vivek mehan,24-Oct-2020 04:58 PM,Rejected-Finance,Rejected,10-Aug-2023,,,,,,,,,,,,,,,,,,,,,,,,,,,,,,,,,,,,,,,,
,,,,,,,,,,,,,,,,,,,,,,,,2.0,Finance,.xls,Schedule of Quantity (BOQ),,,,,,,,,,,,,,,,,,,,,,,,,,,,,,,,,,,,,,,,,,,,,,,,,,,,,,,,,,,,,,,,,,,,,,,,,,,,,,
