Type :,Summary :,Updated By :,Updated On :,Document :,Committee Chairperson/Co-ordinator Name :,Committee Chairperson/Co-ordinator Type :,Committee Members :,Updated By :.1,Updated on :,Document :.1,S.No,Bid Number,Bidder Name,Submitted Date,Status,Remarks,Status Updated On,Contract Date :,Contract Value :,Work Completion Period in days :,Updated By :.2,Updated on :.1,AOC document :,AOC Description :,Type :.1,Summary :.1,Updated By :.3,Updated On :.1,Document :.2,BOQ Comparative Chart :,Committee Chairperson/Co-ordinator Name :.1,Committee Chairperson/Co-ordinator Type :.1,Committee Members :.1,Updated By :.4,Updated On :.2,Financial Bid Opening Date:,Document :.3,Organisation Chain :,Tender ID :,Tender Ref No :,Tender Title :,S.No.1,Bid Number.1,Bidder Name.1,Awarded Currency,Awarded Value,Name,Address,Organisation Chain,Tender Reference Number,Tender ID,Withdrawal Allowed,Tender Type,Form of contract,Tender Category,No. of Covers,General Technical Evaluation Allowed,ItemWise Technical Evaluation Allowed,Payment Mode,Is Multi Currency Allowed For BOQ,Is Multi Currency Allowed For Fee,Allow Two Stage Bidding,Cover No,Cover,Document Type,Description,Title,Work Description,Pre Qualification Details,Independent External Monitor/Remarks,Tender Value in ₹,Product Category,Sub category,Contract Type,Bid Validity(Days),Period Of Work(Days),Location,Pincode,Pre Bid Meeting Place,Pre Bid Meeting Address,Pre Bid Meeting Date,Bid Opening Place,Should Allow NDA Tender,Allow Preferential Bidder,EMD Amount in ₹,EMD Exemption Allowed,EMD Fee Type,EMD Percentage,EMD Payable To,EMD Payable At,S.No.2,Instrument Type,Tender Fee in ₹,Fee Payable To,Fee Payable At,Tender Fee Exemption Allowed,Publish Date,Bid Opening Date,Document Download / Sale Start Date,Document Download / Sale End Date,Clarification Start Date,Clarification End Date,Bid Submission Start Date,Bid Submission End Date,Financial Bid Opening Date
Technical,BOS,Dinesh Thakur,20-Jul-2023 12:08 PM,technical_113735.pdf,EE,Internal,AO AE,Rajesh Thakur,19-Aug-2023 01:02 PM,finsummary_113735.pdf (314.77 KB),1,360838,DHEERAJ PARMAR,17-Jul-2023 04:14 PM,Rejected-Technical,Rejected,24-Jul-2023,19-Aug-2023,"INR 626,585.8",30.0,Rajesh Thakur,19-Aug-2023 01:03 PM,2023_MC_75998_3.pdf (714.00 KB),AOC,Finance,BOS,Rajesh Thakur,19-Aug-2023 11:58 AM,finance_113735.pdf,BOQ Comparative Chart,EE,Internal,AO AE,Rajesh Thakur,24-Jul-2023 04:25 PM,24-Jul-2023 04:30 PM,techsummary_113735.pdf (1037.13 KB),Municipal Corporation Shimla,2023_MC_75998_3,1382Dated04072023,Construction of B wall on path leading to Indernagar road from in front of Janjatiya Bhawan RD 0 0 to 0 45 ward No 20,1.0,360393.0,suresh jagta,INR,"593,682",Executive Engineer R B M C Shimla,Executive Engineer R B M C Shimla,Municipal Corporation Shimla,1382Dated04072023,2023_MC_75998_3,Yes,Open Tender,Item Rate,Works,2.0,No,No,Offline,No,No,No,1.0,Fee/PreQual/Technical,.pdf,Cost of form in shape of DD and Earnest money in shape of FDR as per E procurement notice,Construction of B wall on path leading to Indernagar road from in front of Janjatiya Bhawan RD 0 0 to 0 45 ward No 20,Construction of B wall on path leading to Indernagar road from in front of Janjatiya Bhawan RD 0 0 to 0 45 ward No 20,Please refer Tender Documents ,NA ,"6,19,894",Civil Works,NA ,Tender,120.0,30.0,Shimla,171001.0,NA ,NA ,NA ,MC Shimla,No ,No,"12,400",No,fixed,,Executive Engineer R B M C Shimla,Shimla,1.0,DD - Demand Draft,350.0,Executive Engineer R B M C Shimla,Shimla,No,07-Jul-2023 05:00 PM,18-Jul-2023 03:00 PM,07-Jul-2023 05:00 PM,17-Jul-2023 05:00 PM,NA ,NA ,07-Jul-2023 05:00 PM,17-Jul-2023 05:00 PM,24-Jul-2023 04:30 PM
,,,,,,,,,,,2,360786,Hukam Singh,17-Jul-2023 01:44 PM,Rejected-Technical,Rejected,24-Jul-2023,,,,,,,,,,,,,,,,,,,,,,,,,,,,,,,,,,,,,,,,,,,,,,,,.pdf,Certificate of registration with HPPWD in appropriate class and latest renewal thereof,,,,,,,,,,,,,,,,,,,,,,,,,2.0,FDR - Fixed Deposit,,,,,,,,,,,,,
,,,,,,,,,,,3,360572,mukul thakur,17-Jul-2023 04:13 PM,Rejected-Technical,Rejected,24-Jul-2023,,,,,,,,,,,,,,,,,,,,,,,,,,,,,,,,,,,,,,,,,,,,,,,,.pdf,Income Tax GST and EPF registration PAN Permanent Account No and GST No,,,,,,,,,,,,,,,,,,,,,,,,,,,,,,,,,,,,,,,
,,,,,,,,,,,4,360793,NEERAJ KUMAR,17-Jul-2023 01:45 PM,Rejected-Finance,Rejected,19-Aug-2023,,,,,,,,,,,,,,,,,,,,,,,,,,,,,,,,,,,,,,,,,,,,,,,,.pdf,Scanned Copy of tender documents i.e. NIT (E-procurement notice) Performa and Form MW-7 duly signed,,,,,,,,,,,,,,,,,,,,,,,,,,,,,,,,,,,,,,,
,,,,,,,,,,,5,360783,SATISH KUMAR JAGTA,17-Jul-2023 01:30 PM,Rejected-Technical,Rejected,24-Jul-2023,,,,,,,,,,,,,,,,,,,,,,,,,,,,,,,,,,,,,,,,,,,,,,,,.pdf,Scanned copy of Affidavit duly signed with reference to condition No. 11.4,,,,,,,,,,,,,,,,,,,,,,,,,,,,,,,,,,,,,,,
,,,,,,,,,,,6,360800,SUNIL SHARMA,17-Jul-2023 02:01 PM,Rejected-Finance,Rejected,19-Aug-2023,,,,,,,,,,,,,,,,,,,,,,,,,,,,,,,,,,,,,,,,,,,,,,,,.pdf,Scanned copy of Letter Head with reference to condition No. 11.1,,,,,,,,,,,,,,,,,,,,,,,,,,,,,,,,,,,,,,,
,,,,,,,,,,,7,360393,suresh jagta,17-Jul-2023 01:09 PM,Accepted-AOC,Accepted,19-Aug-2023,,,,,,,,,,,,,,,,,,,,,,,,,,,,,,,,,,,,,,,,,,,,,,2.0,Finance,.xls,BOQ,,,,,,,,,,,,,,,,,,,,,,,,,,,,,,,,,,,,,,,
