Title,Work Description,Pre Qualification Details,Independent External Monitor/Remarks,Tender Value in ₹,Product Category,Sub category,Contract Type,Bid Validity(Days),Period Of Work(Days),Location,Pincode,Pre Bid Meeting Place,Pre Bid Meeting Address,Pre Bid Meeting Date,Bid Opening Place,Should Allow NDA Tender,Allow Preferential Bidder,Organisation Chain,Tender Reference Number,Tender ID,Withdrawal Allowed,Tender Type,Form of contract,Tender Category,No. of Covers,General Technical Evaluation Allowed,ItemWise Technical Evaluation Allowed,Payment Mode,Is Multi Currency Allowed For BOQ,Is Multi Currency Allowed For Fee,Allow Two Stage Bidding,Cover No,Cover,Document Type,Description,Name,Address,S.No,Bank Name,Tender Fee in ₹,Fee Payable To,Fee Payable At,Tender Fee Exemption Allowed,Publish Date,Bid Opening Date,Document Download / Sale Start Date,Document Download / Sale End Date,Clarification Start Date,Clarification End Date,Bid Submission Start Date,Bid Submission End Date,Financial Bid Opening Date,EMD Amount in ₹,EMD through BG/ST or EMD Exemption Allowed,EMD Fee Type,EMD Percentage,EMD Payable To,EMD Payable At,Tender Stage,Organisation Chain :,Tender ID :,Tender Ref No :,Tender Title :,Type :,Summary :,Updated By :,Updated On :,Document :,S.No,Bid Number,Bidder Name,Submitted Date,Status,Remarks,Status Updated On,Committee Chairperson/Co-ordinator Name :,Committee Chairperson/Co-ordinator Type :,Committee Members :,Updated By :.1,Updated On :.1,Financial Bid Opening Date:,Document :.1,Type :.1,Summary :.1,Updated By :.2,Updated On :.2,Document :.2,BOQ Comparative Chart :,Tender Stage
Anti erosion measures to protect Alubari Area at right bank of river Buridehing near Margherita Town,Anti erosion measures to protect Alubari Area at right bank of river Buridehing near Margherita Town,Please refer Tender documents. ,NA ,"1,99,99,578",Civil Works,NA ,Tender,180.0,90.0,Dibrugarh,786005.0,NA ,NA ,NA ,Dibrugarh,No ,No,Department of Water Resources||Chief Engineer - DoWR,DIB/SOPD/ALUBARI/2020-21/1,2021_DoWR_20982_1,Yes,Open Tender,Works,Works,2.0,No,No,Online,No,No,No,1.0,Fee/PreQual/Technical,.pdf,Technical Documents,"Addl. Chief Engineer, UAZ, W. R. Deptt. Dibrugarh","Addl. Chief Engineer, UAZ, W. R. Deptt. Dibrugarh",1.0,SBI Bank,"4,000",Nil,Nil,No,05-Feb-2021 06:00 PM,16-Feb-2021 02:00 PM,05-Feb-2021 06:00 PM,15-Feb-2021 02:00 PM,NA ,NA ,09-Feb-2021 10:00 AM,15-Feb-2021 02:00 PM,18-Feb-2021 05:30 PM,"3,99,992",Yes,percentage,2.0%,Nil,Nil,AOC,Department of Water Resources||Chief Engineer - DoWR,2021_DoWR_20982_1,DIB/SOPD/ALUBARI/2020-21/1,Anti erosion measures to protect Alubari Area at right bank of river Buridehing near Margherita Town,Technical,Financial bid of the successful bidders may be opened,Joy Sekhar Chakraborty,18-Feb-2021 05:25 PM,technical_32620.pdf,1,108663,BOLIN DOWERAH,15-Feb-2021 01:04 PM,Rejected-AOC,NOT QUALIFIED FOR AOC,25-May-2021 12:49 PM,"Additional Chief Engineer, Upper Assam Zone, W. R. Department, Dibrugarh",Internal,"Additional Chief Engineer, UAZ, W.R. Department, Dibrugarh, Director, Design and Planning, Deputy Director, Design and Planning, Assistant Executive Engineer (TC), O/o the ACE, UAZ, WRD",Joy Sekhar Chakraborty,18-Feb-2021 05:27 PM,18-Feb-2021 05:30 PM,techsummary_32620.pdf (754.58 KB),Finance,Updated cs may be prepared,Joy Sekhar Chakraborty,18-Feb-2021 05:39 PM,,BOQ Comparative Chart,AOC
,,,,,,,,,,,,,,,,,,,,,,,,,,,,,,,,2.0,Finance,.xls,BOQ,,,,,,,,,,,,,,,,,,,,,,,,AOC,,,,,,,,,,2,106985,M/S East India Construction,14-Feb-2021 05:26 PM,Rejected-AOC,NOT QUALIFIED FOR AOC,25-May-2021 12:49 PM,,,,,,,,,,,,,,AOC
,,,,,,,,,,,,,,,,,,,,,,,,,,,,,,,,,,,,,,,,,,,,,,,,,,,,,,,,,,,AOC,,,,,,,,,,3,108050,"M/S KAVIYA ENTERPRISE, SANTOSH GARODIA-JV",15-Feb-2021 10:58 AM,Rejected-AOC,NOT QUALIFIED FOR AOC,25-May-2021 12:49 PM,,,,,,,,,,,,,,AOC
,,,,,,,,,,,,,,,,,,,,,,,,,,,,,,,,,,,,,,,,,,,,,,,,,,,,,,,,,,,AOC,,,,,,,,,,4,107239,M/S. M.P. AGARWALLA,14-Feb-2021 08:43 PM,Rejected-AOC,NOT QUALIFIED FOR AOC,25-May-2021 12:49 PM,,,,,,,,,,,,,,AOC
,,,,,,,,,,,,,,,,,,,,,,,,,,,,,,,,,,,,,,,,,,,,,,,,,,,,,,,,,,,AOC,,,,,,,,,,5,108462,"RANJAN DUTTA, AHSANUL MAZID JV",15-Feb-2021 11:33 AM,Accepted-AOC,PROPER,25-May-2021 12:49 PM,,,,,,,,,,,,,,AOC
,,,,,,,,,,,,,,,,,,,,,,,,,,,,,,,,,,,,,,,,,,,,,,,,,,,,,,,,,,,AOC,,,,,,,,,,6,107552,REZWAN ANSARI NAVISH TULSHYAN JV,11-Feb-2021 04:58 PM,Rejected-AOC,NOT QUALIFIED FOR AOC,25-May-2021 12:49 PM,,,,,,,,,,,,,,AOC
