Type :,Summary :,Updated By :,Updated On :,Document :,Committee Chairperson/Co-ordinator Name :,Committee Chairperson/Co-ordinator Type :,Committee Members :,Updated By :.1,Updated on :,Document :.1,S.No,Bid Number,Bidder Name,Submitted Date,Status,Remarks,Status Updated On,Contract Date :,Contract Value :,Work Completion Period in days :,Updated By :.2,Updated on :.1,AOC document :,AOC Description :,Type :.1,Summary :.1,Updated By :.3,Updated On :.1,Document :.2,BOQ Comparative Chart :,Committee Chairperson/Co-ordinator Name :.1,Committee Chairperson/Co-ordinator Type :.1,Committee Members :.1,Updated By :.4,Updated On :.2,Financial Bid Opening Date:,Document :.3,Organisation Chain :,Tender ID :,Tender Ref No :,Tender Title :,S.No.1,Bid Number.1,Bidder Name.1,Awarded Currency,Awarded Value,Tender Stage,Name,Address,EMD Amount in ₹,EMD Exemption Allowed,EMD Fee Type,EMD Percentage,EMD Payable To,EMD Payable At,Title,Work Description,Pre Qualification Details,Independent External Monitor/Remarks,Tender Value in ₹,Product Category,Sub category,Contract Type,Bid Validity(Days),Period Of Work(Days),Location,Pincode,Pre Bid Meeting Place,Pre Bid Meeting Address,Pre Bid Meeting Date,Bid Opening Place,Should Allow NDA Tender,Allow Preferential Bidder,Publish Date,Bid Opening Date,Document Download / Sale Start Date,Document Download / Sale End Date,Clarification Start Date,Clarification End Date,Bid Submission Start Date,Bid Submission End Date,Financial Bid Opening Date,Cover No,Cover,Document Type,Description,Organisation Chain,Tender Reference Number,Tender ID,Withdrawal Allowed,Tender Type,Form of contract,Tender Category,No. of Covers,General Technical Evaluation Allowed,ItemWise Technical Evaluation Allowed,Payment Mode,Is Multi Currency Allowed For BOQ,Is Multi Currency Allowed For Fee,Allow Two Stage Bidding,S.No,Instrument Type,Tender Fee in ₹,Fee Payable To,Fee Payable At,Tender Fee Exemption Allowed,Tender Stage
Technical,BOS,Gopesh Behl,22-Dec-2020 04:36 PM,technical_63521.pdf,EE,Internal,AO AE,Rajesh Thakur,06-May-2021 12:37 PM,finsummary_63521.pdf (294.95 KB),1.0,191422.0,Joginder Singh Thakur,11-Dec-2020 04:13 PM,Rejected-Finance,The rates are on higher side hence rejected,06-May-2021 12:37 PM,06-May-2021,"INR 1,978,738.7",90.0,Rajesh Thakur,06-May-2021 12:39 PM,2020_MC_42854_7.pdf (622.00 KB),AOC,Finance,BOS,Rajesh Thakur,06-May-2021 12:01 PM,finance_63521.pdf,BOQ Comparative Chart,EE,Internal,AO AE,Gopesh Behl,23-Dec-2020 12:36 PM,23-Dec-2020 01:00 PM,techsummary_63521.pdf (1875.70 KB),Municipal Corporation Shimla,2020_MC_42854_7,3159Dated24112020,Restoration of rain damages (SH Channelization of nallah from Barad House to Nalagarh road) in ward No 7,1.0,191414.0,MANMOHAN SHARMA,INR,"1,967,678",AOC,Executive Engineer RB MC Shimla,Executive Engineer RB MC Shimla,"27,000",No,fixed,,Executive Engineer RB MC Shimla,Shimla,Restoration of rain damages (SH Channelization of nallah from Barad House to Nalagarh road) in ward No 7,Restoration of rain damages (SH Channelization of nallah from Barad House to Nalagarh road) in ward No 7,Please refer Tender Documents ,NA ,,Civil Works,NA ,Tender,120.0,120.0,Shimla,171001.0,NA ,NA ,NA ,MC Shimla,No ,No,01-Dec-2020 06:00 PM,14-Dec-2020 11:00 AM,01-Dec-2020 06:00 PM,14-Dec-2020 10:30 AM,NA ,NA ,01-Dec-2020 06:00 PM,14-Dec-2020 10:30 AM,23-Dec-2020 01:00 PM,1.0,Fee/PreQual/Technical,.pdf,Cost of form in shape of DD as per E procurement notice,Municipal Corporation Shimla,3159Dated24112020,2020_MC_42854_7,Yes,Open Tender,Item Rate,Works,2.0,No,No,Offline,No,No,No,1.0,DD - Demand Draft,500.0,Executive Engineer RB MC Shimla,Shimla,No,AOC
,,,,,,,,,,,2.0,191414.0,MANMOHAN SHARMA,11-Dec-2020 03:14 PM,Accepted-AOC,Accepted due to lowest rates,06-May-2021 12:39 PM,,,,,,,,,,,,,,,,,,,,,,,,,,,,,,AOC,,,,,,,,,,,,,,,,,,,,,,,,,,,,,,,,,,,,,,.pdf,Earnest money in shape of FDR and exemption shall not be allowed,,,,,,,,,,,,,,,2.0,FDR - Fixed Deposit,,,,,AOC
,,,,,,,,,,,3.0,191416.0,VIJAY KUMAR SHARMA,11-Dec-2020 03:32 PM,Rejected-Finance,The rates are on higher side hence rejected,06-May-2021 12:37 PM,,,,,,,,,,,,,,,,,,,,,,,,,,,,,,AOC,,,,,,,,,,,,,,,,,,,,,,,,,,,,,,,,,,,,,,.pdf,Certificate of registration with HPPWD in appropriate class and latest renewal thereof,,,,,,,,,,,,,,,,,,,,,AOC
,,,,,,,,,,,,,,,,,,,,,,,,,,,,,,,,,,,,,,,,,,,,,,,AOC,,,,,,,,,,,,,,,,,,,,,,,,,,,,,,,,,,,,,,.pdf,Income Tax GST and EPF registration PAN Permanent Account No and GST No,,,,,,,,,,,,,,,,,,,,,AOC
,,,,,,,,,,,,,,,,,,,,,,,,,,,,,,,,,,,,,,,,,,,,,,,AOC,,,,,,,,,,,,,,,,,,,,,,,,,,,,,,,,,,,,,,.pdf,Scanned copy of tender documents i.e. Tender Notice and Form MW-7 duly signed should be uploaded,,,,,,,,,,,,,,,,,,,,,AOC
,,,,,,,,,,,,,,,,,,,,,,,,,,,,,,,,,,,,,,,,,,,,,,,AOC,,,,,,,,,,,,,,,,,,,,,,,,,,,,,,,,,,,,2.0,Finance,.xls,Schedule of Quantity (BOQ),,,,,,,,,,,,,,,,,,,,,AOC
