Title,Work Description,Pre Qualification Details,Independent External Monitor/Remarks,Tender Value in ₹,Product Category,Sub category,Contract Type,Bid Validity(Days),Period Of Work(Days),Location,Pincode,Pre Bid Meeting Place,Pre Bid Meeting Address,Pre Bid Meeting Date,Bid Opening Place,Should Allow NDA Tender,Allow Preferential Bidder,S.No,Bank Name,Name,Address,EMD Amount in ₹,EMD Exemption Allowed,EMD Fee Type,EMD Percentage,EMD Payable To,EMD Payable At,Organisation Chain,Tender Reference Number,Tender ID,Withdrawal Allowed,Tender Type,Form of contract,Tender Category,No. of Covers,General Technical Evaluation Allowed,ItemWise Technical Evaluation Allowed,Payment Mode,Is Multi Currency Allowed For BOQ,Is Multi Currency Allowed For Fee,Allow Two Stage Bidding,Tender Fee in ₹,Fee Payable To,Fee Payable At,Tender Fee Exemption Allowed,Cover No,Cover,Document Type,Description,Publish Date,Bid Opening Date,Document Download / Sale Start Date,Document Download / Sale End Date,Clarification Start Date,Clarification End Date,Bid Submission Start Date,Bid Submission End Date,Financial Bid Opening Date,Tender Stage,Committee Chairperson/Co-ordinator Name :,Committee Chairperson/Co-ordinator Type :,Committee Members :,Updated By :,Updated on :,Document :,Organisation Chain :,Tender ID :,Tender Ref No :,Tender Title :,S.No,Bid Number,Bidder Name,Awarded Currency,Awarded Value,Type :,Summary :,Updated By :.1,Updated On :,Document :.1,Type :.1,Summary :.1,Updated By :.2,Updated On :.1,Document :.2,BOQ Comparative Chart :,Contract Date :,Contract Value :,Work Completion Period in days :,Updated By :.3,Updated on :.1,AOC document :,AOC Description :,S.No.1,Bid Number.1,Bidder Name.1,Submitted Date,Status,Remarks,Status Updated On,Committee Chairperson/Co-ordinator Name :.1,Committee Chairperson/Co-ordinator Type :.1,Committee Members :.1,Updated By :.4,Updated On :.2,Financial Bid Opening Date:,Document :.3,Tender Stage
of Providing WSS in GP Ghiri and Bhalana Tehsil Sundernagar Distt Mandi HP,SH C O Nallah intake Chamber Phase I II RCC sedimentation tank 30000 ltrs cap at Lower Mohaun RCC filter bed 75 sqmm 37.50 sqm each two units at Lower Mohaun RCC main storage tank 90000 litrs at Taru RCC main storage tan 35000 ltrs cap at Kushla RC,Please refer Tender documents. ,NA ,"41,60,588",Civil Works - Water Works,NA ,Tender,120.0,90.0,Sundernagar,175018.0,NA ,NA ,NA ,Sundernagar,No ,No,1.0,ICICI BANK,EE JS Division Sundernagar,EE JS Division Sundernagar,"70,000",Yes,fixed,,Nil,Nil,"HP Irrigation and Public Health||S Nagar Circle,Irrigation and Public Health,HP||S.nagar,Irrigation and Public Health,HP",EE IPH SNR ES Tender/2021-66295-6345 dt. 4.08.2021,2021_HPIPH_50817_1,Yes,Open Tender,Item Rate,Works,2.0,No,No,Online,No,No,No,800.0,Nil,Nil,No,1.0,Fee/PreQual/Technical,.pdf,Scan copy proof of Cost of Tender form as per NIT,04-Aug-2021 05:00 PM,11-Aug-2021 11:30 AM,04-Aug-2021 05:00 PM,10-Aug-2021 05:00 PM,NA ,NA ,04-Aug-2021 05:00 PM,10-Aug-2021 05:00 PM,02-Sep-2021 01:05 PM,AOC,Er. Upender Vaidya,Internal,Er. Satya Sharma EE (D) Er. Anil Verma EE SNR Er. Vinay Kumar AE (D) Sh Mahender Kumar CHD Sh. Dharmender Kumar Supdt (W),Anil Verma,29-Dec-2021 05:03 PM,finsummary_75999.pdf (1186.06 KB),"HP Irrigation and Public Health||S Nagar Circle,Irrigation and Public Health,HP||S.nagar,Irrigation and Public Health,HP",2021_HPIPH_50817_1,EE IPH SNR ES Tender/2021-66295-6345 dt. 4.08.2021,of Providing WSS in GP Ghiri and Bhalana Tehsil Sundernagar Distt Mandi HP,1.0,227837.0,DEVENDER KUMAR,INR,"4,202,824",Technical,Three No. bidders found eligible as per NIT requirement.,Anil Verma,02-Sep-2021 12:50 PM,technical_75999.pdf,Finance,Three BOQ and BOQ comparative Chart has been successfully generated and downloaded,Anil Verma,02-Sep-2021 01:28 PM,finance_75999.pdf,BOQ Comparative Chart,29-Dec-2021,"INR 4,160,588",90.0,Anil Verma,29-Dec-2021 05:05 PM,AwardGhiri.pdf (2010.00 KB),Work awarded to lowest bidder,1.0,227837.0,DEVENDER KUMAR,06-Aug-2021 01:01 PM,Accepted-AOC,Lowest bidder,29-Dec-2021 05:05 PM,"Er. Upender Vaidya, SE SNR",Internal,"Er. Satya Sharma EE (D), Er. Anil Verma, EE SNR, Er. Vinay Kumar, AE (D), Sh. Dharmender Kumar Supdt. (W), Sh. Mahender Sharma, CHD",Anil Verma,02-Sep-2021 01:01 PM,02-Sep-2021 01:05 PM,techsummary_75999.pdf (320.54 KB),AOC
,,,,,,,,,,,,,,,,,,2.0,ICICI NEFT/RTGS,,,,,,,,,,,,,,,,,,,,,,,,,,,,,.pdf,Scan copy proof of EMD as per NIT,,,,,,,,,,AOC,,,,,,,,,,,,,,,,,,,,,,,,,,,,,,,,,,2.0,227747.0,Karam Singh,06-Aug-2021 03:05 PM,Rejected-Finance,Other than lowest,29-Dec-2021 05:03 PM,,,,,,,,AOC
,,,,,,,,,,,,,,,,,,,,,,,,,,,,,,,,,,,,,,,,,,,,,,,,.pdf,Scan copy of contractor registration as per NIT,,,,,,,,,,AOC,,,,,,,,,,,,,,,,,,,,,,,,,,,,,,,,,,3.0,228026.0,kesar singh contractor,10-Aug-2021 02:16 PM,Rejected-Finance,Other than lowest,29-Dec-2021 05:03 PM,,,,,,,,AOC
,,,,,,,,,,,,,,,,,,,,,,,,,,,,,,,,,,,,,,,,,,,,,,,,.pdf,Scan copy of PAN and GST Registration as per NIT,,,,,,,,,,AOC,,,,,,,,,,,,,,,,,,,,,,,,,,,,,,,,,,,,,,,,,,,,,,,,AOC
,,,,,,,,,,,,,,,,,,,,,,,,,,,,,,,,,,,,,,,,,,,,,,,,.pdf,Scan copy of undertaking as per NIT,,,,,,,,,,AOC,,,,,,,,,,,,,,,,,,,,,,,,,,,,,,,,,,,,,,,,,,,,,,,,AOC
,,,,,,,,,,,,,,,,,,,,,,,,,,,,,,,,,,,,,,,,,,,,,,,,.pdf,Scan copy of authorization certificate of DSC as per NIT,,,,,,,,,,AOC,,,,,,,,,,,,,,,,,,,,,,,,,,,,,,,,,,,,,,,,,,,,,,,,AOC
,,,,,,,,,,,,,,,,,,,,,,,,,,,,,,,,,,,,,,,,,,,,,,2.0,Finance,.xls,BOQ,,,,,,,,,,AOC,,,,,,,,,,,,,,,,,,,,,,,,,,,,,,,,,,,,,,,,,,,,,,,,AOC
