Organisation Chain,Tender Reference Number,Tender ID,Withdrawal Allowed,Tender Type,Form of contract,Tender Category,No. of Covers,General Technical Evaluation Allowed,ItemWise Technical Evaluation Allowed,Payment Mode,Is Multi Currency Allowed For BOQ,Is Multi Currency Allowed For Fee,Allow Two Stage Bidding,Cover No,Cover,Document Type,Description,Publish Date,Bid Opening Date,Document Download / Sale Start Date,Document Download / Sale End Date,Clarification Start Date,Clarification End Date,Bid Submission Start Date,Bid Submission End Date,Financial Bid Opening Date,EMD Amount in ₹,EMD Exemption Allowed,EMD Fee Type,EMD Percentage,EMD Payable To,EMD Payable At,S.No,Bank Name,Tender Fee in ₹,Fee Payable To,Fee Payable At,Tender Fee Exemption Allowed,Name,Address,Title,Work Description,Pre Qualification Details,Independent External Monitor/Remarks,Tender Value in ₹,Product Category,Sub category,Contract Type,Bid Validity(Days),Period Of Work(Days),Location,Pincode,Pre Bid Meeting Place,Pre Bid Meeting Address,Pre Bid Meeting Date,Bid Opening Place,Should Allow NDA Tender,Allow Preferential Bidder,Tender Stage
PWD,NIT-SHI-7981-8080 dated 08.10.2025,2025_PWD_118210_6,Yes,Open Tender,Percentage,Works,2.0,No,No,Online,No,No,No,1.0,Fee/PreQual/Technical,.pdf,Scanned copy Tender Fee and Earnest money indicated in schedule F,18-Oct-2025 10:00 AM,25-Oct-2025 09:00 AM,18-Oct-2025 10:00 AM,24-Oct-2025 05:00 PM,,,18-Oct-2025 10:00 AM,24-Oct-2025 05:00 PM,29-Oct-2025 02:35 PM,"12,700",No,fixed,,Nil,Nil,1.0,ICICI BANK,350.0,Nil,Nil,No,Er. Rajneesh Bansal,Executive Engineer Division HP PWD Shillai,Restoration of rain damage on Kiyari Gundah to Dhaidhar Road Km 0/00 to 2/00 (SH. C/o R/wall in PCC 1.4.8 at Km 1/120 to 1/138) Under PDNA,(SH. C/o R/wall in PCC 1.4.8 at Km 1/120 to 1/138) Under PDNA,Refer to Tender Documents,,"6,30,545",Civil Works - Roads,,Tender,75.0,30.0,Shillai,173027.0,,,,Shillai,No,No,AOC
,,,,,,,,,,,,,,,,.pdf,Scanned copy Contractor registrations refer general rule sr. No 23,,,,,,,,,,,,,,,,2.0,ICICI NEFT/RTGS,,,,,,,,,,,,,,,,,,,,,,,,,AOC
,,,,,,,,,,,,,,,,.pdf,"Scanned copy  PAN, GST Registration and latest GSTR or GST clearance certificate General Rules No.21",,,,,,,,,,,,,,,,,,,,,,,,,,,,,,,,,,,,,,,,,,AOC
,,,,,,,,,,,,,,,,.pdf,"List of Machinery, Tool, Plant (Refer Schedule F with reference to Clause 18)",,,,,,,,,,,,,,,,,,,,,,,,,,,,,,,,,,,,,,,,,,AOC
,,,,,,,,,,,,,,,,.pdf,Scanned copy of Employees Provident Fund Number Refer to General Rule No. 25A,,,,,,,,,,,,,,,,,,,,,,,,,,,,,,,,,,,,,,,,,,AOC
,,,,,,,,,,,,,,,,.pdf,Scanned copy From No. 8 duly signed general Rule Sr. No 26.7,,,,,,,,,,,,,,,,,,,,,,,,,,,,,,,,,,,,,,,,,,AOC
,,,,,,,,,,,,,,,,.pdf,Scanned copy undertaking regarding uploaded documents are true and correct.,,,,,,,,,,,,,,,,,,,,,,,,,,,,,,,,,,,,,,,,,,AOC
,,,,,,,,,,,,,,,,.pdf,Contractor must have Paver finisher and Vibratory roller of requisite Capacity for Job No.1 and 2.,,,,,,,,,,,,,,,,,,,,,,,,,,,,,,,,,,,,,,,,,,AOC
,,,,,,,,,,,,,,2.0,Finance,.xls,BOQ,,,,,,,,,,,,,,,,,,,,,,,,,,,,,,,,,,,,,,,,,,AOC
