Organisation Chain,Tender Reference Number,Tender ID,Withdrawal Allowed,Tender Type,Form of contract,Tender Category,No. of Covers,General Technical Evaluation Allowed,ItemWise Technical Evaluation Allowed,Payment Mode,Is Multi Currency Allowed For BOQ,Is Multi Currency Allowed For Fee,Allow Two Stage Bidding,Cover No,Cover,Document Type,Description,Publish Date,Bid Opening Date,Document Download / Sale Start Date,Document Download / Sale End Date,Clarification Start Date,Clarification End Date,Bid Submission Start Date,Bid Submission End Date,Financial Bid Opening Date,EMD Amount in ₹,EMD Exemption Allowed,EMD Fee Type,EMD Percentage,EMD Payable To,EMD Payable At,S.No,Bank Name,Tender Fee in ₹,Fee Payable To,Fee Payable At,Tender Fee Exemption Allowed,Name,Address,Title,Work Description,Pre Qualification Details,Independent External Monitor/Remarks,Tender Value in ₹,Product Category,Sub category,Contract Type,Bid Validity(Days),Period Of Work(Days),Location,Pincode,Pre Bid Meeting Place,Pre Bid Meeting Address,Pre Bid Meeting Date,Bid Opening Place,Should Allow NDA Tender,Allow Preferential Bidder,Tender Stage
PWD,7857-7956 dated 04.11.2025,2025_PWD_119871_3,Yes,Open Tender,Percentage,Works,2.0,No,No,Online,No,No,No,1.0,Fee/PreQual/Technical,.pdf,Documentary evidence.UTR for EMD and Cost of Tender Form,06-Nov-2025 06:00 PM,13-Nov-2025 11:00 AM,06-Nov-2025 06:00 PM,12-Nov-2025 10:30 AM,,,06-Nov-2025 06:00 PM,12-Nov-2025 10:30 AM,15-Nov-2025 04:40 PM,"25,900",No,fixed,,Nil,Nil,1.0,ICICI BANK,500.0,Nil,Nil,No,R.R damages on link road Karchham to Sapni Km 0.00,R.R damages on link road Karchham to Sapni Km 0.00 to 8.300. SH- C.O Random rubble masonry R.Wall at RD 7.635 to 7.680,R.R damages on link road Karchham to Sapni Km 0.00 to 8.300. SH- C.O Random rubble masonry R.Wall at RD 7.635 to 7.680,R.R damages on link road Karchham to Sapni Km 0.00 to 8.300. SH- C.O Random rubble masonry R.Wall at RD 7.635 to 7.680,Please refer Tender documents.,,"12,90,892",Civil Works - Others,,Tender,75.0,90.0,Karchham,172115.0,,,,EE Krachham Division HPPWD Bhabanagar,No,No,AOC
,,,,,,,,,,,,,,,,.pdf,"Contractors Registration, GST, EPF and PAN",,,,,,,,,,,,,,,,2.0,ICICI NEFT/RTGS,,,,,,,,,,,,,,,,,,,,,,,,,AOC
,,,,,,,,,,,,,,,,.pdf,List of Machinery Tool Plant,,,,,,,,,,,,,,,,,,,,,,,,,,,,,,,,,,,,,,,,,,AOC
,,,,,,,,,,,,,,,,.pdf,An affidavit that the information furnished with the bid document is correct in all respects,,,,,,,,,,,,,,,,,,,,,,,,,,,,,,,,,,,,,,,,,,AOC
,,,,,,,,,,,,,,,,.pdf,All technical documents as per SBD,,,,,,,,,,,,,,,,,,,,,,,,,,,,,,,,,,,,,,,,,,AOC
,,,,,,,,,,,,,,,,.pdf,Certification that the site of work has been seen before submission of tender,,,,,,,,,,,,,,,,,,,,,,,,,,,,,,,,,,,,,,,,,,AOC
,,,,,,,,,,,,,,,,.pdf,Other documents,,,,,,,,,,,,,,,,,,,,,,,,,,,,,,,,,,,,,,,,,,AOC
,,,,,,,,,,,,,,2.0,Finance,.xls,Price bid,,,,,,,,,,,,,,,,,,,,,,,,,,,,,,,,,,,,,,,,,,AOC
