S.No,Instrument Type,Publish Date,Bid Opening Date,Document Download / Sale Start Date,Document Download / Sale End Date,Clarification Start Date,Clarification End Date,Bid Submission Start Date,Bid Submission End Date,Financial Bid Opening Date,Name,Address,Organisation Chain,Tender Reference Number,Tender ID,Withdrawal Allowed,Tender Type,Form of contract,Tender Category,No. of Covers,General Technical Evaluation Allowed,ItemWise Technical Evaluation Allowed,Payment Mode,Is Multi Currency Allowed For BOQ,Is Multi Currency Allowed For Fee,Allow Two Stage Bidding,Cover No,Cover,Document Type,Description,EMD Amount in ₹,EMD Exemption Allowed,EMD Fee Type,EMD Percentage,EMD Payable To,EMD Payable At,Title,Work Description,Pre Qualification Details,Independent External Monitor/Remarks,Tender Value in ₹,Product Category,Sub category,Contract Type,Bid Validity(Days),Period Of Work(Days),Location,Pincode,Pre Bid Meeting Place,Pre Bid Meeting Address,Pre Bid Meeting Date,Bid Opening Place,Should Allow NDA Tender,Allow Preferential Bidder,Tender Fee in ₹,Fee Payable To,Fee Payable At,Tender Fee Exemption Allowed,S.No.1,Category,Sub Category,Sub Category Description,Format/File,Tender Stage,S.No,Bid Number,Bidder Name,Awarded Currency,Awarded Value,Type :,Summary :,Updated By :,Updated On :,Document :,BOQ Comparative Chart :,S.No.1,Bid Number.1,Bidder Name.1,Submitted Date,Status,Remarks,Status Updated On,Type :.1,Summary :.1,Updated By :.1,Updated On :.1,Document :.1,Organisation Chain :,Tender ID :,Tender Ref No :,Tender Title :,Committee Chairperson/Co-ordinator Name :,Committee Chairperson/Co-ordinator Type :,Committee Members :,Updated By :.2,Updated On :.2,Financial Bid Opening Date:,Document :.2,Committee Chairperson/Co-ordinator Name :.1,Committee Chairperson/Co-ordinator Type :.1,Committee Members :.1,Updated By :.3,Updated on :,Document :.3,Contract Date :,Contract Value :,Work Completion Period in days :,Updated By :.4,Updated on :.1,AOC document :,AOC Description :,Tender Stage
1.0,DD - Demand Draft,11-Oct-2022 01:00 PM,17-Oct-2022 11:00 AM,11-Oct-2022 01:00 PM,17-Oct-2022 10:30 AM,NA ,NA ,11-Oct-2022 01:00 PM,17-Oct-2022 10:30 AM,07-Jan-2023 03:00 PM,Executive Engineer Banjar Division HPPWD Banjar,Near HPPWD Rest House Banjar,PWD,No.PW/Banjar-13277-326 Dt.07.10.2022,2022_PWD_66333_1,Yes,Open Tender,Item Rate,Works,2.0,No,No,Offline,No,No,No,1.0,Fee/PreQual/Technical,.pdf,Scanned copy of Registration/ Enlistment with HPPWD,"87,100",No,fixed,,EE Banjar,Banjar,Restoration of rain damages on Hurla Tharas Sachani road kilometre 0-0 to 10-0,"Construction of Retaining wall in various reches at RD 9-400 to 9-460, 9-565 to 9-580, 9-752 to 9-770, 9-210 to 9-235, 9-475 to 9-500 and 9-695 to 9-785",Please refer Tender documents. ,NA ,"43,53,315",Civil Works - Roads,NA ,Tender,75.0,60.0,Tharas,175125.0,NA ,NA ,NA ,Banjar,No ,No,"2,000",EE Banjar,Banjar,No,1.0,Certificate Details ,Affidavit regarding correctness of bid ,Required in tender document in bidder file 1 ,,AOC,1.0,308532.0,Ashapuri Infracon Private Limited,INR,"4,524,710",Finance,As per financial bid opening summary attached,Chaman Singh,07-Jan-2023 04:19 PM,finance_99769.pdf,BOQ Comparative Chart,1.0,308532.0,Ashapuri Infracon Private Limited,14-Oct-2022 04:02 PM,Accepted-AOC,Accepted,24-Feb-2023 02:52 PM,Technical,As per technical opening attached,Chaman Singh,07-Jan-2023 02:17 PM,technical_99769.pdf,PWD,2022_PWD_66333_1,No.PW/Banjar-13277-326 Dt.07.10.2022,Restoration of rain damages on Hurla Tharas Sachani road kilometre 0-0 to 10-0,Er. Chaman Singh Thakur Executive Engineer,Internal,"Sh. Navneet Kumar Supdt. Gr.II, Shri Hira Singh Draughtsman, Divisional Accounts Officer, Banjar Division HPPWD., Banjar",Chaman Singh,07-Jan-2023 02:25 PM,07-Jan-2023 03:00 PM,techsummary_99769.pdf (3489.81 KB),Er. Chaman Singh Thakur Executive Engineer,Internal,"Sh. Navneet Kumar Supdt. Gr.II, Shri Hira Singh Draughtsman, Divisional Accounts Officer Banjar Division HPPWD., Banjar",Chaman Singh,24-Feb-2023 02:28 PM,finsummary_99769.pdf (3184.99 KB),24-Feb-2023,"INR 4,524,710",60.0,Chaman Singh,24-Feb-2023 02:50 PM,Award66333.pdf (6734.00 KB),As per work award attached,AOC
2.0,FDR - Fixed Deposit,,,,,,,,,,,,,,,,,,,,,,,,,,,,.pdf,Scanned copy of proof of Registration under Employees Provident Fund,,,,,,,,,,,,,,,,,,,,,,,,,,,,,,,,,,AOC,,,,,,,,,,,,2.0,308557.0,Narender singh pal,14-Oct-2022 05:13 PM,Rejected-AOC,Rejected,24-Feb-2023 02:52 PM,,,,,,,,,,,,,,,,,,,,,,,,,,,,,,AOC
,,,,,,,,,,,,,,,,,,,,,,,,,,,,,.pdf,Scanned copy of PAN GST Income tax clearance certificate,,,,,,,,,,,,,,,,,,,,,,,,,,,,,,,,,,AOC,,,,,,,,,,,,,,,,,,,,,,,,,,,,,,,,,,,,,,,,,,,,,,,,AOC
,,,,,,,,,,,,,,,,,,,,,,,,,,,,,.pdf,"Scanned copy of Earnest money and cost of Form pledged in the name of EE HPPWD., Divn. Banjar",,,,,,,,,,,,,,,,,,,,,,,,,,,,,,,,,,AOC,,,,,,,,,,,,,,,,,,,,,,,,,,,,,,,,,,,,,,,,,,,,,,,,AOC
,,,,,,,,,,,,,,,,,,,,,,,,,,,,,.pdf,Scanned copy of Work Done Certificate of similar nature of work,,,,,,,,,,,,,,,,,,,,,,,,,,,,,,,,,,AOC,,,,,,,,,,,,,,,,,,,,,,,,,,,,,,,,,,,,,,,,,,,,,,,,AOC
,,,,,,,,,,,,,,,,,,,,,,,,,,,,,.pdf,"Scanned copy of Mach.Detail i.e. Hydraulic Excavator, Front End Loader, Water Tanker, Tipper etc.",,,,,,,,,,,,,,,,,,,,,,,,,,,,,,,,,,AOC,,,,,,,,,,,,,,,,,,,,,,,,,,,,,,,,,,,,,,,,,,,,,,,,AOC
,,,,,,,,,,,,,,,,,,,,,,,,,,,,,.pdf,Form 7 and 8 duly signed,,,,,,,,,,,,,,,,,,,,,,,,,,,,,,,,,,AOC,,,,,,,,,,,,,,,,,,,,,,,,,,,,,,,,,,,,,,,,,,,,,,,,AOC
,,,,,,,,,,,,,,,,,,,,,,,,,,,2.0,Finance,.xls,B O Q,,,,,,,,,,,,,,,,,,,,,,,,,,,,,,,,,,AOC,,,,,,,,,,,,,,,,,,,,,,,,,,,,,,,,,,,,,,,,,,,,,,,,AOC
