Cover No,Cover,Document Type,Description,EMD Amount in ₹,EMD Exemption Allowed,EMD Fee Type,EMD Percentage,EMD Payable To,EMD Payable At,Tender Fee in ₹,Fee Payable To,Fee Payable At,Tender Fee Exemption Allowed,Publish Date,Bid Opening Date,Document Download / Sale Start Date,Document Download / Sale End Date,Clarification Start Date,Clarification End Date,Bid Submission Start Date,Bid Submission End Date,Financial Bid Opening Date,Name,Address,Title,Work Description,Pre Qualification Details,Independent External Monitor/Remarks,Tender Value in ₹,Product Category,Sub category,Contract Type,Bid Validity(Days),Period Of Work(Days),Location,Pincode,Pre Bid Meeting Place,Pre Bid Meeting Address,Pre Bid Meeting Date,Bid Opening Place,Should Allow NDA Tender,Allow Preferential Bidder,Organisation Chain,Tender Reference Number,Tender ID,Withdrawal Allowed,Tender Type,Form of contract,Tender Category,No. of Covers,General Technical Evaluation Allowed,ItemWise Technical Evaluation Allowed,Payment Mode,Is Multi Currency Allowed For BOQ,Is Multi Currency Allowed For Fee,Allow Two Stage Bidding,S.No,Bank Name,S.No.1,Corrigendum Title,Corrigendum Type,View,Tender Stage,S.No,Bid Number,Bidder Name,Submitted Date,Status,Remarks,Status Updated On,Type :,Summary :,Updated By :,Updated On :,Document :,Organisation Chain :,Tender ID :,Tender Ref No :,Tender Title :,Tender Stage
1.0,Fee/PreQual/Technical,.pdf,Cost of tender form through online,"27,400",No,fixed,,Nil,Nil,500.0,Nil,Nil,No,05-Aug-2021 10:00 AM,13-Aug-2021 11:30 AM,05-Aug-2021 10:00 AM,12-Aug-2021 05:00 PM,NA ,NA ,05-Aug-2021 10:00 AM,12-Aug-2021 05:00 PM,18-Aug-2021 10:30 AM,Executive Engineer Electrical HPPWD Division Una,Executive Engineer Electrical HPPWD Division Una,Providing 100 KVA DG set in Civil Hospital at Sujanpur Distt Hamirpur H.P.,Providing 100 KVA DG set in Civil Hospital at Sujanpur Distt Hamirpur H.P.,Please refer Tender documents. ,NA ,"13,68,690",Electrical Works,NA ,Tender,120.0,60.0,Una,174303.0,NA ,NA ,NA ,Una,No ,No,PWD,Pro.100KVA DG set in Civil Hospital at Sujanpur,2021_PWD_50738_1,Yes,Open Tender,Item Rate,Works,2.0,No,No,Online,No,No,No,1.0,ICICI BANK,1.0,Regarding submission of original documents and Location of Tender ID No. 2021_PWD_50706_1,Other,,AOC,1,228859,ARUN KUMAR SHARMA,12-Aug-2021 03:41 PM,Rejected-Finance,L 2,18-Aug-2021 11:53 AM,Technical,tech bid opening summary,Karam Chand,13-Aug-2021 01:29 PM,technical_75875.pdf,PWD,2021_PWD_50738_1,Pro.100KVA DG set in Civil Hospital at Sujanpur,Providing 100 KVA DG set in Civil Hospital at Sujanpur Distt Hamirpur H.P.,AOC
,,.pdf,EMD through Online,,,,,,,,,,,,,,,,,,,,,,,,,,,,,,,,,,,,,,,,,,,,,,,,,,,,,,2.0,ICICI NEFT/RTGS,,,,,AOC,2,228736,GOLD CUBE AUTOMATIONS AND ENERGY,11-Aug-2021 06:20 PM,Rejected-Technical,Non Responsive,16-Aug-2021 09:12 PM,,,,,,,,,,AOC
,,.pdf,"GST,Pan Card ,Income tex, EPF Registration number , certificate of undertaking",,,,,,,,,,,,,,,,,,,,,,,,,,,,,,,,,,,,,,,,,,,,,,,,,,,,,,,,,,,,AOC,3,228644,Haminder Pal,10-Aug-2021 11:57 AM,Rejected-Technical,Non Responsive,16-Aug-2021 09:12 PM,,,,,,,,,,AOC
,,.pdf,Registration as Contractor In Electrical HPPWD wing,,,,,,,,,,,,,,,,,,,,,,,,,,,,,,,,,,,,,,,,,,,,,,,,,,,,,,,,,,,,AOC,4,229293,Kalra Hardware and Electric Store,12-Aug-2021 12:30 PM,Rejected-Finance,L 3,18-Aug-2021 11:53 AM,,,,,,,,,,AOC
,,.pdf,Technical Qualification (TQC) as per SGCC page 147,,,,,,,,,,,,,,,,,,,,,,,,,,,,,,,,,,,,,,,,,,,,,,,,,,,,,,,,,,,,AOC,5,228959,PRAGATI ELECTRICAL AND ELECTRONIC CO,11-Aug-2021 07:44 PM,Accepted-AOC,AOC Done,03-Feb-2023 02:33 PM,,,,,,,,,,AOC
,,.pdf,Form 7 and 8 duly signed by the contractor,,,,,,,,,,,,,,,,,,,,,,,,,,,,,,,,,,,,,,,,,,,,,,,,,,,,,,,,,,,,AOC,6,229393,SHARMA ELECTRICAL CO.,11-Aug-2021 09:25 PM,Rejected-Technical,Non Responsive,16-Aug-2021 09:12 PM,,,,,,,,,,AOC
2.0,Finance,.xls,BOQ,,,,,,,,,,,,,,,,,,,,,,,,,,,,,,,,,,,,,,,,,,,,,,,,,,,,,,,,,,,,AOC,7,228678,SUKH DEV SONI CONT,12-Aug-2021 04:51 PM,Rejected-Technical,Non Responsive,16-Aug-2021 09:12 PM,,,,,,,,,,AOC
