S.No,Bid Number,Bidder Name,Awarded Currency,Awarded Value,Type :,Summary :,Updated By :,Updated On :,Document :,BOQ Comparative Chart :,Type :.1,Summary :.1,Updated By :.1,Updated On :.1,Document :.1,S.No.1,Bid Number.1,Bidder Name.1,Submitted Date,Status,Remarks,Status Updated On,Committee Chairperson/Co-ordinator Name :,Committee Chairperson/Co-ordinator Type :,Committee Members :,Updated By :.2,Updated on :,Document :.2,Contract Date :,Contract Value :,Work Completion Period in days :,Updated By :.3,Updated on :.1,AOC document :,AOC Description :,Organisation Chain :,Tender ID :,Tender Ref No :,Tender Title :,Committee Chairperson/Co-ordinator Name :.1,Committee Chairperson/Co-ordinator Type :.1,Committee Members :.1,Updated By :.4,Updated On :.2,Financial Bid Opening Date:,Document :.3,Tender Stage,Tender Fee in ₹,Fee Payable To,Fee Payable At,Tender Fee Exemption Allowed,Title,Work Description,Pre Qualification Details,Independent External Monitor/Remarks,Tender Value in ₹,Product Category,Sub category,Contract Type,Bid Validity(Days),Period Of Work(Days),Location,Pincode,Pre Bid Meeting Place,Pre Bid Meeting Address,Pre Bid Meeting Date,Bid Opening Place,Should Allow NDA Tender,Allow Preferential Bidder,EMD Amount in ₹,EMD Exemption Allowed,EMD Fee Type,EMD Percentage,EMD Payable To,EMD Payable At,Cover No,Cover,Document Type,Description,Organisation Chain,Tender Reference Number,Tender ID,Withdrawal Allowed,Tender Type,Form of contract,Tender Category,No. of Covers,General Technical Evaluation Allowed,ItemWise Technical Evaluation Allowed,Payment Mode,Is Multi Currency Allowed For BOQ,Is Multi Currency Allowed For Fee,Allow Two Stage Bidding,S.No,Bank Name,Name,Address,Publish Date,Bid Opening Date,Document Download / Sale Start Date,Document Download / Sale End Date,Clarification Start Date,Clarification End Date,Bid Submission Start Date,Bid Submission End Date,Financial Bid Opening Date,Tender Stage
1.0,233864.0,Vowels Technology and Services,INR,"1,360,790",Finance,Four number bids were qualified in TQC accordingly opened for financial part today on dated 29.09.2021 in which Ms Vowels Technology and Services have been found the L-1,S. R Tomer,29-Sep-2021 04:30 PM,finance_77193.pdf,BOQ Comparative Chart,Technical,Four number bids were found uploaded on e-procurement all firms made their physical submission accordingly opened for technical today part on 06.09.2021,Ravi Singh Rana,06-Sep-2021 03:56 PM,technical_77193.pdf,1.0,234064.0,Excel Marketing Corporation,04-Sep-2021 03:03 PM,Rejected-AOC,L3,25-Feb-2023 08:57 PM,XEN ELECTRICAL,Internal,DAO SUPDT HDM,Ravi Singh Rana,25-Feb-2023 08:55 PM,finsummary_77193.pdf (1615.99 KB),25-Feb-2023,"INR 1,360,790",365.0,Ravi Singh Rana,25-Feb-2023 08:56 PM,2021_51639.pdf (1616.00 KB),AWARDED TO L1,PWD,2021_PWD_51639_1,PWED-AB-Tender-2021-22-3174-78 dt 25-08-2021,CO Indoor Auditorium Building at Nahan Distt Sirmour SH SITC of CCTV surveillance System therein,XEN Electrical,Internal,SUPDT HDM DAO,Ravi Singh Rana,29-Sep-2021 04:14 PM,29-Sep-2021 04:15 PM,techsummary_77193.pdf (352.04 KB),AOC,500.0,E.E.Electrical Division No-I Shimla-9,Shimla-9.,No,CO Indoor Auditorium Building at Nahan Distt Sirmour SH SITC of CCTV surveillance System therein,CO Indoor Auditorium Building at Nahan Distt Sirmour SH SITC of CCTV surveillance System therein,Please refer Tender documents. ,NA ,"17,07,790",Electrical Works,NA ,Tender,90.0,365.0,SHIMLA KASUMPTI -9,171009.0,NA ,NA ,NA ,SHIMLA KASUMPTI -9,No ,No,"33,200",No,fixed,,E.E.Electrical Division No-I Shimla-9,Shimla-9.,1.0,Fee/PreQual/Technical,.pdf,Cost of Tender in shape of DD,PWD,PWED-AB-Tender-2021-22-3174-78 dt 25-08-2021,2021_PWD_51639_1,Yes,Open Tender,Item Rate,Works,2.0,No,No,Both(Online/Offline),No,No,No,1.0,ICICI BANK,XEN Electrical division No. 1 Shimla-9,The Executive Engineer Electrical Division No-1 HPPWD Shimla-9,25-Aug-2021 05:00 PM,06-Sep-2021 11:30 AM,25-Aug-2021 05:30 PM,04-Sep-2021 05:00 PM,NA ,NA ,25-Aug-2021 05:30 PM,04-Sep-2021 05:00 PM,29-Sep-2021 04:15 PM,AOC
,,,,,,,,,,,,,,,,2.0,233824.0,Insat Techno Services,03-Sep-2021 05:40 PM,Rejected-AOC,L2,25-Feb-2023 08:57 PM,,,,,,,,,,,,,,,,,,,,,,,,,AOC,,,,,,,,,,,,,,,,,,,,,,,,,,,,,,,.pdf,EMD in shape of FDR,,,,,,,,,,,,,,,2.0,ICICI NEFT/RTGS,,,,,,,,,,,,AOC
,,,,,,,,,,,,,,,,3.0,234070.0,Shanti Infotech,04-Sep-2021 12:52 PM,Rejected-AOC,L4,25-Feb-2023 08:57 PM,,,,,,,,,,,,,,,,,,,,,,,,,AOC,,,,,,,,,,,,,,,,,,,,,,,,,,,,,,,.pdf,GST/PAN Registration,,,,,,,,,,,,,,,,,,,,,,,,,,,,AOC
,,,,,,,,,,,,,,,,4.0,233864.0,Vowels Technology and Services,04-Sep-2021 02:35 PM,Accepted-AOC,L1,25-Feb-2023 08:57 PM,,,,,,,,,,,,,,,,,,,,,,,,,AOC,,,,,,,,,,,,,,,,,,,,,,,,,,,,,,,.pdf,TQC Technical Qualification Criteria as per tender document declaration by contractors,,,,,,,,,,,,,,,,,,,,,,,,,,,,AOC
,,,,,,,,,,,,,,,,,,,,,,,,,,,,,,,,,,,,,,,,,,,,,,,AOC,,,,,,,,,,,,,,,,,,,,,,,,,,,,,,,.pdf,Certificate of undertaking/ DECLARATION BY THE CONTRACTOR,,,,,,,,,,,,,,,,,,,,,,,,,,,,AOC
,,,,,,,,,,,,,,,,,,,,,,,,,,,,,,,,,,,,,,,,,,,,,,,AOC,,,,,,,,,,,,,,,,,,,,,,,,,,,,,2.0,Finance,.xls,SCHEDULE OF QUANTITY BOQ,,,,,,,,,,,,,,,,,,,,,,,,,,,,AOC
,,,,,,,,,,,,,,,,,,,,,,,,,,,,,,,,,,,,,,,,,,,,,,,AOC,,,,,,,,,,,,,,,,,,,,,,,,,,,,,,,.pdf,STANDARD BIDDING DOCUMENT SBD Form-8,,,,,,,,,,,,,,,,,,,,,,,,,,,,AOC
