Committee Chairperson/Co-ordinator Name :,Committee Chairperson/Co-ordinator Type :,Committee Members :,Updated By :,Updated on :,Document :,Contract Date :,Contract Value :,Work Completion Period in days :,Updated By :.1,Updated on :.1,AOC document :,AOC Description :,Type :,Summary :,Updated By :.2,Updated On :,Document :.1,BOQ Comparative Chart :,Organisation Chain :,Tender ID :,Tender Ref No :,Tender Title :,Committee Chairperson/Co-ordinator Name :.1,Committee Chairperson/Co-ordinator Type :.1,Committee Members :.1,Updated By :.3,Updated On :.1,Document :.2,S.No,Bid Number,Bidder Name,Submitted Date,Status,Remarks,Status Updated On,S.No.1,Bid Number.1,Bidder Name.1,Awarded Currency,Awarded Value,Tender Stage,Title,Work Description,Pre Qualification Details,Independent External Monitor/Remarks,Tender Value in ₹,Product Category,Sub category,Contract Type,Bid Validity(Days),Period Of Work(Days),Location,Pincode,Pre Bid Meeting Place,Pre Bid Meeting Address,Pre Bid Meeting Date,Bid Opening Place,Should Allow NDA Tender,Allow Preferential Bidder,Organisation Chain,Tender Reference Number,Tender ID,Withdrawal Allowed,Tender Type,Form of contract,Tender Category,No. of Covers,General Technical Evaluation Allowed,ItemWise Technical Evaluation Allowed,Payment Mode,Is Multi Currency Allowed For BOQ,Is Multi Currency Allowed For Fee,Allow Two Stage Bidding,Cover No,Cover,Document Type,Description,S.No,Instrument Type,EMD Amount in ₹,EMD Exemption Allowed,EMD Fee Type,EMD Percentage,EMD Payable To,EMD Payable At,Tender Fee in ₹,Fee Payable To,Fee Payable At,Tender Fee Exemption Allowed,Name,Address,Publish Date,Bid Opening Date,Document Download / Sale Start Date,Document Download / Sale End Date,Clarification Start Date,Clarification End Date,Bid Submission Start Date,Bid Submission End Date,Tender Stage
XEN,Internal,DAO SUPDT HDM,Ravi Singh Rana,26-Feb-2023 02:38 PM,finsummary_99674.pdf (54.12 KB),26-Feb-2023,"INR 823,165",180.0,Ravi Singh Rana,26-Feb-2023 02:39 PM,2022_66258.pdf (1885.00 KB),AWARDED TO L1,Finance,Three number bids were found uploaded on e-procurement site all made physical submission accordingly opened for financial part today on dated 19.10.2022 in which Ateesh Sharma Electrical contractor was found L-1,Ravi Singh Rana,19-Oct-2022 12:08 PM,finance_99674.pdf,BOQ Comparative Chart,PWD,2022_PWD_66258_1,Electrical Div.No.I PWD Shimla 5529-35 dt.01.10.20,Rewiring at Govt. CHC Building Rajpur Tehsil Poanta Sahib Distt.Sirmour H.P.,XEN,Internal,DAO SUPDT HDM,Ravi Singh Rana,26-Feb-2023 02:37 PM,techsummary_99674.pdf (54.12 KB),1.0,308944.0,Ateesh Sharma,17-Oct-2022 07:47 PM,Accepted-AOC,L1,26-Feb-2023 02:40 PM,1.0,308944.0,Ateesh Sharma,INR,"823,165",AOC,Rewiring at Govt. CHC Building Rajpur Tehsil Poanta Sahib Distt.Sirmour H.P.,Rewiring at Govt. CHC Building Rajpur Tehsil Poanta Sahib Distt.Sirmour H.P.,Please refer Tender documents. ,NA ,"9,96,257",Electrical Works,NA ,Tender,90.0,180.0,SHIMLA,171009.0,NA ,NA ,NA ,SHIMLA KASUMPTI -9,No ,No,PWD,Electrical Div.No.I PWD Shimla 5529-35 dt.01.10.20,2022_PWD_66258_1,Yes,Open Tender,Item Rate,Works,1.0,No,No,Offline,No,No,No,1.0,Fee/PreQual/Technical/Finance,.pdf,Cost of Tender in shape of DD,1.0,DD - Demand Draft,"20,000",No,fixed,,E.E.Electrical Division No-I Shimla-9,Shimla-9,350.0,E.E.Electrical Division No-I Shimla-9,Shimla-9,No,XEN Electrical Division No. 1 Shimla,The Executive Engineer Electrical Division No-1 HPPWD Shimla-9,10-Oct-2022 05:30 PM,19-Oct-2022 11:30 AM,10-Oct-2022 05:30 PM,18-Oct-2022 05:00 PM,NA ,NA ,10-Oct-2022 05:30 PM,18-Oct-2022 05:00 PM,AOC
,,,,,,,,,,,,,,,,,,,,,,,,,,,,,2.0,309109.0,Kuldeep Singh,18-Oct-2022 04:43 PM,Rejected-AOC,L2,26-Feb-2023 02:40 PM,,,,,,AOC,,,,,,,,,,,,,,,,,,,,,,,,,,,,,,,,,,,.pdf,EMD in shape of FDR,2.0,FDR - Fixed Deposit,,,,,,,,,,,,,,,,,,,,,AOC
,,,,,,,,,,,,,,,,,,,,,,,,,,,,,3.0,309113.0,Taran Enterprises,18-Oct-2022 04:38 PM,Rejected-AOC,L3,26-Feb-2023 02:40 PM,,,,,,AOC,,,,,,,,,,,,,,,,,,,,,,,,,,,,,,,,,,,.pdf,GST/PAN Registration,,,,,,,,,,,,,,,,,,,,,,,AOC
,,,,,,,,,,,,,,,,,,,,,,,,,,,,,,,,,,,,,,,,,AOC,,,,,,,,,,,,,,,,,,,,,,,,,,,,,,,,,,,.pdf,Valid electrical enlistment issued From competent authority,,,,,,,,,,,,,,,,,,,,,,,AOC
,,,,,,,,,,,,,,,,,,,,,,,,,,,,,,,,,,,,,,,,,AOC,,,,,,,,,,,,,,,,,,,,,,,,,,,,,,,,,,,.pdf,Certificate of undertaking/ Declaration by the Contractor,,,,,,,,,,,,,,,,,,,,,,,AOC
,,,,,,,,,,,,,,,,,,,,,,,,,,,,,,,,,,,,,,,,,AOC,,,,,,,,,,,,,,,,,,,,,,,,,,,,,,,,,,,.xls,SCHEDULE OF QUANTITY BOQ,,,,,,,,,,,,,,,,,,,,,,,AOC
,,,,,,,,,,,,,,,,,,,,,,,,,,,,,,,,,,,,,,,,,AOC,,,,,,,,,,,,,,,,,,,,,,,,,,,,,,,,,,,.pdf,STANDARD BIDDING DOCUMENT SBD Form-8,,,,,,,,,,,,,,,,,,,,,,,AOC
