Cover No,Cover,Document Type,Description,S.No,Bank Name,Publish Date,Bid Opening Date,Document Download / Sale Start Date,Document Download / Sale End Date,Clarification Start Date,Clarification End Date,Bid Submission Start Date,Bid Submission End Date,Financial Bid Opening Date,EMD Amount in ₹,EMD Exemption Allowed,EMD Fee Type,EMD Percentage,EMD Payable To,EMD Payable At,Organisation Chain,Tender Reference Number,Tender ID,Withdrawal Allowed,Tender Type,Form of contract,Tender Category,No. of Covers,General Technical Evaluation Allowed,ItemWise Technical Evaluation Allowed,Payment Mode,Is Multi Currency Allowed For BOQ,Is Multi Currency Allowed For Fee,Allow Two Stage Bidding,Name,Address,Title,Work Description,Pre Qualification Details,Independent External Monitor/Remarks,Tender Value in ₹,Product Category,Sub category,Contract Type,Bid Validity(Days),Period Of Work(Days),Location,Pincode,Pre Bid Meeting Place,Pre Bid Meeting Address,Pre Bid Meeting Date,Bid Opening Place,Should Allow NDA Tender,Allow Preferential Bidder,Tender Fee in ₹,Fee Payable To,Fee Payable At,Tender Fee Exemption Allowed,S.No.1,Corrigendum Title,Corrigendum Type,View,Tender Stage,Type :,Summary :,Updated By :,Updated On :,Document :,Type :.1,Summary :.1,Updated By :.1,Updated On :.1,Document :.1,BOQ Comparative Chart :,Contract Date :,Contract Value :,Work Completion Period in days :,Updated By :.2,Updated on :,AOC document :,AOC Description :,S.No,Bid Number,Bidder Name,Submitted Date,Status,Remarks,Status Updated On,Committee Chairperson/Co-ordinator Name :,Committee Chairperson/Co-ordinator Type :,Committee Members :,Updated By :.3,Updated On :.2,Financial Bid Opening Date:,Document :.2,Committee Chairperson/Co-ordinator Name :.1,Committee Chairperson/Co-ordinator Type :.1,Committee Members :.1,Updated By :.4,Updated on :.1,Document :.3,Organisation Chain :,Tender ID :,Tender Ref No :,Tender Title :,S.No.1,Bid Number.1,Bidder Name.1,Awarded Currency,Awarded Value,Tender Stage
1.0,Fee/PreQual/Technical,.pdf,Bidder license of A Class contractor from competent Authority,1.0,ICICI BANK,19-Sep-2022 05:30 PM,13-Oct-2022 03:20 PM,20-Sep-2022 01:15 PM,13-Oct-2022 11:05 AM,NA ,NA ,20-Sep-2022 01:15 PM,13-Oct-2022 11:05 AM,14-Oct-2022 01:30 PM,"6,654",No,fixed,,Nil,Nil,HPSEBL||CE(OP) CZ Mandi||SE(OP) Kullu||Sr. Xen (E) Kullu,HPSEBL/KED/NIT-02/2022-23,2022_HPSEB_65197_1,Yes,Open Tender,Turn-key,Works,2.0,No,No,Online,No,No,No,Sr Executive Engineer ED HPSEBL Kullu,Sr Executive Engineer ED HPSEBL Kullu,Supply of Power to APMC Sub Market Yard Shat by providing 100KVA 11/0.4KV DTR at Shat in E section Shat under ESD HPSEBL Bhuntar,Supply of Power to APMC Sub Market Yard Shat by providing 100KVA 11/0.4KV DTR at Shat in E section Shat under ESD HPSEBL Bhuntar,Please refer Tender documents. ,NA ,"6,65,411",Electrical Works,NA ,Tender,180.0,90.0,Shat Kullu,175105.0,NA ,NA ,NA ,Sr Executive Engineer ED HPSEBL Kullu,No ,No,590.0,Nil,Nil,No,1.0,change of date,Date,,AOC,Technical,All the bidders fulfill all terms and conditions Hence eligible,Aayush Minhas,14-Oct-2022 01:09 PM,technical_98144.pdf,Finance,Sh. Dile Ram has been found L1 bidder except all above bidders,Aayush Minhas,07-Feb-2023 04:53 PM,finance_98144.pdf,BOQ Comparative Chart,08-Feb-2023,"INR 665,411",90.0,Aayush Minhas,08-Feb-2023 11:38 AM,Award.pdf (2768.00 KB),Sh Sonu Kumar has been found lowest bidder from all the other bidders,1.0,307470.0,Abha Electricals,10-Oct-2022 02:55 PM,Rejected-Finance,L3 Bidder,08-Feb-2023 11:35 AM,Sr Xen,Internal,AE Works Divisional Accountant,Aayush Minhas,14-Oct-2022 01:11 PM,14-Oct-2022 01:30 PM,techsummary_98144.pdf (1365.89 KB),Sr. Xen ED HPSEBL Kullu,Internal,Divisional Accountant and Assistant Engineer Works and Commercial of this office,Aayush Minhas,08-Feb-2023 11:35 AM,finsummary_98144.pdf (368.70 KB),HPSEBL||CE(OP) CZ Mandi||SE(OP) Kullu||Sr. Xen (E) Kullu,2022_HPSEB_65197_1,HPSEBL/KED/NIT-02/2022-23,Supply of Power to APMC Sub Market Yard Shat by providing 100KVA 11/0.4KV DTR at Shat in E section Shat under ESD HPSEBL Bhuntar,1.0,307925.0,MS Sonu Kumar A Class Govt Cont,INR,"608,851",AOC
,,.pdf,Certificate of performance/experience for similar nature of work as per BID,2.0,ICICI NEFT/RTGS,,,,,,,,,,,,,,,,,,,,,,,,,,,,,,,,,,,,,,,,,,,,,,,,,,,,,,,,,,AOC,,,,,,,,,,,,,,,,,,,2.0,304312.0,GS ELECTRICALS,27-Sep-2022 05:11 PM,Rejected-Finance,L2 Bidder,08-Feb-2023 11:35 AM,,,,,,,,,,,,,,,,,,,,,,,AOC
,,.pdf,Average annual turn over duly attested from CA,,,,,,,,,,,,,,,,,,,,,,,,,,,,,,,,,,,,,,,,,,,,,,,,,,,,,,,,,,,,AOC,,,,,,,,,,,,,,,,,,,3.0,307925.0,MS Sonu Kumar A Class Govt Cont,12-Oct-2022 07:07 PM,Accepted-AOC,L1 Bidder,08-Feb-2023 11:39 AM,,,,,,,,,,,,,,,,,,,,,,,AOC
,,.pdf,Declaration regarding non blacklisted in non judicial stamp paper with notary attested as per bid,,,,,,,,,,,,,,,,,,,,,,,,,,,,,,,,,,,,,,,,,,,,,,,,,,,,,,,,,,,,AOC,,,,,,,,,,,,,,,,,,,,,,,,,,,,,,,,,,,,,,,,,,,,,,,,AOC
,,.pdf,"Certificate of GSTIN, PAN, AADHAR, ITR",,,,,,,,,,,,,,,,,,,,,,,,,,,,,,,,,,,,,,,,,,,,,,,,,,,,,,,,,,,,AOC,,,,,,,,,,,,,,,,,,,,,,,,,,,,,,,,,,,,,,,,,,,,,,,,AOC
,,.pdf,Self undertaking regarding completion of work within scheduled time as per Bid,,,,,,,,,,,,,,,,,,,,,,,,,,,,,,,,,,,,,,,,,,,,,,,,,,,,,,,,,,,,AOC,,,,,,,,,,,,,,,,,,,,,,,,,,,,,,,,,,,,,,,,,,,,,,,,AOC
,,.pdf,Self undertaking regarding that studied all terms and conditions in the BID,,,,,,,,,,,,,,,,,,,,,,,,,,,,,,,,,,,,,,,,,,,,,,,,,,,,,,,,,,,,AOC,,,,,,,,,,,,,,,,,,,,,,,,,,,,,,,,,,,,,,,,,,,,,,,,AOC
2.0,Finance,.xls,BOQ,,,,,,,,,,,,,,,,,,,,,,,,,,,,,,,,,,,,,,,,,,,,,,,,,,,,,,,,,,,,AOC,,,,,,,,,,,,,,,,,,,,,,,,,,,,,,,,,,,,,,,,,,,,,,,,AOC
