Publish Date,Bid Opening Date,Document Download / Sale Start Date,Document Download / Sale End Date,Clarification Start Date,Clarification End Date,Bid Submission Start Date,Bid Submission End Date,Financial Bid Opening Date,Title,Work Description,Pre Qualification Details,Independent External Monitor/Remarks,Tender Value in ₹,Product Category,Sub category,Contract Type,Bid Validity(Days),Period Of Work(Days),Location,Pincode,Pre Bid Meeting Place,Pre Bid Meeting Address,Pre Bid Meeting Date,Bid Opening Place,Should Allow NDA Tender,Allow Preferential Bidder,Name,Address,Cover No,Cover,Document Type,Description,EMD Amount in ₹,EMD through BG/ST or EMD Exemption Allowed,EMD Fee Type,EMD Percentage,EMD Payable To,EMD Payable At,Tender Fee in ₹,Fee Payable To,Fee Payable At,Tender Fee Exemption Allowed,Organisation Chain,Tender Reference Number,Tender ID,Withdrawal Allowed,Tender Type,Form of contract,Tender Category,No. of Covers,General Technical Evaluation Allowed,ItemWise Technical Evaluation Allowed,Payment Mode,Is Multi Currency Allowed For BOQ,Is Multi Currency Allowed For Fee,Allow Two Stage Bidding,S.No,Bank Name,Tender Stage,Committee Chairperson/Co-ordinator Name :,Committee Chairperson/Co-ordinator Type :,Committee Members :,Updated By :,Updated On :,Financial Bid Opening Date:,Document :,Organisation Chain :,Tender ID :,Tender Ref No :,Tender Title :,Type :,Summary :,Updated By :.1,Updated On :.1,Document :.1,BOQ Comparative Chart :,S.No,Bid Number,Bidder Name,Submitted Date,Status,Remarks,Status Updated On,Type :.1,Summary :.1,Updated By :.2,Updated On :.2,Document :.2,Tender Stage
23-Dec-2022 10:00 AM,12-Jan-2023 03:00 PM,23-Dec-2022 10:00 AM,12-Jan-2023 02:00 PM,NA ,NA ,23-Dec-2022 10:00 AM,12-Jan-2023 02:00 PM,28-Jan-2023 11:00 AM,Installation of Hybrid Irrigation Scheme under 36 Dudhnoi (ST ) LAC under SOPD-G for the year 2022-23_7 Nos of Points,Boring_Installation of Solar Panel_LT Electrical work etc,Please refer Tender documents. ,NA ,"54,10,856",Civil Works,NA ,Tender,180.0,45.0,Within 36 Dudhnoi ST LAC,783124.0,NA ,NA ,NA ,Office of the EE_Dudhnoi_Goalpara_East_Div_Irriga,No ,No,EE_Dudhnoi_Goalpara_East_Div_Irriga,Office of the EE_Dudhnoi_Goalpara_East_Div_Irriga,1.0,Fee/PreQual/Technical,.pdf,Bid_Documents,"1,08,217",Yes,percentage,2.0%,Nil,Nil,"1,000",Nil,Nil,No,Irrigation Department||Chief Engineer(Major)-Irrigation Dept||Goalpara Circle||Dudhnoi Goalpara East Division,SID-13032_779_2022_15,2022_ID_28393_1,Yes,Open Tender,Item Rate,Works,2.0,No,No,Online,No,No,No,1.0,SBI Bank,AOC,Nishi Kanta Nath,Internal,Golam_Maidul_Islam_Choudhury Deva_Prasad_Saikia Nava_Kr._Mahanta Shyam_Sundar_Pathak Isfakul_Warish,Shyam Sundar Pathak,28-Jan-2023 12:19 AM,28-Jan-2023 11:00 AM,techsummary_45252.pdf (713.42 KB),Irrigation Department||Chief Engineer(Major)-Irrigation Dept||Goalpara Circle||Dudhnoi Goalpara East Division,2022_ID_28393_1,SID-13032_779_2022_15,Installation of Hybrid Irrigation Scheme under 36 Dudhnoi (ST ) LAC under SOPD-G for the year 2022-23_7 Nos of Points,Finance,Financial BID has been opened,Shobhangkar Das,28-Jan-2023 11:17 AM,,BOQ Comparative Chart,1,172976,ABDUL SAMAD CHOUDHURY,11-Jan-2023 09:27 PM,Rejected-AOC,Previous perfomance under this Divsion is not satisffactory,04-Feb-2023 02:58 PM,Technical,Technical Bid has been opened,Golam Moidul Islam Choudhury,12-Jan-2023 03:45 PM,technical_45252.pdf,AOC
,,,,,,,,,,,,,,,,,,,,,,,,,,,,,,,.pdf,Tech_Qualification,,,,,,,,,,,,,,,,,,,,,,,,,,,AOC,,,,,,,,,,,,,,,,,,2,172339,FREE POWER TECHNOLOGY PRIVATE LIMITED,09-Jan-2023 05:03 PM,Accepted-AOC,Stood as L1,04-Feb-2023 02:58 PM,,,,,,AOC
,,,,,,,,,,,,,,,,,,,,,,,,,,,,,2.0,Finance,.xls,BOQ,,,,,,,,,,,,,,,,,,,,,,,,,,,AOC,,,,,,,,,,,,,,,,,,3,171773,M/S Aarab India Associates,10-Jan-2023 12:19 PM,Accepted-AOC,Owner of tools and plants including boring rig,04-Feb-2023 02:58 PM,,,,,,AOC
,,,,,,,,,,,,,,,,,,,,,,,,,,,,,,,,,,,,,,,,,,,,,,,,,,,,,,,,,,,AOC,,,,,,,,,,,,,,,,,,4,172268,M/S J M ASSOCIATION,09-Jan-2023 12:54 PM,Rejected-AOC,Stood as L2,04-Feb-2023 02:58 PM,,,,,,AOC
,,,,,,,,,,,,,,,,,,,,,,,,,,,,,,,,,,,,,,,,,,,,,,,,,,,,,,,,,,,AOC,,,,,,,,,,,,,,,,,,5,172576,M/S Kusumbar Construction,12-Jan-2023 01:11 PM,Accepted-AOC,Stood as L1,04-Feb-2023 02:58 PM,,,,,,AOC
