S.No,Bid Number,Bidder Name,Submitted Date,Status,Remarks,Status Updated On,S.No.1,Bid Number.1,Bidder Name.1,Awarded Currency,Awarded Value,Contract Date :,Contract Value :,Work Completion Period in days :,Updated By :,Updated on :,AOC document :,AOC Description :,Committee Chairperson/Co-ordinator Name :,Committee Chairperson/Co-ordinator Type :,Committee Members :,Updated By :.1,Updated on :.1,Document :,Committee Chairperson/Co-ordinator Name :.1,Committee Chairperson/Co-ordinator Type :.1,Committee Members :.1,Updated By :.2,Updated On :,Document :.1,Organisation Chain :,Tender ID :,Tender Ref No :,Tender Title :,Type :,Summary :,Updated By :.3,Updated On :.1,Document :.2,BOQ Comparative Chart :,Tender Stage,Organisation Chain,Tender Reference Number,Tender ID,Withdrawal Allowed,Tender Type,Form of contract,Tender Category,No. of Covers,General Technical Evaluation Allowed,ItemWise Technical Evaluation Allowed,Payment Mode,Is Multi Currency Allowed For BOQ,Is Multi Currency Allowed For Fee,Allow Two Stage Bidding,Name,Address,Tender Fee in ₹,Fee Payable To,Fee Payable At,Tender Fee Exemption Allowed,Cover No,Cover,Document Type,Description,Publish Date,Bid Opening Date,Document Download / Sale Start Date,Document Download / Sale End Date,Clarification Start Date,Clarification End Date,Bid Submission Start Date,Bid Submission End Date,S.No,Instrument Type,Title,Work Description,Pre Qualification Details,Independent External Monitor/Remarks,Tender Value in ₹,Product Category,Sub category,Contract Type,Bid Validity(Days),Period Of Work(Days),Location,Pincode,Pre Bid Meeting Place,Pre Bid Meeting Address,Pre Bid Meeting Date,Bid Opening Place,Should Allow NDA Tender,Allow Preferential Bidder,EMD Amount in ₹,EMD Exemption Allowed,EMD Fee Type,EMD Percentage,EMD Payable To,EMD Payable At,Tender Stage
1.0,318040.0,Devi Ram,30-Jan-2023 05:35 PM,Accepted-AOC,L1,26-Feb-2023 03:38 PM,1.0,318040.0,Devi Ram,INR,"300,000",26-Feb-2023,"INR 300,000",365.0,Ravi Singh Rana,26-Feb-2023 03:38 PM,2023_67501.pdf (1809.00 KB),AWARDED TO L1,XEN,Internal,DAO SUPDT HDM,Ravi Singh Rana,26-Feb-2023 03:37 PM,finsummary_101694.pdf (55.41 KB),XEN,Internal,DAO SUPDT HDM,Ravi Singh Rana,26-Feb-2023 03:36 PM,techsummary_101694.pdf (55.41 KB),PWD,2023_PWD_67501_1,Electrical Div.No.I PWD Shimla 8461-66 dt.17.01.20,Providing Staff for running of electrical enquiry in Residential Non Residential Buildings at Nabha Estate Shimla-4 for the year 2023-24 w.e.f 01-03-2023 to 28-02-2024,Finance,Two number bids were found uploaded on e-procurement both were found in order accordingly opened for financial part today on dated 01.02.2023 in which Sh. Devi Ram contractor was found L-1,Ravi Singh Rana,03-Feb-2023 12:36 PM,finance_101694.pdf,BOQ Comparative Chart,AOC,PWD,Electrical Div.No.I PWD Shimla 8461-66 dt.17.01.20,2023_PWD_67501_1,Yes,Open Tender,Item Rate,Works,1.0,No,No,Offline,No,No,No,XEN Electrical Division No. 1 Shimla,The Executive Engineer Electrical Division No-1 HPPWD Shimla-9,350.0,E.E.Electrical Division No-I Shimla-9,Shimla-9,No,1.0,Fee/PreQual/Technical/Finance,.pdf,Cost of Tender in shape of DD,27-Jan-2023 10:00 AM,03-Feb-2023 11:30 AM,27-Jan-2023 10:30 AM,02-Feb-2023 05:00 PM,NA ,NA ,27-Jan-2023 10:30 AM,02-Feb-2023 05:00 PM,1.0,DD - Demand Draft,Providing Staff for running of electrical enquiry in Residential Non Residential Buildings at Nabha Estate Shimla-4 for the year 2023-24 w.e.f 01-03-2023 to 28-02-2024,Providing Staff for running of electrical enquiry in Residential Non Residential Buildings at Nabha Estate Shimla-4 for the year 2023-24 w.e.f 01-03-2023 to 28-02-2024,Please refer Tender documents. ,NA ,"2,98,176",Electrical Works,NA ,Tender,90.0,365.0,SHIMLA,171009.0,NA ,NA ,NA ,SHIMLA KASUMPTI -9,No ,No,"6,000",No,fixed,,E.E.Electrical Division No-I Shimla-9,Shimla-9,AOC
2.0,318413.0,Yog Raj,31-Jan-2023 02:44 PM,Rejected-AOC,L2,26-Feb-2023 03:38 PM,,,,,,,,,,,,,,,,,,,,,,,,,,,,,,,,,,,AOC,,,,,,,,,,,,,,,,,,,,,,,.pdf,EMD in shape of FDR,,,,,,,,,2.0,FDR - Fixed Deposit,,,,,,,,,,,,,,,,,,,,,,,,,AOC
,,,,,,,,,,,,,,,,,,,,,,,,,,,,,,,,,,,,,,,,,AOC,,,,,,,,,,,,,,,,,,,,,,,.pdf,GST/PAN Registration,,,,,,,,,,,,,,,,,,,,,,,,,,,,,,,,,,,AOC
,,,,,,,,,,,,,,,,,,,,,,,,,,,,,,,,,,,,,,,,,AOC,,,,,,,,,,,,,,,,,,,,,,,.pdf,Valid electrical enlistment issued from competent authority,,,,,,,,,,,,,,,,,,,,,,,,,,,,,,,,,,,AOC
,,,,,,,,,,,,,,,,,,,,,,,,,,,,,,,,,,,,,,,,,AOC,,,,,,,,,,,,,,,,,,,,,,,.pdf,Certificate of undertaking /Declaration by the Contractor,,,,,,,,,,,,,,,,,,,,,,,,,,,,,,,,,,,AOC
,,,,,,,,,,,,,,,,,,,,,,,,,,,,,,,,,,,,,,,,,AOC,,,,,,,,,,,,,,,,,,,,,,,.xls,SCHEDULE of QUANTITY BOQ,,,,,,,,,,,,,,,,,,,,,,,,,,,,,,,,,,,AOC
,,,,,,,,,,,,,,,,,,,,,,,,,,,,,,,,,,,,,,,,,AOC,,,,,,,,,,,,,,,,,,,,,,,.pdf,STANDARD BIDDING DOCUMENT Form-8,,,,,,,,,,,,,,,,,,,,,,,,,,,,,,,,,,,AOC
