Organisation Chain,Tender Reference Number,Tender ID,Withdrawal Allowed,Tender Type,Form of contract,Tender Category,No. of Covers,General Technical Evaluation Allowed,ItemWise Technical Evaluation Allowed,Payment Mode,Is Multi Currency Allowed For BOQ,Is Multi Currency Allowed For Fee,Allow Two Stage Bidding,Cover No,Cover,Document Type,Description,Publish Date,Bid Opening Date,Document Download / Sale Start Date,Document Download / Sale End Date,Clarification Start Date,Clarification End Date,Bid Submission Start Date,Bid Submission End Date,Financial Bid Opening Date,EMD Amount in ₹,EMD Exemption Allowed,EMD Fee Type,EMD Percentage,EMD Payable To,EMD Payable At,S.No,Bank Name,Tender Fee in ₹,Fee Payable To,Fee Payable At,Tender Fee Exemption Allowed,Name,Address,Title,Work Description,Pre Qualification Details,Independent External Monitor/Remarks,Tender Value in ₹,Product Category,Sub category,Contract Type,Bid Validity(Days),Period Of Work(Days),Location,Pincode,Pre Bid Meeting Place,Pre Bid Meeting Address,Pre Bid Meeting Date,Bid Opening Place,Should Allow NDA Tender,Allow Preferential Bidder,Tender Stage
PWD,EE Salooni letter No. 11538-87 dated 19.03.2025,2025_PWD_102771_4,Yes,Open Tender,Percentage,Works,2.0,No,No,Online,No,No,No,1.0,Fee/PreQual/Technical,.pdf,Cost of tender from only online mode through E-payment,22-Mar-2025 04:05 PM,29-Mar-2025 11:30 AM,22-Mar-2025 04:05 PM,29-Mar-2025 11:00 AM,,,22-Mar-2025 04:05 PM,29-Mar-2025 11:00 AM,04-Apr-2025 11:30 AM,"20,900",No,fixed,,Nil,Nil,1.0,ICICI BANK,500.0,Nil,Nil,No,Executive Engineer,Executive Engineer Salooni Division HPPWD Salooni,Retrofitting of Block-A of GSSS Telka (Salwan),"Provision of retrofitting and wire mesh in lintel and sill belts in horizontal and vertical jambs at corner along with doors and windows, angle iron frame over roof sheets and preparing of floor",Please refer Tender documents.,,"10,42,443",Civil Works,,Tender,75.0,90.0,Salooni,176320.0,,,,Executive Engineer Salooni Division HPPWD Salooni,No,No,AOC
,,,,,,,,,,,,,,,,.pdf,Earnest Money from only online mode through E-payment,,,,,,,,,,,,,,,,2.0,ICICI NEFT/RTGS,,,,,,,,,,,,,,,,,,,,,,,,,AOC
,,,,,,,,,,,,,,,,.pdf,Contractors Registration (Refer General Rule No.24.3 and as per invitation of bid),,,,,,,,,,,,,,,,,,,,,,,,,,,,,,,,,,,,,,,,,,AOC
,,,,,,,,,,,,,,,,.pdf,Copy of G.S.T. Number,,,,,,,,,,,,,,,,,,,,,,,,,,,,,,,,,,,,,,,,,,AOC
,,,,,,,,,,,,,,,,.pdf,Copy of PAN Number,,,,,,,,,,,,,,,,,,,,,,,,,,,,,,,,,,,,,,,,,,AOC
,,,,,,,,,,,,,,,,.pdf,"Form No. 7/8, duly signed by the contractor",,,,,,,,,,,,,,,,,,,,,,,,,,,,,,,,,,,,,,,,,,AOC
,,,,,,,,,,,,,,,,.pdf,An affidavit/undertaking that information furnished with the bid is correct in all respect,,,,,,,,,,,,,,,,,,,,,,,,,,,,,,,,,,,,,,,,,,AOC
,,,,,,,,,,,,,,,,.pdf,Detail of technical Staff and Machinery,,,,,,,,,,,,,,,,,,,,,,,,,,,,,,,,,,,,,,,,,,AOC
,,,,,,,,,,,,,,2.0,Finance,.xls,Bill of Quantity,,,,,,,,,,,,,,,,,,,,,,,,,,,,,,,,,,,,,,,,,,AOC
