Organisation Chain,Tender Reference Number,Tender ID,Withdrawal Allowed,Tender Type,Form of contract,Tender Category,No. of Covers,General Technical Evaluation Allowed,ItemWise Technical Evaluation Allowed,Payment Mode,Is Multi Currency Allowed For BOQ,Is Multi Currency Allowed For Fee,Allow Two Stage Bidding,Cover No,Cover,Document Type,Description,Publish Date,Bid Opening Date,Document Download / Sale Start Date,Document Download / Sale End Date,Clarification Start Date,Clarification End Date,Bid Submission Start Date,Bid Submission End Date,Financial Bid Opening Date,EMD Amount in ₹,EMD Exemption Allowed,EMD Fee Type,EMD Percentage,EMD Payable To,EMD Payable At,S.No,Bank Name,Tender Fee in ₹,Fee Payable To,Fee Payable At,Tender Fee Exemption Allowed,Name,Address,Title,Work Description,Pre Qualification Details,Independent External Monitor/Remarks,Tender Value in ₹,Product Category,Sub category,Contract Type,Bid Validity(Days),Period Of Work(Days),Location,Pincode,Pre Bid Meeting Place,Pre Bid Meeting Address,Pre Bid Meeting Date,Bid Opening Place,Should Allow NDA Tender,Allow Preferential Bidder,Tender Stage
PWD,3075-3124,2025_PWD_113135_1,Yes,Open Tender,Item Rate,Works,2.0,No,No,Online,No,No,No,1.0,Fee/PreQual/Technical,.pdf,UTR No for cost of tender,28-Aug-2025 11:00 AM,04-Sep-2025 11:00 AM,28-Aug-2025 11:00 AM,03-Sep-2025 06:00 PM,,,28-Aug-2025 11:00 AM,03-Sep-2025 06:00 PM,12-Sep-2025 04:30 PM,"13,500",No,fixed,,Nil,Nil,1.0,ICICI BANK,350.0,Nil,Nil,No,EE NH Rampur,EE NH Rampur,Special repair to NH 305 Sainj Luhri Aut road Km 0.00 to 97.00 S.H. Construction of Wire carte Retaining wall at RD 71.714 to 71.730,Special repair to NH 305 Sainj Luhri Aut road Km 0.00 to 97.00 S.H. Construction of Wire carte Retaining wall at RD 71.714 to 71.730,Please refer Tender documents.,,"6,74,791",Civil Works - Highways,,Tender,90.0,,Rampur,172001.0,,,,EE NH Rampur,No,No,AOC
,,,,,,,,,,,,,,,,.pdf,UTR No for earnest money,,,,,,,,,,,,,,,,2.0,ICICI NEFT/RTGS,,,,,,,,,,,,,,,,,,,,,,,,,AOC
,,,,,,,,,,,,,,,,.pdf,"contractor registration, GST, PAN and EPF etc.",,,,,,,,,,,,,,,,,,,,,,,,,,,,,,,,,,,,,,,,,,AOC
,,,,,,,,,,,,,,,,.pdf,list of required machinery,,,,,,,,,,,,,,,,,,,,,,,,,,,,,,,,,,,,,,,,,,AOC
,,,,,,,,,,,,,,,,.pdf,other documents as per SBD,,,,,,,,,,,,,,,,,,,,,,,,,,,,,,,,,,,,,,,,,,AOC
,,,,,,,,,,,,,,2.0,Finance,.xls,Price bid,,,,,,,,,,,,,,,,,,,,,,,,,,,,,,,,,,,,,,,,,,AOC
