Organisation Chain,Tender Reference Number,Tender ID,Withdrawal Allowed,Tender Type,Form of contract,Tender Category,No. of Covers,General Technical Evaluation Allowed,ItemWise Technical Evaluation Allowed,Payment Mode,Is Multi Currency Allowed For BOQ,Is Multi Currency Allowed For Fee,Allow Two Stage Bidding,Cover No,Cover,Document Type,Description,Publish Date,Bid Opening Date,Document Download / Sale Start Date,Document Download / Sale End Date,Clarification Start Date,Clarification End Date,Bid Submission Start Date,Bid Submission End Date,Financial Bid Opening Date,EMD Amount in ₹,EMD Exemption Allowed,EMD Fee Type,EMD Percentage,EMD Payable To,EMD Payable At,S.No,Bank Name,Tender Fee in ₹,Fee Payable To,Fee Payable At,Tender Fee Exemption Allowed,Name,Address,Title,Work Description,Pre Qualification Details,Independent External Monitor/Remarks,Tender Value in ₹,Product Category,Sub category,Contract Type,Bid Validity(Days),Period Of Work(Days),Location,Pincode,Pre Bid Meeting Place,Pre Bid Meeting Address,Pre Bid Meeting Date,Bid Opening Place,Should Allow NDA Tender,Allow Preferential Bidder,Tender Stage
PWD,T/A  No. 8479-8509 dated 23/02/2023,2023_PWD_70070_1,Yes,Open Tender,Percentage,Works,2.0,No,No,Online,No,No,No,1.0,Fee/PreQual/Technical,.pdf,Cost of Form and Earnest money through Online,03-Mar-2023 09:00 AM,13-Mar-2023 11:30 AM,03-Mar-2023 09:30 AM,13-Mar-2023 11:00 AM,,,03-Mar-2023 09:30 AM,13-Mar-2023 11:00 AM,23-Mar-2023 11:00 AM,"51,800",No,fixed,,Nil,Nil,1.0,ICICI BANK,"1,500",Nil,Nil,No,"Executive Engineer, HPPWD. Electrical Division Una","Executive Engineer, HPPWD. Electrical Division Una",Replacement of 01 No. 15 passenger Stretcher Elevator at Civil Hospital building at Una Distt. (HP),.,Please refer Tender documents.,,"29,48,982",Electrical Works,,Tender,75.0,,Una,174303.0,,,,"Executive Engineer, HPPWD. Electrical Division Una",No,No,AOC
,,,,,,,,,,,,,,,,.pdf,"GST, Pan Card, Income tax, EPF Registration number and certificate of undertaking",,,,,,,,,,,,,,,,2.0,ICICI NEFT/RTGS,,,,,,,,,,,,,,,,,,,,,,,,,AOC
,,,,,,,,,,,,,,,,.pdf,Registration a/w Elect. license or Author. be Prin. Manuf. of Lift or the autho. agency/firm as per,,,,,,,,,,,,,,,,,,,,,,,,,,,,,,,,,,,,,,,,,,AOC
,,,,,,,,,,,,,,,,.pdf,Affidavit regarding correctness of bid documents,,,,,,,,,,,,,,,,,,,,,,,,,,,,,,,,,,,,,,,,,,AOC
,,,,,,,,,,,,,,,,.pdf,Affidavit regarding no relative working in the department as per enlistment rule 2021,,,,,,,,,,,,,,,,,,,,,,,,,,,,,,,,,,,,,,,,,,AOC
,,,,,,,,,,,,,,,,.pdf,Technical Qual. (TQC) as per SGCC and Annual turnover during last three years ending 31st March,,,,,,,,,,,,,,,,,,,,,,,,,,,,,,,,,,,,,,,,,,AOC
,,,,,,,,,,,,,,,,.pdf,Form 7 and 8 duly signed by the Contractor/Firm and Work Done Certificates as per TQC,,,,,,,,,,,,,,,,,,,,,,,,,,,,,,,,,,,,,,,,,,AOC
,,,,,,,,,,,,,,2.0,Finance,.xls,BOQ,,,,,,,,,,,,,,,,,,,,,,,,,,,,,,,,,,,,,,,,,,AOC
