Name,Address,Publish Date,Bid Opening Date,Document Download / Sale Start Date,Document Download / Sale End Date,Clarification Start Date,Clarification End Date,Bid Submission Start Date,Bid Submission End Date,Financial Bid Opening Date,Tender Fee in ₹,Fee Payable To,Fee Payable At,Tender Fee Exemption Allowed,Organisation Chain,Tender Reference Number,Tender ID,Withdrawal Allowed,Tender Type,Form of contract,Tender Category,No. of Covers,General Technical Evaluation Allowed,ItemWise Technical Evaluation Allowed,Payment Mode,Is Multi Currency Allowed For BOQ,Is Multi Currency Allowed For Fee,Allow Two Stage Bidding,S.No,Bank Name,Title,Work Description,Pre Qualification Details,Independent External Monitor/Remarks,Tender Value in ₹,Product Category,Sub category,Contract Type,Bid Validity(Days),Period Of Work(Days),Location,Pincode,Pre Bid Meeting Place,Pre Bid Meeting Address,Pre Bid Meeting Date,Bid Opening Place,Should Allow NDA Tender,Allow Preferential Bidder,Cover No,Cover,Document Type,Description,EMD Amount in ₹,EMD Exemption Allowed,EMD Fee Type,EMD Percentage,EMD Payable To,EMD Payable At,Tender Stage,Contract Date :,Contract Value :,Work Completion Period in days :,Updated By :,Updated on :,AOC document :,AOC Description :,Type :,Summary :,Updated By :.1,Updated On :,Document :,Type :.1,Summary :.1,Updated By :.2,Updated On :.1,Document :.1,BOQ Comparative Chart :,S.No,Bid Number,Bidder Name,Submitted Date,Status,Remarks,Status Updated On,Committee Chairperson/Co-ordinator Name :,Committee Chairperson/Co-ordinator Type :,Committee Members :,Updated By :.3,Updated On :.2,Financial Bid Opening Date:,Document :.2,Committee Chairperson/Co-ordinator Name :.1,Committee Chairperson/Co-ordinator Type :.1,Committee Members :.1,Updated By :.4,Updated on :.1,Document :.3,S.No.1,Bid Number.1,Bidder Name.1,Awarded Currency,Awarded Value,Organisation Chain :,Tender ID :,Tender Ref No :,Tender Title :,Tender Stage
Executive Engineer,Jal Shakti Division Bilaspur,22-Jun-2022 05:00 PM,28-Jun-2022 11:30 AM,22-Jun-2022 05:00 PM,28-Jun-2022 11:00 AM,22-Jun-2022 05:00 PM ,27-Jun-2022 05:00 PM ,22-Jun-2022 05:00 PM,28-Jun-2022 11:00 AM,29-Jun-2022 01:00 PM,400.0,EE Jal Shakti Division Bilaspur,Jal Shakti Division Bilaspur,Yes,"HP Irrigation and Public Health||Bilaspur Circle,Irrigation and Public Health,HP||Bilaspur,Irrigation and Public Health,HP",BLP-BLP00-736 NIT No.8809-8908 dt. 21-06-2022,2022_HPIPH_61996_1,Yes,Open Tender,Item Rate,Works,2.0,No,No,Both(Online/Offline),No,No,No,1.0,ICICI BANK,"Improvement of Lift Irrigation Scheme Baggi Phagalwatta in Tehsil Sadar District Bilaspur (SH Construction of head weir, repair of existing sump well / pump house, construction of delivery tank and providing fixing of barbed wire fencing)","Improvement of Lift Irrigation Scheme Baggi Phagalwatta in Tehsil Sadar District Bilaspur (SH Construction of head weir, repair of existing sump well / pump house, construction of delivery tank and providing fixing of barbed wire fencing)",Please refer tender documents ,NA ,,Civil Works,NA ,Tender,120.0,180.0,Under JSV Sub Division Jukhala,174001.0,NA ,NA ,NA ,Jal Shakti Division Bilaspur,No ,No,1.0,Fee/PreQual/Technical,.pdf,Cost of Tender form proof,"22,800",Yes,fixed,,EE Jal Shakti Division Bilaspur,Jal Shakti Division Bilaspur,AOC,21-Jul-2022,"INR 1,022,406",180.0,Rakesh Kumar,17-Nov-2022 03:03 PM,257.pdf (1782.00 KB),The work has been awarded to Sh. Parkash Chand Village Kot PO Dehar Tehsil Sungernagar Distt. Mandi vide this office letter No. 12228-35 Dated 21-07-2022 for Rs. 1022406/- only,Technical,Four bidders have been participated in the e tender process documents of all bidders downloaded successfully.,Rakesh Kumar,29-Jun-2022 12:43 PM,technical_93543.pdf,Finance,BOQ of all bidders downloaded and boq comparative chart generated successfully.,Rakesh Kumar,29-Jun-2022 02:28 PM,finance_93543.pdf,BOQ Comparative Chart,1.0,288817.0,Gopal Mahajan,27-Jun-2022 11:16 PM,Rejected-AOC,0,17-Nov-2022 03:04 PM,Er. Rakesh Kumar Vaidya Executive Engineer,Internal,"Sh Bala Ram Thakur Superintendent Gr-II, ,Sh. Rakesh Kumar DHD , Sh. Yash Pal Senior Assistant Sh Ravinder Kishore Senior Assistant",Rakesh Kumar,29-Jun-2022 12:56 PM,29-Jun-2022 01:00 PM,techsummary_93543.pdf (431.64 KB),Er. Rakesh Kumar Vaidya Executive Engineer,Internal,"Sh Bala Ram Thakur Superintendent Gr-II, ,Sh. Rakesh Kumar DHD ,Sh. Yash Pal Senior Assistant , Sh Ravinder Kishore Senior Assistant",Rakesh Kumar,29-Jun-2022 02:30 PM,finsummary_93543.pdf (89.15 KB),1.0,288662.0,Parkash Chand Sharma,INR,"1,022,406","HP Irrigation and Public Health||Bilaspur Circle,Irrigation and Public Health,HP||Bilaspur,Irrigation and Public Health,HP",2022_HPIPH_61996_1,BLP-BLP00-736 NIT No.8809-8908 dt. 21-06-2022,"Improvement of Lift Irrigation Scheme Baggi Phagalwatta in Tehsil Sadar District Bilaspur (SH Construction of head weir, repair of existing sump well / pump house, construction of delivery tank and providing fixing of barbed wire fencing)",AOC
,,,,,,,,,,,,,,,,,,,,,,,,,,,,,2.0,ICICI NEFT/RTGS,,,,,,,,,,,,,,,,,,,,,.pdf,Earnest money proof scan copy of EMD of Certificate of exemption of earnest money with affidavit,,,,,,,AOC,,,,,,,,,,,,,,,,,,,2.0,288662.0,Parkash Chand Sharma,27-Jun-2022 05:12 PM,Accepted-AOC,Work Awarded,17-Nov-2022 03:04 PM,,,,,,,,,,,,,,,,,,,,,,,AOC
,,,,,,,,,,,,,,,,,,,,,,,,,,,,,,,,,,,,,,,,,,,,,,,,,,,.pdf,Certificate of registration with Jal Shakti Vighag in appropriate class and latest renewal thereof,,,,,,,AOC,,,,,,,,,,,,,,,,,,,3.0,288772.0,Pawan Kumar,27-Jun-2022 05:31 PM,Rejected-AOC,0,17-Nov-2022 03:04 PM,,,,,,,,,,,,,,,,,,,,,,,AOC
,,,,,,,,,,,,,,,,,,,,,,,,,,,,,,,,,,,,,,,,,,,,,,,,,,,.pdf,PAN No. / GST registration.,,,,,,,AOC,,,,,,,,,,,,,,,,,,,4.0,288755.0,Ravinder Singh Patial,27-Jun-2022 05:16 PM,Rejected-AOC,0,17-Nov-2022 03:04 PM,,,,,,,,,,,,,,,,,,,,,,,AOC
,,,,,,,,,,,,,,,,,,,,,,,,,,,,,,,,,,,,,,,,,,,,,,,,,,,.pdf,Scan copy of EPF No.,,,,,,,AOC,,,,,,,,,,,,,,,,,,,,,,,,,,,,,,,,,,,,,,,,,,,,,,,,AOC
,,,,,,,,,,,,,,,,,,,,,,,,,,,,,,,,,,,,,,,,,,,,,,,,,2.0,Finance,.xls,BOQ,,,,,,,AOC,,,,,,,,,,,,,,,,,,,,,,,,,,,,,,,,,,,,,,,,,,,,,,,,AOC
