Organisation Chain,Tender Reference Number,Tender ID,Withdrawal Allowed,Tender Type,Form of contract,Tender Category,No. of Covers,General Technical Evaluation Allowed,ItemWise Technical Evaluation Allowed,Payment Mode,Is Multi Currency Allowed For BOQ,Is Multi Currency Allowed For Fee,Allow Two Stage Bidding,Cover No,Cover,Document Type,Description,Title,Work Description,Pre Qualification Details,Independent External Monitor/Remarks,Tender Value in ₹,Product Category,Sub category,Contract Type,Bid Validity(Days),Period Of Work(Days),Location,Pincode,Pre Bid Meeting Place,Pre Bid Meeting Address,Pre Bid Meeting Date,Bid Opening Place,Should Allow NDA Tender,Allow Preferential Bidder,Tender Fee in ₹,Fee Payable To,Fee Payable At,Tender Fee Exemption Allowed,S.No,Instrument Type,Publish Date,Bid Opening Date,Document Download / Sale Start Date,Document Download / Sale End Date,Clarification Start Date,Clarification End Date,Bid Submission Start Date,Bid Submission End Date,Financial Bid Opening Date,EMD Amount in ₹,EMD Exemption Allowed,EMD Fee Type,EMD Percentage,EMD Payable To,EMD Payable At,Name,Address,Tender Stage,Committee Chairperson/Co-ordinator Name :,Committee Chairperson/Co-ordinator Type :,Committee Members :,Updated By :,Updated on :,Document :,Organisation Chain :,Tender ID :,Tender Ref No :,Tender Title :,S.No,Bid Number,Bidder Name,Awarded Currency,Awarded Value,Contract Date :,Contract Value :,Work Completion Period in days :,Updated By :.1,Updated on :.1,AOC document :,AOC Description :,Type :,Summary :,Updated By :.2,Updated On :,Document :.1,Type :.1,Summary :.1,Updated By :.3,Updated On :.1,Document :.2,BOQ Comparative Chart :,S.No.1,Bid Number.1,Bidder Name.1,Submitted Date,Status,Remarks,Status Updated On,Committee Chairperson/Co-ordinator Name :.1,Committee Chairperson/Co-ordinator Type :.1,Committee Members :.1,Updated By :.4,Updated On :.2,Financial Bid Opening Date:,Document :.3,Tender Stage
"HP Irrigation and Public Health||Bilaspur Circle,Irrigation and Public Health,HP||Bilaspur,Irrigation and Public Health,HP",BLP-BLP-00736 NIT No.14977-15076 Dated 25/08/2022,2022_HPIPH_64114_1,Yes,Open Tender,Item Rate,Works,2.0,No,No,Offline,No,No,No,1.0,Fee/PreQual/Technical,.pdf,Cost of Tender form proof,Construction of CAD works for LIS Niun Pallian under Jal Shakti Division Bilaspur in Tehsil Sadar District Bilaspur (SH Laying jointing and testing in trenches HDPE pipes for distribution system and construction of 12 Nos field outlet assembly and,Construction of CAD works for LIS Niun Pallian under Jal Shakti Division Bilaspur in Tehsil Sadar District Bilaspur (SH Laying jointing and testing in trenches HDPE pipes for distribution system and construction of 12 Nos field outlet assembly and,Please refer Tender documents. ,NA ,,Civil Works,NA ,Tender,120.0,365.0,JSV Sub Division Kuthera,174001.0,NA ,NA ,NA ,EE JSV Division Bilaspur,No ,No,400.0,EE JSV Bilaspur,Bilaspur,Yes,1.0,DD - Demand Draft,26-Aug-2022 05:00 PM,06-Sep-2022 11:30 AM,27-Aug-2022 11:00 AM,06-Sep-2022 11:00 AM,27-Aug-2022 11:00 AM ,05-Sep-2022 05:00 PM ,27-Aug-2022 11:00 AM,06-Sep-2022 11:00 AM,22-Sep-2022 04:40 PM,"57,900",Yes,fixed,,EE JSV Bilaspur,Bilaspur,Executive Engineer,JSV Division Bilaspur,AOC,Er. Rakesh Vaidya EE JSV Bilaspur,Internal,"Sh Bala Ram Thakur Superintendent Gr-II, Sh. Jitender Sharma DAO Gr.I , Sh. Rakesh Kumar DHD , Sh Ravinder Kumar Senior Assistant",Rakesh Kumar,22-Sep-2022 05:13 PM,finsummary_96584.pdf (50.69 KB),"HP Irrigation and Public Health||Bilaspur Circle,Irrigation and Public Health,HP||Bilaspur,Irrigation and Public Health,HP",2022_HPIPH_64114_1,BLP-BLP-00736 NIT No.14977-15076 Dated 25/08/2022,Construction of CAD works for LIS Niun Pallian under Jal Shakti Division Bilaspur in Tehsil Sadar District Bilaspur (SH Laying jointing and testing in trenches HDPE pipes for distribution system and construction of 12 Nos field outlet assembly and,1.0,299338.0,Vishal Chauhan,INR,"2,400,235",07-Oct-2022,"INR 2,400,235",90.0,Rakesh Kumar,16-Nov-2022 02:52 PM,NiunPallian.pdf (4619.00 KB),The work has been awarded to Sh. Vishal Chauhan Contractor VPO Ghandalwin Tehsil Ghumarwin District Bilaspur vide this office letter No. 19989-96 dated 07/10/2022 for Rs. 2400235/- only.,Technical,Summery,Rakesh Kumar,06-Sep-2022 12:33 PM,technical_96584.pdf,Finance,Financialbid,Rakesh Kumar,22-Sep-2022 04:59 PM,finance_96584.pdf,BOQ Comparative Chart,1.0,299286.0,ANEESH KAUSHAL,05-Sep-2022 11:21 AM,Rejected-AOC,0,16-Nov-2022 02:53 PM,Er. Rajesh Kumar Sharma Superitending Engineer JSV Circle Bilaspur,Internal,"Er. Satish Kumar Sharma EE(D), Er. Rakesh Vaidya (EE BLP) Sh. Desh Raj CHD and Sh. Sher Singh Supdt.",Rakesh Kumar,22-Sep-2022 04:37 PM,22-Sep-2022 04:40 PM,techsummary_96584.pdf (1300.38 KB),AOC
,,,,,,,,,,,,,,,,.pdf,Earnest money proof scan copy of EMD of Certificate of exemption of earnest money with affidavit,,,,,,,,,,,,,,,,,,,,,,,2.0,BC - Bankers Cheque,,,,,,,,,,,,,,,,,,AOC,,,,,,,,,,,,,,,,,,,,,,,,,,,,,,,,,,2.0,299399.0,Neeraj Kumar,06-Sep-2022 10:45 AM,Rejected-AOC,0,16-Nov-2022 02:53 PM,,,,,,,,AOC
,,,,,,,,,,,,,,,,.pdf,Certificate of registration with Jal Shakti Vighag in appropriate class and latest renewal thereof.,,,,,,,,,,,,,,,,,,,,,,,3.0,SS - Small Savings Instrument,,,,,,,,,,,,,,,,,,AOC,,,,,,,,,,,,,,,,,,,,,,,,,,,,,,,,,,3.0,299377.0,SHASHI KANT,06-Sep-2022 09:39 AM,Rejected-AOC,0,16-Nov-2022 02:53 PM,,,,,,,,AOC
,,,,,,,,,,,,,,,,.pdf,PAN No. / GST registration.,,,,,,,,,,,,,,,,,,,,,,,4.0,BG - Bank Guarantee,,,,,,,,,,,,,,,,,,AOC,,,,,,,,,,,,,,,,,,,,,,,,,,,,,,,,,,4.0,299338.0,Vishal Chauhan,05-Sep-2022 04:23 PM,Accepted-AOC,Work Awarded,16-Nov-2022 02:53 PM,,,,,,,,AOC
,,,,,,,,,,,,,,,,.pdf,Scan copy of EPF No.,,,,,,,,,,,,,,,,,,,,,,,5.0,FDR - Fixed Deposit,,,,,,,,,,,,,,,,,,AOC,,,,,,,,,,,,,,,,,,,,,,,,,,,,,,,,,,,,,,,,,,,,,,,,AOC
,,,,,,,,,,,,,,2.0,Finance,.xls,BOQ,,,,,,,,,,,,,,,,,,,,,,,,,,,,,,,,,,,,,,,,,,AOC,,,,,,,,,,,,,,,,,,,,,,,,,,,,,,,,,,,,,,,,,,,,,,,,AOC
