Type :,Summary :,Updated By :,Updated On :,Document :,S.No,Bid Number,Bidder Name,Submitted Date,Status,Remarks,Status Updated On,Type :.1,Summary :.1,Updated By :.1,Updated On :.1,Document :.1,BOQ Comparative Chart :,S.No.1,Bid Number.1,Bidder Name.1,Awarded Currency,Awarded Value,Committee Chairperson/Co-ordinator Name :,Committee Chairperson/Co-ordinator Type :,Committee Members :,Updated By :.2,Updated on :,Document :.2,Contract Date :,Contract Value :,Work Completion Period in days :,Updated By :.3,Updated on :.1,AOC document :,Organisation Chain :,Tender ID :,Tender Ref No :,Tender Title :,Committee Chairperson/Co-ordinator Name :.1,Committee Chairperson/Co-ordinator Type :.1,Committee Members :.1,Updated By :.4,Updated On :.2,Financial Bid Opening Date:,Document :.3,Tender Stage,Name,Address,Organisation Chain,Tender Reference Number,Tender ID,Withdrawal Allowed,Tender Type,Form of contract,Tender Category,No. of Covers,General Technical Evaluation Allowed,ItemWise Technical Evaluation Allowed,Payment Mode,Is Multi Currency Allowed For BOQ,Is Multi Currency Allowed For Fee,Allow Two Stage Bidding,Title,Work Description,Pre Qualification Details,Independent External Monitor/Remarks,Tender Value in ₹,Product Category,Sub category,Contract Type,Bid Validity(Days),Period Of Work(Days),Location,Pincode,Pre Bid Meeting Place,Pre Bid Meeting Address,Pre Bid Meeting Date,Bid Opening Place,Should Allow NDA Tender,Allow Preferential Bidder,S.No,Bank Name,Tender Fee in ₹,Fee Payable To,Fee Payable At,Tender Fee Exemption Allowed,Publish Date,Bid Opening Date,Document Download / Sale Start Date,Document Download / Sale End Date,Clarification Start Date,Clarification End Date,Bid Submission Start Date,Bid Submission End Date,Financial Bid Opening Date,EMD Amount in ₹,EMD Exemption Allowed,EMD Fee Type,EMD Percentage,EMD Payable To,EMD Payable At,Cover No,Cover,Document Type,Description,Tender Stage
Technical,summary updated,Ramesh Rana,11-Oct-2022 01:52 PM,technical_99142.pdf,1.0,305872.0,HEM LATA,03-Oct-2022 08:25 PM,Accepted-AOC,Lowest bidder to awarded the work,25-Nov-2022 12:22 PM,Finance,Summary Uploaded,Ramesh Rana,17-Nov-2022 01:56 PM,finance_99142.pdf,BOQ Comparative Chart,1.0,305872.0,HEM LATA,INR,"824,494",Executive Engineer,Internal,"XEN, AE, HDM, Supdt",Ramesh Rana,17-Nov-2022 01:59 PM,finsummary_99142.pdf (191.41 KB),25-Nov-2022,"INR 848,028",60.0,Ramesh Rana,25-Nov-2022 12:21 PM,a.pdf (622.00 KB),PWD,2022_PWD_65880_7,PW-KD-E-Tende/2022-23-6512-15 dt 20-09-2022,R/R Damages on Gumma Jashla Reoghati Road in K.M. 0/00 to 29/500,Executive Engineer,Internal,"XEN, AE, HDM, Supdt.",Ramesh Rana,11-Oct-2022 01:53 PM,11-Oct-2022 02:00 PM,techsummary_99142.pdf (4045.45 KB),AOC,Executive Engineer,HPPWD Division Kotkhai,PWD,PW-KD-E-Tende/2022-23-6512-15 dt 20-09-2022,2022_PWD_65880_7,Yes,Open Tender,Item Rate,Works,2.0,No,No,Online,No,No,No,R/R Damages on Gumma Jashla Reoghati Road in K.M. 0/00 to 29/500,"C/o, PCC, R/Wall at R.D. in K.M. 7/885 to 7/892, 10/210 to 10/220 and 10/850 to 10/860",Please refer Tender documents. ,NA ,"8,48,029",Civil Works - Roads,NA ,Tender,90.0,60.0,Kotkhai,171202.0,NA ,NA ,NA ,EE Kotkhai,No ,No,1.0,ICICI BANK,350.0,Nil,Nil,No,01-Oct-2022 06:00 PM,07-Oct-2022 11:00 AM,01-Oct-2022 06:00 PM,06-Oct-2022 06:00 PM,NA ,NA ,01-Oct-2022 06:00 PM,06-Oct-2022 06:00 PM,11-Oct-2022 02:00 PM,"17,000",No,fixed,,Nil,Nil,1.0,Fee/PreQual/Technical,.pdf,Cost Of Tender (Indicated In Schedule F),AOC
,,,,,2.0,305867.0,M/s Pardeep Sublaik,03-Oct-2022 08:11 PM,Rejected-Finance,L2 Bidder,17-Nov-2022 01:59 PM,,,,,,,,,,,,,,,,,,,,,,,,,,,,,,,,,,,AOC,,,,,,,,,,,,,,,,,,,,,,,,,,,,,,,,,,,2.0,ICICI NEFT/RTGS,,,,,,,,,,,,,,,,,,,,,,.pdf,The Earnest Money (Indicated In Schedule F),AOC
,,,,,,,,,,,,,,,,,,,,,,,,,,,,,,,,,,,,,,,,,,,,,,AOC,,,,,,,,,,,,,,,,,,,,,,,,,,,,,,,,,,,,,,,,,,,,,,,,,,,,,,,,,,.pdf,Contractors Registration (Refer General Rules No 23),AOC
,,,,,,,,,,,,,,,,,,,,,,,,,,,,,,,,,,,,,,,,,,,,,,AOC,,,,,,,,,,,,,,,,,,,,,,,,,,,,,,,,,,,,,,,,,,,,,,,,,,,,,,,,,,.pdf,GST Registration (General Rules No 21),AOC
,,,,,,,,,,,,,,,,,,,,,,,,,,,,,,,,,,,,,,,,,,,,,,AOC,,,,,,,,,,,,,,,,,,,,,,,,,,,,,,,,,,,,,,,,,,,,,,,,,,,,,,,,,,.pdf,"List Of Machinery, Tool, Plant(Refer Schedule F With Reference To Clause 18)",AOC
,,,,,,,,,,,,,,,,,,,,,,,,,,,,,,,,,,,,,,,,,,,,,,AOC,,,,,,,,,,,,,,,,,,,,,,,,,,,,,,,,,,,,,,,,,,,,,,,,,,,,,,,,,,.pdf,Form No 8 (Refer General Rules No.26.7),AOC
,,,,,,,,,,,,,,,,,,,,,,,,,,,,,,,,,,,,,,,,,,,,,,AOC,,,,,,,,,,,,,,,,,,,,,,,,,,,,,,,,,,,,,,,,,,,,,,,,,,,,,,,,,,.pdf,List Of Both Gazetted And Non-Gazetted Hppwd Employees Related To Him (General Rule No 16),AOC
,,,,,,,,,,,,,,,,,,,,,,,,,,,,,,,,,,,,,,,,,,,,,,AOC,,,,,,,,,,,,,,,,,,,,,,,,,,,,,,,,,,,,,,,,,,,,,,,,,,,,,,,,,,.pdf,Affidavit That Information Furnished With The Bid Is Correct In All Respect,AOC
,,,,,,,,,,,,,,,,,,,,,,,,,,,,,,,,,,,,,,,,,,,,,,AOC,,,,,,,,,,,,,,,,,,,,,,,,,,,,,,,,,,,,,,,,,,,,,,,,,,,,,,,,,,.pdf,Proof of Registration under Employees Provident Funds(Refer General Rule 25 A),AOC
,,,,,,,,,,,,,,,,,,,,,,,,,,,,,,,,,,,,,,,,,,,,,,AOC,,,,,,,,,,,,,,,,,,,,,,,,,,,,,,,,,,,,,,,,,,,,,,,,,,,,,,,,,,.pdf,Other Important Documents As Specified By The State In Proforma Of Schedule,AOC
,,,,,,,,,,,,,,,,,,,,,,,,,,,,,,,,,,,,,,,,,,,,,,AOC,,,,,,,,,,,,,,,,,,,,,,,,,,,,,,,,,,,,,,,,,,,,,,,,,,,,,,,,2.0,Finance,.xls,BOQ,AOC
