Contract Date :,Contract Value :,Work Completion Period in days :,Updated By :,Updated on :,AOC document :,Type :,Summary :,Updated By :.1,Updated On :,Document :,Type :.1,Summary :.1,Updated By :.2,Updated On :.1,Document :.1,BOQ Comparative Chart :,S.No,Bid Number,Bidder Name,Submitted Date,Status,Remarks,Status Updated On,Committee Chairperson/Co-ordinator Name :,Committee Chairperson/Co-ordinator Type :,Committee Members :,Updated By :.3,Updated On :.2,Financial Bid Opening Date:,Document :.2,S.No.1,Bid Number.1,Bidder Name.1,Awarded Currency,Awarded Value,Organisation Chain :,Tender ID :,Tender Ref No :,Tender Title :,Committee Chairperson/Co-ordinator Name :.1,Committee Chairperson/Co-ordinator Type :.1,Committee Members :.1,Updated By :.4,Updated on :.1,Document :.3,Tender Stage,Tender Fee in ₹,Fee Payable To,Fee Payable At,Tender Fee Exemption Allowed,S.No,Bank Name,Title,Work Description,Pre Qualification Details,Independent External Monitor/Remarks,Tender Value in ₹,Product Category,Sub category,Contract Type,Bid Validity(Days),Period Of Work(Days),Location,Pincode,Pre Bid Meeting Place,Pre Bid Meeting Address,Pre Bid Meeting Date,Bid Opening Place,Should Allow NDA Tender,Allow Preferential Bidder,Publish Date,Bid Opening Date,Document Download / Sale Start Date,Document Download / Sale End Date,Clarification Start Date,Clarification End Date,Bid Submission Start Date,Bid Submission End Date,Financial Bid Opening Date,EMD Amount in ₹,EMD Exemption Allowed,EMD Fee Type,EMD Percentage,EMD Payable To,EMD Payable At,Cover No,Cover,Document Type,Description,Organisation Chain,Tender Reference Number,Tender ID,Withdrawal Allowed,Tender Type,Form of contract,Tender Category,No. of Covers,General Technical Evaluation Allowed,ItemWise Technical Evaluation Allowed,Payment Mode,Is Multi Currency Allowed For BOQ,Is Multi Currency Allowed For Fee,Allow Two Stage Bidding,Name,Address,Tender Stage
22-Nov-2022,"INR 3,336,230",180.0,Basant Singh Rathour,22-Nov-2022 03:24 PM,AOC.pdf (561.00 KB),Technical,technical bid summary,Basant Singh Rathour,05-Sep-2022 01:36 PM,technical_96643.pdf,Finance,Financial Bid Summary,Basant Singh Rathour,29-Sep-2022 01:23 PM,None,BOQ Comparative Chart,1,298829,JOGINDER SINGH,02-Sep-2022 11:22 AM,Rejected-Finance,L5,22-Nov-2022 03:23 PM,SE,Internal,,Basant Singh Rathour,29-Sep-2022 12:51 PM,29-Sep-2022 12:55 PM,techsummary_96643.pdf (8937.35 KB),1.0,298978.0,rajinder verma,INR,"2,764,639","HP Irrigation and Public Health||Shimla-9 Circle,Irrigation and Public Health,HP||Shimla,Irrigation and Public Health,HP",2022_HPIPH_64167_1,Kasumpti/Shimla/GWSS/33.36,"Improvement of various GWSS Under Jal Shkati Sub Division Sainj in Tehsil Theog Distt Shimla HP. (SH_ Laying and jointing of G.I Pipe of various dia, construction of RCC storage Tank 1 No. at village Sainj and 1 No. at Deha 85000 ltrs capacity",EE,Internal,,Basant Singh Rathour,22-Nov-2022 03:23 PM,finsummary_96643.pdf (561.12 KB),AOC,400.0,EE Jal Shakti Division No-I,Kasumpti Shimla,No,1.0,ICICI BANK,"Improvement of various GWSS Under Jal Shkati Sub Division Sainj in Tehsil Theog Distt Shimla HP. (SH_ Laying and jointing of G.I Pipe of various dia, construction of RCC storage Tank 1 No. at village Sainj and 1 No. at Deha 85000 ltrs capacity",Providing and laying of rising main 125mm dia.,Please refer Tender documents. ,NA ,"33,36,230",Civil Works - Water Works,NA ,Rate Contract,120.0,180.0,Shimla,171009.0,NA ,NA ,NA ,Kasumpti,No ,No,27-Aug-2022 05:00 PM,03-Sep-2022 11:30 AM,27-Aug-2022 05:00 PM,02-Sep-2022 05:00 PM,NA ,NA ,27-Aug-2022 05:00 PM,02-Sep-2022 05:00 PM,29-Sep-2022 12:55 PM,"57,550",Yes,fixed,,EE Jal Shakti Division No-I,Kasumpti Shimla,1.0,Fee/PreQual/Technical,.pdf,Tender Fee as per NIT,"HP Irrigation and Public Health||Shimla-9 Circle,Irrigation and Public Health,HP||Shimla,Irrigation and Public Health,HP",Kasumpti/Shimla/GWSS/33.36,2022_HPIPH_64167_1,Yes,Open Tender,Item Rate,Works,2.0,No,No,Both(Online/Offline),No,No,No,Executive Engineer,Jal Shakti Division No-I Kasumpati Shimla-9,AOC
,,,,,,,,,,,,,,,,,2,298917,Rajesh Bhandari,02-Sep-2022 12:16 PM,Rejected-Finance,L4,22-Nov-2022 03:23 PM,,,,,,,,,,,,,,,,,,,,,,,AOC,,,,,2.0,ICICI NEFT/RTGS,,,,,,,,,,,,,,,,,,,,,,,,,,,,,,,,,,,,.pdf,Earnest money as per NIT,,,,,,,,,,,,,,,,,AOC
,,,,,,,,,,,,,,,,,3,298978,rajinder verma,02-Sep-2022 04:33 PM,Accepted-AOC,l1,22-Nov-2022 03:24 PM,,,,,,,,,,,,,,,,,,,,,,,AOC,,,,,,,,,,,,,,,,,,,,,,,,,,,,,,,,,,,,,,,,,,.pdf,Certificate of registration as per NIT,,,,,,,,,,,,,,,,,AOC
,,,,,,,,,,,,,,,,,4,298987,rupinder justa govt contractor,02-Sep-2022 04:49 PM,Rejected-Finance,L3,22-Nov-2022 03:23 PM,,,,,,,,,,,,,,,,,,,,,,,AOC,,,,,,,,,,,,,,,,,,,,,,,,,,,,,,,,,,,,,,,,,,.pdf,Copy of PAN card and GSTIN as per NIT,,,,,,,,,,,,,,,,,AOC
,,,,,,,,,,,,,,,,,5,298992,Sanat Sharma,02-Sep-2022 04:34 PM,Rejected-Finance,L2,22-Nov-2022 03:23 PM,,,,,,,,,,,,,,,,,,,,,,,AOC,,,,,,,,,,,,,,,,,,,,,,,,,,,,,,,,,,,,,,,,,,.pdf,Other documents as per NIT,,,,,,,,,,,,,,,,,AOC
,,,,,,,,,,,,,,,,,6,298814,Satish Kumar,01-Sep-2022 04:37 PM,Rejected-Finance,L6,22-Nov-2022 03:23 PM,,,,,,,,,,,,,,,,,,,,,,,AOC,,,,,,,,,,,,,,,,,,,,,,,,,,,,,,,,,,,,,,,,2.0,Finance,.xls,BOQ,,,,,,,,,,,,,,,,,AOC
