Cover No,Cover,Document Type,Description,S.No,Bank Name,Title,Work Description,Pre Qualification Details,Independent External Monitor/Remarks,Tender Value in ₹,Product Category,Sub category,Contract Type,Bid Validity(Days),Period Of Work(Days),Location,Pincode,Pre Bid Meeting Place,Pre Bid Meeting Address,Pre Bid Meeting Date,Bid Opening Place,Should Allow NDA Tender,Allow Preferential Bidder,EMD Amount in ₹,EMD Exemption Allowed,EMD Fee Type,EMD Percentage,EMD Payable To,EMD Payable At,Name,Address,Publish Date,Bid Opening Date,Document Download / Sale Start Date,Document Download / Sale End Date,Clarification Start Date,Clarification End Date,Bid Submission Start Date,Bid Submission End Date,Financial Bid Opening Date,Organisation Chain,Tender Reference Number,Tender ID,Withdrawal Allowed,Tender Type,Form of contract,Tender Category,No. of Covers,General Technical Evaluation Allowed,ItemWise Technical Evaluation Allowed,Payment Mode,Is Multi Currency Allowed For BOQ,Is Multi Currency Allowed For Fee,Allow Two Stage Bidding,Tender Fee in ₹,Fee Payable To,Fee Payable At,Tender Fee Exemption Allowed,Tender Stage,Committee Chairperson/Co-ordinator Name :,Committee Chairperson/Co-ordinator Type :,Committee Members :,Updated By :,Updated On :,Financial Bid Opening Date:,Document :,S.No,Bid Number,Bidder Name,Submitted Date,Status,Remarks,Status Updated On,Type :,Summary :,Updated By :.1,Updated On :.1,Document :.1,BOQ Comparative Chart :,Type :.1,Summary :.1,Updated By :.2,Updated On :.2,Document :.2,Contract Date :,Contract Value :,Work Completion Period in days :,Updated By :.3,Updated on :,AOC document :,AOC Description :,Committee Chairperson/Co-ordinator Name :.1,Committee Chairperson/Co-ordinator Type :.1,Committee Members :.1,Updated By :.4,Updated on :.1,Document :.3,S.No.1,Bid Number.1,Bidder Name.1,Awarded Currency,Awarded Value,Organisation Chain :,Tender ID :,Tender Ref No :,Tender Title :,Tender Stage
1.0,Fee/PreQual/Technical,.pdf,Bidder license of appropriate class as per nit,1.0,ICICI BANK,HPSEBL/OCK/NIT-11,Tender for Supply of Power to LWSS Phatti Peej Phatti Kharahal Phatti Balh near Suma Ropa Bihal under ESD NoII HPSEBL Kullu One Stage one Pump House on Turnkey Basis,Please refer Tender documents. ,NA ,"54,45,155",Electrical Works,NA ,Tender,180.0,90.0,KHARAHAL,175101.0,NA ,NA ,NA ,office of SE op circle HPSEBL Kullu,No ,No,"54,452",No,fixed,,Nil,Nil,Superintending Engineer,office of SE op circle HPSEBL Kullu,24-Sep-2022 02:15 PM,04-Oct-2022 11:30 AM,26-Sep-2022 04:00 PM,03-Oct-2022 03:00 PM,NA ,NA ,26-Sep-2022 04:00 PM,03-Oct-2022 03:00 PM,11-Oct-2022 04:30 PM,HPSEBL||CE(OP) CZ Mandi||SE(OP) Kullu,HPSEBL/OCK/NIT-11/2022-23,2022_HPSEB_65502_1,Yes,Open Tender,Turn-key,Works,2.0,No,No,Online,No,No,No,"1,120",Nil,Nil,No,AOC,SE OP Circle Kullu,Internal,SE Works office of CEOCZ Sr Xen Comm and Works and AAO of this office,Sanjay Kaushal,11-Oct-2022 03:57 PM,11-Oct-2022 04:30 PM,techsummary_98612.pdf (442.43 KB),1,305394,Gurmail Singh Electrical Cont And Supplier,01-Oct-2022 05:30 PM,Rejected-Finance,L-5 BIDDER,01-Nov-2022 01:02 PM,Finance,AFTER OPENING OF FINANCIAL BID MS DEVARYA ENGINEERING FOUND L-1 BIDDER,Aayush Minhas,01-Nov-2022 12:48 PM,finance_98612.pdf,BOQ Comparative Chart,Technical,All the above bidders have fulfill all terms and conditions Hence eligible,Sanjay Kaushal,11-Oct-2022 03:53 PM,technical_98612.pdf,01-Nov-2022,"INR 5,445,155",90.0,Aayush Minhas,01-Nov-2022 01:07 PM,awardofnit11.pdf (4182.00 KB),work awarded to MS Devarya Engineering completed all codal formalities,SE OPERATION CIRCLE HPSEBL KULLU,Internal,SE OPERATION CIRCLE HPSEBL KULLU SR EXECUTIVE ENGINEER COMMERCIAL AND WORKS ASSISIANT ACCTOUNT OFFICER,Aayush Minhas,01-Nov-2022 01:02 PM,finsummary_98612.pdf (442.44 KB),1.0,304248.0,M/S DEVARYA ENGINEERING,INR,"5,012,263",HPSEBL||CE(OP) CZ Mandi||SE(OP) Kullu,2022_HPSEB_65502_1,HPSEBL/OCK/NIT-11/2022-23,HPSEBL/OCK/NIT-11,AOC
,,.pdf,Certificate of performance /experience in same field as per SBD,2.0,ICICI NEFT/RTGS,,,,,,,,,,,,,,,,,,,,,,,,,,,,,,,,,,,,,,,,,,,,,,,,,,,,,,AOC,,,,,,,,2,305047,JOGINDER SINGH GOVT CONTRACTOR,02-Oct-2022 08:49 AM,Rejected-Finance,L-7 BIDDER,01-Nov-2022 01:02 PM,,,,,,,,,,,,,,,,,,,,,,,,,,,,,,,,,,AOC
,,.pdf,Annual turnover as per SBD,,,,,,,,,,,,,,,,,,,,,,,,,,,,,,,,,,,,,,,,,,,,,,,,,,,,,,,,AOC,,,,,,,,3,305702,MAHESH KUMAR AND SONS,03-Oct-2022 02:01 PM,Rejected-Finance,L-8 BIDDER,01-Nov-2022 01:02 PM,,,,,,,,,,,,,,,,,,,,,,,,,,,,,,,,,,AOC
,,.pdf,Declaration of non blacklisting,,,,,,,,,,,,,,,,,,,,,,,,,,,,,,,,,,,,,,,,,,,,,,,,,,,,,,,,AOC,,,,,,,,4,305546,MANUJ VAISDYA,02-Oct-2022 12:24 PM,Rejected-Finance,L-6 BIDDER,01-Nov-2022 01:02 PM,,,,,,,,,,,,,,,,,,,,,,,,,,,,,,,,,,AOC
,,.pdf,copy of PAN AND GST,,,,,,,,,,,,,,,,,,,,,,,,,,,,,,,,,,,,,,,,,,,,,,,,,,,,,,,,AOC,,,,,,,,5,304248,M/S DEVARYA ENGINEERING,30-Sep-2022 01:05 PM,Accepted-AOC,L-1 Bidder,01-Nov-2022 01:08 PM,,,,,,,,,,,,,,,,,,,,,,,,,,,,,,,,,,AOC
2.0,Finance,.xls,BOQ,,,,,,,,,,,,,,,,,,,,,,,,,,,,,,,,,,,,,,,,,,,,,,,,,,,,,,,,AOC,,,,,,,,6,305558,MS. Prem Enterprises,03-Oct-2022 10:36 AM,Rejected-Finance,L-4 BIDDER,01-Nov-2022 01:02 PM,,,,,,,,,,,,,,,,,,,,,,,,,,,,,,,,,,AOC
,,,,,,,,,,,,,,,,,,,,,,,,,,,,,,,,,,,,,,,,,,,,,,,,,,,,,,,,,,,AOC,,,,,,,,7,305654,M/S Raizada Enterprises,03-Oct-2022 10:59 AM,Rejected-Finance,L-3 BIDDER,01-Nov-2022 01:02 PM,,,,,,,,,,,,,,,,,,,,,,,,,,,,,,,,,,AOC
,,,,,,,,,,,,,,,,,,,,,,,,,,,,,,,,,,,,,,,,,,,,,,,,,,,,,,,,,,,AOC,,,,,,,,8,304285,MS Sonu Kumar A Class Govt Cont,30-Sep-2022 02:31 PM,Rejected-Finance,L-2 BIDDER,01-Nov-2022 01:02 PM,,,,,,,,,,,,,,,,,,,,,,,,,,,,,,,,,,AOC
