Title,Work Description,Pre Qualification Details,Independent External Monitor/Remarks,Tender Value in ₹,Product Category,Sub category,Contract Type,Bid Validity(Days),Period Of Work(Days),Location,Pincode,Pre Bid Meeting Place,Pre Bid Meeting Address,Pre Bid Meeting Date,Bid Opening Place,Should Allow NDA Tender,Allow Preferential Bidder,S.No,Instrument Type,EMD Amount in ₹,EMD Exemption Allowed,EMD Fee Type,EMD Percentage,EMD Payable To,EMD Payable At,Name,Address,Tender Fee in ₹,Fee Payable To,Fee Payable At,Tender Fee Exemption Allowed,Cover No,Cover,Document Type,Description,Publish Date,Bid Opening Date,Document Download / Sale Start Date,Document Download / Sale End Date,Clarification Start Date,Clarification End Date,Bid Submission Start Date,Bid Submission End Date,Financial Bid Opening Date,Organisation Chain,Tender Reference Number,Tender ID,Withdrawal Allowed,Tender Type,Form of contract,Tender Category,No. of Covers,General Technical Evaluation Allowed,ItemWise Technical Evaluation Allowed,Payment Mode,Is Multi Currency Allowed For BOQ,Is Multi Currency Allowed For Fee,Allow Two Stage Bidding,Tender Stage,Committee Chairperson/Co-ordinator Name :,Committee Chairperson/Co-ordinator Type :,Committee Members :,Updated By :,Updated On :,Financial Bid Opening Date:,Document :,Organisation Chain :,Tender ID :,Tender Ref No :,Tender Title :,Contract Date :,Contract Value :,Work Completion Period in days :,Updated By :.1,Updated on :,AOC document :,AOC Description :,Committee Chairperson/Co-ordinator Name :.1,Committee Chairperson/Co-ordinator Type :.1,Committee Members :.1,Updated By :.2,Updated on :.1,Document :.1,S.No,Bid Number,Bidder Name,Submitted Date,Status,Remarks,Status Updated On,Type :,Summary :,Updated By :.3,Updated On :.1,Document :.2,Type :.1,Summary :.1,Updated By :.4,Updated On :.2,Document :.3,BOQ Comparative Chart :,S.No.1,Bid Number.1,Bidder Name.1,Awarded Currency,Awarded Value,Tender Stage
Restoration of rain damages (SH Construction of Retaining wall on road leading to Annandale from Capital Hotel RD 0 925 to 0 945) in ward No 4 Phase I,Restoration of rain damages (SH Construction of Retaining wall on road leading to Annandale from Capital Hotel RD 0 925 to 0 945) in ward No 4 Phase I,Please refer Tender Documents ,NA ,"8,70,000",Civil Works,NA ,Tender,120.0,60.0,Shimla,171001.0,NA ,NA ,NA ,MC Shimla,No ,No,1.0,DD - Demand Draft,"17,400",No,fixed,,Executive Engineer R B M C Shimla,Shimla,Executive Engineer R B M C Shimla,Executive Engineer R B M C Shimla,350.0,Executive Engineer R B M C Shimla,Shimla,No,1.0,Fee/PreQual/Technical,.pdf,Cost of form in shape of DD and Earnest money in shape of FDR as per E procurement notice,21-Sep-2022 06:00 PM,30-Sep-2022 02:00 PM,21-Sep-2022 06:00 PM,29-Sep-2022 05:00 PM,NA ,NA ,21-Sep-2022 06:00 PM,29-Sep-2022 05:00 PM,11-Oct-2022 10:15 AM,Municipal Corporation Shimla,4508Dated16092022,2022_MC_65310_15,Yes,Open Tender,Item Rate,Works,2.0,No,No,Offline,No,No,No,AOC,EE,Internal,AGM SJPNL AO,Rajesh Thakur,11-Oct-2022 10:11 AM,11-Oct-2022 10:15 AM,techsummary_98344.pdf (1189.47 KB),Municipal Corporation Shimla,2022_MC_65310_15,4508Dated16092022,Restoration of rain damages (SH Construction of Retaining wall on road leading to Annandale from Capital Hotel RD 0 925 to 0 945) in ward No 4 Phase I,03-Nov-2022,"INR 609,000.06",60.0,Rajesh Thakur,03-Nov-2022 11:08 AM,2022_MC_65310_15.pdf (513.00 KB),AOC,EE,Internal,AGM SJPNL AO,Rajesh Thakur,03-Nov-2022 11:08 AM,finsummary_98344.pdf (314.77 KB),1,304735,AJAY SHARMA,28-Sep-2022 05:33 PM,Rejected-Finance,Rejected,03-Nov-2022 11:08 AM,Technical,BOS,Sunil Attri,10-Oct-2022 03:59 PM,technical_98344.pdf,Finance,BOS,Rajesh Thakur,11-Oct-2022 10:44 AM,finance_98344.pdf,BOQ Comparative Chart,1.0,305061.0,SANJAY SHARMA,INR,"609,000",AOC
,,,,,,,,,,,,,,,,,,2.0,FDR - Fixed Deposit,,,,,,,,,,,,,,,.pdf,Certificate of registration with HPPWD in appropriate class and latest renewal thereof,,,,,,,,,,,,,,,,,,,,,,,,AOC,,,,,,,,,,,,,,,,,,,,,,,,,2,305092,BHIM CHAND SHARMA,29-Sep-2022 04:39 PM,Rejected-Finance,Rejected,03-Nov-2022 11:08 AM,,,,,,,,,,,,,,,,,AOC
,,,,,,,,,,,,,,,,,,,,,,,,,,,,,,,,,,.pdf,Income Tax GST and EPF registration PAN Permanent Account No and GST No,,,,,,,,,,,,,,,,,,,,,,,,AOC,,,,,,,,,,,,,,,,,,,,,,,,,3,304900,KHAJAN SINGH,29-Sep-2022 11:35 AM,Rejected-Finance,Rejected,03-Nov-2022 11:08 AM,,,,,,,,,,,,,,,,,AOC
,,,,,,,,,,,,,,,,,,,,,,,,,,,,,,,,,,.pdf,Scanned Copy of tender documents i.e. NIT (E-procurement notice) Performa and Form MW-7 duly signed,,,,,,,,,,,,,,,,,,,,,,,,AOC,,,,,,,,,,,,,,,,,,,,,,,,,4,305049,Lalit Thakur,29-Sep-2022 03:33 PM,Rejected-Finance,Rejected,03-Nov-2022 11:08 AM,,,,,,,,,,,,,,,,,AOC
,,,,,,,,,,,,,,,,,,,,,,,,,,,,,,,,,,.pdf,Scanned copy of Affidavit duly signed with reference to condition No. 10.4,,,,,,,,,,,,,,,,,,,,,,,,AOC,,,,,,,,,,,,,,,,,,,,,,,,,5,305006,manoj kumar,29-Sep-2022 02:05 PM,Rejected-Finance,Rejected,03-Nov-2022 11:08 AM,,,,,,,,,,,,,,,,,AOC
,,,,,,,,,,,,,,,,,,,,,,,,,,,,,,,,,,.pdf,Scanned copy of Letter Head with reference to condition No. 10.1,,,,,,,,,,,,,,,,,,,,,,,,AOC,,,,,,,,,,,,,,,,,,,,,,,,,6,305061,SANJAY SHARMA,29-Sep-2022 03:41 PM,Accepted-AOC,Accepted,03-Nov-2022 11:09 AM,,,,,,,,,,,,,,,,,AOC
,,,,,,,,,,,,,,,,,,,,,,,,,,,,,,,,2.0,Finance,.xls,BOQ,,,,,,,,,,,,,,,,,,,,,,,,AOC,,,,,,,,,,,,,,,,,,,,,,,,,7,304981,SUNIL SHARMA,29-Sep-2022 01:49 PM,Rejected-Finance,Rejected,03-Nov-2022 11:08 AM,,,,,,,,,,,,,,,,,AOC
