S.No,Instrument Type,Organisation Chain,Tender Reference Number,Tender ID,Withdrawal Allowed,Tender Type,Form of contract,Tender Category,No. of Covers,General Technical Evaluation Allowed,ItemWise Technical Evaluation Allowed,Payment Mode,Is Multi Currency Allowed For BOQ,Is Multi Currency Allowed For Fee,Allow Two Stage Bidding,Cover No,Cover,Document Type,Description,Name,Address,Tender Fee in ₹,Fee Payable To,Fee Payable At,Tender Fee Exemption Allowed,Publish Date,Bid Opening Date,Document Download / Sale Start Date,Document Download / Sale End Date,Clarification Start Date,Clarification End Date,Bid Submission Start Date,Bid Submission End Date,Financial Bid Opening Date,Title,Work Description,Pre Qualification Details,Independent External Monitor/Remarks,Tender Value in ₹,Product Category,Sub category,Contract Type,Bid Validity(Days),Period Of Work(Days),Location,Pincode,Pre Bid Meeting Place,Pre Bid Meeting Address,Pre Bid Meeting Date,Bid Opening Place,Should Allow NDA Tender,Allow Preferential Bidder,S.No.1,Corrigendum Title,Corrigendum Type,View,EMD Amount in ₹,EMD through BG/ST or EMD Exemption Allowed,EMD Fee Type,EMD Percentage,EMD Payable To,EMD Payable At,Tender Stage,Type :,Summary :,Updated By :,Updated On :,Document :,BOQ Comparative Chart :,Type :.1,Summary :.1,Updated By :.1,Updated On :.1,Document :.1,Organisation Chain :,Tender ID :,Tender Ref No :,Tender Title :,Committee Chairperson/Co-ordinator Name :,Committee Chairperson/Co-ordinator Type :,Committee Members :,Updated By :.2,Updated on :,Document :.2,Committee Chairperson/Co-ordinator Name :.1,Committee Chairperson/Co-ordinator Type :.1,Committee Members :.1,Updated By :.3,Updated On :.2,Financial Bid Opening Date:,Document :.3,S.No,Bid Number,Bidder Name,Submitted Date,Status,Remarks,Status Updated On,Contract Date :,Contract Value :,Work Completion Period in days :,Updated By :.4,Updated on :.1,AOC document :,AOC Description :,S.No.1,Bid Number.1,Bidder Name.1,Awarded Currency,Awarded Value,Tender Stage
1.0,DD - Demand Draft,Assam Electricity Grid Corporation Ltd||CGM (T and T),DGM/LAC/TT/TLS-69/18/293,2018_AEGCL_7075_1,Yes,Open Tender,Works,Works,2.0,No,No,Offline,No,No,No,1.0,Fee/PreQual/Technical,.rar,Technical Documents,DEPUTY GENERAL MANAGER,Lower Assam T T Circle AEGCL Narengi Guwahati,"3,000",Deputy General Manager,LA TT Circle AEGCL Narengi Ghy,Yes,04-May-2018 11:00 AM,18-May-2018 03:30 PM,04-May-2018 11:00 AM,17-May-2018 05:00 PM,NA ,NA ,04-May-2018 11:00 AM,17-May-2018 05:00 PM,02-Jul-2018 04:50 PM,Construction of RCC retaining wall and stone boulder works for protection of Tower No 36 of 132kV Kahilipara CTPS Line under Kahilipara Division,Construction of RCC retaining wall and stone boulder works for protection of Tower No 36 of 132kV Kahilipara CTPS Line under Kahilipara Division,Refer to IFB or BID Documents ,NA ,0.0,Civil Works,Protection Work For Transmission Line Tower ,Tender,180.0,60.0,Narengi,781026.0,NA ,NA ,NA ,NARENGI,No ,No,1.0,Time Extension,Date,,"98,000",Yes,fixed,,Deputy General Manager,LA TT Circle AEGCL Narengi Ghy,AOC,Finance,RA Associates L1 Bidder qualifies,MITHUN AICH,18-Jan-2019 05:24 PM,,BOQ Comparative Chart,Technical,M/S Sankalpa Associates and M/S RA Associates have qualified the Technical Evaluation. For more details please refer to the Technical Bid Evaluation Report enclosed herewith.,ATREYEE BISWANATH,02-Jul-2018 04:30 PM,technical_10656.pdf,Assam Electricity Grid Corporation Ltd||CGM (T and T),2018_AEGCL_7075_1,DGM/LAC/TT/TLS-69/18/293,Construction of RCC retaining wall and stone boulder works for protection of Tower No 36 of 132kV Kahilipara CTPS Line under Kahilipara Division,Abhijeet Bhuyan,Internal,,MITHUN AICH,18-Jan-2019 05:28 PM,finsummary_10656.pdf (123.75 KB),Ajay Nath,Internal,"Mithun Aich, Atreyee Biswanath, Debajit Devnath",ATREYEE BISWANATH,02-Jul-2018 04:48 PM,02-Jul-2018 04:50 PM,techsummary_10656.pdf (1310.94 KB),1,35857,AG ASSOCIATES,17-May-2018 01:30 PM,Not Admitted-Fee/PreQual/Technical,Not Complied with technical specification,02-Jul-2018 04:30 PM,15-Jun-2019,INR 3576571.0,60.0,MITHUN AICH,12-Sep-2019 04:05 PM,Doc1.pdf (492.00 KB),Construction of RCC retaining wall and stone boulder works for protection of Tower No-36 of 132kV Kahilipara-CTPS Line under Kahilipara Division.,1.0,35886.0,R. A. ASSOCIATES,INR,3576571.0,AOC
2.0,BC - Bankers Cheque,,,,,,,,,,,,,,,,,.pdf,Techno-Commercial Compliance,,,,,,,,,,,,,,,,,,,,,,,,,,,,,,,,,,,,,,,,,,,,AOC,,,,,,,,,,,,,,,,,,,,,,,,,,,,,2,35738,GANAPATI ENTERPRISE,15-May-2018 12:21 PM,Not Admitted-Fee/PreQual/Technical,Not Complied with technical specification,02-Jul-2018 04:30 PM,,,,,,,,,,,,,AOC
3.0,BG - Bank Guarantee Irrevocable,,,,,,,,,,,,,,,2.0,Finance,.xls,BOQ,,,,,,,,,,,,,,,,,,,,,,,,,,,,,,,,,,,,,,,,,,,,AOC,,,,,,,,,,,,,,,,,,,,,,,,,,,,,3,35808,Mudit Kumar Borah,15-May-2018 02:31 PM,Not Admitted-Fee/PreQual/Technical,Not Complied with technical specification,02-Jul-2018 04:30 PM,,,,,,,,,,,,,AOC
4.0,FDR - Fixed Deposit Receipt,,,,,,,,,,,,,,,,,,,,,,,,,,,,,,,,,,,,,,,,,,,,,,,,,,,,,,,,,,,,,,AOC,,,,,,,,,,,,,,,,,,,,,,,,,,,,,4,35886,R. A. ASSOCIATES,16-May-2018 11:42 PM,Accepted-AOC,L1,12-Sep-2019 04:05 PM,,,,,,,,,,,,,AOC
,,,,,,,,,,,,,,,,,,,,,,,,,,,,,,,,,,,,,,,,,,,,,,,,,,,,,,,,,,,,,,,AOC,,,,,,,,,,,,,,,,,,,,,,,,,,,,,5,35874,Sankalpa Associates,17-May-2018 02:53 PM,Not Admitted-Finance,Not qualified for AOC,18-Jan-2019 05:24 PM,,,,,,,,,,,,,AOC
