Committee Chairperson/Co-ordinator Name :,Committee Chairperson/Co-ordinator Type :,Committee Members :,Updated By :,Updated On :,Financial Bid Opening Date:,Document :,S.No,Bid Number,Bidder Name,Awarded Currency,Awarded Value,Organisation Chain :,Tender ID :,Tender Ref No :,Tender Title :,Committee Chairperson/Co-ordinator Name :.1,Committee Chairperson/Co-ordinator Type :.1,Committee Members :.1,Updated By :.1,Updated on :,Document :.1,S.No.1,Bid Number.1,Bidder Name.1,Submitted Date,Status,Remarks,Status Updated On,Type :,Summary :,Updated By :.2,Updated On :.1,Document :.2,Type :.1,Summary :.1,Updated By :.3,Updated On :.2,Document :.3,BOQ Comparative Chart :,Contract Date :,Contract Value :,Work Completion Period in days :,Updated By :.4,Updated on :.1,AOC document :,AOC Description :,Tender Stage,S.No,Instrument Type,S.No.1,Corrigendum Title,Corrigendum Type,View,Tender Fee in ₹,Fee Payable To,Fee Payable At,Tender Fee Exemption Allowed,Cover No,Cover,Document Type,Description,EMD Amount in ₹,EMD Exemption Allowed,EMD Fee Type,EMD Percentage,EMD Payable To,EMD Payable At,Publish Date,Bid Opening Date,Document Download / Sale Start Date,Document Download / Sale End Date,Clarification Start Date,Clarification End Date,Bid Submission Start Date,Bid Submission End Date,Financial Bid Opening Date,Organisation Chain,Tender Reference Number,Tender ID,Withdrawal Allowed,Tender Type,Form of contract,Tender Category,No. of Covers,General Technical Evaluation Allowed,ItemWise Technical Evaluation Allowed,Payment Mode,Is Multi Currency Allowed For BOQ,Is Multi Currency Allowed For Fee,Allow Two Stage Bidding,Title,Work Description,Pre Qualification Details,Independent External Monitor/Remarks,Tender Value in ₹,Product Category,Sub category,Contract Type,Bid Validity(Days),Period Of Work(Days),Location,Pincode,Pre Bid Meeting Place,Pre Bid Meeting Address,Pre Bid Meeting Date,Bid Opening Place,Should Allow NDA Tender,Allow Preferential Bidder,Name,Address,Tender Stage
Executive Engineer,Internal,Municipal Engineer Account Officer,Sudhir Gupta,10-Jul-2019 04:30 PM,10-Jul-2019 05:00 PM,techsummary_42738.pdf (712.58 KB),1.0,123291.0,SANTOSH KUMAR,INR,"1,127,532.2",Municipal Corporation Shimla||Road and Building - MC,2019_MC_29539_2,1299dated12.06.2019,Restoration of rain damages SH- Removal of slips C-O drain culvert R-wall and B-wall in various roads and path in ward No.20,Executive Engineer,Internal,Municipal Engineer Account Officer,Sudhir Gupta,19-Oct-2019 03:55 PM,finsummary_42738.pdf (600.11 KB),1.0,123291.0,SANTOSH KUMAR,05-Jul-2019 04:43 PM,Accepted-AOC,due to lowest rates,19-Oct-2019 03:56 PM,Technical,bos,Vijay Gupta,10-Jul-2019 02:43 PM,None,Finance,Award letter,Sudhir Gupta,19-Oct-2019 12:30 PM,finance_42738.pdf,BOQ Comparative Chart,19-Oct-2019,"INR 1,127,532.2",120.0,Sudhir Gupta,19-Oct-2019 03:56 PM,3285.pdf (159.00 KB),AOC,AOC,1.0,DD - Demand Draft,1.0,Corrigendum,Date,,350.0,Executive Engineer RB MC Shimla,Shimla,No,1.0,Fee/PreQual/Technical,.pdf,Cost of form in shape of DD as per e procurement notice,"11,700",No,fixed,,Executive Engineer RB MC Shimla,Shimla,21-Jun-2019 05:00 PM,06-Jul-2019 11:00 AM,21-Jun-2019 05:00 PM,06-Jul-2019 10:30 AM,NA ,NA ,21-Jun-2019 05:00 PM,06-Jul-2019 10:30 AM,10-Jul-2019 05:00 PM,Municipal Corporation Shimla||Road and Building - MC,1299dated12.06.2019,2019_MC_29539_2,Yes,Open Tender,Item Rate,Works,2.0,No,No,Offline,No,No,No,Restoration of rain damages SH- Removal of slips C-O drain culvert R-wall and B-wall in various roads and path in ward No.20,Restoration of rain damages SH- Removal of slips C-O drain culvert R-wall and B-wall in various roads and path in ward No.20,Please refer tender documents ,NA ,"5,83,500",Civil Works,NA ,Tender,120.0,120.0,Shimla,171001.0,NA ,NA ,NA ,Shimla,No ,No,Executive Engineer RB MC Shimla,Executive Engineer RB MC Shimla,AOC
,,,,,,,,,,,,,,,,,,,,,,2.0,123293.0,suresh jagta,28-Jun-2019 04:04 PM,Rejected-Finance,Rejected,19-Oct-2019 03:55 PM,,,,,,,,,,,,,,,,,,,AOC,2.0,FDR - Fixed Deposit,,,,,,,,,,,.pdf,Earnest money in shape of FDR and exemption shall not be allowed,,,,,,,,,,,,,,,,,,,,,,,,,,,,,,,,,,,,,,,,,,,,,,,,,,AOC
,,,,,,,,,,,,,,,,,,,,,,,,,,,,,,,,,,,,,,,,,,,,,,,AOC,,,,,,,,,,,,,.pdf,Certificate of registration with HPPWD in appropriate class and latest renewal thereof,,,,,,,,,,,,,,,,,,,,,,,,,,,,,,,,,,,,,,,,,,,,,,,,,,AOC
,,,,,,,,,,,,,,,,,,,,,,,,,,,,,,,,,,,,,,,,,,,,,,,AOC,,,,,,,,,,,,,.pdf,Income Tax GST and EPF registration PAN Permanent Account No and GST No,,,,,,,,,,,,,,,,,,,,,,,,,,,,,,,,,,,,,,,,,,,,,,,,,,AOC
,,,,,,,,,,,,,,,,,,,,,,,,,,,,,,,,,,,,,,,,,,,,,,,AOC,,,,,,,,,,,2.0,Finance,.xls,Schedule of Quantities,,,,,,,,,,,,,,,,,,,,,,,,,,,,,,,,,,,,,,,,,,,,,,,,,,AOC
