Cover No,Cover,Document Type,Description,Tender Fee in ₹,Fee Payable To,Fee Payable At,Tender Fee Exemption Allowed,Publish Date,Bid Opening Date,Document Download / Sale Start Date,Document Download / Sale End Date,Clarification Start Date,Clarification End Date,Bid Submission Start Date,Bid Submission End Date,Financial Bid Opening Date,EMD Amount in ₹,EMD through BG/ST or EMD Exemption Allowed,EMD Fee Type,EMD Percentage,EMD Payable To,EMD Payable At,Name,Address,S.No,Instrument Type,Title,Work Description,Pre Qualification Details,Independent External Monitor/Remarks,Tender Value in ₹,Product Category,Sub category,Contract Type,Bid Validity(Days),Period Of Work(Days),Location,Pincode,Pre Bid Meeting Place,Pre Bid Meeting Address,Pre Bid Meeting Date,Bid Opening Place,Should Allow NDA Tender,Allow Preferential Bidder,Organisation Chain,Tender Reference Number,Tender ID,Withdrawal Allowed,Tender Type,Form of contract,Tender Category,No. of Covers,General Technical Evaluation Allowed,ItemWise Technical Evaluation Allowed,Payment Mode,Is Multi Currency Allowed For BOQ,Is Multi Currency Allowed For Fee,Allow Two Stage Bidding,Tender Stage,Committee Chairperson/Co-ordinator Name :,Committee Chairperson/Co-ordinator Type :,Committee Members :,Updated By :,Updated on :,Document :,Committee Chairperson/Co-ordinator Name :.1,Committee Chairperson/Co-ordinator Type :.1,Committee Members :.1,Updated By :.1,Updated On :,Financial Bid Opening Date:,Document :.1,S.No,Bid Number,Bidder Name,Submitted Date,Status,Remarks,Status Updated On,Type :,Summary :,Updated By :.2,Updated On :.1,Document :.2,BOQ Comparative Chart :,S.No.1,Bid Number.1,Bidder Name.1,Awarded Currency,Awarded Value,Organisation Chain :,Tender ID :,Tender Ref No :,Tender Title :,Type :.1,Summary :.1,Updated By :.3,Updated On :.2,Document :.3,Contract Date :,Contract Value :,Work Completion Period in days :,Updated By :.4,Updated on :.1,AOC document :,AOC Description :,Tender Stage
1.0,Fee,.pdf,Cost of Tender and EMD,"5,000","The Executive Engineer, Dibrugarh W. R. Division",Dibrugarh,No,22-Jan-2019 06:00 PM,02-Feb-2019 02:00 PM,22-Jan-2019 06:05 PM,01-Feb-2019 02:00 PM,NA ,NA ,27-Jan-2019 10:00 AM,01-Feb-2019 02:00 PM,08-Mar-2019 04:20 PM,"3,58,149",Yes,percentage,2.0%,"The Executive Engineer, Dibrugarh W. R. Division",Dibrugarh,"Addl. Chief Engineer, UAZ, W.R. Deptt., Dibrugarh","O/o the Additional Chief Engineer, Upper Assam Zone, Water Resources Department, Dibrugarh - 05",1.0,DD - Demand Draft,Immediate measures to Dehing Bund L/B from Aghunibari to Sessughat at 71st Km for 2018-19,Immediate measures to Dehing Bund L/B from Aghunibari to Sessughat at 71st Km for 2018-19,Please refer Tender documents. ,NA ,"1,79,07,464",Civil Works,NA ,Tender,180.0,60.0,Dibrugarh,786005.0,NA ,NA ,NA ,Dibrugarh,No ,No,Department of Water Resources||Chief Engineer - DoWR,DIB/SDRF/2018-19/AGHUNIBARI/1,2019_DoWR_11290_1,Yes,Open Tender,Works,Works,3.0,No,No,Offline,No,No,No,AOC,"Addl. Chief Engineer, Upper Assam Zone, Water Resources Department, Dibrugarh",Internal,"Dy. Director, Design and Planning, Dibrugarh, AEE, Office of the Addl. Chief Engineer, UAZ, WRD, Dibrugarh, Accounts Officer, Dibrugarh WRD, DBR",Joy Sekhar Chakraborty,08-Mar-2019 04:32 PM,finsummary_17951.pdf (754.57 KB),"Addl. Chief Engineer, Upper Assam Zone, Water Resources Department, Dibrugarh",Internal,"Dy. Director, Design and Planning, Dibrugarh, AEE, Office of the Addl. Chief Engineer, UAZ, WRD, Dibrugarh, Accounts Officer, Dibrugarh WRD, DBR",Shamim Akhtar Laskar,08-Mar-2019 04:19 PM,08-Mar-2019 04:20 PM,techsummary_17951.pdf (754.60 KB),1,53536,BIJAY KUMAR SWAMI RAJEEB KUMAR GOGOI-JV,31-Jan-2019 07:12 PM,Accepted-AOC,Proper,21-Sep-2019 10:08 AM,Finance,Updated CS may be prepared,Joy Sekhar Chakraborty,08-Mar-2019 04:29 PM,finance_17951.pdf,BOQ Comparative Chart,1.0,53475.0,Manjur Hussain Ansari,INR,5354170.0,Department of Water Resources||Chief Engineer - DoWR,2019_DoWR_11290_1,DIB/SDRF/2018-19/AGHUNIBARI/1,Immediate measures to Dehing Bund L/B from Aghunibari to Sessughat at 71st Km for 2018-19,Technical,Financial Bid of the successful bidders may be opened.,Shamim Akhtar Laskar,08-Mar-2019 04:18 PM,technical_17951.pdf,21-Sep-2019,INR 17907463.52,60.0,Joy Sekhar Chakraborty,21-Sep-2019 10:08 AM,aghunibaritosessughat.pdf (8250.00 KB),Immediate measures to Dehing Bund L/B from Aghunibari to Sessughat at 71st Km for 2018-19,AOC
2.0,PreQual/Technical,.pdf,Technical Documents,,,,,,,,,,,,,,,,,,,,,,2.0,BC - Bankers Cheque,,,,,,,,,,,,,,,,,,,,,,,,,,,,,,,,,AOC,,,,,,,,,,,,,,2,53595,BOLIN DOWERAH,31-Jan-2019 03:20 PM,Rejected-AOC,Not qualified for AOC,21-Sep-2019 10:08 AM,,,,,,,2.0,53490.0,SURESH KUMAR AGARWALLA ROYAL TRADING TRIBENI DAS - JV,INR,5378101.0,,,,,,,,,,,,,,,,,AOC
3.0,Finance,.xls,BOQ,,,,,,,,,,,,,,,,,,,,,,3.0,BG - Bank Guarantee Irrevocable,,,,,,,,,,,,,,,,,,,,,,,,,,,,,,,,,AOC,,,,,,,,,,,,,,3,53475,Manjur Hussain Ansari,30-Jan-2019 07:30 PM,Accepted-AOC,Proper,21-Sep-2019 10:08 AM,,,,,,,3.0,53536.0,BIJAY KUMAR SWAMI RAJEEB KUMAR GOGOI-JV,INR,5383551.0,,,,,,,,,,,,,,,,,AOC
,,,,,,,,,,,,,,,,,,,,,,,,,4.0,FDR - Fixed Deposit Receipt,,,,,,,,,,,,,,,,,,,,,,,,,,,,,,,,,AOC,,,,,,,,,,,,,,4,53685,RANJAN DUTTA,31-Jan-2019 10:43 PM,Rejected-AOC,Not qualified for AOC,21-Sep-2019 10:08 AM,,,,,,,,,,,,,,,,,,,,,,,,,,,,AOC
,,,,,,,,,,,,,,,,,,,,,,,,,5.0,DCR - Deposit at call receipt,,,,,,,,,,,,,,,,,,,,,,,,,,,,,,,,,AOC,,,,,,,,,,,,,,5,53447,SARJUG SAH,30-Jan-2019 02:51 PM,Rejected-AOC,Not qualified for AOC,21-Sep-2019 10:08 AM,,,,,,,,,,,,,,,,,,,,,,,,,,,,AOC
,,,,,,,,,,,,,,,,,,,,,,,,,,,,,,,,,,,,,,,,,,,,,,,,,,,,,,,,,,,AOC,,,,,,,,,,,,,,6,53490,SURESH KUMAR AGARWALLA ROYAL TRADING TRIBENI DAS - JV,31-Jan-2019 06:38 PM,Accepted-AOC,Proper,21-Sep-2019 10:08 AM,,,,,,,,,,,,,,,,,,,,,,,,,,,,AOC
