Committee Chairperson/Co-ordinator Name :,Committee Chairperson/Co-ordinator Type :,Committee Members :,Updated By :,Updated on :,Document :,Organisation Chain :,Tender ID :,Tender Ref No :,Tender Title :,Contract Date :,Contract Value :,Work Completion Period in days :,Updated By :.1,Updated on :.1,AOC document :,AOC Description :,S.No,Bid Number,Bidder Name,Awarded Currency,Awarded Value,Committee Chairperson/Co-ordinator Name :.1,Committee Chairperson/Co-ordinator Type :.1,Committee Members :.1,Updated By :.2,Updated On :,Financial Bid Opening Date:,Document :.1,Type :,Summary :,Updated By :.3,Updated On :.1,Document :.2,S.No.1,Bid Number.1,Bidder Name.1,Submitted Date,Status,Remarks,Status Updated On,Type :.1,Summary :.1,Updated By :.4,Updated On :.2,Document :.3,BOQ Comparative Chart :,Tender Stage,Name,Address,Tender Fee in ₹,Fee Payable To,Fee Payable At,Tender Fee Exemption Allowed,S.No,Instrument Type,EMD Amount in ₹,EMD Exemption Allowed,EMD Fee Type,EMD Percentage,EMD Payable To,EMD Payable At,Publish Date,Bid Opening Date,Document Download / Sale Start Date,Document Download / Sale End Date,Clarification Start Date,Clarification End Date,Bid Submission Start Date,Bid Submission End Date,Financial Bid Opening Date,Cover No,Cover,Document Type,Description,Title,Work Description,Pre Qualification Details,Independent External Monitor/Remarks,Tender Value in ₹,Product Category,Sub category,Contract Type,Bid Validity(Days),Period Of Work(Days),Location,Pincode,Pre Bid Meeting Place,Pre Bid Meeting Address,Pre Bid Meeting Date,Bid Opening Place,Should Allow NDA Tender,Allow Preferential Bidder,Organisation Chain,Tender Reference Number,Tender ID,Withdrawal Allowed,Tender Type,Form of contract,Tender Category,No. of Covers,General Technical Evaluation Allowed,ItemWise Technical Evaluation Allowed,Payment Mode,Is Multi Currency Allowed For BOQ,Is Multi Currency Allowed For Fee,Allow Two Stage Bidding,Tender Stage
Er Vijay Kumar Sharma,Internal,"Er Vinod Sharma, Chander Mohan, Raj Kumar and RS Guleria",Vijay kumar Sharma,03-Dec-2021 03:08 PM,finsummary_80693.pdf (47.90 KB),Dr. Yashwant Singh Parmar University of Horticulture and Forestry,2021_YSPU_53306_2,UHF/Const.1/Partfile/2021/- 1787 dt 08-11-21,"Providing solar fencing in Majgoan Nursery for the Deptt. of SAF at Dr YSP University of Horticulture and Forestry, Nauni Solan.",23-Dec-2021,"INR 523,906",120.0,Vijay kumar Sharma,03-Feb-2022 04:45 PM,SaFfencingnrsy.pdf (561.00 KB),"Providing solar fencing in Majgoan Nursery for the Deptt. of SAF at Dr YSP University of Horticulture and Forestry, Nauni Solan.",1.0,246820.0,rajneesh katna,INR,"523,905",Er Vijay Kumar Sharma,Internal,"Er Vinod Sharma, Chander Mohan, RS Guleria and Raj Kumar",Vijay kumar Sharma,03-Dec-2021 02:40 PM,03-Dec-2021 02:45 PM,techsummary_80693.pdf (47.64 KB),Technical,"Three nos. bids received online, but only two bidders have submitted their documents physically. Hence, committee decided to admit two nos. bids and rejected the one bid for not submitting the documents physically on schedule date and time.",Vinod Kumar,03-Dec-2021 02:38 PM,technical_80693.pdf,1.0,246820.0,rajneesh katna,02-Dec-2021 02:19 PM,Accepted-AOC,L1,03-Feb-2022 04:45 PM,Finance,"Between two tenders Sh. Rajneesh Katna S/o Sh. Ram Prakash Katna R/o Ram Niwas (Ward no. 10), officer colony near DIET, Kotla nala Solan Distt. Solan is the lowest bidder as per comparative statement.",Vinod Kumar,03-Dec-2021 03:04 PM,finance_80693.pdf,BOQ Comparative Chart,AOC,EE Design,"o/o the EO, Dr YSP UHF Nauni, Solan HP","1,000",EE Design,"Dr YSP UHF Nauni, Solan HP",No,1.0,DD - Demand Draft,"11,000",No,fixed,,EE Design,"Dr YSP UHF Nauni, Solan HP",23-Nov-2021 05:00 PM,03-Dec-2021 11:00 AM,23-Nov-2021 05:30 PM,03-Dec-2021 09:30 AM,NA ,NA ,23-Nov-2021 05:30 PM,03-Dec-2021 09:30 AM,03-Dec-2021 02:45 PM,1.0,Fee/PreQual/Technical,.pdf,Tender Cost in shape of DD,"Providing solar fencing in Majgoan Nursery for the Deptt. of SAF at Dr YSP University of Horticulture and Forestry, Nauni Solan.","Providing solar fencing in Majgoan Nursery for the Deptt. of SAF at Dr YSP University of Horticulture and Forestry, Nauni Solan.",Please refer Tender documents. ,NA ,"5,41,913",Civil Works,NA ,Tender,90.0,120.0,"Nauni, Solan",173230.0,NA ,NA ,NA ,"Nauni, Solan",No ,No,Dr. Yashwant Singh Parmar University of Horticulture and Forestry,UHF/Const.1/Partfile/2021/- 1787 dt 08-11-21,2021_YSPU_53306_2,Yes,Open Tender,Item Rate,Works,2.0,No,No,Offline,No,No,No,AOC
,,,,,,,,,,,,,,,,,,,,,,,,,,,,,,,,,,2.0,245727.0,Ravinder Kumar,28-Nov-2021 07:55 PM,Rejected-AOC,L2,03-Feb-2022 04:45 PM,,,,,,,AOC,,,,,,,2.0,FDR - Fixed Deposit,,,,,,,,,,,,,,,,,,.pdf,Earnest Money in shape of FDR,,,,,,,,,,,,,,,,,,,,,,,,,,,,,,,,,AOC
,,,,,,,,,,,,,,,,,,,,,,,,,,,,,,,,,,3.0,246012.0,Vikrant Sharma,29-Nov-2021 09:03 PM,Not Admitted-Fee/PreQual/Technical,Not Complied with technical specification,03-Dec-2021 02:38 PM,,,,,,,AOC,,,,,,,,,,,,,,,,,,,,,,,,,,.pdf,Registration Certificate,,,,,,,,,,,,,,,,,,,,,,,,,,,,,,,,,AOC
,,,,,,,,,,,,,,,,,,,,,,,,,,,,,,,,,,,,,,,,,,,,,,,AOC,,,,,,,,,,,,,,,,,,,,,,,,,,.pdf,PAN and GST,,,,,,,,,,,,,,,,,,,,,,,,,,,,,,,,,AOC
,,,,,,,,,,,,,,,,,,,,,,,,,,,,,,,,,,,,,,,,,,,,,,,AOC,,,,,,,,,,,,,,,,,,,,,,,,,,.pdf,Tender Document duly signed by the Contractor,,,,,,,,,,,,,,,,,,,,,,,,,,,,,,,,,AOC
,,,,,,,,,,,,,,,,,,,,,,,,,,,,,,,,,,,,,,,,,,,,,,,AOC,,,,,,,,,,,,,,,,,,,,,,,,2.0,Finance,.xls,Bid Document,,,,,,,,,,,,,,,,,,,,,,,,,,,,,,,,,AOC
