Organisation Chain :,Tender ID :,Tender Ref No :,Tender Title :,S.No,Bid Number,Bidder Name,Awarded Currency,Awarded Value,Committee Chairperson/Co-ordinator Name :,Committee Chairperson/Co-ordinator Type :,Committee Members :,Updated By :,Updated on :,Document :,Type :,Summary :,Updated By :.1,Updated On :,Document :.1,BOQ Comparative Chart :,Type :.1,Summary :.1,Updated By :.2,Updated On :.1,Document :.2,Contract Date :,Contract Value :,Work Completion Period in days :,Updated By :.3,Updated on :.1,AOC document :,AOC Description :,Committee Chairperson/Co-ordinator Name :.1,Committee Chairperson/Co-ordinator Type :.1,Committee Members :.1,Updated By :.4,Updated On :.2,Financial Bid Opening Date:,Document :.3,S.No.1,Bid Number.1,Bidder Name.1,Submitted Date,Status,Remarks,Status Updated On,Tender Stage,Title,Work Description,Pre Qualification Details,Independent External Monitor/Remarks,Tender Value in ₹,Product Category,Sub category,Contract Type,Bid Validity(Days),Period Of Work(Days),Location,Pincode,Pre Bid Meeting Place,Pre Bid Meeting Address,Pre Bid Meeting Date,Bid Opening Place,Should Allow NDA Tender,Allow Preferential Bidder,EMD Amount in ₹,EMD Exemption Allowed,EMD Fee Type,EMD Percentage,EMD Payable To,EMD Payable At,S.No,Instrument Type,Cover No,Cover,Document Type,Description,Publish Date,Bid Opening Date,Document Download / Sale Start Date,Document Download / Sale End Date,Clarification Start Date,Clarification End Date,Bid Submission Start Date,Bid Submission End Date,Financial Bid Opening Date,S.No.1,Corrigendum Title,Corrigendum Type,View,Tender Fee in ₹,Fee Payable To,Fee Payable At,Tender Fee Exemption Allowed,Name,Address,Organisation Chain,Tender Reference Number,Tender ID,Withdrawal Allowed,Tender Type,Form of contract,Tender Category,No. of Covers,General Technical Evaluation Allowed,ItemWise Technical Evaluation Allowed,Payment Mode,Is Multi Currency Allowed For BOQ,Is Multi Currency Allowed For Fee,Allow Two Stage Bidding,Tender Stage
Directorate of Urban Development||Urban Development - UDDHP||Municipal Council Una - UDDHP,2020_UDDHP_39039_4,MCU/E-TENDER/2020/1444-1449 DATED 16/07/2020,c/o street from MC street towards h/o Harvinder Patwari Moh. Govind Nagar W.no. 1 MC Una.,1.0,171030.0,MANI GOVT. CONTRACTOR,INR,"635,838",Sh AS Bedi,Internal,EO AE JE,Ashwani Kumar,11-Aug-2020 02:00 PM,finsummary_57612.pdf (179.21 KB),Finance,Three no. financial bids found correct,Rajinder Kumar,11-Aug-2020 01:52 PM,finance_57612.pdf,BOQ Comparative Chart,Technical,Three nos bids recieved and three nos have been qulaified technicla documnets,Rajinder Kumar,11-Aug-2020 01:27 PM,technical_57612.pdf,30-Sep-2020,"INR 417,113",90.0,Ashwani Kumar,14-Feb-2022 12:16 PM,AOCO1.pdf (1088.00 KB),AOC,President Sh AS Bedi,Internal,EO AE JE,Rajinder Kumar,11-Aug-2020 01:29 PM,11-Aug-2020 01:30 PM,techsummary_57612.pdf (177.26 KB),1.0,171030.0,MANI GOVT. CONTRACTOR,01-Aug-2020 03:18 PM,Accepted-AOC,Being lowest Note-Offline AOC already awarded On line late.,14-Feb-2022 12:16 PM,AOC,c/o street from MC street towards h/o Harvinder Patwari Moh. Govind Nagar W.no. 1 MC Una.,c/o street from MC street towards h/o Harvinder Patwari Moh. Govind Nagar W.no. 1 MC Una.,Please refer Tender documents. ,NA ,"4,17,113",Civil Works,NA ,Rate Contract,90.0,90.0,ward no. 1,174303.0,NA ,NA ,NA ,"O/o The Assistant Engineer, Municipal Council Una",No ,No,"8,400",No,fixed,,"Executive Officer, MC Una",Una,1.0,DD - Demand Draft,1.0,Fee/PreQual/Technical,.pdf,EMD (in shape of FDR),18-Jul-2020 09:00 AM,05-Aug-2020 01:00 PM,18-Jul-2020 09:00 AM,04-Aug-2020 06:00 PM,NA ,NA ,18-Jul-2020 01:00 PM,04-Aug-2020 06:00 PM,11-Aug-2020 01:30 PM,1.0,Due Date Extended,Admin Corrigendum Date Extend,,500.0,"Executive Officer, MC Una",Una,No,"Assistant Engineer, Municipal Council Una",O/o Municipal Council Una Distt Una HP,Directorate of Urban Development||Urban Development - UDDHP||Municipal Council Una - UDDHP,MCU/E-TENDER/2020/1444-1449 DATED 16/07/2020,2020_UDDHP_39039_4,Yes,Open Tender,Item Rate,Works,2.0,No,No,Offline,No,No,No,AOC
,,,,,,,,,,,,,,,,,,,,,,,,,,,,,,,,,,,,,,,,2.0,171045.0,ROBIN SHARMA GOVT. CONTRACTOR,01-Aug-2020 04:46 PM,Rejected-Finance,DUE TO HIGHER RATE,11-Aug-2020 02:00 PM,AOC,,,,,,,,,,,,,,,,,,,,,,,,,2.0,FDR - Fixed Deposit,,,.pdf,Tender Fee (in shape of DD),,,,,,,,,,,,,,,,,,,,,,,,,,,,,,,,,,AOC
,,,,,,,,,,,,,,,,,,,,,,,,,,,,,,,,,,,,,,,,3.0,171052.0,Varun Puri govt. Contractor,02-Aug-2020 03:47 PM,Rejected-Finance,DUE TO HIGHER RATE,11-Aug-2020 02:00 PM,AOC,,,,,,,,,,,,,,,,,,,,,,,,,,,,,.pdf,"CONTRACTOR REGISTRATION (HPPWD,IPH HP,CPWD, UD HP)",,,,,,,,,,,,,,,,,,,,,,,,,,,,,,,,,,AOC
,,,,,,,,,,,,,,,,,,,,,,,,,,,,,,,,,,,,,,,,,,,,,,,AOC,,,,,,,,,,,,,,,,,,,,,,,,,,,,,.pdf,"GST, PAN copy",,,,,,,,,,,,,,,,,,,,,,,,,,,,,,,,,,AOC
,,,,,,,,,,,,,,,,,,,,,,,,,,,,,,,,,,,,,,,,,,,,,,,AOC,,,,,,,,,,,,,,,,,,,,,,,,,,,,,.pdf,EPF Reg,,,,,,,,,,,,,,,,,,,,,,,,,,,,,,,,,,AOC
,,,,,,,,,,,,,,,,,,,,,,,,,,,,,,,,,,,,,,,,,,,,,,,AOC,,,,,,,,,,,,,,,,,,,,,,,,,,,,,.pdf,Experience Certificate-2 no.s works eg similar kinds of work,,,,,,,,,,,,,,,,,,,,,,,,,,,,,,,,,,AOC
,,,,,,,,,,,,,,,,,,,,,,,,,,,,,,,,,,,,,,,,,,,,,,,AOC,,,,,,,,,,,,,,,,,,,,,,,,,,,,,.pdf,Affidavit-start work within time or complete well in time otherwise EMD Forfieted by MC,,,,,,,,,,,,,,,,,,,,,,,,,,,,,,,,,,AOC
,,,,,,,,,,,,,,,,,,,,,,,,,,,,,,,,,,,,,,,,,,,,,,,AOC,,,,,,,,,,,,,,,,,,,,,,,,,,,2.0,Finance,.xls,BOQ,,,,,,,,,,,,,,,,,,,,,,,,,,,,,,,,,,AOC
