Publish Date,Bid Opening Date,Document Download / Sale Start Date,Document Download / Sale End Date,Clarification Start Date,Clarification End Date,Bid Submission Start Date,Bid Submission End Date,Financial Bid Opening Date,Tender Fee in ₹,Fee Payable To,Fee Payable At,Tender Fee Exemption Allowed,Cover No,Cover,Document Type,Description,EMD Amount in ₹,EMD Exemption Allowed,EMD Fee Type,EMD Percentage,EMD Payable To,EMD Payable At,Organisation Chain,Tender Reference Number,Tender ID,Withdrawal Allowed,Tender Type,Form of contract,Tender Category,No. of Covers,General Technical Evaluation Allowed,ItemWise Technical Evaluation Allowed,Payment Mode,Is Multi Currency Allowed For BOQ,Is Multi Currency Allowed For Fee,Allow Two Stage Bidding,Title,Work Description,Pre Qualification Details,Independent External Monitor/Remarks,Tender Value in ₹,Product Category,Sub category,Contract Type,Bid Validity(Days),Period Of Work(Days),Location,Pincode,Pre Bid Meeting Place,Pre Bid Meeting Address,Pre Bid Meeting Date,Bid Opening Place,Should Allow NDA Tender,Allow Preferential Bidder,Name,Address,S.No,Instrument Type,Tender Stage,S.No,Bid Number,Bidder Name,Awarded Currency,Awarded Value,Type :,Summary :,Updated By :,Updated On :,Document :,BOQ Comparative Chart :,S.No.1,Bid Number.1,Bidder Name.1,Submitted Date,Status,Remarks,Status Updated On,Type :.1,Summary :.1,Updated By :.1,Updated On :.1,Document :.1,Organisation Chain :,Tender ID :,Tender Ref No :,Tender Title :,Committee Chairperson/Co-ordinator Name :,Committee Chairperson/Co-ordinator Type :,Committee Members :,Updated By :.2,Updated On :.2,Financial Bid Opening Date:,Document :.2,Committee Chairperson/Co-ordinator Name :.1,Committee Chairperson/Co-ordinator Type :.1,Committee Members :.1,Updated By :.3,Updated on :,Document :.3,Contract Date :,Contract Value :,Work Completion Period in days :,Updated By :.4,Updated on :.1,AOC document :,AOC Description :,Tender Stage
17-Nov-2021 06:00 PM,30-Nov-2021 02:00 PM,17-Nov-2021 06:00 PM,29-Nov-2021 05:00 PM,NA ,NA ,17-Nov-2021 06:00 PM,29-Nov-2021 05:00 PM,06-Dec-2021 11:50 AM,350.0,Executive Engineer R B M C Shimla,Shimla,No,1.0,Fee/PreQual/Technical,.pdf,Cost of form in shape of DD and Earnest money in shape of FDR as per E procurement notice,"8,800",No,fixed,,Executive Engineer R B M C Shimla,Shimla,Municipal Corporation Shimla,3142Dated03112021,2021_MC_53696_17,Yes,Open Tender,Item Rate,Works,2.0,No,No,Offline,No,No,No,Repair and Maintenance of drain from NH to Block No 21 ward No 30 Kanghandhar (RD 0 0 to 0 300 mtr),Repair and Maintenance of drain from NH to Block No 21 ward No 30 Kanghandhar (RD 0 0 to 0 300 mtr),Please refer Tender Documents ,NA ,"4,39,194",Civil Works,NA ,Tender,120.0,60.0,Shimla,171001.0,NA ,NA ,NA ,MC Shimla,No ,No,Executive Engineer R B M C Shimla,Executive Engineer R B M C Shimla,1.0,DD - Demand Draft,AOC,1.0,245910.0,Mandeep Thakur,INR,"551,572",Finance,BOS,Gopesh Behl,06-Dec-2021 12:41 PM,finance_80427.pdf,BOQ Comparative Chart,1.0,245910.0,Mandeep Thakur,29-Nov-2021 04:49 PM,Accepted-AOC,Accepted due to lowest rates,21-Feb-2022 12:11 PM,Technical,BOS,Rajesh Thakur,06-Dec-2021 11:02 AM,technical_80427.pdf,Municipal Corporation Shimla,2021_MC_53696_17,3142Dated03112021,Repair and Maintenance of drain from NH to Block No 21 ward No 30 Kanghandhar (RD 0 0 to 0 300 mtr),EE,Internal,AGM SJPNL AO,Rajesh Thakur,06-Dec-2021 11:46 AM,06-Dec-2021 11:50 AM,techsummary_80427.pdf (2381.35 KB),EE,Internal,AGM SJPNL AO,Rajesh Thakur,21-Feb-2022 12:10 PM,finsummary_80427.pdf (294.95 KB),21-Feb-2022,"INR 551,572",60.0,Rajesh Thakur,21-Feb-2022 12:11 PM,2021_MC_53696_17.pdf (354.00 KB),AOC,AOC
,,,,,,,,,,,,,,,.pdf,Certificate of registration with HPPWD in appropriate class and latest renewal thereof,,,,,,,,,,,,,,,,,,,,,,,,,,,,,,,,,,,,,,,,,2.0,FDR - Fixed Deposit,AOC,,,,,,,,,,,,2.0,245497.0,Rakesh Kumar Pundir,26-Nov-2021 04:56 PM,Rejected-Finance,Rejected,21-Feb-2022 12:10 PM,,,,,,,,,,,,,,,,,,,,,,,,,,,,,,AOC
,,,,,,,,,,,,,,,.pdf,"Income Tax, GST and EPF registration PAN Permanent Account No and GST No",,,,,,,,,,,,,,,,,,,,,,,,,,,,,,,,,,,,,,,,,,,AOC,,,,,,,,,,,,,,,,,,,,,,,,,,,,,,,,,,,,,,,,,,,,,,,,AOC
,,,,,,,,,,,,,,,.pdf,Scanned copy of Tender Document i.e. NIT (E-procurement notice) and Form MW-7 duly signed,,,,,,,,,,,,,,,,,,,,,,,,,,,,,,,,,,,,,,,,,,,AOC,,,,,,,,,,,,,,,,,,,,,,,,,,,,,,,,,,,,,,,,,,,,,,,,AOC
,,,,,,,,,,,,,,,.pdf,Fill the Performa as per E-procurement Notice (It is Mandatory),,,,,,,,,,,,,,,,,,,,,,,,,,,,,,,,,,,,,,,,,,,AOC,,,,,,,,,,,,,,,,,,,,,,,,,,,,,,,,,,,,,,,,,,,,,,,,AOC
,,,,,,,,,,,,,,,.pdf,affidavit that contractor does not have more than two works in hand in the M C Shimla,,,,,,,,,,,,,,,,,,,,,,,,,,,,,,,,,,,,,,,,,,,AOC,,,,,,,,,,,,,,,,,,,,,,,,,,,,,,,,,,,,,,,,,,,,,,,,AOC
,,,,,,,,,,,,,2.0,Finance,.xls,BOQ,,,,,,,,,,,,,,,,,,,,,,,,,,,,,,,,,,,,,,,,,,,AOC,,,,,,,,,,,,,,,,,,,,,,,,,,,,,,,,,,,,,,,,,,,,,,,,AOC
