Tender Fee in ₹,Fee Payable To,Fee Payable At,Tender Fee Exemption Allowed,S.No,Bank Name,Publish Date,Bid Opening Date,Document Download / Sale Start Date,Document Download / Sale End Date,Clarification Start Date,Clarification End Date,Bid Submission Start Date,Bid Submission End Date,Financial Bid Opening Date,Name,Address,EMD Amount in ₹,EMD Exemption Allowed,EMD Fee Type,EMD Percentage,EMD Payable To,EMD Payable At,Title,Work Description,Pre Qualification Details,Independent External Monitor/Remarks,Tender Value in ₹,Product Category,Sub category,Contract Type,Bid Validity(Days),Period Of Work(Days),Location,Pincode,Pre Bid Meeting Place,Pre Bid Meeting Address,Pre Bid Meeting Date,Bid Opening Place,Should Allow NDA Tender,Allow Preferential Bidder,Cover No,Cover,Document Type,Description,Organisation Chain,Tender Reference Number,Tender ID,Withdrawal Allowed,Tender Type,Form of contract,Tender Category,No. of Covers,General Technical Evaluation Allowed,ItemWise Technical Evaluation Allowed,Payment Mode,Is Multi Currency Allowed For BOQ,Is Multi Currency Allowed For Fee,Allow Two Stage Bidding,Tender Stage,Committee Chairperson/Co-ordinator Name :,Committee Chairperson/Co-ordinator Type :,Committee Members :,Updated By :,Updated on :,Document :,Organisation Chain :,Tender ID :,Tender Ref No :,Tender Title :,S.No,Bid Number,Bidder Name,Awarded Currency,Awarded Value,Type :,Summary :,Updated By :.1,Updated On :,Document :.1,BOQ Comparative Chart :,Type :.1,Summary :.1,Updated By :.2,Updated On :.1,Document :.2,Contract Date :,Contract Value :,Work Completion Period in days :,Updated By :.3,Updated on :.1,AOC document :,AOC Description :,Committee Chairperson/Co-ordinator Name :.1,Committee Chairperson/Co-ordinator Type :.1,Committee Members :.1,Updated By :.4,Updated On :.2,Financial Bid Opening Date:,Document :.3,S.No.1,Bid Number.1,Bidder Name.1,Submitted Date,Status,Remarks,Status Updated On,Tender Stage
400.0,Executive Engineer Flood Prot. Division Gagret,Gagret,No,1.0,ICICI BANK,26-Oct-2021 06:00 PM,09-Nov-2021 12:30 PM,26-Oct-2021 06:00 PM,09-Nov-2021 11:00 AM,26-Oct-2021 06:00 PM ,09-Nov-2021 11:00 AM ,26-Oct-2021 06:00 PM,09-Nov-2021 11:00 AM,11-Nov-2021 03:30 PM,Executive Engineer Flood Prot. Division Gagret,Executive Engineer Flood Prot. Division Gagret,"58,915",Yes,fixed,,Executive Engineer Flood Prot. Division Gagret,Gagret,"Improvement of T/Well at Mandhwara (Near Barrier), T/well at Guglehar, Irrigation Scheme Andora Upper and Lower in Tehsil Amb Distt. Una (HP) (Under NABARD-XXVII)","Drilling, lowering of assembly and development of 2 Nos. T/well 140 mtrs. deep each i.e. T/well Andora 1st at Badoun-II and T/well at Upper Andora",As per NIT ,NA ,"34,27,630",Civil Works,NA ,Tender,120.0,90.0,Gagret,177201.0,NA ,NA ,NA ,Executive Engineer Flood Prot. Division Gagret,No ,No,1.0,Fee/PreQual/Technical,.pdf,Registration in HP JSV (IPH Department) as per NIT condition No. 11(I),HP Irrigation and Public Health||IPH Circle Swan River Flood Management Project Una - HPIPH||Flood Protection Gagret - HPIPH,GGT-UNA01-752 No. 5479-5578 dt 25.10.2021,2021_HPIPH_53125_1,Yes,Open Tender,Item Rate,Works,2.0,No,No,Both(Online/Offline),No,No,No,AOC,Er Arvind Sood,Internal,See the uploaded document,Parveen Kumar Sharma,11-Feb-2022 04:35 PM,finsummary_79448.pdf (43.95 KB),HP Irrigation and Public Health||IPH Circle Swan River Flood Management Project Una - HPIPH||Flood Protection Gagret - HPIPH,2021_HPIPH_53125_1,GGT-UNA01-752 No. 5479-5578 dt 25.10.2021,"Improvement of T/Well at Mandhwara (Near Barrier), T/well at Guglehar, Irrigation Scheme Andora Upper and Lower in Tehsil Amb Distt. Una (HP) (Under NABARD-XXVII)",1.0,241948.0,M/S Sharma Enterpirses,INR,"3,377,364",Finance,See the uploaded document,Parveen Kumar Sharma,11-Nov-2021 05:06 PM,finance_79448.pdf,BOQ Comparative Chart,Technical,See the uploaded document,Parveen Kumar Sharma,11-Nov-2021 12:09 PM,technical_79448.pdf,11-Feb-2022,"INR 3,377,364",90.0,Parveen Kumar Sharma,11-Feb-2022 04:39 PM,Award-Upper-Andora-Sharma.pdf (735.00 KB),See the uploaded document,Er Parveen Kumar Sharma,Internal,See the uploaded document,Parveen Kumar Sharma,11-Nov-2021 12:26 PM,11-Nov-2021 03:30 PM,techsummary_79448.pdf (44.83 KB),1.0,241803.0,M/S. Mast Ram Jaswal And Co.,09-Nov-2021 10:11 AM,Rejected-Finance,Higher amount quoted,11-Feb-2022 04:35 PM,AOC
,,,,2.0,ICICI NEFT/RTGS,,,,,,,,,,,,,,,,,,,,,,,,,,,,,,,,,,,,,,.pdf,Cost of tender documents and Earnest money as per NIT condition No. 11(ii),,,,,,,,,,,,,,,AOC,,,,,,,,,,,,,,,,,,,,,,,,,,,,,,,,,,,,,,,,,2.0,241948.0,M/S Sharma Enterpirses,09-Nov-2021 08:40 AM,Accepted-AOC,Lower amount quoted,11-Feb-2022 04:39 PM,AOC
,,,,,,,,,,,,,,,,,,,,,,,,,,,,,,,,,,,,,,,,,,,.pdf,Earnest money Exemption necessary undertaking as per NIT condition No. 11(iii),,,,,,,,,,,,,,,AOC,,,,,,,,,,,,,,,,,,,,,,,,,,,,,,,,,,,,,,,,,3.0,241444.0,popular pipes,09-Nov-2021 09:44 AM,Rejected-Finance,Higher amount quoted,11-Feb-2022 04:35 PM,AOC
,,,,,,,,,,,,,,,,,,,,,,,,,,,,,,,,,,,,,,,,,,,.pdf,"Income Tax, GST Regd No or their latest clearance certificate, copy of PAN as per NIT cond No.11(v)",,,,,,,,,,,,,,,AOC,,,,,,,,,,,,,,,,,,,,,,,,,,,,,,,,,,,,,,,,,4.0,241967.0,Vats Associates,09-Nov-2021 10:18 AM,Rejected-Finance,Higher amount quoted,11-Feb-2022 04:35 PM,AOC
,,,,,,,,,,,,,,,,,,,,,,,,,,,,,,,,,,,,,,,,,,,.pdf,Copy of latest return of GST or Clearance certificate as per NIT condition No. 11(v),,,,,,,,,,,,,,,AOC,,,,,,,,,,,,,,,,,,,,,,,,,,,,,,,,,,,,,,,,,,,,,,,,AOC
,,,,,,,,,,,,,,,,,,,,,,,,,,,,,,,,,,,,,,,,,,,.pdf,Undertaking as per NIT condition No. 11(vi),,,,,,,,,,,,,,,AOC,,,,,,,,,,,,,,,,,,,,,,,,,,,,,,,,,,,,,,,,,,,,,,,,AOC
,,,,,,,,,,,,,,,,,,,,,,,,,,,,,,,,,,,,,,,,,,,.pdf,Copy of EPF as per NIT condition No. 11(vii),,,,,,,,,,,,,,,AOC,,,,,,,,,,,,,,,,,,,,,,,,,,,,,,,,,,,,,,,,,,,,,,,,AOC
,,,,,,,,,,,,,,,,,,,,,,,,,,,,,,,,,,,,,,,,,,,.pdf,Copy of Certificate regarding State Ground Water Authority as per NIT condition No. 11(viii),,,,,,,,,,,,,,,AOC,,,,,,,,,,,,,,,,,,,,,,,,,,,,,,,,,,,,,,,,,,,,,,,,AOC
,,,,,,,,,,,,,,,,,,,,,,,,,,,,,,,,,,,,,,,,,2.0,Finance,.xls,Financial bid,,,,,,,,,,,,,,,AOC,,,,,,,,,,,,,,,,,,,,,,,,,,,,,,,,,,,,,,,,,,,,,,,,AOC
