Committee Chairperson/Co-ordinator Name :,Committee Chairperson/Co-ordinator Type :,Committee Members :,Updated By :,Updated On :,Financial Bid Opening Date:,Document :,S.No,Bid Number,Bidder Name,Submitted Date,Status,Remarks,Status Updated On,Type :,Summary :,Updated By :.1,Updated On :.1,Document :.1,BOQ Comparative Chart :,Type :.1,Summary :.1,Updated By :.2,Updated On :.2,Document :.2,Contract Date :,Contract Value :,Work Completion Period in days :,Updated By :.3,Updated on :,AOC document :,AOC Description :,S.No.1,Bid Number.1,Bidder Name.1,Awarded Currency,Awarded Value,Organisation Chain :,Tender ID :,Tender Ref No :,Tender Title :,Committee Chairperson/Co-ordinator Name :.1,Committee Chairperson/Co-ordinator Type :.1,Committee Members :.1,Updated By :.4,Updated on :.1,Document :.3,Tender Stage,S.No,Bank Name,Title,Work Description,Pre Qualification Details,Independent External Monitor/Remarks,Tender Value in ₹,Product Category,Sub category,Contract Type,Bid Validity(Days),Period Of Work(Days),Location,Pincode,Pre Bid Meeting Place,Pre Bid Meeting Address,Pre Bid Meeting Date,Bid Opening Place,Should Allow NDA Tender,Allow Preferential Bidder,Tender Fee in ₹,Fee Payable To,Fee Payable At,Tender Fee Exemption Allowed,Organisation Chain,Tender Reference Number,Tender ID,Withdrawal Allowed,Tender Type,Form of contract,Tender Category,No. of Covers,General Technical Evaluation Allowed,ItemWise Technical Evaluation Allowed,Payment Mode,Is Multi Currency Allowed For BOQ,Is Multi Currency Allowed For Fee,Allow Two Stage Bidding,Name,Address,Publish Date,Bid Opening Date,Document Download / Sale Start Date,Document Download / Sale End Date,Clarification Start Date,Clarification End Date,Bid Submission Start Date,Bid Submission End Date,Financial Bid Opening Date,Cover No,Cover,Document Type,Description,EMD Amount in ₹,EMD Exemption Allowed,EMD Fee Type,EMD Percentage,EMD Payable To,EMD Payable At,Tender Stage
Er. Sanjay Thakur,Internal,Sh. Andesh Kumar (JOA) Tender Asstt. 2 Smt. Indra Devi Supdt. 3 Rattan Chand D.A.O 4 Narender Thakur,Sanjay Kumar,03-Feb-2020 10:23 AM,03-Feb-2020 10:30 AM,techsummary_48745.pdf (419.39 KB),1.0,145282.0,GANTANTAR THAKUR,17-Jan-2020 10:53 AM,Not Admitted-Fee/PreQual/Technical,Not Complied with technical specification,03-Feb-2020 10:21 AM,Finance,BOQ and comparative statement download successfully.,Sanjay Kumar,08-Feb-2020 12:01 PM,finance_48745.pdf,BOQ Comparative Chart,Technical,Five bidder successfully verify and one bidder rejected as per NIT conditions.,Sanjay Kumar,03-Feb-2020 10:21 AM,technical_48745.pdf,15-Jul-2020,"INR 4,692,676.18",365.0,Sanjay Kumar,26-Oct-2020 03:08 PM,HPIPH33836.pdf (191.00 KB),Work Awarded to M/S MNBN Enterprises,1.0,144903.0,MNBN Enterprises,INR,"4,692,676","HP Irrigation and Public Health||Dharamshala Circle,Irrigation and Public Health,HP||Palampur,Irrigation and Public Health,HP",2020_HPIPH_33836_1,16505-45 dt 02/01/2020,Construction of lift irrigation scheme Sakri Deora Kathak in Tehsil Baijnath District Kangra HP,Er. Sanjay Thakur,Internal,Sh. Andesh Kumar (JOA) Tender Asstt. 2 Smt. Indra Devi Supdt. 3 Rattan Chand D.A.O 4 Narender Thakur,Sanjay Kumar,08-Feb-2020 12:14 PM,finsummary_48745.pdf (73.56 KB),AOC,1.0,ICICI BANK,Construction of lift irrigation scheme Sakri Deora Kathak in Tehsil Baijnath District Kangra HP,"SH _Laying , Jointing and testing of MSERW pipe of 200 mm dia Rising Main, Supply and erection of Submersible pumping machinery Stage-Ist and Centrifugal pumping machinery Stage-2nd.",Please refer Tender documents. ,NA ,"35,56,389",Civil Works,NA ,Tender,120.0,365.0,Palampur,176061.0,NA ,NA ,NA ,"IPH Division, Palampur",No ,No,800.0,"IPH Division, Palampur","Executive Engineer, IPH Division, Palampur",No,"HP Irrigation and Public Health||Dharamshala Circle,Irrigation and Public Health,HP||Palampur,Irrigation and Public Health,HP",16505-45 dt 02/01/2020,2020_HPIPH_33836_1,Yes,Open Tender,Item Rate,Works,2.0,No,No,Online,No,No,No,"Executive Engineer,","IPH Division, Palampur",02-Jan-2020 06:55 PM,17-Jan-2020 11:30 AM,02-Jan-2020 06:55 PM,17-Jan-2020 11:00 AM,NA ,NA ,02-Jan-2020 06:55 PM,17-Jan-2020 11:00 AM,03-Feb-2020 10:30 AM,1.0,Fee/PreQual/Technical,.pdf,i) Scan copy of deduction of Earnest money and cost of tender,"60,850",Yes,fixed,,"IPH Division, Palampur","Executive Engineer, IPH Division, Palampur",AOC
,,,,,,,2.0,144903.0,MNBN Enterprises,16-Jan-2020 06:26 PM,Accepted-AOC,Lowest one,26-Oct-2020 03:10 PM,,,,,,,,,,,,,,,,,,,,,,,,,,,,,,,,,,AOC,2.0,ICICI NEFT/RTGS,,,,,,,,,,,,,,,,,,,,,,,,,,,,,,,,,,,,,,,,,,,,,,,,,,.pdf,ii) Certificate of registration with IPH Department in appropriate class and latest renewal thereof.,,,,,,,AOC
,,,,,,,3.0,144769.0,Naik Electrical Works,15-Jan-2020 11:23 AM,Rejected-AOC,High rate quoted,26-Oct-2020 03:10 PM,,,,,,,,,,,,,,,,,,,,,,,,,,,,,,,,,,AOC,,,,,,,,,,,,,,,,,,,,,,,,,,,,,,,,,,,,,,,,,,,,,,,,,,,,.pdf,iii) Income tax/GST / EPF registration,,,,,,,AOC
,,,,,,,4.0,145104.0,Pawan Virmani,16-Jan-2020 06:39 AM,Rejected-AOC,High rate quoted,26-Oct-2020 03:10 PM,,,,,,,,,,,,,,,,,,,,,,,,,,,,,,,,,,AOC,,,,,,,,,,,,,,,,,,,,,,,,,,,,,,,,,,,,,,,,,,,,,,,,,,,,.pdf,iv) Contractor must have experience of executing work of similar nature as per NIT conditions.,,,,,,,AOC
,,,,,,,5.0,145107.0,SANJAY SAINI,15-Jan-2020 10:10 PM,Rejected-AOC,High rate quoted,26-Oct-2020 03:10 PM,,,,,,,,,,,,,,,,,,,,,,,,,,,,,,,,,,AOC,,,,,,,,,,,,,,,,,,,,,,,,,,,,,,,,,,,,,,,,,,,,,,,,,,,,.pdf,v) If contractor upload exemption of earnest money contractor have to give affidavit that not used,,,,,,,AOC
,,,,,,,6.0,145285.0,SG Engineers and Consultants,17-Jan-2020 10:29 AM,Rejected-AOC,High rate quoted,26-Oct-2020 03:10 PM,,,,,,,,,,,,,,,,,,,,,,,,,,,,,,,,,,AOC,,,,,,,,,,,,,,,,,,,,,,,,,,,,,,,,,,,,,,,,,,,,,,,,,,,,.pdf,vi) Affidavit that he have not two uncompleted work in hand and personal visit site,,,,,,,AOC
,,,,,,,,,,,,,,,,,,,,,,,,,,,,,,,,,,,,,,,,,,,,,,,AOC,,,,,,,,,,,,,,,,,,,,,,,,,,,,,,,,,,,,,,,,,,,,,,,,,,,,.pdf,vii) Contractor must ensure to upload the award letter (without revised schedule of quantity) of whi,,,,,,,AOC
,,,,,,,,,,,,,,,,,,,,,,,,,,,,,,,,,,,,,,,,,,,,,,,AOC,,,,,,,,,,,,,,,,,,,,,,,,,,,,,,,,,,,,,,,,,,,,,,,,,,2.0,Finance,.pdf,Form 6 duly singed,,,,,,,AOC
,,,,,,,,,,,,,,,,,,,,,,,,,,,,,,,,,,,,,,,,,,,,,,,AOC,,,,,,,,,,,,,,,,,,,,,,,,,,,,,,,,,,,,,,,,,,,,,,,,,,,,.xls,BOQ,,,,,,,AOC
