Organisation Chain,Tender Reference Number,Tender ID,Withdrawal Allowed,Tender Type,Form of contract,Tender Category,No. of Covers,General Technical Evaluation Allowed,ItemWise Technical Evaluation Allowed,Payment Mode,Is Multi Currency Allowed For BOQ,Is Multi Currency Allowed For Fee,Allow Two Stage Bidding,S.No,Bank Name,EMD Amount in ₹,EMD Exemption Allowed,EMD Fee Type,EMD Percentage,EMD Payable To,EMD Payable At,Tender Fee in ₹,Fee Payable To,Fee Payable At,Tender Fee Exemption Allowed,Publish Date,Bid Opening Date,Document Download / Sale Start Date,Document Download / Sale End Date,Clarification Start Date,Clarification End Date,Bid Submission Start Date,Bid Submission End Date,Financial Bid Opening Date,Title,Work Description,Pre Qualification Details,Independent External Monitor/Remarks,Tender Value in ₹,Product Category,Sub category,Contract Type,Bid Validity(Days),Period Of Work(Days),Location,Pincode,Pre Bid Meeting Place,Pre Bid Meeting Address,Pre Bid Meeting Date,Bid Opening Place,Should Allow NDA Tender,Allow Preferential Bidder,Name,Address,Cover No,Cover,Document Type,Description,Tender Stage,Contract Date :,Contract Value :,Work Completion Period in days :,Updated By :,Updated on :,AOC document :,AOC Description :,Type :,Summary :,Updated By :.1,Updated On :,Document :,BOQ Comparative Chart :,Type :.1,Summary :.1,Updated By :.2,Updated On :.1,Document :.1,Committee Chairperson/Co-ordinator Name :,Committee Chairperson/Co-ordinator Type :,Committee Members :,Updated By :.3,Updated On :.2,Financial Bid Opening Date:,Document :.2,S.No,Bid Number,Bidder Name,Submitted Date,Status,Remarks,Status Updated On,Committee Chairperson/Co-ordinator Name :.1,Committee Chairperson/Co-ordinator Type :.1,Committee Members :.1,Updated By :.4,Updated on :.1,Document :.3,S.No.1,Bid Number.1,Bidder Name.1,Awarded Currency,Awarded Value,Organisation Chain :,Tender ID :,Tender Ref No :,Tender Title :,Tender Stage
"HP Irrigation and Public Health||Dharamshala Circle,Irrigation and Public Health,HP||Palampur,Irrigation and Public Health,HP",5372-5420 dt 29/7/2020,2020_HPIPH_39397_1,Yes,Open Tender,Item Rate,Works,2.0,No,No,Online,No,No,No,1.0,ICICI BANK,"42,660",Yes,fixed,,Executive Engineer,JSD Palampur,400.0,Executive Engineer,JSD Palampur,No,29-Jul-2020 06:00 PM,05-Aug-2020 11:30 AM,29-Jul-2020 06:00 PM,05-Aug-2020 11:00 AM,NA ,NA ,29-Jul-2020 06:00 PM,05-Aug-2020 11:00 AM,06-Aug-2020 04:15 PM,Improvement of water supply scheme for house hold connection to PC habitation Kothi Pahra and Kasba Jugehar in Tehsil Palampur District Kangra(HP),"SH_Drilling, lowering assembly and development of 1 Nos tube well 80 metre deep at Chandropa near Community hall Chandropa",Please refer Tender documents. ,NA ,"11,71,905",Civil Works,NA ,Tender,120.0,90.0,Palampur,176061.0,NA ,NA ,NA ,Jal Shakti Division Palampur,No ,No,Executive Engineer,Jal Shakti Division Palampur,1.0,Fee/PreQual/Technical,.pdf,Scan copy of deduction of Earnest money and cost of tender.,AOC,10-Aug-2020,"INR 1,119,800",90.0,Sanjay Kumar,26-Oct-2020 03:33 PM,HPIPH39397.pdf (184.00 KB),Work Awarded to Sh. Kamlesh,Finance,Five bidder successfully verify,Sanjay Kumar,07-Aug-2020 10:54 AM,finance_58171.pdf,BOQ Comparative Chart,Technical,Five bidder successfully verify.,Sanjay Kumar,06-Aug-2020 04:06 PM,technical_58171.pdf,Er. Sanjay Kumar,Internal,1. Sh. Andesh Kumar(JOA) Tender Asstt. 2 Sh. Ashok kumar Supdt. 3 Harsh Tanwar D.A.O 4 Surinder Katoch HDM,Sanjay Kumar,06-Aug-2020 04:12 PM,06-Aug-2020 04:15 PM,techsummary_58171.pdf (72.04 KB),1.0,171283.0,ABTAR SINGH AND COMPANY,05-Aug-2020 10:31 AM,Rejected-AOC,High rate quoted,26-Oct-2020 03:36 PM,Er. Sanjay Kumar,Internal,1. Sh. Andesh Kumar(JOA) Tender Asstt. 2 Sh. Ashok kumar Supdt. 3 Harsh Tanwar D.A.O 4 Surinder Katoch HDM,Sanjay Kumar,07-Aug-2020 10:58 AM,finsummary_58171.pdf (72.66 KB),1.0,171650.0,Kamlesh,INR,"1,105,200","HP Irrigation and Public Health||Dharamshala Circle,Irrigation and Public Health,HP||Palampur,Irrigation and Public Health,HP",2020_HPIPH_39397_1,5372-5420 dt 29/7/2020,Improvement of water supply scheme for house hold connection to PC habitation Kothi Pahra and Kasba Jugehar in Tehsil Palampur District Kangra(HP),AOC
,,,,,,,,,,,,,,2.0,ICICI NEFT/RTGS,,,,,,,,,,,,,,,,,,,,,,,,,,,,,,,,,,,,,,,,,,.pdf,Certificate of registration with IPH Department in appropriate class and latest renewal thereof.,AOC,,,,,,,,,,,,,,,,,,,,,,,,,,2.0,171002.0,H.N.SINGH AND COMPANY,05-Aug-2020 10:28 AM,Rejected-AOC,High rate quoted,26-Oct-2020 03:36 PM,,,,,,,,,,,,,,,,AOC
,,,,,,,,,,,,,,,,,,,,,,,,,,,,,,,,,,,,,,,,,,,,,,,,,,,,,,,,,.pdf,Income tax/GST / EPF registration No certificate only.,AOC,,,,,,,,,,,,,,,,,,,,,,,,,,3.0,171650.0,Kamlesh,04-Aug-2020 07:30 PM,Accepted-AOC,Lowest one,26-Oct-2020 03:36 PM,,,,,,,,,,,,,,,,AOC
,,,,,,,,,,,,,,,,,,,,,,,,,,,,,,,,,,,,,,,,,,,,,,,,,,,,,,,,,.pdf,Affidavit that he have not two uncompleted work in hand and personal visit site.,AOC,,,,,,,,,,,,,,,,,,,,,,,,,,4.0,171638.0,NEW APSARA BOREWELL,04-Aug-2020 06:14 PM,Rejected-AOC,High rate quoted,26-Oct-2020 03:36 PM,,,,,,,,,,,,,,,,AOC
,,,,,,,,,,,,,,,,,,,,,,,,,,,,,,,,,,,,,,,,,,,,,,,,,,,,,,,,,.pdf,Contractor must ensure to upload the work done with award letter of which experience certificate has,AOC,,,,,,,,,,,,,,,,,,,,,,,,,,5.0,171288.0,SUKHDEV ENGINEERING WORKS,05-Aug-2020 10:25 AM,Rejected-AOC,High rate quoted,26-Oct-2020 03:36 PM,,,,,,,,,,,,,,,,AOC
,,,,,,,,,,,,,,,,,,,,,,,,,,,,,,,,,,,,,,,,,,,,,,,,,,,,,,,,,.pdf,Affidavit contr. not used exemption more than its limit and not ever been black listed,AOC,,,,,,,,,,,,,,,,,,,,,,,,,,,,,,,,,,,,,,,,,,,,,,,,AOC
,,,,,,,,,,,,,,,,,,,,,,,,,,,,,,,,,,,,,,,,,,,,,,,,,,,,,,,2.0,Finance,.pdf,Form 6 duly singed,AOC,,,,,,,,,,,,,,,,,,,,,,,,,,,,,,,,,,,,,,,,,,,,,,,,AOC
,,,,,,,,,,,,,,,,,,,,,,,,,,,,,,,,,,,,,,,,,,,,,,,,,,,,,,,,,.xls,BOQ,AOC,,,,,,,,,,,,,,,,,,,,,,,,,,,,,,,,,,,,,,,,,,,,,,,,AOC
