Organisation Chain,Tender Reference Number,Tender ID,Withdrawal Allowed,Tender Type,Form of contract,Tender Category,No. of Covers,General Technical Evaluation Allowed,ItemWise Technical Evaluation Allowed,Payment Mode,Is Multi Currency Allowed For BOQ,Is Multi Currency Allowed For Fee,Allow Two Stage Bidding,Cover No,Cover,Document Type,Description,Publish Date,Bid Opening Date,Document Download / Sale Start Date,Document Download / Sale End Date,Clarification Start Date,Clarification End Date,Bid Submission Start Date,Bid Submission End Date,Financial Bid Opening Date,EMD Amount in ₹,EMD Exemption Allowed,EMD Fee Type,EMD Percentage,EMD Payable To,EMD Payable At,S.No,Bank Name,Tender Fee in ₹,Fee Payable To,Fee Payable At,Tender Fee Exemption Allowed,Name,Address,Title,Work Description,Pre Qualification Details,Independent External Monitor/Remarks,Tender Value in ₹,Product Category,Sub category,Contract Type,Bid Validity(Days),Period Of Work(Days),Location,Pincode,Pre Bid Meeting Place,Pre Bid Meeting Address,Pre Bid Meeting Date,Bid Opening Place,Should Allow NDA Tender,Allow Preferential Bidder,Tender Stage
PWD,PW/EE/HD/T/2627-76 dt. 14-10-2022,2022_PWD_66563_1,Yes,Open Tender,Item Rate,Works,2.0,No,No,Online,No,No,No,1.0,Fee/PreQual/Technical,.pdf,1.	Cost of tender document as per schedule F  (6.3) earnest money as per schedule F (6.5) online mod,14-Oct-2022 05:15 PM,21-Oct-2022 11:30 AM,14-Oct-2022 05:15 PM,20-Oct-2022 05:15 PM,,,14-Oct-2022 05:30 PM,20-Oct-2022 05:15 PM,17-Nov-2022 11:45 AM,"48,000",No,fixed,,Nil,Nil,1.0,ICICI BANK,"1,500",Nil,Nil,No,Executive Engineer,HP PWD US CLUB SHIMLA,ROADSIDE PLANTATION  IN BAROTIWALA BADDI SAI  RAMSHEHAR ROAD RD 0.0 TO  10.600,ROADSIDE PLANTATION  IN BAROTIWALA BADDI SAI  RAMSHEHAR ROAD RD 0.0 TO  10.600,Please refer Tender documents.,,"26,53,441",Civil Works,,Tender,75.0,210.0,Baddi,173205.0,,,,SHIMLA,No,No,AOC
,,,,,,,,,,,,,,,,.pdf,2.	Contractor registration as per general Rule 23 and as per invitation of bid,,,,,,,,,,,,,,,,2.0,ICICI NEFT/RTGS,,,,,,,,,,,,,,,,,,,,,,,,,AOC
,,,,,,,,,,,,,,,,.pdf,"3.	GST registration as per General Rule No,. 21. Copy of GST No. Copy of TIN No. and Coy of PAN Card",,,,,,,,,,,,,,,,,,,,,,,,,,,,,,,,,,,,,,,,,,AOC
,,,,,,,,,,,,,,,,.pdf,"4.	Proof of  registration under  Employees provident Funds and Miscellaneous  Provision Act, 1952",,,,,,,,,,,,,,,,,,,,,,,,,,,,,,,,,,,,,,,,,,AOC
,,,,,,,,,,,,,,,,.pdf,5.	HP PWD Form No. 8 with full address and Mobile No.,,,,,,,,,,,,,,,,,,,,,,,,,,,,,,,,,,,,,,,,,,AOC
,,,,,,,,,,,,,,,,.pdf,6.	Affidavit of  Gazetted and Non gazette HP PWD employees related to  him  (General Rule No. 16),,,,,,,,,,,,,,,,,,,,,,,,,,,,,,,,,,,,,,,,,,AOC
,,,,,,,,,,,,,,,,.pdf,7.	Affidavit of no relative working in PWD Information  furnished in the bid is correct in all respe,,,,,,,,,,,,,,,,,,,,,,,,,,,,,,,,,,,,,,,,,,AOC
,,,,,,,,,,,,,,,,.pdf,8.	Proof of Machinery Tools plant and ownership as per Sr. No. 6.19 of schedule F Clause 18,,,,,,,,,,,,,,,,,,,,,,,,,,,,,,,,,,,,,,,,,,AOC
,,,,,,,,,,,,,,2.0,Finance,.xls,BOQ,,,,,,,,,,,,,,,,,,,,,,,,,,,,,,,,,,,,,,,,,,AOC
