Organisation Chain,Tender Reference Number,Tender ID,Withdrawal Allowed,Tender Type,Form of contract,Tender Category,No. of Covers,General Technical Evaluation Allowed,ItemWise Technical Evaluation Allowed,Payment Mode,Is Multi Currency Allowed For BOQ,Is Multi Currency Allowed For Fee,Allow Two Stage Bidding,Cover No,Cover,Document Type,Description,Publish Date,Bid Opening Date,Document Download / Sale Start Date,Document Download / Sale End Date,Clarification Start Date,Clarification End Date,Bid Submission Start Date,Bid Submission End Date,Financial Bid Opening Date,EMD Amount in ₹,EMD Exemption Allowed,EMD Fee Type,EMD Percentage,EMD Payable To,EMD Payable At,S.No,Instrument Type,Tender Fee in ₹,Fee Payable To,Fee Payable At,Tender Fee Exemption Allowed,Name,Address,Title,Work Description,Pre Qualification Details,Independent External Monitor/Remarks,Tender Value in ₹,Product Category,Sub category,Contract Type,Bid Validity(Days),Period Of Work(Days),Location,Pincode,Pre Bid Meeting Place,Pre Bid Meeting Address,Pre Bid Meeting Date,Bid Opening Place,Should Allow NDA Tender,Allow Preferential Bidder,Tender Stage
Directorate of Urban Development||Urban Development - UDDHP||Municipal Council Solan - UDDHP,"1559, 02.08.2021",2021_UDDHP_50937_1,Yes,Open Tender,Item Rate,Works,2.0,No,No,Offline,No,No,No,1.0,Fee/PreQual/Technical,.pdf,Copy of valid registration EPF/ECI,11-Aug-2021 10:00 AM,20-Aug-2021 02:00 PM,11-Aug-2021 10:00 AM,19-Aug-2021 05:00 PM,,,11-Aug-2021 10:00 AM,19-Aug-2021 05:00 PM,21-Aug-2021 04:10 PM,"11,250",No,fixed,,Commissioner M.Corp. Solan,Solan,1.0,DD - Demand Draft,500.0,Commissioner M.Corp. Solan,Solan,No,Commissioner M.Corp. Solan,Commissioner M.Corp. Solan,"Management of Wet and Dry Waste of MC Solan at SWM site, Salogra and further transportation to the Agency existing processing plant based on latest technologies i.e. Biomethanation and Extrusion respectively for wet and dry waste or cement plan","Management of Wet and Dry Waste of MC Solan at SWM site, Salogra and further transportation to the Agency existing processing plant based on latest technologies i.e. Biomethanation and Extrusion respectively for wet and dry waste or cement plan",Please refer Tender documents.,,"4,50,000",Civil Works - Others,,Tender,90.0,365.0,M.Corp. Solan,173212.0,,,,M.Corp. Solan,No,No,AOC
,,,,,,,,,,,,,,,,.pdf,Earnest money,,,,,,,,,,,,,,,,,,,,,,,,,,,,,,,,,,,,,,,,,,AOC
,,,,,,,,,,,,,,,,.pdf,Cost of tender,,,,,,,,,,,,,,,,,,,,,,,,,,,,,,,,,,,,,,,,,,AOC
,,,,,,,,,,,,,,,,.pdf,Copy of GST and PAN card,,,,,,,,,,,,,,,,,,,,,,,,,,,,,,,,,,,,,,,,,,AOC
,,,,,,,,,,,,,,,,.pdf,Work done certificate with minimum 3 years experience,,,,,,,,,,,,,,,,,,,,,,,,,,,,,,,,,,,,,,,,,,AOC
,,,,,,,,,,,,,,,,.pdf,Document supporting processing of wet waste  of 8-10 TPD at their existing waste processing-unit,,,,,,,,,,,,,,,,,,,,,,,,,,,,,,,,,,,,,,,,,,AOC
,,,,,,,,,,,,,,,,.pdf,"Detail of equipment,transport Manpower as per Annex. A",,,,,,,,,,,,,,,,,,,,,,,,,,,,,,,,,,,,,,,,,,AOC
,,,,,,,,,,,,,,,,.pdf,Other document as per RPF,,,,,,,,,,,,,,,,,,,,,,,,,,,,,,,,,,,,,,,,,,AOC
,,,,,,,,,,,,,,2.0,Finance,.xls,BOQ,,,,,,,,,,,,,,,,,,,,,,,,,,,,,,,,,,,,,,,,,,AOC
