Contract Date :,Contract Value :,Work Completion Period in days :,Updated By :,Updated on :,AOC document :,S.No,Bid Number,Bidder Name,Submitted Date,Status,Remarks,Status Updated On,Type :,Summary :,Updated By :.1,Updated On :,Document :,Type :.1,Summary :.1,Updated By :.2,Updated On :.1,Document :.1,BOQ Comparative Chart :,Committee Chairperson/Co-ordinator Name :,Committee Chairperson/Co-ordinator Type :,Committee Members :,Updated By :.3,Updated On :.2,Financial Bid Opening Date:,Document :.2,Committee Chairperson/Co-ordinator Name :.1,Committee Chairperson/Co-ordinator Type :.1,Committee Members :.1,Updated By :.4,Updated on :.1,Document :.3,Organisation Chain :,Tender ID :,Tender Ref No :,Tender Title :,S.No.1,Bid Number.1,Bidder Name.1,Awarded Currency,Awarded Value,Tender Stage,Name,Address,Title,Work Description,Pre Qualification Details,Independent External Monitor/Remarks,Tender Value in ₹,Product Category,Sub category,Contract Type,Bid Validity(Days),Period Of Work(Days),Location,Pincode,Pre Bid Meeting Place,Pre Bid Meeting Address,Pre Bid Meeting Date,Bid Opening Place,Should Allow NDA Tender,Allow Preferential Bidder,S.No,Instrument Type,Organisation Chain,Tender Reference Number,Tender ID,Withdrawal Allowed,Tender Type,Form of contract,Tender Category,No. of Covers,General Technical Evaluation Allowed,ItemWise Technical Evaluation Allowed,Payment Mode,Is Multi Currency Allowed For BOQ,Is Multi Currency Allowed For Fee,Allow Two Stage Bidding,EMD Amount in ₹,EMD through BG/ST or EMD Exemption Allowed,EMD Fee Type,EMD Percentage,EMD Payable To,EMD Payable At,Cover No,Cover,Document Type,Description,Tender Fee in ₹,Fee Payable To,Fee Payable At,Tender Fee Exemption Allowed,Publish Date,Bid Opening Date,Document Download / Sale Start Date,Document Download / Sale End Date,Clarification Start Date,Clarification End Date,Bid Submission Start Date,Bid Submission End Date,Financial Bid Opening Date,Tender Stage
23-Oct-2019,INR 290728.4,30.0,Ritu Moni Sarmah,23-Oct-2019 05:37 PM,AOC.pdf (925.00 KB),1,63126,AIM TECHSOFT PRIVATE LIMITED,31-Aug-2019 04:12 PM,Rejected-Technical,Does not fulfil eligibility criteria,13-Sep-2019 06:08 PM,Technical,Eight bids received,Ritu Moni Sarmah,03-Sep-2019 11:18 AM,,Finance,Three bids admitted,Ritu Moni Sarmah,18-Sep-2019 03:44 PM,,BOQ Comparative Chart,Central Project Coordinator,Internal,,Ritu Moni Sarmah,13-Sep-2019 06:08 PM,18-Sep-2019 03:30 PM,techsummary_21263.pdf (933.67 KB),Central Project Coordinator,Internal,,Ritu Moni Sarmah,04-Oct-2019 12:36 PM,finsummary_21263.pdf (100.26 KB),Gauhati High Court - Guwahati,2019_GHC_13771_1,HC.XLV-309/2019/3340/PMP,Supply of Digital Signature Certificates,1.0,64024.0,DIGI SOLUTIONS AND SERVICES,INR,290728.4,AOC,Central Project Coordinator,"Central Project Coordinator, Gauhati High Court, Guwahati-781001",Supply of Digital Signature Certificates,Supply of approximately 389 nos. of Digital Signature Certificates (DSCs) for Judicial Officers of Assam under phase II of the eCourts Project,Please refer Tender documents. ,NA ,,Computer- S/W,NA ,Tender,180.0,30.0,Across Judicial Districts of Assam,781001.0,NA ,NA ,NA ,Guwahati,No ,No,1.0,DD - Demand Draft,Gauhati High Court - Guwahati,HC.XLV-309/2019/3340/PMP,2019_GHC_13771_1,Yes,Open Tender,Supply,Goods,4.0,No,No,Offline,No,No,No,"19,450",Yes,fixed,,"Registrar General, Gauhati High Court, Guwahati",Guwahati,1.0,Fee,.pdf,EMD,0.0,Nil,Nil,No,01-Aug-2019 06:40 PM,03-Sep-2019 11:00 AM,01-Aug-2019 06:40 PM,02-Sep-2019 03:00 PM,02-Aug-2019 10:00 AM ,14-Aug-2019 05:00 PM ,02-Aug-2019 10:00 AM,02-Sep-2019 03:00 PM,18-Sep-2019 03:30 PM,AOC
,,,,,,2,62829,ANGEL BUSINESS CONSULTANCY,07-Aug-2019 08:12 AM,Rejected-Technical,Not submitted processing fee,13-Sep-2019 06:08 PM,,,,,,,,,,,,,,,,,,,,,,,,,,,,,,,,,,AOC,,,,,,,,,,,,,,,,,,,,,2.0,BC - Bankers Cheque,,,,,,,,,,,,,,,,,,,,,,,.pdf,Processing Fee,,,,,,,,,,,,,,AOC
,,,,,,3,64024,DIGI SOLUTIONS AND SERVICES,02-Sep-2019 02:09 PM,Accepted-AOC,Overall L1,23-Oct-2019 05:37 PM,,,,,,,,,,,,,,,,,,,,,,,,,,,,,,,,,,AOC,,,,,,,,,,,,,,,,,,,,,3.0,BG - Bank Guarantee Irrevocable,,,,,,,,,,,,,,,,,,,,,2.0,PreQual,.pdf,Eligibility Criteria,,,,,,,,,,,,,,AOC
,,,,,,4,64040,e Consultancy Services,02-Sep-2019 01:51 PM,Rejected-AOC,Overall L2,23-Oct-2019 05:37 PM,,,,,,,,,,,,,,,,,,,,,,,,,,,,,,,,,,AOC,,,,,,,,,,,,,,,,,,,,,,,,,,,,,,,,,,,,,,,,,,,3.0,Technical,.pdf,Technical Bid,,,,,,,,,,,,,,AOC
,,,,,,5,62823,EFILING INFOTECH PVT LTD,31-Aug-2019 05:16 PM,Rejected-Technical,Does not fulfil eligibility criteria,13-Sep-2019 06:08 PM,,,,,,,,,,,,,,,,,,,,,,,,,,,,,,,,,,AOC,,,,,,,,,,,,,,,,,,,,,,,,,,,,,,,,,,,,,,,,,,,,,.pdf,TVDS Datasheet,,,,,,,,,,,,,,AOC
,,,,,,6,63368,FOURTH DIMENSION SERVICE SOLUTIONS,31-Aug-2019 01:51 PM,Rejected-Finance,Does not fulfil point no. 5 at Annexure III of the tender document,04-Oct-2019 12:36 PM,,,,,,,,,,,,,,,,,,,,,,,,,,,,,,,,,,AOC,,,,,,,,,,,,,,,,,,,,,,,,,,,,,,,,,,,,,,,,,,,4.0,Finance,.xls,BoQ,,,,,,,,,,,,,,AOC
,,,,,,7,64017,H R INFRACON LIMITED,02-Sep-2019 12:20 PM,Rejected-Technical,Does not fulfil eligibility criteria,13-Sep-2019 06:08 PM,,,,,,,,,,,,,,,,,,,,,,,,,,,,,,,,,,AOC,,,,,,,,,,,,,,,,,,,,,,,,,,,,,,,,,,,,,,,,,,,,,,,,,,,,,,,,,,,,AOC
,,,,,,8,64046,Smart Associates,02-Sep-2019 02:54 PM,Rejected-Technical,Not submitted processing fee,13-Sep-2019 06:08 PM,,,,,,,,,,,,,,,,,,,,,,,,,,,,,,,,,,AOC,,,,,,,,,,,,,,,,,,,,,,,,,,,,,,,,,,,,,,,,,,,,,,,,,,,,,,,,,,,,AOC
