EMD Amount in ₹,EMD Exemption Allowed,EMD Fee Type,EMD Percentage,EMD Payable To,EMD Payable At,Title,Work Description,Pre Qualification Details,Independent External Monitor/Remarks,Tender Value in ₹,Product Category,Sub category,Contract Type,Bid Validity(Days),Period Of Work(Days),Location,Pincode,Pre Bid Meeting Place,Pre Bid Meeting Address,Pre Bid Meeting Date,Bid Opening Place,Should Allow NDA Tender,Allow Preferential Bidder,Name,Address,Publish Date,Bid Opening Date,Document Download / Sale Start Date,Document Download / Sale End Date,Clarification Start Date,Clarification End Date,Bid Submission Start Date,Bid Submission End Date,Financial Bid Opening Date,S.No,Instrument Type,Tender Fee in ₹,Fee Payable To,Fee Payable At,Tender Fee Exemption Allowed,Organisation Chain,Tender Reference Number,Tender ID,Withdrawal Allowed,Tender Type,Form of contract,Tender Category,No. of Covers,General Technical Evaluation Allowed,ItemWise Technical Evaluation Allowed,Payment Mode,Is Multi Currency Allowed For BOQ,Is Multi Currency Allowed For Fee,Allow Two Stage Bidding,Cover No,Cover,Document Type,Description,Tender Stage,Organisation Chain :,Tender ID :,Tender Ref No :,Tender Title :,Committee Chairperson/Co-ordinator Name :,Committee Chairperson/Co-ordinator Type :,Committee Members :,Updated By :,Updated On :,Financial Bid Opening Date:,Document :,Committee Chairperson/Co-ordinator Name :.1,Committee Chairperson/Co-ordinator Type :.1,Committee Members :.1,Updated By :.1,Updated on :,Document :.1,Contract Date :,Contract Value :,Work Completion Period in days :,Updated By :.2,Updated on :.1,AOC document :,AOC Description :,S.No,Bid Number,Bidder Name,Submitted Date,Status,Remarks,Status Updated On,Type :,Summary :,Updated By :.3,Updated On :.1,Document :.2,Type :.1,Summary :.1,Updated By :.4,Updated On :.2,Document :.3,BOQ Comparative Chart :,S.No.1,Bid Number.1,Bidder Name.1,Awarded Currency,Awarded Value,Tender Stage
"28,000",Yes,fixed,,EE PWD Fatehpur,Fatehpur,Periodic Renewal of Village Roads Gangath to Gheta road km. 0/0 to 8/800 Annual Maintenance Plan for the year 2019-20,Providing and laying 25mm single layer bituminous concrete km. 3/0 to 5/0,Please refer Tender documents. ,NA ,"14,34,440",Civil Works - Roads,renewal coat ,Tender,120.0,30.0,Gangath,176401.0,NA ,NA ,NA ,O/O EE PWD Fatehpur,No ,No,EE PWD Fatehpur,EE PWD Fatehpur,06-Feb-2019 10:00 AM,25-Feb-2019 11:00 AM,06-Feb-2019 10:00 AM,23-Feb-2019 05:00 PM,NA ,NA ,06-Feb-2019 11:00 AM,23-Feb-2019 05:00 PM,28-Feb-2019 04:00 PM,1.0,DD - Demand Draft,5.0,EE PWD Fatehpur,Fatehpur,Yes,PWD,PWF CB II C Tender 10091-140 dated 22.1.19,2019_PWD_26276_1,Yes,Open Tender,Item Rate,Works,2.0,No,No,Offline,No,No,No,1.0,Fee/PreQual/Technical,.pdf,Cost of tender as Indicated in Schedule F,AOC,PWD,2019_PWD_26276_1,PWF CB II C Tender 10091-140 dated 22.1.19,Periodic Renewal of Village Roads Gangath to Gheta road km. 0/0 to 8/800 Annual Maintenance Plan for the year 2019-20,Mohinder Pal Dhiman,Internal,dhd dao supdt,Mohinder Pal Dhiman,28-Feb-2019 03:46 PM,28-Feb-2019 04:00 PM,techsummary_37126.pdf (2174.79 KB),Mohinder Pal Dhiman,Internal,dao dhd supdt,Mohinder Pal Dhiman,01-May-2019 03:02 PM,finsummary_37126.pdf (247.31 KB),08-May-2019,"INR 1,636,530",30.0,Mohinder Pal Dhiman,08-May-2019 03:43 PM,26276.pdf (530.00 KB),aoc,1.0,114226.0,rajat thakur govt contractor,22-Feb-2019 05:19 PM,Accepted-AOC,Ist lowest,08-May-2019 03:43 PM,Technical,summary,Mohinder Pal Dhiman,28-Feb-2019 03:42 PM,technical_37126.pdf,Finance,summary,Mohinder Pal Dhiman,27-Apr-2019 11:04 AM,finance_37126.pdf,BOQ Comparative Chart,1.0,114226.0,rajat thakur govt contractor,INR,"1,636,530",AOC
,,,,,,,,,,,,,,,,,,,,,,,,,,,,,,,,,,,2.0,FDR - Fixed Deposit,,,,,,,,,,,,,,,,,,,,,.pdf,Earnest Money as Indicated in Schedule F,AOC,,,,,,,,,,,,,,,,,,,,,,,,,2.0,114680.0,Ravinder Kumar,22-Feb-2019 05:08 PM,Rejected-Finance,3rd Lowest,01-May-2019 03:02 PM,,,,,,,,,,,,,,,,,AOC
,,,,,,,,,,,,,,,,,,,,,,,,,,,,,,,,,,,,,,,,,,,,,,,,,,,,,,,,,.pdf,Contractor Registration Refer General Rule 21,AOC,,,,,,,,,,,,,,,,,,,,,,,,,3.0,114756.0,RAVI SHARMA,22-Feb-2019 11:19 PM,Rejected-Finance,4th Lowest,01-May-2019 03:02 PM,,,,,,,,,,,,,,,,,AOC
,,,,,,,,,,,,,,,,,,,,,,,,,,,,,,,,,,,,,,,,,,,,,,,,,,,,,,,,,.pdf,Sales Tax Registration Refer General Rule 21,AOC,,,,,,,,,,,,,,,,,,,,,,,,,4.0,114847.0,V S SAINI,23-Feb-2019 02:45 PM,Rejected-Finance,2nd Lowest,01-May-2019 03:02 PM,,,,,,,,,,,,,,,,,AOC
,,,,,,,,,,,,,,,,,,,,,,,,,,,,,,,,,,,,,,,,,,,,,,,,,,,,,,,,,.pdf,Work Done Certificate Refer General Rule 19,AOC,,,,,,,,,,,,,,,,,,,,,,,,,,,,,,,,,,,,,,,,,,,,,,,,AOC
,,,,,,,,,,,,,,,,,,,,,,,,,,,,,,,,,,,,,,,,,,,,,,,,,,,,,,,,,.pdf,List of Machinery as Shown in Schedule F,AOC,,,,,,,,,,,,,,,,,,,,,,,,,,,,,,,,,,,,,,,,,,,,,,,,AOC
,,,,,,,,,,,,,,,,,,,,,,,,,,,,,,,,,,,,,,,,,,,,,,,,,,,,,,,2.0,Finance,.xls,boq,AOC,,,,,,,,,,,,,,,,,,,,,,,,,,,,,,,,,,,,,,,,,,,,,,,,AOC
