Committee Chairperson/Co-ordinator Name :,Committee Chairperson/Co-ordinator Type :,Committee Members :,Updated By :,Updated on :,Document :,Contract Date :,Contract Value :,Work Completion Period in days :,Updated By :.1,Updated on :.1,AOC document :,AOC Description :,Organisation Chain :,Tender ID :,Tender Ref No :,Tender Title :,Committee Chairperson/Co-ordinator Name :.1,Committee Chairperson/Co-ordinator Type :.1,Committee Members :.1,Updated By :.2,Updated On :,Financial Bid Opening Date:,Document :.1,Type :,Summary :,Updated By :.3,Updated On :.1,Document :.2,BOQ Comparative Chart :,S.No,Bid Number,Bidder Name,Awarded Currency,Awarded Value,Type :.1,Summary :.1,Updated By :.4,Updated On :.2,Document :.3,S.No.1,Bid Number.1,Bidder Name.1,Submitted Date,Status,Remarks,Status Updated On,Tender Stage,Publish Date,Bid Opening Date,Document Download / Sale Start Date,Document Download / Sale End Date,Clarification Start Date,Clarification End Date,Bid Submission Start Date,Bid Submission End Date,Financial Bid Opening Date,Tender Fee in ₹,Fee Payable To,Fee Payable At,Tender Fee Exemption Allowed,Organisation Chain,Tender Reference Number,Tender ID,Withdrawal Allowed,Tender Type,Form of contract,Tender Category,No. of Covers,General Technical Evaluation Allowed,ItemWise Technical Evaluation Allowed,Payment Mode,Is Multi Currency Allowed For BOQ,Is Multi Currency Allowed For Fee,Allow Two Stage Bidding,Cover No,Cover,Document Type,Description,EMD Amount in ₹,EMD Exemption Allowed,EMD Fee Type,EMD Percentage,EMD Payable To,EMD Payable At,Name,Address,Title,Work Description,Pre Qualification Details,Independent External Monitor/Remarks,Tender Value in ₹,Product Category,Sub category,Contract Type,Bid Validity(Days),Period Of Work(Days),Location,Pincode,Pre Bid Meeting Place,Pre Bid Meeting Address,Pre Bid Meeting Date,Bid Opening Place,Should Allow NDA Tender,Allow Preferential Bidder,S.No,Instrument Type,Tender Stage
EE,Internal,supdtSrDAoAEGMRSrDAO,Parveen Kumar Verma,04-May-2019 03:34 PM,finsummary_21630.pdf (88.38 KB),04-May-2019,"INR 678,440",90.0,Parveen Kumar Verma,04-May-2019 03:54 PM,awaBalhseena.PDF (66.00 KB),Awardletter,PWD,2017_PWD_15915_1,AMP on road to village Bhagatpur,AMP on Link road to Village Bhagatpur,EE,Internal,SupdtSrdaoDHDAEGMR,Parveen Kumar Verma,05-May-2017 01:00 PM,05-May-2017 01:05 PM,techsummary_21630.pdf (179.45 KB),Finance,fin bed,Parveen Kumar Verma,04-May-2019 03:30 PM,finance_21630.pdf,BOQ Comparative Chart,1.0,59111.0,Ranvir Singh,INR,"678,440",Technical,teceveluation,Parveen Kumar Verma,05-May-2017 12:58 PM,technical_21630.pdf,1.0,58746.0,Amit Kumar,25-Apr-2017 02:36 PM,Rejected-Finance,Due to L5,04-May-2019 03:34 PM,AOC,19-Apr-2017 12:00 PM,01-May-2017 11:00 AM,19-Apr-2017 12:00 PM,01-May-2017 10:00 AM,19-Apr-2017 12:00 PM ,01-May-2017 10:00 AM ,19-Apr-2017 12:00 PM,01-May-2017 10:00 AM,05-May-2017 01:05 PM,350.0,EE Ghumarwin,Ghumarwin,Yes,PWD,AMP on road to village Bhagatpur,2017_PWD_15915_1,Yes,Open Tender,Item Rate,Works,2.0,No,No,Offline,No,No,No,1.0,Fee/PreQual/Technical,.pdf,Cost of Tender Form and Earnest money (Indicated in Schedule-F),"18,000",Yes,fixed,,EE Ghumarwin,Ghumarwin,Executive Engineer,Executive Engineer HPPWD Division Ghumarwin,AMP on Link road to Village Bhagatpur,AMP work,Please refer Tender documents. ,NA ,"9,32,663",Civil Works - Roads,NA ,Tender,120.0,90.0,Ghumarwin,174021.0,Ghumarwin Division ,Executive Engineer HPPWD Division Ghumarwin ,01-May-2017 10:00 AM ,Ghumarwin Division,No ,No,1.0,DD - Demand Draft,AOC
,,,,,,,,,,,,,,,,,,,,,,,,,,,,,,,,,,,,,,,,2.0,59050.0,Anil Kumar,27-Apr-2017 05:39 PM,Rejected-Finance,Due to L4,04-May-2019 03:34 PM,AOC,,,,,,,,,,,,,,,,,,,,,,,,,,,,,,.pdf,Contractor Registration (Refer General Rules No.23),,,,,,,,,,,,,,,,,,,,,,,,,,,2.0,FDR - Fixed Deposit,AOC
,,,,,,,,,,,,,,,,,,,,,,,,,,,,,,,,,,,,,,,,3.0,59147.0,Jintender Kumar,30-Apr-2017 12:27 PM,Rejected-Finance,due to L3,04-May-2019 03:34 PM,AOC,,,,,,,,,,,,,,,,,,,,,,,,,,,,,,.pdf,Sale Tax Registration Tin No and Pan No. EPF No (Refer general Rules No.21),,,,,,,,,,,,,,,,,,,,,,,,,,,,,AOC
,,,,,,,,,,,,,,,,,,,,,,,,,,,,,,,,,,,,,,,,4.0,58828.0,Nisha Kumari,29-Apr-2017 11:22 AM,Rejected-Finance,Due to L2,04-May-2019 03:34 PM,AOC,,,,,,,,,,,,,,,,,,,,,,,,,,,,,,.pdf,Work Done for last 05years and work in Hand Certificates dully signed by concerned Authority/EE (G,,,,,,,,,,,,,,,,,,,,,,,,,,,,,AOC
,,,,,,,,,,,,,,,,,,,,,,,,,,,,,,,,,,,,,,,,5.0,59111.0,Ranvir Singh,29-Apr-2017 03:05 PM,Accepted-AOC,Awardletterissued,04-May-2019 03:54 PM,AOC,,,,,,,,,,,,,,,,,,,,,,,,,,,,,,.pdf,"List of Machinery, Tool, Plants and Laboratory Equipment etc. (as shown in Schedule-F)",,,,,,,,,,,,,,,,,,,,,,,,,,,,,AOC
,,,,,,,,,,,,,,,,,,,,,,,,,,,,,,,,,,,,,,,,,,,,,,,AOC,,,,,,,,,,,,,,,,,,,,,,,,,,,,,,.pdf,"Form 7, 8 dully signed by Contractor with seal (Refer schedule A to F)",,,,,,,,,,,,,,,,,,,,,,,,,,,,,AOC
,,,,,,,,,,,,,,,,,,,,,,,,,,,,,,,,,,,,,,,,,,,,,,,AOC,,,,,,,,,,,,,,,,,,,,,,,,,,,,2.0,Finance,.xls,BOQ,,,,,,,,,,,,,,,,,,,,,,,,,,,,,AOC
