Organisation Chain,Tender Reference Number,Tender ID,Withdrawal Allowed,Tender Type,Form of contract,Tender Category,No. of Covers,General Technical Evaluation Allowed,ItemWise Technical Evaluation Allowed,Payment Mode,Is Multi Currency Allowed For BOQ,Is Multi Currency Allowed For Fee,Allow Two Stage Bidding,Cover No,Cover,Document Type,Description,Publish Date,Bid Opening Date,Document Download / Sale Start Date,Document Download / Sale End Date,Clarification Start Date,Clarification End Date,Bid Submission Start Date,Bid Submission End Date,Financial Bid Opening Date,EMD Amount in ₹,EMD Exemption Allowed,EMD Fee Type,EMD Percentage,EMD Payable To,EMD Payable At,S.No,Bank Name,Tender Fee in ₹,Fee Payable To,Fee Payable At,Tender Fee Exemption Allowed,Name,Address,Title,Work Description,Pre Qualification Details,Independent External Monitor/Remarks,Tender Value in ₹,Product Category,Sub category,Contract Type,Bid Validity(Days),Period Of Work(Days),Location,Pincode,Pre Bid Meeting Place,Pre Bid Meeting Address,Pre Bid Meeting Date,Bid Opening Place,Should Allow NDA Tender,Allow Preferential Bidder,Tender Stage
PWD,12350-60 dated 18.03.2025,2025_PWD_102481_3,Yes,Open Tender,Percentage,Works,2.0,No,No,Online,No,No,No,1.0,Fee/PreQual/Technical,.pdf,UTR nos of EMD and Cost of Tender Form,20-Mar-2025 11:00 AM,28-Mar-2025 11:00 AM,20-Mar-2025 11:30 AM,27-Mar-2025 06:00 PM,,,20-Mar-2025 11:30 AM,27-Mar-2025 06:00 PM,28-Mar-2025 01:30 PM,"18,700",No,fixed,,Nil,Nil,1.0,ICICI BANK,350.0,Nil,Nil,No,"EE Karchham Division, HPPWD., Bhabanagar","EE Karchham Division, HPPWD., Bhabanagar","C.o link road from Nanspo to Upper Tranda Km 0.00 to 3.500 Sub Head- C.o B.wall at RD 0.460 to 0.461, R.wall at R.D. 0.700 to 0.714 and B.wall at RD 1.100 to 1.115.","C.o link road from Nanspo to Upper Tranda Km 0.00 to 3.500 Sub Head- C.o B.wall at RD 0.460 to 0.461, R.wall at R.D. 0.700 to 0.714 and B.wall at RD 1.100 to 1.115.",Please refer Tender documents.,,"9,33,819",Civil Works - Roads,,Tender,90.0,90.0,Nanspo,172115.0,,,,"EE Karchham Division, HPPWD., Bhabanagar",No,No,AOC
,,,,,,,,,,,,,,,,.pdf,"Contractors Registration, GST, EPF and PAN",,,,,,,,,,,,,,,,2.0,ICICI NEFT/RTGS,,,,,,,,,,,,,,,,,,,,,,,,,AOC
,,,,,,,,,,,,,,,,.pdf,List of Machinery Tool Plant.,,,,,,,,,,,,,,,,,,,,,,,,,,,,,,,,,,,,,,,,,,AOC
,,,,,,,,,,,,,,,,.pdf,All technical documents as per SBD,,,,,,,,,,,,,,,,,,,,,,,,,,,,,,,,,,,,,,,,,,AOC
,,,,,,,,,,,,,,,,.pdf,Other document as per SBD,,,,,,,,,,,,,,,,,,,,,,,,,,,,,,,,,,,,,,,,,,AOC
,,,,,,,,,,,,,,2.0,Finance,.xls,PRICE BID,,,,,,,,,,,,,,,,,,,,,,,,,,,,,,,,,,,,,,,,,,AOC
