Organisation Chain,Tender Reference Number,Tender ID,Withdrawal Allowed,Tender Type,Form of contract,Tender Category,No. of Covers,General Technical Evaluation Allowed,ItemWise Technical Evaluation Allowed,Payment Mode,Is Multi Currency Allowed For BOQ,Is Multi Currency Allowed For Fee,Allow Two Stage Bidding,Cover No,Cover,Document Type,Description,Publish Date,Bid Opening Date,Document Download / Sale Start Date,Document Download / Sale End Date,Clarification Start Date,Clarification End Date,Bid Submission Start Date,Bid Submission End Date,Financial Bid Opening Date,EMD Amount in ₹,EMD Exemption Allowed,EMD Fee Type,EMD Percentage,EMD Payable To,EMD Payable At,S.No,Bank Name,Tender Fee in ₹,Fee Payable To,Fee Payable At,Tender Fee Exemption Allowed,Name,Address,Title,Work Description,Pre Qualification Details,Independent External Monitor/Remarks,Tender Value in ₹,Product Category,Sub category,Contract Type,Bid Validity(Days),Period Of Work(Days),Location,Pincode,Pre Bid Meeting Place,Pre Bid Meeting Address,Pre Bid Meeting Date,Bid Opening Place,Should Allow NDA Tender,Allow Preferential Bidder,Tender Stage
PWD,NAHAN 8027-56,2024_PWD_83922_2,Yes,Open Tender,Percentage,Works,2.0,No,No,Online,No,No,No,1.0,Fee/PreQual/Technical,.pdf,Receipt of Cost of Tender and Earnest Money Payment,11-Jan-2024 05:00 PM,22-Jan-2024 11:00 AM,11-Jan-2024 05:00 PM,22-Jan-2024 10:00 AM,,,11-Jan-2024 05:00 PM,22-Jan-2024 10:00 AM,27-Jan-2024 04:35 PM,"24,000",No,fixed,,Nil,Nil,1.0,ICICI BANK,500.0,Nil,Nil,No,Executive Engineer,Executive Engineer HPPWD B and R Division Nahan,"A/R and M/O Health Sub-Centre at Kotla Mollar, Teshil Dadahu, Sirmaur (HP)","Providing Painting Work, PPGI Roofing and Sanitary Installation",As per Bidding Document,,,Civil Works - Buildings,,Tender,75.0,60.0,Nahan,173001.0,,,,HPPWD B and R Division Nahan,No,No,AOC
,,,,,,,,,,,,,,,,.pdf,Contractor Registration,,,,,,,,,,,,,,,,2.0,ICICI NEFT/RTGS,,,,,,,,,,,,,,,,,,,,,,,,,AOC
,,,,,,,,,,,,,,,,.pdf,GST Registration and EPF Registration,,,,,,,,,,,,,,,,,,,,,,,,,,,,,,,,,,,,,,,,,,AOC
,,,,,,,,,,,,,,,,.pdf,Acknowledgement of up to date filed GST Return,,,,,,,,,,,,,,,,,,,,,,,,,,,,,,,,,,,,,,,,,,AOC
,,,,,,,,,,,,,,,,.pdf,List a/w Documentary Proof of Machinery and Technical Staff as per Schedule-F or Affidavit,,,,,,,,,,,,,,,,,,,,,,,,,,,,,,,,,,,,,,,,,,AOC
,,,,,,,,,,,,,,,,.pdf,Undertaking of not having more than 2 Works-in-Hand,,,,,,,,,,,,,,,,,,,,,,,,,,,,,,,,,,,,,,,,,,AOC
,,,,,,,,,,,,,,,,.pdf,Affidavit regarding Correctness of Documents,,,,,,,,,,,,,,,,,,,,,,,,,,,,,,,,,,,,,,,,,,AOC
,,,,,,,,,,,,,,,,.pdf,Contact Detail i.e. e-mail ID and Mobile No. of the Bidder,,,,,,,,,,,,,,,,,,,,,,,,,,,,,,,,,,,,,,,,,,AOC
,,,,,,,,,,,,,,2.0,Finance,.xls,Bill of Quantity,,,,,,,,,,,,,,,,,,,,,,,,,,,,,,,,,,,,,,,,,,AOC
