Organisation Chain,Tender Reference Number,Tender ID,Withdrawal Allowed,Tender Type,Form of contract,Tender Category,No. of Covers,General Technical Evaluation Allowed,ItemWise Technical Evaluation Allowed,Payment Mode,Is Multi Currency Allowed For BOQ,Is Multi Currency Allowed For Fee,Allow Two Stage Bidding,Cover No,Cover,Document Type,Description,Publish Date,Bid Opening Date,Document Download / Sale Start Date,Document Download / Sale End Date,Clarification Start Date,Clarification End Date,Bid Submission Start Date,Bid Submission End Date,Financial Bid Opening Date,EMD Amount in ₹,EMD Exemption Allowed,EMD Fee Type,EMD Percentage,EMD Payable To,EMD Payable At,S.No,Instrument Type,Tender Fee in ₹,Fee Payable To,Fee Payable At,Tender Fee Exemption Allowed,Name,Address,Title,Work Description,Pre Qualification Details,Independent External Monitor/Remarks,Tender Value in ₹,Product Category,Sub category,Contract Type,Bid Validity(Days),Period Of Work(Days),Location,Pincode,Pre Bid Meeting Place,Pre Bid Meeting Address,Pre Bid Meeting Date,Bid Opening Place,Should Allow NDA Tender,Allow Preferential Bidder,Tender Stage
Dr. Yashwant Singh Parmar University of Horticulture and Forestry,UHF/Const.-1/ Parttfile/2024/-1386-87 dtt 14.10.2024,2024_YSPU_94020_1,Yes,Open Tender,Item Rate,Works,2.0,No,No,Offline,No,No,No,1.0,Fee/PreQual/Technical,.pdf,cost of tender form in shape of DD and earnest  money in shape of FDR,14-Oct-2024 05:00 PM,25-Oct-2024 11:10 AM,14-Oct-2024 05:30 PM,25-Oct-2024 10:00 AM,,,14-Oct-2024 05:30 PM,25-Oct-2024 10:00 AM,25-Oct-2024 01:15 PM,"47,000",No,fixed,,EE Design,"Dr YSP UHF Nauni,Solan",1.0,DD - Demand Draft,"3,000",EE Design,"Dr YSP UHF Nauni,Solan",No,EE Design,"O/o Estate Organization ,UHF ,Nauni",Construction of new girls Hostel college of hort iculture andforestry at  Neri-HamirpurSH Providing Electrical Installation,Construction of new girls Hostel college of horticulture and forestry at  Neri-Hamirpur SH Providing Electrical Installation,Please refer Tender documents.,,"23,33,412",Electrical Works,,Tender,45.0,570.0,Neri,177001.0,,,,"Nauni ,Solan",No,No,AOC
,,,,,,,,,,,,,,,,.pdf,Contractor registration certificate/GST /PAN/EPFO Certificate,,,,,,,,,,,,,,,,2.0,FDR - Fixed Deposit,,,,,,,,,,,,,,,,,,,,,,,,,AOC
,,,,,,,,,,,,,,,,.pdf,Tender Documents duly signed by bidder,,,,,,,,,,,,,,,,,,,,,,,,,,,,,,,,,,,,,,,,,,AOC
,,,,,,,,,,,,,,,,.pdf,Affidavit regarding correctness of bid and having not more than 2 works in hand in govt. deptt.,,,,,,,,,,,,,,,,,,,,,,,,,,,,,,,,,,,,,,,,,,AOC
,,,,,,,,,,,,,,2.0,Finance,.xls,BOQ,,,,,,,,,,,,,,,,,,,,,,,,,,,,,,,,,,,,,,,,,,AOC
