Organisation Chain,Tender Reference Number,Tender ID,Withdrawal Allowed,Tender Type,Form of contract,Tender Category,No. of Covers,General Technical Evaluation Allowed,ItemWise Technical Evaluation Allowed,Payment Mode,Is Multi Currency Allowed For BOQ,Is Multi Currency Allowed For Fee,Allow Two Stage Bidding,Cover No,Cover,Document Type,Description,Publish Date,Bid Opening Date,Document Download / Sale Start Date,Document Download / Sale End Date,Clarification Start Date,Clarification End Date,Bid Submission Start Date,Bid Submission End Date,Financial Bid Opening Date,EMD Amount in ₹,EMD Exemption Allowed,EMD Fee Type,EMD Percentage,EMD Payable To,EMD Payable At,S.No,Bank Name,Tender Fee in ₹,Fee Payable To,Fee Payable At,Tender Fee Exemption Allowed,Name,Address,Title,Work Description,Pre Qualification Details,Independent External Monitor/Remarks,Tender Value in ₹,Product Category,Sub category,Contract Type,Bid Validity(Days),Period Of Work(Days),Location,Pincode,Pre Bid Meeting Place,Pre Bid Meeting Address,Pre Bid Meeting Date,Bid Opening Place,Should Allow NDA Tender,Allow Preferential Bidder,Tender Stage
HP SIDC Limited,Job No. 5,2025_SIDC_99259_1,Yes,Open Tender,Item Rate,Works,2.0,No,No,Online,No,No,No,1.0,Fee/PreQual/Technical,.pdf,Appropriate Electrical Contractor registration (as per tender condition),05-Feb-2025 11:00 AM,17-Feb-2025 11:00 AM,05-Feb-2025 11:00 AM,15-Feb-2025 05:00 PM,,,05-Feb-2025 11:00 AM,15-Feb-2025 05:00 PM,28-Feb-2025 04:00 PM,"5,400",No,fixed,,Nil,Nil,1.0,ICICI BANK,500.0,Nil,Nil,No,Executive Engineer,HPSIDC Shimla,"Construction of Children and Adolescents Libraries in Govt. Sr. Sec. School Amboya, Nagheta, GHS Kunnier Dhamon Block Distt. Sirmour (HP) SH- Providing E.I. work).",SH- Providing E.I. work).,Please refer Tender documents.,,"2,69,226",Electrical Works,,Tender,120.0,60.0,Sirmour,173001.0,,,,HPSIDC Shimla,No,No,AOC
,,,,,,,,,,,,,,,,.pdf,Signed copy of agreement Form,,,,,,,,,,,,,,,,2.0,ICICI NEFT/RTGS,,,,,,,,,,,,,,,,,,,,,,,,,AOC
,,,,,,,,,,,,,,,,.pdf,Affidavit that accept all terms and conditions and the information furnished with the bid documents,,,,,,,,,,,,,,,,,,,,,,,,,,,,,,,,,,,,,,,,,,AOC
,,,,,,,,,,,,,,,,.pdf,Affidavit that you have not more than 2 works in hand each of Rs.100 lakh or above in any department,,,,,,,,,,,,,,,,,,,,,,,,,,,,,,,,,,,,,,,,,,AOC
,,,,,,,,,,,,,,,,.pdf,Proof copy of active EPF registration No. and active GST registration No.,,,,,,,,,,,,,,,,,,,,,,,,,,,,,,,,,,,,,,,,,,AOC
,,,,,,,,,,,,,,,,.pdf,Copy of  latest ITR and pan card,,,,,,,,,,,,,,,,,,,,,,,,,,,,,,,,,,,,,,,,,,AOC
,,,,,,,,,,,,,,,,.pdf,Copy of receipt of EMD and cost of form,,,,,,,,,,,,,,,,,,,,,,,,,,,,,,,,,,,,,,,,,,AOC
,,,,,,,,,,,,,,2.0,Finance,.xls,BOQ,,,,,,,,,,,,,,,,,,,,,,,,,,,,,,,,,,,,,,,,,,AOC
