Committee Chairperson/Co-ordinator Name :,Committee Chairperson/Co-ordinator Type :,Committee Members :,Updated By :,Updated On :,Financial Bid Opening Date:,Document :,S.No,Bid Number,Bidder Name,Awarded Currency,Awarded Value,Organisation Chain :,Tender ID :,Tender Ref No :,Tender Title :,S.No.1,Bid Number.1,Bidder Name.1,Submitted Date,Status,Remarks,Status Updated On,Committee Chairperson/Co-ordinator Name :.1,Committee Chairperson/Co-ordinator Type :.1,Committee Members :.1,Updated By :.1,Updated on :,Document :.1,Type :,Summary :,Updated By :.2,Updated On :.1,Document :.2,Type :.1,Summary :.1,Updated By :.3,Updated On :.2,Document :.3,BOQ Comparative Chart :,Contract Date :,Contract Value :,Work Completion Period in days :,Updated By :.4,Updated on :.1,AOC document :,AOC Description :,Tender Stage,S.No,Instrument Type,Name,Address,Cover No,Cover,Document Type,Description,Title,Work Description,Pre Qualification Details,Independent External Monitor/Remarks,Tender Value in ₹,Product Category,Sub category,Contract Type,Bid Validity(Days),Period Of Work(Days),Location,Pincode,Pre Bid Meeting Place,Pre Bid Meeting Address,Pre Bid Meeting Date,Bid Opening Place,Should Allow NDA Tender,Allow Preferential Bidder,EMD Amount in ₹,EMD Exemption Allowed,EMD Fee Type,EMD Percentage,EMD Payable To,EMD Payable At,Organisation Chain,Tender Reference Number,Tender ID,Withdrawal Allowed,Tender Type,Form of contract,Tender Category,No. of Covers,General Technical Evaluation Allowed,ItemWise Technical Evaluation Allowed,Payment Mode,Is Multi Currency Allowed For BOQ,Is Multi Currency Allowed For Fee,Allow Two Stage Bidding,Publish Date,Bid Opening Date,Document Download / Sale Start Date,Document Download / Sale End Date,Clarification Start Date,Clarification End Date,Bid Submission Start Date,Bid Submission End Date,Financial Bid Opening Date,Tender Fee in ₹,Fee Payable To,Fee Payable At,Tender Fee Exemption Allowed,Tender Stage
EE,Internal,AGM SJPNL AO,Gopesh Behl,16-Mar-2022 03:20 PM,16-Mar-2022 03:25 PM,techsummary_86916.pdf (3080.54 KB),1.0,269625.0,Sohan Singh,INR,"1,779,998",Municipal Corporation Shimla,2022_MC_57602_6,441Dated22022022,Construction of Parking below Tibetan Colony Ghatru in ward No 26 under Shimla Smart City Mission,1.0,269625.0,Sohan Singh,13-Mar-2022 03:24 PM,Accepted-AOC,Accepted due to lowest rates,28-Mar-2022 12:16 PM,EE,Internal,AGM SJPNL AO,Rajesh Thakur,28-Mar-2022 12:15 PM,finsummary_86916.pdf (294.95 KB),Technical,BOS,Gopesh Behl,16-Mar-2022 01:15 PM,technical_86916.pdf,Finance,BOS,Rajesh Thakur,16-Mar-2022 04:16 PM,finance_86916.pdf,BOQ Comparative Chart,28-Mar-2022,"INR 1,779,998.55",90.0,Rajesh Thakur,28-Mar-2022 12:16 PM,2022_MC_57602_6.pdf (794.00 KB),AOC,AOC,1.0,DD - Demand Draft,Executive Engineer R B M C Shimla,Executive Engineer R B M C Shimla,1.0,Fee/PreQual/Technical,.pdf,Cost of form in shape of DD and Earnest money in shape of FDR as per E-procurement notice,Construction of Parking below Tibetan Colony Ghatru in ward No 26 under Shimla Smart City Mission,Construction of Parking below Tibetan Colony Ghatru in ward No 26 under Shimla Smart City Mission,Please refer Tender Documents ,NA ,"24,26,900",Civil Works,NA ,Tender,120.0,180.0,Shimla,171001.0,NA ,NA ,NA ,MC Shimla,No ,No,"48,500",No,fixed,,Executive Engineer R B M C Shimla,Shimla,Municipal Corporation Shimla,441Dated22022022,2022_MC_57602_6,Yes,Open Tender,Item Rate,Works,2.0,No,No,Offline,No,No,No,07-Mar-2022 05:00 PM,14-Mar-2022 02:00 PM,07-Mar-2022 05:00 PM,14-Mar-2022 10:00 AM,NA ,NA ,07-Mar-2022 05:00 PM,14-Mar-2022 10:00 AM,16-Mar-2022 03:25 PM,500.0,Executive Engineer R B M C Shimla,Shimla,No,AOC
,,,,,,,,,,,,,,,,2.0,269384.0,SUNIL SHARMA,12-Mar-2022 11:50 AM,Rejected-Finance,Rejected,28-Mar-2022 12:15 PM,,,,,,,,,,,,,,,,,,,,,,,,,AOC,2.0,FDR - Fixed Deposit,,,,,.pdf,Certificate of registration with HPPWD in appropriate class and latest renewal thereof,,,,,,,,,,,,,,,,,,,,,,,,,,,,,,,,,,,,,,,,,,,,,,,,,,,,AOC
,,,,,,,,,,,,,,,,,,,,,,,,,,,,,,,,,,,,,,,,,,,,,,,AOC,,,,,,,.pdf,Income Tax GST and EPF registration PAN Permanent Account No. and GST No.,,,,,,,,,,,,,,,,,,,,,,,,,,,,,,,,,,,,,,,,,,,,,,,,,,,,AOC
,,,,,,,,,,,,,,,,,,,,,,,,,,,,,,,,,,,,,,,,,,,,,,,AOC,,,,,,,.pdf,Affidavit that he does not have more than two works in hand in the MC Shimla as per condition No 10,,,,,,,,,,,,,,,,,,,,,,,,,,,,,,,,,,,,,,,,,,,,,,,,,,,,AOC
,,,,,,,,,,,,,,,,,,,,,,,,,,,,,,,,,,,,,,,,,,,,,,,AOC,,,,,,,.pdf,"Bidder must upload scanned copy of Proforma(It is mandatory), E-procurement Notice and Form MW-7",,,,,,,,,,,,,,,,,,,,,,,,,,,,,,,,,,,,,,,,,,,,,,,,,,,,AOC
,,,,,,,,,,,,,,,,,,,,,,,,,,,,,,,,,,,,,,,,,,,,,,,AOC,,,,,,,.pdf,"Printed Letter Head Pad mention Contractor name, WhatspNo., Address, Upload as per condition No 10.1",,,,,,,,,,,,,,,,,,,,,,,,,,,,,,,,,,,,,,,,,,,,,,,,,,,,AOC
,,,,,,,,,,,,,,,,,,,,,,,,,,,,,,,,,,,,,,,,,,,,,,,AOC,,,,,2.0,Finance,.xls,BOQ,,,,,,,,,,,,,,,,,,,,,,,,,,,,,,,,,,,,,,,,,,,,,,,,,,,,AOC
