Type :,Summary :,Updated By :,Updated On :,Document :,BOQ Comparative Chart :,Committee Chairperson/Co-ordinator Name :,Committee Chairperson/Co-ordinator Type :,Committee Members :,Updated By :.1,Updated on :,Document :.1,Committee Chairperson/Co-ordinator Name :.1,Committee Chairperson/Co-ordinator Type :.1,Committee Members :.1,Updated By :.2,Updated On :.1,Financial Bid Opening Date:,Document :.2,S.No,Bid Number,Bidder Name,Submitted Date,Status,Remarks,Status Updated On,Contract Date :,Contract Value :,Work Completion Period in days :,Updated By :.3,Updated on :.1,AOC document :,AOC Description :,Organisation Chain :,Tender ID :,Tender Ref No :,Tender Title :,S.No.1,Bid Number.1,Bidder Name.1,Awarded Currency,Awarded Value,Type :.1,Summary :.1,Updated By :.4,Updated On :.2,Document :.3,Tender Stage,Title,Work Description,Pre Qualification Details,Independent External Monitor/Remarks,Tender Value in ₹,Product Category,Sub category,Contract Type,Bid Validity(Days),Period Of Work(Days),Location,Pincode,Pre Bid Meeting Place,Pre Bid Meeting Address,Pre Bid Meeting Date,Bid Opening Place,Should Allow NDA Tender,Allow Preferential Bidder,Publish Date,Bid Opening Date,Document Download / Sale Start Date,Document Download / Sale End Date,Clarification Start Date,Clarification End Date,Bid Submission Start Date,Bid Submission End Date,Financial Bid Opening Date,EMD Amount in ₹,EMD through BG/ST or EMD Exemption Allowed,EMD Fee Type,EMD Percentage,EMD Payable To,EMD Payable At,Name,Address,Tender Fee in ₹,Fee Payable To,Fee Payable At,Tender Fee Exemption Allowed,Cover No,Cover,Document Type,Description,S.No,Bank Name,Organisation Chain,Tender Reference Number,Tender ID,Withdrawal Allowed,Tender Type,Form of contract,Tender Category,No. of Covers,General Technical Evaluation Allowed,ItemWise Technical Evaluation Allowed,Payment Mode,Is Multi Currency Allowed For BOQ,Is Multi Currency Allowed For Fee,Allow Two Stage Bidding,Tender Stage
Finance,We have open the financial bid for financial evaluation.,Kalyan Pathak,10-Feb-2022 03:41 PM,,BOQ Comparative Chart,Director of Research (Agri.),Internal,1 Dr Rupam Borgohain 2 Dr Mrinal Saikia 3 Dr Sailen Gogoi 4 Pankaj Barua 5 Jadumoni Bora 6 Dr Kalyan Pathak,Mrinal Saikia,01-Mar-2022 10:18 AM,finsummary_36609.pdf (324.51 KB),Diirector of Research (Agri),Internal,1 Dr Rupam Borgohain 2 Dr Mrinal Saikia 3 Dr Kalyan Pathak 4 Dr S Gogoi 5 Dr P Barua 6 Jadumoni Bora,Kalyan Pathak,04-Feb-2022 05:15 PM,04-Feb-2022 05:20 PM,techsummary_36609.pdf (601.64 KB),1,129452,Amnex Infotechnologies Pvt Ltd,13-Jan-2022 11:56 AM,Rejected-Finance,Due to L5 price,01-Mar-2022 10:18 AM,01-Mar-2022,INR 1599999.0,90.0,Mrinal Saikia,01-Mar-2022 10:29 AM,AOC.pdf (522.00 KB),Due to L1 bidder the firm selected for the award of contract.,Assam Agricultural University||Directorate of Research (Agri.),2021_AAU_23878_1,7(227.24)/DRA(A)/APART/GIS Website/25665-75,"Development of GIS Web Portal under APART, AAU, Jorhat",1.0,129346.0,"Science and Technology Park, Pune",INR,1599999.0,Technical,Nine quotation were received and all are submitted for technical evaluation.,Rupam Borgohain,04-Feb-2022 04:56 PM,,AOC,"Development of GIS Web Portal under APART, AAU, Jorhat","Development, Framework and Design of GIS Web Portal under APART, AAU, Jorhat",Please refer Tender documents. ,NA ,,Miscellaneous Services,NA ,Tender,90.0,90.0,"AAU, Jorhat",785013.0,NA ,NA ,NA ,"AAU, Jorhat-13",No ,No,29-Dec-2021 05:00 PM,13-Jan-2022 03:00 PM,29-Dec-2021 05:30 PM,13-Jan-2022 02:30 PM,04-Jan-2022 09:30 AM ,07-Jan-2022 04:30 PM ,10-Jan-2022 09:30 AM,13-Jan-2022 02:30 PM,04-Feb-2022 05:20 PM,"45,400",Yes,fixed,,Nil,Nil,Director of Research (Agri.),"Directorate of Research (Agri.), Assam Agricultural University, Jorhat-785013","1,000",Nil,Nil,Yes,1.0,Fee/PreQual/Technical,.pdf,Technical Bid,1.0,SBI Bank,Assam Agricultural University||Directorate of Research (Agri.),7(227.24)/DRA(A)/APART/GIS Website/25665-75,2021_AAU_23878_1,Yes,Open Tender,Item Rate,Services,2.0,No,No,Online,No,No,No,AOC
,,,,,,,,,,,,,,,,,,,2,129579,ASOMI POLYSEED PRIVATE LIMITED,13-Jan-2022 11:48 AM,Rejected-Technical,Due to non-submission of the following documents Company Registration Certificate Similar Nature of Work details IT return documents Company Profile etc as per our clause no 12 a of bid document,04-Feb-2022 05:15 PM,,,,,,,,,,,,,,,,,,,,,,AOC,,,,,,,,,,,,,,,,,,,,,,,,,,,,,,,,,,,,,,,,2.0,Finance,.xls,Financial Bid,,,,,,,,,,,,,,,,,AOC
,,,,,,,,,,,,,,,,,,,3,129505,CyberSWIFT Infotech Pvt. Ltd.,13-Jan-2022 12:36 PM,Rejected-Finance,Due to L2 price,01-Mar-2022 10:18 AM,,,,,,,,,,,,,,,,,,,,,,AOC,,,,,,,,,,,,,,,,,,,,,,,,,,,,,,,,,,,,,,,,,,,,,,,,,,,,,,,,,,,,AOC
,,,,,,,,,,,,,,,,,,,4,129485,Garudalytics Private Limited,13-Jan-2022 01:01 PM,Rejected-Technical,Due to non-submission of the IT return documents as the firm is incorporated on 14 May 2021 as per our clause no 8 of bid document.,04-Feb-2022 05:15 PM,,,,,,,,,,,,,,,,,,,,,,AOC,,,,,,,,,,,,,,,,,,,,,,,,,,,,,,,,,,,,,,,,,,,,,,,,,,,,,,,,,,,,AOC
,,,,,,,,,,,,,,,,,,,5,129398,HEXAMAP SOLUTIONS PRIVATE LIMITED,13-Jan-2022 02:13 PM,Rejected-Finance,Due to L3 price,01-Mar-2022 10:18 AM,,,,,,,,,,,,,,,,,,,,,,AOC,,,,,,,,,,,,,,,,,,,,,,,,,,,,,,,,,,,,,,,,,,,,,,,,,,,,,,,,,,,,AOC
,,,,,,,,,,,,,,,,,,,6,129593,Indigi Consulting and Solutions Private Limited,13-Jan-2022 01:43 PM,Rejected-Technical,Due to not having proven experience of 2 similar nature of services no experience with development of GIS web portal in last 3 years as per clause no. 8 b of bid document,04-Feb-2022 05:15 PM,,,,,,,,,,,,,,,,,,,,,,AOC,,,,,,,,,,,,,,,,,,,,,,,,,,,,,,,,,,,,,,,,,,,,,,,,,,,,,,,,,,,,AOC
,,,,,,,,,,,,,,,,,,,7,129512,Infoneo Technologies Private Limited,13-Jan-2022 01:48 PM,Rejected-Technical,Due to not having proven experience of 2 similar nature of services no experience with development of GIS web portal in last 3 years as per clause no 8 b of bid document,04-Feb-2022 05:15 PM,,,,,,,,,,,,,,,,,,,,,,AOC,,,,,,,,,,,,,,,,,,,,,,,,,,,,,,,,,,,,,,,,,,,,,,,,,,,,,,,,,,,,AOC
,,,,,,,,,,,,,,,,,,,8,129381,Satpalda Trading Private Limited,13-Jan-2022 11:49 AM,Rejected-Finance,Due to L4 price,01-Mar-2022 10:18 AM,,,,,,,,,,,,,,,,,,,,,,AOC,,,,,,,,,,,,,,,,,,,,,,,,,,,,,,,,,,,,,,,,,,,,,,,,,,,,,,,,,,,,AOC
,,,,,,,,,,,,,,,,,,,9,129346,"Science and Technology Park, Pune",12-Jan-2022 04:46 PM,Accepted-AOC,Due to L1 bidder the firm selected for the award of contract.,01-Mar-2022 10:29 AM,,,,,,,,,,,,,,,,,,,,,,AOC,,,,,,,,,,,,,,,,,,,,,,,,,,,,,,,,,,,,,,,,,,,,,,,,,,,,,,,,,,,,AOC
