Type :,Summary :,Updated By :,Updated On :,Document :,Type :.1,Summary :.1,Updated By :.1,Updated On :.1,Document :.1,BOQ Comparative Chart :,S.No,Bid Number,Bidder Name,Submitted Date,Status,Remarks,Status Updated On,Committee Chairperson/Co-ordinator Name :,Committee Chairperson/Co-ordinator Type :,Committee Members :,Updated By :.2,Updated on :,Document :.2,Contract Date :,Contract Value :,Work Completion Period in days :,Updated By :.3,Updated on :.1,AOC document :,AOC Description :,S.No.1,Bid Number.1,Bidder Name.1,Awarded Currency,Awarded Value,Organisation Chain :,Tender ID :,Tender Ref No :,Tender Title :,Committee Chairperson/Co-ordinator Name :.1,Committee Chairperson/Co-ordinator Type :.1,Committee Members :.1,Updated By :.4,Updated On :.2,Financial Bid Opening Date:,Document :.3,Tender Stage,EMD Amount in ₹,EMD through BG/ST or EMD Exemption Allowed,EMD Fee Type,EMD Percentage,EMD Payable To,EMD Payable At,Organisation Chain,Tender Reference Number,Tender ID,Withdrawal Allowed,Tender Type,Form of contract,Tender Category,No. of Covers,General Technical Evaluation Allowed,ItemWise Technical Evaluation Allowed,Payment Mode,Is Multi Currency Allowed For BOQ,Is Multi Currency Allowed For Fee,Allow Two Stage Bidding,Title,Work Description,Pre Qualification Details,Independent External Monitor/Remarks,Tender Value in ₹,Product Category,Sub category,Contract Type,Bid Validity(Days),Period Of Work(Days),Location,Pincode,Pre Bid Meeting Place,Pre Bid Meeting Address,Pre Bid Meeting Date,Bid Opening Place,Should Allow NDA Tender,Allow Preferential Bidder,Publish Date,Bid Opening Date,Document Download / Sale Start Date,Document Download / Sale End Date,Clarification Start Date,Clarification End Date,Bid Submission Start Date,Bid Submission End Date,Financial Bid Opening Date,Cover No,Cover,Document Type,Description,Name,Address,Tender Fee in ₹,Fee Payable To,Fee Payable At,Tender Fee Exemption Allowed,S.No,Instrument Type,Tender Stage
Technical,Bid accepted for Technical Evaluation,KHANINDRA SARMA,06-Dec-2021 04:03 PM,,Finance,Financial Bids downloaded,KHANINDRA SARMA,09-Jan-2022 05:40 PM,,BOQ Comparative Chart,1,127508,Abul Hussain Choudhury,04-Dec-2021 11:22 AM,Rejected-Finance,Not quoted the minimum,26-Jan-2022 10:10 AM,PD DRDA Kamrup-M,Internal,"Executive Engineer, DRDA Kamrup-M. BDO Dimoria. Accountant DRDA Kamrup-M. JE DRDA Kamrup-M",KHANINDRA SARMA,26-Jan-2022 10:10 AM,finsummary_36045.pdf (566.16 KB),17-Feb-2022,INR 3375000.0,365.0,KHANINDRA SARMA,09-Mar-2022 02:03 PM,DRDA-K-M-Borkhat-GP-Work-Order.pdf (629.00 KB),"As L1 has quoted 12 percent violating clause 36 of page no 32 of SBD, so L2 bidder is considered for the award",1.0,127506.0,THANU RAM KALITA,INR,3375000.0,Principal Secretary- P and RD- Assam Secretariat||Commissioner- P and RD- PNRD||DRDA Kamrup Metro,2021_PNRD_23436_1,10/e-tender/NIC/SOPD/2021-22 (Barkhat GP),"Construction of Barkhat Gaon Panchayat Office Building under SOPD For The Year 2017-18 of Dimoria Dev.Block, Assam","PD, DRDA, Kamrup Metro",Internal,"Executive Engineer, DRDA, Kamrup Metro. BDO, Dimoria Dev Block. Accountant, DRDA, Kamrup Metro. JE, DRDA, Kamrup Metro",KHANINDRA SARMA,07-Jan-2022 08:02 PM,08-Jan-2022 09:00 AM,techsummary_36045.pdf (1046.31 KB),AOC,"75,000",Yes,percentage,2.0%,"Project Director, Kamrup Metro, Guwahati",Guwahati,Principal Secretary- P and RD- Assam Secretariat||Commissioner- P and RD- PNRD||DRDA Kamrup Metro,10/e-tender/NIC/SOPD/2021-22 (Barkhat GP),2021_PNRD_23436_1,Yes,Open Tender,Works,Works,2.0,No,No,Offline,No,No,No,"Construction of Barkhat Gaon Panchayat Office Building under SOPD For The Year 2017-18 of Dimoria Dev.Block, Assam","Construction of Barkhat Gaon Panchayat Office Building under SOPD For The Year 2017-18 of Dimoria Dev.Block, Assam",As per Bid Document ,NA ,"37,50,000",Civil Works,NA ,Tender,180.0,365.0,"Barkhat GP under Dimoria Dev.Block, Kamrup-M",782402.0,"Office of PD, DRDA, Kamrup Metro, Guwahati ","Office of PD, DRDA, Kamrup Metro, Panbazar, Guwahati-781001 ",29-Nov-2021 11:30 AM ,"Office of PD, DRDA, Kamrup Metro, Guwahati",No ,No,17-Nov-2021 06:00 PM,06-Dec-2021 03:00 PM,18-Nov-2021 12:00 PM,04-Dec-2021 02:00 PM,NA ,NA ,30-Nov-2021 02:30 PM,04-Dec-2021 02:00 PM,08-Jan-2022 09:00 AM,1.0,Fee/PreQual/Technical,.pdf,Tender Processing Fee Document,"Project Director, DRDA, Kamrup Metro","Office of PD, DRDA, Kamrup Metro, Panbazar, Guwahati-781001","1,200","Project Director, Kamrup Metro, Guwahati",Guwahati,No,1.0,DD - Demand Draft,AOC
,,,,,,,,,,,2,127496,Consulting Engineer NG,03-Dec-2021 07:19 PM,Rejected-Technical,"Clause 1.4 of qualification info, Table no-06, page 38 of SBD",07-Jan-2022 08:02 PM,,,,,,,,,,,,,,,,,,,,,,,,,,,,,,AOC,,,,,,,,,,,,,,,,,,,,,,,,,,,,,,,,,,,,,,,,,,,,,,,,,,.pdf,Earnest Money Document,,,,,,,2.0,BC - Bankers Cheque,AOC
,,,,,,,,,,,3,127485,M/S B.S. ENTERPRISE,03-Dec-2021 04:31 PM,Rejected-Finance,Not quoted the minimum,26-Jan-2022 10:10 AM,,,,,,,,,,,,,,,,,,,,,,,,,,,,,,AOC,,,,,,,,,,,,,,,,,,,,,,,,,,,,,,,,,,,,,,,,,,,,,,,,,,.pdf,Technical Qualification Supporting Documents,,,,,,,3.0,BG - Bank Guarantee Irrevocable,AOC
,,,,,,,,,,,4,127477,SRI RUPAM BARMAN,03-Dec-2021 03:00 PM,Rejected-Finance,Rejected as quoted below the allowed range. Clause 36 page 32 Of SBD,26-Jan-2022 10:10 AM,,,,,,,,,,,,,,,,,,,,,,,,,,,,,,AOC,,,,,,,,,,,,,,,,,,,,,,,,,,,,,,,,,,,,,,,,,,,,,,,,,,.pdf,Signed Bid Document-To be downloaded and again uploaded by the bidder,,,,,,,4.0,FDR - Fixed Deposit Receipt,AOC
,,,,,,,,,,,5,127506,THANU RAM KALITA,04-Dec-2021 11:40 AM,Accepted-AOC,"As L1 has quoted 12 percent violating clause 36 of page no 32 of SBD, so L2 bidder is considered for the award",09-Mar-2022 02:03 PM,,,,,,,,,,,,,,,,,,,,,,,,,,,,,,AOC,,,,,,,,,,,,,,,,,,,,,,,,,,,,,,,,,,,,,,,,,,,,,,,,2.0,Finance,.xls,Financial Bid (In BOQ Format),,,,,,,,,AOC
