Committee Chairperson/Co-ordinator Name :,Committee Chairperson/Co-ordinator Type :,Committee Members :,Updated By :,Updated On :,Financial Bid Opening Date:,Document :,Organisation Chain :,Tender ID :,Tender Ref No :,Tender Title :,S.No,Bid Number,Bidder Name,Awarded Currency,Awarded Value,Type :,Summary :,Updated By :.1,Updated On :.1,Document :.1,S.No.1,Bid Number.1,Bidder Name.1,Submitted Date,Status,Remarks,Status Updated On,Committee Chairperson/Co-ordinator Name :.1,Committee Chairperson/Co-ordinator Type :.1,Committee Members :.1,Updated By :.2,Updated on :,Document :.2,Contract Date :,Contract Value :,Work Completion Period in days :,Updated By :.3,Updated on :.1,AOC document :,AOC Description :,Type :.1,Summary :.1,Updated By :.4,Updated On :.2,Document :.3,BOQ Comparative Chart :,Tender Stage,Publish Date,Bid Opening Date,Document Download / Sale Start Date,Document Download / Sale End Date,Clarification Start Date,Clarification End Date,Bid Submission Start Date,Bid Submission End Date,Financial Bid Opening Date,Name,Address,EMD Amount in ₹,EMD Exemption Allowed,EMD Fee Type,EMD Percentage,EMD Payable To,EMD Payable At,Cover No,Cover,Document Type,Description,Title,Work Description,Pre Qualification Details,Independent External Monitor/Remarks,Tender Value in ₹,Product Category,Sub category,Contract Type,Bid Validity(Days),Period Of Work(Days),Location,Pincode,Pre Bid Meeting Place,Pre Bid Meeting Address,Pre Bid Meeting Date,Bid Opening Place,Should Allow NDA Tender,Allow Preferential Bidder,Organisation Chain,Tender Reference Number,Tender ID,Withdrawal Allowed,Tender Type,Form of contract,Tender Category,No. of Covers,General Technical Evaluation Allowed,ItemWise Technical Evaluation Allowed,Payment Mode,Is Multi Currency Allowed For BOQ,Is Multi Currency Allowed For Fee,Allow Two Stage Bidding,Tender Fee in ₹,Fee Payable To,Fee Payable At,Tender Fee Exemption Allowed,S.No,Instrument Type,Tender Stage
EE,Internal,AGM SJPNL AO,Gopesh Behl,22-Mar-2022 10:34 AM,22-Mar-2022 10:35 AM,techsummary_87356.pdf (657.64 KB),Municipal Corporation Shimla,2022_MC_57851_4,523Dated26022022,Construction of Community Centr cum Parking on Khasra No 132 Up Mohal Shanti Vihar under Shimla Smart City Mission,1.0,270425.0,Akash Saini,INR,"12,600,000",Technical,BOS,Gopesh Behl,21-Mar-2022 04:41 PM,technical_87356.pdf,1.0,270425.0,Akash Saini,17-Mar-2022 10:22 AM,Accepted-AOC,Accepted due to lowest rates,30-Mar-2022 10:57 AM,EE,Internal,AGM SJPNL AO,Rajesh Thakur,30-Mar-2022 10:54 AM,finsummary_87356.pdf (294.95 KB),30-Mar-2022,"INR 13,627,756.3",240.0,Rajesh Thakur,30-Mar-2022 10:56 AM,2022_MC_57851_4.pdf (1128.00 KB),AOC,Finance,BOS,Rajesh Thakur,22-Mar-2022 10:55 AM,finance_87356.pdf,BOQ Comparative Chart,AOC,11-Mar-2022 02:30 PM,19-Mar-2022 02:00 PM,11-Mar-2022 02:30 PM,17-Mar-2022 05:00 PM,NA ,NA ,11-Mar-2022 02:30 PM,17-Mar-2022 05:00 PM,22-Mar-2022 10:35 AM,Executive Engineer R B M C Shimla,Executive Engineer R B M C Shimla,"2,95,000",No,fixed,,Executive Engineer R B M C Shimla,Shimla,1.0,Fee/PreQual/Technical,.pdf,Cost of form in shape of DD and Earnest money in shape of FDR as per E-procurement notice,Construction of Community Centr cum Parking on Khasra No 132 Up Mohal Shanti Vihar under Shimla Smart City Mission,Construction of Community Centr cum Parking on Khasra No 132 Up Mohal Shanti Vihar under Shimla Smart City Mission,Please refer Tender Documents ,NA ,"1,47,24,638",Civil Works,NA ,Tender,120.0,240.0,Shimla,171001.0,NA ,NA ,NA ,MC Shimla,No ,No,Municipal Corporation Shimla,523Dated26022022,2022_MC_57851_4,Yes,Open Tender,Item Rate,Works,2.0,No,No,Offline,No,No,No,"5,000",Executive Engineer R B M C Shimla,Shimla,No,1.0,DD - Demand Draft,AOC
,,,,,,,,,,,,,,,,,,,,,2.0,270394.0,"Rahul Rai, Govt. Contractor",16-Mar-2022 05:20 PM,Rejected-Finance,Rejected,30-Mar-2022 10:54 AM,,,,,,,,,,,,,,,,,,,,AOC,,,,,,,,,,,,,,,,,,,,.pdf,Certificate of registration with HPPWD in appropriate class and latest renewal thereof,,,,,,,,,,,,,,,,,,,,,,,,,,,,,,,,,,,,,2.0,FDR - Fixed Deposit,AOC
,,,,,,,,,,,,,,,,,,,,,3.0,270369.0,VISHWA BHUMI ENGINEERS P LTD,16-Mar-2022 03:52 PM,Rejected-Finance,Rejected,30-Mar-2022 10:54 AM,,,,,,,,,,,,,,,,,,,,AOC,,,,,,,,,,,,,,,,,,,,.pdf,Income Tax GST and EPF registration PAN Permanent Account No. and GST No.,,,,,,,,,,,,,,,,,,,,,,,,,,,,,,,,,,,,,,,AOC
,,,,,,,,,,,,,,,,,,,,,,,,,,,,,,,,,,,,,,,,,,,,,,,AOC,,,,,,,,,,,,,,,,,,,,.pdf,Affidavit that he does not have more than two works in hand in the MC Shimla as per condition No 10,,,,,,,,,,,,,,,,,,,,,,,,,,,,,,,,,,,,,,,AOC
,,,,,,,,,,,,,,,,,,,,,,,,,,,,,,,,,,,,,,,,,,,,,,,AOC,,,,,,,,,,,,,,,,,,,,.pdf,"Bidder must upload scanned copy of Proforma(It is mandatory), E-procurement Notice and Form MW-7",,,,,,,,,,,,,,,,,,,,,,,,,,,,,,,,,,,,,,,AOC
,,,,,,,,,,,,,,,,,,,,,,,,,,,,,,,,,,,,,,,,,,,,,,,AOC,,,,,,,,,,,,,,,,,,,,.pdf,"Printed Letter Head Pad mention Contractor name, WhatspNo., Address, Upload as per condition No 10.1",,,,,,,,,,,,,,,,,,,,,,,,,,,,,,,,,,,,,,,AOC
,,,,,,,,,,,,,,,,,,,,,,,,,,,,,,,,,,,,,,,,,,,,,,,AOC,,,,,,,,,,,,,,,,,,2.0,Finance,.xls,BOQ,,,,,,,,,,,,,,,,,,,,,,,,,,,,,,,,,,,,,,,AOC
