Committee Chairperson/Co-ordinator Name :,Committee Chairperson/Co-ordinator Type :,Committee Members :,Updated By :,Updated on :,Document :,Organisation Chain :,Tender ID :,Tender Ref No :,Tender Title :,Contract Date :,Contract Value :,Work Completion Period in days :,Updated By :.1,Updated on :.1,AOC document :,AOC Description :,S.No,Bid Number,Bidder Name,Awarded Currency,Awarded Value,Type :,Summary :,Updated By :.2,Updated On :,Document :.1,Committee Chairperson/Co-ordinator Name :.1,Committee Chairperson/Co-ordinator Type :.1,Committee Members :.1,Updated By :.3,Updated On :.1,Financial Bid Opening Date:,Document :.2,S.No.1,Bid Number.1,Bidder Name.1,Submitted Date,Status,Remarks,Status Updated On,Type :.1,Summary :.1,Updated By :.4,Updated On :.2,Document :.3,BOQ Comparative Chart :,Tender Stage,EMD Amount in ₹,EMD Exemption Allowed,EMD Fee Type,EMD Percentage,EMD Payable To,EMD Payable At,Name,Address,S.No,Bank Name,Organisation Chain,Tender Reference Number,Tender ID,Withdrawal Allowed,Tender Type,Form of contract,Tender Category,No. of Covers,General Technical Evaluation Allowed,ItemWise Technical Evaluation Allowed,Payment Mode,Is Multi Currency Allowed For BOQ,Is Multi Currency Allowed For Fee,Allow Two Stage Bidding,Title,Work Description,Pre Qualification Details,Independent External Monitor/Remarks,Tender Value in ₹,Product Category,Sub category,Contract Type,Bid Validity(Days),Period Of Work(Days),Location,Pincode,Pre Bid Meeting Place,Pre Bid Meeting Address,Pre Bid Meeting Date,Bid Opening Place,Should Allow NDA Tender,Allow Preferential Bidder,Cover No,Cover,Document Type,Description,Tender Fee in ₹,Fee Payable To,Fee Payable At,Tender Fee Exemption Allowed,Publish Date,Bid Opening Date,Document Download / Sale Start Date,Document Download / Sale End Date,Clarification Start Date,Clarification End Date,Bid Submission Start Date,Bid Submission End Date,Financial Bid Opening Date,Tender Stage
EE,Internal,"DM, Manager(F), AE(HQ)",Sushant Singh Negi,17-Jul-2021 12:03 PM,finsummary_73360.pdf (29.49 KB),HP SIDC Limited,2021_SIDC_48955_1,Job No. 11,Providing and fixing windows and doors at Elementary Block Govt. Sr. Sec. School Pandoh Distt. Mandi (HP).,26-Aug-2021,"INR 978,843",120.0,Sushant Singh Negi,28-Aug-2021 11:02 AM,birisingh.pdf (963.00 KB),AOC,1.0,220272.0,Biri SIngh,INR,"978,843",Technical,Technical evaluation summary,Sushant Singh Negi,14-Jul-2021 10:43 AM,technical_73360.pdf,EE(HQ),Internal,"DM, Manager(F), AE(HQ)",Sushant Singh Negi,14-Jul-2021 10:44 AM,15-Jul-2021 11:00 AM,techsummary_73360.pdf (531.53 KB),1.0,220272.0,Biri SIngh,29-Jun-2021 04:09 PM,Accepted-AOC,AOC,28-Aug-2021 11:02 AM,Finance,Financial summary,Sushant Singh Negi,17-Jul-2021 12:01 PM,finance_73360.pdf,BOQ Comparative Chart,AOC,"15,200",No,fixed,,Nil,Nil,Executive Engineer,HPSIDC Ltd. Shimla,1.0,ICICI BANK,HP SIDC Limited,Job No. 11,2021_SIDC_48955_1,Yes,Open Tender,Item Rate,Works,2.0,No,No,Online,No,No,No,Providing and fixing windows and doors at Elementary Block Govt. Sr. Sec. School Pandoh Distt. Mandi (HP).,Providing and fixing windows and doors at Elementary Block Govt. Sr. Sec. School Pandoh Distt. Mandi (HP).,Please refer Tender documents. ,NA ,"7,61,021",Civil Works,NA ,Tender,120.0,120.0,Panoh (Mandi),174003.0,NA ,NA ,NA ,HPSIDC Ltd. Shimla,No ,No,1.0,Fee/PreQual/Technical,.pdf,Appropriate Contractor registration (as per tender condition),800.0,Nil,Nil,No,23-Jun-2021 11:00 AM,30-Jun-2021 11:00 AM,23-Jun-2021 11:00 AM,29-Jun-2021 05:00 PM,NA ,NA ,23-Jun-2021 11:00 AM,29-Jun-2021 05:00 PM,15-Jul-2021 11:00 AM,AOC
,,,,,,,,,,,,,,,,,,,,,,,,,,,,,,,,,,2.0,220243.0,GD Builders & Construction Associates,29-Jun-2021 03:26 PM,Rejected-Finance,Second lowest bidder,17-Jul-2021 12:03 PM,,,,,,,AOC,,,,,,,,,2.0,ICICI NEFT/RTGS,,,,,,,,,,,,,,,,,,,,,,,,,,,,,,,,,,,.pdf,Signed copy of agreement form and approved make for materials,,,,,,,,,,,,,,AOC
,,,,,,,,,,,,,,,,,,,,,,,,,,,,,,,,,,,,,,,,,,,,,,,AOC,,,,,,,,,,,,,,,,,,,,,,,,,,,,,,,,,,,,,,,,,,,,,.pdf,Affidavit that the information furnished with the bid documents is true and correct.,,,,,,,,,,,,,,AOC
,,,,,,,,,,,,,,,,,,,,,,,,,,,,,,,,,,,,,,,,,,,,,,,AOC,,,,,,,,,,,,,,,,,,,,,,,,,,,,,,,,,,,,,,,,,,,,,.pdf,Affidavit that you have not more than 2 works in hand each of Rs.100 lakh or above in any department,,,,,,,,,,,,,,AOC
,,,,,,,,,,,,,,,,,,,,,,,,,,,,,,,,,,,,,,,,,,,,,,,AOC,,,,,,,,,,,,,,,,,,,,,,,,,,,,,,,,,,,,,,,,,,,,,.pdf,Proof copy of EPF registration No.,,,,,,,,,,,,,,AOC
,,,,,,,,,,,,,,,,,,,,,,,,,,,,,,,,,,,,,,,,,,,,,,,AOC,,,,,,,,,,,,,,,,,,,,,,,,,,,,,,,,,,,,,,,,,,,,,.pdf,Proof copy of GST registration No.,,,,,,,,,,,,,,AOC
,,,,,,,,,,,,,,,,,,,,,,,,,,,,,,,,,,,,,,,,,,,,,,,AOC,,,,,,,,,,,,,,,,,,,,,,,,,,,,,,,,,,,,,,,,,,,,,.pdf,Copy of latest ITR and pan card,,,,,,,,,,,,,,AOC
,,,,,,,,,,,,,,,,,,,,,,,,,,,,,,,,,,,,,,,,,,,,,,,AOC,,,,,,,,,,,,,,,,,,,,,,,,,,,,,,,,,,,,,,,,,,,,,.pdf,Copy of receipt of EMD and cost of form,,,,,,,,,,,,,,AOC
,,,,,,,,,,,,,,,,,,,,,,,,,,,,,,,,,,,,,,,,,,,,,,,AOC,,,,,,,,,,,,,,,,,,,,,,,,,,,,,,,,,,,,,,,,,,,2.0,Finance,.xls,BOQ,,,,,,,,,,,,,,AOC
