Cover No,Cover,Document Type,Description,Name,Address,Publish Date,Bid Opening Date,Document Download / Sale Start Date,Document Download / Sale End Date,Clarification Start Date,Clarification End Date,Bid Submission Start Date,Bid Submission End Date,Financial Bid Opening Date,Organisation Chain,Tender Reference Number,Tender ID,Withdrawal Allowed,Tender Type,Form of contract,Tender Category,No. of Covers,General Technical Evaluation Allowed,ItemWise Technical Evaluation Allowed,Payment Mode,Is Multi Currency Allowed For BOQ,Is Multi Currency Allowed For Fee,Allow Two Stage Bidding,Tender Fee in ₹,Fee Payable To,Fee Payable At,Tender Fee Exemption Allowed,EMD Amount in ₹,EMD Exemption Allowed,EMD Fee Type,EMD Percentage,EMD Payable To,EMD Payable At,S.No,Bank Name,Title,Work Description,Pre Qualification Details,Independent External Monitor/Remarks,Tender Value in ₹,Product Category,Sub category,Contract Type,Bid Validity(Days),Period Of Work(Days),Location,Pincode,Pre Bid Meeting Place,Pre Bid Meeting Address,Pre Bid Meeting Date,Bid Opening Place,Should Allow NDA Tender,Allow Preferential Bidder,Tender Stage,Type :,Summary :,Updated By :,Updated On :,Document :,BOQ Comparative Chart :,S.No,Bid Number,Bidder Name,Submitted Date,Status,Remarks,Status Updated On,Committee Chairperson/Co-ordinator Name :,Committee Chairperson/Co-ordinator Type :,Committee Members :,Updated By :.1,Updated On :.1,Financial Bid Opening Date:,Document :.1,Type :.1,Summary :.1,Updated By :.2,Updated On :.2,Document :.2,S.No.1,Bid Number.1,Bidder Name.1,Awarded Currency,Awarded Value,Contract Date :,Contract Value :,Work Completion Period in days :,Updated By :.3,Updated on :,AOC document :,AOC Description :,Organisation Chain :,Tender ID :,Tender Ref No :,Tender Title :,Committee Chairperson/Co-ordinator Name :.1,Committee Chairperson/Co-ordinator Type :.1,Committee Members :.1,Updated By :.4,Updated on :.1,Document :.3,Tender Stage
1.0,Fee/PreQual/Technical,.pdf,Enlistment (as per NIT conditions),Executive Engineer,HPSIDC Ltd. Shimla,25-Jul-2019 01:30 PM,17-Aug-2019 11:00 AM,25-Jul-2019 01:30 PM,16-Aug-2019 05:00 PM,NA ,NA ,25-Jul-2019 01:30 PM,16-Aug-2019 05:00 PM,06-Sep-2019 11:00 AM,HP SIDC Limited,Job No. 10,2019_SIDC_30437_1,Yes,Open Tender,Item Rate,Works,2.0,No,No,Online,No,No,No,"3,100",EE HPSIDC Ltd. Shimla,HPSIDC Ltd. Shimla,No,"59,900",No,fixed,,EE HPSIDC Ltd. Shimla,HPSIDC Ltd. Shimla,1.0,ICICI BANK,Construction of 1 No. RCC Overhead Tank of 2.00 Lac ltr. Capacity with staging height 18 mtrs. at Ind. Area Basal Distt. Una (HP).,Construction of 1 No. RCC Overhead Tank of 2.00 Lac ltr. Capacity with staging height 18 mtrs. at Ind. Area Basal Distt. Una (HP).,Please refer Tender documents. ,NA ,"26,93,686",Civil Works,NA ,Tender,120.0,180.0,Basal (Una),174303.0,NA ,NA ,NA ,HPSIDC Ltd. Shimla,No ,No,AOC,Finance,Financial summary,Sushant Singh Negi,17-Sep-2019 12:04 PM,finance_43845.pdf,BOQ Comparative Chart,1.0,127982.0,M/S OM PARKASH DHIMAN AND SONS,16-Aug-2019 04:31 PM,Accepted-AOC,AOC,05-Aug-2021 04:24 PM,SE,Internal,"DM, AE(HQ), Dy. Manager (P), EE",Sushant Singh Negi,05-Sep-2019 04:18 PM,06-Sep-2019 11:00 AM,techsummary_43845.pdf (811.82 KB),Technical,Opening summary,Sushant Singh Negi,28-Aug-2019 10:52 AM,technical_43845.pdf,1.0,127982.0,M/S OM PARKASH DHIMAN AND SONS,INR,"2,747,107",04-Jan-2020,"INR 2,747,107",180.0,Sushant Singh Negi,05-Aug-2021 04:24 PM,omprakash.pdf (1640.00 KB),AOC (Awarded 04.01.2019,HP SIDC Limited,2019_SIDC_30437_1,Job No. 10,Construction of 1 No. RCC Overhead Tank of 2.00 Lac ltr. Capacity with staging height 18 mtrs. at Ind. Area Basal Distt. Una (HP).,EE,Internal,"DM, AE, Dy. Manager (P)",Sushant Singh Negi,17-Sep-2019 12:09 PM,finsummary_43845.pdf (491.33 KB),AOC
,,.pdf,Signed copy of agreement form,,,,,,,,,,,,,,,,,,,,,,,,,,,,,,,,,,,,2.0,ICICI NEFT/RTGS,,,,,,,,,,,,,,,,,,,AOC,,,,,,,2.0,127900.0,Om Parkash Govt Contrator,16-Aug-2019 03:06 PM,Rejected-Finance,Second lowest bidder,17-Sep-2019 12:09 PM,,,,,,,,,,,,,,,,,,,,,,,,,,,,,,,,,,,AOC
,,.pdf,Proof copy of GST registration No.,,,,,,,,,,,,,,,,,,,,,,,,,,,,,,,,,,,,,,,,,,,,,,,,,,,,,,,,AOC,,,,,,,3.0,127970.0,Prafull Bedi,16-Aug-2019 03:07 PM,Rejected-Technical,The similar type of work done in last five years has not submitted as per conditions of tender,05-Sep-2019 04:18 PM,,,,,,,,,,,,,,,,,,,,,,,,,,,,,,,,,,,AOC
,,.pdf,Proof copy of EPF registration No.,,,,,,,,,,,,,,,,,,,,,,,,,,,,,,,,,,,,,,,,,,,,,,,,,,,,,,,,AOC,,,,,,,4.0,127495.0,Sarabjit Singh Katoch,12-Aug-2019 08:12 PM,Rejected-Technical,Inappropriate contractor registration class,05-Sep-2019 04:18 PM,,,,,,,,,,,,,,,,,,,,,,,,,,,,,,,,,,,AOC
,,.pdf,Copy of latest ITR and pan card,,,,,,,,,,,,,,,,,,,,,,,,,,,,,,,,,,,,,,,,,,,,,,,,,,,,,,,,AOC,,,,,,,5.0,127916.0,SHIV KANT PRASHAR,15-Aug-2019 11:44 PM,Rejected-Technical,Inappropriate contractor registration class,05-Sep-2019 04:18 PM,,,,,,,,,,,,,,,,,,,,,,,,,,,,,,,,,,,AOC
,,.pdf,Copy of work done certificate ( as per NIT conditions),,,,,,,,,,,,,,,,,,,,,,,,,,,,,,,,,,,,,,,,,,,,,,,,,,,,,,,,AOC,,,,,,,6.0,127921.0,Vinod Kumar,16-Aug-2019 01:24 PM,Rejected-Technical,The similar type of work done in last five years has not submitted as per conditions of tender,05-Sep-2019 04:18 PM,,,,,,,,,,,,,,,,,,,,,,,,,,,,,,,,,,,AOC
,,.pdf,Scan copy of EMD and cost of form,,,,,,,,,,,,,,,,,,,,,,,,,,,,,,,,,,,,,,,,,,,,,,,,,,,,,,,,AOC,,,,,,,,,,,,,,,,,,,,,,,,,,,,,,,,,,,,,,,,,,,,,,,,AOC
2.0,Finance,.xls,BOQ,,,,,,,,,,,,,,,,,,,,,,,,,,,,,,,,,,,,,,,,,,,,,,,,,,,,,,,,AOC,,,,,,,,,,,,,,,,,,,,,,,,,,,,,,,,,,,,,,,,,,,,,,,,AOC
