Type :,Summary :,Updated By :,Updated On :,Document :,S.No,Bid Number,Bidder Name,Submitted Date,Status,Remarks,Status Updated On,Type :.1,Summary :.1,Updated By :.1,Updated On :.1,Document :.1,BOQ Comparative Chart :,S.No.1,Bid Number.1,Bidder Name.1,Awarded Currency,Awarded Value,Contract Date :,Contract Value :,Work Completion Period in days :,Updated By :.2,Updated on :,AOC document :,AOC Description :,Committee Chairperson/Co-ordinator Name :,Committee Chairperson/Co-ordinator Type :,Committee Members :,Updated By :.3,Updated on :.1,Document :.2,Committee Chairperson/Co-ordinator Name :.1,Committee Chairperson/Co-ordinator Type :.1,Committee Members :.1,Updated By :.4,Updated On :.2,Financial Bid Opening Date:,Document :.3,Organisation Chain :,Tender ID :,Tender Ref No :,Tender Title :,Tender Stage,Publish Date,Bid Opening Date,Document Download / Sale Start Date,Document Download / Sale End Date,Clarification Start Date,Clarification End Date,Bid Submission Start Date,Bid Submission End Date,Financial Bid Opening Date,EMD Amount in ₹,EMD Exemption Allowed,EMD Fee Type,EMD Percentage,EMD Payable To,EMD Payable At,Organisation Chain,Tender Reference Number,Tender ID,Withdrawal Allowed,Tender Type,Form of contract,Tender Category,No. of Covers,General Technical Evaluation Allowed,ItemWise Technical Evaluation Allowed,Payment Mode,Is Multi Currency Allowed For BOQ,Is Multi Currency Allowed For Fee,Allow Two Stage Bidding,Tender Fee in ₹,Fee Payable To,Fee Payable At,Tender Fee Exemption Allowed,Name,Address,Cover No,Cover,Document Type,Description,Title,Work Description,Pre Qualification Details,Independent External Monitor/Remarks,Tender Value in ₹,Product Category,Sub category,Contract Type,Bid Validity(Days),Period Of Work(Days),Location,Pincode,Pre Bid Meeting Place,Pre Bid Meeting Address,Pre Bid Meeting Date,Bid Opening Place,Should Allow NDA Tender,Allow Preferential Bidder,S.No,Instrument Type,Tender Stage
Technical,Please find the attachment,Rita Sharma,12-Aug-2021 03:21 PM,technical_75356.pdf,1,229126,Anam Thakur,11-Aug-2021 10:12 AM,Rejected-Finance,Only L1 is Accepted,13-Aug-2021 01:37 PM,Finance,Please find attachment,Ashwani Kumar Bhardwaj,13-Aug-2021 01:32 PM,finance_75356.pdf,BOQ Comparative Chart,1.0,228596.0,Jeet Singh Thakur,INR,"1,041,509.25",25-Aug-2021,"INR 1,155,000",120.0,Ashwani Kumar Bhardwaj,25-Aug-2021 11:39 AM,awardletter.pdf (1815.00 KB),Please find attachment,Divisional Engineer Shimla(SC),Internal,Please find attachment,Ashwani Kumar Bhardwaj,13-Aug-2021 01:37 PM,finsummary_75356.pdf (383.61 KB),Divisional Engineer Shimla(SC),Internal,Please see attachment,Ashwani Kumar Bhardwaj,12-Aug-2021 03:31 PM,12-Aug-2021 03:35 PM,techsummary_75356.pdf (375.59 KB),Director of Agriculture||Agriculture Head Office - DoA,2021_DoA_50346_1,No. Agr. (SC)DE(G)1-5/2004-VOL-(IX)-,Agr. (SC)DE(G)1-5/2004-VOL-(IX)-,AOC,28-Jul-2021 05:00 PM,12-Aug-2021 12:00 PM,28-Jul-2021 05:00 PM,11-Aug-2021 05:00 PM,NA ,NA ,28-Jul-2021 05:00 PM,11-Aug-2021 05:00 PM,12-Aug-2021 03:35 PM,"23,100",No,fixed,,As mentioned in Tender Document,Shimla,Director of Agriculture||Agriculture Head Office - DoA,No. Agr. (SC)DE(G)1-5/2004-VOL-(IX)-,2021_DoA_50346_1,Yes,Open Tender,Item Rate,Works,2.0,No,No,Offline,No,No,No,500.0,As mentioned in Tender Document,Shimla,No,Superintending Engineer,"o/o Superintending engineer, Shimla Division ,Boileauganj, shimla-5",1.0,Fee/PreQual/Technical,.pdf,Documents required to be uploaded as per Tender Document,Agr. (SC)DE(G)1-5/2004-VOL-(IX)-,"Work for the Tilling, Distempering, Steel Mesh and General Maintenance for the O/o Superintending Engineer (Soil Cons), Shimla Division, Shimla 5, ASO Office and AIO Office at Krishi Bhawan Annexe Complex Shimla 5",Please see tender document ,NA ,"11,55,000",Repair and Maintenance Works,NA ,Rate Contract,60.0,120.0,"o/o Superintending engineer, Boileauganj, shimla-5",171005.0,NA ,NA ,NA ,"o/o Superintending engineer, Boileauganj, shimla-5",No ,No,1.0,DD - Demand Draft,AOC
,,,,,2,228596,Jeet Singh Thakur,09-Aug-2021 03:05 PM,Accepted-AOC,L1 rate quoted,25-Aug-2021 11:38 AM,,,,,,,,,,,,,,,,,,,,,,,,,,,,,,,,,,,,AOC,,,,,,,,,,,,,,,,,,,,,,,,,,,,,,,,,,,,,,.pdf,Copy of Tender Fee and earnest money as per Tender Document,,,,,,,,,,,,,,,,,,,2.0,SS - Small Savings Instrument,AOC
,,,,,3,229056,RAJESH KUMAR,11-Aug-2021 03:52 PM,Rejected-Finance,Only L1 is Accepted,13-Aug-2021 01:37 PM,,,,,,,,,,,,,,,,,,,,,,,,,,,,,,,,,,,,AOC,,,,,,,,,,,,,,,,,,,,,,,,,,,,,,,,,,,,2.0,Finance,.xls,Price Bid (BOQ),,,,,,,,,,,,,,,,,,,3.0,FDR - Fixed Deposit,AOC
,,,,,4,228928,Rajesh Sharma,10-Aug-2021 01:44 PM,Rejected-Finance,Only L1 is Accepted,13-Aug-2021 01:37 PM,,,,,,,,,,,,,,,,,,,,,,,,,,,,,,,,,,,,AOC,,,,,,,,,,,,,,,,,,,,,,,,,,,,,,,,,,,,,,,,,,,,,,,,,,,,,,,,,,,,AOC
,,,,,5,229010,Raman Kumr,10-Aug-2021 03:45 PM,Rejected-Finance,Only L1 is Accepted,13-Aug-2021 01:37 PM,,,,,,,,,,,,,,,,,,,,,,,,,,,,,,,,,,,,AOC,,,,,,,,,,,,,,,,,,,,,,,,,,,,,,,,,,,,,,,,,,,,,,,,,,,,,,,,,,,,AOC
