S.No,Bid Number,Bidder Name,Awarded Currency,Awarded Value,Organisation Chain :,Tender ID :,Tender Ref No :,Tender Title :,Committee Chairperson/Co-ordinator Name :,Committee Chairperson/Co-ordinator Type :,Committee Members :,Updated By :,Updated on :,Document :,Committee Chairperson/Co-ordinator Name :.1,Committee Chairperson/Co-ordinator Type :.1,Committee Members :.1,Updated By :.1,Updated On :,Financial Bid Opening Date:,Document :.1,S.No.1,Bid Number.1,Bidder Name.1,Submitted Date,Status,Remarks,Status Updated On,Contract Date :,Contract Value :,Work Completion Period in days :,Updated By :.2,Updated on :.1,AOC document :,AOC Description :,Type :,Summary :,Updated By :.3,Updated On :.1,Document :.2,BOQ Comparative Chart :,Type :.1,Summary :.1,Updated By :.4,Updated On :.2,Document :.3,Tender Stage,Publish Date,Bid Opening Date,Document Download / Sale Start Date,Document Download / Sale End Date,Clarification Start Date,Clarification End Date,Bid Submission Start Date,Bid Submission End Date,Financial Bid Opening Date,Title,Work Description,Pre Qualification Details,Independent External Monitor/Remarks,Tender Value in ₹,Product Category,Sub category,Contract Type,Bid Validity(Days),Period Of Work(Days),Location,Pincode,Pre Bid Meeting Place,Pre Bid Meeting Address,Pre Bid Meeting Date,Bid Opening Place,Should Allow NDA Tender,Allow Preferential Bidder,Organisation Chain,Tender Reference Number,Tender ID,Withdrawal Allowed,Tender Type,Form of contract,Tender Category,No. of Covers,General Technical Evaluation Allowed,ItemWise Technical Evaluation Allowed,Payment Mode,Is Multi Currency Allowed For BOQ,Is Multi Currency Allowed For Fee,Allow Two Stage Bidding,S.No,Bank Name,Tender Fee in ₹,Fee Payable To,Fee Payable At,Tender Fee Exemption Allowed,EMD Amount in ₹,EMD Exemption Allowed,EMD Fee Type,EMD Percentage,EMD Payable To,EMD Payable At,Name,Address,Cover No,Cover,Document Type,Description,Tender Stage
1.0,294454.0,suresh kumar gupta,INR,"3,189,388","Himachal Urban Development Authority||Supdt. Engineer (N),HIMUDA||Executive Engineer Division,Dharamsala,HIMUDA",2022_HIMUD_63154_1,HIMUDA/DD/CB/W-7/2684-2708,Construction of Pong view Residential Colony at Dhera Distt. Kangra HP,Er. Dinesh Verma E.E.,Internal,"Smt. Bandna Katoch, Supdt., Sh. Abhishek Thakur, DA, Sh. Lalit Bhiushan, HDM",DINESH VERMA,18-Aug-2022 10:41 AM,finsummary_95206.pdf (406.24 KB),Er. Dinesh Verma E.E.,Internal,"Smt. Bandna Katoch, Supdt. , Sh. Abhishek Thakur, DA, Sh. Lalit Bhushan HDM",DINESH VERMA,17-Aug-2022 12:04 PM,17-Aug-2022 12:05 PM,techsummary_95206.pdf (215.61 KB),1.0,294931.0,SHIV KANT PRASHAR,09-Aug-2022 01:56 PM,Rejected-Finance,L2 Bidder,18-Aug-2022 10:41 AM,07-Sep-2022,"INR 4,601,494",180.0,DINESH VERMA,09-Sep-2022 01:08 PM,AwardletterexternaSS.pdf (1203.00 KB),This work is awarded to Sh. Suresh Kumar Gupta Govt Contractor WArd No. 7 Tehsil Nurpur Distt. Kangra,Finance,Financial Bid opening summary,DINESH VERMA,18-Aug-2022 10:39 AM,finance_95206.pdf,BOQ Comparative Chart,Technical,Technical Bid opening summary,DINESH VERMA,17-Aug-2022 12:00 PM,technical_95206.pdf,AOC,27-Jul-2022 04:40 PM,10-Aug-2022 12:00 PM,27-Jul-2022 05:00 PM,09-Aug-2022 04:00 PM,27-Jul-2022 05:00 PM ,09-Aug-2022 04:00 PM ,27-Jul-2022 05:00 PM,09-Aug-2022 04:00 PM,17-Aug-2022 12:05 PM,Construction of Pong view Residential Colony at Dhera Distt. Kangra HP,SH Providing and laying external sewerage system,Please refer Tender documents. ,NA ,"46,01,494",Civil Works,NA ,Tender,120.0,180.0,Dehra Distt. Kangra,177117.0,NA ,NA ,NA ,Executive Engineer HIMUDA Division Dharamshala,No ,No,"Himachal Urban Development Authority||Supdt. Engineer (N),HIMUDA||Executive Engineer Division,Dharamsala,HIMUDA",HIMUDA/DD/CB/W-7/2684-2708,2022_HIMUD_63154_1,Yes,Open Tender,Item Rate,Works,2.0,No,No,Online,No,No,No,1.0,ICICI BANK,"2,000",Nil,Nil,Yes,"92,050",Yes,fixed,,Nil,Nil,Executive Engineer,HIMUDA Division Dharamshala,1.0,Fee/PreQual/Technical,.pdf,Earnest Money (As per NIT),AOC
,,,,,,,,,,,,,,,,,,,,,,2.0,294454.0,suresh kumar gupta,08-Aug-2022 10:24 AM,Accepted-AOC,L1 Bidder,09-Sep-2022 01:09 PM,,,,,,,,,,,,,,,,,,,AOC,,,,,,,,,,,,,,,,,,,,,,,,,,,,,,,,,,,,,,,,,,2.0,ICICI NEFT/RTGS,,,,,,,,,,,,,,,.pdf,Cost of Tender Form (As per NIT),AOC
,,,,,,,,,,,,,,,,,,,,,,,,,,,,,,,,,,,,,,,,,,,,,,,AOC,,,,,,,,,,,,,,,,,,,,,,,,,,,,,,,,,,,,,,,,,,,,,,,,,,,,,,,,,,.pdf,Certificate of Registration in appropriate class.,AOC
,,,,,,,,,,,,,,,,,,,,,,,,,,,,,,,,,,,,,,,,,,,,,,,AOC,,,,,,,,,,,,,,,,,,,,,,,,,,,,,,,,,,,,,,,,,,,,,,,,,,,,,,,,,,.pdf,Undertaking for acceptance of terms and Condition as per Form No. 6 and 8,AOC
,,,,,,,,,,,,,,,,,,,,,,,,,,,,,,,,,,,,,,,,,,,,,,,AOC,,,,,,,,,,,,,,,,,,,,,,,,,,,,,,,,,,,,,,,,,,,,,,,,,,,,,,,,,,.pdf,Income Tax PAN/TAN No.,AOC
,,,,,,,,,,,,,,,,,,,,,,,,,,,,,,,,,,,,,,,,,,,,,,,AOC,,,,,,,,,,,,,,,,,,,,,,,,,,,,,,,,,,,,,,,,,,,,,,,,,,,,,,,,,,.pdf,GST Registration No and GST R 1 and 3 and EPF Registration No.and Clearance certificate.,AOC
,,,,,,,,,,,,,,,,,,,,,,,,,,,,,,,,,,,,,,,,,,,,,,,AOC,,,,,,,,,,,,,,,,,,,,,,,,,,,,,,,,,,,,,,,,,,,,,,,,,,,,,,,,,,.pdf,Work done certificate and work in hand certificate/ List of machinery tools and Plants.,AOC
,,,,,,,,,,,,,,,,,,,,,,,,,,,,,,,,,,,,,,,,,,,,,,,AOC,,,,,,,,,,,,,,,,,,,,,,,,,,,,,,,,,,,,,,,,,,,,,,,,,,,,,,,,,,.pdf,Eligibility Criteria as per form 6 and 8 of tender document,AOC
,,,,,,,,,,,,,,,,,,,,,,,,,,,,,,,,,,,,,,,,,,,,,,,AOC,,,,,,,,,,,,,,,,,,,,,,,,,,,,,,,,,,,,,,,,,,,,,,,,,,,,,,,,2.0,Finance,.xls,BOQ,AOC
