Name,Address,S.No,Corrigendum Title,Corrigendum Type,View,Title,Work Description,Pre Qualification Details,Independent External Monitor/Remarks,Tender Value in ₹,Product Category,Sub category,Contract Type,Bid Validity(Days),Period Of Work(Days),Location,Pincode,Pre Bid Meeting Place,Pre Bid Meeting Address,Pre Bid Meeting Date,Bid Opening Place,Should Allow NDA Tender,Allow Preferential Bidder,Organisation Chain,Tender Reference Number,Tender ID,Withdrawal Allowed,Tender Type,Form of contract,Tender Category,No. of Covers,General Technical Evaluation Allowed,ItemWise Technical Evaluation Allowed,Payment Mode,Is Multi Currency Allowed For BOQ,Is Multi Currency Allowed For Fee,Allow Two Stage Bidding,S.No.1,Bank Name,EMD Amount in ₹,EMD Exemption Allowed,EMD Fee Type,EMD Percentage,EMD Payable To,EMD Payable At,Publish Date,Bid Opening Date,Document Download / Sale Start Date,Document Download / Sale End Date,Clarification Start Date,Clarification End Date,Bid Submission Start Date,Bid Submission End Date,Financial Bid Opening Date,Cover No,Cover,Document Type,Description,Tender Fee in ₹,Fee Payable To,Fee Payable At,Tender Fee Exemption Allowed,Tender Stage,Type :,Summary :,Updated By :,Updated On :,Document :,BOQ Comparative Chart :,Committee Chairperson/Co-ordinator Name :,Committee Chairperson/Co-ordinator Type :,Committee Members :,Updated By :.1,Updated On :.1,Financial Bid Opening Date:,Document :.1,Type :.1,Summary :.1,Updated By :.2,Updated On :.2,Document :.2,S.No,Bid Number,Bidder Name,Submitted Date,Status,Remarks,Status Updated On,Contract Date :,Contract Value :,Work Completion Period in days :,Updated By :.3,Updated on :,AOC document :,AOC Description :,S.No.1,Bid Number.1,Bidder Name.1,Awarded Currency,Awarded Value,Committee Chairperson/Co-ordinator Name :.1,Committee Chairperson/Co-ordinator Type :.1,Committee Members :.1,Updated By :.4,Updated on :.1,Document :.3,Organisation Chain :,Tender ID :,Tender Ref No :,Tender Title :,Tender Stage
Executive Engineer,HPSIDC Shimla,1.0,Corrigendum for date extended,Date,,"SRMO type-I qtrs (8 sets in 2 building) at The Atal Bihari Bajpaye Mountaineering Institute Manali, Distt. Kullu (HP).","SRMO type-I qtrs (8 sets in 2 building) at The Atal Bihari Bajpaye Mountaineering Institute Manali, Distt. Kullu (HP).",Please refer Tender documents. ,NA ,"31,21,575",Civil Works - Buildings,NA ,Tender,120.0,180.0,Manali (Kullu),175131.0,NA ,NA ,NA ,HPSIDC Shimla,No ,No,HP SIDC Limited,Job No. 1,2022_SIDC_56223_1,Yes,Open Tender,Item Rate,Works,2.0,No,No,Online,No,No,No,1.0,ICICI BANK,"54,300",No,fixed,,Nil,Nil,01-Feb-2022 11:00 AM,11-Feb-2022 11:00 AM,01-Feb-2022 11:00 AM,10-Feb-2022 05:00 PM,NA ,NA ,01-Feb-2022 11:00 AM,10-Feb-2022 05:00 PM,24-Feb-2022 11:00 AM,1.0,Fee/PreQual/Technical,.pdf,Appropriate Contractor registration (as per tender condition),"3,600",Nil,Nil,No,AOC,Finance,Financial summary,Sushant Singh Negi,26-Feb-2022 02:58 PM,finance_84519.pdf,BOQ Comparative Chart,SE,Internal,"DM, Manager(F), AE(HQ), EE(HQ)",Sushant Singh Negi,23-Feb-2022 03:19 PM,24-Feb-2022 11:00 AM,techsummary_84519.pdf (369.76 KB),Technical,Technical summary,Sushant Singh Negi,23-Feb-2022 03:19 PM,technical_84519.pdf,1.0,261490.0,Ankush Bhardwaj,07-Feb-2022 10:23 PM,Rejected-Finance,Fourth lowest bidder,26-Feb-2022 03:01 PM,12-Sep-2022,"INR 2,977,197",180.0,Sushant Singh Negi,22-Sep-2022 11:59 AM,manaliaward.pdf (1425.00 KB),Award letter,1.0,262506.0,GD Builders & Construction Associates,INR,"2,977,197",SE,Internal,"DM, Manager(F), EE(HQ)",Sushant Singh Negi,26-Feb-2022 03:01 PM,finsummary_84519.pdf (33.96 KB),HP SIDC Limited,2022_SIDC_56223_1,Job No. 1,"SRMO type-I qtrs (8 sets in 2 building) at The Atal Bihari Bajpaye Mountaineering Institute Manali, Distt. Kullu (HP).",AOC
,,,,,,,,,,,,,,,,,,,,,,,,,,,,,,,,,,,,,,2.0,ICICI NEFT/RTGS,,,,,,,,,,,,,,,,,,.pdf,Signed copy of agreement form and approved make for materials,,,,,AOC,,,,,,,,,,,,,,,,,,,2.0,261174.0,DEVI CHAND THAKUR,07-Feb-2022 01:54 PM,Rejected-Finance,Second lowest bidder,26-Feb-2022 03:01 PM,,,,,,,,,,,,,,,,,,,,,,,AOC
,,,,,,,,,,,,,,,,,,,,,,,,,,,,,,,,,,,,,,,,,,,,,,,,,,,,,,,,,.pdf,Affidavit that the information furnished with the bid documents is true and correct.,,,,,AOC,,,,,,,,,,,,,,,,,,,3.0,262506.0,GD Builders & Construction Associates,10-Feb-2022 03:45 PM,Accepted-AOC,AOC,22-Sep-2022 11:59 AM,,,,,,,,,,,,,,,,,,,,,,,AOC
,,,,,,,,,,,,,,,,,,,,,,,,,,,,,,,,,,,,,,,,,,,,,,,,,,,,,,,,,.pdf,Affidavit that you have not more than 2 works in hand each of Rs.100 lakh or above in any department,,,,,AOC,,,,,,,,,,,,,,,,,,,4.0,261518.0,Keshav ram,07-Feb-2022 10:14 PM,Rejected-Finance,Third lowest bidder,26-Feb-2022 03:01 PM,,,,,,,,,,,,,,,,,,,,,,,AOC
,,,,,,,,,,,,,,,,,,,,,,,,,,,,,,,,,,,,,,,,,,,,,,,,,,,,,,,,,.pdf,Proof copy of EPF registration No.,,,,,AOC,,,,,,,,,,,,,,,,,,,5.0,261696.0,shubham chauhan,10-Feb-2022 11:10 AM,Rejected-Finance,Fifth lowest bidder,26-Feb-2022 03:01 PM,,,,,,,,,,,,,,,,,,,,,,,AOC
,,,,,,,,,,,,,,,,,,,,,,,,,,,,,,,,,,,,,,,,,,,,,,,,,,,,,,,,,.pdf,Proof copy of GST registration No.,,,,,AOC,,,,,,,,,,,,,,,,,,,6.0,261672.0,VIKAS KUMAR CONTRACTOR,10-Feb-2022 11:20 AM,Rejected-Finance,Sixth lowest bidder,26-Feb-2022 03:01 PM,,,,,,,,,,,,,,,,,,,,,,,AOC
,,,,,,,,,,,,,,,,,,,,,,,,,,,,,,,,,,,,,,,,,,,,,,,,,,,,,,,,,.pdf,Copy of latest ITR and pan card,,,,,AOC,,,,,,,,,,,,,,,,,,,,,,,,,,,,,,,,,,,,,,,,,,,,,,,,AOC
,,,,,,,,,,,,,,,,,,,,,,,,,,,,,,,,,,,,,,,,,,,,,,,,,,,,,,,,,.pdf,Copy of receipt of EMD and cost of form,,,,,AOC,,,,,,,,,,,,,,,,,,,,,,,,,,,,,,,,,,,,,,,,,,,,,,,,AOC
,,,,,,,,,,,,,,,,,,,,,,,,,,,,,,,,,,,,,,,,,,,,,,,,,,,,,,,2.0,Finance,.xls,BOQ,,,,,AOC,,,,,,,,,,,,,,,,,,,,,,,,,,,,,,,,,,,,,,,,,,,,,,,,AOC
