Tender Fee in ₹,Fee Payable To,Fee Payable At,Tender Fee Exemption Allowed,Cover No,Cover,Document Type,Description,Organisation Chain,Tender Reference Number,Tender ID,Withdrawal Allowed,Tender Type,Form of contract,Tender Category,No. of Covers,General Technical Evaluation Allowed,ItemWise Technical Evaluation Allowed,Payment Mode,Is Multi Currency Allowed For BOQ,Is Multi Currency Allowed For Fee,Allow Two Stage Bidding,S.No,Instrument Type,Name,Address,EMD Amount in ₹,EMD through BG/ST or EMD Exemption Allowed,EMD Fee Type,EMD Percentage,EMD Payable To,EMD Payable At,Title,Work Description,Pre Qualification Details,Independent External Monitor/Remarks,Tender Value in ₹,Product Category,Sub category,Contract Type,Bid Validity(Days),Period Of Work(Days),Location,Pincode,Pre Bid Meeting Place,Pre Bid Meeting Address,Pre Bid Meeting Date,Bid Opening Place,Should Allow NDA Tender,Allow Preferential Bidder,Publish Date,Bid Opening Date,Document Download / Sale Start Date,Document Download / Sale End Date,Clarification Start Date,Clarification End Date,Bid Submission Start Date,Bid Submission End Date,Financial Bid Opening Date,Tender Stage,S.No,Bid Number,Bidder Name,Submitted Date,Status,Remarks,Status Updated On,Committee Chairperson/Co-ordinator Name :,Committee Chairperson/Co-ordinator Type :,Committee Members :,Updated By :,Updated on :,Document :,Type :,Summary :,Updated By :.1,Updated On :,Document :.1,Committee Chairperson/Co-ordinator Name :.1,Committee Chairperson/Co-ordinator Type :.1,Committee Members :.1,Updated By :.2,Updated On :.1,Financial Bid Opening Date:,Document :.2,Organisation Chain :,Tender ID :,Tender Ref No :,Tender Title :,Contract Date :,Contract Value :,Work Completion Period in days :,Updated By :.3,Updated on :.1,AOC document :,AOC Description :,S.No.1,Bid Number.1,Bidder Name.1,Awarded Currency,Awarded Value,Type :.1,Summary :.1,Updated By :.4,Updated On :.2,Document :.3,BOQ Comparative Chart :,Tender Stage
"1,200",EE ICD,GHY,No,1.0,Fee/PreQual/Technical,.pdf,Cost of Bid and Bid Security,Industries and Commerce Department||Commissioner Industries and Commerce Assam,EE-G/426/08/Pt-I/3 dated 3/11/2021,2021_ICD_23331_14,Yes,Open Tender,Item Rate,Works,2.0,No,No,Offline,No,No,No,1.0,DD - Demand Draft,EE ICD,Executive Engineer Industries and Commerce Deptt Assam Bamunimaidam Guwahati 21,"73,730",Yes,fixed,,EE ICD,GHY,Construction of Internal Road with both side drain and Cross Drainage at MIE Pathsala Dist Barpeta Group No 14,Construction of Internal Road with both side drain and Cross Drainage at MIE Pathsala Dist Barpeta Group No 14,Please refer Tender documents. ,NA ,,Construction Works,NA ,Tender,180.0,120.0,Pathsala,781325.0,NA ,NA ,NA ,"Bamunimaidam, Guwahati-21",No ,No,08-Nov-2021 02:00 PM,30-Nov-2021 11:30 AM,08-Nov-2021 02:00 PM,29-Nov-2021 02:00 PM,08-Nov-2021 02:00 PM ,29-Nov-2021 02:00 PM ,08-Nov-2021 02:00 PM,29-Nov-2021 02:00 PM,08-Jul-2022 12:10 PM,AOC,1.0,126989.0,MS UNIQUE CONSTRUCTION AND SUPPLY,28-Nov-2021 06:44 PM,Rejected-Finance,Refer Minutes of TSC meeting,02-Sep-2022 06:40 PM,"P. J. Das, Chairman",Internal,"A. K. Kalita, Member, B. K. Nath, Member, R. K. Saikia, Member, P. K. Borah, Member",Apurba Kumar Kalita,02-Sep-2022 06:40 PM,finsummary_35882.pdf (3365.58 KB),Technical,Bid Opening Summery,Apurba Kumar Kalita,30-Nov-2021 03:57 PM,technical_35882.pdf,"P. J. Das, Chairman",Internal,"A. K. Kalita, Member, B. K. Nath, Member, R. K. Saikia, Member, P. K. Borah, Member",Apurba Kumar Kalita,07-Jul-2022 05:51 PM,08-Jul-2022 12:10 PM,techsummary_35882.pdf (2672.24 KB),Industries and Commerce Department||Commissioner Industries and Commerce Assam,2021_ICD_23331_14,EE-G/426/08/Pt-I/3 dated 3/11/2021,Construction of Internal Road with both side drain and Cross Drainage at MIE Pathsala Dist Barpeta Group No 14,21-Sep-2022,INR 3686505.0,120.0,Apurba Kumar Kalita,22-Sep-2022 05:04 PM,AOC_14.pdf (680.00 KB),AOC,1.0,126980.0,SRI GOPAL DEKA,INR,3317854.5,Finance,Bid opening summery,Apurba Kumar Kalita,11-Jul-2022 03:27 PM,finance_35882.pdf,BOQ Comparative Chart,AOC
,,,,,,.pdf,Technical Bid,,,,,,,,,,,,,,,2.0,BC - Bankers Cheque,,,,,,,,,,,,,,,,,,,,,,,,,,,,,,,,,,,,AOC,2.0,126857.0,Rubul Bhatta,29-Nov-2021 12:47 PM,Rejected-Finance,Refer Minutes of TSC meeting,02-Sep-2022 06:40 PM,,,,,,,,,,,,,,,,,,,,,,,,,,,,,,,,,,,,,,,,,AOC
,,,,,,.pdf,Signed Bid Document,,,,,,,,,,,,,,,3.0,FDR - Fixed Deposit Receipt,,,,,,,,,,,,,,,,,,,,,,,,,,,,,,,,,,,,AOC,3.0,126996.0,Sri Dinesh Goswami,28-Nov-2021 07:03 PM,Rejected-Finance,Refer Minutes of TSC meeting,02-Sep-2022 06:40 PM,,,,,,,,,,,,,,,,,,,,,,,,,,,,,,,,,,,,,,,,,AOC
,,,,2.0,Finance,.xls,BOQ,,,,,,,,,,,,,,,,,,,,,,,,,,,,,,,,,,,,,,,,,,,,,,,,,,,,AOC,4.0,126980.0,SRI GOPAL DEKA,28-Nov-2021 06:23 PM,Accepted-AOC,Recommended L1 bidder,22-Sep-2022 05:05 PM,,,,,,,,,,,,,,,,,,,,,,,,,,,,,,,,,,,,,,,,,AOC
,,,,,,.pdf,Form Of Bid,,,,,,,,,,,,,,,,,,,,,,,,,,,,,,,,,,,,,,,,,,,,,,,,,,,,AOC,,,,,,,,,,,,,,,,,,,,,,,,,,,,,,,,,,,,,,,,,,,,,,,,AOC
