Type :,Summary :,Updated By :,Updated On :,Document :,Type :.1,Summary :.1,Updated By :.1,Updated On :.1,Document :.1,BOQ Comparative Chart :,Contract Date :,Contract Value :,Work Completion Period in days :,Updated By :.2,Updated on :,AOC document :,AOC Description :,S.No,Bid Number,Bidder Name,Submitted Date,Status,Remarks,Status Updated On,Committee Chairperson/Co-ordinator Name :,Committee Chairperson/Co-ordinator Type :,Committee Members :,Updated By :.3,Updated On :.2,Financial Bid Opening Date:,Document :.2,Organisation Chain :,Tender ID :,Tender Ref No :,Tender Title :,S.No.1,Bid Number.1,Bidder Name.1,Awarded Currency,Awarded Value,Committee Chairperson/Co-ordinator Name :.1,Committee Chairperson/Co-ordinator Type :.1,Committee Members :.1,Updated By :.4,Updated on :.1,Document :.3,Tender Stage,Title,Work Description,Pre Qualification Details,Independent External Monitor/Remarks,Tender Value in ₹,Product Category,Sub category,Contract Type,Bid Validity(Days),Period Of Work(Days),Location,Pincode,Pre Bid Meeting Place,Pre Bid Meeting Address,Pre Bid Meeting Date,Bid Opening Place,Should Allow NDA Tender,Allow Preferential Bidder,Cover No,Cover,Document Type,Description,Organisation Chain,Tender Reference Number,Tender ID,Withdrawal Allowed,Tender Type,Form of contract,Tender Category,No. of Covers,General Technical Evaluation Allowed,ItemWise Technical Evaluation Allowed,Payment Mode,Is Multi Currency Allowed For BOQ,Is Multi Currency Allowed For Fee,Allow Two Stage Bidding,Tender Fee in ₹,Fee Payable To,Fee Payable At,Tender Fee Exemption Allowed,Publish Date,Bid Opening Date,Document Download / Sale Start Date,Document Download / Sale End Date,Clarification Start Date,Clarification End Date,Bid Submission Start Date,Bid Submission End Date,Financial Bid Opening Date,EMD Amount in ₹,EMD Exemption Allowed,EMD Fee Type,EMD Percentage,EMD Payable To,EMD Payable At,Name,Address,S.No,Bank Name,Tender Stage
Technical,BIDOPENINGSUMMARY,Lalit Thakur,23-Sep-2022 03:37 PM,technical_97620.pdf,Finance,BIDOPENINGSUMMARY,Lalit Thakur,23-Sep-2022 03:54 PM,finance_97620.pdf,BOQ Comparative Chart,24-Sep-2022,"INR 19,985,557.44",365.0,Lalit Thakur,27-Sep-2022 02:16 PM,AwardMushroomSidhpur.pdf (2126.00 KB),Awarded to Sh. Pankaj Gupta,1.0,302199.0,Ajay Kumar Thakur,20-Sep-2022 09:56 AM,Rejected-AOC,Rejected,27-Sep-2022 02:17 PM,Er Lalit Kumar Thakur,Internal,Sh Biri Singh Sh Kailash Sharma Sh Naresh Kumar,Lalit Thakur,23-Sep-2022 03:41 PM,23-Sep-2022 03:45 PM,techsummary_97620.pdf (2431.34 KB),"Himachal Urban Development Authority||Supdt. Engineer (N),HIMUDA||Executive Engineer Division,Mandi,HIMUDA",2022_HIMUD_64886_1,HIMUDA-MD-E-134-2022,Construction of Extra shed for existing Mushroom unit building including intenral and external services at Sidhpur Tehsil Dharampur Distt Mandi HP,1.0,302110.0,Pankaj Gupta,INR,"19,985,557.44",Er Lalit Kumar Thakur,Internal,Sh Biri Singh Sh Kailash Sharma Sh Naresh Kumar,Lalit Thakur,23-Sep-2022 04:03 PM,finsummary_97620.pdf (491.00 KB),AOC,Construction of Extra shed for existing Mushroom unit building including intenral and external services at Sidhpur Tehsil Dharampur Distt Mandi HP,Construction of Extra shed for existing Mushroom unit building including intenral and external services at Sidhpur Tehsil Dharampur Distt Mandi HP,Please refer to tender documents ,NA ,"1,95,51,842",Civil Works,NA ,Tender,60.0,365.0,Sidhpur at Dharampur Mandi,175040.0,NA ,NA ,NA ,O/O Executive Engineer HIMUDA Division Mandi,No ,No,1.0,Fee/PreQual/Technical,.pdf,Contractor Registration (As mentioned in NIT),"Himachal Urban Development Authority||Supdt. Engineer (N),HIMUDA||Executive Engineer Division,Mandi,HIMUDA",HIMUDA-MD-E-134-2022,2022_HIMUD_64886_1,Yes,Open Tender,Item Rate,Works,2.0,No,No,Online,No,No,No,"5,900",Nil,Nil,Yes,13-Sep-2022 04:00 PM,21-Sep-2022 11:30 AM,14-Sep-2022 10:30 AM,20-Sep-2022 05:00 PM,NA ,NA ,14-Sep-2022 10:30 AM,20-Sep-2022 05:00 PM,23-Sep-2022 03:45 PM,"3,91,050",Yes,fixed,,Nil,Nil,Executive Engineer HIMUDA Division Mandi,Executive Engineer HIMUDA Division Mandi,1.0,ICICI BANK,AOC
,,,,,,,,,,,,,,,,,,2.0,302110.0,Pankaj Gupta,18-Sep-2022 08:38 PM,Accepted-AOC,Accepted,27-Sep-2022 02:17 PM,,,,,,,,,,,,,,,,,,,,,,,AOC,,,,,,,,,,,,,,,,,,,,,.pdf,GST Registration and acknowledgement of returns of GST.,,,,,,,,,,,,,,,,,,,,,,,,,,,,,,,,,,,,2.0,ICICI NEFT/RTGS,AOC
,,,,,,,,,,,,,,,,,,,,,,,,,,,,,,,,,,,,,,,,,,,,,,,AOC,,,,,,,,,,,,,,,,,,,,,.pdf,Income tax Return/clearance and PAN and EPF (As mentioned in NIT),,,,,,,,,,,,,,,,,,,,,,,,,,,,,,,,,,,,,,AOC
,,,,,,,,,,,,,,,,,,,,,,,,,,,,,,,,,,,,,,,,,,,,,,,AOC,,,,,,,,,,,,,,,,,,,,,.pdf,"Detail of Work Done, Work in hand as per general rules No.16 tender form 7/8",,,,,,,,,,,,,,,,,,,,,,,,,,,,,,,,,,,,,,AOC
,,,,,,,,,,,,,,,,,,,,,,,,,,,,,,,,,,,,,,,,,,,,,,,AOC,,,,,,,,,,,,,,,,,,,,,.pdf,Bidding capacity as per eligibility criteria No.26.2 a tender form 7/8,,,,,,,,,,,,,,,,,,,,,,,,,,,,,,,,,,,,,,AOC
,,,,,,,,,,,,,,,,,,,,,,,,,,,,,,,,,,,,,,,,,,,,,,,AOC,,,,,,,,,,,,,,,,,,,,,.pdf,Detail of Machinery as shown in schedule F of tender form 7/8,,,,,,,,,,,,,,,,,,,,,,,,,,,,,,,,,,,,,,AOC
,,,,,,,,,,,,,,,,,,,,,,,,,,,,,,,,,,,,,,,,,,,,,,,AOC,,,,,,,,,,,,,,,,,,,,,.pdf,Undertaking as uploaded on the portal,,,,,,,,,,,,,,,,,,,,,,,,,,,,,,,,,,,,,,AOC
,,,,,,,,,,,,,,,,,,,,,,,,,,,,,,,,,,,,,,,,,,,,,,,AOC,,,,,,,,,,,,,,,,,,,,,.pdf,Affidavit if no work in hand,,,,,,,,,,,,,,,,,,,,,,,,,,,,,,,,,,,,,,AOC
,,,,,,,,,,,,,,,,,,,,,,,,,,,,,,,,,,,,,,,,,,,,,,,AOC,,,,,,,,,,,,,,,,,,,2.0,Finance,.xls,BOQ,,,,,,,,,,,,,,,,,,,,,,,,,,,,,,,,,,,,,,AOC
