Cover No,Cover,Document Type,Description,Name,Address,Organisation Chain,Tender Reference Number,Tender ID,Withdrawal Allowed,Tender Type,Form of contract,Tender Category,No. of Covers,General Technical Evaluation Allowed,ItemWise Technical Evaluation Allowed,Payment Mode,Is Multi Currency Allowed For BOQ,Is Multi Currency Allowed For Fee,Allow Two Stage Bidding,Tender Fee in ₹,Fee Payable To,Fee Payable At,Tender Fee Exemption Allowed,EMD Amount in ₹,EMD Exemption Allowed,EMD Fee Type,EMD Percentage,EMD Payable To,EMD Payable At,Title,Work Description,Pre Qualification Details,Independent External Monitor/Remarks,Tender Value in ₹,Product Category,Sub category,Contract Type,Bid Validity(Days),Period Of Work(Days),Location,Pincode,Pre Bid Meeting Place,Pre Bid Meeting Address,Pre Bid Meeting Date,Bid Opening Place,Should Allow NDA Tender,Allow Preferential Bidder,Publish Date,Bid Opening Date,Document Download / Sale Start Date,Document Download / Sale End Date,Clarification Start Date,Clarification End Date,Bid Submission Start Date,Bid Submission End Date,Financial Bid Opening Date,S.No,Bank Name,Tender Stage,Contract Date :,Contract Value :,Work Completion Period in days :,Updated By :,Updated on :,AOC document :,AOC Description :,Type :,Summary :,Updated By :.1,Updated On :,Document :,Type :.1,Summary :.1,Updated By :.2,Updated On :.1,Document :.1,BOQ Comparative Chart :,S.No,Bid Number,Bidder Name,Submitted Date,Status,Remarks,Status Updated On,Committee Chairperson/Co-ordinator Name :,Committee Chairperson/Co-ordinator Type :,Committee Members :,Updated By :.3,Updated On :.2,Financial Bid Opening Date:,Document :.2,Committee Chairperson/Co-ordinator Name :.1,Committee Chairperson/Co-ordinator Type :.1,Committee Members :.1,Updated By :.4,Updated on :.1,Document :.3,S.No.1,Bid Number.1,Bidder Name.1,Awarded Currency,Awarded Value,Organisation Chain :,Tender ID :,Tender Ref No :,Tender Title :,Tender Stage
1.0,Fee/PreQual/Technical,.pdf,Scanned copy of offline/online payment a/c of cost of tender document.,Executive Engineer,IPH Division Fatehpur,"HP Irrigation and Public Health||Nurpur Circle,Irrigation and Public Health,HP||Fatehpur-Irrigation and Public Health-HP",EE-IPH-FTR/Tender/2019- 4754-4804,2019_HPIPH_31168_1,Yes,Open Tender,Item Rate,Works,2.0,No,No,Both(Online/Offline),No,No,No,250.0,EE IPH Division Fatehpur,SBI Fatehpur,No,"12,740",Yes,fixed,,EE IPH Division Fatehpur,SBI Fatehpur,"Providing Irrigation Facility to Village Sunet-1st, Doda Ka Moch, Takoli-2nd, Khukhnara, Lohara, Chakwari etc. in Teshil Fatehpur District Kangra HP",Sub Head Providing Laying and Testing of RCC Pipe 250 mm dia and C/O Outlets in distribution system for Tube Well of Lohara,As per NIT ,NA ,"6,36,562",Civil Works,NA ,Tender,90.0,120.0,Tehsil Fatehpur,176054.0,NA ,NA ,NA ,EE IPh Division Fatehpur,No ,No,30-Aug-2019 05:00 PM,13-Sep-2019 11:30 AM,30-Aug-2019 06:30 PM,13-Sep-2019 11:00 AM,NA ,NA ,30-Aug-2019 06:30 PM,13-Sep-2019 11:00 AM,30-Sep-2019 03:20 PM,1.0,ICICI BANK,AOC,03-Jan-2020,"INR 469,195",90.0,Sushil Chand Katoch,03-Jan-2020 12:36 PM,AOC.pdf (314.00 KB),AOC,Technical,proceeding,Sushil Chand Katoch,30-Sep-2019 03:16 PM,technical_44866.pdf,Finance,summary,Rajinder Singh,30-Sep-2019 03:27 PM,finance_44866.pdf,BOQ Comparative Chart,1.0,130841.0,ASHOK KUMAR,13-Sep-2019 10:32 AM,Rejected-Technical,unqualified,30-Sep-2019 03:19 PM,Er. Sushil Chand,Internal,DAO HDM SUPDT,Sushil Chand Katoch,30-Sep-2019 03:19 PM,30-Sep-2019 03:20 PM,techsummary_44866.pdf (647.98 KB),ER Sushil Chand katoch,Internal,Supdt DAO HDM,Sushil Chand Katoch,03-Jan-2020 12:34 PM,finsummary_44866.pdf (707.20 KB),1.0,130840.0,JAGJIT SINGH PATHANIA,INR,"469,195","HP Irrigation and Public Health||Nurpur Circle,Irrigation and Public Health,HP||Fatehpur-Irrigation and Public Health-HP",2019_HPIPH_31168_1,EE-IPH-FTR/Tender/2019- 4754-4804,"Providing Irrigation Facility to Village Sunet-1st, Doda Ka Moch, Takoli-2nd, Khukhnara, Lohara, Chakwari etc. in Teshil Fatehpur District Kangra HP",AOC
,,.pdf,Scanned copy of offline/ online payment i.e. cost of receipt of the amount deposited of cost of earn,,,,,,,,,,,,,,,,,,,,,,,,,,,,,,,,,,,,,,,,,,,,,,,,,,,,,,2.0,ICICI NEFT/RTGS,AOC,,,,,,,,,,,,,,,,,,,2.0,130840.0,JAGJIT SINGH PATHANIA,13-Sep-2019 10:36 AM,Accepted-AOC,lowest,03-Jan-2020 12:36 PM,,,,,,,,,,,,,,,,,,,,,,,AOC
,,.pdf,Scanned copy of registration in IPH Deptt. in appropriate class and latest renewal thereof,,,,,,,,,,,,,,,,,,,,,,,,,,,,,,,,,,,,,,,,,,,,,,,,,,,,,,,,AOC,,,,,,,,,,,,,,,,,,,3.0,129935.0,RAJESHWAR SINGH,10-Sep-2019 12:32 PM,Rejected-Finance,higher side amount,03-Jan-2020 12:34 PM,,,,,,,,,,,,,,,,,,,,,,,AOC
,,.pdf,Scanned copy of Income tax (Assessment Year 2018-19),,,,,,,,,,,,,,,,,,,,,,,,,,,,,,,,,,,,,,,,,,,,,,,,,,,,,,,,AOC,,,,,,,,,,,,,,,,,,,,,,,,,,,,,,,,,,,,,,,,,,,,,,,,AOC
,,.pdf,Scanned copy of PAN No,,,,,,,,,,,,,,,,,,,,,,,,,,,,,,,,,,,,,,,,,,,,,,,,,,,,,,,,AOC,,,,,,,,,,,,,,,,,,,,,,,,,,,,,,,,,,,,,,,,,,,,,,,,AOC
,,.pdf,Scanned copy of GST No. registration and latest clearance certificate thereof.,,,,,,,,,,,,,,,,,,,,,,,,,,,,,,,,,,,,,,,,,,,,,,,,,,,,,,,,AOC,,,,,,,,,,,,,,,,,,,,,,,,,,,,,,,,,,,,,,,,,,,,,,,,AOC
2.0,Finance,.xls,Schedule of quantity,,,,,,,,,,,,,,,,,,,,,,,,,,,,,,,,,,,,,,,,,,,,,,,,,,,,,,,,AOC,,,,,,,,,,,,,,,,,,,,,,,,,,,,,,,,,,,,,,,,,,,,,,,,AOC
