S.No,Bid Number,Bidder Name,Submitted Date,Status,Remarks,Status Updated On,Organisation Chain :,Tender ID :,Tender Ref No :,Tender Title :,Tender Stage,S.No,Bank Name,S.No.1,Corrigendum Title,Corrigendum Type,View,Cover No,Cover,Document Type,Description,EMD Amount in ₹,EMD through BG/ST or EMD Exemption Allowed,EMD Fee Type,EMD Percentage,EMD Payable To,EMD Payable At,Publish Date,Bid Opening Date,Document Download / Sale Start Date,Document Download / Sale End Date,Clarification Start Date,Clarification End Date,Bid Submission Start Date,Bid Submission End Date,Financial Bid Opening Date,Title,Work Description,Pre Qualification Details,Independent External Monitor/Remarks,Tender Value in ₹,Product Category,Sub category,Contract Type,Bid Validity(Days),Period Of Work(Days),Location,Pincode,Pre Bid Meeting Place,Pre Bid Meeting Address,Pre Bid Meeting Date,Bid Opening Place,Should Allow NDA Tender,Allow Preferential Bidder,Tender Fee in ₹,Fee Payable To,Fee Payable At,Tender Fee Exemption Allowed,Organisation Chain,Tender Reference Number,Tender ID,Withdrawal Allowed,Tender Type,Form of contract,Tender Category,No. of Covers,General Technical Evaluation Allowed,ItemWise Technical Evaluation Allowed,Payment Mode,Is Multi Currency Allowed For BOQ,Is Multi Currency Allowed For Fee,Allow Two Stage Bidding,Name,Address,Tender Stage
1,68229,Akhil Kumar Jain,27-Dec-2019 09:51 AM,Accepted-AOC,PROPER,20-Jan-2020 05:52 PM,Department of Water Resources||Chief Engineer - DoWR,2019_DoWR_14862_1,GOALPARA/2018-19/UTTARAN/I,Anti-erosion measures to protect Baladmari,AOC,1.0,SBI Bank,1.0,"Due to Interruption in Internet connectivity, All the tenders due for closing during the period between (11-Dec-2019 and 20-Dec-2019) have been extended to 27-Dec-2019.",Admin Corrigendum Date Extend,,1.0,Fee,.pdf,Tender fee details,"19,70,714",Yes,percentage,2.0%,"The Executive Engineer, Goalpara W. R. Division",Goalpara,21-Nov-2019 01:40 PM,28-Dec-2019 02:00 PM,21-Nov-2019 01:45 PM,27-Dec-2019 02:00 PM,NA ,NA ,05-Dec-2019 10:00 AM,27-Dec-2019 02:00 PM,31-Dec-2019 06:05 PM,Anti-erosion measures to protect Baladmari,Anti-erosion measures to protect Baladmari and its adjoining areas from the erosion of river Brahmaputra. (Signature project).,Please refer Tender documents. ,NA ,"9,85,35,681",Civil Works,NA ,Tender,180.0,180.0,GOALPARA,783101.0,Guwahati ,O/O Chief Engineer Water Resources Department Chandmari ,27-Nov-2019 12:00 PM ,GUWAHATI,No ,No,"20,000","The Executive Engineer, Goalpara W. R. Division",Goalpara,No,Department of Water Resources||Chief Engineer - DoWR,GOALPARA/2018-19/UTTARAN/I,2019_DoWR_14862_1,Yes,Open Tender,Works,Works,3.0,No,No,Online,No,No,No,"Chief Engineer,W.R.Deptt",O/O Chief Engineer Water Resources Department Chandmari,AOC
2,69703,Ashok Kumar Agarwalla,27-Dec-2019 10:04 AM,Rejected-AOC,Not Qualified for AOC,20-Jan-2020 05:52 PM,,,,,AOC,,,,,,,2.0,PreQual/Technical,.pdf,Technical documents,,,,,,,,,,,,,,,,,,,,,,,,,,,,,,,,,,,,,,,,,,,,,,,,,,,,,,AOC
3,68370,Ashok Kumar Jain,27-Dec-2019 10:02 AM,Rejected-AOC,Not Qualified for AOC,20-Jan-2020 05:52 PM,,,,,AOC,,,,,,,3.0,Finance,.xls,BOQ,,,,,,,,,,,,,,,,,,,,,,,,,,,,,,,,,,,,,,,,,,,,,,,,,,,,,,AOC
4,68526,JYOTI CONSTRO COMMERCIALS SAJIDUR RAHMAN JV,11-Dec-2019 11:17 AM,Rejected-AOC,Not Qualified for AOC,20-Jan-2020 05:52 PM,,,,,AOC,,,,,,,,,,,,,,,,,,,,,,,,,,,,,,,,,,,,,,,,,,,,,,,,,,,,,,,,,,,,,,,,AOC
5,68494,M.H. CONSTRUCTION,26-Dec-2019 07:26 PM,Rejected-AOC,Not Qualified for AOC,20-Jan-2020 05:52 PM,,,,,AOC,,,,,,,,,,,,,,,,,,,,,,,,,,,,,,,,,,,,,,,,,,,,,,,,,,,,,,,,,,,,,,,,AOC
6,68477,S.A. ENTERPRISE,11-Dec-2019 08:59 AM,Rejected-AOC,Not Qualified for AOC,20-Jan-2020 05:52 PM,,,,,AOC,,,,,,,,,,,,,,,,,,,,,,,,,,,,,,,,,,,,,,,,,,,,,,,,,,,,,,,,,,,,,,,,AOC
7,68545,Sanyug Enterprise Jayanta Khaund Joint Venture,27-Dec-2019 02:00 AM,Not Admitted-PreQual/Technical,Not Complied with technical specification,31-Dec-2019 04:36 PM,,,,,AOC,,,,,,,,,,,,,,,,,,,,,,,,,,,,,,,,,,,,,,,,,,,,,,,,,,,,,,,,,,,,,,,,AOC
8,68534,SONTOSH KUMAR SAHA CHILARAI CONSTRUCTION PVT LTD JV,23-Dec-2019 10:31 PM,Rejected-AOC,Not Qualified for AOC,20-Jan-2020 05:52 PM,,,,,AOC,,,,,,,,,,,,,,,,,,,,,,,,,,,,,,,,,,,,,,,,,,,,,,,,,,,,,,,,,,,,,,,,AOC
