Organisation Chain,Tender Reference Number,Tender ID,Withdrawal Allowed,Tender Type,Form of contract,Tender Category,No. of Covers,General Technical Evaluation Allowed,ItemWise Technical Evaluation Allowed,Payment Mode,Is Multi Currency Allowed For BOQ,Is Multi Currency Allowed For Fee,Allow Two Stage Bidding,Cover No,Cover,Document Type,Description,Publish Date,Bid Opening Date,Document Download / Sale Start Date,Document Download / Sale End Date,Clarification Start Date,Clarification End Date,Bid Submission Start Date,Bid Submission End Date,Financial Bid Opening Date,EMD Amount in ₹,EMD Exemption Allowed,EMD Fee Type,EMD Percentage,EMD Payable To,EMD Payable At,S.No,Corrigendum Title,Corrigendum Type,View,S.No.1,Bank Name,Tender Fee in ₹,Fee Payable To,Fee Payable At,Tender Fee Exemption Allowed,Name,Address,Title,Work Description,Pre Qualification Details,Independent External Monitor/Remarks,Tender Value in ₹,Product Category,Sub category,Contract Type,Bid Validity(Days),Period Of Work(Days),Location,Pincode,Pre Bid Meeting Place,Pre Bid Meeting Address,Pre Bid Meeting Date,Bid Opening Place,Should Allow NDA Tender,Allow Preferential Bidder,Tender Stage
"HP Irrigation and Public Health||Chamba  Circle,Irrigation and Public Health,HP||Dalhousie,Irrigation and Public Health,HP",JSVD-DLU-EA-I/11257-11307 dt. 13.12.2023,2023_HPIPH_82626_1,Yes,Open Tender,Lump-sum,Works,2.0,No,No,Both(Online/Offline),No,No,No,1.0,Fee/PreQual/Technical,.pdf,Cost of tender form online (e-payment) and off line mode.,14-Dec-2023 10:00 AM,26-Dec-2023 11:30 AM,14-Dec-2023 10:00 AM,23-Dec-2023 05:00 PM,14-Dec-2023 10:00 AM,23-Dec-2023 05:00 PM,14-Dec-2023 10:00 AM,23-Dec-2023 05:00 PM,16-Jan-2024 12:35 PM,"45,598",Yes,fixed,,EE Dalhousie,Dalhousie,1.0,Corrigendum,Technical Bid,,1.0,ICICI BANK,800.0,EE Dalhousie,Dalhousie,No,Executive Engineer,"Jal Shakti Division, Dalhousie",Construction of Jal Shakti Vibhag Sub-Division office Chowari in tehsil Bhattiyat Distt. Chamba (H.P),Construction of Jal Shakti Vibhag Sub-Division office Chowari in tehsil Bhattiyat Distt. Chamba (H.P),Construction of Jal Shakti Vibhag Sub-Division office Chowari in tehsil Bhattiyat Distt. Chamba (H.P),,"45,59,808",Civil Works,,Tender,180.0,365.0,Chowari Town,176302.0,,,,Dalhousie,No,No,AOC
,,,,,,,,,,,,,,,,.pdf,Earnest money online (e-payment) and off line mode.,,,,,,,,,,,,,,,,,,,,2.0,ICICI NEFT/RTGS,,,,,,,,,,,,,,,,,,,,,,,,,AOC
,,,,,,,,,,,,,,,,.pdf,Scanned copy Certificate of registration with Jal Shakti Vibhag in appropriate class and latest rene,,,,,,,,,,,,,,,,,,,,,,,,,,,,,,,,,,,,,,,,,,,,,,AOC
,,,,,,,,,,,,,,,,.pdf,Income Tax/Sale Tax/ clearance/GST registration/EPF No labour license and latest clearance certifica,,,,,,,,,,,,,,,,,,,,,,,,,,,,,,,,,,,,,,,,,,,,,,AOC
,,,,,,,,,,,,,,,,.pdf,Undertaking that I have carefully studied all the terms and conditions stipulated in the contract,,,,,,,,,,,,,,,,,,,,,,,,,,,,,,,,,,,,,,,,,,,,,,AOC
,,,,,,,,,,,,,,,,.pdf,"If contractor/firm uploads exemption of earnest money, he has to give affidavit that he has not used",,,,,,,,,,,,,,,,,,,,,,,,,,,,,,,,,,,,,,,,,,,,,,AOC
,,,,,,,,,,,,,,,,.pdf,All other conditions as per NIT,,,,,,,,,,,,,,,,,,,,,,,,,,,,,,,,,,,,,,,,,,,,,,AOC
,,,,,,,,,,,,,,2.0,Finance,.xls,Construction of Jal Shakti Vibhag Sub-Division office Chowari in tehsil Bhattiyat Distt. Chamba (H.P,,,,,,,,,,,,,,,,,,,,,,,,,,,,,,,,,,,,,,,,,,,,,,AOC
