Organisation Chain,Tender Reference Number,Tender ID,Withdrawal Allowed,Tender Type,Form of contract,Tender Category,No. of Covers,General Technical Evaluation Allowed,ItemWise Technical Evaluation Allowed,Payment Mode,Is Multi Currency Allowed For BOQ,Is Multi Currency Allowed For Fee,Allow Two Stage Bidding,Cover No,Cover,Document Type,Description,Publish Date,Bid Opening Date,Document Download / Sale Start Date,Document Download / Sale End Date,Clarification Start Date,Clarification End Date,Bid Submission Start Date,Bid Submission End Date,Financial Bid Opening Date,EMD Amount in ₹,EMD Exemption Allowed,EMD Fee Type,EMD Percentage,EMD Payable To,EMD Payable At,S.No,Bank Name,Tender Fee in ₹,Fee Payable To,Fee Payable At,Tender Fee Exemption Allowed,Name,Address,Title,Work Description,Pre Qualification Details,Independent External Monitor/Remarks,Tender Value in ₹,Product Category,Sub category,Contract Type,Bid Validity(Days),Period Of Work(Days),Location,Pincode,Pre Bid Meeting Place,Pre Bid Meeting Address,Pre Bid Meeting Date,Bid Opening Place,Should Allow NDA Tender,Allow Preferential Bidder,Tender Stage
"HP Irrigation and Public Health||S  Nagar Circle,Irrigation and Public Health,HP||Baggi,Irrigation and Public Health,HP",EE-JSD-BGI/2023- 6382-6442 DT. 13/06/2023,2023_HPIPH_74945_1,Yes,Open Tender,Item Rate,Works,2.0,No,No,Both(Online/Offline),No,No,No,1.0,Fee/PreQual/Technical,.pdf,ALL PAYMENT REGARDING PURCHASE OF BID DOCUMENT AND EMD AS REQUIRED NIT CONDITIO NO. 22(I),15-Jun-2023 09:00 AM,24-Jun-2023 11:30 AM,15-Jun-2023 09:30 AM,23-Jun-2023 05:00 PM,,,15-Jun-2023 10:00 AM,23-Jun-2023 05:00 PM,01-Jul-2023 04:10 PM,"24,000",Yes,fixed,,EE BAGGI,BAGGI,1.0,ICICI BANK,400.0,EE BAGGI,BAGGI,No,EXECUTIVE ENGINEER,EXECUTIVE ENGINEER JAL SHAKTI DIVISION BAGGI,PLWSS TO CHANDYAL BHADYAL AND BEHNA,AS PER BOQ,AS PER NIT,,"12,00,000",Civil Works,PUMPING MACHINERY,Tender,120.0,90.0,BAGGI,175027.0,,,,BAGGI,No,No,AOC
,,,,,,,,,,,,,,,,.pdf,REGISTRATION WITH  HPIPH DEPARTMENT IN APPROPRIATE CLASS AND LATEST RENEWAL.,,,,,,,,,,,,,,,,2.0,ICICI NEFT/RTGS,,,,,,,,,,,,,,,,,,,,,,,,,AOC
,,,,,,,,,,,,,,,,.pdf,PAN NO. AND GST REGISTRATION,,,,,,,,,,,,,,,,,,,,,,,,,,,,,,,,,,,,,,,,,,AOC
,,,,,,,,,,,,,,,,.pdf,SCANNED COPY OF UNDERTAKING AS REQUIRED NIT CONDITION NO. 22(IV),,,,,,,,,,,,,,,,,,,,,,,,,,,,,,,,,,,,,,,,,,AOC
,,,,,,,,,,,,,,,,.pdf,AUTHORIZATION LETTER REGARDING DSC OF THE PERSON AUTHORIZED BY THE REGISTERED TENDERER.,,,,,,,,,,,,,,,,,,,,,,,,,,,,,,,,,,,,,,,,,,AOC
,,,,,,,,,,,,,,,,.pdf,CURVE CHART DULY MARKED WITH DUTY POINT CONDITION ALONG WITH OFFER LIST OTHERWISE TENDER SHALL BE RE,,,,,,,,,,,,,,,,,,,,,,,,,,,,,,,,,,,,,,,,,,AOC
,,,,,,,,,,,,,,2.0,Finance,.xls,BOQ,,,,,,,,,,,,,,,,,,,,,,,,,,,,,,,,,,,,,,,,,,AOC
