Organisation Chain,Tender Reference Number,Tender ID,Withdrawal Allowed,Tender Type,Form of contract,Tender Category,No. of Covers,General Technical Evaluation Allowed,ItemWise Technical Evaluation Allowed,Payment Mode,Is Multi Currency Allowed For BOQ,Is Multi Currency Allowed For Fee,Allow Two Stage Bidding,Cover No,Cover,Document Type,Description,Publish Date,Bid Opening Date,Document Download / Sale Start Date,Document Download / Sale End Date,Clarification Start Date,Clarification End Date,Bid Submission Start Date,Bid Submission End Date,Financial Bid Opening Date,EMD Amount in ₹,EMD Exemption Allowed,EMD Fee Type,EMD Percentage,EMD Payable To,EMD Payable At,S.No,Bank Name,Tender Fee in ₹,Fee Payable To,Fee Payable At,Tender Fee Exemption Allowed,Name,Address,Title,Work Description,Pre Qualification Details,Independent External Monitor/Remarks,Tender Value in ₹,Product Category,Sub category,Contract Type,Bid Validity(Days),Period Of Work(Days),Location,Pincode,Pre Bid Meeting Place,Pre Bid Meeting Address,Pre Bid Meeting Date,Bid Opening Place,Should Allow NDA Tender,Allow Preferential Bidder,Tender Stage
PWD,EE Dehra letter No15063-68  dated 30.03.2022,2022_PWD_59074_3,Yes,Open Tender,Item Rate,Works,2.0,No,No,Online,No,No,No,1.0,Fee/PreQual/Technical,.pdf,Cost of form and earnest money,06-Apr-2022 10:00 AM,13-Apr-2022 11:30 AM,06-Apr-2022 10:00 AM,12-Apr-2022 06:00 PM,06-Apr-2022 10:00 AM,08-Apr-2022 04:00 PM,06-Apr-2022 10:00 AM,12-Apr-2022 06:00 PM,16-Apr-2022 04:00 PM,"18,000",No,fixed,,Nil,Nil,1.0,ICICI BANK,350.0,Nil,Nil,No,Executive Engineer,HPPWD Dehra,Periodic Renewal on Link road to village Dehra to Kuru road for the year 2022-23 under PMGSY,Providing and laying 30 mm thick Bituminous Concrete with Paver Finisher on  Km.  0/0 to 1/00,Please refer to tender documents,,"8,83,211",Civil Works,Tarring work,Tender,75.0,30.0,Dehra,177101.0,,,,Dehra,No,No,AOC
,,,,,,,,,,,,,,,,.pdf,"Copy of valid enlistment/registration, GST Registration, PAN card and EPF Registration",,,,,,,,,,,,,,,,2.0,ICICI NEFT/RTGS,,,,,,,,,,,,,,,,,,,,,,,,,AOC
,,,,,,,,,,,,,,,,.pdf,Aff. reg. correctness of bid with bid name and  reg. list of near relatives working in HPPWD,,,,,,,,,,,,,,,,,,,,,,,,,,,,,,,,,,,,,,,,,,AOC
,,,,,,,,,,,,,,,,.pdf,"Ownership/lease hire proof of paver,plant and list of other machinary equipments required for AMP",,,,,,,,,,,,,,,,,,,,,,,,,,,,,,,,,,,,,,,,,,AOC
,,,,,,,,,,,,,,,,.pdf,List of technical staff,,,,,,,,,,,,,,,,,,,,,,,,,,,,,,,,,,,,,,,,,,AOC
,,,,,,,,,,,,,,,,.pdf,Form 8 duly signed,,,,,,,,,,,,,,,,,,,,,,,,,,,,,,,,,,,,,,,,,,AOC
,,,,,,,,,,,,,,2.0,Finance,.xls,BOQ,,,,,,,,,,,,,,,,,,,,,,,,,,,,,,,,,,,,,,,,,,AOC
