Type :,Summary :,Updated By :,Updated On :,Document :,S.No,Bid Number,Bidder Name,Submitted Date,Status,Remarks,Status Updated On,Committee Chairperson/Co-ordinator Name :,Committee Chairperson/Co-ordinator Type :,Committee Members :,Updated By :.1,Updated on :,Document :.1,Contract Date :,Contract Value :,Work Completion Period in days :,Updated By :.2,Updated on :.1,AOC document :,AOC Description :,Type :.1,Summary :.1,Updated By :.3,Updated On :.1,Document :.2,BOQ Comparative Chart :,Committee Chairperson/Co-ordinator Name :.1,Committee Chairperson/Co-ordinator Type :.1,Committee Members :.1,Updated By :.4,Updated On :.2,Financial Bid Opening Date:,Document :.3,Organisation Chain :,Tender ID :,Tender Ref No :,Tender Title :,S.No.1,Bid Number.1,Bidder Name.1,Awarded Currency,Awarded Value,Tender Stage,Name,Address,Tender Fee in ₹,Fee Payable To,Fee Payable At,Tender Fee Exemption Allowed,Organisation Chain,Tender Reference Number,Tender ID,Withdrawal Allowed,Tender Type,Form of contract,Tender Category,No. of Covers,General Technical Evaluation Allowed,ItemWise Technical Evaluation Allowed,Payment Mode,Is Multi Currency Allowed For BOQ,Is Multi Currency Allowed For Fee,Allow Two Stage Bidding,Title,Work Description,Pre Qualification Details,Independent External Monitor/Remarks,Tender Value in ₹,Product Category,Sub category,Contract Type,Bid Validity(Days),Period Of Work(Days),Location,Pincode,Pre Bid Meeting Place,Pre Bid Meeting Address,Pre Bid Meeting Date,Bid Opening Place,Should Allow NDA Tender,Allow Preferential Bidder,Cover No,Cover,Document Type,Description,S.No,Instrument Type,EMD Amount in ₹,EMD Exemption Allowed,EMD Fee Type,EMD Percentage,EMD Payable To,EMD Payable At,Publish Date,Bid Opening Date,Document Download / Sale Start Date,Document Download / Sale End Date,Clarification Start Date,Clarification End Date,Bid Submission Start Date,Bid Submission End Date,Financial Bid Opening Date,Tender Stage
Technical,BOS,Gopesh Behl,26-Jul-2021 12:45 PM,technical_73990.pdf,1.0,223360.0,ATMA RAM SHARMA,15-Jul-2021 11:51 AM,Rejected-Finance,Rejected,15-Nov-2021 11:41 AM,EE,Internal,AGM SJPNL AO,Rajesh Thakur,15-Nov-2021 11:41 AM,finsummary_73990.pdf (294.94 KB),15-Nov-2021,"INR 1,098,890.83",90.0,Rajesh Thakur,15-Nov-2021 11:42 AM,2021_MC_49397_6.pdf (649.00 KB),AOC,Finance,BOS,Rajesh Thakur,26-Jul-2021 03:10 PM,finance_73990.pdf,BOQ Comparative Chart,EE,Internal,AGM SJPNL AO,Gopesh Behl,26-Jul-2021 02:18 PM,26-Jul-2021 02:20 PM,techsummary_73990.pdf (2396.85 KB),Municipal Corporation Shimla,2021_MC_49397_6,1747Dated25062021,Construction of various path in ward No 23 Bhatta Kuffer (i) Path from Amit House to Ashok House (ii) Path from Sharma Niwas to Chauhan Niwas,1.0,223224.0,HARGOVIND RANA,INR,"996,100",AOC,Executive Engineer R B M C Shimla,Executive Engineer R B M C Shimla,350.0,Executive Engineer R B M C Shimla,Shimla,No,Municipal Corporation Shimla,1747Dated25062021,2021_MC_49397_6,Yes,Open Tender,Item Rate,Works,2.0,No,No,Offline,No,No,No,Construction of various path in ward No 23 Bhatta Kuffer (i) Path from Amit House to Ashok House (ii) Path from Sharma Niwas to Chauhan Niwas,Construction of various path in ward No 23 Bhatta Kuffer (i) Path from Amit House to Ashok House (ii) Path from Sharma Niwas to Chauhan Niwas,Please refer Tender Documents ,NA ,"6,58,027",Civil Works,NA ,Tender,120.0,60.0,Shimla,171001.0,NA ,NA ,NA ,MC Shimla,No ,No,1.0,Fee/PreQual/Technical,.pdf,Cost of form in shape of DD as per e procurement notice,1.0,DD - Demand Draft,"13,200",No,fixed,,Executive Engineer R B M C Shimla,Shimla,03-Jul-2021 05:00 PM,16-Jul-2021 02:00 PM,03-Jul-2021 05:00 PM,15-Jul-2021 05:00 PM,NA ,NA ,03-Jul-2021 05:00 PM,15-Jul-2021 05:00 PM,26-Jul-2021 02:20 PM,AOC
,,,,,2.0,223224.0,HARGOVIND RANA,14-Jul-2021 03:38 PM,Accepted-AOC,Accepted due to lowest rates,15-Nov-2021 11:42 AM,,,,,,,,,,,,,,,,,,,,,,,,,,,,,,,,,,,,AOC,,,,,,,,,,,,,,,,,,,,,,,,,,,,,,,,,,,,,,,,,.pdf,Earnest money in shape of FDR and exemption shall not be allowed,2.0,FDR - Fixed Deposit,,,,,,,,,,,,,,,,AOC
,,,,,3.0,223163.0,Vikram Singh,14-Jul-2021 01:20 PM,Rejected-Finance,Rejected,15-Nov-2021 11:41 AM,,,,,,,,,,,,,,,,,,,,,,,,,,,,,,,,,,,,AOC,,,,,,,,,,,,,,,,,,,,,,,,,,,,,,,,,,,,,,,,,.pdf,Certificate of registration with HPPWD in appropriate class and latest renewal thereof,,,,,,,,,,,,,,,,,,AOC
,,,,,,,,,,,,,,,,,,,,,,,,,,,,,,,,,,,,,,,,,,,,,,,AOC,,,,,,,,,,,,,,,,,,,,,,,,,,,,,,,,,,,,,,,,,.pdf,Income Tax GST and EPF registration PAN Permanent Account No and GST No,,,,,,,,,,,,,,,,,,AOC
,,,,,,,,,,,,,,,,,,,,,,,,,,,,,,,,,,,,,,,,,,,,,,,AOC,,,,,,,,,,,,,,,,,,,,,,,,,,,,,,,,,,,,,,,,,.pdf,Scanned copy of tender document i.e. NIT and Form MW-7 and Performa duly signed,,,,,,,,,,,,,,,,,,AOC
,,,,,,,,,,,,,,,,,,,,,,,,,,,,,,,,,,,,,,,,,,,,,,,AOC,,,,,,,,,,,,,,,,,,,,,,,,,,,,,,,,,,,,,,,2.0,Finance,.xls,Schedule of Quantity (BOQ),,,,,,,,,,,,,,,,,,AOC
