Tender Fee in ₹,Fee Payable To,Fee Payable At,Tender Fee Exemption Allowed,EMD Amount in ₹,EMD Exemption Allowed,EMD Fee Type,EMD Percentage,EMD Payable To,EMD Payable At,Name,Address,Title,Work Description,Pre Qualification Details,Independent External Monitor/Remarks,Tender Value in ₹,Product Category,Sub category,Contract Type,Bid Validity(Days),Period Of Work(Days),Location,Pincode,Pre Bid Meeting Place,Pre Bid Meeting Address,Pre Bid Meeting Date,Bid Opening Place,Should Allow NDA Tender,Allow Preferential Bidder,Cover No,Cover,Document Type,Description,Organisation Chain,Tender Reference Number,Tender ID,Withdrawal Allowed,Tender Type,Form of contract,Tender Category,No. of Covers,General Technical Evaluation Allowed,ItemWise Technical Evaluation Allowed,Payment Mode,Is Multi Currency Allowed For BOQ,Is Multi Currency Allowed For Fee,Allow Two Stage Bidding,S.No,Instrument Type,Publish Date,Bid Opening Date,Document Download / Sale Start Date,Document Download / Sale End Date,Clarification Start Date,Clarification End Date,Bid Submission Start Date,Bid Submission End Date,Financial Bid Opening Date,Tender Stage,S.No,Bid Number,Bidder Name,Awarded Currency,Awarded Value,Organisation Chain :,Tender ID :,Tender Ref No :,Tender Title :,Committee Chairperson/Co-ordinator Name :,Committee Chairperson/Co-ordinator Type :,Committee Members :,Updated By :,Updated On :,Financial Bid Opening Date:,Document :,Type :,Summary :,Updated By :.1,Updated On :.1,Document :.1,BOQ Comparative Chart :,Contract Date :,Contract Value :,Work Completion Period in days :,Updated By :.2,Updated on :,AOC document :,AOC Description :,S.No.1,Bid Number.1,Bidder Name.1,Submitted Date,Status,Remarks,Status Updated On,Committee Chairperson/Co-ordinator Name :.1,Committee Chairperson/Co-ordinator Type :.1,Committee Members :.1,Updated By :.3,Updated on :.1,Document :.2,Type :.1,Summary :.1,Updated By :.4,Updated On :.2,Document :.3,Tender Stage
350.0,Executive Engineer R B M C Shimla,Shimla,No,"18,500",No,fixed,,Executive Engineer R B M C Shimla,Shimla,Executive Engineer R B M C Shimla,Executive Engineer R B M C Shimla,Construction of Public Path from R M Sharma House to Ghora Chowki in ward No 9 Kachighatti R D 0 0 to 0 280 (SH Construction of Retaining wall R D 0 030 to 0 090),Construction of Public Path from R M Sharma House to Ghora Chowki in ward No 9 Kachighatti R D 0 0 to 0 280 (SH Construction of Retaining wall R D 0 030 to 0 090),Please refer Tender Documents ,NA ,"9,23,918",Civil Works,NA ,Tender,120.0,90.0,Shimla,171001.0,NA ,NA ,NA ,MC Shimla,No ,No,1.0,Fee/PreQual/Technical,.pdf,Cost of form in shape of DD and Earnest money in shape of FDR as per e-procurement notice,Municipal Corporation Shimla,2241Dated05082021,2021_MC_51288_5,Yes,Open Tender,Item Rate,Works,2.0,No,No,Offline,No,No,No,1.0,DD - Demand Draft,16-Aug-2021 05:00 PM,25-Aug-2021 02:00 PM,16-Aug-2021 05:00 PM,24-Aug-2021 05:00 PM,NA ,NA ,16-Aug-2021 05:00 PM,24-Aug-2021 05:00 PM,03-Sep-2021 11:20 AM,AOC,1.0,231936.0,Dalip Singh,INR,"1,118,395",Municipal Corporation Shimla,2021_MC_51288_5,2241Dated05082021,Construction of Public Path from R M Sharma House to Ghora Chowki in ward No 9 Kachighatti R D 0 0 to 0 280 (SH Construction of Retaining wall R D 0 030 to 0 090),EE,Internal,AGM SJPNL AO,Gopesh Behl,03-Sep-2021 11:17 AM,03-Sep-2021 11:20 AM,techsummary_76654.pdf (2532.99 KB),Finance,BOS,Rajesh Thakur,03-Sep-2021 12:07 PM,finance_76654.pdf,BOQ Comparative Chart,11-Nov-2021,"INR 1,118,395",90.0,Rajesh Thakur,11-Nov-2021 11:27 AM,2021_MC_51288_5.pdf (432.00 KB),AOC,1.0,231936.0,Dalip Singh,24-Aug-2021 01:32 PM,Accepted-AOC,Accepted due to lowest rates,11-Nov-2021 11:27 AM,EE,Internal,AGM SJPNL AO,Rajesh Thakur,11-Nov-2021 11:20 AM,finsummary_76654.pdf (294.94 KB),Technical,BOS,Gopesh Behl,03-Sep-2021 10:24 AM,technical_76654.pdf,AOC
,,,,,,,,,,,,,,,,,,,,,,,,,,,,,,,,.pdf,Certificate of Registration with HPPWD in appropriate class and latest renewal thereof,,,,,,,,,,,,,,,2.0,FDR - Fixed Deposit,,,,,,,,,,AOC,,,,,,,,,,,,,,,,,,,,,,,,,,,,,,2.0,231901.0,Parmod Kumar,24-Aug-2021 12:20 PM,Rejected-Finance,Rejected,11-Nov-2021 11:20 AM,,,,,,,,,,,,AOC
,,,,,,,,,,,,,,,,,,,,,,,,,,,,,,,,.pdf,Income Tax GST and EPF registration PAN Permanent Account No and GST No,,,,,,,,,,,,,,,,,,,,,,,,,,AOC,,,,,,,,,,,,,,,,,,,,,,,,,,,,,,3.0,231926.0,SANDEEP CHAUHAN,24-Aug-2021 01:00 PM,Rejected-Finance,Rejected,11-Nov-2021 11:20 AM,,,,,,,,,,,,AOC
,,,,,,,,,,,,,,,,,,,,,,,,,,,,,,,,.pdf,"Scanned copy of tender document i.e. e procurement notice, Performa and Form MW-7 duly signed",,,,,,,,,,,,,,,,,,,,,,,,,,AOC,,,,,,,,,,,,,,,,,,,,,,,,,,,,,,4.0,231958.0,SANTOSH KUMAR NAIDU,24-Aug-2021 02:32 PM,Rejected-Finance,Rejected,11-Nov-2021 11:20 AM,,,,,,,,,,,,AOC
,,,,,,,,,,,,,,,,,,,,,,,,,,,,,,2.0,Finance,.xls,Schedule of Quantity (BOQ),,,,,,,,,,,,,,,,,,,,,,,,,,AOC,,,,,,,,,,,,,,,,,,,,,,,,,,,,,,,,,,,,,,,,,,,,,,,,AOC
