Tender Fee in ₹,Fee Payable To,Fee Payable At,Tender Fee Exemption Allowed,Cover No,Cover,Document Type,Description,Title,Work Description,Pre Qualification Details,Independent External Monitor/Remarks,Tender Value in ₹,Product Category,Sub category,Contract Type,Bid Validity(Days),Period Of Work(Days),Location,Pincode,Pre Bid Meeting Place,Pre Bid Meeting Address,Pre Bid Meeting Date,Bid Opening Place,Should Allow NDA Tender,Allow Preferential Bidder,EMD Amount in ₹,EMD Exemption Allowed,EMD Fee Type,EMD Percentage,EMD Payable To,EMD Payable At,Publish Date,Bid Opening Date,Document Download / Sale Start Date,Document Download / Sale End Date,Clarification Start Date,Clarification End Date,Bid Submission Start Date,Bid Submission End Date,Financial Bid Opening Date,Name,Address,S.No,Instrument Type,Organisation Chain,Tender Reference Number,Tender ID,Withdrawal Allowed,Tender Type,Form of contract,Tender Category,No. of Covers,General Technical Evaluation Allowed,ItemWise Technical Evaluation Allowed,Payment Mode,Is Multi Currency Allowed For BOQ,Is Multi Currency Allowed For Fee,Allow Two Stage Bidding,Tender Stage,Organisation Chain :,Tender ID :,Tender Ref No :,Tender Title :,Committee Chairperson/Co-ordinator Name :,Committee Chairperson/Co-ordinator Type :,Committee Members :,Updated By :,Updated On :,Financial Bid Opening Date:,Document :,Committee Chairperson/Co-ordinator Name :.1,Committee Chairperson/Co-ordinator Type :.1,Committee Members :.1,Updated By :.1,Updated on :,Document :.1,Contract Date :,Contract Value :,Work Completion Period in days :,Updated By :.2,Updated on :.1,AOC document :,AOC Description :,Type :,Summary :,Updated By :.3,Updated On :.1,Document :.2,BOQ Comparative Chart :,S.No,Bid Number,Bidder Name,Awarded Currency,Awarded Value,S.No.1,Bid Number.1,Bidder Name.1,Submitted Date,Status,Remarks,Status Updated On,Type :.1,Summary :.1,Updated By :.4,Updated On :.2,Document :.3,Tender Stage
350.0,Executive Engineer R B M C Shimla,Shimla,No,1.0,Fee/PreQual/Technical,.pdf,Cost of form in shape of DD and Earnest money in shape of FDR as per e-procurement notice,Construction of path from Chauhan provision store to Sharma Niwas Gahan in ward No 23,Construction of path from Chauhan provision store to Sharma Niwas Gahan in ward No 23,Please refer Tender Documents ,NA ,"5,15,186",Civil Works,NA ,Tender,120.0,60.0,Shimla,171001.0,NA ,NA ,NA ,MC Shimla,No ,No,"10,400",No,fixed,,Executive Engineer R B M C Shimla,Shimla,25-Aug-2021 01:00 PM,06-Sep-2021 02:00 PM,25-Aug-2021 01:00 PM,04-Sep-2021 05:00 PM,NA ,NA ,25-Aug-2021 01:00 PM,04-Sep-2021 05:00 PM,20-Sep-2021 11:20 AM,Executive Engineer R B M C Shimla,Executive Engineer R B M C Shimla,1.0,DD - Demand Draft,Municipal Corporation Shimla,2332Dated11082021,2021_MC_51611_18,Yes,Open Tender,Item Rate,Works,2.0,No,No,Offline,No,No,No,AOC,Municipal Corporation Shimla,2021_MC_51611_18,2332Dated11082021,Construction of path from Chauhan provision store to Sharma Niwas Gahan in ward No 23,EE,Internal,AGM SJPNL AO,Rajesh Thakur,20-Sep-2021 11:16 AM,20-Sep-2021 11:20 AM,techsummary_77177.pdf (5078.58 KB),EE,Internal,AGM SJPNL AO,Rajesh Thakur,25-Nov-2021 04:37 PM,finsummary_77177.pdf (294.95 KB),25-Nov-2021,"INR 903,832",60.0,Rajesh Thakur,25-Nov-2021 04:39 PM,2021_MC_51611_18.pdf (606.00 KB),AOC,Finance,BOS,Gopesh Behl,20-Sep-2021 01:06 PM,finance_77177.pdf,BOQ Comparative Chart,1.0,233883.0,HARGOVIND RANA,INR,"786,200",1.0,233949.0,ATMA RAM SHARMA,03-Sep-2021 04:49 PM,Rejected-Finance,Rejected,25-Nov-2021 04:37 PM,Technical,BOS,Gopesh Behl,18-Sep-2021 04:06 PM,technical_77177.pdf,AOC
,,,,,,.pdf,Certificate of Registration with HPPWD in appropriate class and latest renewal thereof,,,,,,,,,,,,,,,,,,,,,,,,,,,,,,,,,,,,2.0,FDR - Fixed Deposit,,,,,,,,,,,,,,,AOC,,,,,,,,,,,,,,,,,,,,,,,,,,,,,,,,,,,,2.0,233883.0,HARGOVIND RANA,03-Sep-2021 05:05 PM,Accepted-AOC,Accepted due to lowest rates,25-Nov-2021 04:39 PM,,,,,,AOC
,,,,,,.pdf,Income Tax GST and EPF registration PAN Permanent Account No and GST No,,,,,,,,,,,,,,,,,,,,,,,,,,,,,,,,,,,,,,,,,,,,,,,,,,,,AOC,,,,,,,,,,,,,,,,,,,,,,,,,,,,,,,,,,,,,,,,,,,,,,,,AOC
,,,,,,.pdf,"Scanned copy of tender document i.e. e procurement notice, Performa and Form MW-7 duly signed",,,,,,,,,,,,,,,,,,,,,,,,,,,,,,,,,,,,,,,,,,,,,,,,,,,,AOC,,,,,,,,,,,,,,,,,,,,,,,,,,,,,,,,,,,,,,,,,,,,,,,,AOC
,,,,2.0,Finance,.xls,Schedule of Quantity (BOQ),,,,,,,,,,,,,,,,,,,,,,,,,,,,,,,,,,,,,,,,,,,,,,,,,,,,AOC,,,,,,,,,,,,,,,,,,,,,,,,,,,,,,,,,,,,,,,,,,,,,,,,AOC
