Name,Address,Tender Fee in ₹,Fee Payable To,Fee Payable At,Tender Fee Exemption Allowed,Title,Work Description,Pre Qualification Details,Independent External Monitor/Remarks,Tender Value in ₹,Product Category,Sub category,Contract Type,Bid Validity(Days),Period Of Work(Days),Location,Pincode,Pre Bid Meeting Place,Pre Bid Meeting Address,Pre Bid Meeting Date,Bid Opening Place,Should Allow NDA Tender,Allow Preferential Bidder,Organisation Chain,Tender Reference Number,Tender ID,Withdrawal Allowed,Tender Type,Form of contract,Tender Category,No. of Covers,General Technical Evaluation Allowed,ItemWise Technical Evaluation Allowed,Payment Mode,Is Multi Currency Allowed For BOQ,Is Multi Currency Allowed For Fee,Allow Two Stage Bidding,S.No,Instrument Type,Publish Date,Bid Opening Date,Document Download / Sale Start Date,Document Download / Sale End Date,Clarification Start Date,Clarification End Date,Bid Submission Start Date,Bid Submission End Date,Financial Bid Opening Date,Cover No,Cover,Document Type,Description,EMD Amount in ₹,EMD Exemption Allowed,EMD Fee Type,EMD Percentage,EMD Payable To,EMD Payable At,Tender Stage,Organisation Chain :,Tender ID :,Tender Ref No :,Tender Title :,Committee Chairperson/Co-ordinator Name :,Committee Chairperson/Co-ordinator Type :,Committee Members :,Updated By :,Updated On :,Financial Bid Opening Date:,Document :,Committee Chairperson/Co-ordinator Name :.1,Committee Chairperson/Co-ordinator Type :.1,Committee Members :.1,Updated By :.1,Updated on :,Document :.1,Contract Date :,Contract Value :,Work Completion Period in days :,Updated By :.2,Updated on :.1,AOC document :,AOC Description :,S.No,Bid Number,Bidder Name,Submitted Date,Status,Remarks,Status Updated On,Type :,Summary :,Updated By :.3,Updated On :.1,Document :.2,Type :.1,Summary :.1,Updated By :.4,Updated On :.2,Document :.3,BOQ Comparative Chart :,S.No.1,Bid Number.1,Bidder Name.1,Awarded Currency,Awarded Value,Tender Stage
Executive Engineer R B M C Shimla,Executive Engineer R B M C Shimla,350.0,Executive Engineer R B M C Shimla,Shimla,No,Construction of path from Churat Road to above Lower Dhalli Colony in ward No 21 Mashobra,Construction of path from Churat Road to above Lower Dhalli Colony in ward No 21 Mashobra,Please refer Tender Documents ,NA ,"4,22,383",Civil Works,NA ,Tender,120.0,60.0,Shimla,171001.0,NA ,NA ,NA ,MC Shimla,No ,No,Municipal Corporation Shimla,2643Dated10092021,2021_MC_52543_14,Yes,Open Tender,Item Rate,Works,2.0,No,No,Offline,No,No,No,1.0,DD - Demand Draft,21-Sep-2021 05:00 PM,05-Oct-2021 02:00 PM,21-Sep-2021 05:00 PM,04-Oct-2021 05:00 PM,NA ,NA ,21-Sep-2021 05:00 PM,04-Oct-2021 05:00 PM,14-Oct-2021 02:00 PM,1.0,Fee/PreQual/Technical,.pdf,Cost of Form in shape of DD and Earnest money in shape of FD as per E procurement Notice,"8,500",No,fixed,,Executive Engineer R B M C Shimla,Shimla,AOC,Municipal Corporation Shimla,2021_MC_52543_14,2643Dated10092021,Construction of path from Churat Road to above Lower Dhalli Colony in ward No 21 Mashobra,EE,Internal,AGM SJPNL AO,Gopesh Behl,14-Oct-2021 01:56 PM,14-Oct-2021 02:00 PM,techsummary_78581.pdf (3386.08 KB),EE,Internal,AGM SJPNL AO,Rajesh Thakur,26-Nov-2021 12:09 PM,finsummary_78581.pdf (294.94 KB),26-Nov-2021,"INR 421,704.4",60.0,Rajesh Thakur,26-Nov-2021 12:17 PM,2021_MC_52543_14.pdf (524.00 KB),AOC,1.0,239306.0,RAMESH VIJ,04-Oct-2021 02:31 PM,Rejected-Finance,Rejected,26-Nov-2021 12:09 PM,Technical,BOS,Gopesh Behl,14-Oct-2021 12:36 PM,technical_78581.pdf,Finance,BOS,Rajesh Thakur,14-Oct-2021 02:56 PM,finance_78581.pdf,BOQ Comparative Chart,1.0,239258.0,ROHIT DIWAN,INR,"414,592",AOC
,,,,,,,,,,,,,,,,,,,,,,,,,,,,,,,,,,,,,,2.0,FDR - Fixed Deposit,,,,,,,,,,,,.pdf,Certificate of registration with HPPWD in appropriate class and latest renewal threof,,,,,,,AOC,,,,,,,,,,,,,,,,,,,,,,,,,2.0,239258.0,ROHIT DIWAN,04-Oct-2021 01:04 PM,Accepted-AOC,Accepted due to lowest rates,26-Nov-2021 12:17 PM,,,,,,,,,,,,,,,,,AOC
,,,,,,,,,,,,,,,,,,,,,,,,,,,,,,,,,,,,,,,,,,,,,,,,,,,.pdf,Income Tax GST and EPF registration PAN Permanent Account No and GST No,,,,,,,AOC,,,,,,,,,,,,,,,,,,,,,,,,,,,,,,,,,,,,,,,,,,,,,,,,AOC
,,,,,,,,,,,,,,,,,,,,,,,,,,,,,,,,,,,,,,,,,,,,,,,,,,,.pdf,"Scanned copy of tender document i.e. NIT (E-procurement notice), Form MW-7 and Performa duly signed",,,,,,,AOC,,,,,,,,,,,,,,,,,,,,,,,,,,,,,,,,,,,,,,,,,,,,,,,,AOC
,,,,,,,,,,,,,,,,,,,,,,,,,,,,,,,,,,,,,,,,,,,,,,,,,2.0,Finance,.xls,Schedule of Quantity (BOQ),,,,,,,AOC,,,,,,,,,,,,,,,,,,,,,,,,,,,,,,,,,,,,,,,,,,,,,,,,AOC
