2019_DoWR_15211_3,KARIMGANJ/2019-20/SOPD-FDR/II,"Kabaribond village along with improvement of Longai ,Retender-5",Reconstruction of Breached embankment at Kabaribond village along with improvement of Longai L/B embankment from Ch. 0 to 21.95 KM including anti-erosion measures at different reaches.,Works,Open Tender,Works,Civil Works,No,No,NA ,28-Jan-2020 06:00 PM,NA ,180.0,No ,No,Online,05-Feb-2020 02:00 PM,Department of Water Resources||Chief Engineer - DoWR,Karimganj,788710.0,3.0,"5,13,13,827",MOINUL HOQUE,51184439.34,Accepted-AOC,10-Jun-2020,AOC,Department of Water Resources||Chief Engineer - DoWR,True,"{'Flood': 0, 'Embankment': 2, 'embkt': 0, 'Relief': 0, 'Erosion': 1, 'SDRF': 0, 'Inundation': 0, 'Hydrology': 0, 'Silt': 0, 'Siltation': 0, 'Bund': 0, 'Trench': 0, 'Breach': 0, 'Culvert': 0, 'Sluice': 0, 'Dyke': 0, 'Storm water drain': 0, 'Emergency': 0, 'Immediate': 0, 'IM': 0, 'AE': 0, 'A E': 0, 'AAPDA MITRA': 0}","{'Floodlight': 0, 'Flood Light': 0, 'GAS': 0, 'FIFA': 0, 'pipe': 0, 'pipes': 0, 'covid': 0}",Pre-Monsoon,SOPD,True,True,Repair and Restoration,"{'improvement': 2, 'reconstruction': 1}"
2020_DoWR_17370_1,BARPETA/2019-20/SDRF/V,Immediate measures for restoration of flood damages on R/B embankment of River Pahumara and Teklajan at Saralpara area under SDRF for 2019-20.,Immediate measures for restoration of flood damages on R/B embankment of River Pahumara and Teklajan at Saralpara area under SDRF for 2019-20.,Works,Open Tender,Works,Civil Works,No,No,NA ,28-Apr-2020 06:00 PM,NA ,180.0,No ,No,Online,11-May-2020 02:05 PM,Department of Water Resources||Chief Engineer - DoWR,BARPETA,781301.0,3.0,"1,89,99,984",Ashok Kumar Agarwalla,15410171.04,Rejected-AOC,08-Jun-2020,AOC,Department of Water Resources||Chief Engineer - DoWR,True,"{'Flood': 2, 'Embankment': 2, 'embkt': 0, 'Relief': 0, 'Erosion': 0, 'SDRF': 3, 'Inundation': 0, 'Hydrology': 0, 'Silt': 0, 'Siltation': 0, 'Bund': 0, 'Trench': 0, 'Breach': 0, 'Culvert': 0, 'Sluice': 0, 'Dyke': 0, 'Storm water drain': 0, 'Emergency': 0, 'Immediate': 2, 'IM': 0, 'AE': 0, 'A E': 0, 'AAPDA MITRA': 0}","{'Floodlight': 0, 'Flood Light': 0, 'GAS': 0, 'FIFA': 0, 'pipe': 0, 'pipes': 0, 'covid': 0}",Pre-Monsoon,SDRF,False,True,Repair and Restoration,{'restoration': 2}
2019_DoWR_14785_1,FREMAA/Kaziranga/KP/K-E-9 of 2019,Earthwork for Gap filling at Sluice locations,"Earthwork for Gap filling at Sluice locations of Brahmaputra Dyke Kaziranga, Golaghat District, Assam",Works,Open Tender,Works,Civil Works,No,No,NA ,18-Nov-2019 10:00 AM,30-Nov-2019 11:00 AM ,120.0,No ,No,Online,27-Dec-2019 03:10 PM,Department of Water Resources||Flood and River Erosion Management Agency of Assam,"Brahmaputra Dyke Kaziranga, Golaghat, Assam",785612.0,1.0,"5,27,08,000",M/S. M.P. AGARWALLA,46857406.03,Accepted-AOC,17-Jun-2020,AOC,Department of Water Resources||Flood and River Erosion Management Agency of Assam,True,"{'Flood': 0, 'Embankment': 0, 'embkt': 0, 'Relief': 0, 'Erosion': 0, 'SDRF': 0, 'Inundation': 0, 'Hydrology': 0, 'Silt': 0, 'Siltation': 0, 'Bund': 0, 'Trench': 0, 'Breach': 0, 'Culvert': 0, 'Sluice': 2, 'Dyke': 1, 'Storm water drain': 0, 'Emergency': 0, 'Immediate': 0, 'IM': 0, 'AE': 0, 'A E': 0, 'AAPDA MITRA': 0}","{'Floodlight': 0, 'Flood Light': 0, 'GAS': 0, 'FIFA': 0, 'pipe': 0, 'pipes': 0, 'covid': 0}",Post-Monsoon,,False,True,Others,
2019_DoWR_15196_4,KARIMGANJ/2019-20/SOPD-FDR/I,Reconstruction of Breached embankment at Dullavpur and Mukamerbond along with improvement of Shingla R/B embankment from Phanirbond to Dullavpur PACKAGE 1 RETENDER,Reconstruction of Breached embankment at Dullavpur and Mukamerbond along with improvement of Shingla R/B embankment from Phanirbond to Dullavpur including anti-erosion measures at different reaches.,Works,Open Tender,Works,Civil Works,No,No,NA ,18-Feb-2020 06:00 PM,NA ,180.0,No ,No,Online,27-Feb-2020 02:00 PM,Department of Water Resources||Chief Engineer - DoWR,KARIMGANJ,788710.0,3.0,"9,68,12,121",SMTI JOYSHREE DEB,94857432.92,Accepted-AOC,02-Jun-2020,AOC,Department of Water Resources||Chief Engineer - DoWR,True,"{'Flood': 0, 'Embankment': 4, 'embkt': 0, 'Relief': 0, 'Erosion': 1, 'SDRF': 0, 'Inundation': 0, 'Hydrology': 0, 'Silt': 0, 'Siltation': 0, 'Bund': 0, 'Trench': 0, 'Breach': 0, 'Culvert': 0, 'Sluice': 0, 'Dyke': 0, 'Storm water drain': 0, 'Emergency': 0, 'Immediate': 0, 'IM': 0, 'AE': 0, 'A E': 0, 'AAPDA MITRA': 0}","{'Floodlight': 0, 'Flood Light': 0, 'GAS': 0, 'FIFA': 0, 'pipe': 0, 'pipes': 0, 'covid': 0}",Pre-Monsoon,SOPD,True,True,Repair and Restoration,"{'improvement': 2, 'reconstruction': 2}"
2020_DoWR_17367_1,BARPETA/2019-20/SDRF/I,Immediate measures for restoration of flood damages on R/B embankment of River Pahumara at 20th Km Kahara Pathar and 24th km Banglipara under SDRF for 2019-20.,Immediate measures for restoration of flood damages on R/B embankment of River Pahumara at 20th Km Kahara Pathar and 24th km Banglipara under SDRF for 2019-20.,Works,Open Tender,Works,Civil Works,No,No,NA ,28-Apr-2020 06:00 PM,NA ,180.0,No ,No,Online,11-May-2020 02:05 PM,Department of Water Resources||Chief Engineer - DoWR,BARPETA,781301.0,3.0,"2,19,99,970",DHARMENDRA TALUKDAR-SANKALPA ASSOCIATES JV,18950546.77,Rejected-AOC,08-Jun-2020,AOC,Department of Water Resources||Chief Engineer - DoWR,True,"{'Flood': 2, 'Embankment': 2, 'embkt': 0, 'Relief': 0, 'Erosion': 0, 'SDRF': 3, 'Inundation': 0, 'Hydrology': 0, 'Silt': 0, 'Siltation': 0, 'Bund': 0, 'Trench': 0, 'Breach': 0, 'Culvert': 0, 'Sluice': 0, 'Dyke': 0, 'Storm water drain': 0, 'Emergency': 0, 'Immediate': 2, 'IM': 0, 'AE': 0, 'A E': 0, 'AAPDA MITRA': 0}","{'Floodlight': 0, 'Flood Light': 0, 'GAS': 0, 'FIFA': 0, 'pipe': 0, 'pipes': 0, 'covid': 0}",Pre-Monsoon,SDRF,False,True,Repair and Restoration,{'restoration': 2}
2020_DoWR_17207_1,DIBRUGARH/2019-20/SDRF/II,Immediate measures to restore Rohmoria area near H.S school from the river Brahmaputra for 2019-20,Immediate measures to restore Rohmoria area near H.S school from the river Brahmaputra for 2019-20,Works,Open Tender,Works,Civil Works,No,No,NA ,17-Mar-2020 06:00 PM,NA ,180.0,No ,No,Online,23-Apr-2020 02:00 PM,Department of Water Resources||Chief Engineer - DoWR,DIBRUGARH,786001.0,3.0,"7,74,92,999",SOMESWAR DAS,74389405.04,Rejected-AOC,20-Jun-2020,AOC,Department of Water Resources||Chief Engineer - DoWR,True,"{'Flood': 0, 'Embankment': 0, 'embkt': 0, 'Relief': 0, 'Erosion': 0, 'SDRF': 1, 'Inundation': 0, 'Hydrology': 0, 'Silt': 0, 'Siltation': 0, 'Bund': 0, 'Trench': 0, 'Breach': 0, 'Culvert': 0, 'Sluice': 0, 'Dyke': 0, 'Storm water drain': 0, 'Emergency': 0, 'Immediate': 2, 'IM': 0, 'AE': 0, 'A E': 0, 'AAPDA MITRA': 0}","{'Floodlight': 0, 'Flood Light': 0, 'GAS': 0, 'FIFA': 0, 'pipe': 0, 'pipes': 0, 'covid': 0}",Pre-Monsoon,SDRF,False,False,Immediate Measures,"{'sdrf': 1, 'immediate': 2}"
2020_DoWR_16278_1,NAGAON/2019-20/SOPD-FDR/II,Construction of Ring Bund from Gakhirkhaiti to Sullung along left bank of river Brahmaputra. PACKAGE 2,Construction of Ring Bund from Gakhirkhaiti to Sullung along left bank of river Brahmaputra.,Works,Open Tender,Works,Civil Works,No,No,NA ,04-Feb-2020 06:00 PM,NA ,180.0,No ,No,Online,26-Feb-2020 02:00 PM,Department of Water Resources||Chief Engineer - DoWR,NAGAON,782001.0,3.0,"3,41,14,199",Nabajyoti Borah and Dulal Ch Borah JV,33602304.07,Accepted-AOC,03-Jun-2020,AOC,Department of Water Resources||Chief Engineer - DoWR,True,"{'Flood': 0, 'Embankment': 0, 'embkt': 0, 'Relief': 0, 'Erosion': 0, 'SDRF': 0, 'Inundation': 0, 'Hydrology': 0, 'Silt': 0, 'Siltation': 0, 'Bund': 2, 'Trench': 0, 'Breach': 0, 'Culvert': 0, 'Sluice': 0, 'Dyke': 0, 'Storm water drain': 0, 'Emergency': 0, 'Immediate': 0, 'IM': 0, 'AE': 0, 'A E': 0, 'AAPDA MITRA': 0}","{'Floodlight': 0, 'Flood Light': 0, 'GAS': 0, 'FIFA': 0, 'pipe': 0, 'pipes': 0, 'covid': 0}",Pre-Monsoon,SOPD,False,True,Immediate Measures,{'package': 1}
2020_DoWR_16391_2,BARPETA/2019-20/SOPD-FDR/V,Reconstruction of Public cut on embankment at Gagalmari including improvement of R/B embkt. Along river Morachowlkhowa RETENDER,Reconstruction of Public cut on embankment at Gagalmari including improvement of R/B embkt. Along river Morachowlkhowa from ch. 0.00 Km to ch.5.60 Km along with A/E measures at different reaches under SOPD(FDR) for 2019-20.,Works,Open Tender,Works,Civil Works,No,No,NA ,07-Mar-2020 06:00 PM,NA ,180.0,No ,No,Online,16-Mar-2020 02:15 PM,Department of Water Resources||Chief Engineer - DoWR,BARPETA,781301.0,3.0,"16,11,00,263",M/S ZED ENGINEERS-ARIFUDDIN AHMED JV,158055796.41,Rejected-AOC,10-Jun-2020,AOC,Department of Water Resources||Chief Engineer - DoWR,True,"{'Flood': 0, 'Embankment': 2, 'embkt': 2, 'Relief': 0, 'Erosion': 0, 'SDRF': 0, 'Inundation': 0, 'Hydrology': 0, 'Silt': 0, 'Siltation': 0, 'Bund': 0, 'Trench': 0, 'Breach': 0, 'Culvert': 0, 'Sluice': 0, 'Dyke': 0, 'Storm water drain': 0, 'Emergency': 0, 'Immediate': 0, 'IM': 0, 'AE': 0, 'A E': 1, 'AAPDA MITRA': 0}","{'Floodlight': 0, 'Flood Light': 0, 'GAS': 0, 'FIFA': 0, 'pipe': 0, 'pipes': 0, 'covid': 0}",Pre-Monsoon,SOPD,True,True,Repair and Restoration,"{'improvement': 2, 'reconstruction': 2}"
2020_DoWR_17137_1,JOR/SDRF/GELABEEL/2019-20/1,Immediate measures to restore Namtemera area from the flood damages of river Gelabeel under SDRF for 2019-20.,Immediate measures to restore Namtemera area from the flood damages of river Gelabeel under SDRF for 2019-20.,Works,Open Tender,Works,Civil Works,No,No,NA ,12-Mar-2020 06:00 PM,NA ,180.0,No ,No,Online,23-Mar-2020 02:00 PM,Department of Water Resources||Chief Engineer - DoWR,Bokakhat,785612.0,3.0,"2,89,91,959",ADITYA DOWARAH,24063326.0,Accepted-AOC,05-Jun-2020,AOC,Department of Water Resources||Chief Engineer - DoWR,True,"{'Flood': 2, 'Embankment': 0, 'embkt': 0, 'Relief': 0, 'Erosion': 0, 'SDRF': 3, 'Inundation': 0, 'Hydrology': 0, 'Silt': 0, 'Siltation': 0, 'Bund': 0, 'Trench': 0, 'Breach': 0, 'Culvert': 0, 'Sluice': 0, 'Dyke': 0, 'Storm water drain': 0, 'Emergency': 0, 'Immediate': 2, 'IM': 0, 'AE': 0, 'A E': 0, 'AAPDA MITRA': 0}","{'Floodlight': 0, 'Flood Light': 0, 'GAS': 0, 'FIFA': 0, 'pipe': 0, 'pipes': 0, 'covid': 0}",Pre-Monsoon,SDRF,False,False,Immediate Measures,"{'sdrf': 3, 'immediate': 2}"
2020_DoWR_17162_1,TEZPUR/2019-20/SOPD-G/I,A/E measures to protect Berajan-Rajgarh area from the flood devastation of river Jiabharali on its Right Bank under SOPD for 2019-20,A/E measures to protect Berajan-Rajgarh area from the flood devastation of river Jiabharali on its Right Bank under SOPD for 2019-20,Works,Open Tender,Works,Civil Works,No,No,NA ,14-Mar-2020 06:00 PM,NA ,180.0,No ,No,Online,23-Apr-2020 02:00 PM,Department of Water Resources||Chief Engineer - DoWR,TEZPUR,784001.0,3.0,"3,36,79,124",GLOBAL ENTERPRISE,,Accepted-AOC,,AOC,Department of Water Resources||Chief Engineer - DoWR,True,"{'Flood': 2, 'Embankment': 0, 'embkt': 0, 'Relief': 0, 'Erosion': 0, 'SDRF': 0, 'Inundation': 0, 'Hydrology': 0, 'Silt': 0, 'Siltation': 0, 'Bund': 0, 'Trench': 0, 'Breach': 0, 'Culvert': 0, 'Sluice': 0, 'Dyke': 0, 'Storm water drain': 0, 'Emergency': 0, 'Immediate': 0, 'IM': 0, 'AE': 0, 'A E': 2, 'AAPDA MITRA': 0}","{'Floodlight': 0, 'Flood Light': 0, 'GAS': 0, 'FIFA': 0, 'pipe': 0, 'pipes': 0, 'covid': 0}",Pre-Monsoon,SOPD,True,False,Others,
2020_DoWR_16734_1,NALBARI/2019-20/SOPD-FDR/IV,improvement of Noona R-B embkt. along with A-E measures,Reconstruction of breached like damage embkt. at U-S D-S of Rly. Line along with improvement of Noona R-B embkt. along with A-E measures at different reaches under SOPD-FDR for the year 2019- 20,Works,Open Tender,Works,Civil Works,No,No,NA ,22-Feb-2020 06:00 PM,NA ,180.0,No ,No,Online,16-Mar-2020 02:05 PM,Department of Water Resources||Chief Engineer - DoWR,Nalbari,781335.0,3.0,"5,34,14,670",Sailen Kumar Sharma,48235252.63,Accepted-AOC,02-Jun-2020,AOC,Department of Water Resources||Chief Engineer - DoWR,True,"{'Flood': 0, 'Embankment': 0, 'embkt': 3, 'Relief': 0, 'Erosion': 0, 'SDRF': 0, 'Inundation': 0, 'Hydrology': 0, 'Silt': 0, 'Siltation': 0, 'Bund': 0, 'Trench': 0, 'Breach': 0, 'Culvert': 0, 'Sluice': 0, 'Dyke': 0, 'Storm water drain': 0, 'Emergency': 0, 'Immediate': 0, 'IM': 0, 'AE': 0, 'A E': 2, 'AAPDA MITRA': 0}","{'Floodlight': 0, 'Flood Light': 0, 'GAS': 0, 'FIFA': 0, 'pipe': 0, 'pipes': 0, 'covid': 0}",Pre-Monsoon,SOPD,True,True,Repair and Restoration,"{'improvement': 2, 'reconstruction': 1}"
2020_DoWR_16441_1,MAJULI/2019-20/SOPD-FDR/II,Pro-siltation measures at Sorai Chapori and its adjoining area under Dakhin Ahotguri G.P. in Majuli island,Pro-siltation measures at Sorai Chapori and its adjoining area under Dakhin Ahotguri G.P. in Majuli island,Works,Open Tender,Works,Civil Works,No,No,NA ,12-Feb-2020 06:00 PM,NA ,180.0,No ,No,Online,04-Mar-2020 02:00 PM,Department of Water Resources||Chief Engineer - DoWR,MAJULI,785105.0,3.0,"5,53,99,505",SA ENTERPRISE ROHIT SAH JV,47147160.65,Rejected-AOC,17-Jun-2020,AOC,Department of Water Resources||Chief Engineer - DoWR,True,"{'Flood': 0, 'Embankment': 0, 'embkt': 0, 'Relief': 0, 'Erosion': 0, 'SDRF': 0, 'Inundation': 0, 'Hydrology': 0, 'Silt': 0, 'Siltation': 2, 'Bund': 0, 'Trench': 0, 'Breach': 0, 'Culvert': 0, 'Sluice': 0, 'Dyke': 0, 'Storm water drain': 0, 'Emergency': 0, 'Immediate': 0, 'IM': 0, 'AE': 0, 'A E': 0, 'AAPDA MITRA': 0}","{'Floodlight': 0, 'Flood Light': 0, 'GAS': 0, 'FIFA': 0, 'pipe': 0, 'pipes': 0, 'covid': 0}",Pre-Monsoon,SOPD,False,True,Others,
2020_DoWR_16395_1,TEZPUR/2019-20/SOPD-FDR/II,A/E Measures at Dipara Dani Gaon (Model Village) to protect Kalyani Than and its adjoining area from the erosion of river Brahmaputra,A/E Measures at Dipara Dani Gaon (Model Village) to protect Kalyani Than and its adjoining area from the erosion of river Brahmaputra,Works,Open Tender,Works,Civil Works,No,No,NA ,10-Feb-2020 06:00 PM,NA ,180.0,No ,No,Online,03-Mar-2020 02:00 PM,Department of Water Resources||Chief Engineer - DoWR,TEZPUR,784001.0,3.0,"13,54,29,364",M/S. M.P. AGARWALLA,,Rejected-AOC,,AOC,Department of Water Resources||Chief Engineer - DoWR,True,"{'Flood': 0, 'Embankment': 0, 'embkt': 0, 'Relief': 0, 'Erosion': 2, 'SDRF': 0, 'Inundation': 0, 'Hydrology': 0, 'Silt': 0, 'Siltation': 0, 'Bund': 0, 'Trench': 0, 'Breach': 0, 'Culvert': 0, 'Sluice': 0, 'Dyke': 0, 'Storm water drain': 0, 'Emergency': 0, 'Immediate': 0, 'IM': 0, 'AE': 0, 'A E': 2, 'AAPDA MITRA': 0}","{'Floodlight': 0, 'Flood Light': 0, 'GAS': 0, 'FIFA': 0, 'pipe': 0, 'pipes': 0, 'covid': 0}",Pre-Monsoon,SOPD,True,False,Others,
2019_DoWR_15215_3,KARIMGANJ/2019-20/SOPD-FDR/II,Reconstruction of Breached embankment at Kabaribond village Package 9 RETENDER,Reconstruction of Breached embankment at Kabaribond village along with improvement of Longai L/B embankment from Ch. 0 to 21.95 KM including anti-erosion measures at different reaches.,Works,Open Tender,Works,Civil Works,No,No,NA ,28-Jan-2020 06:00 PM,NA ,180.0,No ,No,Online,05-Feb-2020 02:00 PM,Department of Water Resources||Chief Engineer - DoWR,KARIMGANJ,788710.0,3.0,"8,94,08,772",SMTI JOYSHREE DEB,89407511.88,Accepted-AOC,03-Jun-2020,AOC,Department of Water Resources||Chief Engineer - DoWR,True,"{'Flood': 0, 'Embankment': 3, 'embkt': 0, 'Relief': 0, 'Erosion': 1, 'SDRF': 0, 'Inundation': 0, 'Hydrology': 0, 'Silt': 0, 'Siltation': 0, 'Bund': 0, 'Trench': 0, 'Breach': 0, 'Culvert': 0, 'Sluice': 0, 'Dyke': 0, 'Storm water drain': 0, 'Emergency': 0, 'Immediate': 0, 'IM': 0, 'AE': 0, 'A E': 0, 'AAPDA MITRA': 0}","{'Floodlight': 0, 'Flood Light': 0, 'GAS': 0, 'FIFA': 0, 'pipe': 0, 'pipes': 0, 'covid': 0}",Pre-Monsoon,SOPD,True,True,Repair and Restoration,"{'improvement': 1, 'reconstruction': 2}"
2019_DoWR_15012_2,MANGALDAI/2019-20/SOPD-FDR/II,"Reconstruction of breached embankment at Kumarpara ,Retender-pk1",Reconstruction of breached embankment at Kumarpara (Ch. 16800 m) including improvement of Nonoi R/B embankment from Ch. 4925 m to 24925 m under SOPD (FDR) for 2019-20,Works,Open Tender,Works,Civil Works,No,No,NA ,08-Jan-2020 06:00 PM,NA ,180.0,No ,No,Online,18-Jan-2020 02:00 PM,Department of Water Resources||Chief Engineer - DoWR,Mangaldai,784125.0,3.0,"2,97,62,408",NIRENDU ROY MIRZA MD. RAIHAN-JV,26784679.17,Not Admitted-PreQual/Technical,10-Jun-2020,AOC,Department of Water Resources||Chief Engineer - DoWR,True,"{'Flood': 0, 'Embankment': 3, 'embkt': 0, 'Relief': 0, 'Erosion': 0, 'SDRF': 0, 'Inundation': 0, 'Hydrology': 0, 'Silt': 0, 'Siltation': 0, 'Bund': 0, 'Trench': 0, 'Breach': 0, 'Culvert': 0, 'Sluice': 0, 'Dyke': 0, 'Storm water drain': 0, 'Emergency': 0, 'Immediate': 0, 'IM': 0, 'AE': 0, 'A E': 0, 'AAPDA MITRA': 0}","{'Floodlight': 0, 'Flood Light': 0, 'GAS': 0, 'FIFA': 0, 'pipe': 0, 'pipes': 0, 'covid': 0}",Pre-Monsoon,SOPD,False,True,Repair and Restoration,"{'improvement': 1, 'reconstruction': 2}"
2020_BTCWR_16840_2,"AddlCEKZWRAccttE-T/100/136, dtd.26-02-20",Immediate measures for restoration of village Khagrabari from flood damages on L/B of river Beki under S.D.R.F. for 2019-20.,Immediate measures for restoration of village Khagrabari from flood damages on L/B of river Beki under S.D.R.F. for 2019-20.,Works,Open Tender,Item Rate,Civil Works,No,No,NA ,28-Feb-2020 10:00 AM,NA ,180.0,No ,No,Online,10-Mar-2020 04:00 PM,Bodoland Territorial Council-WRD,Khagrabari village,784509.0,2.0,"1,29,99,777",KATIRAM NARZARY,12948824.48,Accepted-AOC,21-May-2020,AOC,Bodoland Territorial Council-WRD,True,"{'Flood': 2, 'Embankment': 0, 'embkt': 0, 'Relief': 0, 'Erosion': 0, 'SDRF': 0, 'Inundation': 0, 'Hydrology': 0, 'Silt': 0, 'Siltation': 0, 'Bund': 0, 'Trench': 0, 'Breach': 0, 'Culvert': 0, 'Sluice': 0, 'Dyke': 0, 'Storm water drain': 0, 'Emergency': 0, 'Immediate': 2, 'IM': 0, 'AE': 0, 'A E': 0, 'AAPDA MITRA': 0}","{'Floodlight': 0, 'Flood Light': 0, 'GAS': 0, 'FIFA': 0, 'pipe': 0, 'pipes': 0, 'covid': 0}",Pre-Monsoon,,False,False,Repair and Restoration,{'restoration': 2}
2020_DoWR_16930_1,GOALPARA/2019-20/SDRF/II,Immediate measures for restoration of B/dyke from Kharmuza to Nichinpur at Solmari area under SDRF for 2019-20.,Immediate measures for restoration of B/dyke from Kharmuza to Nichinpur at Solmari area under SDRF for 2019-20.,Works,Open Tender,Works,Civil Works,No,No,NA ,03-Mar-2020 06:00 PM,NA ,180.0,No ,No,Online,13-Mar-2020 02:00 PM,Department of Water Resources||Chief Engineer - DoWR,GOALPARA,783101.0,3.0,"2,49,99,762",Akhil Kumar Jain,22245945.59,Rejected-AOC,03-Jun-2020,AOC,Department of Water Resources||Chief Engineer - DoWR,True,"{'Flood': 0, 'Embankment': 0, 'embkt': 0, 'Relief': 0, 'Erosion': 0, 'SDRF': 3, 'Inundation': 0, 'Hydrology': 0, 'Silt': 0, 'Siltation': 0, 'Bund': 0, 'Trench': 0, 'Breach': 0, 'Culvert': 0, 'Sluice': 0, 'Dyke': 2, 'Storm water drain': 0, 'Emergency': 0, 'Immediate': 2, 'IM': 0, 'AE': 0, 'A E': 0, 'AAPDA MITRA': 0}","{'Floodlight': 0, 'Flood Light': 0, 'GAS': 0, 'FIFA': 0, 'pipe': 0, 'pipes': 0, 'covid': 0}",Pre-Monsoon,SDRF,False,True,Repair and Restoration,{'restoration': 2}
2019_DoWR_15210_3,KARIMGANJ/2019-20/SOPD-FDR/II,"at Kabaribond village along with improvement of Longai ,Retender-4",Reconstruction of Breached embankment at Kabaribond village along with improvement of Longai L/B embankment from Ch. 0 to 21.95 KM including anti-erosion measures at different reaches.,Works,Open Tender,Works,Civil Works,No,No,NA ,28-Jan-2020 06:00 PM,NA ,180.0,No ,No,Online,07-Feb-2020 02:05 PM,Department of Water Resources||Chief Engineer - DoWR,Karimganj,788710.0,3.0,"3,15,51,768",SWADESH RANJAN PAUL AND JAHAR PAUL JV,31551767.73,Accepted-AOC,02-Jun-2020,AOC,Department of Water Resources||Chief Engineer - DoWR,True,"{'Flood': 0, 'Embankment': 2, 'embkt': 0, 'Relief': 0, 'Erosion': 1, 'SDRF': 0, 'Inundation': 0, 'Hydrology': 0, 'Silt': 0, 'Siltation': 0, 'Bund': 0, 'Trench': 0, 'Breach': 0, 'Culvert': 0, 'Sluice': 0, 'Dyke': 0, 'Storm water drain': 0, 'Emergency': 0, 'Immediate': 0, 'IM': 0, 'AE': 0, 'A E': 0, 'AAPDA MITRA': 0}","{'Floodlight': 0, 'Flood Light': 0, 'GAS': 0, 'FIFA': 0, 'pipe': 0, 'pipes': 0, 'covid': 0}",Pre-Monsoon,SOPD,True,True,Repair and Restoration,"{'improvement': 2, 'reconstruction': 1}"
2020_DoWR_16558_1,NAGAON/2019-20/SDRF/II,Immediate measures to restoration of damage sectionof Brahmaputra dyke from Silghat to Dhing at Kathalguri area under SDRF for 2019-20,Immediate measures to restoration of damage sectionof Brahmaputra dyke from Silghat to Dhing at Kathalguri area under SDRF for 2019-20,Works,Open Tender,Works,Civil Works,No,No,NA ,15-Feb-2020 06:00 PM,NA ,180.0,No ,No,Online,26-Feb-2020 02:00 PM,Department of Water Resources||Chief Engineer - DoWR,NAGAON,782001.0,3.0,"2,99,82,104",DURGA PRASAD UPADHYA,26231403.4,Not Admitted-PreQual/Technical,02-Jun-2020,AOC,Department of Water Resources||Chief Engineer - DoWR,True,"{'Flood': 0, 'Embankment': 0, 'embkt': 0, 'Relief': 0, 'Erosion': 0, 'SDRF': 3, 'Inundation': 0, 'Hydrology': 0, 'Silt': 0, 'Siltation': 0, 'Bund': 0, 'Trench': 0, 'Breach': 0, 'Culvert': 0, 'Sluice': 0, 'Dyke': 2, 'Storm water drain': 0, 'Emergency': 0, 'Immediate': 2, 'IM': 0, 'AE': 0, 'A E': 0, 'AAPDA MITRA': 0}","{'Floodlight': 0, 'Flood Light': 0, 'GAS': 0, 'FIFA': 0, 'pipe': 0, 'pipes': 0, 'covid': 0}",Pre-Monsoon,SDRF,False,True,Repair and Restoration,{'restoration': 2}
2020_DoWR_16393_3,TEZPUR/2019-20/SOPD-FDR/I,Protection of Gangmouthan and its adjoining areas from the erosion of river Borgang on left bank Phase II RETENDER,Protection of Gangmouthan and its adjoining areas from the erosion of river Borgang on left bank Phase II,Works,Open Tender,Works,Civil Works,No,No,NA ,19-Mar-2020 06:00 PM,NA ,180.0,No ,No,Online,23-Apr-2020 02:00 PM,Department of Water Resources||Chief Engineer - DoWR,TEZPUR,784001.0,3.0,"3,37,58,759",pulin borgohain,33339054.08,Rejected-AOC,10-Jun-2020,AOC,Department of Water Resources||Chief Engineer - DoWR,True,"{'Flood': 0, 'Embankment': 0, 'embkt': 0, 'Relief': 0, 'Erosion': 2, 'SDRF': 0, 'Inundation': 0, 'Hydrology': 0, 'Silt': 0, 'Siltation': 0, 'Bund': 0, 'Trench': 0, 'Breach': 0, 'Culvert': 0, 'Sluice': 0, 'Dyke': 0, 'Storm water drain': 0, 'Emergency': 0, 'Immediate': 0, 'IM': 0, 'AE': 0, 'A E': 0, 'AAPDA MITRA': 0}","{'Floodlight': 0, 'Flood Light': 0, 'GAS': 0, 'FIFA': 0, 'pipe': 0, 'pipes': 0, 'covid': 0}",Pre-Monsoon,SOPD,True,False,Others,
2020_DoWR_16722_1,GHY.EAST/2019-20/SDRF/IV,Khanajan and masonary wall for the year 2019-20,I/M for restoration of damaged section of bank of river Khanajan and masonary wall for the year 2019-20 under SDRF.,Works,Open Tender,Works,Civil Works,No,No,NA ,21-Feb-2020 06:00 PM,NA ,180.0,No ,No,Online,02-Mar-2020 02:05 PM,Department of Water Resources||Chief Engineer - DoWR,Guwahati,781012.0,3.0,"2,49,99,333",Ashok Kumar Agarwalla,22218776.55,Rejected-AOC,12-Jun-2020,AOC,Department of Water Resources||Chief Engineer - DoWR,True,"{'Flood': 0, 'Embankment': 0, 'embkt': 0, 'Relief': 0, 'Erosion': 0, 'SDRF': 2, 'Inundation': 0, 'Hydrology': 0, 'Silt': 0, 'Siltation': 0, 'Bund': 0, 'Trench': 0, 'Breach': 0, 'Culvert': 0, 'Sluice': 0, 'Dyke': 0, 'Storm water drain': 0, 'Emergency': 0, 'Immediate': 0, 'IM': 0, 'AE': 0, 'A E': 0, 'AAPDA MITRA': 0}","{'Floodlight': 0, 'Flood Light': 0, 'GAS': 0, 'FIFA': 0, 'pipe': 0, 'pipes': 0, 'covid': 0}",Pre-Monsoon,SDRF,False,False,Repair and Restoration,{'restoration': 1}
2020_DoWR_16262_2,DHUBRI/2019-20/SOPD-FDR/IV,Restoration and recoupment of breached like damages of road cum bund by flooding of river Brahmaputra at Nichinpur area under SOPD (FDR). RETENDER,Restoration and recoupment of breached like damages of road cum bund by flooding of river Brahmaputra at Nichinpur area under SOPD (FDR).,Works,Open Tender,Works,Civil Works,No,No,NA ,13-May-2020 06:00 PM,NA ,180.0,No ,No,Online,21-May-2020 02:00 PM,Department of Water Resources||Chief Engineer - DoWR,DHUBRI,783301.0,3.0,"6,48,79,852",SURAJIT ROY MANIRAJ BRAHMA-JV,63580973.84,Accepted-AOC,10-Jun-2020,AOC,Department of Water Resources||Chief Engineer - DoWR,True,"{'Flood': 0, 'Embankment': 0, 'embkt': 0, 'Relief': 0, 'Erosion': 0, 'SDRF': 0, 'Inundation': 0, 'Hydrology': 0, 'Silt': 0, 'Siltation': 0, 'Bund': 2, 'Trench': 0, 'Breach': 0, 'Culvert': 0, 'Sluice': 0, 'Dyke': 0, 'Storm water drain': 0, 'Emergency': 0, 'Immediate': 0, 'IM': 0, 'AE': 0, 'A E': 0, 'AAPDA MITRA': 0}","{'Floodlight': 0, 'Flood Light': 0, 'GAS': 0, 'FIFA': 0, 'pipe': 0, 'pipes': 0, 'covid': 0}",Pre-Monsoon,SOPD,False,True,Repair and Restoration,"{'restoration': 2, 'recoupment': 2}"
2020_DoWR_16418_1,UAID/2019-20/SOPD-FDR/I,RESTORATION OF NR DYKE PH II AT NEOLGAON AREA FROM FLOOD DEVASTATION OF RIVER BRAHMAPUTRA UNDER SOPD-FDR FOR THE YEAR 2019-20,RESTORATION OF NR DYKE PH II AT NEOLGAON AREA FROM FLOOD DEVASTATION OF RIVER BRAHMAPUTRA UNDER SOPD-FDR FOR THE YEAR 2019-20,Works,Open Tender,Works,Civil Works,No,No,NA ,11-Feb-2020 06:00 PM,NA ,180.0,No ,No,Online,04-Mar-2020 02:00 PM,Department of Water Resources||Chief Engineer - DoWR,JORHAT,785001.0,3.0,"7,86,68,995",SOMESWAR DAS,74723367.06,Rejected-AOC,10-Jun-2020,AOC,Department of Water Resources||Chief Engineer - DoWR,True,"{'Flood': 2, 'Embankment': 0, 'embkt': 0, 'Relief': 0, 'Erosion': 0, 'SDRF': 0, 'Inundation': 0, 'Hydrology': 0, 'Silt': 0, 'Siltation': 0, 'Bund': 0, 'Trench': 0, 'Breach': 0, 'Culvert': 0, 'Sluice': 0, 'Dyke': 2, 'Storm water drain': 0, 'Emergency': 0, 'Immediate': 0, 'IM': 0, 'AE': 0, 'A E': 0, 'AAPDA MITRA': 0}","{'Floodlight': 0, 'Flood Light': 0, 'GAS': 0, 'FIFA': 0, 'pipe': 0, 'pipes': 0, 'covid': 0}",Pre-Monsoon,SOPD,False,True,Repair and Restoration,{'restoration': 2}
