Tender ID,tender_externalreference,tender_title,Work Description,Tender Category,Tender Type,Form of contract,Product Category,Is Multi Currency Allowed For BOQ,Allow Two Stage Bidding,Independent External Monitor/Remarks,Published Date,Pre Bid Meeting Date,Bid Validity(Days),Should Allow NDA Tender,Allow Preferential Bidder,Payment Mode,Bid Opening Date,Organisation Chain,location,Pincode,No of Bids Received,Tender Value in ₹,Bidder Name,Awarded Value,Status,Contract Date :,Tender Stage,Department,is_flood_tender,positive_keywords_dict,negative_keywords_dict,Season,Scheme,Erosion,Roads_Bridges_Embkt,Response Type,Flood Response - Subhead
2020_ASDMA_19144_1,ASDMA.32/2019/Part/51,Tender Document on Supply of Life Buoys to ASDMA for providing to flood prone districts and Revenue Circles of Assam,Tender Document on Supply of Life Buoys to ASDMA for providing to flood prone districts and Revenue Circles of Assam,Goods,Open Tender,Supply,Supply of Materials,No,No,NA ,03-Nov-2020 10:00 AM,12-Nov-2020 11:00 AM ,365.0,No ,No,Online,03-Dec-2020 05:00 PM,Assam State Disaster Management Authority||Head Offcie - ASDMA,As per Tender Document,781006.0,3.0,,Aerial Services Pvt Ltd,2331000.0,Not Admitted-Fee,31-Mar-2021,AOC,Assam State Disaster Management Authority||Head Offcie - ASDMA,True,"{'Flood': 2, 'Embankment': 0, 'embkt': 0, 'Relief': 0, 'Erosion': 0, 'SDRF': 0, 'Inundation': 0, 'Hydrology': 0, 'Silt': 0, 'Siltation': 0, 'Bund': 0, 'Trench': 0, 'Breach': 0, 'Culvert': 0, 'Sluice': 0, 'Dyke': 0, 'Storm water drain': 0, 'Emergency': 0, 'Immediate': 0, 'IM': 0, 'AE': 0, 'A E': 0, 'AAPDA MITRA': 0}","{'Floodlight': 0, 'Flood Light': 0, 'GAS': 0, 'FIFA': 0, 'pipe': 0, 'pipes': 0, 'covid': 0}",Post-Monsoon,,False,False,Preparedness Measures,{'life buoys': 2}
2020_PWD_19361_1,NKTRD/SOPD/Tech./NIT/01/2380,"Construction of (1) NH-31 Dipteswari Temple to Garaka community Hall via Garaka Namghar (L_0.726 Km ), (2) Stone Masonary Retaining wall on NH-31 to Baralia River Embankment Road, (3) Road from Dwarkuchi Chowk to Baralipar (Astami ) samsan khala (L_0","Construction of (1) NH-31 Dipteswari Temple to Garaka community Hall via Garaka Namghar (L_0.726 Km ), (2) Stone Masonary Retaining wall on NH-31 to Baralia River Embankment Road, (3) Road from Dwarkuchi Chowk to Baralipar (Astami ) samsan khala (L_0",Works,Open Tender,Item Rate,Civil Works – Roads,No,No,NA ,20-Nov-2020 11:00 AM,NA ,90.0,No ,No,Offline,30-Nov-2020 01:00 PM,Public Works Roads Department,Rangia,781354.0,2.0,,JAYANTA KUMAR DAS,10034100.0,Accepted-AOC,11-Jan-2021,AOC,Public Works Roads Department,True,"{'Flood': 0, 'Embankment': 2, 'embkt': 0, 'Relief': 0, 'Erosion': 0, 'SDRF': 0, 'Inundation': 0, 'Hydrology': 0, 'Silt': 0, 'Siltation': 0, 'Bund': 0, 'Trench': 0, 'Breach': 0, 'Culvert': 0, 'Sluice': 0, 'Dyke': 0, 'Storm water drain': 0, 'Emergency': 0, 'Immediate': 0, 'IM': 0, 'AE': 0, 'A E': 0, 'AAPDA MITRA': 0}","{'Floodlight': 0, 'Flood Light': 0, 'GAS': 0, 'FIFA': 0, 'pipe': 0, 'pipes': 0, 'covid': 0}",Post-Monsoon,SOPD,False,True,Others,
2020_PWD_18228_1,No. GRC/NIT/510/2018-19/ 1831 Dated.27.07.2020,"KAM/GRC/SOPD(G)/ 2020-21/03.Improvement/ Construction of Road from Boromboi Embankment to Gallipar Tiniali under Jalukbari and Hajo Territorial Road Division under SOPD-G for the year 2020-21, Hajo LAC","Improvement/ Construction of Road from Boromboi Embankment to Gallipar Tiniali under Jalukbari and Hajo Territorial Road Division under SOPD-G for the year 2020-21, Hajo LAC",Works,Open Tender,Item Rate,Civil Works – Roads,No,No,NA ,31-Jul-2020 11:00 AM,NA ,90.0,No ,No,Offline,07-Aug-2020 01:00 PM,Public Works Roads Department,Hajo,781102.0,2.0,"63,99,804",M/S BORLUIT CONSTRUCTION AND CO,5759824.0,Rejected-Technical,29-Sep-2020,AOC,Public Works Roads Department,True,"{'Flood': 0, 'Embankment': 2, 'embkt': 0, 'Relief': 0, 'Erosion': 0, 'SDRF': 0, 'Inundation': 0, 'Hydrology': 0, 'Silt': 0, 'Siltation': 0, 'Bund': 0, 'Trench': 0, 'Breach': 0, 'Culvert': 0, 'Sluice': 0, 'Dyke': 0, 'Storm water drain': 0, 'Emergency': 0, 'Immediate': 0, 'IM': 0, 'AE': 0, 'A E': 0, 'AAPDA MITRA': 0}","{'Floodlight': 0, 'Flood Light': 0, 'GAS': 0, 'FIFA': 0, 'pipe': 0, 'pipes': 0, 'covid': 0}",Monsoon,SOPD,False,True,Repair and Restoration,{'improvement': 2}
2020_BTCWR_18161_1,NIT Addl.CE/KZ/WR/e-T/AC/101/490 dt.15.07.2020,AE Measures to protect village Singimari from the erosion of river Garuphella on RB under,AE Measures to protect village Singimari from the erosion of river Garuphella on RB under NABARD RIDF-XXV,Works,Open Tender,Item Rate,Civil Works,No,No,NA ,17-Jul-2020 10:00 AM,NA ,180.0,No ,No,Online,06-Aug-2020 04:00 PM,Bodoland Territorial Council-WRD,At Singimari village,783372.0,2.0,"1,27,71,228",KATIRAM NARZARY,12710045.7,Rejected-AOC,09-Oct-2020,AOC,Bodoland Territorial Council-WRD,True,"{'Flood': 0, 'Embankment': 0, 'embkt': 0, 'Relief': 0, 'Erosion': 2, 'SDRF': 0, 'Inundation': 0, 'Hydrology': 0, 'Silt': 0, 'Siltation': 0, 'Bund': 0, 'Trench': 0, 'Breach': 0, 'Culvert': 0, 'Sluice': 0, 'Dyke': 0, 'Storm water drain': 0, 'Emergency': 0, 'Immediate': 0, 'IM': 0, 'AE': 2, 'A E': 0, 'AAPDA MITRA': 0}","{'Floodlight': 0, 'Flood Light': 0, 'GAS': 0, 'FIFA': 0, 'pipe': 0, 'pipes': 0, 'covid': 0}",Monsoon,RIDF,True,False,Others,
2020_PWD_19161_1,No. GRC/NIT/510./2018-19/2922 Dated.29/10/2020,KAM/GRC/SOPD(G)/ 2020-21/36,1.Karara Gaon Panchayat Chwk to Nakuchi Chwk .2.Karara Bathan Rd to Sutarkuchi via Bhakat Suba.3.Rd from 2nd Km of Karara Pingaleswar Rd to Pingaleswar Bar Pukhuri.4.H.P. Culvert at Arjuntal Chowk to Bakultal Mandir rd,Works,Open Tender,Item Rate,Civil Works – Roads,No,No,NA ,03-Nov-2020 02:00 PM,NA ,90.0,No ,No,Offline,10-Nov-2020 01:00 PM,Public Works Roads Department,Kamalpur,781380.0,2.0,,Sri Dilip Kumar Deka,12168000.0,Rejected-AOC,05-Jan-2021,AOC,Public Works Roads Department,True,"{'Flood': 0, 'Embankment': 0, 'embkt': 0, 'Relief': 0, 'Erosion': 0, 'SDRF': 0, 'Inundation': 0, 'Hydrology': 0, 'Silt': 0, 'Siltation': 0, 'Bund': 0, 'Trench': 0, 'Breach': 0, 'Culvert': 1, 'Sluice': 0, 'Dyke': 0, 'Storm water drain': 0, 'Emergency': 0, 'Immediate': 0, 'IM': 0, 'AE': 0, 'A E': 0, 'AAPDA MITRA': 0}","{'Floodlight': 0, 'Flood Light': 0, 'GAS': 0, 'FIFA': 0, 'pipe': 0, 'pipes': 0, 'covid': 0}",Post-Monsoon,SOPD,False,True,Others,
2020_PWD_19362_1,NKTRD/SOPD/Tech./NIT/01/2380,"Construction of (1) Road from NH-31 to Dipteswari Temple road to Chepti Bihdia road via 26 No. Nakul L.P School (L_1.180 Km ), (2) SPT Br. No. 1/1 on 3 No. Kekohati Bathou Mandir to Nona river embankment over Ghoga Jaan to Baralia River under SOPD","Construction of (1) Road from NH-31 to Dipteswari Temple road to Chepti Bihdia road via 26 No. Nakul L.P School (L_1.180 Km ), (2) SPT Br. No. 1/1 on 3 No. Kekohati Bathou Mandir to Nona river embankment over Ghoga Jaan to Baralia River under SOPD",Works,Open Tender,Item Rate,Civil Works – Roads,No,No,NA ,20-Nov-2020 11:00 AM,NA ,90.0,No ,No,Offline,30-Nov-2020 01:00 PM,Public Works Roads Department,Rangia,781354.0,2.0,,Jayanta Sarma,11294100.0,Accepted-AOC,11-Jan-2021,AOC,Public Works Roads Department,True,"{'Flood': 0, 'Embankment': 2, 'embkt': 0, 'Relief': 0, 'Erosion': 0, 'SDRF': 0, 'Inundation': 0, 'Hydrology': 0, 'Silt': 0, 'Siltation': 0, 'Bund': 0, 'Trench': 0, 'Breach': 0, 'Culvert': 0, 'Sluice': 0, 'Dyke': 0, 'Storm water drain': 0, 'Emergency': 0, 'Immediate': 0, 'IM': 0, 'AE': 0, 'A E': 0, 'AAPDA MITRA': 0}","{'Floodlight': 0, 'Flood Light': 0, 'GAS': 0, 'FIFA': 0, 'pipe': 0, 'pipes': 0, 'covid': 0}",Post-Monsoon,SOPD,False,True,Others,
2021_PWBNH_20420_1,BRD/Rd/KXJ(SOPD)/2020-21/06,Construction of paved shoulder with Interlocking Concrete Paver Block (ICBP) at built-up areas in stretches including construction/reconstruction of RCC covered drain in stretches and immediate Repair of Damaged stretches including cutting of Katcha,Construction of paved shoulder with Interlocking Concrete Paver Block (ICBP) at built-up areas in stretches including construction/reconstruction of RCC covered drain in stretches and immediate Repair of Damaged stretches including cutting of Katcha,Works,Open Tender,Item Rate,Civil Works – Highways,No,No,NA ,28-Jan-2021 06:00 PM,05-Feb-2021 12:00 PM ,180.0,No ,No,Offline,11-Feb-2021 02:00 PM,Public Works Building and NH Department||Chief Engineer-Building - PWBNH||SE-Planning - PWBNH,Karimganj,788710.0,2.0,"14,50,39,000",BINNI CONSTRUCTION,145026209.0,Accepted-AOC,03-Apr-2021,AOC,Public Works Building and NH Department||Chief Engineer-Building - PWBNH||SE-Planning - PWBNH,True,"{'Flood': 0, 'Embankment': 0, 'embkt': 0, 'Relief': 0, 'Erosion': 0, 'SDRF': 0, 'Inundation': 0, 'Hydrology': 0, 'Silt': 0, 'Siltation': 0, 'Bund': 0, 'Trench': 0, 'Breach': 0, 'Culvert': 0, 'Sluice': 0, 'Dyke': 0, 'Storm water drain': 0, 'Emergency': 0, 'Immediate': 2, 'IM': 0, 'AE': 0, 'A E': 0, 'AAPDA MITRA': 0}","{'Floodlight': 0, 'Flood Light': 0, 'GAS': 0, 'FIFA': 0, 'pipe': 0, 'pipes': 0, 'covid': 0}",Pre-Monsoon,SOPD,False,True,Repair and Restoration,"{'repair': 2, 'reconstruction': 2}"
2020_PWD_18240_1,No. GRC/NIT/510/2018-19/ 1831 Dated.27.07.2020,KAM/GRC/SOPD(G)/ 2020-21/11.Construction of Road from Garamsung Vithera Chowk to Borolia Embankment at Purankhumdum via Bangshigopal Nam Ghar (L 1830.00M) under SOPD.G for the year 2020-21 in HajoLAC under Jalukbari and Hajo Territroial Road Division,Construction of Road from Garamsung Vithera Chowk to Borolia Embankment at Purankhumdum via Bangshigopal Nam Ghar (Length 1830.00M) under SOPD-G for the year 2020-21 in Hajo LAC under Jalukbari and Hajo Territroial Road Division,Works,Open Tender,Item Rate,Civil Works – Roads,No,No,NA ,31-Jul-2020 11:00 AM,NA ,90.0,No ,No,Offline,07-Aug-2020 01:00 PM,Public Works Roads Department,Hajo,781102.0,2.0,"1,35,99,243",Safikur Rahman,12239319.0,Rejected-AOC,05-Oct-2020,AOC,Public Works Roads Department,True,"{'Flood': 0, 'Embankment': 2, 'embkt': 0, 'Relief': 0, 'Erosion': 0, 'SDRF': 0, 'Inundation': 0, 'Hydrology': 0, 'Silt': 0, 'Siltation': 0, 'Bund': 0, 'Trench': 0, 'Breach': 0, 'Culvert': 0, 'Sluice': 0, 'Dyke': 0, 'Storm water drain': 0, 'Emergency': 0, 'Immediate': 0, 'IM': 0, 'AE': 0, 'A E': 0, 'AAPDA MITRA': 0}","{'Floodlight': 0, 'Flood Light': 0, 'GAS': 0, 'FIFA': 0, 'pipe': 0, 'pipes': 0, 'covid': 0}",Monsoon,SOPD,False,True,Others,
