2024_PWD_89602_1,No.PWC-WA-II- 2225-324 dated 21.06.2024,M/T and C.D works on Sarol Bazar i/c  drain (SH Construction of PCC road side  drain  in Km. 0/450 to 0/745),M/T and C.D works on Sarol Bazar i/c  drain (SH Construction of PCC road side  drain  in Km. 0/450 to 0/745),Works,Open Tender,Item Rate,Civil Works - Roads,No,No,,25-Jun-2024 10:00 AM,,75.0,No,No,Online,03-Jul-2024 11:30 AM,PWD,Chamba,176310.0,2.0,"85,22,136",,,,,PWD,True,"{'flood': 0, 'landslide': 0, 'flash flood': 0, 'heavy rain': 0, 'embankment': 0, 'Drainage': 0, ' River': 0, 'Khad': 0, 'Silt': 0, 'Bridge': 0, 'Nallah': 0, 'Nalla': 0, 'Road': 2, 'Culvert': 0, 'Lake': 0, 'Relief': 0, 'Erosion': 0, 'Sluice': 0, 'Dyke': 0, 'Storm water drain': 0, 'Emergency': 0, 'Immediate': 0, 'dam': 0, 'irrigation': 0, 'rain': 0, 'pond': 0, 'recharge': 0, 'bank': 0}","{'Flood Lights': 0, 'pipe': 0, 'pipes': 0, 'supply': 0, 'beautification': 0, 'installation': 0}",Monsoon,,False,True,Repair and Restoration,"{'construction': 2, 'drain': 4}"
2024_PWD_90157_5,TA-1341-1441dated-28-6-2024,Construction of PBAT road km 19/0 to 34/350 (S.H-Providing and laying Interlocking Tiles in km 26/680 to  26/900  )Under MNP,Construction of PBAT road km 19/0 to 34/350 (S.H-Providing and laying Interlocking Tiles in km 26/680 to  26/900  )Under MNP,Works,Open Tender,Percentage,Civil Works - Roads,No,No,,05-Jul-2024 05:00 PM,,75.0,No,No,Online,16-Jul-2024 11:00 AM,PWD,Shillai,173027.0,2.0,"10,05,873",,,,,PWD,True,"{'flood': 0, 'landslide': 0, 'flash flood': 0, 'heavy rain': 0, 'embankment': 0, 'Drainage': 0, ' River': 0, 'Khad': 0, 'Silt': 0, 'Bridge': 0, 'Nallah': 0, 'Nalla': 0, 'Road': 2, 'Culvert': 0, 'Lake': 0, 'Relief': 0, 'Erosion': 0, 'Sluice': 0, 'Dyke': 0, 'Storm water drain': 0, 'Emergency': 0, 'Immediate': 0, 'dam': 0, 'irrigation': 0, 'rain': 0, 'pond': 0, 'recharge': 0, 'bank': 0}","{'Flood Lights': 0, 'pipe': 0, 'pipes': 0, 'supply': 0, 'beautification': 0, 'installation': 0}",Monsoon,,False,True,Repair and Restoration,{'construction': 2}
2024_PWD_90345_1,CHD_1351-1450_1,C/o Chopal Chowkia Jhiknipul road km. 0/0 to 10/0,C/o 8.00 mtr. span RCC slab culvert at R.D. 9/120,Works,Open Tender,Percentage,Civil Works - Roads,No,No,,09-Jul-2024 05:00 PM,,90.0,No,No,Online,16-Jul-2024 11:00 AM,PWD,Chopal,171211.0,2.0,"26,71,453",,,,,PWD,True,"{'flood': 0, 'landslide': 0, 'flash flood': 0, 'heavy rain': 0, 'embankment': 0, 'Drainage': 0, ' River': 0, 'Khad': 0, 'Silt': 0, 'Bridge': 0, 'Nallah': 0, 'Nalla': 0, 'Road': 1, 'Culvert': 1, 'Lake': 0, 'Relief': 0, 'Erosion': 0, 'Sluice': 0, 'Dyke': 0, 'Storm water drain': 0, 'Emergency': 0, 'Immediate': 0, 'dam': 0, 'irrigation': 0, 'rain': 0, 'pond': 0, 'recharge': 0, 'bank': 0}","{'Flood Lights': 0, 'pipe': 0, 'pipes': 0, 'supply': 0, 'beautification': 0, 'installation': 0}",Monsoon,,False,True,Others,
2024_PWD_90666_1,2896-2903 dt. 10.07.2024,RRD on Bassa Kuther Nehra road km 0/00 to 4/00 and Bassa Mahamata road 0/00 to 2/00 (SH Providing and laying 25mm thick Mixed seal surfacing and repair of pot holes at different RDs),RRD on Bassa Kuther Nehra road km 0/00 to 4/00 and Bassa Mahamata road 0/00 to 2/00 (SH Providing and laying 25mm thick Mixed seal surfacing and repair of pot holes at different RDs),Works,Open Tender,Percentage,Civil Works - Roads,No,No,,18-Jul-2024 10:00 AM,,75.0,No,No,Online,25-Jul-2024 11:30 AM,PWD,Gohar,175029.0,2.0,"8,10,198",,,,,PWD,True,"{'flood': 0, 'landslide': 0, 'flash flood': 0, 'heavy rain': 0, 'embankment': 0, 'Drainage': 0, ' River': 0, 'Khad': 0, 'Silt': 0, 'Bridge': 0, 'Nallah': 0, 'Nalla': 0, 'Road': 4, 'Culvert': 0, 'Lake': 0, 'Relief': 0, 'Erosion': 0, 'Sluice': 0, 'Dyke': 0, 'Storm water drain': 0, 'Emergency': 0, 'Immediate': 0, 'dam': 0, 'irrigation': 0, 'rain': 0, 'pond': 0, 'recharge': 0, 'bank': 0}","{'Flood Lights': 0, 'pipe': 0, 'pipes': 0, 'supply': 0, 'beautification': 0, 'installation': 0}",Monsoon,,False,True,Repair and Restoration,{'repair': 2}
2024_PWD_91028_1,PW-KD-E-Tender/2024-25-1847-51 dated 23-7-2024,M/T on Link road Bareonghat to Bareon in K.M. 0/00 to 1/930,"Maintenance of WBM, P/L Tarring in K.M. 1/00 to 1/930",Works,Open Tender,Percentage,Civil Works - Roads,No,No,,25-Jul-2024 01:15 PM,,60.0,No,No,Online,01-Aug-2024 11:00 AM,PWD,Kotkhai,171202.0,2.0,"20,16,709",,,,,PWD,True,"{'flood': 0, 'landslide': 0, 'flash flood': 0, 'heavy rain': 0, 'embankment': 0, 'Drainage': 0, ' River': 0, 'Khad': 0, 'Silt': 0, 'Bridge': 0, 'Nallah': 0, 'Nalla': 0, 'Road': 1, 'Culvert': 0, 'Lake': 0, 'Relief': 0, 'Erosion': 0, 'Sluice': 0, 'Dyke': 0, 'Storm water drain': 0, 'Emergency': 0, 'Immediate': 0, 'dam': 0, 'irrigation': 0, 'rain': 0, 'pond': 0, 'recharge': 0, 'bank': 0}","{'Flood Lights': 0, 'pipe': 0, 'pipes': 0, 'supply': 0, 'beautification': 0, 'installation': 0}",Monsoon,,False,True,Preparedness Measures,{'maintenance': 1}
2024_PWD_91203_1,EE Salooni Letter No. 2627-76 dated 26.07.2024,Post DLP maintenance of Kuthed to Kandhwara road K.M. 0/0 to 12/100 PMGSY Package No. HP02152,"Initial rectification, periodic renewal and routine maintenance for five years",Works,Open Tender,Percentage,Civil Works,No,No,,30-Jul-2024 09:00 AM,,75.0,No,No,Online,09-Aug-2024 11:30 AM,PWD,Salooni,176320.0,2.0,"2,81,71,147",,,,,PWD,True,"{'flood': 0, 'landslide': 0, 'flash flood': 0, 'heavy rain': 0, 'embankment': 0, 'Drainage': 0, ' River': 0, 'Khad': 0, 'Silt': 0, 'Bridge': 0, 'Nallah': 0, 'Nalla': 0, 'Road': 1, 'Culvert': 0, 'Lake': 0, 'Relief': 0, 'Erosion': 0, 'Sluice': 0, 'Dyke': 0, 'Storm water drain': 0, 'Emergency': 0, 'Immediate': 0, 'dam': 0, 'irrigation': 0, 'rain': 0, 'pond': 0, 'recharge': 0, 'bank': 0}","{'Flood Lights': 0, 'pipe': 0, 'pipes': 0, 'supply': 0, 'beautification': 0, 'installation': 0}",Monsoon,,False,True,Immediate Measures,{'package': 1}
2024_PWD_91240_5,PW-KNR-E-Tender/24-2214-23 dated 23-07-2024,"Slope stabilization and rock fall mitigation works at Km.10/530 to 10/700 along hill side of link road to Village Nesang  (SH- Removal of   loose rock mass, Construction of Gabion walls in benches in sliding  zones and  providing  Erosion mat in sli","Slope stabilization and rock fall mitigation works at Km.10/530 to 10/700 along hill side of link road to Village Nesang  (SH- Removal of   loose rock mass, Construction of Gabion walls in benches in sliding  zones and  providing  Erosion mat in sli",Works,Open Tender,Item Rate,Civil Works - Roads,No,No,,01-Aug-2024 09:00 AM,,45.0,No,No,Online,14-Aug-2024 11:30 AM,PWD,Nesang under Pooh Sub Division,172110.0,2.0,"2,52,52,594",,,,,PWD,True,"{'flood': 0, 'landslide': 0, 'flash flood': 0, 'heavy rain': 0, 'embankment': 0, 'Drainage': 0, ' River': 0, 'Khad': 0, 'Silt': 0, 'Bridge': 0, 'Nallah': 0, 'Nalla': 0, 'Road': 2, 'Culvert': 0, 'Lake': 0, 'Relief': 0, 'Erosion': 2, 'Sluice': 0, 'Dyke': 0, 'Storm water drain': 0, 'Emergency': 0, 'Immediate': 0, 'dam': 0, 'irrigation': 0, 'rain': 0, 'pond': 0, 'recharge': 0, 'bank': 0}","{'Flood Lights': 0, 'pipe': 0, 'pipes': 0, 'supply': 0, 'beautification': 0, 'installation': 0}",Monsoon,,True,True,Repair and Restoration,{'construction': 2}
2024_PWD_91395_1,PW-KD-E-Tender/24-25-1896-1900 dtd 24-7-2024,"Periodical Renewal on Gumma Pujali BAghi Road in K.M. 0/00 to 28/545, Maintenance of WBM in Patches and Bitumen Concrete 25 mm thickness between in K.M. 8/500 to 11/00","Periodical Renewal on Gumma Pujali Baghi Road in K.M. 0/00 to 28/545, Maintenance of WBM in Patches and Bitumen Concrete 25 mm thickness between in K.M. 8/500 to 11/00",Works,Open Tender,Percentage,Civil Works - Roads,No,No,,03-Aug-2024 02:30 PM,,60.0,No,No,Online,12-Aug-2024 11:00 AM,PWD,Kotkhai,171202.0,2.0,"47,07,638",,,,,PWD,True,"{'flood': 0, 'landslide': 0, 'flash flood': 0, 'heavy rain': 0, 'embankment': 0, 'Drainage': 0, ' River': 0, 'Khad': 0, 'Silt': 0, 'Bridge': 0, 'Nallah': 0, 'Nalla': 0, 'Road': 2, 'Culvert': 0, 'Lake': 0, 'Relief': 0, 'Erosion': 0, 'Sluice': 0, 'Dyke': 0, 'Storm water drain': 0, 'Emergency': 0, 'Immediate': 0, 'dam': 0, 'irrigation': 0, 'rain': 0, 'pond': 0, 'recharge': 0, 'bank': 0}","{'Flood Lights': 0, 'pipe': 0, 'pipes': 0, 'supply': 0, 'beautification': 0, 'installation': 0}",Monsoon,,False,True,Preparedness Measures,{'maintenance': 2}
2024_PWD_91463_1,C/O link road Uhal Kakkar main road village Purli to Barota Janglehad Khad,C/O link road Uhal Kakkar main road village Purli to Barota Janglehad Khad km. 0/00 to 1/500,ROFD in RD. 0/150 to 0/345).(Under OTMNP).,Works,Open Tender,Percentage,Civil Works - Roads,No,No,,06-Aug-2024 11:30 AM,,60.0,No,No,Online,13-Aug-2024 10:30 AM,PWD,Tauni Devi,177023.0,2.0,"6,46,693",,,,,PWD,True,"{'flood': 0, 'landslide': 0, 'flash flood': 0, 'heavy rain': 0, 'embankment': 0, 'Drainage': 0, ' River': 0, 'Khad': 2, 'Silt': 0, 'Bridge': 0, 'Nallah': 0, 'Nalla': 0, 'Road': 4, 'Culvert': 0, 'Lake': 0, 'Relief': 0, 'Erosion': 0, 'Sluice': 0, 'Dyke': 0, 'Storm water drain': 0, 'Emergency': 0, 'Immediate': 0, 'dam': 0, 'irrigation': 0, 'rain': 0, 'pond': 0, 'recharge': 0, 'bank': 0}","{'Flood Lights': 0, 'pipe': 0, 'pipes': 0, 'supply': 0, 'beautification': 0, 'installation': 0}",Monsoon,,False,True,Others,
2024_PWD_91790_1,Construction of link road from Nihari Buhli Basti Dhargod Bahli  G.P Karot,Construction of link road from Nihari Buhli Basti Dhargod Bahli  G.P Karot Km. 0/0 to 1/300,"Providing and laying stone soling at RD 0/305 to 0/615, PCC as base course at RD 0/00 to 0/050, Providing and laying  80mm thick interlocking paver zigzag shape at RD 0/0 to 0/050, 0/405 to 0/425 and  0/428 to 0/500",Works,Open Tender,Percentage,Civil Works - Roads,No,No,,14-Aug-2024 10:00 AM,,60.0,No,No,Online,22-Aug-2024 10:30 AM,PWD,Tauni Devi,177023.0,2.0,"9,66,541",,,,,PWD,True,"{'flood': 0, 'landslide': 0, 'flash flood': 0, 'heavy rain': 0, 'embankment': 0, 'Drainage': 0, ' River': 0, 'Khad': 0, 'Silt': 0, 'Bridge': 0, 'Nallah': 0, 'Nalla': 0, 'Road': 2, 'Culvert': 0, 'Lake': 0, 'Relief': 0, 'Erosion': 0, 'Sluice': 0, 'Dyke': 0, 'Storm water drain': 0, 'Emergency': 0, 'Immediate': 0, 'dam': 0, 'irrigation': 0, 'rain': 0, 'pond': 0, 'recharge': 0, 'bank': 0}","{'Flood Lights': 0, 'pipe': 0, 'pipes': 0, 'supply': 0, 'beautification': 0, 'installation': 0}",Monsoon,,False,True,Repair and Restoration,{'construction': 2}
2024_PWD_91942_1,Sohari Chack Sarai Under Bharwain Division,Restoration of rain damages Sohari Chack Sarai road Km 4000 to 11335  SH Reconstruction of Plain Cement Concrete Berms  Rwall between Km various RDs against Telecom Deposit,Restoration of rain damages Sohari Chack Sarai road Km 4000 to 11335  SH Reconstruction of Plain Cement Concrete Berms  Rwall between Km various RDs against Telecom Deposit,Works,Open Tender,Percentage,Civil Works,No,No,,17-Aug-2024 05:00 PM,,75.0,No,No,Online,24-Aug-2024 11:30 AM,PWD,Bharwain,177109.0,2.0,"9,17,246",,,,,PWD,True,"{'flood': 0, 'landslide': 0, 'flash flood': 0, 'heavy rain': 0, 'embankment': 0, 'Drainage': 0, ' River': 0, 'Khad': 0, 'Silt': 0, 'Bridge': 0, 'Nallah': 0, 'Nalla': 0, 'Road': 2, 'Culvert': 0, 'Lake': 0, 'Relief': 0, 'Erosion': 0, 'Sluice': 0, 'Dyke': 0, 'Storm water drain': 0, 'Emergency': 0, 'Immediate': 0, 'dam': 0, 'irrigation': 0, 'rain': 2, 'pond': 0, 'recharge': 0, 'bank': 0}","{'Flood Lights': 0, 'pipe': 0, 'pipes': 0, 'supply': 0, 'beautification': 0, 'installation': 0}",Monsoon,,False,True,Repair and Restoration,"{'restoration': 2, 'reconstruction': 2}"
2024_PWD_91945_1,Nandpur mairi Under bharwain Divn Job-3,Restoration of rain damages Nandpur mairi road Km 000 to 24675 SH Re construction Plain Cement Concrete Berms and Rwalls at various Rds Between Km 12000 to 16000 against telecom Deposit,Restoration of rain damages Nandpur mairi road Km 000 to 24675 SH Re construction Plain Cement Concrete Berms and Rwalls at various Rds Between Km 12000 to 16000 against telecom Deposit,Works,Open Tender,Percentage,Civil Works,No,No,,17-Aug-2024 05:00 PM,,75.0,No,No,Online,24-Aug-2024 11:30 AM,PWD,Bharwain,177109.0,2.0,"15,12,739",,,,,PWD,True,"{'flood': 0, 'landslide': 0, 'flash flood': 0, 'heavy rain': 0, 'embankment': 0, 'Drainage': 0, ' River': 0, 'Khad': 0, 'Silt': 0, 'Bridge': 0, 'Nallah': 0, 'Nalla': 0, 'Road': 2, 'Culvert': 0, 'Lake': 0, 'Relief': 0, 'Erosion': 0, 'Sluice': 0, 'Dyke': 0, 'Storm water drain': 0, 'Emergency': 0, 'Immediate': 0, 'dam': 0, 'irrigation': 0, 'rain': 2, 'pond': 0, 'recharge': 0, 'bank': 0}","{'Flood Lights': 0, 'pipe': 0, 'pipes': 0, 'supply': 0, 'beautification': 0, 'installation': 0}",Monsoon,,False,True,Repair and Restoration,"{'restoration': 2, 'construction': 2}"
2024_PWD_91964_1,EE Salooni Letter No. 3363-3412 dated 13.08.2024,Post DLP maintenance of Chakoli to Lader road K.M. 0/0 to 20/0 under PMGSY Package No. HP02218,"Initial rectification, periodic renewal and routine maintenance for five years",Works,Open Tender,Percentage,Civil Works,No,No,,17-Aug-2024 04:25 PM,,75.0,No,No,Online,27-Aug-2024 11:30 AM,PWD,Salooni,176320.0,2.0,"4,46,72,313",,,,,PWD,True,"{'flood': 0, 'landslide': 0, 'flash flood': 0, 'heavy rain': 0, 'embankment': 0, 'Drainage': 0, ' River': 0, 'Khad': 0, 'Silt': 0, 'Bridge': 0, 'Nallah': 0, 'Nalla': 0, 'Road': 1, 'Culvert': 0, 'Lake': 0, 'Relief': 0, 'Erosion': 0, 'Sluice': 0, 'Dyke': 0, 'Storm water drain': 0, 'Emergency': 0, 'Immediate': 0, 'dam': 0, 'irrigation': 0, 'rain': 0, 'pond': 0, 'recharge': 0, 'bank': 0}","{'Flood Lights': 0, 'pipe': 0, 'pipes': 0, 'supply': 0, 'beautification': 0, 'installation': 0}",Monsoon,,False,True,Immediate Measures,{'package': 1}
2024_PWD_91987_1,TISSA,M/T and C/D on shawa to Bhadkws road km 0/0 to 1/500,M/T and C/D on shawa to Bhadkws road km 0/0 to 1/500,Works,Open Tender,Percentage,Civil Works - Roads,No,No,,19-Aug-2024 09:00 AM,,75.0,No,No,Online,27-Aug-2024 11:30 AM,PWD,TISSA,176316.0,2.0,"67,30,392",,,,,PWD,True,"{'flood': 0, 'landslide': 0, 'flash flood': 0, 'heavy rain': 0, 'embankment': 0, 'Drainage': 0, ' River': 0, 'Khad': 0, 'Silt': 0, 'Bridge': 0, 'Nallah': 0, 'Nalla': 0, 'Road': 2, 'Culvert': 0, 'Lake': 0, 'Relief': 0, 'Erosion': 0, 'Sluice': 0, 'Dyke': 0, 'Storm water drain': 0, 'Emergency': 0, 'Immediate': 0, 'dam': 0, 'irrigation': 0, 'rain': 0, 'pond': 0, 'recharge': 0, 'bank': 0}","{'Flood Lights': 0, 'pipe': 0, 'pipes': 0, 'supply': 0, 'beautification': 0, 'installation': 0}",Monsoon,,False,True,Others,
2024_PWD_92005_1,PW/BGN/CB/T-1/2024-25-1559-90 dated 14.08.2024,Annual Maintenance Plan for the year 2024 25 on Una Barsar Bhota Bhambla Kalkhar Ner Chowk road  SH Providing and laying 30mm thick Bituminous Concrete  in km 22000 to 24000  33000 to 3600,Annual Maintenance Plan for the year 2024 25 on Una Barsar Bhota Bhambla Kalkhar Ner Chowk road  SH Providing and laying 30mm thick Bituminous Concrete  in km 22000 to 24000  33000 to 3600,Works,Open Tender,Percentage,Civil Works - Roads,No,No,,20-Aug-2024 11:00 AM,,45.0,No,No,Online,28-Aug-2024 11:00 AM,PWD,Bangana,174307.0,2.0,"1,25,65,337",,,,,PWD,True,"{'flood': 0, 'landslide': 0, 'flash flood': 0, 'heavy rain': 0, 'embankment': 0, 'Drainage': 0, ' River': 0, 'Khad': 0, 'Silt': 0, 'Bridge': 0, 'Nallah': 0, 'Nalla': 0, 'Road': 2, 'Culvert': 0, 'Lake': 0, 'Relief': 0, 'Erosion': 0, 'Sluice': 0, 'Dyke': 0, 'Storm water drain': 0, 'Emergency': 0, 'Immediate': 0, 'dam': 0, 'irrigation': 0, 'rain': 0, 'pond': 0, 'recharge': 0, 'bank': 0}","{'Flood Lights': 0, 'pipe': 0, 'pipes': 0, 'supply': 0, 'beautification': 0, 'installation': 0}",Monsoon,,False,True,Preparedness Measures,"{'maintenance': 2, 'annual maintenance': 2}"
2024_PWD_92006_1,PW/BGN/CB/T-1/2024-25-1559-90 dated 14.08.2024,Annual Maintenance Plan for  the year 2024 25 on Link road from Una Dhamandri Road to Vishna Nagar km 0000 to 2000  Mansoh to Kudu km. 0000 to 4000  Ambehra Dheeraj to Harot road km 4000 to 6000 and L R Una to Village Dangoli km 0000 to 1560 SH Provi,Annual Maintenance Plan for  the year 2024 25 on Link road from Una Dhamandri Road to Vishna Nagar km 0000 to 2000  Mansoh to Kudu km. 0000 to 4000  Ambehra Dheeraj to Harot road km 4000 to 6000 and L R Una to Village Dangoli km 0000 to 1560 SH Provi,Works,Open Tender,Percentage,Civil Works - Roads,No,No,,20-Aug-2024 11:00 AM,,45.0,No,No,Online,28-Aug-2024 11:00 AM,PWD,Bangana,174307.0,2.0,"1,09,81,734",,,,,PWD,True,"{'flood': 0, 'landslide': 0, 'flash flood': 0, 'heavy rain': 0, 'embankment': 0, 'Drainage': 0, ' River': 0, 'Khad': 0, 'Silt': 0, 'Bridge': 0, 'Nallah': 0, 'Nalla': 0, 'Road': 6, 'Culvert': 0, 'Lake': 0, 'Relief': 0, 'Erosion': 0, 'Sluice': 0, 'Dyke': 0, 'Storm water drain': 0, 'Emergency': 0, 'Immediate': 0, 'dam': 0, 'irrigation': 0, 'rain': 0, 'pond': 0, 'recharge': 0, 'bank': 0}","{'Flood Lights': 0, 'pipe': 0, 'pipes': 0, 'supply': 0, 'beautification': 0, 'installation': 0}",Monsoon,,False,True,Preparedness Measures,"{'maintenance': 2, 'annual maintenance': 2}"
2024_PWD_92119_1,PWD--Tender/2024-25-2279-2329 Dt 13.08.24,C/O Link road to village Bhalogi k.m  0 0 to 1 200,SH Formation cutting km 0 0 to 1 200 and wire crate for Dumping site,Works,Open Tender,Percentage,Civil Works,No,No,,23-Aug-2024 05:00 PM,,75.0,No,No,Online,02-Sep-2024 11:30 AM,PWD,Dalhousie,176304.0,2.0,"26,62,535",,,,,PWD,True,"{'flood': 0, 'landslide': 0, 'flash flood': 0, 'heavy rain': 0, 'embankment': 0, 'Drainage': 0, ' River': 0, 'Khad': 0, 'Silt': 0, 'Bridge': 0, 'Nallah': 0, 'Nalla': 0, 'Road': 1, 'Culvert': 0, 'Lake': 0, 'Relief': 0, 'Erosion': 0, 'Sluice': 0, 'Dyke': 0, 'Storm water drain': 0, 'Emergency': 0, 'Immediate': 0, 'dam': 0, 'irrigation': 0, 'rain': 0, 'pond': 0, 'recharge': 0, 'bank': 0}","{'Flood Lights': 0, 'pipe': 0, 'pipes': 0, 'supply': 0, 'beautification': 0, 'installation': 0}",Monsoon,,False,True,Others,
2024_PWD_92313_1,PMGSY road Baruhi Dumkhar Under Bharwain Divn,Periodical  Renewal  Post DLP Maintenance  of PMGSY road Baruhi Dumkhar Km 000 to 27270 in Distt Una HP,SH Initial Rectification  Periodical Renewal from Km 000 to 27270  and  Five year Routine Maintenance after Periodical Renewal PMGSY Financial Incentive Package No HP12114,Works,Open Tender,Percentage,Civil Works,No,No,,28-Aug-2024 05:00 PM,,75.0,No,No,Online,09-Sep-2024 11:00 AM,PWD,Bharwain,177109.0,2.0,"6,34,33,552",,,,,PWD,True,"{'flood': 0, 'landslide': 0, 'flash flood': 0, 'heavy rain': 0, 'embankment': 0, 'Drainage': 0, ' River': 0, 'Khad': 0, 'Silt': 0, 'Bridge': 0, 'Nallah': 0, 'Nalla': 0, 'Road': 2, 'Culvert': 0, 'Lake': 0, 'Relief': 0, 'Erosion': 0, 'Sluice': 0, 'Dyke': 0, 'Storm water drain': 0, 'Emergency': 0, 'Immediate': 0, 'dam': 0, 'irrigation': 0, 'rain': 0, 'pond': 0, 'recharge': 0, 'bank': 0}","{'Flood Lights': 0, 'pipe': 0, 'pipes': 0, 'supply': 0, 'beautification': 0, 'installation': 0}",Monsoon,,False,True,Immediate Measures,{'package': 1}
2024_PWD_92446_2,SD-II-7785-91dated27-08-2024,Annual Surface and Maintanance on various roads under Division No. III at HP Sectt. Sub Division. (Sub Head - P L renewal coat with bituminous concrete at Approach road from Cart road to Majitha House RD 0 0 to 0 270. and Balance work of Approach roa,"Annual Surface and Maintanance on various
roads under Division No. III at HP Sectt. Sub Division. (Sub Head -
P L renewal coat with bituminous concrete at",Works,Open Tender,Percentage,Civil Works - Buildings,No,No,,02-Sep-2024 09:00 AM,,75.0,No,No,Online,13-Sep-2024 10:00 AM,PWD,Shimla,171001.0,2.0,"17,32,072",,,,,PWD,True,"{'flood': 0, 'landslide': 0, 'flash flood': 0, 'heavy rain': 0, 'embankment': 0, 'Drainage': 0, ' River': 0, 'Khad': 0, 'Silt': 0, 'Bridge': 0, 'Nallah': 0, 'Nalla': 0, 'Road': 2, 'Culvert': 0, 'Lake': 0, 'Relief': 0, 'Erosion': 0, 'Sluice': 0, 'Dyke': 0, 'Storm water drain': 0, 'Emergency': 0, 'Immediate': 0, 'dam': 0, 'irrigation': 0, 'rain': 0, 'pond': 0, 'recharge': 0, 'bank': 0}","{'Flood Lights': 0, 'pipe': 0, 'pipes': 0, 'supply': 0, 'beautification': 0, 'installation': 0}",Monsoon,,False,True,Others,
2024_PWD_92610_1,NIT No. 4642-46 dated 30-08-2024,"A/R and M/O Barotiwala Baddi Sai  Ramshehar  road in km 0/0 to 45/00 (SH P/L Interlocking tiles on berms at RD 3/050 to 3/250, 4/300 to 4/400, 5/500 to 5/700 etc) under NGT","A/R and M/O Barotiwala Baddi Sai  Ramshehar  road in km 0/0 to 45/00 (SH P/L Interlocking tiles on berms at RD 3/050 to 3/250, 4/300 to 4/400, 5/500 to 5/700 etc) under NGT",Works,Open Tender,Percentage,Civil Works,No,No,,04-Sep-2024 04:00 PM,,75.0,No,No,Online,12-Sep-2024 11:00 AM,PWD,Nalagarh,174101.0,2.0,"25,60,917",,,,,PWD,True,"{'flood': 0, 'landslide': 0, 'flash flood': 0, 'heavy rain': 0, 'embankment': 0, 'Drainage': 0, ' River': 0, 'Khad': 0, 'Silt': 0, 'Bridge': 0, 'Nallah': 0, 'Nalla': 0, 'Road': 2, 'Culvert': 0, 'Lake': 0, 'Relief': 0, 'Erosion': 0, 'Sluice': 0, 'Dyke': 0, 'Storm water drain': 0, 'Emergency': 0, 'Immediate': 0, 'dam': 0, 'irrigation': 0, 'rain': 0, 'pond': 0, 'recharge': 0, 'bank': 0}","{'Flood Lights': 0, 'pipe': 0, 'pipes': 0, 'supply': 0, 'beautification': 0, 'installation': 0}",Monsoon,,False,True,Others,
2024_PWD_92745_1,Chil Kawali to Mohalla Kabir Job No. 3,Const of link road  Chil Kawali to Mohalla Kabir Panthian and Harijan Basti in GP Ghangret km 000 to 3800 SH Const of Cement Concrete Pavement between km 0377 to 1390 and Const of  Edge wall between Various RDs  under SCCP,Const of link road  Chil Kawali to Mohalla Kabir Panthian and Harijan Basti in GP Ghangret km 000 to 3800 SH Const of Cement Concrete Pavement between km 0377 to 1390 and Const of  Edge wall between Various RDs  under SCCP,Works,Open Tender,Percentage,Civil Works,No,No,,06-Sep-2024 05:00 PM,,75.0,No,No,Online,13-Sep-2024 11:30 AM,PWD,Bharwain,177109.0,2.0,"21,34,427",,,,,PWD,True,"{'flood': 0, 'landslide': 0, 'flash flood': 0, 'heavy rain': 0, 'embankment': 0, 'Drainage': 0, ' River': 0, 'Khad': 0, 'Silt': 0, 'Bridge': 0, 'Nallah': 0, 'Nalla': 0, 'Road': 2, 'Culvert': 0, 'Lake': 0, 'Relief': 0, 'Erosion': 0, 'Sluice': 0, 'Dyke': 0, 'Storm water drain': 0, 'Emergency': 0, 'Immediate': 0, 'dam': 0, 'irrigation': 0, 'rain': 0, 'pond': 0, 'recharge': 0, 'bank': 0}","{'Flood Lights': 0, 'pipe': 0, 'pipes': 0, 'supply': 0, 'beautification': 0, 'installation': 0}",Monsoon,,False,True,Others,
2024_PWD_92764_1,Kharyali  Job No. 6,Construction of link road to village Kharyali km 000 to 4500 SH Providing Laying  Cement Concrete Pavement at RD 3255 to 3295 and 3570 to 3605 under SCCP,Construction of link road to village Kharyali km 000 to 4500 SH Providing Laying  Cement Concrete Pavement at RD 3255 to 3295 and 3570 to 3605 under SCCP,Works,Open Tender,Percentage,Civil Works,No,No,,06-Sep-2024 05:00 PM,,75.0,No,No,Online,13-Sep-2024 11:30 AM,PWD,Bharwain,177109.0,2.0,"6,84,369",,,,,PWD,True,"{'flood': 0, 'landslide': 0, 'flash flood': 0, 'heavy rain': 0, 'embankment': 0, 'Drainage': 0, ' River': 0, 'Khad': 0, 'Silt': 0, 'Bridge': 0, 'Nallah': 0, 'Nalla': 0, 'Road': 2, 'Culvert': 0, 'Lake': 0, 'Relief': 0, 'Erosion': 0, 'Sluice': 0, 'Dyke': 0, 'Storm water drain': 0, 'Emergency': 0, 'Immediate': 0, 'dam': 0, 'irrigation': 0, 'rain': 0, 'pond': 0, 'recharge': 0, 'bank': 0}","{'Flood Lights': 0, 'pipe': 0, 'pipes': 0, 'supply': 0, 'beautification': 0, 'installation': 0}",Monsoon,,False,True,Repair and Restoration,{'construction': 2}
2024_PWD_92775_1,NINORI,C/o Shakti Nallah to Nanori road km 0/0 to 1/600,C/o Shakti Nallah to Nanori road km 0/0 to 1/600,Works,Open Tender,Percentage,Civil Works - Roads,No,No,,06-Sep-2024 06:00 PM,,75.0,No,No,Online,12-Sep-2024 11:30 AM,PWD,NINORI,176316.0,2.0,,,,,,PWD,True,"{'flood': 0, 'landslide': 0, 'flash flood': 0, 'heavy rain': 0, 'embankment': 0, 'Drainage': 0, ' River': 0, 'Khad': 0, 'Silt': 0, 'Bridge': 0, 'Nallah': 2, 'Nalla': 0, 'Road': 2, 'Culvert': 0, 'Lake': 0, 'Relief': 0, 'Erosion': 0, 'Sluice': 0, 'Dyke': 0, 'Storm water drain': 0, 'Emergency': 0, 'Immediate': 0, 'dam': 0, 'irrigation': 0, 'rain': 0, 'pond': 0, 'recharge': 0, 'bank': 0}","{'Flood Lights': 0, 'pipe': 0, 'pipes': 0, 'supply': 0, 'beautification': 0, 'installation': 0}",Monsoon,,False,True,Others,
2024_PWD_92909_2,PW-NBT-CB-Tender/24-4679-82 dt 06.09.2024,C/O link road Nilawas to Sandal via Sidh Baba Bharthri Mandir Dhalhet,"C/O formation cutting, RCC slab culvert etc.",Works,Open Tender,Percentage,Civil Works - Roads,No,No,,09-Sep-2024 06:00 PM,,75.0,No,No,Online,16-Sep-2024 11:30 AM,PWD,Bilaspur,174001.0,2.0,"37,12,004",,,,,PWD,True,"{'flood': 0, 'landslide': 0, 'flash flood': 0, 'heavy rain': 0, 'embankment': 0, 'Drainage': 0, ' River': 0, 'Khad': 0, 'Silt': 0, 'Bridge': 0, 'Nallah': 0, 'Nalla': 0, 'Road': 1, 'Culvert': 1, 'Lake': 0, 'Relief': 0, 'Erosion': 0, 'Sluice': 0, 'Dyke': 0, 'Storm water drain': 0, 'Emergency': 0, 'Immediate': 0, 'dam': 0, 'irrigation': 0, 'rain': 0, 'pond': 0, 'recharge': 0, 'bank': 0}","{'Flood Lights': 0, 'pipe': 0, 'pipes': 0, 'supply': 0, 'beautification': 0, 'installation': 0}",Monsoon,,False,True,Others,
2024_PWD_92910_1,d/shala 3641-70,"Restoration of rain damages on Dharamshala to Jule via Aghanjar Mahadev to slate Godown road km 0/000 to 22/500 in Tehsil Dharamshala, Distt. Kangra H.P.",SH - Construction of Retaining wall i/c Pusta at RD 17/740 to 17/762,Works,Open Tender,Percentage,Civil Works,No,No,,10-Sep-2024 09:00 AM,,75.0,No,No,Online,20-Sep-2024 11:00 AM,PWD,Dharamshala,176215.0,2.0,"19,85,942",,,,,PWD,True,"{'flood': 0, 'landslide': 0, 'flash flood': 0, 'heavy rain': 0, 'embankment': 0, 'Drainage': 0, ' River': 0, 'Khad': 0, 'Silt': 0, 'Bridge': 0, 'Nallah': 0, 'Nalla': 0, 'Road': 1, 'Culvert': 0, 'Lake': 0, 'Relief': 0, 'Erosion': 0, 'Sluice': 0, 'Dyke': 0, 'Storm water drain': 0, 'Emergency': 0, 'Immediate': 0, 'dam': 0, 'irrigation': 0, 'rain': 1, 'pond': 0, 'recharge': 0, 'bank': 0}","{'Flood Lights': 0, 'pipe': 0, 'pipes': 0, 'supply': 0, 'beautification': 0, 'installation': 0}",Monsoon,,False,True,Repair and Restoration,"{'restoration': 1, 'construction': 1}"
