Tender ID,tender_externalreference,tender_title,Work Description,Tender Category,Tender Type,Form of contract,Product Category,Is Multi Currency Allowed For BOQ,Allow Two Stage Bidding,Independent External Monitor/Remarks,Published Date,Pre Bid Meeting Date,Bid Validity(Days),Should Allow NDA Tender,Allow Preferential Bidder,Payment Mode,Bid Opening Date,Organisation Chain,location,Pincode,No of Bids Received,Tender Value in ₹,Bidder Name,Awarded Value,Status,Contract Date :,Department,is_flood_tender,positive_keywords_dict,negative_keywords_dict,Season,Scheme,Erosion,Roads_Bridges_Embkt,Response Type,Flood Response - Subhead
2018_PWD_22293_1,SD-III-CB-Tender/2018-19-5340 dated 05-06-2018,"Construction of Stadium at Tutikandi near ISBT Shimla. (SH- Civil work, W.S. and S.I., Rain harvesting tank and Site development etc.)","Construction of Stadium at Tutikandi near ISBT Shimla. (SH- Civil work, W.S. and S.I., Rain harvesting tank and Site development etc.)",Works,Open Tender,Item Rate,Civil Works,No,No,,12-Jul-2018 02:00 PM,,120.0,No,No,Offline,27-Jul-2018 11:00 AM,PWD,Tutikandi near ISBT Shimla,171004.0,2.0,"74,28,024",,,,,PWD,True,"{'flood': 0, 'landslide': 0, 'flash flood': 0, 'heavy rain': 0, 'embankment': 0, 'Drainage': 0, ' River': 0, 'Khad': 0, 'Silt': 0, 'Bridge': 0, 'Nallah': 0, 'Nalla': 0, 'Road': 0, 'Culvert': 0, 'Lake': 0, 'Relief': 0, 'Erosion': 0, 'Sluice': 0, 'Dyke': 0, 'Storm water drain': 0, 'Emergency': 0, 'Immediate': 0, 'dam': 0, 'irrigation': 0, 'rain': 2, 'pond': 0, 'recharge': 0, 'bank': 0}","{'Flood Lights': 0, 'pipe': 0, 'pipes': 0, 'supply': 0, 'beautification': 0, 'installation': 0}",Monsoon,,False,False,Repair and Restoration,{'construction': 2}
2018_UDDHP_20236_1,MCSolan/2018-5590 Dated 09/03/2018,Repair and maintenance of road and path from HRTC workshop to Hans Raj Sharma Ward No.4,Repair and maintenance of road and path from HRTC workshop to Hans Raj Sharma Ward No.4,Works,Open Tender,Item Rate,Civil Works,No,No,,30-Mar-2018 09:00 AM,,90.0,No,No,Offline,13-Apr-2018 01:00 PM,Directorate of Urban Development||Urban Development - UDDHP||Municipal Council Solan - UDDHP,MC Solan,173212.0,2.0,"2,00,000",,,,,Directorate of Urban Development||Urban Development - UDDHP||Municipal Council Solan - UDDHP,True,"{'flood': 0, 'landslide': 0, 'flash flood': 0, 'heavy rain': 0, 'embankment': 0, 'Drainage': 0, ' River': 0, 'Khad': 0, 'Silt': 0, 'Bridge': 0, 'Nallah': 0, 'Nalla': 0, 'Road': 2, 'Culvert': 0, 'Lake': 0, 'Relief': 0, 'Erosion': 0, 'Sluice': 0, 'Dyke': 0, 'Storm water drain': 0, 'Emergency': 0, 'Immediate': 0, 'dam': 0, 'irrigation': 0, 'rain': 0, 'pond': 0, 'recharge': 0, 'bank': 0}","{'Flood Lights': 0, 'pipe': 0, 'pipes': 0, 'supply': 0, 'beautification': 0, 'installation': 0}",Pre-Monsoon,,False,True,Repair and Restoration,{'repair': 2}
2018_UDDHP_20255_1,MCSolan/2018-5590 Dated 09/03/2018,"Repair and maintenance of road near Rakesh house Chaunrighat Ward No. 10 sub head Stairs, Tiles and drains etc","Repair and maintenance of road near Rakesh house Chaunrighat Ward No. 10 sub head Stairs, Tiles and drains etc",Works,Open Tender,Item Rate,Civil Works,No,No,,30-Mar-2018 09:00 AM,,90.0,No,No,Offline,13-Apr-2018 01:00 PM,Directorate of Urban Development||Urban Development - UDDHP||Municipal Council Solan - UDDHP,MC Solan,173212.0,2.0,"2,00,000",,,,,Directorate of Urban Development||Urban Development - UDDHP||Municipal Council Solan - UDDHP,True,"{'flood': 0, 'landslide': 0, 'flash flood': 0, 'heavy rain': 0, 'embankment': 0, 'Drainage': 0, ' River': 0, 'Khad': 0, 'Silt': 0, 'Bridge': 0, 'Nallah': 0, 'Nalla': 0, 'Road': 2, 'Culvert': 0, 'Lake': 0, 'Relief': 0, 'Erosion': 0, 'Sluice': 0, 'Dyke': 0, 'Storm water drain': 0, 'Emergency': 0, 'Immediate': 0, 'dam': 0, 'irrigation': 0, 'rain': 0, 'pond': 0, 'recharge': 0, 'bank': 0}","{'Flood Lights': 0, 'pipe': 0, 'pipes': 0, 'supply': 0, 'beautification': 0, 'installation': 0}",Pre-Monsoon,,False,True,Repair and Restoration,{'repair': 2}
2018_UDDHP_20432_1,MCSolan/2018-5590 Dated 09/03/2018,Repair and maintenance of TCP office road sub head providing and laying cement concrete work Ward No1.,Repair and maintenance of TCP office road sub head providing and laying cement concrete work Ward No1.,Works,Open Tender,Item Rate,Civil Works,No,No,,30-Mar-2018 09:00 AM,,90.0,No,No,Offline,13-Apr-2018 01:00 PM,Directorate of Urban Development||Urban Development - UDDHP||Municipal Council Solan - UDDHP,MCSolan,173212.0,2.0,"2,00,000",,,,,Directorate of Urban Development||Urban Development - UDDHP||Municipal Council Solan - UDDHP,True,"{'flood': 0, 'landslide': 0, 'flash flood': 0, 'heavy rain': 0, 'embankment': 0, 'Drainage': 0, ' River': 0, 'Khad': 0, 'Silt': 0, 'Bridge': 0, 'Nallah': 0, 'Nalla': 0, 'Road': 2, 'Culvert': 0, 'Lake': 0, 'Relief': 0, 'Erosion': 0, 'Sluice': 0, 'Dyke': 0, 'Storm water drain': 0, 'Emergency': 0, 'Immediate': 0, 'dam': 0, 'irrigation': 0, 'rain': 0, 'pond': 0, 'recharge': 0, 'bank': 0}","{'Flood Lights': 0, 'pipe': 0, 'pipes': 0, 'supply': 0, 'beautification': 0, 'installation': 0}",Pre-Monsoon,,False,True,Repair and Restoration,{'repair': 2}
2018_UDDHP_20435_1,MCSolan/2018-5590 Dated 09/03/2018,Repair and maintenance of Gurudwara road Ward No. 1 sub head providing and laying interlocking pavers.,Repair and maintenance of Gurudwara road Ward No. 1 sub head providing and laying interlocking pavers.,Works,Open Tender,Item Rate,Civil Works,No,No,,30-Mar-2018 09:00 AM,,90.0,No,No,Offline,13-Apr-2018 01:00 PM,Directorate of Urban Development||Urban Development - UDDHP||Municipal Council Solan - UDDHP,MC Solan,173212.0,2.0,"2,00,000",,,,,Directorate of Urban Development||Urban Development - UDDHP||Municipal Council Solan - UDDHP,True,"{'flood': 0, 'landslide': 0, 'flash flood': 0, 'heavy rain': 0, 'embankment': 0, 'Drainage': 0, ' River': 0, 'Khad': 0, 'Silt': 0, 'Bridge': 0, 'Nallah': 0, 'Nalla': 0, 'Road': 2, 'Culvert': 0, 'Lake': 0, 'Relief': 0, 'Erosion': 0, 'Sluice': 0, 'Dyke': 0, 'Storm water drain': 0, 'Emergency': 0, 'Immediate': 0, 'dam': 0, 'irrigation': 0, 'rain': 0, 'pond': 0, 'recharge': 0, 'bank': 0}","{'Flood Lights': 0, 'pipe': 0, 'pipes': 0, 'supply': 0, 'beautification': 0, 'installation': 0}",Pre-Monsoon,,False,True,Repair and Restoration,{'repair': 2}
2018_UDDHP_20439_1,MCSolan/2018-5590 Dated 09/03/2018,"Construction of Retaining wall near block No.20, 21 to increase width of road and to remove blind curve Phase-I Housing Board colony Ward No.14","Construction of Retaining wall near block No.20, 21 to increase width of road and to remove blind curve Phase-I Housing Board colony Ward No.14",Works,Open Tender,Item Rate,Civil Works,No,No,,30-Mar-2018 09:00 AM,,90.0,No,No,Offline,13-Apr-2018 01:00 PM,Directorate of Urban Development||Urban Development - UDDHP||Municipal Council Solan - UDDHP,MC Solan,173212.0,2.0,"2,00,000",,,,,Directorate of Urban Development||Urban Development - UDDHP||Municipal Council Solan - UDDHP,True,"{'flood': 0, 'landslide': 0, 'flash flood': 0, 'heavy rain': 0, 'embankment': 0, 'Drainage': 0, ' River': 0, 'Khad': 0, 'Silt': 0, 'Bridge': 0, 'Nallah': 0, 'Nalla': 0, 'Road': 2, 'Culvert': 0, 'Lake': 0, 'Relief': 0, 'Erosion': 0, 'Sluice': 0, 'Dyke': 0, 'Storm water drain': 0, 'Emergency': 0, 'Immediate': 0, 'dam': 0, 'irrigation': 0, 'rain': 0, 'pond': 0, 'recharge': 0, 'bank': 0}","{'Flood Lights': 0, 'pipe': 0, 'pipes': 0, 'supply': 0, 'beautification': 0, 'installation': 0}",Pre-Monsoon,,False,True,Repair and Restoration,{'construction': 2}
2021_PWD_45407_3,17974-23 HPPWD Palampur,Periodical Maintenance of YOL DADH PALAMPUR ROAD TO KALOOND HANGLOW under (VILLAGE ROADS) (HP0402VR008119301) (AMP 2021-22) Phase-I,Providing and Laying 30 mm thick Bitumen Concrete  with Paver finisher in Km  0/000 to 1/000,Works,Open Tender,Item Rate,Civil Works - Roads,No,No,,10-Mar-2021 04:00 PM,,120.0,No,No,Online,22-Mar-2021 11:30 AM,PWD,Palampur,176059.0,2.0,,,,,,PWD,True,"{'flood': 0, 'landslide': 0, 'flash flood': 0, 'heavy rain': 0, 'embankment': 0, 'Drainage': 0, ' River': 0, 'Khad': 0, 'Silt': 0, 'Bridge': 0, 'Nallah': 0, 'Nalla': 0, 'Road': 1, 'Culvert': 0, 'Lake': 0, 'Relief': 0, 'Erosion': 0, 'Sluice': 0, 'Dyke': 0, 'Storm water drain': 0, 'Emergency': 0, 'Immediate': 0, 'dam': 0, 'irrigation': 0, 'rain': 0, 'pond': 0, 'recharge': 0, 'bank': 0}","{'Flood Lights': 0, 'pipe': 0, 'pipes': 0, 'supply': 0, 'beautification': 0, 'installation': 0}",Pre-Monsoon,,False,True,Preparedness Measures,{'maintenance': 1}
2021_PWD_45407_4,17974-23 HPPWD Palampur,Periodical Maintenance of YOL DADH PALAMPUR ROAD TO KALOOND HANGLOW under (VILLAGE ROADS) (HP0402VR008119302) (AMP 2021-22) Phase-I,Providing and Laying 30 mm thick Bitumen Concrete  with Paver finisher in Km  1/000 to 2/000,Works,Open Tender,Item Rate,Civil Works - Roads,No,No,,10-Mar-2021 04:00 PM,,120.0,No,No,Online,22-Mar-2021 11:30 AM,PWD,Palampur,176061.0,2.0,,,,,,PWD,True,"{'flood': 0, 'landslide': 0, 'flash flood': 0, 'heavy rain': 0, 'embankment': 0, 'Drainage': 0, ' River': 0, 'Khad': 0, 'Silt': 0, 'Bridge': 0, 'Nallah': 0, 'Nalla': 0, 'Road': 1, 'Culvert': 0, 'Lake': 0, 'Relief': 0, 'Erosion': 0, 'Sluice': 0, 'Dyke': 0, 'Storm water drain': 0, 'Emergency': 0, 'Immediate': 0, 'dam': 0, 'irrigation': 0, 'rain': 0, 'pond': 0, 'recharge': 0, 'bank': 0}","{'Flood Lights': 0, 'pipe': 0, 'pipes': 0, 'supply': 0, 'beautification': 0, 'installation': 0}",Pre-Monsoon,,False,True,Preparedness Measures,{'maintenance': 1}
2021_PWD_45470_4,17924-73 HPPWD Palampur,Periodical Maintenance of KHILRU SSB CHOWK TO SOOD COLONY ROAD under (VILLAGE ROADS) (HP0402VR011219301) (AMP 2021-22) Phase-I,Providing and Laying 30 mm thick Bitumen Concrete  with Paver finisher in Km  0/000 to 0/750,Works,Open Tender,Item Rate,Civil Works - Roads,No,No,,12-Mar-2021 03:05 PM,,120.0,No,No,Online,25-Mar-2021 11:30 AM,PWD,Palampur,176061.0,2.0,,,,,,PWD,True,"{'flood': 0, 'landslide': 0, 'flash flood': 0, 'heavy rain': 0, 'embankment': 0, 'Drainage': 0, ' River': 0, 'Khad': 0, 'Silt': 0, 'Bridge': 0, 'Nallah': 0, 'Nalla': 0, 'Road': 1, 'Culvert': 0, 'Lake': 0, 'Relief': 0, 'Erosion': 0, 'Sluice': 0, 'Dyke': 0, 'Storm water drain': 0, 'Emergency': 0, 'Immediate': 0, 'dam': 0, 'irrigation': 0, 'rain': 0, 'pond': 0, 'recharge': 0, 'bank': 0}","{'Flood Lights': 0, 'pipe': 0, 'pipes': 0, 'supply': 0, 'beautification': 0, 'installation': 0}",Pre-Monsoon,,False,True,Preparedness Measures,{'maintenance': 1}
2021_PWD_48697_1,3181-3231 HPPWD Palampur,Periodical Maintenacne of link to Bandla Tea Estate via Dohru (RURAL Road) (HP0402 VR0110) (AMP 2021-22)Phase-I,P/L 30mm thick bitumen concrete with paver finisher in km. 0/00 to 1/00,Works,Open Tender,Item Rate,Civil Works - Roads,No,No,,18-Jun-2021 11:00 AM,,120.0,No,No,Online,01-Jul-2021 11:30 AM,PWD,Palampur,176061.0,2.0,,,,,,PWD,True,"{'flood': 0, 'landslide': 0, 'flash flood': 0, 'heavy rain': 0, 'embankment': 0, 'Drainage': 0, ' River': 0, 'Khad': 0, 'Silt': 0, 'Bridge': 0, 'Nallah': 0, 'Nalla': 0, 'Road': 1, 'Culvert': 0, 'Lake': 0, 'Relief': 0, 'Erosion': 0, 'Sluice': 0, 'Dyke': 0, 'Storm water drain': 0, 'Emergency': 0, 'Immediate': 0, 'dam': 0, 'irrigation': 0, 'rain': 0, 'pond': 0, 'recharge': 0, 'bank': 0}","{'Flood Lights': 0, 'pipe': 0, 'pipes': 0, 'supply': 0, 'beautification': 0, 'installation': 0}",Monsoon,,False,True,Others,
2021_PWD_52734_21,Sangrah 5782-5832 dated 14.09.2021,"Restoration of rain damages on Gattadhar to village Sangna road km. 0/00 to 3/690 (SH  C/O R/Wall in wire crates at RD. 2/595 to 2/615, 2/660 to 2/670, 2/825 to 2/835, 2/690 to 2/705 and  2/980 to 2/995)","Restoration of rain damages on Gattadhar to village Sangna road km. 0/00 to 3/690 (SH  C/O R/Wall in wire crates at RD. 2/595 to 2/615, 2/660 to 2/670, 2/825 to 2/835, 2/690 to 2/705 and  2/980 to 2/995)",Works,Open Tender,Item Rate,Civil Works,No,No,,30-Sep-2021 12:00 PM,,75.0,No,No,Online,07-Oct-2021 10:30 AM,PWD,Sangrah,173023.0,2.0,"9,67,379",,,,,PWD,True,"{'flood': 0, 'landslide': 0, 'flash flood': 0, 'heavy rain': 0, 'embankment': 0, 'Drainage': 0, ' River': 0, 'Khad': 0, 'Silt': 0, 'Bridge': 0, 'Nallah': 0, 'Nalla': 0, 'Road': 2, 'Culvert': 0, 'Lake': 0, 'Relief': 0, 'Erosion': 0, 'Sluice': 0, 'Dyke': 0, 'Storm water drain': 0, 'Emergency': 0, 'Immediate': 0, 'dam': 0, 'irrigation': 0, 'rain': 2, 'pond': 0, 'recharge': 0, 'bank': 0}","{'Flood Lights': 0, 'pipe': 0, 'pipes': 0, 'supply': 0, 'beautification': 0, 'installation': 0}",Monsoon,,False,True,Repair and Restoration,{'restoration': 2}
2021_UDDHP_44403_1,"6675-77,01/02/2021",Construction of CC road and repair of Paver and Drain near Dr. Praveen gupta house to Raghwanshi house in ward no 9,Construction of CC road and repair of Paver and Drain near Dr. Praveen gupta house to Raghwanshi house in ward no 9,Works,Open Tender,Item Rate,Civil Works,No,No,,18-Feb-2021 09:00 AM,,90.0,No,No,Offline,10-Mar-2021 02:00 PM,Directorate of Urban Development||Urban Development - UDDHP||Municipal Council Solan - UDDHP,M.Corp. Solan,173212.0,2.0,,,,,,Directorate of Urban Development||Urban Development - UDDHP||Municipal Council Solan - UDDHP,True,"{'flood': 0, 'landslide': 0, 'flash flood': 0, 'heavy rain': 0, 'embankment': 0, 'Drainage': 0, ' River': 0, 'Khad': 0, 'Silt': 0, 'Bridge': 0, 'Nallah': 0, 'Nalla': 0, 'Road': 2, 'Culvert': 0, 'Lake': 0, 'Relief': 0, 'Erosion': 0, 'Sluice': 0, 'Dyke': 0, 'Storm water drain': 0, 'Emergency': 0, 'Immediate': 0, 'dam': 0, 'irrigation': 0, 'rain': 0, 'pond': 0, 'recharge': 0, 'bank': 0}","{'Flood Lights': 0, 'pipe': 0, 'pipes': 0, 'supply': 0, 'beautification': 0, 'installation': 0}",Pre-Monsoon,,False,True,Repair and Restoration,"{'repair': 2, 'construction': 2, 'drain': 2}"
2021_UDDHP_44675_1,"6675-77,01/02/2021",Channelization of Nallah near Mida house to bina house in ward no 13,Channelization of Nallah near Mida house to bina house in ward no 13,Works,Open Tender,Item Rate,Civil Works,No,No,,24-Feb-2021 09:00 AM,,90.0,No,No,Offline,10-Mar-2021 02:00 PM,Directorate of Urban Development||Urban Development - UDDHP||Municipal Council Solan - UDDHP,M.Corp. Solan,173212.0,2.0,,,,,,Directorate of Urban Development||Urban Development - UDDHP||Municipal Council Solan - UDDHP,True,"{'flood': 0, 'landslide': 0, 'flash flood': 0, 'heavy rain': 0, 'embankment': 0, 'Drainage': 0, ' River': 0, 'Khad': 0, 'Silt': 0, 'Bridge': 0, 'Nallah': 2, 'Nalla': 0, 'Road': 0, 'Culvert': 0, 'Lake': 0, 'Relief': 0, 'Erosion': 0, 'Sluice': 0, 'Dyke': 0, 'Storm water drain': 0, 'Emergency': 0, 'Immediate': 0, 'dam': 0, 'irrigation': 0, 'rain': 0, 'pond': 0, 'recharge': 0, 'bank': 0}","{'Flood Lights': 0, 'pipe': 0, 'pipes': 0, 'supply': 0, 'beautification': 0, 'installation': 0}",Pre-Monsoon,,False,False,Others,
2021_UDDHP_48275_1,"508, 31/05/2021",Channelization of Nallah near DeshRaj house in ward no 7.,Channelization of Nallah near DeshRaj house in ward no 7.,Works,Open Tender,Item Rate,Civil Works,No,No,,10-Jun-2021 09:00 AM,,90.0,No,No,Offline,19-Jun-2021 02:00 PM,Directorate of Urban Development||Urban Development - UDDHP||Municipal Council Solan - UDDHP,M.Corp. Solan,173212.0,2.0,,,,,,Directorate of Urban Development||Urban Development - UDDHP||Municipal Council Solan - UDDHP,True,"{'flood': 0, 'landslide': 0, 'flash flood': 0, 'heavy rain': 0, 'embankment': 0, 'Drainage': 0, ' River': 0, 'Khad': 0, 'Silt': 0, 'Bridge': 0, 'Nallah': 2, 'Nalla': 0, 'Road': 0, 'Culvert': 0, 'Lake': 0, 'Relief': 0, 'Erosion': 0, 'Sluice': 0, 'Dyke': 0, 'Storm water drain': 0, 'Emergency': 0, 'Immediate': 0, 'dam': 0, 'irrigation': 0, 'rain': 0, 'pond': 0, 'recharge': 0, 'bank': 0}","{'Flood Lights': 0, 'pipe': 0, 'pipes': 0, 'supply': 0, 'beautification': 0, 'installation': 0}",Monsoon,,False,False,Others,
2021_UDDHP_48278_1,"508, 31/05/2021","Construction o R/Wall, drain cover with gratting from Rajgarh road to Hari Mandir in ward no 7.","Construction o R/Wall, drain cover with gratting from Rajgarh road to Hari Mandir in ward no 7.",Works,Open Tender,Item Rate,Civil Works,No,No,,10-Jun-2021 09:00 AM,,90.0,No,No,Offline,19-Jun-2021 02:00 PM,Directorate of Urban Development||Urban Development - UDDHP||Municipal Council Solan - UDDHP,M.Corp. Solan,173212.0,2.0,,,,,,Directorate of Urban Development||Urban Development - UDDHP||Municipal Council Solan - UDDHP,True,"{'flood': 0, 'landslide': 0, 'flash flood': 0, 'heavy rain': 0, 'embankment': 0, 'Drainage': 0, ' River': 0, 'Khad': 0, 'Silt': 0, 'Bridge': 0, 'Nallah': 0, 'Nalla': 0, 'Road': 2, 'Culvert': 0, 'Lake': 0, 'Relief': 0, 'Erosion': 0, 'Sluice': 0, 'Dyke': 0, 'Storm water drain': 0, 'Emergency': 0, 'Immediate': 0, 'dam': 0, 'irrigation': 0, 'rain': 0, 'pond': 0, 'recharge': 0, 'bank': 0}","{'Flood Lights': 0, 'pipe': 0, 'pipes': 0, 'supply': 0, 'beautification': 0, 'installation': 0}",Monsoon,,False,True,Repair and Restoration,"{'construction': 2, 'drain': 2}"
2021_UDDHP_48312_1,"508, 31/05/2021","Construction of Drain, Nallah from Jai Halwai to Puran Chand house in ward no 8.","Construction of Drain, Nallah from Jai Halwai to Puran Chand house in ward no 8.",Works,Open Tender,Item Rate,Civil Works,No,No,,10-Jun-2021 09:00 AM,,90.0,No,No,Offline,19-Jun-2021 02:00 PM,Directorate of Urban Development||Urban Development - UDDHP||Municipal Council Solan - UDDHP,M.Corp. Solan,173212.0,2.0,,,,,,Directorate of Urban Development||Urban Development - UDDHP||Municipal Council Solan - UDDHP,True,"{'flood': 0, 'landslide': 0, 'flash flood': 0, 'heavy rain': 0, 'embankment': 0, 'Drainage': 0, ' River': 0, 'Khad': 0, 'Silt': 0, 'Bridge': 0, 'Nallah': 2, 'Nalla': 0, 'Road': 0, 'Culvert': 0, 'Lake': 0, 'Relief': 0, 'Erosion': 0, 'Sluice': 0, 'Dyke': 0, 'Storm water drain': 0, 'Emergency': 0, 'Immediate': 0, 'dam': 0, 'irrigation': 0, 'rain': 0, 'pond': 0, 'recharge': 0, 'bank': 0}","{'Flood Lights': 0, 'pipe': 0, 'pipes': 0, 'supply': 0, 'beautification': 0, 'installation': 0}",Monsoon,,False,True,Repair and Restoration,"{'construction': 2, 'drain': 2}"
2021_UDDHP_48323_1,"508, 31/05/2021","Repair and maintenance of road from Satya Narayan house to Gurudwara and hand pump bye PWD office ward no 1, 2 or 14.","Repair and maintenance of road from Satya Narayan house to Gurudwara and hand pump bye PWD office ward no 1, 2 or 14.",Works,Open Tender,Item Rate,Civil Works,No,No,,10-Jun-2021 09:00 AM,,90.0,No,No,Offline,19-Jun-2021 02:00 PM,Directorate of Urban Development||Urban Development - UDDHP||Municipal Council Solan - UDDHP,M.Corp. Solan,173212.0,2.0,,,,,,Directorate of Urban Development||Urban Development - UDDHP||Municipal Council Solan - UDDHP,True,"{'flood': 0, 'landslide': 0, 'flash flood': 0, 'heavy rain': 0, 'embankment': 0, 'Drainage': 0, ' River': 0, 'Khad': 0, 'Silt': 0, 'Bridge': 0, 'Nallah': 0, 'Nalla': 0, 'Road': 2, 'Culvert': 0, 'Lake': 0, 'Relief': 0, 'Erosion': 0, 'Sluice': 0, 'Dyke': 0, 'Storm water drain': 0, 'Emergency': 0, 'Immediate': 0, 'dam': 0, 'irrigation': 0, 'rain': 0, 'pond': 0, 'recharge': 0, 'bank': 0}","{'Flood Lights': 0, 'pipe': 0, 'pipes': 0, 'supply': 0, 'beautification': 0, 'installation': 0}",Monsoon,,False,True,Repair and Restoration,{'repair': 2}
2021_UDDHP_48328_1,"508, 31/05/2021",Construction of utility duct /R.C.C Culvert at Chabaghat Salogra.,Construction of utility duct /R.C.C Culvert at Chabaghat  Salogra.,Works,Open Tender,Item Rate,Civil Works,No,No,,10-Jun-2021 09:00 AM,,90.0,No,No,Offline,19-Jun-2021 02:00 PM,Directorate of Urban Development||Urban Development - UDDHP||Municipal Council Solan - UDDHP,M.Corp. Solan,173212.0,2.0,,,,,,Directorate of Urban Development||Urban Development - UDDHP||Municipal Council Solan - UDDHP,True,"{'flood': 0, 'landslide': 0, 'flash flood': 0, 'heavy rain': 0, 'embankment': 0, 'Drainage': 0, ' River': 0, 'Khad': 0, 'Silt': 0, 'Bridge': 0, 'Nallah': 0, 'Nalla': 0, 'Road': 0, 'Culvert': 2, 'Lake': 0, 'Relief': 0, 'Erosion': 0, 'Sluice': 0, 'Dyke': 0, 'Storm water drain': 0, 'Emergency': 0, 'Immediate': 0, 'dam': 0, 'irrigation': 0, 'rain': 0, 'pond': 0, 'recharge': 0, 'bank': 0}","{'Flood Lights': 0, 'pipe': 0, 'pipes': 0, 'supply': 0, 'beautification': 0, 'installation': 0}",Monsoon,,False,True,Repair and Restoration,{'construction': 2}
2021_UDDHP_50343_1,"1227-29, 22.07.2021",Repair and maintenance of drain Baba Balak nath road to Shashi Pal in Ward No.1.,Repair and maintenance of drain Baba Balak nath road to Shashi Pal in Ward No.1.,Works,Open Tender,Item Rate,Civil Works,No,No,,31-Jul-2021 09:00 AM,,90.0,No,No,Offline,11-Aug-2021 02:00 PM,Directorate of Urban Development||Urban Development - UDDHP||Municipal Council Solan - UDDHP,M.Corp. Solan,173212.0,2.0,"1,62,610",,,,,Directorate of Urban Development||Urban Development - UDDHP||Municipal Council Solan - UDDHP,True,"{'flood': 0, 'landslide': 0, 'flash flood': 0, 'heavy rain': 0, 'embankment': 0, 'Drainage': 0, ' River': 0, 'Khad': 0, 'Silt': 0, 'Bridge': 0, 'Nallah': 0, 'Nalla': 0, 'Road': 2, 'Culvert': 0, 'Lake': 0, 'Relief': 0, 'Erosion': 0, 'Sluice': 0, 'Dyke': 0, 'Storm water drain': 0, 'Emergency': 0, 'Immediate': 0, 'dam': 0, 'irrigation': 0, 'rain': 0, 'pond': 0, 'recharge': 0, 'bank': 0}","{'Flood Lights': 0, 'pipe': 0, 'pipes': 0, 'supply': 0, 'beautification': 0, 'installation': 0}",Monsoon,,False,True,Repair and Restoration,"{'repair': 2, 'drain': 2}"
2021_UDDHP_50347_1,"1227-29, 22.07.2021","Repair and maint. of path/road near Dullu and Gosain house and railing near Anurag, Bimla, Puta house in ward No.2.","Repair and maint. of path/road near Dullu and Gosain house and railing near Anurag, Bimla, Puta house in ward No.2.",Works,Open Tender,Item Rate,Civil Works,No,No,,31-Jul-2021 09:00 AM,,90.0,No,No,Offline,11-Aug-2021 02:00 PM,Directorate of Urban Development||Urban Development - UDDHP||Municipal Council Solan - UDDHP,M.Corp. Solan,173212.0,2.0,"1,50,801",,,,,Directorate of Urban Development||Urban Development - UDDHP||Municipal Council Solan - UDDHP,True,"{'flood': 0, 'landslide': 0, 'flash flood': 0, 'heavy rain': 0, 'embankment': 0, 'Drainage': 0, ' River': 0, 'Khad': 0, 'Silt': 0, 'Bridge': 0, 'Nallah': 0, 'Nalla': 0, 'Road': 2, 'Culvert': 0, 'Lake': 0, 'Relief': 0, 'Erosion': 0, 'Sluice': 0, 'Dyke': 0, 'Storm water drain': 0, 'Emergency': 0, 'Immediate': 0, 'dam': 0, 'irrigation': 0, 'rain': 0, 'pond': 0, 'recharge': 0, 'bank': 0}","{'Flood Lights': 0, 'pipe': 0, 'pipes': 0, 'supply': 0, 'beautification': 0, 'installation': 0}",Monsoon,,False,True,Repair and Restoration,{'repair': 2}
2021_UDDHP_50348_1,"1227-29, 22.07.2021",Construction of Park and steel stair subathu road Sood house side in Ward No.2 Railing Sunder Cinema road to Negi house,Construction of Park and steel stair subathu road Sood house side in Ward No.2 Railing Sunder Cinema road to Negi house,Works,Open Tender,Item Rate,Civil Works,No,No,,31-Jul-2021 09:00 AM,,90.0,No,No,Offline,11-Aug-2021 02:00 PM,Directorate of Urban Development||Urban Development - UDDHP||Municipal Council Solan - UDDHP,M.Corp. Solan,173212.0,2.0,"2,95,702",,,,,Directorate of Urban Development||Urban Development - UDDHP||Municipal Council Solan - UDDHP,True,"{'flood': 0, 'landslide': 0, 'flash flood': 0, 'heavy rain': 0, 'embankment': 0, 'Drainage': 0, ' River': 0, 'Khad': 0, 'Silt': 0, 'Bridge': 0, 'Nallah': 0, 'Nalla': 0, 'Road': 4, 'Culvert': 0, 'Lake': 0, 'Relief': 0, 'Erosion': 0, 'Sluice': 0, 'Dyke': 0, 'Storm water drain': 0, 'Emergency': 0, 'Immediate': 0, 'dam': 0, 'irrigation': 0, 'rain': 0, 'pond': 0, 'recharge': 0, 'bank': 0}","{'Flood Lights': 0, 'pipe': 0, 'pipes': 0, 'supply': 0, 'beautification': 0, 'installation': 0}",Monsoon,,False,True,Repair and Restoration,{'construction': 2}
2021_UDDHP_50352_1,"1227-29, 22.07.2021","Const. of drain, road near Shivana hotel near UCO bank to Gaurav niwas Chambaghat and opp. Gurukul School Ramesh Thakur house in Ward No.3.","Const. of drain, road near Shivana hotel near UCO bank to Gaurav niwas Chambaghat and opp. Gurukul School Ramesh Thakur house in Ward No.3.",Works,Open Tender,Item Rate,Civil Works,No,No,,31-Jul-2021 09:00 AM,,90.0,No,No,Offline,11-Aug-2021 02:00 PM,Directorate of Urban Development||Urban Development - UDDHP||Municipal Council Solan - UDDHP,M.Corp. Solan,173212.0,2.0,"2,44,106",,,,,Directorate of Urban Development||Urban Development - UDDHP||Municipal Council Solan - UDDHP,True,"{'flood': 0, 'landslide': 0, 'flash flood': 0, 'heavy rain': 0, 'embankment': 0, 'Drainage': 0, ' River': 0, 'Khad': 0, 'Silt': 0, 'Bridge': 0, 'Nallah': 0, 'Nalla': 0, 'Road': 2, 'Culvert': 0, 'Lake': 0, 'Relief': 0, 'Erosion': 0, 'Sluice': 0, 'Dyke': 0, 'Storm water drain': 0, 'Emergency': 0, 'Immediate': 0, 'dam': 0, 'irrigation': 0, 'rain': 0, 'pond': 0, 'recharge': 0, 'bank': 2}","{'Flood Lights': 0, 'pipe': 0, 'pipes': 0, 'supply': 0, 'beautification': 0, 'installation': 0}",Monsoon,,False,True,Repair and Restoration,{'drain': 2}
2022_PWD_56562_1,No.BGN/2020-21-11816-845 dated  27.01.2022Job3,C/o Atal Adarsh Vidyalaya  at Mohal Ghera Dhanet Tehsil Bangana District Una (H.P. ),C/o 4.00mtr. wide approach road in length 842.00 mtr.,Works,Open Tender,Item Rate,Civil Works,No,No,,10-Feb-2022 11:00 AM,,120.0,No,No,Online,22-Feb-2022 11:00 AM,PWD,Bangana Division,174307.0,2.0,"2,46,90,166",,,,,PWD,True,"{'flood': 0, 'landslide': 0, 'flash flood': 0, 'heavy rain': 0, 'embankment': 0, 'Drainage': 0, ' River': 0, 'Khad': 0, 'Silt': 0, 'Bridge': 0, 'Nallah': 0, 'Nalla': 0, 'Road': 1, 'Culvert': 0, 'Lake': 0, 'Relief': 0, 'Erosion': 0, 'Sluice': 0, 'Dyke': 0, 'Storm water drain': 0, 'Emergency': 0, 'Immediate': 0, 'dam': 0, 'irrigation': 0, 'rain': 0, 'pond': 0, 'recharge': 0, 'bank': 0}","{'Flood Lights': 0, 'pipe': 0, 'pipes': 0, 'supply': 0, 'beautification': 0, 'installation': 0}",Pre-Monsoon,,False,True,Others,
