Organisation Chain,Tender Reference Number,Tender ID,Withdrawal Allowed,Tender Type,Form of contract,Tender Category,No. of Covers,General Technical Evaluation Allowed,ItemWise Technical Evaluation Allowed,Payment Mode,Is Multi Currency Allowed For BOQ,Is Multi Currency Allowed For Fee,Allow Two Stage Bidding,Cover No,Cover,Document Type,Description,Publish Date,Bid Opening Date,Document Download / Sale Start Date,Document Download / Sale End Date,Clarification Start Date,Clarification End Date,Bid Submission Start Date,Bid Submission End Date,Financial Bid Opening Date,EMD Amount in ₹,EMD Exemption Allowed,EMD Fee Type,EMD Percentage,EMD Payable To,EMD Payable At,S.No,Corrigendum Title,Corrigendum Type,View,S.No.1,Bank Name,Tender Fee in ₹,Fee Payable To,Fee Payable At,Tender Fee Exemption Allowed,Name,Address,Title,Work Description,Pre Qualification Details,Independent External Monitor/Remarks,Tender Value in ₹,Product Category,Sub category,Contract Type,Bid Validity(Days),Period Of Work(Days),Location,Pincode,Pre Bid Meeting Place,Pre Bid Meeting Address,Pre Bid Meeting Date,Bid Opening Place,Should Allow NDA Tender,Allow Preferential Bidder,Tender Stage
HPSEBL||CE(OP) South||SE(OP) Nahan||Sr. Xen (E) Rajgarh,104/2025-26,2025_HPSEB_114533_1,Yes,Open Tender,Percentage,Works,2.0,No,No,Online,No,No,No,1.0,Fee/PreQual/Technical,.pdf,FEe and EMD,12-Sep-2025 11:00 AM,19-Sep-2025 03:00 PM,12-Sep-2025 11:00 AM,18-Sep-2025 12:00 PM,12-Sep-2025 11:00 AM,15-Sep-2025 12:00 PM,12-Sep-2025 11:00 AM,18-Sep-2025 12:00 PM,19-Sep-2025 05:00 PM,"1,690",No,fixed,,Nil,Nil,1.0,Corrigendum,Date,,1.0,ICICI BANK,590.0,Nil,Nil,No,Er Narender Thakur,"Sr. Executive Engineer,
Electrical Division,
HPSEB Ltd. Rajgarh",104/2025-26,"Tender for  Permanent restoration  of  11 KV HT Line at VillageManolidhar, Dobradhar, Badiyalta and LT Line at Village Chankash, Samra, Jogibag  and S/area damage due to heavy Storms/Rain on Dated 03and04/09/2025 under ESD Charna",A Class,,,Electrical Works,HT and LT line,Tender,30.0,30.0,Charna,173101.0,,,,ED Rajgarh,No,No,AOC
,,,,,,,,,,,,,,,,.pdf,Tecahnical equirement as per SBD,,,,,,,,,,,,,,,,,,,,2.0,ICICI NEFT/RTGS,,,,,,,,,,,,,,,,,,,,,,,,,AOC
,,,,,,,,,,,,,,2.0,Finance,.xls,Price Bid,,,,,,,,,,,,,,,,,,,,,,,,,,,,,,,,,,,,,,,,,,,,,,AOC
