Organisation Chain,Tender Reference Number,Tender ID,Withdrawal Allowed,Tender Type,Form of contract,Tender Category,No. of Covers,General Technical Evaluation Allowed,ItemWise Technical Evaluation Allowed,Payment Mode,Is Multi Currency Allowed For BOQ,Is Multi Currency Allowed For Fee,Allow Two Stage Bidding,Cover No,Cover,Document Type,Description,Publish Date,Bid Opening Date,Document Download / Sale Start Date,Document Download / Sale End Date,Clarification Start Date,Clarification End Date,Bid Submission Start Date,Bid Submission End Date,Financial Bid Opening Date,EMD Amount in ₹,EMD Exemption Allowed,EMD Fee Type,EMD Percentage,EMD Payable To,EMD Payable At,S.No,Bank Name,Tender Fee in ₹,Fee Payable To,Fee Payable At,Tender Fee Exemption Allowed,Name,Address,Title,Work Description,Pre Qualification Details,Independent External Monitor/Remarks,Tender Value in ₹,Product Category,Sub category,Contract Type,Bid Validity(Days),Period Of Work(Days),Location,Pincode,Pre Bid Meeting Place,Pre Bid Meeting Address,Pre Bid Meeting Date,Bid Opening Place,Should Allow NDA Tender,Allow Preferential Bidder,Tender Stage
HPSEBL||CE (OP) North||SE (OP) Kangra||Sr. Xen Dehra,5988-6002,2025_HPSEB_118085_1,Yes,Open Tender,Percentage,Works,2.0,No,No,Online,No,No,No,1.0,Fee/PreQual/Technical,.pdf,"Cost of Tender Form, Earnest money as per NIT",17-Oct-2025 05:00 PM,25-Oct-2025 02:30 PM,17-Oct-2025 05:00 PM,25-Oct-2025 11:00 AM,,,17-Oct-2025 05:00 PM,25-Oct-2025 11:00 AM,10-Nov-2025 04:35 PM,"7,340",No,fixed,,Nil,Nil,1.0,ICICI BANK,590.0,Nil,Nil,No,Sr. Executive Engineer,Ele. Div  HPSEBL Dehra,DED  40  25-26,Tender  for prov. 11 0.4 KV 25 KVA SStn and 11 KV HT Line for SOP to LIS Nagrota Ghatti under HPCDPP-JICA-ODA UESD Sansarpur Terrace under ED HPSEBL Dehra.,Please refer Tender documents.,,"7,34,143",Electrical Works,,Tender,120.0,21.0,Sr. Executive Engineer  Ele. Div  HPSEBL Dehra,177101.0,,,,Dehra,No,No,AOC
,,,,,,,,,,,,,,,,.pdf,"Copy of registration with HPSEBL, experience certificate, Affidavit of non Blacklisted by the Board",,,,,,,,,,,,,,,,2.0,ICICI NEFT/RTGS,,,,,,,,,,,,,,,,,,,,,,,,,AOC
,,,,,,,,,,,,,,,,.pdf,"Copy of Pan, GST, Credit Cash limit, Bid capacity certificate",,,,,,,,,,,,,,,,,,,,,,,,,,,,,,,,,,,,,,,,,,AOC
,,,,,,,,,,,,,,,,.pdf,Income Tax Return (of last three years) (no other docs),,,,,,,,,,,,,,,,,,,,,,,,,,,,,,,,,,,,,,,,,,AOC
,,,,,,,,,,,,,,,,.pdf,"Turnover (of last 3 years), Net Worth Certificate (of last 3 years) (no other docs)",,,,,,,,,,,,,,,,,,,,,,,,,,,,,,,,,,,,,,,,,,AOC
,,,,,,,,,,,,,,,,.pdf,"Copy of balance sheet, profit and loss statement (of last 3 years)  audited by CA (no other docs)",,,,,,,,,,,,,,,,,,,,,,,,,,,,,,,,,,,,,,,,,,AOC
,,,,,,,,,,,,,,2.0,Finance,.xls,boq,,,,,,,,,,,,,,,,,,,,,,,,,,,,,,,,,,,,,,,,,,AOC
