Committee Chairperson/Co-ordinator Name :,Committee Chairperson/Co-ordinator Type :,Committee Members :,Updated By :,Updated on :,Document :,Contract Date :,Contract Value :,Work Completion Period in days :,Updated By :.1,Updated on :.1,AOC document :,AOC Description :,Organisation Chain :,Tender ID :,Tender Ref No :,Tender Title :,Committee Chairperson/Co-ordinator Name :.1,Committee Chairperson/Co-ordinator Type :.1,Committee Members :.1,Updated By :.2,Updated On :,Financial Bid Opening Date:,Document :.1,S.No,Bid Number,Bidder Name,Awarded Currency,Awarded Value,Type :,Summary :,Updated By :.3,Updated On :.1,Document :.2,BOQ Comparative Chart :,Type :.1,Summary :.1,Updated By :.4,Updated On :.2,Document :.3,S.No.1,Bid Number.1,Bidder Name.1,Submitted Date,Status,Remarks,Status Updated On,Tender Stage,Cover No,Cover,Document Type,Description,S.No,Instrument Type,Publish Date,Bid Opening Date,Document Download / Sale Start Date,Document Download / Sale End Date,Clarification Start Date,Clarification End Date,Bid Submission Start Date,Bid Submission End Date,Financial Bid Opening Date,Tender Fee in ₹,Fee Payable To,Fee Payable At,Tender Fee Exemption Allowed,Title,Work Description,Pre Qualification Details,Independent External Monitor/Remarks,Tender Value in ₹,Product Category,Sub category,Contract Type,Bid Validity(Days),Period Of Work(Days),Location,Pincode,Pre Bid Meeting Place,Pre Bid Meeting Address,Pre Bid Meeting Date,Bid Opening Place,Should Allow NDA Tender,Allow Preferential Bidder,Organisation Chain,Tender Reference Number,Tender ID,Withdrawal Allowed,Tender Type,Form of contract,Tender Category,No. of Covers,General Technical Evaluation Allowed,ItemWise Technical Evaluation Allowed,Payment Mode,Is Multi Currency Allowed For BOQ,Is Multi Currency Allowed For Fee,Allow Two Stage Bidding,Name,Address,EMD Amount in ₹,EMD Exemption Allowed,EMD Fee Type,EMD Percentage,EMD Payable To,EMD Payable At,Tender Stage
Er. Sushil Dhadwal,Internal,Members Sh. Vikramjit DAO (Gr.I) Sh. Ashok Kumar Supdt. Sh. Suresh Kumar HDM Sh. Vipan Kumar TA,Sushil Kumar Dhadwal,05-Jun-2020 02:19 PM,finsummary_53034.pdf (536.39 KB),06-Jun-2020,"INR 3,495,030",90.0,Sushil Kumar Dhadwal,06-Jun-2020 07:05 PM,35988_4.pdf (1002.00 KB),Shri Rohit Sharma,PWD,2020_PWD_35988_4,9921-50,Periodic maintenance of Yol Jheol Road under AMP 2020-21 PMGSY Road in District Kangra (HP),Er. Sushil Dhadwal,Internal,Sh. Vikramjit DAO (Gr.I) Sh. Ashok Kumar Supdt. Sh. Suresh Kumar HDM Sh. Vipan Kumar TA,Sushil Kumar Dhadwal,28-Apr-2020 01:23 PM,28-Apr-2020 01:30 PM,techsummary_53034.pdf (868.33 KB),1.0,156450.0,Rohit,INR,"3,495,030",Finance,As per document attached,Tarlok Dhiman,28-Apr-2020 02:00 PM,finance_53034.pdf,BOQ Comparative Chart,Technical,As per document attached,Sushil Kumar Dhadwal,28-Apr-2020 01:01 PM,technical_53034.pdf,1.0,156375.0,Navneet Thakur,23-Mar-2020 05:13 PM,Rejected-Finance,L2,05-Jun-2020 02:19 PM,AOC,1.0,Fee/PreQual/Technical,.pdf,Cost of Tender Form (Indicated in schedule F),1.0,DD - Demand Draft,12-Mar-2020 10:00 AM,26-Mar-2020 11:30 AM,12-Mar-2020 10:00 AM,25-Mar-2020 05:00 PM,NA ,NA ,12-Mar-2020 10:00 AM,25-Mar-2020 05:00 PM,28-Apr-2020 01:30 PM,"1,500",EE Dharamshala,Dharamshala,No,Periodic maintenance of Yol Jheol Road under AMP 2020-21 PMGSY Road in District Kangra (HP),(SHProviding and Laying 30mm thick Bituminous concrete laying with paver finisher in km 4/000 to 7/000),Please refer Tender documents. ,NA ,"32,18,150",Civil Works - Roads,NA ,Tender,120.0,90.0,Dharamshala,176215.0,NA ,NA ,NA ,Dharamshala,No ,No,PWD,9921-50,2020_PWD_35988_4,Yes,Open Tender,Item Rate,Works,2.0,No,No,Offline,No,No,No,Executive Engineer,EE HPPWD DIVISION DHARAMSHALA,"55,775",No,fixed,,EE Dharamshala,Dharamshala,AOC
,,,,,,,,,,,,,,,,,,,,,,,,,,,,,,,,,,,,,,,,2.0,156359.0,pritam singh thkur,23-Mar-2020 03:02 PM,Rejected-Finance,L4,05-Jun-2020 02:19 PM,AOC,,,.pdf,Earnest Money (Indicated in schedule F),2.0,FDR - Fixed Deposit,,,,,,,,,,,,,,,,,,,,,,,,,,,,,,,,,,,,,,,,,,,,,,,,,,,,,,AOC
,,,,,,,,,,,,,,,,,,,,,,,,,,,,,,,,,,,,,,,,3.0,156450.0,Rohit,25-Mar-2020 09:59 AM,Accepted-AOC,L1,06-Jun-2020 07:05 PM,AOC,,,.pdf,Contractors registration,,,,,,,,,,,,,,,,,,,,,,,,,,,,,,,,,,,,,,,,,,,,,,,,,,,,,,,,AOC
,,,,,,,,,,,,,,,,,,,,,,,,,,,,,,,,,,,,,,,,4.0,156181.0,VP SHARMA,21-Mar-2020 12:50 PM,Rejected-Finance,L3,05-Jun-2020 02:19 PM,AOC,,,.pdf,GST registration (General rule 21),,,,,,,,,,,,,,,,,,,,,,,,,,,,,,,,,,,,,,,,,,,,,,,,,,,,,,,,AOC
,,,,,,,,,,,,,,,,,,,,,,,,,,,,,,,,,,,,,,,,,,,,,,,AOC,,,.pdf,Work done certificate (General rule 19),,,,,,,,,,,,,,,,,,,,,,,,,,,,,,,,,,,,,,,,,,,,,,,,,,,,,,,,AOC
,,,,,,,,,,,,,,,,,,,,,,,,,,,,,,,,,,,,,,,,,,,,,,,AOC,,,.pdf,Form No. 7 and 8 Duly signed on judicial paper (General rule 26.7),,,,,,,,,,,,,,,,,,,,,,,,,,,,,,,,,,,,,,,,,,,,,,,,,,,,,,,,AOC
,,,,,,,,,,,,,,,,,,,,,,,,,,,,,,,,,,,,,,,,,,,,,,,AOC,,,.pdf,List of both gazzetted or non gazzetted officers HPPWD employees related to him (General rule No.16),,,,,,,,,,,,,,,,,,,,,,,,,,,,,,,,,,,,,,,,,,,,,,,,,,,,,,,,AOC
,,,,,,,,,,,,,,,,,,,,,,,,,,,,,,,,,,,,,,,,,,,,,,,AOC,,,.pdf,Affidavit that information furnished with name of work is correct,,,,,,,,,,,,,,,,,,,,,,,,,,,,,,,,,,,,,,,,,,,,,,,,,,,,,,,,AOC
,,,,,,,,,,,,,,,,,,,,,,,,,,,,,,,,,,,,,,,,,,,,,,,AOC,,,.pdf,Employee Provident fund Number(EPF Number),,,,,,,,,,,,,,,,,,,,,,,,,,,,,,,,,,,,,,,,,,,,,,,,,,,,,,,,AOC
,,,,,,,,,,,,,,,,,,,,,,,,,,,,,,,,,,,,,,,,,,,,,,,AOC,,,.pdf,List of machinery including Hot Mix plant with proof i.e RCs etc. and staff (indicated in schedule F,,,,,,,,,,,,,,,,,,,,,,,,,,,,,,,,,,,,,,,,,,,,,,,,,,,,,,,,AOC
,,,,,,,,,,,,,,,,,,,,,,,,,,,,,,,,,,,,,,,,,,,,,,,AOC,2.0,Finance,.xls,BOQ,,,,,,,,,,,,,,,,,,,,,,,,,,,,,,,,,,,,,,,,,,,,,,,,,,,,,,,,AOC
