Committee Chairperson/Co-ordinator Name :,Committee Chairperson/Co-ordinator Type :,Committee Members :,Updated By :,Updated on :,Document :,Type :,Summary :,Updated By :.1,Updated On :,Document :.1,BOQ Comparative Chart :,Contract Date :,Contract Value :,Work Completion Period in days :,Updated By :.2,Updated on :.1,AOC document :,AOC Description :,S.No,Bid Number,Bidder Name,Submitted Date,Status,Remarks,Status Updated On,S.No.1,Bid Number.1,Bidder Name.1,Awarded Currency,Awarded Value,Type :.1,Summary :.1,Updated By :.3,Updated On :.1,Document :.2,Committee Chairperson/Co-ordinator Name :.1,Committee Chairperson/Co-ordinator Type :.1,Committee Members :.1,Updated By :.4,Updated On :.2,Financial Bid Opening Date:,Document :.3,Organisation Chain :,Tender ID :,Tender Ref No :,Tender Title :,Tender Stage,Cover No,Cover,Document Type,Description,S.No,Instrument Type,Publish Date,Bid Opening Date,Document Download / Sale Start Date,Document Download / Sale End Date,Clarification Start Date,Clarification End Date,Bid Submission Start Date,Bid Submission End Date,Financial Bid Opening Date,Organisation Chain,Tender Reference Number,Tender ID,Withdrawal Allowed,Tender Type,Form of contract,Tender Category,No. of Covers,General Technical Evaluation Allowed,ItemWise Technical Evaluation Allowed,Payment Mode,Is Multi Currency Allowed For BOQ,Is Multi Currency Allowed For Fee,Allow Two Stage Bidding,Tender Fee in ₹,Fee Payable To,Fee Payable At,Tender Fee Exemption Allowed,EMD Amount in ₹,EMD Exemption Allowed,EMD Fee Type,EMD Percentage,EMD Payable To,EMD Payable At,Name,Address,Title,Work Description,Pre Qualification Details,Independent External Monitor/Remarks,Tender Value in ₹,Product Category,Sub category,Contract Type,Bid Validity(Days),Period Of Work(Days),Location,Pincode,Pre Bid Meeting Place,Pre Bid Meeting Address,Pre Bid Meeting Date,Bid Opening Place,Should Allow NDA Tender,Allow Preferential Bidder,Tender Stage
Add. Commissioner,Internal,"Executive Engineer, Dy. Controller (FandA), Junior Engineer, Asstt. Draughtsman",Balbir Chadda,02-Sep-2021 04:01 PM,finsummary_65147.pdf (101.40 KB),Finance,"Add. Commissioner, Executive Engineer, Dy. Controller (FandA), Junior Engineer, Asstt. Draughtsman",Balbir Chadda,17-Mar-2021 12:19 PM,finance_65147.pdf,BOQ Comparative Chart,30-Sep-2021,"INR 133,340",90.0,Balbir Chadda,30-Sep-2021 01:38 PM,42.pdf (1596.00 KB),Sh. Mitul Shukla VPO Dari Tehsil Dhramshala Distt. Kangra,1.0,196298.0,mitul shukla,29-Jan-2021 04:35 PM,Accepted-AOC,Due to lowest bidder,30-Sep-2021 01:38 PM,1.0,196298.0,mitul shukla,INR,"200,000",Technical,"Add. Commissioner, Executive Engineer, Dy. Controller (FandA), Junior Engineer, Asstt. Draughtsman",Balbir Chadda,26-Feb-2021 01:39 PM,technical_65147.pdf,Add. Commissioner,Internal,"Executive Engineer, Dy. Controller (FandA), Junior Engineer, Asstt. Draughtsman",Balbir Chadda,26-Feb-2021 02:49 PM,26-Feb-2021 03:00 PM,techsummary_65147.pdf (101.40 KB),Directorate of Urban Development||Urban Development - UDDHP||Municipal Corporation Dharamshala,2021_UDDHP_43694_42,5621-26 DMC,C/O R/wall to protect the street /level at Dari Ward No. 13,AOC,1.0,Fee/PreQual/Technical,.pdf,Cost of Tender Form (Indicated in schedule F),1.0,DD - Demand Draft,19-Jan-2021 05:00 PM,03-Feb-2021 11:30 AM,19-Jan-2021 05:00 PM,03-Feb-2021 11:00 AM,NA ,NA ,19-Jan-2021 05:00 PM,03-Feb-2021 11:00 AM,26-Feb-2021 03:00 PM,Directorate of Urban Development||Urban Development - UDDHP||Municipal Corporation Dharamshala,5621-26 DMC,2021_UDDHP_43694_42,Yes,Open Tender,Item Rate,Works,2.0,No,No,Offline,No,No,No,350.0,Comm. DMC,Dharamshala,No,"2,700",No,fixed,,Comm. DMC,Dharamshala,Executive Engineer,Executive Engineer DMC Dharamshala,C/O R/wall to protect the street /level at Dari Ward No. 13,C/O R/wall to protect the street /level at Dari Ward No. 13,Please refer tender document ,NA ,,Civil Works,NA ,Tender,120.0,90.0,Dharamshala,176215.0,NA ,NA ,NA ,Dharamshala,No ,No,AOC
,,,,,,,,,,,,,,,,,,,2.0,196128.0,M/s Ashish Kapoor,28-Jan-2021 04:16 PM,Rejected-Finance,Due to higher bidder,02-Sep-2021 04:01 PM,,,,,,,,,,,,,,,,,,,,,,AOC,,,.pdf,Earnest Money (Indicated in schedule F),2.0,FDR - Fixed Deposit,,,,,,,,,,,,,,,,,,,,,,,,,,,,,,,,,,,,,,,,,,,,,,,,,,,,,,AOC
,,,,,,,,,,,,,,,,,,,,,,,,,,,,,,,,,,,,,,,,,,,,,,,AOC,,,.pdf,Contractors registration,,,,,,,,,,,,,,,,,,,,,,,,,,,,,,,,,,,,,,,,,,,,,,,,,,,,,,,,AOC
,,,,,,,,,,,,,,,,,,,,,,,,,,,,,,,,,,,,,,,,,,,,,,,AOC,,,.pdf,GST registration (General rule 21),,,,,,,,,,,,,,,,,,,,,,,,,,,,,,,,,,,,,,,,,,,,,,,,,,,,,,,,AOC
,,,,,,,,,,,,,,,,,,,,,,,,,,,,,,,,,,,,,,,,,,,,,,,AOC,,,.pdf,Employee Provident fund Number(EPF Number),,,,,,,,,,,,,,,,,,,,,,,,,,,,,,,,,,,,,,,,,,,,,,,,,,,,,,,,AOC
,,,,,,,,,,,,,,,,,,,,,,,,,,,,,,,,,,,,,,,,,,,,,,,AOC,,,.pdf,List of both gazzetted or non gazzetted officers HPPWD employees related to him (General rule No.16),,,,,,,,,,,,,,,,,,,,,,,,,,,,,,,,,,,,,,,,,,,,,,,,,,,,,,,,AOC
,,,,,,,,,,,,,,,,,,,,,,,,,,,,,,,,,,,,,,,,,,,,,,,AOC,,,.pdf,Form No. 7 and 8 Duly signed on judicial paper (General rule 26.7),,,,,,,,,,,,,,,,,,,,,,,,,,,,,,,,,,,,,,,,,,,,,,,,,,,,,,,,AOC
,,,,,,,,,,,,,,,,,,,,,,,,,,,,,,,,,,,,,,,,,,,,,,,AOC,,,.pdf,An affidavit that information furnished is correct,,,,,,,,,,,,,,,,,,,,,,,,,,,,,,,,,,,,,,,,,,,,,,,,,,,,,,,,AOC
,,,,,,,,,,,,,,,,,,,,,,,,,,,,,,,,,,,,,,,,,,,,,,,AOC,2.0,Finance,.xls,BOQ,,,,,,,,,,,,,,,,,,,,,,,,,,,,,,,,,,,,,,,,,,,,,,,,,,,,,,,,AOC
