Name,Address,Publish Date,Bid Opening Date,Document Download / Sale Start Date,Document Download / Sale End Date,Clarification Start Date,Clarification End Date,Bid Submission Start Date,Bid Submission End Date,Financial Bid Opening Date,Title,Work Description,Pre Qualification Details,Independent External Monitor/Remarks,Tender Value in ₹,Product Category,Sub category,Contract Type,Bid Validity(Days),Period Of Work(Days),Location,Pincode,Pre Bid Meeting Place,Pre Bid Meeting Address,Pre Bid Meeting Date,Bid Opening Place,Should Allow NDA Tender,Allow Preferential Bidder,Cover No,Cover,Document Type,Description,EMD Amount in ₹,EMD Exemption Allowed,EMD Fee Type,EMD Percentage,EMD Payable To,EMD Payable At,Tender Fee in ₹,Fee Payable To,Fee Payable At,Tender Fee Exemption Allowed,Organisation Chain,Tender Reference Number,Tender ID,Withdrawal Allowed,Tender Type,Form of contract,Tender Category,No. of Covers,General Technical Evaluation Allowed,ItemWise Technical Evaluation Allowed,Payment Mode,Is Multi Currency Allowed For BOQ,Is Multi Currency Allowed For Fee,Allow Two Stage Bidding,S.No,Instrument Type,Tender Stage,Type :,Summary :,Updated By :,Updated On :,Document :,Organisation Chain :,Tender ID :,Tender Ref No :,Tender Title :,Committee Chairperson/Co-ordinator Name :,Committee Chairperson/Co-ordinator Type :,Committee Members :,Updated By :.1,Updated On :.1,Financial Bid Opening Date:,Document :.1,S.No,Bid Number,Bidder Name,Awarded Currency,Awarded Value,S.No.1,Bid Number.1,Bidder Name.1,Submitted Date,Status,Remarks,Status Updated On,Contract Date :,Contract Value :,Work Completion Period in days :,Updated By :.2,Updated on :,AOC document :,AOC Description :,Committee Chairperson/Co-ordinator Name :.1,Committee Chairperson/Co-ordinator Type :.1,Committee Members :.1,Updated By :.3,Updated on :.1,Document :.2,Type :.1,Summary :.1,Updated By :.4,Updated On :.2,Document :.3,BOQ Comparative Chart :,Tender Stage
Executive Engineer,Executive Engineer DMC Dharamshala,19-Jan-2021 05:00 PM,03-Feb-2021 11:30 AM,19-Jan-2021 05:00 PM,03-Feb-2021 11:00 AM,NA ,NA ,19-Jan-2021 05:00 PM,03-Feb-2021 11:00 AM,26-Feb-2021 03:00 PM,C/O Pucca path alongwith drain from Punnu Ram land to Partap Singh house Ward No. 12,C/O Pucca path alongwith drain from Punnu Ram land to Partap Singh house Ward No. 12,Please refer tender document ,NA ,,Civil Works,NA ,Tender,120.0,90.0,Dharamshala,176215.0,NA ,NA ,NA ,Dharamshala,No ,No,1.0,Fee/PreQual/Technical,.pdf,Cost of Tender Form (Indicated in schedule F),"6,000",No,fixed,,Comm. DMC Dharamshala,Dharamshala,350.0,Comm. DMC,Dharamshala,No,Directorate of Urban Development||Urban Development - UDDHP||Municipal Corporation Dharamshala,5621-26 DMC,2021_UDDHP_43694_48,Yes,Open Tender,Item Rate,Works,2.0,No,No,Offline,No,No,No,1.0,DD - Demand Draft,AOC,Technical,"Add. Commissioner, Executive Engineer, Dy. Controller (FandA), Junior Engineer, Asstt. Draughtsman",Balbir Chadda,26-Feb-2021 01:42 PM,technical_65154.pdf,Directorate of Urban Development||Urban Development - UDDHP||Municipal Corporation Dharamshala,2021_UDDHP_43694_48,5621-26 DMC,C/O Pucca path alongwith drain from Punnu Ram land to Partap Singh house Ward No. 12,Add. Commissioner,Internal,"Executive Engineer, Dy. Controller (FandA), Junior Engineer, Asstt. Draughtsman",Balbir Chadda,26-Feb-2021 02:43 PM,26-Feb-2021 03:00 PM,techsummary_65154.pdf (205.58 KB),1.0,197064.0,shiv charan,INR,"412,303",1.0,196712.0,desh raj,01-Feb-2021 05:07 PM,Rejected-Finance,Due to higher bidder,02-Sep-2021 03:38 PM,30-Sep-2021,"INR 300,000",90.0,Balbir Chadda,30-Sep-2021 01:43 PM,48.pdf (1564.00 KB),Sh. Shiv Charan VPO Tau Tehsil Dharamshala Distt. Kangra,Add. Commissioner,Internal,"Executive Engineer, Dy. Controller (FandA), Junior Engineer, Asstt. Draughtsman",Balbir Chadda,02-Sep-2021 03:38 PM,finsummary_65154.pdf (205.58 KB),Finance,"Add. Commissioner, Executive Engineer, Dy. Controller (FandA), Junior Engineer, Asstt. Draughtsman",Balbir Chadda,17-Mar-2021 12:21 PM,finance_65154.pdf,BOQ Comparative Chart,AOC
,,,,,,,,,,,,,,,,,,,,,,,,,,,,,,,.pdf,Earnest Money (Indicated in schedule F),,,,,,,,,,,,,,,,,,,,,,,,,2.0,FDR - Fixed Deposit,AOC,,,,,,,,,,,,,,,,,,,,,,2.0,196725.0,harbans kumar,01-Feb-2021 06:01 PM,Rejected-Finance,Due to higher bidder,02-Sep-2021 03:38 PM,,,,,,,,,,,,,,,,,,,,AOC
,,,,,,,,,,,,,,,,,,,,,,,,,,,,,,,.pdf,Contractors registration,,,,,,,,,,,,,,,,,,,,,,,,,,,AOC,,,,,,,,,,,,,,,,,,,,,,3.0,197025.0,Kapil Sharma,02-Feb-2021 10:31 PM,Rejected-Finance,Due to higher bidder,02-Sep-2021 03:38 PM,,,,,,,,,,,,,,,,,,,,AOC
,,,,,,,,,,,,,,,,,,,,,,,,,,,,,,,.pdf,GST registration (General rule 21),,,,,,,,,,,,,,,,,,,,,,,,,,,AOC,,,,,,,,,,,,,,,,,,,,,,4.0,196603.0,Rajeev Kumar,31-Jan-2021 07:49 PM,Rejected-Finance,Due to higher bidder,02-Sep-2021 03:38 PM,,,,,,,,,,,,,,,,,,,,AOC
,,,,,,,,,,,,,,,,,,,,,,,,,,,,,,,.pdf,Employee Provident fund Number(EPF Number),,,,,,,,,,,,,,,,,,,,,,,,,,,AOC,,,,,,,,,,,,,,,,,,,,,,5.0,196605.0,rajinder singh,31-Jan-2021 08:05 PM,Rejected-Finance,Due to higher bidder,02-Sep-2021 03:38 PM,,,,,,,,,,,,,,,,,,,,AOC
,,,,,,,,,,,,,,,,,,,,,,,,,,,,,,,.pdf,List of both gazzetted or non gazzetted officers HPPWD employees related to him (General rule No.16),,,,,,,,,,,,,,,,,,,,,,,,,,,AOC,,,,,,,,,,,,,,,,,,,,,,6.0,197064.0,shiv charan,03-Feb-2021 10:38 AM,Accepted-AOC,Due to lowest bidder,30-Sep-2021 01:43 PM,,,,,,,,,,,,,,,,,,,,AOC
,,,,,,,,,,,,,,,,,,,,,,,,,,,,,,,.pdf,Form No. 7 and 8 Duly signed on judicial paper (General rule 26.7),,,,,,,,,,,,,,,,,,,,,,,,,,,AOC,,,,,,,,,,,,,,,,,,,,,,,,,,,,,,,,,,,,,,,,,,,,,,,,AOC
,,,,,,,,,,,,,,,,,,,,,,,,,,,,,,,.pdf,An affidavit that information furnished is correct,,,,,,,,,,,,,,,,,,,,,,,,,,,AOC,,,,,,,,,,,,,,,,,,,,,,,,,,,,,,,,,,,,,,,,,,,,,,,,AOC
,,,,,,,,,,,,,,,,,,,,,,,,,,,,,2.0,Finance,.xls,BOQ,,,,,,,,,,,,,,,,,,,,,,,,,,,AOC,,,,,,,,,,,,,,,,,,,,,,,,,,,,,,,,,,,,,,,,,,,,,,,,AOC
