Name,Address,Publish Date,Bid Opening Date,Document Download / Sale Start Date,Document Download / Sale End Date,Clarification Start Date,Clarification End Date,Bid Submission Start Date,Bid Submission End Date,Financial Bid Opening Date,Cover No,Cover,Document Type,Description,Tender Fee in ₹,Fee Payable To,Fee Payable At,Tender Fee Exemption Allowed,Title,Work Description,Pre Qualification Details,Independent External Monitor/Remarks,Tender Value in ₹,Product Category,Sub category,Contract Type,Bid Validity(Days),Period Of Work(Days),Location,Pincode,Pre Bid Meeting Place,Pre Bid Meeting Address,Pre Bid Meeting Date,Bid Opening Place,Should Allow NDA Tender,Allow Preferential Bidder,Organisation Chain,Tender Reference Number,Tender ID,Withdrawal Allowed,Tender Type,Form of contract,Tender Category,No. of Covers,General Technical Evaluation Allowed,ItemWise Technical Evaluation Allowed,Payment Mode,Is Multi Currency Allowed For BOQ,Is Multi Currency Allowed For Fee,Allow Two Stage Bidding,EMD Amount in ₹,EMD Exemption Allowed,EMD Fee Type,EMD Percentage,EMD Payable To,EMD Payable At,S.No,Instrument Type,Tender Stage,Type :,Summary :,Updated By :,Updated On :,Document :,Organisation Chain :,Tender ID :,Tender Ref No :,Tender Title :,Committee Chairperson/Co-ordinator Name :,Committee Chairperson/Co-ordinator Type :,Committee Members :,Updated By :.1,Updated On :.1,Financial Bid Opening Date:,Document :.1,S.No,Bid Number,Bidder Name,Awarded Currency,Awarded Value,S.No.1,Bid Number.1,Bidder Name.1,Submitted Date,Status,Remarks,Status Updated On,Contract Date :,Contract Value :,Work Completion Period in days :,Updated By :.2,Updated on :,AOC document :,AOC Description :,Committee Chairperson/Co-ordinator Name :.1,Committee Chairperson/Co-ordinator Type :.1,Committee Members :.1,Updated By :.3,Updated on :.1,Document :.2,Type :.1,Summary :.1,Updated By :.4,Updated On :.2,Document :.3,BOQ Comparative Chart :,Tender Stage
Executive Engineer,Executive Engineer DMC Dharamshala,09-Mar-2021 06:00 PM,23-Mar-2021 11:30 AM,09-Mar-2021 06:00 PM,23-Mar-2021 11:00 AM,NA ,NA ,09-Mar-2021 06:00 PM,23-Mar-2021 11:00 AM,09-Apr-2021 03:00 PM,1.0,Fee/PreQual/Technical,.pdf,Cost of Tender Form (Indicated in schedule F),350.0,Comm. DMC,Dharamshala,No,C/O puli and repair of pucca path from Jiddi Ram house to Nallah Kand Mohal,C/O puli and repair of pucca path from Jiddi Ram house to Nallah Kand Mohal,Please refer tender document ,NA ,,Civil Works,NA ,Tender,120.0,90.0,Dharamshala,176215.0,NA ,NA ,NA ,Dharamshala,No ,No,Directorate of Urban Development||Urban Development - UDDHP||Municipal Corporation Dharamshala,6717-22 DMC,2021_UDDHP_45139_35,Yes,Open Tender,Item Rate,Works,2.0,No,No,Offline,No,No,No,"4,700",No,fixed,,Comm. DMC,Dharamshala,1.0,DD - Demand Draft,AOC,Technical,"Add. Commissioner, Executive Engineer, Dy. Controller (FandA), Junior Engineer, Asstt. Draughtsman",Balbir Chadda,09-Apr-2021 02:10 PM,technical_68023.pdf,Directorate of Urban Development||Urban Development - UDDHP||Municipal Corporation Dharamshala,2021_UDDHP_45139_35,6717-22 DMC,C/O puli and repair of pucca path from Jiddi Ram house to Nallah Kand Mohal,Add. Commissioner,Internal,"Executive Engineer, Dy. Controller (FandA), Junior Engineer, Asstt. Draughtsman",Balbir Chadda,09-Apr-2021 02:51 PM,09-Apr-2021 03:00 PM,techsummary_68023.pdf (104.85 KB),1.0,205240.0,Rajeev Kumar,INR,"347,286",1.0,205240.0,Rajeev Kumar,22-Mar-2021 11:48 PM,Accepted-AOC,Due to lowest bidder,24-Sep-2021 03:53 PM,24-Sep-2021,"INR 233,340",90.0,Balbir Chadda,24-Sep-2021 03:53 PM,35.pdf (1684.00 KB),Sh. Rajeev Kumar VPO Sakoh Tehsil Dharamshala Distt. Kangra,Add. Commissioner,Internal,"Executive Engineer, Dy. Controller (FandA), Junior Engineer, Asstt. Draughtsman",Balbir Chadda,05-Jul-2021 02:29 PM,finsummary_68023.pdf (104.85 KB),Finance,"Add. Commissioner, Executive Engineer, Dy. Controller (FandA), Junior Engineer, Asstt. Draughtsman",Balbir Chadda,05-Jul-2021 02:11 PM,finance_68023.pdf,BOQ Comparative Chart,AOC
,,,,,,,,,,,,,.pdf,Earnest Money (Indicated in schedule F),,,,,,,,,,,,,,,,,,,,,,,,,,,,,,,,,,,,,,,,,,,2.0,FDR - Fixed Deposit,AOC,,,,,,,,,,,,,,,,,2.0,205308.0,Ram Pal,INR,"397,084",2.0,205308.0,Ram Pal,23-Mar-2021 10:48 AM,Accepted-AOC,Reject due to higher bidder,24-Sep-2021 03:53 PM,,,,,,,,,,,,,,,,,,,,AOC
,,,,,,,,,,,,,.pdf,Contractors registration,,,,,,,,,,,,,,,,,,,,,,,,,,,,,,,,,,,,,,,,,,,,,AOC,,,,,,,,,,,,,,,,,,,,,,,,,,,,,,,,,,,,,,,,,,,,,,,,AOC
,,,,,,,,,,,,,.pdf,GST registration (General rule 21),,,,,,,,,,,,,,,,,,,,,,,,,,,,,,,,,,,,,,,,,,,,,AOC,,,,,,,,,,,,,,,,,,,,,,,,,,,,,,,,,,,,,,,,,,,,,,,,AOC
,,,,,,,,,,,,,.pdf,Employee Provident fund Number(EPF Number),,,,,,,,,,,,,,,,,,,,,,,,,,,,,,,,,,,,,,,,,,,,,AOC,,,,,,,,,,,,,,,,,,,,,,,,,,,,,,,,,,,,,,,,,,,,,,,,AOC
,,,,,,,,,,,,,.pdf,Form No. 7 and 8 Duly signed on judicial paper (General rule 26.7),,,,,,,,,,,,,,,,,,,,,,,,,,,,,,,,,,,,,,,,,,,,,AOC,,,,,,,,,,,,,,,,,,,,,,,,,,,,,,,,,,,,,,,,,,,,,,,,AOC
,,,,,,,,,,,,,.pdf,List of both gazzetted or non gazzetted officers HPPWD employees related to him (General rule No.16),,,,,,,,,,,,,,,,,,,,,,,,,,,,,,,,,,,,,,,,,,,,,AOC,,,,,,,,,,,,,,,,,,,,,,,,,,,,,,,,,,,,,,,,,,,,,,,,AOC
,,,,,,,,,,,,,.pdf,An affidavit that information furnished is correct,,,,,,,,,,,,,,,,,,,,,,,,,,,,,,,,,,,,,,,,,,,,,AOC,,,,,,,,,,,,,,,,,,,,,,,,,,,,,,,,,,,,,,,,,,,,,,,,AOC
,,,,,,,,,,,2.0,Finance,.xls,BOQ,,,,,,,,,,,,,,,,,,,,,,,,,,,,,,,,,,,,,,,,,,,,,AOC,,,,,,,,,,,,,,,,,,,,,,,,,,,,,,,,,,,,,,,,,,,,,,,,AOC
