Committee Chairperson/Co-ordinator Name :,Committee Chairperson/Co-ordinator Type :,Committee Members :,Updated By :,Updated on :,Document :,Type :,Summary :,Updated By :.1,Updated On :,Document :.1,Committee Chairperson/Co-ordinator Name :.1,Committee Chairperson/Co-ordinator Type :.1,Committee Members :.1,Updated By :.2,Updated On :.1,Financial Bid Opening Date:,Document :.2,Organisation Chain :,Tender ID :,Tender Ref No :,Tender Title :,S.No,Bid Number,Bidder Name,Submitted Date,Status,Remarks,Status Updated On,S.No.1,Bid Number.1,Bidder Name.1,Awarded Currency,Awarded Value,Type :.1,Summary :.1,Updated By :.3,Updated On :.2,Document :.3,BOQ Comparative Chart :,Contract Date :,Contract Value :,Work Completion Period in days :,Updated By :.4,Updated on :.1,AOC document :,Tender Stage,Tender Fee in ₹,Fee Payable To,Fee Payable At,Tender Fee Exemption Allowed,EMD Amount in ₹,EMD through BG/ST or EMD Exemption Allowed,EMD Fee Type,EMD Percentage,EMD Payable To,EMD Payable At,S.No,Instrument Type,Title,Work Description,Pre Qualification Details,Independent External Monitor/Remarks,Tender Value in ₹,Product Category,Sub category,Contract Type,Bid Validity(Days),Period Of Work(Days),Location,Pincode,Pre Bid Meeting Place,Pre Bid Meeting Address,Pre Bid Meeting Date,Bid Opening Place,Should Allow NDA Tender,Allow Preferential Bidder,Name,Address,Publish Date,Bid Opening Date,Document Download / Sale Start Date,Document Download / Sale End Date,Clarification Start Date,Clarification End Date,Bid Submission Start Date,Bid Submission End Date,Financial Bid Opening Date,Organisation Chain,Tender Reference Number,Tender ID,Withdrawal Allowed,Tender Type,Form of contract,Tender Category,No. of Covers,General Technical Evaluation Allowed,ItemWise Technical Evaluation Allowed,Payment Mode,Is Multi Currency Allowed For BOQ,Is Multi Currency Allowed For Fee,Allow Two Stage Bidding,Cover No,Cover,Document Type,Description,Tender Stage
"Dr. AP RAO, IPS",Internal,,Lohit Goswami,28-Apr-2018 09:10 AM,finsummary_7683.pdf (202.79 KB),Technical,Technical Bid Opening Summary,Lohit Goswami,19-Jan-2018 03:18 PM,,"Dr. A. P. Rout, IPS",Internal,,Lohit Goswami,19-Jan-2018 03:19 PM,20-Jan-2018 10:30 AM,techsummary_7683.pdf (610.10 KB),Director- Fire and Emergency Services-Assam,2018_FESA_4849_3,FG/410/2017-2018/72,"Construction of RCC (three) storied Fire Station Building, RCC 5 (five) storied Drill cum Hose Drying Tower, under Ground Reservoir (1.00 lakh Ltr. Capacity) Boundary Wall and Security Fencing with Heavy Duty Iron Gate etc. at Nilambazar",1.0,25909.0,Faruk Ahmed Mazumder,16-Jan-2018 01:43 PM,Accepted-AOC,Accepted,28-Apr-2018 09:41 AM,1.0,25909.0,Faruk Ahmed Mazumder,INR,16136753.63,Finance,Financial Bid Opening Summary,Lohit Goswami,24-Apr-2018 07:14 PM,,BOQ Comparative Chart,28-Apr-2018,INR 19836939,730.0,Lohit Goswami,28-Apr-2018 09:41 AM,nilambazar.pdf (577.00 KB),AOC,"4,000",DGP-cum-DF and ES Assam,Guwahati,No,"3,96,800",Yes,fixed,,DGP-cum-DF and ES Assam,Guwahati,1.0,DD - Demand Draft,"Construction of RCC (three) storied Fire Station Building, RCC 5 (five) storied Drill cum Hose Drying Tower, under Ground Reservoir (1.00 lakh Ltr. Capacity) Boundary Wall and Security Fencing with Heavy Duty Iron Gate etc. at Nilambazar","Construction of RCC (three) storied Fire Station Building, RCC 5 (five) storied Drill cum Hose Drying Tower, under Ground Reservoir (1.00 lakh Ltr. Capacity) Boundary Wall and Security Fencing with Heavy Duty Iron Gate etc. at Nilambazar",Please refer Tender documents. ,NA ,"1,98,36,939",Civil Works - Building,NA ,Tender,180.0,730.0,Nilambazar,781001.0,"Director of fire Emergency Services,panbazar,ghy ","o o Special Director General-cum-Director of fire Emergency Services,panbazar,ghy1 ",10-Jan-2018 11:00 AM ,"Director of fire Emergency Services,panbazar,ghy",No ,No,"Director of fire Emergency Services,assam",o/o Special Director General-cum-Director of fire Emergency,08-Jan-2018 05:00 PM,18-Jan-2018 11:00 AM,09-Jan-2018 11:00 AM,16-Jan-2018 05:00 PM,NA ,NA ,09-Jan-2018 11:00 AM,16-Jan-2018 05:00 PM,20-Jan-2018 10:30 AM,Director- Fire and Emergency Services-Assam,FG/410/2017-2018/72,2018_FESA_4849_3,Yes,Open Tender,Works,Works,2.0,No,No,Offline,No,No,No,1.0,Fee/PreQual/Technical,.pdf,Tender FEE and EMD,AOC
,,,,,,,,,,,,,,,,,,,,,,2.0,25939.0,M/S NORTH EASTERN TRADERS,16-Jan-2018 04:59 PM,Rejected-AOC,REJECTED,28-Apr-2018 09:41 AM,,,,,,,,,,,,,,,,,,AOC,,,,,,,,,,,2.0,BC - Bankers Cheque,,,,,,,,,,,,,,,,,,,,,,,,,,,,,,,,,,,,,,,,,,,,,,.pdf,Tender Document,AOC
,,,,,,,,,,,,,,,,,,,,,,3.0,25660.0,Sajal Kr Acharjee,11-Jan-2018 04:12 PM,Rejected-AOC,REJECTED,28-Apr-2018 09:41 AM,,,,,,,,,,,,,,,,,,AOC,,,,,,,,,,,3.0,BG - Bank Guarantee Irrevocable,,,,,,,,,,,,,,,,,,,,,,,,,,,,,,,,,,,,,,,,,,,,,,.pdf,Supporting Document as per the Tender Document,AOC
,,,,,,,,,,,,,,,,,,,,,,,,,,,,,,,,,,,,,,,,,,,,,,AOC,,,,,,,,,,,4.0,FDR - Fixed Deposit Receipt,,,,,,,,,,,,,,,,,,,,,,,,,,,,,,,,,,,,,,,,,,,,2.0,Finance,.xls,Price Bid,AOC
,,,,,,,,,,,,,,,,,,,,,,,,,,,,,,,,,,,,,,,,,,,,,,AOC,,,,,,,,,,,,,,,,,,,,,,,,,,,,,,,,,,,,,,,,,,,,,,,,,,,,,,,,,,.pdf,FOB,AOC
