S.No,Bid Number,Bidder Name,Awarded Currency,Awarded Value,Type :,Summary :,Updated By :,Updated On :,Document :,BOQ Comparative Chart :,Type :.1,Summary :.1,Updated By :.1,Updated On :.1,Document :.1,S.No.1,Bid Number.1,Bidder Name.1,Submitted Date,Status,Remarks,Status Updated On,Contract Date :,Contract Value :,Work Completion Period in days :,Updated By :.2,Updated on :,AOC document :,AOC Description :,Committee Chairperson/Co-ordinator Name :,Committee Chairperson/Co-ordinator Type :,Committee Members :,Updated By :.3,Updated on :.1,Document :.2,Committee Chairperson/Co-ordinator Name :.1,Committee Chairperson/Co-ordinator Type :.1,Committee Members :.1,Updated By :.4,Updated On :.2,Financial Bid Opening Date:,Document :.3,Organisation Chain :,Tender ID :,Tender Ref No :,Tender Title :,Publish Date,Bid Opening Date,Document Download / Sale Start Date,Document Download / Sale End Date,Clarification Start Date,Clarification End Date,Bid Submission Start Date,Bid Submission End Date,Financial Bid Opening Date,Tender Fee in ₹,Fee Payable To,Fee Payable At,Tender Fee Exemption Allowed,Name,Address,EMD Amount in ₹,EMD Exemption Allowed,EMD Fee Type,EMD Percentage,EMD Payable To,EMD Payable At,Cover No,Cover,Document Type,Description,Organisation Chain,Tender Reference Number,Tender ID,Withdrawal Allowed,Tender Type,Form of contract,Tender Category,No. of Covers,General Technical Evaluation Allowed,ItemWise Technical Evaluation Allowed,Payment Mode,Is Multi Currency Allowed For BOQ,Is Multi Currency Allowed For Fee,Allow Two Stage Bidding,S.No.2,Bank Name,Title,Work Description,Pre Qualification Details,Independent External Monitor/Remarks,Tender Value in ₹,Product Category,Sub category,Contract Type,Bid Validity(Days),Period Of Work(Days),Location,Pincode,Pre Bid Meeting Place,Pre Bid Meeting Address,Pre Bid Meeting Date,Bid Opening Place,Should Allow NDA Tender,Allow Preferential Bidder
1.0,367173.0,CHET RAM,INR,"533,111",Finance,sumary,Parbarser Singh,24-Aug-2023 11:18 AM,finance_115818.pdf,BOQ Comparative Chart,Technical,sumary,Raj Kumar,23-Aug-2023 03:31 PM,technical_115818.pdf,1.0,367173.0,CHET RAM,19-Aug-2023 02:21 PM,Accepted-AOC,AOC done,13-Dec-2023,15-Nov-2023,"INR 772,624",90.0,Parbarser Singh,13-Dec-2023 03:00 PM,280.pdf (214.00 KB),AOC,Executive Engineer,Internal,All Committee Members,Parbarser Singh,24-Aug-2023 01:24 PM,finsummary_115818.pdf (82.31 KB),Executive Engineer,Internal,all committee Members,Raj Kumar,23-Aug-2023 03:33 PM,23-Aug-2023 03:35 PM,techsummary_115818.pdf (127.38 KB),PWD,2023_PWD_77525_1,NIT No. 4658-62 dated 8-08-2023,C/O link road from SKRN road to Ambedkar Bhawan to Village Gabar Brahmana to mahadev jandu road to waha road km 0/0 to 3/00 (SH F.C in km 0/600 to 0/800 and ROFD in km 0/800 to 1/300 and C/O 2 Nos. NP 2 pipe 900mm dia HPC at Rd 0/260 and 0/400 along,11-Aug-2023 05:05 PM,21-Aug-2023 11:00 AM,11-Aug-2023 05:10 PM,21-Aug-2023 10:00 AM,NA ,NA ,11-Aug-2023 05:15 PM,21-Aug-2023 10:00 AM,23-Aug-2023 03:35 PM,350.0,Nil,Nil,No,Execitive Engineer,Nalagarh,"15,500",No,fixed,,Nil,Nil,1.0,Fee/PreQual/Technical,.pdf,"Receipt of Cost of Tender, EMD and other terms and conditions as per indicated in SBD",PWD,NIT No. 4658-62 dated 8-08-2023,2023_PWD_77525_1,Yes,Open Tender,Percentage,Works,2.0,No,No,Online,No,No,No,1.0,ICICI BANK,C/O link road from SKRN road to Ambedkar Bhawan to Village Gabar Brahmana to mahadev jandu road to waha road km 0/0 to 3/00 (SH F.C in km 0/600 to 0/800 and ROFD in km 0/800 to 1/300 and C/O 2 Nos. NP 2 pipe 900mm dia HPC at Rd 0/260 and 0/400 along,.,NA ,NA ,"7,72,625",Civil Works,NA ,Tender,75.0,90.0,Nalagarh,174101.0,NA ,NA ,NA ,EE Nalagarh,No ,No
,,,,,,,,,,,,,,,,2.0,367200.0,JITENDER KUMAR,19-Aug-2023 03:08 PM,Rejected-Finance,Due to L3 bidder,24-Aug-2023,,,,,,,,,,,,,,,,,,,,,,,,,,,,,,,,,,,,,,,,,,,,,,,,.pdf,Contractor Registration/GST/PAN/EPF and follow the other all conditions indicated in SBD,,,,,,,,,,,,,,,2.0,ICICI NEFT/RTGS,,,,,,,,,,,,,,,,,,
,,,,,,,,,,,,,,,,3.0,366744.0,VIRENDER SHARMA,17-Aug-2023 03:36 PM,Rejected-Finance,Due to l2 Bidder,24-Aug-2023,,,,,,,,,,,,,,,,,,,,,,,,,,,,,,,,,,,,,,,,,,,,,,,,.pdf,Duly filled and signed form No 7/8 General Rule and Direction,,,,,,,,,,,,,,,,,,,,,,,,,,,,,,,,,,
,,,,,,,,,,,,,,,,,,,,,,,,,,,,,,,,,,,,,,,,,,,,,,,,,,,,,,,,,,,,,,,,,,,,,,.pdf,Affidavit reg. detail of Machinery/ Tool Plant) along with document of Machinery as per contract da,,,,,,,,,,,,,,,,,,,,,,,,,,,,,,,,,,
,,,,,,,,,,,,,,,,,,,,,,,,,,,,,,,,,,,,,,,,,,,,,,,,,,,,,,,,,,,,,,,,,,,,2.0,Finance,.xls,finance,,,,,,,,,,,,,,,,,,,,,,,,,,,,,,,,,,
