Organisation Chain,Tender Reference Number,Tender ID,Withdrawal Allowed,Tender Type,Form of contract,Tender Category,No. of Covers,General Technical Evaluation Allowed,ItemWise Technical Evaluation Allowed,Payment Mode,Is Multi Currency Allowed For BOQ,Is Multi Currency Allowed For Fee,Allow Two Stage Bidding,Title,Work Description,Pre Qualification Details,Independent External Monitor/Remarks,Tender Value in ₹,Product Category,Sub category,Contract Type,Bid Validity(Days),Period Of Work(Days),Location,Pincode,Pre Bid Meeting Place,Pre Bid Meeting Address,Pre Bid Meeting Date,Bid Opening Place,Should Allow NDA Tender,Allow Preferential Bidder,S.No,Bank Name,Tender Fee in ₹,Fee Payable To,Fee Payable At,Tender Fee Exemption Allowed,Cover No,Cover,Document Type,Description,Name,Address,Publish Date,Bid Opening Date,Document Download / Sale Start Date,Document Download / Sale End Date,Clarification Start Date,Clarification End Date,Bid Submission Start Date,Bid Submission End Date,Financial Bid Opening Date,EMD Amount in ₹,EMD Exemption Allowed,EMD Fee Type,EMD Percentage,EMD Payable To,EMD Payable At,Type :,Summary :,Updated By :,Updated On :,Document :,BOQ Comparative Chart :,S.No.2,Bid Number,Bidder Name,Submitted Date,Status,Remarks,Status Updated On,Type :.1,Summary :.1,Updated By :.1,Updated On :.1,Document :.1,Committee Chairperson/Co-ordinator Name :,Committee Chairperson/Co-ordinator Type :,Committee Members :,Updated By :.2,Updated On :.2,Financial Bid Opening Date:,Document :.2,S.No.1,Bid Number.1,Bidder Name.1,Awarded Currency,Awarded Value,Contract Date :,Contract Value :,Work Completion Period in days :,Updated By :.3,Updated on :,AOC document :,AOC Description :,Organisation Chain :,Tender ID :,Tender Ref No :,Tender Title :,Committee Chairperson/Co-ordinator Name :.1,Committee Chairperson/Co-ordinator Type :.1,Committee Members :.1,Updated By :.4,Updated on :.1,Document :.3
HP SIDC Limited,Job No. 8,2023_SIDC_74859_1,Yes,Open Tender,Item Rate,Works,2.0,No,No,Online,No,No,No,Construction of type-III qtrs. at Veterinary Hospital Takoli Distt. Mandi (HP).,Construction of type-III qtrs.,Please refer Tender documents. ,NA ,"18,53,533",Civil Works - Buildings,NA ,Tender,120.0,270.0,Mandi,175121.0,NA ,NA ,NA ,HPSIDC Shimla,No ,No,1.0,ICICI BANK,"2,200",Nil,Nil,No,1.0,Fee/PreQual/Technical,.pdf,Appropriate Contractor registration (as per tender condition),Executive Engineer,HPSIDC Shimla,13-Jun-2023 11:00 AM,21-Jun-2023 11:00 AM,13-Jun-2023 11:00 AM,20-Jun-2023 05:00 PM,NA ,NA ,13-Jun-2023 11:00 AM,20-Jun-2023 05:00 PM,30-Jun-2023 11:00 AM,"37,100",No,fixed,,Nil,Nil,Finance,Financial summary,Sushant Singh Negi,03-Jul-2023 02:39 PM,finance_112155.pdf,BOQ Comparative Chart,1.0,355593.0,ANJU DEVI,20-Jun-2023 02:46 PM,Rejected-Finance,Third lowest bidder,03-Jul-2023,Technical,Tender Summary,Sushant Singh Negi,28-Jun-2023 03:23 PM,technical_112155.pdf,SE,Internal,"DM, Manager(F), AE(HQ), EE(HQ)",Sushant Singh Negi,28-Jun-2023 03:25 PM,30-Jun-2023 11:00 AM,techsummary_112155.pdf (474.67 KB),1.0,355570.0,Biri SIngh,INR,"2,662,489",16-Nov-2023,"INR 2,662,489",270.0,Sushant Singh Negi,04-Dec-2023 10:37 AM,birisinghaoc.pdf (3251.00 KB),Award letter,HP SIDC Limited,2023_SIDC_74859_1,Job No. 8,Construction of type-III qtrs. at Veterinary Hospital Takoli Distt. Mandi (HP).,SE,Internal,"DM, Manager(F), AE(HQ), EE(HQ)",Sushant Singh Negi,03-Jul-2023 02:42 PM,finsummary_112155.pdf (28.04 KB)
,,,,,,,,,,,,,,,,,,,,,,,,,,,,,,,,2.0,ICICI NEFT/RTGS,,,,,,,.pdf,Signed copy of agreement form and approved make for materials,,,,,,,,,,,,,,,,,,,,,,,,2.0,355570.0,Biri SIngh,20-Jun-2023 04:48 PM,Accepted-AOC,AOC,04-Dec-2023,,,,,,,,,,,,,,,,,,,,,,,,,,,,,,,,,,
,,,,,,,,,,,,,,,,,,,,,,,,,,,,,,,,,,,,,,,,.pdf,Affidavit that the information furnished with the bid documents is true and correct.,,,,,,,,,,,,,,,,,,,,,,,,3.0,355590.0,DALIP SINGH,20-Jun-2023 04:44 PM,Rejected-Technical,Inappropriate Contractor registration class,28-Jun-2023,,,,,,,,,,,,,,,,,,,,,,,,,,,,,,,,,,
,,,,,,,,,,,,,,,,,,,,,,,,,,,,,,,,,,,,,,,,.pdf,Affidavit that you have not more than 2 works in hand each of Rs.100 lakh or above in any department,,,,,,,,,,,,,,,,,,,,,,,,4.0,355226.0,RANDHIR JAMWAL,19-Jun-2023 09:07 AM,Rejected-Finance,Second lowest bidder,03-Jul-2023,,,,,,,,,,,,,,,,,,,,,,,,,,,,,,,,,,
,,,,,,,,,,,,,,,,,,,,,,,,,,,,,,,,,,,,,,,,.pdf,Proof copy of EPF registration No.,,,,,,,,,,,,,,,,,,,,,,,,,,,,,,,,,,,,,,,,,,,,,,,,,,,,,,,,,,,,,,,,
,,,,,,,,,,,,,,,,,,,,,,,,,,,,,,,,,,,,,,,,.pdf,Proof copy of GST registration No.,,,,,,,,,,,,,,,,,,,,,,,,,,,,,,,,,,,,,,,,,,,,,,,,,,,,,,,,,,,,,,,,
,,,,,,,,,,,,,,,,,,,,,,,,,,,,,,,,,,,,,,,,.pdf,Copy of latest ITR and pan card,,,,,,,,,,,,,,,,,,,,,,,,,,,,,,,,,,,,,,,,,,,,,,,,,,,,,,,,,,,,,,,,
,,,,,,,,,,,,,,,,,,,,,,,,,,,,,,,,,,,,,,,,.pdf,Copy of receipt of EMD and cost of form,,,,,,,,,,,,,,,,,,,,,,,,,,,,,,,,,,,,,,,,,,,,,,,,,,,,,,,,,,,,,,,,
,,,,,,,,,,,,,,,,,,,,,,,,,,,,,,,,,,,,,,2.0,Finance,.xls,BOQ,,,,,,,,,,,,,,,,,,,,,,,,,,,,,,,,,,,,,,,,,,,,,,,,,,,,,,,,,,,,,,,,
