Publish Date,Bid Opening Date,Document Download / Sale Start Date,Document Download / Sale End Date,Clarification Start Date,Clarification End Date,Bid Submission Start Date,Bid Submission End Date,Financial Bid Opening Date,Title,Work Description,Pre Qualification Details,Independent External Monitor/Remarks,Tender Value in ₹,Product Category,Sub category,Contract Type,Bid Validity(Days),Period Of Work(Days),Location,Pincode,Pre Bid Meeting Place,Pre Bid Meeting Address,Pre Bid Meeting Date,Bid Opening Place,Should Allow NDA Tender,Allow Preferential Bidder,Name,Address,Cover No,Cover,Document Type,Description,EMD Amount in ₹,EMD Exemption Allowed,EMD Fee Type,EMD Percentage,EMD Payable To,EMD Payable At,Organisation Chain,Tender Reference Number,Tender ID,Withdrawal Allowed,Tender Type,Form of contract,Tender Category,No. of Covers,General Technical Evaluation Allowed,ItemWise Technical Evaluation Allowed,Payment Mode,Is Multi Currency Allowed For BOQ,Is Multi Currency Allowed For Fee,Allow Two Stage Bidding,Tender Fee in ₹,Fee Payable To,Fee Payable At,Tender Fee Exemption Allowed,S.No,Bank Name,Contract Date :,Contract Value :,Work Completion Period in days :,Updated By :,Updated on :,AOC document :,AOC Description :,Type :,Summary :,Updated By :.1,Updated On :,Document :,BOQ Comparative Chart :,Type :.1,Summary :.1,Updated By :.2,Updated On :.1,Document :.1,Committee Chairperson/Co-ordinator Name :,Committee Chairperson/Co-ordinator Type :,Committee Members :,Updated By :.3,Updated On :.2,Financial Bid Opening Date:,Document :.2,S.No.2,Bid Number,Bidder Name,Submitted Date,Status,Remarks,Status Updated On,Committee Chairperson/Co-ordinator Name :.1,Committee Chairperson/Co-ordinator Type :.1,Committee Members :.1,Updated By :.4,Updated on :.1,Document :.3,Organisation Chain :,Tender ID :,Tender Ref No :,Tender Title :,S.No.1,Bid Number.1,Bidder Name.1,Awarded Currency,Awarded Value
25-May-2022 01:20 PM,03-Jun-2022 11:30 AM,25-May-2022 01:20 PM,03-Jun-2022 11:00 AM,25-May-2022 01:20 PM ,03-Jun-2022 11:00 AM ,25-May-2022 01:20 PM,03-Jun-2022 11:00 AM,08-Jun-2022 10:40 AM,"Annual repair, Operation and maintenance of Sub Divisional level water testing Laboratory at Arki in Tehsil Arki Distt. Solan HP (SH - Providing Skilled / Unskilled staff, material and maintenance of equipments for three years).","Annual repair, Operation and maintenance of Sub Divisional level water testing Laboratory at Arki in Tehsil Arki Distt. Solan HP (SH - Providing Skilled / Unskilled staff, material and maintenance of equipments for three years).",Please refer Tender documents. ,NA ,"19,68,903",Civil Works,NA ,Tender,120.0,1095.0,Arki,173208.0,NA ,NA ,NA ,"Executive Engineer, Jal Shakti Division, Arki",No ,No,"Executive Engineer, Jal Shakti Division, Arki","Executive Engineer, Jal Shakti Division, Arki",1.0,Fee/PreQual/Technical,.pdf,Earnest Money OR certificate of exemption of Earnest Money should be deposited online mode only,"37,750",Yes,fixed,,Nil,Nil,"HP Irrigation and Public Health||Shimla-9 Circle,Irrigation and Public Health,HP||Arki,Irrigation and Public Health,HP",3049-3120 dated 25-05-2022,2022_HPIPH_61056_1,Yes,Open Tender,Item Rate,Works,2.0,No,No,Online,No,No,No,400.0,Nil,Nil,Yes,1.0,ICICI BANK,17-Nov-2023,"INR 1,968,903",1095.0,Vivek Katoch,24-Nov-2023 12:46 PM,AOC_2022_23_Lab.pdf (440.00 KB),Awarded,Finance,BOQ and BOQ Comparative Chart of all bidders downloaded successfully,Pratap Kishta,02-Jul-2022 11:57 AM,finance_92161.pdf,BOQ Comparative Chart,Technical,Documents of all bidders downloaded successfully,Pratap Kishta,08-Jun-2022 10:37 AM,technical_92161.pdf,Executive Engineer,Internal,"Superintendent Gr.-II, DHD, DAO, AE Arki and T.A. of this office",Pratap Kishta,08-Jun-2022 10:39 AM,08-Jun-2022 10:40 AM,techsummary_92161.pdf (730.26 KB),1.0,284996.0,Chetan Thakur,02-Jun-2022 03:38 PM,Accepted-AOC,Awared,24-Nov-2023,Executive Engineer,Internal,"Superintendent Gr.-II, DHD, DAO, AE Arki and T.A. of this office",Pratap Kishta,02-Jul-2022 12:24 PM,finsummary_92161.pdf (537.63 KB),"HP Irrigation and Public Health||Shimla-9 Circle,Irrigation and Public Health,HP||Arki,Irrigation and Public Health,HP",2022_HPIPH_61056_1,3049-3120 dated 25-05-2022,"Annual repair, Operation and maintenance of Sub Divisional level water testing Laboratory at Arki in Tehsil Arki Distt. Solan HP (SH - Providing Skilled / Unskilled staff, material and maintenance of equipments for three years).",1.0,284996.0,Chetan Thakur,INR,"1,275,000"
,,,,,,,,,,,,,,,,,,,,,,,,,,,,,,,.pdf,Cost of tender Form as mentioned above be deposited online only,,,,,,,,,,,,,,,,,,,,,,,,,2.0,ICICI NEFT/RTGS,,,,,,,,,,,,,,,,,,,,,,,,,,2.0,284881.0,govt contractor,03-Jun-2022 10:55 AM,Rejected-Finance,Rejected,02-Jul-2022,,,,,,,,,,,,,,,
,,,,,,,,,,,,,,,,,,,,,,,,,,,,,,,.pdf,Certificate of contractor registration with H.P. Jal Shakti Vibhag in appropriate class and latest,,,,,,,,,,,,,,,,,,,,,,,,,,,,,,,,,,,,,,,,,,,,,,,,,,,,3.0,284751.0,Jyoti Trading Company,31-May-2022 07:33 PM,Rejected-Finance,Rejected,02-Jul-2022,,,,,,,,,,,,,,,
,,,,,,,,,,,,,,,,,,,,,,,,,,,,,,,.pdf,"PAN No., GST registration, EPF Registration and Income Tax Return thereof",,,,,,,,,,,,,,,,,,,,,,,,,,,,,,,,,,,,,,,,,,,,,,,,,,,,,,,,,,,,,,,,,,,,,,,,,
,,,,,,,,,,,,,,,,,,,,,,,,,,,,,,,.pdf,Scanned copy of undertaking that I have carefully studied all the terms and conditions stipulated in,,,,,,,,,,,,,,,,,,,,,,,,,,,,,,,,,,,,,,,,,,,,,,,,,,,,,,,,,,,,,,,,,,,,,,,,,
,,,,,,,,,,,,,,,,,,,,,,,,,,,,,,,.pdf,Authorization letter regarding digital signature certificate (DSC) of the person authorized by the,,,,,,,,,,,,,,,,,,,,,,,,,,,,,,,,,,,,,,,,,,,,,,,,,,,,,,,,,,,,,,,,,,,,,,,,,
,,,,,,,,,,,,,,,,,,,,,,,,,,,,,2.0,Finance,.xls,BOQ,,,,,,,,,,,,,,,,,,,,,,,,,,,,,,,,,,,,,,,,,,,,,,,,,,,,,,,,,,,,,,,,,,,,,,,,,
