Tender Fee in ₹,Fee Payable To,Fee Payable At,Tender Fee Exemption Allowed,S.No,Bank Name,Publish Date,Bid Opening Date,Document Download / Sale Start Date,Document Download / Sale End Date,Clarification Start Date,Clarification End Date,Bid Submission Start Date,Bid Submission End Date,Financial Bid Opening Date,Name,Address,EMD Amount in ₹,EMD Exemption Allowed,EMD Fee Type,EMD Percentage,EMD Payable To,EMD Payable At,Cover No,Cover,Document Type,Description,Title,Work Description,Pre Qualification Details,Independent External Monitor/Remarks,Tender Value in ₹,Product Category,Sub category,Contract Type,Bid Validity(Days),Period Of Work(Days),Location,Pincode,Pre Bid Meeting Place,Pre Bid Meeting Address,Pre Bid Meeting Date,Bid Opening Place,Should Allow NDA Tender,Allow Preferential Bidder,Organisation Chain,Tender Reference Number,Tender ID,Withdrawal Allowed,Tender Type,Form of contract,Tender Category,No. of Covers,General Technical Evaluation Allowed,ItemWise Technical Evaluation Allowed,Payment Mode,Is Multi Currency Allowed For BOQ,Is Multi Currency Allowed For Fee,Allow Two Stage Bidding,Committee Chairperson/Co-ordinator Name :,Committee Chairperson/Co-ordinator Type :,Committee Members :,Updated By :,Updated On :,Financial Bid Opening Date:,Document :,Organisation Chain :,Tender ID :,Tender Ref No :,Tender Title :,Contract Date :,Contract Value :,Work Completion Period in days :,Updated By :.1,Updated on :,AOC document :,AOC Description :,Committee Chairperson/Co-ordinator Name :.1,Committee Chairperson/Co-ordinator Type :.1,Committee Members :.1,Updated By :.2,Updated on :.1,Document :.1,S.No.2,Bid Number,Bidder Name,Awarded Currency,Awarded Value,Type :,Summary :,Updated By :.3,Updated On :.1,Document :.2,BOQ Comparative Chart :,S.No.1,Bid Number.1,Bidder Name.1,Submitted Date,Status,Remarks,Status Updated On,Type :.1,Summary :.1,Updated By :.4,Updated On :.2,Document :.3
"2,000",Nil,Nil,No,1.0,ICICI BANK,22-Sep-2023 04:00 PM,04-Oct-2023 11:00 AM,22-Sep-2023 04:00 PM,02-Oct-2023 05:00 PM,NA ,NA ,22-Sep-2023 04:00 PM,02-Oct-2023 05:00 PM,05-Oct-2023 04:40 PM,Er.G.L.Thakur,Mech Division HPPWD Kullu,"1,05,900",No,fixed,,Nil,Nil,1.0,Fee/PreQual/Technical,.pdf,Scanned copy of Manufacturer Authorized dealer of Light Gauge Steel Frame LGSF system,Balance work of construction of ANM Administrative Block at Gandhi Nagar Distt Kullu HP with Light Gauge Steel Frame Technology LGSF SH CO Building with Light Gauge Steel Frame Technology superstructure including all finishing work with sanitary and,Balance work of construction of ANM Administrative Block at Gandhi Nagar Distt Kullu HP with Light Gauge Steel Frame Technology LGSF SH CO Building with Light Gauge Steel Frame Technology superstructure including all finishing work with sanitary and,Balance work of construction of ANM Administrative Block at Gandhi Nagar Distt Kullu HP with Light Gauge Steel Frame Technology LGSF SH CO Building with Light Gauge Steel Frame Technology superstructure including all finishing work with sanitary and  ,NA ,"52,90,320",Civil Works - Canal,NA ,Tender,90.0,90.0,Kullu,175101.0,NA ,NA ,NA ,EE Mech Div Kullu,No ,No,PWD,3870-73 dt. 22.09.2023,2023_PWD_79214_1,Yes,Open Tender,Percentage,Works,2.0,No,No,Online,No,No,No,Er.G.L.Thakur,Internal,as per summary attached,Girdhari Lal Thakur,05-Oct-2023 04:37 PM,05-Oct-2023 04:40 PM,techsummary_118078.pdf (776.68 KB),PWD,2023_PWD_79214_1,3870-73 dt. 22.09.2023,Balance work of construction of ANM Administrative Block at Gandhi Nagar Distt Kullu HP with Light Gauge Steel Frame Technology LGSF SH CO Building with Light Gauge Steel Frame Technology superstructure including all finishing work with sanitary and,18-Nov-2023,"INR 5,402,191",90.0,Girdhari Lal Thakur,18-Nov-2023 01:21 PM,aocanm.pdf (929.00 KB),aoc,Er.G.L.Thakur,Internal,as per summary attached,Girdhari Lal Thakur,09-Oct-2023 12:54 PM,finsummary_118078.pdf (2148.08 KB),1.0,375138.0,amit kumar seth,INR,"5,402,191",Finance,as per summary attached,Girdhari Lal Thakur,09-Oct-2023 12:51 PM,finance_118078.pdf,BOQ Comparative Chart,1.0,375138.0,amit kumar seth,29-Sep-2023 04:39 PM,Accepted-AOC,being lowest,18-Nov-2023,Technical,as per summary attached,Girdhari Lal Thakur,05-Oct-2023 04:35 PM,technical_118078.pdf
,,,,2.0,ICICI NEFT/RTGS,,,,,,,,,,,,,,,,,,,,.pdf,Scanned copy of Registration Enlistment with HPPWD Department,,,,,,,,,,,,,,,,,,,,,,,,,,,,,,,,,,,,,,,,,,,,,,,,,,,,,,,,,,,,,,,,,,,,2.0,375463.0,M/S INDUE PREFAB PRIVATE LIMITED,02-Oct-2023 10:33 AM,Rejected-Finance,being 2nd lowest,09-Oct-2023,,,,,
,,,,,,,,,,,,,,,,,,,,,,,,,.pdf,Scanned copy of PAN GST No EPF No and Income Tax clearance certificate,,,,,,,,,,,,,,,,,,,,,,,,,,,,,,,,,,,,,,,,,,,,,,,,,,,,,,,,,,,,,,,,,,,,,,,,,,,,,,,
,,,,,,,,,,,,,,,,,,,,,,,,,.pdf,Scanned copy of work done certificate of similar nature work,,,,,,,,,,,,,,,,,,,,,,,,,,,,,,,,,,,,,,,,,,,,,,,,,,,,,,,,,,,,,,,,,,,,,,,,,,,,,,,
,,,,,,,,,,,,,,,,,,,,,,,,,.pdf,Scanned copy of Earnest Money and Cost of Form,,,,,,,,,,,,,,,,,,,,,,,,,,,,,,,,,,,,,,,,,,,,,,,,,,,,,,,,,,,,,,,,,,,,,,,,,,,,,,,
,,,,,,,,,,,,,,,,,,,,,,,,,.pdf,Scanned copy of Affidavit at Sr No 6 mentioned in terms and conditions,,,,,,,,,,,,,,,,,,,,,,,,,,,,,,,,,,,,,,,,,,,,,,,,,,,,,,,,,,,,,,,,,,,,,,,,,,,,,,,
,,,,,,,,,,,,,,,,,,,,,,,,,.pdf,Scanned copy of Affidavit regarding genuineness and correctness of document attached,,,,,,,,,,,,,,,,,,,,,,,,,,,,,,,,,,,,,,,,,,,,,,,,,,,,,,,,,,,,,,,,,,,,,,,,,,,,,,,
,,,,,,,,,,,,,,,,,,,,,,,2.0,Finance,.xls,boq,,,,,,,,,,,,,,,,,,,,,,,,,,,,,,,,,,,,,,,,,,,,,,,,,,,,,,,,,,,,,,,,,,,,,,,,,,,,,,,
,,,,,,,,,,,,,,,,,,,,,,,,,.pdf,tenderdocument,,,,,,,,,,,,,,,,,,,,,,,,,,,,,,,,,,,,,,,,,,,,,,,,,,,,,,,,,,,,,,,,,,,,,,,,,,,,,,,
