Committee Chairperson/Co-ordinator Name :,Committee Chairperson/Co-ordinator Type :,Committee Members :,Updated By :,Updated on :,Document :,Organisation Chain :,Tender ID :,Tender Ref No :,Tender Title :,Contract Date :,Contract Value :,Work Completion Period in days :,Updated By :.1,Updated on :.1,AOC document :,AOC Description :,S.No,Bid Number,Bidder Name,Awarded Currency,Awarded Value,Committee Chairperson/Co-ordinator Name :.1,Committee Chairperson/Co-ordinator Type :.1,Committee Members :.1,Updated By :.2,Updated On :,Financial Bid Opening Date:,Document :.1,Type :,Summary :,Updated By :.3,Updated On :.1,Document :.2,S.No.1,Bid Number.1,Bidder Name.1,Submitted Date,Status,Remarks,Status Updated On,Type :.1,Summary :.1,Updated By :.4,Updated On :.2,Document :.3,BOQ Comparative Chart :,Cover No,Cover,Document Type,Description,S.No.2,Bank Name,Tender Fee in ₹,Fee Payable To,Fee Payable At,Tender Fee Exemption Allowed,S.No.1.1,Category,Sub Category,Sub Category Description,Format/File,Organisation Chain,Tender Reference Number,Tender ID,Withdrawal Allowed,Tender Type,Form of contract,Tender Category,No. of Covers,General Technical Evaluation Allowed,ItemWise Technical Evaluation Allowed,Payment Mode,Is Multi Currency Allowed For BOQ,Is Multi Currency Allowed For Fee,Allow Two Stage Bidding,Publish Date,Bid Opening Date,Document Download / Sale Start Date,Document Download / Sale End Date,Clarification Start Date,Clarification End Date,Bid Submission Start Date,Bid Submission End Date,Financial Bid Opening Date,EMD Amount in ₹,EMD Exemption Allowed,EMD Fee Type,EMD Percentage,EMD Payable To,EMD Payable At,Name,Address,Title,Work Description,Pre Qualification Details,Independent External Monitor/Remarks,Tender Value in ₹,Product Category,Sub category,Contract Type,Bid Validity(Days),Period Of Work(Days),Location,Pincode,Pre Bid Meeting Place,Pre Bid Meeting Address,Pre Bid Meeting Date,Bid Opening Place,Should Allow NDA Tender,Allow Preferential Bidder
Er. Pawan,Internal,Er. C.L.azad,Pawan Kumar Garg,28-Oct-2022 05:00 PM,finsummary_92236.pdf (220.01 KB),PWD,2022_PWD_61103_11,PW-RD-GA-T-2111-24dt17-3-22,R/R Damages to Dadiyar Kaloti Dhumdhar road 0/00 to 4/500,05-Oct-2023,"INR 845,055",60.0,Chuni Lal Azad,05-Oct-2023 06:50 PM,correindendum.pdf (470.00 KB),AOC,1.0,284713.0,ALI MOHAMMAD,INR,"870,141",PAWAN KUMAR,Internal,AE TO EE,Duni Chand Chauhan,15-Jun-2022 01:41 PM,15-Jun-2022 02:00 PM,techsummary_92236.pdf (66.54 KB),Technical,Bid Opening Summary,Duni Chand Chauhan,15-Jun-2022 01:30 PM,technical_92236.pdf,1.0,284713.0,ALI MOHAMMAD,31-May-2022 04:32 PM,Accepted-AOC,AOC,05-Oct-2023,Finance,Bid Opening Summary,Duni Chand Chauhan,15-Jun-2022 04:45 PM,finance_92236.pdf,BOQ Comparative Chart,1.0,Fee/PreQual/Technical,.pdf,COST OF TENDER FORM,1.0,ICICI BANK,500.0,Nil,Nil,No,1.0,Certificate Details ,Affidavit regarding correctness of bid ,Required in tender document in bidder file 1 ,,PWD,PW-RD-GA-T-2111-24dt17-3-22,2022_PWD_61103_11,Yes,Open Tender,Item Rate,Works,2.0,No,No,Online,No,No,No,26-May-2022 05:00 PM,01-Jun-2022 11:00 AM,26-May-2022 05:00 PM,31-May-2022 06:00 PM,NA ,NA ,26-May-2022 05:00 PM,31-May-2022 06:00 PM,15-Jun-2022 02:00 PM,"17,300",No,fixed,,Nil,Nil,E E B and R Divn HPPWD ROHRU,E E B and R Divn HPPWD ROHRU,R/R Damages to Dadiyar Kaloti Dhumdhar road 0/00 to 4/500,(SH- C/o R/wall in PCC 1 4 8 at RD 1/600 to 1/621.40),Please refer Tender documents. ,NA ,"8,70,241",Civil Works - Roads,NA ,Tender,45.0,60.0,Rohru,171207.0,NA ,NA ,NA ,E E HPPWD ROHRU,No ,No
,,,,,,,,,,,,,,,,,,,,,,,,,,,,,,,,,,2.0,284729.0,Mohmad Zakir Husain,31-May-2022 05:00 PM,Rejected-Finance,2nd lowest,28-Oct-2022,,,,,,,,,.pdf,EARNEST MONEY,2.0,ICICI NEFT/RTGS,,,,,,,,,,,,,,,,,,,,,,,,,,,,,,,,,,,,,,,,,,,,,,,,,,,,,,,,,,
,,,,,,,,,,,,,,,,,,,,,,,,,,,,,,,,,,,,,,,,,,,,,,,,,.pdf,CONTRACTOR REGISTRATION,,,,,,,,,,,,,,,,,,,,,,,,,,,,,,,,,,,,,,,,,,,,,,,,,,,,,,,,,,,,
,,,,,,,,,,,,,,,,,,,,,,,,,,,,,,,,,,,,,,,,,,,,,,,,,.pdf,PAN NUMBER,,,,,,,,,,,,,,,,,,,,,,,,,,,,,,,,,,,,,,,,,,,,,,,,,,,,,,,,,,,,
,,,,,,,,,,,,,,,,,,,,,,,,,,,,,,,,,,,,,,,,,,,,,,,,,.pdf,EPF NUMBER GST NUMBER AND IMCOME TAX CALEARANCE,,,,,,,,,,,,,,,,,,,,,,,,,,,,,,,,,,,,,,,,,,,,,,,,,,,,,,,,,,,,
,,,,,,,,,,,,,,,,,,,,,,,,,,,,,,,,,,,,,,,,,,,,,,,,,.pdf,WORK DONE CERTIFICATES AS PER CLAUSE 19 OF GENERAL RULES,,,,,,,,,,,,,,,,,,,,,,,,,,,,,,,,,,,,,,,,,,,,,,,,,,,,,,,,,,,,
,,,,,,,,,,,,,,,,,,,,,,,,,,,,,,,,,,,,,,,,,,,,,,,,,.pdf,MACHINARY AND TOOLS DETAILS AS GIVEN IN SCHEDULE F FOR CLAUSE 18 OF GENERAL RULE,,,,,,,,,,,,,,,,,,,,,,,,,,,,,,,,,,,,,,,,,,,,,,,,,,,,,,,,,,,,
,,,,,,,,,,,,,,,,,,,,,,,,,,,,,,,,,,,,,,,,,,,,,,,,,.pdf,AFFIDAVIT REGARDING GAZETTE NONGAZET CORRECTNESS OF INFORMATION SUBMITTED,,,,,,,,,,,,,,,,,,,,,,,,,,,,,,,,,,,,,,,,,,,,,,,,,,,,,,,,,,,,
,,,,,,,,,,,,,,,,,,,,,,,,,,,,,,,,,,,,,,,,,,,,,,,,,.pdf,CA/Turnover of Last five year,,,,,,,,,,,,,,,,,,,,,,,,,,,,,,,,,,,,,,,,,,,,,,,,,,,,,,,,,,,,
,,,,,,,,,,,,,,,,,,,,,,,,,,,,,,,,,,,,,,,,,,,,,,,,,.pdf,Form 8,,,,,,,,,,,,,,,,,,,,,,,,,,,,,,,,,,,,,,,,,,,,,,,,,,,,,,,,,,,,
,,,,,,,,,,,,,,,,,,,,,,,,,,,,,,,,,,,,,,,,,,,,,,,,,.pdf,The work Done statements should be coantersigned by the Engineer in charge not below the rank of XEN,,,,,,,,,,,,,,,,,,,,,,,,,,,,,,,,,,,,,,,,,,,,,,,,,,,,,,,,,,,,
,,,,,,,,,,,,,,,,,,,,,,,,,,,,,,,,,,,,,,,,,,,,,,,,,.pdf,"physical submission submit should be compalsory otherwise tender will be rejected,UTR No copy should",,,,,,,,,,,,,,,,,,,,,,,,,,,,,,,,,,,,,,,,,,,,,,,,,,,,,,,,,,,,
,,,,,,,,,,,,,,,,,,,,,,,,,,,,,,,,,,,,,,,,,,,,,,,2.0,Finance,.xls,BOQ,,,,,,,,,,,,,,,,,,,,,,,,,,,,,,,,,,,,,,,,,,,,,,,,,,,,,,,,,,,,
