Type :,Summary :,Updated By :,Updated On :,Document :,Type :.1,Summary :.1,Updated By :.1,Updated On :.1,Document :.1,BOQ Comparative Chart :,Contract Date :,Contract Value :,Work Completion Period in days :,Updated By :.2,Updated on :,AOC document :,AOC Description :,S.No,Bid Number,Bidder Name,Submitted Date,Status,Remarks,Status Updated On,Committee Chairperson/Co-ordinator Name :,Committee Chairperson/Co-ordinator Type :,Committee Members :,Updated By :.3,Updated On :.2,Financial Bid Opening Date:,Document :.2,S.No.1,Bid Number.1,Bidder Name.1,Awarded Currency,Awarded Value,Organisation Chain :,Tender ID :,Tender Ref No :,Tender Title :,Committee Chairperson/Co-ordinator Name :.1,Committee Chairperson/Co-ordinator Type :.1,Committee Members :.1,Updated By :.4,Updated on :.1,Document :.3,Publish Date,Bid Opening Date,Document Download / Sale Start Date,Document Download / Sale End Date,Clarification Start Date,Clarification End Date,Bid Submission Start Date,Bid Submission End Date,Financial Bid Opening Date,Title,Work Description,Pre Qualification Details,Independent External Monitor/Remarks,Tender Value in ₹,Product Category,Sub category,Contract Type,Bid Validity(Days),Period Of Work(Days),Location,Pincode,Pre Bid Meeting Place,Pre Bid Meeting Address,Pre Bid Meeting Date,Bid Opening Place,Should Allow NDA Tender,Allow Preferential Bidder,Cover No,Cover,Document Type,Description,Tender Fee in ₹,Fee Payable To,Fee Payable At,Tender Fee Exemption Allowed,EMD Amount in ₹,EMD Exemption Allowed,EMD Fee Type,EMD Percentage,EMD Payable To,EMD Payable At,Organisation Chain,Tender Reference Number,Tender ID,Withdrawal Allowed,Tender Type,Form of contract,Tender Category,No. of Covers,General Technical Evaluation Allowed,ItemWise Technical Evaluation Allowed,Payment Mode,Is Multi Currency Allowed For BOQ,Is Multi Currency Allowed For Fee,Allow Two Stage Bidding,Name,Address,S.No.2,Bank Name
Technical,proceeding,Vipan Kumar,20-Jul-2023 12:06 PM,technical_113720.pdf,Finance,summary,Vipan Kumar,20-Jul-2023 01:57 PM,finance_113720.pdf,BOQ Comparative Chart,20-Oct-2023,"INR 844,500",180.0,Vipan Kumar,20-Oct-2023 06:08 PM,Aoc.pdf (425.00 KB),Lowest One,1.0,360401.0,ashok kumar govt contractor,15-Jul-2023 12:39 PM,Rejected-Finance,highest,20-Oct-2023,EE,Internal,DAO JDM AE TA,Vipan Kumar,20-Jul-2023 12:10 PM,20-Jul-2023 12:15 PM,techsummary_113720.pdf (441.41 KB),1.0,360734.0,nisha devi govt contrator,INR,"844,500","HP Irrigation and Public Health||Nurpur Circle,Irrigation and Public Health,HP||Fatehpur-Irrigation and Public Health-HP",2023_HPIPH_75986_1,EE/JSV/IND/EA-I-/23-24-2930-80 dt 07.07.23,Providing Lift Water Supply Scheme for Schedule Tribe Abadi in village Thitholi etc in Tehsil Indora,EE,Internal,"JDM, TA, DAO, AE",Vipan Kumar,20-Oct-2023 06:04 PM,finsummary_113720.pdf (249.76 KB),07-Jul-2023 05:00 PM,17-Jul-2023 11:30 AM,07-Jul-2023 05:30 PM,17-Jul-2023 11:00 AM,NA ,NA ,07-Jul-2023 05:30 PM,17-Jul-2023 11:00 AM,20-Jul-2023 12:15 PM,Providing Lift Water Supply Scheme for Schedule Tribe Abadi in village Thitholi etc in Tehsil Indora,SH- Construction of RCC Main Storage Over Head Tank 50000 ltr capacity with 10.00 metres staging height,Please refer Tender documents. ,NA ,"11,23,500",Civil Works,NA ,Tender,180.0,NA ,Indora,176401.0,NA ,NA ,NA ,Indora,No ,No,1.0,Fee/PreQual/Technical,.pdf,Online tender cost of receipt of the amount deposited on a/c of cost of tender document in favour of,400.0,Nil,Nil,Yes,"22,470",Yes,fixed,,Nil,Nil,"HP Irrigation and Public Health||Nurpur Circle,Irrigation and Public Health,HP||Fatehpur-Irrigation and Public Health-HP",EE/JSV/IND/EA-I-/23-24-2930-80 dt 07.07.23,2023_HPIPH_75986_1,Yes,Open Tender,Item Rate,Works,2.0,No,No,Online,No,No,No,EE JSV Indora,EE JSV Indora,1.0,ICICI BANK
,,,,,,,,,,,,,,,,,,2.0,360568.0,Dilbag Singh,16-Jul-2023 06:44 PM,Rejected-Finance,Highest,20-Oct-2023,,,,,,,,,,,,,,,,,,,,,,,,,,,,,,,,,,,,,,,,,,,,,,,,,,,,.pdf,Copy of FDR/Exemption letter cost of receipt of the amount deposited of cost of earnest money in fav,,,,,,,,,,,,,,,,,,,,,,,,,,,2.0,ICICI NEFT/RTGS
,,,,,,,,,,,,,,,,,,3.0,360360.0,MS NITIN CONSTRUCTION BHAPOO,14-Jul-2023 01:18 PM,Rejected-Technical,Reject,20-Jul-2023,,,,,,,,,,,,,,,,,,,,,,,,,,,,,,,,,,,,,,,,,,,,,,,,,,,,.pdf,Copy of registration in Jal Shakti Deptt. in appropriate class and latest renewal thereof.,,,,,,,,,,,,,,,,,,,,,,,,,,,,
,,,,,,,,,,,,,,,,,,4.0,360734.0,nisha devi govt contrator,17-Jul-2023 10:13 AM,Accepted-AOC,Lowest One,20-Oct-2023,,,,,,,,,,,,,,,,,,,,,,,,,,,,,,,,,,,,,,,,,,,,,,,,,,,,.pdf,Copy of Income tax (Assessment Year 2023-24),,,,,,,,,,,,,,,,,,,,,,,,,,,,
,,,,,,,,,,,,,,,,,,5.0,360652.0,RAVI DUTT,16-Jul-2023 03:19 PM,Rejected-Finance,highest,20-Oct-2023,,,,,,,,,,,,,,,,,,,,,,,,,,,,,,,,,,,,,,,,,,,,,,,,,,,,.pdf,Copy of PAN No and EPF Number,,,,,,,,,,,,,,,,,,,,,,,,,,,,
,,,,,,,,,,,,,,,,,,6.0,360524.0,VIJAY KUMAR,15-Jul-2023 02:19 PM,Rejected-Finance,highest,20-Oct-2023,,,,,,,,,,,,,,,,,,,,,,,,,,,,,,,,,,,,,,,,,,,,,,,,,,,,.pdf,Copy of GST No. registration and latest clearance certificate thereof,,,,,,,,,,,,,,,,,,,,,,,,,,,,
,,,,,,,,,,,,,,,,,,,,,,,,,,,,,,,,,,,,,,,,,,,,,,,,,,,,,,,,,,,,,,,,,,,,,,,,,,,,.pdf,Any other terms and condition as per Notice Inviting tender,,,,,,,,,,,,,,,,,,,,,,,,,,,,
,,,,,,,,,,,,,,,,,,,,,,,,,,,,,,,,,,,,,,,,,,,,,,,,,,,,,,,,,,,,,,,,,,,,,,,,,,2.0,Finance,.xls,BOQ,,,,,,,,,,,,,,,,,,,,,,,,,,,,
