Committee Chairperson/Co-ordinator Name :,Committee Chairperson/Co-ordinator Type :,Committee Members :,Updated By :,Updated on :,Document :,Contract Date :,Contract Value :,Work Completion Period in days :,Updated By :.1,Updated on :.1,AOC document :,AOC Description :,Organisation Chain :,Tender ID :,Tender Ref No :,Tender Title :,Committee Chairperson/Co-ordinator Name :.1,Committee Chairperson/Co-ordinator Type :.1,Committee Members :.1,Updated By :.2,Updated On :,Financial Bid Opening Date:,Document :.1,Type :,Summary :,Updated By :.3,Updated On :.1,Document :.2,BOQ Comparative Chart :,S.No,Bid Number,Bidder Name,Awarded Currency,Awarded Value,Type :.1,Summary :.1,Updated By :.4,Updated On :.2,Document :.3,S.No.1,Bid Number.1,Bidder Name.1,Submitted Date,Status,Remarks,Status Updated On,Tender Stage,Name,Address,Title,Work Description,Pre Qualification Details,Independent External Monitor/Remarks,Tender Value in ₹,Product Category,Sub category,Contract Type,Bid Validity(Days),Period Of Work(Days),Location,Pincode,Pre Bid Meeting Place,Pre Bid Meeting Address,Pre Bid Meeting Date,Bid Opening Place,Should Allow NDA Tender,Allow Preferential Bidder,EMD Amount in ₹,EMD Exemption Allowed,EMD Fee Type,EMD Percentage,EMD Payable To,EMD Payable At,Tender Fee in ₹,Fee Payable To,Fee Payable At,Tender Fee Exemption Allowed,Cover No,Cover,Document Type,Description,Publish Date,Bid Opening Date,Document Download / Sale Start Date,Document Download / Sale End Date,Clarification Start Date,Clarification End Date,Bid Submission Start Date,Bid Submission End Date,Financial Bid Opening Date,Organisation Chain,Tender Reference Number,Tender ID,Withdrawal Allowed,Tender Type,Form of contract,Tender Category,No. of Covers,General Technical Evaluation Allowed,ItemWise Technical Evaluation Allowed,Payment Mode,Is Multi Currency Allowed For BOQ,Is Multi Currency Allowed For Fee,Allow Two Stage Bidding,S.No,Bank Name,Tender Stage
EE,Internal,All Committee Members,Raj Kumar,25-Aug-2022 03:02 PM,finsummary_95446.pdf (491.46 KB),31-Aug-2022,"INR 975,452",180.0,Raj Kumar,03-Dec-2022 10:53 AM,134-2022-23.pdf (128.00 KB),AOC,PWD,2022_PWD_63310_1,NIT No. 5643-47 dated 20-07-2022,"C/O link road to Village Churangal km 0/0 to 5/500 (SH P/L Gr-II, Gr-III, Tarring in km 2/500 to 3/00) Under SCCP",EE,Internal,All Committee Members,Raj Kumar,24-Aug-2022 10:12 AM,24-Aug-2022 10:15 AM,techsummary_95446.pdf (491.46 KB),Finance,summary,Raj Kumar,25-Aug-2022 09:33 AM,finance_95446.pdf,BOQ Comparative Chart,1.0,295405.0,SANJEEV KUMAR GOVT CONTRACTOR,INR,"847,131",Technical,summary,Raj Kumar,24-Aug-2022 10:11 AM,technical_95446.pdf,1.0,295307.0,Lovedeep singh,11-Aug-2022 02:01 PM,Rejected-Finance,Due to L2 Bidder,25-Aug-2022 03:02 PM,AOC,Executive Engineer,Nalagarh Division,"C/O link road to Village Churangal km 0/0 to 5/500 (SH P/L Gr-II, Gr-III, Tarring in km 2/500 to 3/00) Under SCCP",.,NA ,NA ,"9,75,452",Civil Works,NA ,Tender,75.0,180.0,Nalagarh,174101.0,NA ,NA ,NA ,EE Nalagarh,No ,No,"19,500",No,fixed,,Nil,Nil,350.0,Nil,Nil,No,1.0,Fee/PreQual/Technical,.pdf,"Cost of Tender, EMD and other terms and conditions as per indicated in SBD",01-Aug-2022 10:00 AM,12-Aug-2022 11:30 AM,01-Aug-2022 10:05 AM,12-Aug-2022 11:00 AM,NA ,NA ,01-Aug-2022 10:10 AM,12-Aug-2022 11:00 AM,24-Aug-2022 10:15 AM,PWD,NIT No. 5643-47 dated 20-07-2022,2022_PWD_63310_1,Yes,Open Tender,Item Rate,Works,2.0,No,No,Online,No,No,No,1.0,ICICI BANK,AOC
,,,,,,,,,,,,,,,,,,,,,,,,,,,,,,,,,,,,,,,,2.0,295405.0,SANJEEV KUMAR GOVT CONTRACTOR,11-Aug-2022 06:51 PM,Accepted-AOC,AOC done,03-Dec-2022 10:53 AM,AOC,,,,,,,,,,,,,,,,,,,,,,,,,,,,,,,,,.pdf,Contractor Registration/GST/PAN/EPF and follow the other all conditions indicated in SBD,,,,,,,,,,,,,,,,,,,,,,,,2.0,ICICI NEFT/RTGS,AOC
,,,,,,,,,,,,,,,,,,,,,,,,,,,,,,,,,,,,,,,,3.0,294430.0,Sh. Bhupinder Singh Badi S/o Sh. Kishan Singh,04-Aug-2022 10:33 PM,Rejected-Finance,Due to L3 Bidder,25-Aug-2022 03:02 PM,AOC,,,,,,,,,,,,,,,,,,,,,,,,,,,,,,,,,.pdf,Duly filled and signed from No 7/8 General Rule and Direction,,,,,,,,,,,,,,,,,,,,,,,,,,AOC
,,,,,,,,,,,,,,,,,,,,,,,,,,,,,,,,,,,,,,,,,,,,,,,AOC,,,,,,,,,,,,,,,,,,,,,,,,,,,,,,,,,.pdf,Affidavit reg. detail of Machinery as per contract data to General Condition of Contact in SBD,,,,,,,,,,,,,,,,,,,,,,,,,,AOC
,,,,,,,,,,,,,,,,,,,,,,,,,,,,,,,,,,,,,,,,,,,,,,,AOC,,,,,,,,,,,,,,,,,,,,,,,,,,,,,,,2.0,Finance,.xls,finance,,,,,,,,,,,,,,,,,,,,,,,,,,AOC
