Title,Work Description,Pre Qualification Details,Independent External Monitor/Remarks,Tender Value in ₹,Product Category,Sub category,Contract Type,Bid Validity(Days),Period Of Work(Days),Location,Pincode,Pre Bid Meeting Place,Pre Bid Meeting Address,Pre Bid Meeting Date,Bid Opening Place,Should Allow NDA Tender,Allow Preferential Bidder,S.No,Bank Name,Organisation Chain,Tender Reference Number,Tender ID,Withdrawal Allowed,Tender Type,Form of contract,Tender Category,No. of Covers,General Technical Evaluation Allowed,ItemWise Technical Evaluation Allowed,Payment Mode,Is Multi Currency Allowed For BOQ,Is Multi Currency Allowed For Fee,Allow Two Stage Bidding,Cover No,Cover,Document Type,Description,Tender Fee in ₹,Fee Payable To,Fee Payable At,Tender Fee Exemption Allowed,S.No.1,Corrigendum Title,Corrigendum Type,View,EMD Amount in ₹,EMD through BG/ST or EMD Exemption Allowed,EMD Fee Type,EMD Percentage,EMD Payable To,EMD Payable At,Name,Address,Publish Date,Bid Opening Date,Document Download / Sale Start Date,Document Download / Sale End Date,Clarification Start Date,Clarification End Date,Bid Submission Start Date,Bid Submission End Date,Financial Bid Opening Date,Tender Stage,Organisation Chain :,Tender ID :,Tender Ref No :,Tender Title :,Committee Chairperson/Co-ordinator Name :,Committee Chairperson/Co-ordinator Type :,Committee Members :,Updated By :,Updated on :,Document :,Committee Chairperson/Co-ordinator Name :.1,Committee Chairperson/Co-ordinator Type :.1,Committee Members :.1,Updated By :.1,Updated On :,Financial Bid Opening Date:,Document :.1,Contract Date :,Contract Value :,Work Completion Period in days :,Updated By :.2,Updated on :.1,AOC document :,S.No,Bid Number,Bidder Name,Awarded Currency,Awarded Value,Type :,Summary :,Updated By :.3,Updated On :.1,Document :.2,BOQ Comparative Chart :,Type :.1,Summary :.1,Updated By :.4,Updated On :.2,Document :.3,S.No.1,Bid Number.1,Bidder Name.1,Submitted Date,Status,Remarks,Status Updated On,Tender Stage
Supply Full Sleeves Disposable AI Gloves and AI Sheaths,AI Gloves and Sheaths are required in field for AI activity,Please refer Tender documents. ,NA ,"40,00,000",Miscellaneous Goods,NA ,Rate Contract,365.0,30.0,"ALDA-HQ, Khanapara, Guwahati, Assam",781022.0,NA ,NA ,NA ,"Khanapara, Guwahati, Assam-781022",No ,No,1.0,SBI Bank,Animal Husbandry and Veterinary Department||Assam Livestock Development Agency,"ALDA/NP-AI/15-16/315,22/06/22",2022_AHVD_26098_1,Yes,Open Tender,Item Rate,Goods,2.0,No,Yes,Online,No,No,No,1.0,Fee/PreQual/Technical,.pdf,EMD and Tender Fee Receipt,"1,000",Nil,Nil,No,1.0,Modification of Qualification Criteria of bidders,Technical Bid,,"65,000",Yes,fixed,,Nil,Nil,Chief Executive Officer,"Assam Livestock Development Agency, Khanapara, Guwahati, 781022",24-Jun-2022 10:00 AM,20-Jul-2022 03:00 PM,24-Jun-2022 10:00 AM,18-Jul-2022 03:00 PM,NA ,NA ,01-Jul-2022 10:00 AM,18-Jul-2022 03:00 PM,17-Aug-2022 10:00 AM,AOC,Animal Husbandry and Veterinary Department||Assam Livestock Development Agency,2022_AHVD_26098_1,"ALDA/NP-AI/15-16/315,22/06/22",Supply Full Sleeves Disposable AI Gloves and AI Sheaths,Dr Monideep Das,Internal,"Shri A Chaliha, Shri A Das, Shri S Thakuria",Monideep Das,17-Dec-2022 06:06 PM,finsummary_40297.pdf (1273.21 KB),Dr Manoj Kumar Goswami,Internal,Dr Dulajit Pathak Dr Indrani Hazarika,Monideep Das,16-Aug-2022 07:46 PM,17-Aug-2022 10:00 AM,techsummary_40297.pdf (841.83 KB),17-Dec-2022,INR 3675859.0,30.0,Monideep Das,17-Dec-2022 06:09 PM,AOCSheath.pdf (84.00 KB),1.0,153136.0,Stridewel International,INR,3675859.0,Finance,Only 1 bidders has been qualified for AOC,Monideep Das,17-Dec-2022 05:53 PM,,BOQ Comparative Chart,Technical,"Out the 4 bidders, Plasti Surge Industries Pvt Ltd and Kshama Surgical Pvt Ltd failed to technically qualify in any of the items quoted. Hence, their technical bids stands rejected.",Monideep Das,16-Aug-2022 07:42 PM,technical_40297.pdf,1.0,153698.0,IMV India Private Limited,18-Jul-2022 11:08 AM,Not Admitted-Finance,Not qualified for AOC,17-Dec-2022 05:53 PM,AOC
,,,,,,,,,,,,,,,,,,,,,,,,,,,,,,,,,,,,.pdf,SBD,,,,,,,,,,,,,,,,,,,,,,,,,,AOC,,,,,,,,,,,,,,,,,,,,,,,,,,,,,,,,,,,,,,,,2.0,153736.0,KSHAMA SURGICAL PVT LTD,18-Jul-2022 01:28 PM,Not Admitted-Fee/PreQual/Technical,Not Complied with technical specification,16-Aug-2022 07:42 PM,AOC
,,,,,,,,,,,,,,,,,,,,,,,,,,,,,,,,,,,,.pdf,Technical Qualification Details,,,,,,,,,,,,,,,,,,,,,,,,,,AOC,,,,,,,,,,,,,,,,,,,,,,,,,,,,,,,,,,,,,,,,3.0,153243.0,PLASTI SURGE INDUSTRIES PVT LTD,18-Jul-2022 02:46 PM,Not Admitted-Fee/PreQual/Technical,Not Complied with technical specification,16-Aug-2022 07:42 PM,AOC
,,,,,,,,,,,,,,,,,,,,,,,,,,,,,,,,,,,,.pdf,Letter of Bid (Technical),,,,,,,,,,,,,,,,,,,,,,,,,,AOC,,,,,,,,,,,,,,,,,,,,,,,,,,,,,,,,,,,,,,,,4.0,153136.0,Stridewel International,17-Jul-2022 09:54 PM,Accepted-AOC,L1,17-Dec-2022 06:10 PM,AOC
,,,,,,,,,,,,,,,,,,,,,,,,,,,,,,,,,,2.0,Finance,.xls,Financial Bid,,,,,,,,,,,,,,,,,,,,,,,,,,AOC,,,,,,,,,,,,,,,,,,,,,,,,,,,,,,,,,,,,,,,,,,,,,,,AOC
