Organisation Chain :,Tender ID :,Tender Ref No :,Tender Title :,Committee Chairperson/Co-ordinator Name :,Committee Chairperson/Co-ordinator Type :,Committee Members :,Updated By :,Updated on :,Document :,S.No,Bid Number,Bidder Name,Awarded Currency,Awarded Value,Contract Date :,Contract Value :,Work Completion Period in days :,Updated By :.1,Updated on :.1,AOC document :,AOC Description :,S.No.1,Bid Number.1,Bidder Name.1,Submitted Date,Status,Remarks,Status Updated On,Type :,Summary :,Updated By :.2,Updated On :,Document :.1,Committee Chairperson/Co-ordinator Name :.1,Committee Chairperson/Co-ordinator Type :.1,Committee Members :.1,Updated By :.3,Updated On :.1,Financial Bid Opening Date:,Document :.2,Type :.1,Summary :.1,Updated By :.4,Updated On :.2,Document :.3,BOQ Comparative Chart :,Tender Stage,S.No,Bank Name,EMD Amount in ₹,EMD Exemption Allowed,EMD Fee Type,EMD Percentage,EMD Payable To,EMD Payable At,Name,Address,Tender Fee in ₹,Fee Payable To,Fee Payable At,Tender Fee Exemption Allowed,Organisation Chain,Tender Reference Number,Tender ID,Withdrawal Allowed,Tender Type,Form of contract,Tender Category,No. of Covers,General Technical Evaluation Allowed,ItemWise Technical Evaluation Allowed,Payment Mode,Is Multi Currency Allowed For BOQ,Is Multi Currency Allowed For Fee,Allow Two Stage Bidding,Publish Date,Bid Opening Date,Document Download / Sale Start Date,Document Download / Sale End Date,Clarification Start Date,Clarification End Date,Bid Submission Start Date,Bid Submission End Date,Financial Bid Opening Date,Cover No,Cover,Document Type,Description,Title,Work Description,Pre Qualification Details,Independent External Monitor/Remarks,Tender Value in ₹,Product Category,Sub category,Contract Type,Bid Validity(Days),Period Of Work(Days),Location,Pincode,Pre Bid Meeting Place,Pre Bid Meeting Address,Pre Bid Meeting Date,Bid Opening Place,Should Allow NDA Tender,Allow Preferential Bidder,Tender Stage
PWD,2022_PWD_57162_26,16112-61,Annual Maintenance Plan (AMP) of Shahpur Sub Division for the Year 2022-23 PMGSY Rural road U/G of Bhanala to Rulehad road (HP-04-445) (HP0413VR005) Km. 7/0 to 8/0,Er.Vijay Kumar Verma,Internal,"Divisional Head Draughtsman, HPPWD, Kangra, Superintendent (Gr-II) (Estt.) HPPWD, Kangra Superintendent (Gr-II) (Accounts) HPPWD, Kangra",Vijay Kumar Verma,21-May-2022 10:32 AM,finsummary_86364.pdf (251.73 KB),1.0,270757.0,Rakesh Mahajan Govt Contractor,INR,"2,019,594",20-Dec-2022,"INR 1,977,216",30.0,Sushil Kumar Dhadwal,20-Dec-2022 10:57 AM,AOC.pdf (2204.00 KB),AOC,1.0,270826.0,rajat thakur govt contractor,20-Mar-2022 05:43 PM,Rejected-Technical,Non Responsive,24-Mar-2022 05:24 PM,Technical,Summary,Vijay Kumar Verma,24-Mar-2022 05:22 PM,technical_86364.pdf,Er. Vijay Kumar Verma,Internal,"Divisional Head Draughtsman, HPPWD, Kangra, Superintendent (Gr-II) (Estt.) HPPWD, Kangra Superintendent (Gr-II) (Accounts) HPPWD, Kangra",Vijay Kumar Verma,24-Mar-2022 05:24 PM,25-Mar-2022 03:00 PM,techsummary_86364.pdf (646.56 KB),Finance,Summary,Vijay Kumar Verma,21-May-2022 10:30 AM,finance_86364.pdf,BOQ Comparative Chart,AOC,1.0,ICICI BANK,"37,200",No,fixed,,Nil,Nil,Executive Engineer,"Executive Engineer, HPPWD, Division, Kangra",500.0,Nil,Nil,No,PWD,16112-61,2022_PWD_57162_26,Yes,Open Tender,Item Rate,Works,2.0,No,No,Online,No,No,No,11-Mar-2022 09:00 AM,21-Mar-2022 11:00 AM,11-Mar-2022 09:00 AM,21-Mar-2022 10:00 AM,NA ,NA ,11-Mar-2022 10:00 AM,21-Mar-2022 10:00 AM,25-Mar-2022 03:00 PM,1.0,Fee/PreQual/Technical,.pdf,Cost of tender form indicated in schedule-F (Required only National Bank),Annual Maintenance Plan (AMP) of Shahpur Sub Division for the Year 2022-23 PMGSY Rural road U/G of Bhanala to Rulehad road (HP-04-445) (HP0413VR005) Km. 7/0 to 8/0,P/Laying 30mm thick bituminous concrete in Km.7/0 to 8/0,Please refer Tender documents. ,NA ,"19,77,216",Civil Works - Roads,NA ,Tender,120.0,30.0,Kangra,176001.0,NA ,NA ,NA ,Kangra,No ,No,AOC
,,,,,,,,,,,,,,,,,,,,,,2.0,270757.0,Rakesh Mahajan Govt Contractor,19-Mar-2022 06:44 PM,Accepted-AOC,Award,20-Dec-2022 10:58 AM,,,,,,,,,,,,,,,,,,,AOC,2.0,ICICI NEFT/RTGS,,,,,,,,,,,,,,,,,,,,,,,,,,,,,,,,,,,,,,.pdf,Earnest Money indicated in schedule-F,,,,,,,,,,,,,,,,,,,AOC
,,,,,,,,,,,,,,,,,,,,,,3.0,271143.0,VP SHARMA,20-Mar-2022 12:45 PM,Rejected-Finance,rate higher side,21-May-2022 10:32 AM,,,,,,,,,,,,,,,,,,,AOC,,,,,,,,,,,,,,,,,,,,,,,,,,,,,,,,,,,,,,,,.pdf,Detail of technical staff required as per Clause 36(1(2) and 36(A),,,,,,,,,,,,,,,,,,,AOC
,,,,,,,,,,,,,,,,,,,,,,,,,,,,,,,,,,,,,,,,,,,,,,,AOC,,,,,,,,,,,,,,,,,,,,,,,,,,,,,,,,,,,,,,,,.pdf,Detail of Litigation case,,,,,,,,,,,,,,,,,,,AOC
,,,,,,,,,,,,,,,,,,,,,,,,,,,,,,,,,,,,,,,,,,,,,,,AOC,,,,,,,,,,,,,,,,,,,,,,,,,,,,,,,,,,,,,,,,.pdf,List of machinery tool plant shown in schedule-F (Sr. No-6.19) (Refer clause No-18),,,,,,,,,,,,,,,,,,,AOC
,,,,,,,,,,,,,,,,,,,,,,,,,,,,,,,,,,,,,,,,,,,,,,,AOC,,,,,,,,,,,,,,,,,,,,,,,,,,,,,,,,,,,,,,,,.pdf,Contractor Registration (Refer General Rule No-23),,,,,,,,,,,,,,,,,,,AOC
,,,,,,,,,,,,,,,,,,,,,,,,,,,,,,,,,,,,,,,,,,,,,,,AOC,,,,,,,,,,,,,,,,,,,,,,,,,,,,,,,,,,,,,,,,.pdf,List of equipment to be provided by the contractor at site as per Sr. No. 6.14 refer clause No 10(A),,,,,,,,,,,,,,,,,,,AOC
,,,,,,,,,,,,,,,,,,,,,,,,,,,,,,,,,,,,,,,,,,,,,,,AOC,,,,,,,,,,,,,,,,,,,,,,,,,,,,,,,,,,,,,,,,.pdf,HPPWD Form No-8 (Shown in General Rule and Direction 26(26.7),,,,,,,,,,,,,,,,,,,AOC
,,,,,,,,,,,,,,,,,,,,,,,,,,,,,,,,,,,,,,,,,,,,,,,AOC,,,,,,,,,,,,,,,,,,,,,,,,,,,,,,,,,,,,,,2.0,Finance,.xls,BOQ,,,,,,,,,,,,,,,,,,,AOC
