S.No,Bid Number,Bidder Name,Awarded Currency,Awarded Value,Organisation Chain :,Tender ID :,Tender Ref No :,Tender Title :,Committee Chairperson/Co-ordinator Name :,Committee Chairperson/Co-ordinator Type :,Committee Members :,Updated By :,Updated on :,Document :,S.No.1,Bid Number.1,Bidder Name.1,Submitted Date,Status,Remarks,Status Updated On,Committee Chairperson/Co-ordinator Name :.1,Committee Chairperson/Co-ordinator Type :.1,Committee Members :.1,Updated By :.1,Updated On :,Financial Bid Opening Date:,Document :.1,Type :,Summary :,Updated By :.2,Updated On :.1,Document :.2,Type :.1,Summary :.1,Updated By :.3,Updated On :.2,Document :.3,BOQ Comparative Chart :,Contract Date :,Contract Value :,Work Completion Period in days :,Updated By :.4,Updated on :.1,AOC document :,AOC Description :,Tender Stage,Organisation Chain,Tender Reference Number,Tender ID,Withdrawal Allowed,Tender Type,Form of contract,Tender Category,No. of Covers,General Technical Evaluation Allowed,ItemWise Technical Evaluation Allowed,Payment Mode,Is Multi Currency Allowed For BOQ,Is Multi Currency Allowed For Fee,Allow Two Stage Bidding,Cover No,Cover,Document Type,Description,Title,Work Description,Pre Qualification Details,Independent External Monitor/Remarks,Tender Value in ₹,Product Category,Sub category,Contract Type,Bid Validity(Days),Period Of Work(Days),Location,Pincode,Pre Bid Meeting Place,Pre Bid Meeting Address,Pre Bid Meeting Date,Bid Opening Place,Should Allow NDA Tender,Allow Preferential Bidder,S.No,Bank Name,Publish Date,Bid Opening Date,Document Download / Sale Start Date,Document Download / Sale End Date,Clarification Start Date,Clarification End Date,Bid Submission Start Date,Bid Submission End Date,Financial Bid Opening Date,EMD Amount in ₹,EMD Exemption Allowed,EMD Fee Type,EMD Percentage,EMD Payable To,EMD Payable At,Tender Fee in ₹,Fee Payable To,Fee Payable At,Tender Fee Exemption Allowed,Name,Address,Tender Stage
1.0,270638.0,GULAM MOHIDEEN MIR,INR,"753,401",HPSEBL||CE(ES) Hamirpur||SE(ES) Shimla,2022_HPSEB_58035_1,SEES/SHIMLA-304/2021-22,SEES/SHIMLA-304/2021-22,"SE, ES Circle Totu-shimla",Internal,"SE totu,XEN shimla, AAO shimla, HDM totu, Chief Hamirpur, CAO shimla",gurprit Singh,13-Apr-2022 02:45 PM,finsummary_87625.pdf (322.59 KB),1.0,270638.0,GULAM MOHIDEEN MIR,21-Mar-2022 05:16 PM,Accepted-AOC,Awarded,14-Dec-2022 12:44 PM,"SE, ES Circle Totu-shimla",Internal,"SE totu, XEN Shimla, AAO Shimla, HDM Shimla, Chief Hamirpur, CAO shimla",gurprit Singh,04-Apr-2022 10:58 AM,06-Apr-2022 11:30 AM,techsummary_87625.pdf (311.90 KB),Technical,pricebid,gurprit Singh,04-Apr-2022 10:55 AM,None,Finance,pricebid,gurprit Singh,13-Apr-2022 02:42 PM,None,BOQ Comparative Chart,25-May-2022,"INR 753,401",90.0,gurprit Singh,14-Dec-2022 12:43 PM,304award.pdf (376.00 KB),Awarded to Mr. Gulam Mohideen Mir,AOC,HPSEBL||CE(ES) Hamirpur||SE(ES) Shimla,SEES/SHIMLA-304/2021-22,2022_HPSEB_58035_1,Yes,Open Tender,Item Rate,Works,3.0,No,No,Online,No,No,No,1.0,Fee,.pdf,Tender Cost and Tender Fees,SEES/SHIMLA-304/2021-22,Re-Construction of damaged brast wall at tower No. GS-44 of Giri- Solan Ckt. No. II under Electrical System Division HPSEBL Solan,please refer tender documents ,NA ,"9,74,467",Civil Works,NA ,Tender,180.0,90.0,Giri Solan,173211.0,NA ,NA ,NA ,Shimla,No ,No,1.0,ICICI BANK,15-Mar-2022 05:15 PM,23-Mar-2022 11:30 AM,16-Mar-2022 10:00 AM,22-Mar-2022 11:00 AM,NA ,NA ,17-Mar-2022 10:00 AM,22-Mar-2022 11:00 AM,06-Apr-2022 11:30 AM,"19,500",Yes,fixed,,Nil,Nil,"1,180",Nil,Nil,Yes,Superintending Engineer,Superintending Engineer ES Circle HPSEBL Totu,AOC
,,,,,,,,,,,,,,,2.0,271633.0,Mohan Singh,22-Mar-2022 09:38 AM,Not Admitted-PreQual/Technical,Not Complied with technical specification,04-Apr-2022 10:55 AM,,,,,,,,,,,,,,,,,,,,,,,,,,AOC,,,,,,,,,,,,,,,,,.pdf,EMD,,,,,,,,,,,,,,,,,,,2.0,ICICI NEFT/RTGS,,,,,,,,,,,,,,,,,,,,,,AOC
,,,,,,,,,,,,,,,3.0,271588.0,SACHIN GARG,21-Mar-2022 09:52 PM,Not Admitted-PreQual/Technical,Not Complied with technical specification,04-Apr-2022 10:55 AM,,,,,,,,,,,,,,,,,,,,,,,,,,AOC,,,,,,,,,,,,,,,2.0,PreQual/Technical,.xls,Technical and Commerical bid,,,,,,,,,,,,,,,,,,,,,,,,,,,,,,,,,,,,,,,,,,AOC
,,,,,,,,,,,,,,,,,,,,,,,,,,,,,,,,,,,,,,,,,,,,,,,AOC,,,,,,,,,,,,,,,,,.pdf,required documents to be uploated as per tender documents,,,,,,,,,,,,,,,,,,,,,,,,,,,,,,,,,,,,,,,,,,AOC
,,,,,,,,,,,,,,,,,,,,,,,,,,,,,,,,,,,,,,,,,,,,,,,AOC,,,,,,,,,,,,,,,3.0,Finance,.xls,price bid,,,,,,,,,,,,,,,,,,,,,,,,,,,,,,,,,,,,,,,,,,AOC
