Organisation Chain :,Tender ID :,Tender Ref No :,Tender Title :,S.No,Bid Number,Bidder Name,Awarded Currency,Awarded Value,Committee Chairperson/Co-ordinator Name :,Committee Chairperson/Co-ordinator Type :,Committee Members :,Updated By :,Updated on :,Document :,Type :,Summary :,Updated By :.1,Updated On :,Document :.1,BOQ Comparative Chart :,Type :.1,Summary :.1,Updated By :.2,Updated On :.1,Document :.2,Contract Date :,Contract Value :,Work Completion Period in days :,Updated By :.3,Updated on :.1,AOC document :,AOC Description :,Committee Chairperson/Co-ordinator Name :.1,Committee Chairperson/Co-ordinator Type :.1,Committee Members :.1,Updated By :.4,Updated On :.2,Financial Bid Opening Date:,Document :.3,S.No.1,Bid Number.1,Bidder Name.1,Submitted Date,Status,Remarks,Status Updated On,Tender Stage,EMD Amount in ₹,EMD Exemption Allowed,EMD Fee Type,EMD Percentage,EMD Payable To,EMD Payable At,Name,Address,Publish Date,Bid Opening Date,Document Download / Sale Start Date,Document Download / Sale End Date,Clarification Start Date,Clarification End Date,Bid Submission Start Date,Bid Submission End Date,Financial Bid Opening Date,Title,Work Description,Pre Qualification Details,Independent External Monitor/Remarks,Tender Value in ₹,Product Category,Sub category,Contract Type,Bid Validity(Days),Period Of Work(Days),Location,Pincode,Pre Bid Meeting Place,Pre Bid Meeting Address,Pre Bid Meeting Date,Bid Opening Place,Should Allow NDA Tender,Allow Preferential Bidder,S.No,Bank Name,Organisation Chain,Tender Reference Number,Tender ID,Withdrawal Allowed,Tender Type,Form of contract,Tender Category,No. of Covers,General Technical Evaluation Allowed,ItemWise Technical Evaluation Allowed,Payment Mode,Is Multi Currency Allowed For BOQ,Is Multi Currency Allowed For Fee,Allow Two Stage Bidding,Cover No,Cover,Document Type,Description,Tender Fee in ₹,Fee Payable To,Fee Payable At,Tender Fee Exemption Allowed,Tender Stage
"HP Irrigation and Public Health||S Nagar Circle,Irrigation and Public Health,HP||Baggi,Irrigation and Public Health,HP",2021_HPIPH_54379_1,EE-JSD-BAGGI/2021- 24405-54 DATED 06/12/2021,CAD OF FIS NATNED KULH IN GP BEHAL,1.0,249065.0,Narender Singh,INR,"1,525,323",As per list attached,Internal,List attached,Praveen Kumar Gupta,24-Dec-2022 10:19 AM,finsummary_81424.pdf (160.33 KB),Finance,FINANCIAL BIDS,Harsh Sharma,16-Dec-2021 04:10 PM,finance_81424.pdf,BOQ Comparative Chart,Technical,MINUTES OF MEETING,Harsh Sharma,16-Dec-2021 03:40 PM,technical_81424.pdf,24-Dec-2022,"INR 1,525,323",180.0,Praveen Kumar Gupta,24-Dec-2022 10:22 AM,918_2021_22.pdf (2340.00 KB),AOC,LIST ATTACHED,Internal,LIST ATTACHED,Harsh Sharma,16-Dec-2021 03:44 PM,16-Dec-2021 03:50 PM,techsummary_81424.pdf (6968.33 KB),1.0,249065.0,Narender Singh,13-Dec-2021 11:25 AM,Accepted-AOC,AOC,24-Dec-2022 10:23 AM,AOC,"30,600",Yes,fixed,,EE BAGGI,BAGGI,EE,EXECUTIVE ENGINEER JAL SHAKTI DIVISION BAGGI,07-Dec-2021 09:00 AM,14-Dec-2021 11:30 AM,07-Dec-2021 10:00 AM,13-Dec-2021 05:00 PM,NA ,NA ,07-Dec-2021 05:00 PM,13-Dec-2021 05:00 PM,16-Dec-2021 03:50 PM,CAD OF FIS NATNED KULH IN GP BEHAL,AS PER BOQ,AS PER NIT ,NA ,"15,35,940",Civil Works,NA ,Tender,120.0,180.0,BAGI,175027.0,NA ,NA ,NA ,BAGGI,No ,No,1.0,ICICI BANK,"HP Irrigation and Public Health||S Nagar Circle,Irrigation and Public Health,HP||Baggi,Irrigation and Public Health,HP",EE-JSD-BAGGI/2021- 24405-54 DATED 06/12/2021,2021_HPIPH_54379_1,Yes,Open Tender,Item Rate,Works,2.0,No,No,Both(Online/Offline),No,No,No,1.0,Fee/PreQual/Technical,.pdf,ALL PAYMENT REGARDING PURCHASE OF BID DOCUMENT AND EMD AS REQUIRED NIT CONDITIO NO. 2(I),400.0,EE BAGGI,BAGGI,No,AOC
,,,,,,,,,,,,,,,,,,,,,,,,,,,,,,,,,,,,,,,,2.0,249071.0,Oasis Enterprises,13-Dec-2021 11:13 AM,Rejected-Finance,Lowest-2,24-Dec-2022 10:19 AM,AOC,,,,,,,,,,,,,,,,,,,,,,,,,,,,,,,,,,,,2.0,ICICI NEFT/RTGS,,,,,,,,,,,,,,,,,.pdf,REGISTRATION WITH HPIPH DEPARTMENT IN APPROPRIATE CLASS AND LATEST RENEWAL.,,,,,AOC
,,,,,,,,,,,,,,,,,,,,,,,,,,,,,,,,,,,,,,,,,,,,,,,AOC,,,,,,,,,,,,,,,,,,,,,,,,,,,,,,,,,,,,,,,,,,,,,,,,,,,,,,.pdf,PAN NO. AND GST REGISTRATION,,,,,AOC
,,,,,,,,,,,,,,,,,,,,,,,,,,,,,,,,,,,,,,,,,,,,,,,AOC,,,,,,,,,,,,,,,,,,,,,,,,,,,,,,,,,,,,,,,,,,,,,,,,,,,,,,.pdf,SCANNED COPY OF UNDERTAKING AS REQUIRED NIT CONDITION NO. 2(IV),,,,,AOC
,,,,,,,,,,,,,,,,,,,,,,,,,,,,,,,,,,,,,,,,,,,,,,,AOC,,,,,,,,,,,,,,,,,,,,,,,,,,,,,,,,,,,,,,,,,,,,,,,,,,,,,,.pdf,AUTHORIZATION LETTER REGARDING DSC OF THE PERSON AUTHORIZED BY THE REGISTERED TENDERER.,,,,,AOC
,,,,,,,,,,,,,,,,,,,,,,,,,,,,,,,,,,,,,,,,,,,,,,,AOC,,,,,,,,,,,,,,,,,,,,,,,,,,,,,,,,,,,,,,,,,,,,,,,,,,,,2.0,Finance,.xls,BOQ,,,,,AOC
