Organisation Chain :,Tender ID :,Tender Ref No :,Tender Title :,S.No,Bid Number,Bidder Name,Awarded Currency,Awarded Value,Committee Chairperson/Co-ordinator Name :,Committee Chairperson/Co-ordinator Type :,Committee Members :,Updated By :,Updated on :,Document :,S.No.1,Bid Number.1,Bidder Name.1,Submitted Date,Status,Remarks,Status Updated On,Committee Chairperson/Co-ordinator Name :.1,Committee Chairperson/Co-ordinator Type :.1,Committee Members :.1,Updated By :.1,Updated On :,Financial Bid Opening Date:,Document :.1,Type :,Summary :,Updated By :.2,Updated On :.1,Document :.2,Type :.1,Summary :.1,Updated By :.3,Updated On :.2,Document :.3,BOQ Comparative Chart :,Contract Date :,Contract Value :,Work Completion Period in days :,Updated By :.4,Updated on :.1,AOC document :,AOC Description :,Tender Stage,Organisation Chain,Tender Reference Number,Tender ID,Withdrawal Allowed,Tender Type,Form of contract,Tender Category,No. of Covers,General Technical Evaluation Allowed,ItemWise Technical Evaluation Allowed,Payment Mode,Is Multi Currency Allowed For BOQ,Is Multi Currency Allowed For Fee,Allow Two Stage Bidding,S.No,Bank Name,Name,Address,Tender Fee in ₹,Fee Payable To,Fee Payable At,Tender Fee Exemption Allowed,EMD Amount in ₹,EMD Exemption Allowed,EMD Fee Type,EMD Percentage,EMD Payable To,EMD Payable At,Publish Date,Bid Opening Date,Document Download / Sale Start Date,Document Download / Sale End Date,Clarification Start Date,Clarification End Date,Bid Submission Start Date,Bid Submission End Date,Financial Bid Opening Date,Title,Work Description,Pre Qualification Details,Independent External Monitor/Remarks,Tender Value in ₹,Product Category,Sub category,Contract Type,Bid Validity(Days),Period Of Work(Days),Location,Pincode,Pre Bid Meeting Place,Pre Bid Meeting Address,Pre Bid Meeting Date,Bid Opening Place,Should Allow NDA Tender,Allow Preferential Bidder,Cover No,Cover,Document Type,Description,Tender Stage
"HP Irrigation and Public Health||Nahan Circle,Irrigation and Public Health,HP||Nalagarh,Irrigation and Public Health,HP",2022_HPIPH_64759_1,9699-9739 dated 09-09-2022,Construction of OHSR 70000 liter capacity with column type staging height 15 metre in Village Miyanpur Dhang Upprli and Khanoa in Tehsil Nalagarh District Solan HP Sub Head Sector Storage Tank of 70000 ltrs capacity at Khanoa,1.0,300802.0,MANPREET KUMAR GOVT. CONTRACTOR,INR,"1,120,000",Er. Puneet Sharma,Internal,Supdt DAO DHD,Puneet Sharma,06-Dec-2022 10:37 AM,finsummary_97464.pdf (3804.58 KB),1.0,300802.0,MANPREET KUMAR GOVT. CONTRACTOR,15-Sep-2022 08:28 PM,Accepted-AOC,Awarded to lowest bidder,06-Dec-2022 10:40 AM,Er. Puneet Sharma,Internal,Supdt DAO DHD,Puneet Sharma,20-Sep-2022 12:28 PM,20-Sep-2022 12:30 PM,techsummary_97464.pdf (3695.80 KB),Technical,Documents checked by the committee thee bidder participated in tender and all are found in order,Puneet Sharma,20-Sep-2022 12:26 PM,technical_97464.pdf,Finance,Financial bid opened successfully,Puneet Sharma,26-Sep-2022 11:01 AM,finance_97464.pdf,BOQ Comparative Chart,06-Dec-2022,"INR 997,500",180.0,Puneet Sharma,06-Dec-2022 10:39 AM,AOC.pdf (2841.00 KB),"Works awarded to lowest Bidder Sh. Manpreet Kumar, Village Basowal Sultani, Po Baroona Tehsil Nalagarh District Solan (HP).",AOC,"HP Irrigation and Public Health||Nahan Circle,Irrigation and Public Health,HP||Nalagarh,Irrigation and Public Health,HP",9699-9739 dated 09-09-2022,2022_HPIPH_64759_1,Yes,Open Tender,Item Rate,Works,2.0,No,No,Online,No,No,No,1.0,ICICI BANK,Executive Engineer,Jal Shakti Division Nalagarh District Solan HP,250.0,Nil,Nil,No,"19,950",Yes,fixed,,Nil,Nil,09-Sep-2022 04:00 PM,17-Sep-2022 11:30 AM,09-Sep-2022 04:00 PM,17-Sep-2022 11:00 AM,NA ,NA ,09-Sep-2022 04:00 PM,17-Sep-2022 11:00 AM,20-Sep-2022 12:30 PM,Construction of OHSR 70000 liter capacity with column type staging height 15 metre in Village Miyanpur Dhang Upprli and Khanoa in Tehsil Nalagarh District Solan HP Sub Head Sector Storage Tank of 70000 ltrs capacity at Khanoa,Construction of OHSR 70000 liter capacity with column type staging height 15 metre in Village Miyanpur Dhang Upprli and Khanoa in Tehsil Nalagarh District Solan HP Sub Head Sector Storage Tank of 70000 ltrs capacity at Khanoa,Please refer Tender documents. ,NA ,"9,97,500",Civil Works,NA ,Tender,120.0,180.0,Nalagarh,174101.0,NA ,NA ,NA ,JSV Division Nalagarh,No ,No,1.0,Fee/PreQual/Technical,.pdf,Earnest Money (As per NIT),AOC
,,,,,,,,,,,,,,,2.0,301674.0,SAJJAN SINGH GOVT CONTRACTOR,16-Sep-2022 06:00 PM,Rejected-Finance,Higher Amount,06-Dec-2022 10:37 AM,,,,,,,,,,,,,,,,,,,,,,,,,,AOC,,,,,,,,,,,,,,,2.0,ICICI NEFT/RTGS,,,,,,,,,,,,,,,,,,,,,,,,,,,,,,,,,,,,,,,,,,.pdf,Cost of tender forms (As per NIT),AOC
,,,,,,,,,,,,,,,3.0,301734.0,Vijay Kumar,16-Sep-2022 04:59 PM,Rejected-Finance,Higher Amount,06-Dec-2022 10:37 AM,,,,,,,,,,,,,,,,,,,,,,,,,,AOC,,,,,,,,,,,,,,,,,,,,,,,,,,,,,,,,,,,,,,,,,,,,,,,,,,,,,,,,,,.pdf,Registration with JSV (As per NIT),AOC
,,,,,,,,,,,,,,,,,,,,,,,,,,,,,,,,,,,,,,,,,,,,,,,AOC,,,,,,,,,,,,,,,,,,,,,,,,,,,,,,,,,,,,,,,,,,,,,,,,,,,,,,,,,,.pdf,PAN EPF GST ITR (As per NIT),AOC
,,,,,,,,,,,,,,,,,,,,,,,,,,,,,,,,,,,,,,,,,,,,,,,AOC,,,,,,,,,,,,,,,,,,,,,,,,,,,,,,,,,,,,,,,,,,,,,,,,,,,,,,,,,,.pdf,"Undertaking for terms and condition, form 6 form 8 and BOQ etc. (As per NIT)",AOC
,,,,,,,,,,,,,,,,,,,,,,,,,,,,,,,,,,,,,,,,,,,,,,,AOC,,,,,,,,,,,,,,,,,,,,,,,,,,,,,,,,,,,,,,,,,,,,,,,,,,,,,,,,,,.pdf,Joint Venture not allowed (As per NIT),AOC
,,,,,,,,,,,,,,,,,,,,,,,,,,,,,,,,,,,,,,,,,,,,,,,AOC,,,,,,,,,,,,,,,,,,,,,,,,,,,,,,,,,,,,,,,,,,,,,,,,,,,,,,,,2.0,Finance,.xls,BOQ,AOC
