Organisation Chain,Tender Reference Number,Tender ID,Withdrawal Allowed,Tender Type,Form of contract,Tender Category,No. of Covers,General Technical Evaluation Allowed,ItemWise Technical Evaluation Allowed,Payment Mode,Is Multi Currency Allowed For BOQ,Is Multi Currency Allowed For Fee,Allow Two Stage Bidding,Publish Date,Bid Opening Date,Document Download / Sale Start Date,Document Download / Sale End Date,Clarification Start Date,Clarification End Date,Bid Submission Start Date,Bid Submission End Date,Financial Bid Opening Date,Publish Date.1,Bid Opening Date.1,Bid Submission Opening Date,Bid Submission Closing Date,Pre Bid Meeting Date,EMD Amount in ₹,EMD through BG/ST or EMD Exemption Allowed,EMD Fee Type,EMD Percentage,EMD Payable To,EMD Payable At,Title,Work Description,Pre Qualification Details,Independent External Monitor/Remarks,Tender Value in ₹,Product Category,Sub category,Contract Type,Bid Validity(Days),Period Of Work(Days),Location,Pincode,Pre Bid Meeting Place,Pre Bid Meeting Address,Pre Bid Meeting Date.1,Bid Opening Place,Should Allow NDA Tender,Allow Preferential Bidder,Cover No,Cover,Document Type,Description,S.No,Corrigendum Title,Corrigendum Type,View,Tender Fee in ₹,Fee Payable To,Fee Payable At,Tender Fee Exemption Allowed,Name,Address,S.No.1,Bank Name,Tender Stage,Committee Chairperson/Co-ordinator Name :,Committee Chairperson/Co-ordinator Type :,Committee Members :,Updated By :,Updated on :,Document :,Type :,Summary :,Updated By :.1,Updated On :,Document :.1,BOQ Comparative Chart :,Committee Chairperson/Co-ordinator Name :.1,Committee Chairperson/Co-ordinator Type :.1,Committee Members :.1,Updated By :.2,Updated On :.1,Document :.2,S.No,Bid Number,Bidder Name,Awarded Currency,Awarded Value,Type :.1,Summary :.1,Updated By :.3,Updated On :.2,Document :.3,Contract Date :,Contract Value :,Work Completion Period in days :,Updated By :.4,Updated on :.1,AOC document :,Organisation Chain :,Tender ID :,Tender Ref No :,Tender Title :,S.No.1,Bid Number.1,Bidder Name.1,Submitted Date,Status,Remarks,Status Updated On,Tender Stage
Director- Fire and Emergency Services-Assam,F and ES/PS/271/PT-III/2063 DATED 07/08/2020,2020_FESA_18319_1,Yes,Open Tender,Works,Works,2.0,No,No,Online,No,No,Yes,07-Aug-2020 06:00 PM,29-Aug-2020 04:00 PM,07-Aug-2020 06:30 PM,29-Aug-2020 01:00 PM,07-Aug-2020 06:30 PM ,17-Aug-2020 02:30 PM ,18-Aug-2020 04:00 PM,29-Aug-2020 01:00 PM,22-Sep-2020 04:00 PM,19-Sep-2020 06:00 PM,22-Sep-2020 04:00 PM,19-Sep-2020 06:30 PM,22-Sep-2020 02:00 PM,,"8,00,000",Yes,fixed,,"Director Fire and Emergency Services, Assam",Guwahati,"Procurement of 9(Nine) Water Bowser for Fire and Emergency Services, Assam","Procurement of 9(Nine) Water Bowser for Fire and Emergency Services, Assam",Please refer Tender documents. ,NA ,"4,00,25,000",Composite Works,NA ,Tender,365.0,90.0,Panbazar Guwahati,781001.0,Panbazar Guwahati ,"Office of the Director Fire and Emergency Services, Assam ",17-Aug-2020 03:00 PM ,Panbazar Guwahati,No ,No,1.0,Fee/PreQual/Technical,.pdf,NIT,1.0,CORRIGENDUM,Technical Bid,,"8,000","Director Fire and Emergency Services, Assam",Guwahati,No,"Director Fire and Emergency Services, Assam","Office of the Director Fire and Emergency Services, Assam, Panbazar, Guwahati-781001",1.0,SBI Bank,AOC,Y K GAUTAM,Internal,"N C BASUMATARY, K J HILALY, D NATH, L GOSWAMI",Lohit Goswami,01-Jan-2021 05:00 PM,finsummary_28307.pdf (1973.07 KB),Finance,SUMMARY,Pulin Chandra Roy,26-Nov-2020 01:51 PM,finance_28307.pdf,BOQ Comparative Chart,Y K GAUTAM,Internal,"P BHUYAN, D NATH, S BHATTACHARYYA, L GOSWAMI, A MEDHI, B N TALUKDAR",Lohit Goswami,19-Sep-2020 04:45 PM,techsummary_28307.pdf (3468.14 KB),1.0,87430.0,ANAND FABRICATORS & ENGINEERS,INR,39546992.0,Technical,SUMMARY,Pulin Chandra Roy,11-Sep-2020 04:32 PM,technical_28307.pdf,06-Jan-2021,INR 39546992,90.0,Lohit Goswami,07-Jan-2021 05:49 PM,WB1.pdf (2269.00 KB),Director- Fire and Emergency Services-Assam,2020_FESA_18319_1,F and ES/PS/271/PT-III/2063 DATED 07/08/2020,"Procurement of 9(Nine) Water Bowser for Fire and Emergency Services, Assam",1,87430,ANAND FABRICATORS & ENGINEERS,29-Aug-2020 11:15 AM,Accepted-AOC,As Govt. sanction,07-Jan-2021 05:49 PM,AOC
,,,,,,,,,,,,,,,,,,,,,,,,,,,,,,,,,,,,,,,,,,,,,,,,,,,,,,.pdf,TENDER DOCUMENT,,,,,,,,,,,,,AOC,,,,,,,,,,,,,,,,,,,,,,,,,,,,,,,,,,,,,,,2,86884,AshokaHightec Pvt. Ltd.,27-Aug-2020 11:59 AM,Rejected-Finance,Financially rejected,01-Jan-2021 05:00 PM,AOC
,,,,,,,,,,,,,,,,,,,,,,,,,,,,,,,,,,,,,,,,,,,,,,,,,,,,,,.pdf,ELIGIBILITY CRITERIA,,,,,,,,,,,,,AOC,,,,,,,,,,,,,,,,,,,,,,,,,,,,,,,,,,,,,,,3,86880,BRIJBASI HITECH UDYOG LTD,28-Aug-2020 01:28 PM,Rejected-Technical,Failed to upload the performance certificate of five fire tenders,19-Sep-2020 04:45 PM,AOC
,,,,,,,,,,,,,,,,,,,,,,,,,,,,,,,,,,,,,,,,,,,,,,,,,,,,,,.pdf,PAST EXPERIENCE,,,,,,,,,,,,,AOC,,,,,,,,,,,,,,,,,,,,,,,,,,,,,,,,,,,,,,,4,87307,FIRST RESPONDERS PVT LTD,27-Aug-2020 03:24 PM,Rejected-Finance,Financially rejected,01-Jan-2021 05:00 PM,AOC
,,,,,,,,,,,,,,,,,,,,,,,,,,,,,,,,,,,,,,,,,,,,,,,,,,,,,,.pdf,ANY OTHER DOCUMENT,,,,,,,,,,,,,AOC,,,,,,,,,,,,,,,,,,,,,,,,,,,,,,,,,,,,,,,5,87087,Hindusthan Technologies.com,25-Aug-2020 07:59 PM,Rejected-Finance,Financially rejected,01-Jan-2021 05:00 PM,AOC
,,,,,,,,,,,,,,,,,,,,,,,,,,,,,,,,,,,,,,,,,,,,,,,,,,,,2.0,Finance,.xls,FINANCIAL BID,,,,,,,,,,,,,AOC,,,,,,,,,,,,,,,,,,,,,,,,,,,,,,,,,,,,,,,6,87249,SIRI TECON,28-Aug-2020 06:54 PM,Rejected-Technical,Failed to uplaod the credential or clarification through online,19-Sep-2020 04:45 PM,AOC
,,,,,,,,,,,,,,,,,,,,,,,,,,,,,,,,,,,,,,,,,,,,,,,,,,,,,,.pdf,ANY OTHER DOCUMENT,,,,,,,,,,,,,AOC,,,,,,,,,,,,,,,,,,,,,,,,,,,,,,,,,,,,,,,7,87176,Sova Hitech Industries,28-Aug-2020 04:09 PM,Rejected-Finance,Financially rejected,01-Jan-2021 05:00 PM,AOC
,,,,,,,,,,,,,,,,,,,,,,,,,,,,,,,,,,,,,,,,,,,,,,,,,,,,,,,,,,,,,,,,,,,,AOC,,,,,,,,,,,,,,,,,,,,,,,,,,,,,,,,,,,,,,,8,86789,united manufacturing co.,24-Aug-2020 04:15 PM,Rejected-Technical,Discrepancy in between make and model of vehicle mounted pump,19-Sep-2020 04:45 PM,AOC
