S.No,Bid Number,Bidder Name,Submitted Date,Status,Remarks,Status Updated On,Committee Chairperson/Co-ordinator Name :,Committee Chairperson/Co-ordinator Type :,Committee Members :,Updated By :,Updated On :,Financial Bid Opening Date:,Document :,Type :,Summary :,Updated By :.1,Updated On :.1,Document :.1,Type :.1,Summary :.1,Updated By :.2,Updated On :.2,Document :.2,BOQ Comparative Chart :,Contract Date :,Contract Value :,Work Completion Period in days :,Updated By :.3,Updated on :,AOC document :,AOC Description :,Organisation Chain :,Tender ID :,Tender Ref No :,Tender Title :,S.No.1,Bid Number.1,Bidder Name.1,Awarded Currency,Awarded Value,Committee Chairperson/Co-ordinator Name :.1,Committee Chairperson/Co-ordinator Type :.1,Committee Members :.1,Updated By :.4,Updated on :.1,Document :.3,Tender Stage,Cover No,Cover,Document Type,Description,Name,Address,S.No,Bank Name,Tender Fee in ₹,Fee Payable To,Fee Payable At,Tender Fee Exemption Allowed,EMD Amount in ₹,EMD Exemption Allowed,EMD Fee Type,EMD Percentage,EMD Payable To,EMD Payable At,Title,Work Description,Pre Qualification Details,Independent External Monitor/Remarks,Tender Value in ₹,Product Category,Sub category,Contract Type,Bid Validity(Days),Period Of Work(Days),Location,Pincode,Pre Bid Meeting Place,Pre Bid Meeting Address,Pre Bid Meeting Date,Bid Opening Place,Should Allow NDA Tender,Allow Preferential Bidder,Organisation Chain,Tender Reference Number,Tender ID,Withdrawal Allowed,Tender Type,Form of contract,Tender Category,No. of Covers,General Technical Evaluation Allowed,ItemWise Technical Evaluation Allowed,Payment Mode,Is Multi Currency Allowed For BOQ,Is Multi Currency Allowed For Fee,Allow Two Stage Bidding,Publish Date,Bid Opening Date,Document Download / Sale Start Date,Document Download / Sale End Date,Clarification Start Date,Clarification End Date,Bid Submission Start Date,Bid Submission End Date,Financial Bid Opening Date,Tender Stage
1.0,121719.0,Ajay kumar,20-Jun-2019 08:15 PM,Accepted-AOC,Lowest one,27-Jul-2019 10:02 AM,Er. Sanjay Thakur,Internal,1. Sh. Andesh Kumar (JOA) Tender Asstt. 2 Smt. Indra Devi Supdt. 3 Rattan Chand D.A.O 4 Narender Thakur,Sanjay Kumar,03-Jul-2019 12:02 PM,03-Jul-2019 12:10 PM,techsummary_42443.pdf (72.73 KB),Technical,Five bidder successfully verify and one no. bidder rejected due to non submission of required documents.,Sanjay Kumar,03-Jul-2019 11:50 AM,technical_42443.pdf,Finance,BOQ and comparative statement download successfully.,Sanjay Kumar,27-Jul-2019 09:49 AM,finance_42443.pdf,BOQ Comparative Chart,27-Jul-2019,"INR 2,453,837",180.0,Sanjay Kumar,27-Jul-2019 10:02 AM,29307.pdf (356.00 KB),Awarded to Sh Ajay Kumar Bakshi,"HP Irrigation and Public Health||Dharamshala Circle,Irrigation and Public Health,HP||Palampur,Irrigation and Public Health,HP",2019_HPIPH_29307_1,2313-50,Construction of flow irrigation scheme Maang kuhl in Tehsil Palampur District Kangra HP,1.0,121719.0,Ajay kumar,INR,"2,453,838",Er. Sanjay Thakur,Internal,. Sh. Andesh Kumar (JOA) Tender Asstt. 2 Smt. Indra Devi Supdt. 3 Rattan Chand D.A.O 4 Narender Thakur,Sanjay Kumar,27-Jul-2019 09:55 AM,finsummary_42443.pdf (71.23 KB),AOC,1.0,Fee/PreQual/Technical,.pdf,i) Scan copy of deduction of Earnest money and cost of tender.,"Executive Engineer,",IPH Division Palampur,1.0,ICICI BANK,400.0,"IPH Division, Palampur","Executive Engineer, IPH Division, Palampur",No,"44,830",Yes,fixed,,"IPH Division, Palampur","Executive Engineer, IPH Division, Palampur",Construction of flow irrigation scheme Maang kuhl in Tehsil Palampur District Kangra HP,"SH_Construction of reinforcement cement concrete channel at RD 2550 to 2670, RD 2678 to 2870, RD 2876 to 3249 _ 685 runningmetre, 2 Number Outlet chamber and 1 No. Foot path crossing",Please refer Tender documents. ,NA ,"24,88,288",Civil Works,NA ,Tender,120.0,180.0,Palampur,176061.0,NA ,NA ,NA ,"IPH Division, Palampur",No ,No,"HP Irrigation and Public Health||Dharamshala Circle,Irrigation and Public Health,HP||Palampur,Irrigation and Public Health,HP",2313-50,2019_HPIPH_29307_1,Yes,Open Tender,Item Rate,Works,2.0,No,No,Online,No,No,No,12-Jun-2019 06:55 PM,26-Jun-2019 11:30 AM,12-Jun-2019 06:55 PM,26-Jun-2019 11:00 AM,NA ,NA ,12-Jun-2019 06:55 PM,26-Jun-2019 11:00 AM,03-Jul-2019 12:10 PM,AOC
2.0,122808.0,ajay kumar sarmai,25-Jun-2019 01:33 PM,Rejected-AOC,Higher rate quoted,27-Jul-2019 10:02 AM,,,,,,,,,,,,,,,,,,,,,,,,,,,,,,,,,,,,,,,,,AOC,,,.pdf,ii) Certificate of registration with IPH Department in appropriate class and latest renewal thereof.,,,2.0,ICICI NEFT/RTGS,,,,,,,,,,,,,,,,,,,,,,,,,,,,,,,,,,,,,,,,,,,,,,,,,,,,AOC
3.0,122882.0,krishan chand,25-Jun-2019 02:16 PM,Not Admitted-Fee/PreQual/Technical,Not Complied with technical specification,03-Jul-2019 11:50 AM,,,,,,,,,,,,,,,,,,,,,,,,,,,,,,,,,,,,,,,,,AOC,,,.pdf,iii) Income tax/GST / EPF registration and latest clearance certificate thereof.,,,,,,,,,,,,,,,,,,,,,,,,,,,,,,,,,,,,,,,,,,,,,,,,,,,,,,,,AOC
4.0,122880.0,Shadil Thakur,26-Jun-2019 07:31 AM,Rejected-AOC,Higher rate quoted,27-Jul-2019 10:02 AM,,,,,,,,,,,,,,,,,,,,,,,,,,,,,,,,,,,,,,,,,AOC,,,.pdf,iv) Contractor must have experience of executing work of similar nature.,,,,,,,,,,,,,,,,,,,,,,,,,,,,,,,,,,,,,,,,,,,,,,,,,,,,,,,,AOC
5.0,122936.0,SUBHASH CHAND GOVT. CONTRACTOR,26-Jun-2019 10:25 AM,Rejected-AOC,Higher rate quoted,27-Jul-2019 10:02 AM,,,,,,,,,,,,,,,,,,,,,,,,,,,,,,,,,,,,,,,,,AOC,,,.pdf,v) Affidavit that he have not two uncompleted work in hand.,,,,,,,,,,,,,,,,,,,,,,,,,,,,,,,,,,,,,,,,,,,,,,,,,,,,,,,,AOC
6.0,122728.0,Sudershan kumar Angaria,24-Jun-2019 04:51 PM,Rejected-AOC,Higher rate quoted,27-Jul-2019 10:02 AM,,,,,,,,,,,,,,,,,,,,,,,,,,,,,,,,,,,,,,,,,AOC,2.0,Finance,.pdf,Form 6 duly signed,,,,,,,,,,,,,,,,,,,,,,,,,,,,,,,,,,,,,,,,,,,,,,,,,,,,,,,,AOC
,,,,,,,,,,,,,,,,,,,,,,,,,,,,,,,,,,,,,,,,,,,,,,,AOC,,,.xls,BOQ,,,,,,,,,,,,,,,,,,,,,,,,,,,,,,,,,,,,,,,,,,,,,,,,,,,,,,,,AOC
