Tender Fee in ₹,Fee Payable To,Fee Payable At,Tender Fee Exemption Allowed,Organisation Chain,Tender Reference Number,Tender ID,Withdrawal Allowed,Tender Type,Form of contract,Tender Category,No. of Covers,General Technical Evaluation Allowed,ItemWise Technical Evaluation Allowed,Payment Mode,Is Multi Currency Allowed For BOQ,Is Multi Currency Allowed For Fee,Allow Two Stage Bidding,Name,Address,Cover No,Cover,Document Type,Description,S.No,Bank Name,Publish Date,Bid Opening Date,Document Download / Sale Start Date,Document Download / Sale End Date,Clarification Start Date,Clarification End Date,Bid Submission Start Date,Bid Submission End Date,Financial Bid Opening Date,EMD Amount in ₹,EMD Exemption Allowed,EMD Fee Type,EMD Percentage,EMD Payable To,EMD Payable At,Title,Work Description,Pre Qualification Details,Independent External Monitor/Remarks,Tender Value in ₹,Product Category,Sub category,Contract Type,Bid Validity(Days),Period Of Work(Days),Location,Pincode,Pre Bid Meeting Place,Pre Bid Meeting Address,Pre Bid Meeting Date,Bid Opening Place,Should Allow NDA Tender,Allow Preferential Bidder,Tender Stage,Committee Chairperson/Co-ordinator Name :,Committee Chairperson/Co-ordinator Type :,Committee Members :,Updated By :,Updated on :,Document :,Organisation Chain :,Tender ID :,Tender Ref No :,Tender Title :,S.No,Bid Number,Bidder Name,Awarded Currency,Awarded Value,S.No.1,Bid Number.1,Bidder Name.1,Submitted Date,Status,Remarks,Status Updated On,Committee Chairperson/Co-ordinator Name :.1,Committee Chairperson/Co-ordinator Type :.1,Committee Members :.1,Updated By :.1,Updated On :,Financial Bid Opening Date:,Document :.1,Type :,Summary :,Updated By :.2,Updated On :.1,Document :.2,Type :.1,Summary :.1,Updated By :.3,Updated On :.2,Document :.3,BOQ Comparative Chart :,Contract Date :,Contract Value :,Work Completion Period in days :,Updated By :.4,Updated on :.1,AOC document :,AOC Description :,Tender Stage
250.0,EE IPH Division Nahan,Nahan,No,"HP Irrigation and Public Health||Nahan Circle,Irrigation and Public Health,HP||Nahan,Irrigation and Public Health,HP",No- 14016-76 dated 21-01-2019,2019_HPIPH_26534_1,Yes,Open Tender,Item Rate,Works,2.0,No,No,Both(Online/Offline),No,No,No,Executive Engineer,Executive Engineer IPH Division Nahan,1.0,Fee/PreQual/Technical,.pdf,Earnest Money as per mentioned in NIT,1.0,ICICI BANK,01-Feb-2019 04:00 PM,07-Feb-2019 11:30 AM,01-Feb-2019 04:00 PM,07-Feb-2019 11:00 AM,NA ,NA ,01-Feb-2019 04:00 PM,07-Feb-2019 11:00 AM,05-Mar-2019 10:30 AM,"13,000",Yes,fixed,,EE IPH Division Nahan,Nahan,Augmantation of LWSS Tikker Ser Baral in Tehsil Pachhad Distt Sirmour HP,SH - Laying and jointing of GMS pipes of various dia,Please refer Tender documents. ,NA ,"6,48,830",Pipe Laying Works,NA ,Tender,120.0,90.0,Nahan,173001.0,NA ,NA ,NA ,Executive Engineer IPH Division Nahan,No ,No,AOC,Er. Mandeep Gupta,Internal,EE HDM AE TA,Mandeep Gupta,04-Apr-2019 03:41 PM,finsummary_37635.pdf (1043.65 KB),"HP Irrigation and Public Health||Nahan Circle,Irrigation and Public Health,HP||Nahan,Irrigation and Public Health,HP",2019_HPIPH_26534_1,No- 14016-76 dated 21-01-2019,Augmantation of LWSS Tikker Ser Baral in Tehsil Pachhad Distt Sirmour HP,1.0,111340.0,M/s Pardeep Sublaik,INR,"579,628",1.0,111198.0,Bhaw Singh,06-Feb-2019 03:24 PM,Not Admitted-Fee/PreQual/Technical,Not Complied with technical specification,04-Mar-2019 05:40 PM,Er Mandeep Gupta EE,Internal,Supdt Gr II DHD DAO DA,Mandeep Gupta,04-Mar-2019 05:45 PM,05-Mar-2019 10:30 AM,techsummary_37635.pdf (105.18 KB),Technical,Technical Bid Summary,Mandeep Gupta,04-Mar-2019 05:40 PM,technical_37635.pdf,Finance,Financial Bid Summary,Mandeep Gupta,06-Mar-2019 03:41 PM,finance_37635.pdf,BOQ Comparative Chart,04-Apr-2019,"INR 648,830",90.0,Mandeep Gupta,04-Apr-2019 03:44 PM,AOC.pdf (1044.00 KB),Award,AOC
,,,,,,,,,,,,,,,,,,,,,,.pdf,Cost of bid as per mentioned in NIT,2.0,ICICI NEFT/RTGS,,,,,,,,,,,,,,,,,,,,,,,,,,,,,,,,,,AOC,,,,,,,,,,,,,,,,2.0,111254.0,HARINDER KUMAR VERMA.,06-Feb-2019 04:28 PM,Rejected-Finance,Rejected,04-Apr-2019 03:41 PM,,,,,,,,,,,,,,,,,,,,,,,,,,AOC
,,,,,,,,,,,,,,,,,,,,,,.pdf,Copy of certificate of registration as per NIT,,,,,,,,,,,,,,,,,,,,,,,,,,,,,,,,,,,,AOC,,,,,,,,,,,,,,,,3.0,111351.0,KAMDHENU ENTERPRISES,07-Feb-2019 07:12 AM,Not Admitted-Fee/PreQual/Technical,Not Complied with technical specification,04-Mar-2019 05:40 PM,,,,,,,,,,,,,,,,,,,,,,,,,,AOC
,,,,,,,,,,,,,,,,,,,,,,.pdf,Copy of certificate of EPF registration,,,,,,,,,,,,,,,,,,,,,,,,,,,,,,,,,,,,AOC,,,,,,,,,,,,,,,,4.0,110907.0,MADAN SINGH,05-Feb-2019 03:38 PM,Rejected-Finance,Rejected,04-Apr-2019 03:41 PM,,,,,,,,,,,,,,,,,,,,,,,,,,AOC
,,,,,,,,,,,,,,,,,,,,,,.pdf,Undertaking of Joint venture is not allowed,,,,,,,,,,,,,,,,,,,,,,,,,,,,,,,,,,,,AOC,,,,,,,,,,,,,,,,5.0,111340.0,M/s Pardeep Sublaik,06-Feb-2019 11:53 PM,Accepted-AOC,Award,04-Apr-2019 03:44 PM,,,,,,,,,,,,,,,,,,,,,,,,,,AOC
,,,,,,,,,,,,,,,,,,,,,,.pdf,Undertaking of carefully studied all the terms and conditions,,,,,,,,,,,,,,,,,,,,,,,,,,,,,,,,,,,,AOC,,,,,,,,,,,,,,,,6.0,111349.0,M/S Sharma Enterpirses,07-Feb-2019 07:16 AM,Rejected-Finance,Rejected,04-Apr-2019 03:41 PM,,,,,,,,,,,,,,,,,,,,,,,,,,AOC
,,,,,,,,,,,,,,,,,,,,,,.pdf,Undertaking with the provision of contract Labour as per NIT,,,,,,,,,,,,,,,,,,,,,,,,,,,,,,,,,,,,AOC,,,,,,,,,,,,,,,,7.0,110959.0,RAKESH KALIA,05-Feb-2019 05:07 PM,Not Admitted-Fee/PreQual/Technical,Not Complied with technical specification,04-Mar-2019 05:40 PM,,,,,,,,,,,,,,,,,,,,,,,,,,AOC
,,,,,,,,,,,,,,,,,,,,2.0,Finance,.xls,B.O.Q,,,,,,,,,,,,,,,,,,,,,,,,,,,,,,,,,,,,AOC,,,,,,,,,,,,,,,,,,,,,,,,,,,,,,,,,,,,,,,,,,,,,,,,AOC
