Type :,Summary :,Updated By :,Updated On :,Document :,S.No,Bid Number,Bidder Name,Submitted Date,Status,Remarks,Status Updated On,S.No.1,Bid Number.1,Bidder Name.1,Awarded Currency,Awarded Value,Type :.1,Summary :.1,Updated By :.1,Updated On :.1,Document :.1,BOQ Comparative Chart :,Contract Date :,Contract Value :,Work Completion Period in days :,Updated By :.2,Updated on :,AOC document :,AOC Description :,Committee Chairperson/Co-ordinator Name :,Committee Chairperson/Co-ordinator Type :,Committee Members :,Updated By :.3,Updated on :.1,Document :.2,Committee Chairperson/Co-ordinator Name :.1,Committee Chairperson/Co-ordinator Type :.1,Committee Members :.1,Updated By :.4,Updated On :.2,Financial Bid Opening Date:,Document :.3,Organisation Chain :,Tender ID :,Tender Ref No :,Tender Title :,Tender Stage,Organisation Chain,Tender Reference Number,Tender ID,Withdrawal Allowed,Tender Type,Form of contract,Tender Category,No. of Covers,General Technical Evaluation Allowed,ItemWise Technical Evaluation Allowed,Payment Mode,Is Multi Currency Allowed For BOQ,Is Multi Currency Allowed For Fee,Allow Two Stage Bidding,Cover No,Cover,Document Type,Description,Publish Date,Bid Opening Date,Document Download / Sale Start Date,Document Download / Sale End Date,Clarification Start Date,Clarification End Date,Bid Submission Start Date,Bid Submission End Date,Financial Bid Opening Date,S.No,Instrument Type,EMD Amount in ₹,EMD Exemption Allowed,EMD Fee Type,EMD Percentage,EMD Payable To,EMD Payable At,Name,Address,Tender Fee in ₹,Fee Payable To,Fee Payable At,Tender Fee Exemption Allowed,Title,Work Description,Pre Qualification Details,Independent External Monitor/Remarks,Tender Value in ₹,Product Category,Sub category,Contract Type,Bid Validity(Days),Period Of Work(Days),Location,Pincode,Pre Bid Meeting Place,Pre Bid Meeting Address,Pre Bid Meeting Date,Bid Opening Place,Should Allow NDA Tender,Allow Preferential Bidder,Tender Stage
Technical,TECHNICAL EVALUATION,Harsh Puri,04-Jan-2019 10:07 PM,technical_35760.pdf,1.0,106110.0,julphakar muhammad,01-Jan-2019 12:03 PM,Rejected-AOC,L2,04-Apr-2019 10:58 PM,1.0,106192.0,Yusav Khan,INR,"745,827.8",Finance,SUMMARY,Harsh Puri,04-Apr-2019 10:52 PM,finance_35760.pdf,BOQ Comparative Chart,04-Apr-2019,"INR 493,529",60.0,Harsh Puri,04-Apr-2019 10:58 PM,7.pdf (370.00 KB),AWARD LETTER,EE,Internal,EE AE SUPDT HDM SR ASSTT,Harsh Puri,04-Apr-2019 10:56 PM,finsummary_35760.pdf (370.49 KB),EE,Internal,EE AE SUPDT HDM SR ASSTT,Harsh Puri,04-Jan-2019 10:11 PM,05-Jan-2019 11:30 AM,techsummary_35760.pdf (3423.40 KB),PWD,2018_PWD_25519_3,12023-12122 DATED 11/12/2018,C/o Missing Cross Dranaige work on Tissa Shawa Goa Goth road KM 0/0 to 9/500,AOC,PWD,12023-12122 DATED 11/12/2018,2018_PWD_25519_3,Yes,Open Tender,Item Rate,Works,2.0,No,No,Offline,No,No,No,1.0,Fee/PreQual/Technical,.pdf,COST OF FORM,22-Dec-2018 09:00 AM,02-Jan-2019 11:30 AM,22-Dec-2018 09:00 AM,02-Jan-2019 11:00 AM,NA ,NA ,22-Dec-2018 09:00 AM,02-Jan-2019 11:00 AM,05-Jan-2019 11:30 AM,1.0,DD - Demand Draft,"9,900",No,fixed,,Executive Engineer Tissa Division HPPWD Tissa,Tissa/Bhanjraru,Executive Engineer Tissa Division HPPWD Tissa,Executive Engineer Tissa Division HPPWD Tissa,350.0,Executive Engineer Tissa Division HPPWD Tissa,Tissa/Bhanjraru,No,C/o Missing Cross Dranaige work on Tissa Shawa Goa Goth road KM 0/0 to 9/500,C/o 900mm dia Hume Pipe Culvert at RD 4/470 and 6/160 along with wings walls,Please refer Tender documents. ,NA ,"4,93,629",Civil Works - Roads,NA ,Tender,90.0,60.0,Tissa,176316.0,NA ,NA ,NA ,Executive Engineer Tissa Division HPPWD Tissa,No ,No,AOC
,,,,,2.0,106211.0,Piar Deen Govt Contractor,02-Jan-2019 10:26 AM,Rejected-Technical,NON RESPONSIVE,04-Jan-2019 10:11 PM,,,,,,,,,,,,,,,,,,,,,,,,,,,,,,,,,,,,AOC,,,,,,,,,,,,,,,,,.pdf,EARNEST MONEY,,,,,,,,,,2.0,FDR - Fixed Deposit,,,,,,,,,,,,,,,,,,,,,,,,,,,,,,,AOC
,,,,,3.0,106192.0,Yusav Khan,01-Jan-2019 09:08 PM,Accepted-AOC,L1,04-Apr-2019 10:58 PM,,,,,,,,,,,,,,,,,,,,,,,,,,,,,,,,,,,,AOC,,,,,,,,,,,,,,,,,.pdf,LATEST CONTRACTOR REGISTRATION,,,,,,,,,,,,,,,,,,,,,,,,,,,,,,,,,,,,,,,,,,AOC
,,,,,,,,,,,,,,,,,,,,,,,,,,,,,,,,,,,,,,,,,,,,,,,AOC,,,,,,,,,,,,,,,,,.pdf,PAN CARD AND GST NO.,,,,,,,,,,,,,,,,,,,,,,,,,,,,,,,,,,,,,,,,,,AOC
,,,,,,,,,,,,,,,,,,,,,,,,,,,,,,,,,,,,,,,,,,,,,,,AOC,,,,,,,,,,,,,,,,,.pdf,FORM 8 DULY SIGNED BY THE CONTRACTOR,,,,,,,,,,,,,,,,,,,,,,,,,,,,,,,,,,,,,,,,,,AOC
,,,,,,,,,,,,,,,,,,,,,,,,,,,,,,,,,,,,,,,,,,,,,,,AOC,,,,,,,,,,,,,,,,,.pdf,AFFIDAVIT REGARDING ALL THE INFORMATION WITH THE BID IS CORRECT,,,,,,,,,,,,,,,,,,,,,,,,,,,,,,,,,,,,,,,,,,AOC
,,,,,,,,,,,,,,,,,,,,,,,,,,,,,,,,,,,,,,,,,,,,,,,AOC,,,,,,,,,,,,,,,,,.pdf,AFFIDAVIT REGARDING HAVING NOT MORE THAT TWO WORK IN HAND,,,,,,,,,,,,,,,,,,,,,,,,,,,,,,,,,,,,,,,,,,AOC
,,,,,,,,,,,,,,,,,,,,,,,,,,,,,,,,,,,,,,,,,,,,,,,AOC,,,,,,,,,,,,,,,2.0,Finance,.xls,BOQ,,,,,,,,,,,,,,,,,,,,,,,,,,,,,,,,,,,,,,,,,,AOC
