Type :,Summary :,Updated By :,Updated On :,Document :,S.No,Bid Number,Bidder Name,Submitted Date,Status,Remarks,Status Updated On,Type :.1,Summary :.1,Updated By :.1,Updated On :.1,Document :.1,BOQ Comparative Chart :,S.No.1,Bid Number.1,Bidder Name.1,Awarded Currency,Awarded Value,Committee Chairperson/Co-ordinator Name :,Committee Chairperson/Co-ordinator Type :,Committee Members :,Updated By :.2,Updated on :,Document :.2,Contract Date :,Contract Value :,Work Completion Period in days :,Updated By :.3,Updated on :.1,AOC document :,AOC Description :,Organisation Chain :,Tender ID :,Tender Ref No :,Tender Title :,Committee Chairperson/Co-ordinator Name :.1,Committee Chairperson/Co-ordinator Type :.1,Committee Members :.1,Updated By :.4,Updated On :.2,Financial Bid Opening Date:,Document :.3,Tender Stage,S.No,Instrument Type,Name,Address,Cover No,Cover,Document Type,Description,Tender Fee in ₹,Fee Payable To,Fee Payable At,Tender Fee Exemption Allowed,Organisation Chain,Tender Reference Number,Tender ID,Withdrawal Allowed,Tender Type,Form of contract,Tender Category,No. of Covers,General Technical Evaluation Allowed,ItemWise Technical Evaluation Allowed,Payment Mode,Is Multi Currency Allowed For BOQ,Is Multi Currency Allowed For Fee,Allow Two Stage Bidding,EMD Amount in ₹,EMD Exemption Allowed,EMD Fee Type,EMD Percentage,EMD Payable To,EMD Payable At,Title,Work Description,Pre Qualification Details,Independent External Monitor/Remarks,Tender Value in ₹,Product Category,Sub category,Contract Type,Bid Validity(Days),Period Of Work(Days),Location,Pincode,Pre Bid Meeting Place,Pre Bid Meeting Address,Pre Bid Meeting Date,Bid Opening Place,Should Allow NDA Tender,Allow Preferential Bidder,Publish Date,Bid Opening Date,Document Download / Sale Start Date,Document Download / Sale End Date,Clarification Start Date,Clarification End Date,Bid Submission Start Date,Bid Submission End Date,Financial Bid Opening Date,Tender Stage
Technical,Bid opening Summary,Jeet Singh Thakur,20-Feb-2019 03:45 PM,technical_37163.pdf,1.0,110563.0,Dheeraj Badyal Govt Contractor,04-Feb-2019 03:32 PM,Rejected-AOC,l2,10-Apr-2019 08:34 PM,Finance,Bid opening Summary,Jeet Singh Thakur,25-Feb-2019 05:31 PM,finance_37163.pdf,BOQ Comparative Chart,1.0,110888.0,Govt.Contractor,INR,"1,606,354",EE,Internal,Senior Assistant Superintendent and Assistant Engineer,Jeet Singh Thakur,10-Apr-2019 08:31 PM,finsummary_37163.pdf (17.47 KB),10-Apr-2019,"INR 1,897,558",180.0,Jeet Singh Thakur,10-Apr-2019 08:34 PM,63AOC.pdf (332.00 KB),Construction of record rooms/land record management centre at Chamba,PWD,2019_PWD_26307_1,No. PWC-WA-II/Contract/17- 17056-155 dt.14.1.19,Construction of record rooms/land record management centre at Chamba,Er J.S. Thakur,Internal,Senior Assistant Superintendent and Assistant Engineer,Jeet Singh Thakur,20-Feb-2019 03:48 PM,23-Feb-2019 11:30 AM,techsummary_37163.pdf (357.31 KB),AOC,1.0,DD - Demand Draft,"Executive Engineer, Chamba Division HPPWD Chamba","Executive Engineer, Chamba Division HPPWD Chamba",1.0,Fee/PreQual/Technical,.pdf,Cost of Tender Form (as per Schedule F),500.0,"Executive Engineer, Chamba Division HPPWD Chamba",Chamba,No,PWD,No. PWC-WA-II/Contract/17- 17056-155 dt.14.1.19,2019_PWD_26307_1,Yes,Open Tender,Item Rate,Works,2.0,No,No,Offline,No,No,No,"22,325",No,fixed,,"Executive Engineer, Chamba Division HPPWD Chamba",Chamba,Construction of record rooms/land record management centre at Chamba,Construction of record rooms/land record management centre at Chamba,Please refer Tender documents. ,NA ,"11,15,317",Civil Works - Buildings,NA ,Tender,90.0,180.0,Chamba,176310.0,NA ,NA ,NA ,"Executive Engineer, Chamba Division HPPWD Chamba",No ,No,24-Jan-2019 06:55 PM,06-Feb-2019 11:30 AM,24-Jan-2019 06:55 PM,05-Feb-2019 05:00 PM,NA ,NA ,24-Jan-2019 06:55 PM,05-Feb-2019 05:00 PM,23-Feb-2019 11:30 AM,AOC
,,,,,2.0,110888.0,Govt.Contractor,05-Feb-2019 02:58 PM,Accepted-AOC,l1,10-Apr-2019 08:34 PM,,,,,,,,,,,,,,,,,,,,,,,,,,,,,,,,,,,,AOC,2.0,BC - Bankers Cheque,,,,,.pdf,Earnest Money Deposit (As per schedule F),,,,,,,,,,,,,,,,,,,,,,,,,,,,,,,,,,,,,,,,,,,,,,,,,,,,AOC
,,,,,3.0,110876.0,Yoginder Sharma,05-Feb-2019 02:31 PM,Rejected-AOC,l3,10-Apr-2019 08:34 PM,,,,,,,,,,,,,,,,,,,,,,,,,,,,,,,,,,,,AOC,3.0,FDR - Fixed Deposit,,,,,.pdf,Contractor registration (Refer General rule No.23),,,,,,,,,,,,,,,,,,,,,,,,,,,,,,,,,,,,,,,,,,,,,,,,,,,,AOC
,,,,,,,,,,,,,,,,,,,,,,,,,,,,,,,,,,,,,,,,,,,,,,,AOC,,,,,,,.pdf,Form No. 8 (Refer General rule No 26.7).,,,,,,,,,,,,,,,,,,,,,,,,,,,,,,,,,,,,,,,,,,,,,,,,,,,,AOC
,,,,,,,,,,,,,,,,,,,,,,,,,,,,,,,,,,,,,,,,,,,,,,,AOC,,,,,,,.pdf,Affidavit that information furnished with the bid is correct in all respect.,,,,,,,,,,,,,,,,,,,,,,,,,,,,,,,,,,,,,,,,,,,,,,,,,,,,AOC
,,,,,,,,,,,,,,,,,,,,,,,,,,,,,,,,,,,,,,,,,,,,,,,AOC,,,,,,,.pdf,Work experience as per clause 28.2 b of general and direction and as per schedule F,,,,,,,,,,,,,,,,,,,,,,,,,,,,,,,,,,,,,,,,,,,,,,,,,,,,AOC
,,,,,,,,,,,,,,,,,,,,,,,,,,,,,,,,,,,,,,,,,,,,,,,AOC,,,,,,,.pdf,Copy of PAN No.,,,,,,,,,,,,,,,,,,,,,,,,,,,,,,,,,,,,,,,,,,,,,,,,,,,,AOC
,,,,,,,,,,,,,,,,,,,,,,,,,,,,,,,,,,,,,,,,,,,,,,,AOC,,,,,,,.pdf,GST registration (Refer General rule No.21),,,,,,,,,,,,,,,,,,,,,,,,,,,,,,,,,,,,,,,,,,,,,,,,,,,,AOC
,,,,,,,,,,,,,,,,,,,,,,,,,,,,,,,,,,,,,,,,,,,,,,,AOC,,,,,2.0,Finance,.xls,BOQ,,,,,,,,,,,,,,,,,,,,,,,,,,,,,,,,,,,,,,,,,,,,,,,,,,,,AOC
