Type :,Summary :,Updated By :,Updated On :,Document :,S.No,Bid Number,Bidder Name,Awarded Currency,Awarded Value,Type :.1,Summary :.1,Updated By :.1,Updated On :.1,Document :.1,BOQ Comparative Chart :,Committee Chairperson/Co-ordinator Name :,Committee Chairperson/Co-ordinator Type :,Committee Members :,Updated By :.2,Updated on :,Document :.2,Organisation Chain :,Tender ID :,Tender Ref No :,Tender Title :,Contract Date :,Contract Value :,Work Completion Period in days :,Updated By :.3,Updated on :.1,AOC document :,AOC Description :,Committee Chairperson/Co-ordinator Name :.1,Committee Chairperson/Co-ordinator Type :.1,Committee Members :.1,Updated By :.4,Updated On :.2,Financial Bid Opening Date:,Document :.3,S.No.1,Bid Number.1,Bidder Name.1,Submitted Date,Status,Remarks,Status Updated On,Tender Stage,EMD Amount in ₹,EMD through BG/ST or EMD Exemption Allowed,EMD Fee Type,EMD Percentage,EMD Payable To,EMD Payable At,Cover No,Cover,Document Type,Description,Organisation Chain,Tender Reference Number,Tender ID,Withdrawal Allowed,Tender Type,Form of contract,Tender Category,No. of Covers,General Technical Evaluation Allowed,ItemWise Technical Evaluation Allowed,Payment Mode,Is Multi Currency Allowed For BOQ,Is Multi Currency Allowed For Fee,Allow Two Stage Bidding,Name,Address,Tender Fee in ₹,Fee Payable To,Fee Payable At,Tender Fee Exemption Allowed,Title,Work Description,Pre Qualification Details,Independent External Monitor/Remarks,Tender Value in ₹,Product Category,Sub category,Contract Type,Bid Validity(Days),Period Of Work(Days),Location,Pincode,Pre Bid Meeting Place,Pre Bid Meeting Address,Pre Bid Meeting Date,Bid Opening Place,Should Allow NDA Tender,Allow Preferential Bidder,Publish Date,Bid Opening Date,Document Download / Sale Start Date,Document Download / Sale End Date,Clarification Start Date,Clarification End Date,Bid Submission Start Date,Bid Submission End Date,Financial Bid Opening Date,S.No,Bank Name,Tender Stage
Technical,Technical Evaluation,Dipjyoti Deka,18-May-2023 05:00 PM,technical_46836.pdf,1.0,177180.0,SRI SWADIP GOHAIN,INR,13966810.0,Finance,work order,Anupam Choudhury,04-Jul-2023 07:03 PM,finance_46836.pdf,BOQ Comparative Chart,ED,Internal,,Anupam Choudhury,04-Jul-2023 07:05 PM,finsummary_46836.pdf (421.83 KB),National Health Mission||State Programme Management Unit - NHM,2023_NHM_29088_2,NHM-32034/30/2021-Cons-NHM/142,"Construction of PHC at Ambikapur in Tinsukia District under NHM, Assam",04-Jul-2023,INR 1.396681E+7,240.0,Anupam Choudhury,04-Jul-2023 07:07 PM,wo_ambikapur.pdf (422.00 KB),WORK ALLOTTED,OSD,Internal,"DF, FA, SE(E), SE(C), CCW",Dipjyoti Deka,18-May-2023 05:02 PM,18-May-2023 05:05 PM,techsummary_46836.pdf (647.17 KB),1.0,177178.0,M/S Azad Constructions,15-Feb-2023 12:22 PM,Rejected-Finance,NOT ADMITTED,04-Jul-2023 07:05 PM,AOC,"2,86,000",Yes,percentage,2.0%,Nil,Nil,1.0,Fee/PreQual/Technical,.pdf,Tender Fee and EMD recipt,National Health Mission||State Programme Management Unit - NHM,NHM-32034/30/2021-Cons-NHM/142,2023_NHM_29088_2,Yes,Open Tender,Turn-key,Works,2.0,No,No,Online,No,No,No,"MD, NHM, Assam","O/o Mission Director, NHM, Assam, Saikia Commercial Complex, Christanbasti G.S Road Guwahati","3,000",Nil,Nil,No,"Construction of PHC at Ambikapur in Tinsukia District under NHM, Assam","Construction of PHC at Ambikapur in Tinsukia District under NHM, Assam",Please refer Tender documents. ,NA ,"1,43,00,000",Civil Works - Building,NA ,Tender,180.0,240.0,Tinsukia,786125.0,NA ,NA ,NA ,"O/O Mission Director, NHM, Assam",No ,No,02-Feb-2023 09:00 AM,16-Feb-2023 03:30 PM,02-Feb-2023 09:00 AM,15-Feb-2023 02:00 PM,NA ,NA ,02-Feb-2023 09:00 AM,15-Feb-2023 02:00 PM,18-May-2023 05:05 PM,1.0,SBI Bank,AOC
,,,,,,,,,,,,,,,,,,,,,,,,,,,,,,,,,,,,,,,,2.0,177184.0,SRI BUBUL KONWAR,15-Feb-2023 12:01 PM,Not Admitted-Fee/PreQual/Technical,Not Complied with technical specification,18-May-2023 05:00 PM,AOC,,,,,,,,,.pdf,Bid document,,,,,,,,,,,,,,,,,,,,,,,,,,,,,,,,,,,,,,,,,,,,,,,,,,AOC
,,,,,,,,,,,,,,,,,,,,,,,,,,,,,,,,,,,,,,,,3.0,177180.0,SRI SWADIP GOHAIN,15-Feb-2023 01:54 PM,Accepted-AOC,L1,04-Jul-2023 07:07 PM,AOC,,,,,,,,,.pdf,Technical Qualification,,,,,,,,,,,,,,,,,,,,,,,,,,,,,,,,,,,,,,,,,,,,,,,,,,AOC
,,,,,,,,,,,,,,,,,,,,,,,,,,,,,,,,,,,,,,,,4.0,177106.0,SUNIL SHAH,15-Feb-2023 01:31 PM,Not Admitted-Fee/PreQual/Technical,Not Complied with technical specification,18-May-2023 05:00 PM,AOC,,,,,,,2.0,Finance,.xls,BOQ,,,,,,,,,,,,,,,,,,,,,,,,,,,,,,,,,,,,,,,,,,,,,,,,,,AOC
,,,,,,,,,,,,,,,,,,,,,,,,,,,,,,,,,,,,,,,,,,,,,,,AOC,,,,,,,,,.pdf,FOB,,,,,,,,,,,,,,,,,,,,,,,,,,,,,,,,,,,,,,,,,,,,,,,,,,AOC
