S.No,Bid Number,Bidder Name,Awarded Currency,Awarded Value,Type :,Summary :,Updated By :,Updated On :,Document :,BOQ Comparative Chart :,Type :.1,Summary :.1,Updated By :.1,Updated On :.1,Document :.1,S.No.1,Bid Number.1,Bidder Name.1,Submitted Date,Status,Remarks,Status Updated On,Committee Chairperson/Co-ordinator Name :,Committee Chairperson/Co-ordinator Type :,Committee Members :,Updated By :.2,Updated on :,Document :.2,Contract Date :,Contract Value :,Work Completion Period in days :,Updated By :.3,Updated on :.1,AOC document :,AOC Description :,Organisation Chain :,Tender ID :,Tender Ref No :,Tender Title :,Committee Chairperson/Co-ordinator Name :.1,Committee Chairperson/Co-ordinator Type :.1,Committee Members :.1,Updated By :.4,Updated On :.2,Financial Bid Opening Date:,Document :.3,Cover No,Cover,Document Type,Description,Name,Address,Organisation Chain,Tender Reference Number,Tender ID,Withdrawal Allowed,Tender Type,Form of contract,Tender Category,No. of Covers,General Technical Evaluation Allowed,ItemWise Technical Evaluation Allowed,Payment Mode,Is Multi Currency Allowed For BOQ,Is Multi Currency Allowed For Fee,Allow Two Stage Bidding,Tender Fee in ₹,Fee Payable To,Fee Payable At,Tender Fee Exemption Allowed,Title,Work Description,Pre Qualification Details,Independent External Monitor/Remarks,Tender Value in ₹,Product Category,Sub category,Contract Type,Bid Validity(Days),Period Of Work(Days),Location,Pincode,Pre Bid Meeting Place,Pre Bid Meeting Address,Pre Bid Meeting Date,Bid Opening Place,Should Allow NDA Tender,Allow Preferential Bidder,S.No.2,Bank Name,Publish Date,Bid Opening Date,Document Download / Sale Start Date,Document Download / Sale End Date,Clarification Start Date,Clarification End Date,Bid Submission Start Date,Bid Submission End Date,Financial Bid Opening Date,EMD Amount in ₹,EMD Exemption Allowed,EMD Fee Type,EMD Percentage,EMD Payable To,EMD Payable At
1.0,349510.0,TARUN SHARMA,INR,"240,139",Finance,BOS,Bhupender Singh,05-Jun-2023 03:49 PM,finance_110872.pdf,BOQ Comparative Chart,Technical,Bid Opening Summary,Bhupender Singh,05-Jun-2023 03:13 PM,technical_110872.pdf,1.0,349573.0,Jibachh Goswami,25-May-2023 06:02 PM,Rejected-Finance,L2,06-Jun-2023,PKVermaE.E.,Internal,SanjeevChauhanSupdt.KamleshMehtaHDMDeepakSharmaSr.DAO,Bhupender Singh,06-Jun-2023 12:49 PM,finsummary_110872.pdf (238.08 KB),05-Jul-2023,"INR 240,139",30.0,Bhupender Singh,07-Jun-2023 09:17 AM,TarunAOC.pdf (449.00 KB),AOC,PWD,2023_PWD_73801_2,sd-iii-T-2501-21dt.19-5-2023,"Special repair to residential building under Shimla division No.III (SH- Repair of M.S. Jafri, M.S. tank stand, MS railing in stairs main entrance RR Masonary and dry rubble masonary edge wall repair of siffits, painting and distempering etc. in park",P.K. Verma E.E.,Internal,SanjeevChauhanSupdt.KamleshMehtaHDMDeepakSharmaSr.DAO,Bhupender Singh,05-Jun-2023 03:21 PM,05-Jun-2023 03:25 PM,techsummary_110872.pdf (370.27 KB),1.0,Fee/PreQual/Technical,.pdf,Cost of tender document as per schedule F (6.3) and Earnest Money as per schedule F (6.5),"E. E. SHIMLA DIVISION NO. III, HPPWD, Shimla-3","E. E. SHIMLA DIVISION NO. III, HPPWD, Shimla-3",PWD,sd-iii-T-2501-21dt.19-5-2023,2023_PWD_73801_2,Yes,Open Tender,Percentage,Works,2.0,No,No,Online,No,No,No,350.0,Nil,Nil,No,"Special repair to residential building under Shimla division No.III (SH- Repair of M.S. Jafri, M.S. tank stand, MS railing in stairs main entrance RR Masonary and dry rubble masonary edge wall repair of siffits, painting and distempering etc. in park","Special repair to residential building under Shimla division No.III (SH- Repair of M.S. Jafri, M.S. tank stand, MS railing in stairs main entrance RR Masonary and dry rubble masonary edge wall repair of siffits, painting and distempering etc. in park",As per SBD ,NA ,"6,05,319",Civil Works - Buildings,NA ,Tender,75.0,30.0,Nigam Vihar,171002.0,NA ,NA ,NA ,"Executive Engineer Shimla Division No.IIIHP.PWD.,",No ,No,1.0,ICICI BANK,24-May-2023 04:00 PM,03-Jun-2023 11:00 AM,24-May-2023 04:00 PM,03-Jun-2023 09:00 AM,NA ,NA ,24-May-2023 04:00 PM,03-Jun-2023 09:00 AM,05-Jun-2023 03:25 PM,"12,110",No,fixed,,Nil,Nil
,,,,,,,,,,,,,,,,2.0,349510.0,TARUN SHARMA,25-May-2023 05:40 PM,Accepted-AOC,L1,07-Jun-2023,,,,,,,,,,,,,,,,,,,,,,,,,,,.pdf,Contractor registration as per general Rule 23 and as per invitation of bid.,,,,,,,,,,,,,,,,,,,,,,,,,,,,,,,,,,,,,,,2.0,ICICI NEFT/RTGS,,,,,,,,,,,,,,,
,,,,,,,,,,,,,,,,,,,,,,,,,,,,,,,,,,,,,,,,,,,,,,,,,.pdf,GST registration as per General Rule No 21. Copy of GST No./ Copy of Tin No. and Copy of PAN Card.,,,,,,,,,,,,,,,,,,,,,,,,,,,,,,,,,,,,,,,,,,,,,,,,,,,,,,,
,,,,,,,,,,,,,,,,,,,,,,,,,,,,,,,,,,,,,,,,,,,,,,,,,.pdf,Proof of registration under Employees Provident Funds and Miscellaneous Provision Act. 1952.,,,,,,,,,,,,,,,,,,,,,,,,,,,,,,,,,,,,,,,,,,,,,,,,,,,,,,,
,,,,,,,,,,,,,,,,,,,,,,,,,,,,,,,,,,,,,,,,,,,,,,,,,.pdf,HP.PWD Form No-7/8,,,,,,,,,,,,,,,,,,,,,,,,,,,,,,,,,,,,,,,,,,,,,,,,,,,,,,,
,,,,,,,,,,,,,,,,,,,,,,,,,,,,,,,,,,,,,,,,,,,,,,,,,.pdf,Affidavit of Gazetted and non-Gazetted HPPWD employees related to him (General Rule No 16).,,,,,,,,,,,,,,,,,,,,,,,,,,,,,,,,,,,,,,,,,,,,,,,,,,,,,,,
,,,,,,,,,,,,,,,,,,,,,,,,,,,,,,,,,,,,,,,,,,,,,,,,,.pdf,"Affidavit of no relative working in PWD, Information furnished in the bid is correct in all respect.",,,,,,,,,,,,,,,,,,,,,,,,,,,,,,,,,,,,,,,,,,,,,,,,,,,,,,,
,,,,,,,,,,,,,,,,,,,,,,,,,,,,,,,,,,,,,,,,,,,,,,,,,.pdf,Proof of Machinery Tools plant and ownership as per sr. No. 6.19 of schedule F Clause 18.,,,,,,,,,,,,,,,,,,,,,,,,,,,,,,,,,,,,,,,,,,,,,,,,,,,,,,,
,,,,,,,,,,,,,,,,,,,,,,,,,,,,,,,,,,,,,,,,,,,,,,,2.0,Finance,.xls,BOQ,,,,,,,,,,,,,,,,,,,,,,,,,,,,,,,,,,,,,,,,,,,,,,,,,,,,,,,
