S.No,Bid Number,Bidder Name,Submitted Date,Status,Remarks,Status Updated On,Committee Chairperson/Co-ordinator Name :,Committee Chairperson/Co-ordinator Type :,Committee Members :,Updated By :,Updated on :,Document :,Type :,Summary :,Updated By :.1,Updated On :,Document :.1,Type :.1,Summary :.1,Updated By :.2,Updated On :.1,Document :.2,BOQ Comparative Chart :,Contract Date :,Contract Value :,Work Completion Period in days :,Updated By :.3,Updated on :.1,AOC document :,AOC Description :,Committee Chairperson/Co-ordinator Name :.1,Committee Chairperson/Co-ordinator Type :.1,Committee Members :.1,Updated By :.4,Updated On :.2,Financial Bid Opening Date:,Document :.3,S.No.1,Bid Number.1,Bidder Name.1,Awarded Currency,Awarded Value,Organisation Chain :,Tender ID :,Tender Ref No :,Tender Title :,S.No.2,Instrument Type,Publish Date,Bid Opening Date,Document Download / Sale Start Date,Document Download / Sale End Date,Clarification Start Date,Clarification End Date,Bid Submission Start Date,Bid Submission End Date,Financial Bid Opening Date,Tender Fee in ₹,Fee Payable To,Fee Payable At,Tender Fee Exemption Allowed,EMD Amount in ₹,EMD Exemption Allowed,EMD Fee Type,EMD Percentage,EMD Payable To,EMD Payable At,Title,Work Description,Pre Qualification Details,Independent External Monitor/Remarks,Tender Value in ₹,Product Category,Sub category,Contract Type,Bid Validity(Days),Period Of Work(Days),Location,Pincode,Pre Bid Meeting Place,Pre Bid Meeting Address,Pre Bid Meeting Date,Bid Opening Place,Should Allow NDA Tender,Allow Preferential Bidder,Cover No,Cover,Document Type,Description,Organisation Chain,Tender Reference Number,Tender ID,Withdrawal Allowed,Tender Type,Form of contract,Tender Category,No. of Covers,General Technical Evaluation Allowed,ItemWise Technical Evaluation Allowed,Payment Mode,Is Multi Currency Allowed For BOQ,Is Multi Currency Allowed For Fee,Allow Two Stage Bidding,Name,Address
1,180250,Deepak Sahani,28-Sep-2020 08:57 PM,Rejected-Finance,Rejected,27-Jul-2023,EE,Internal,AGM AO,Rajesh Thakur,27-Jul-2023 10:20 AM,finsummary_60170.pdf (314.77 KB),Technical,bos,Rajesh Thakur,05-Oct-2020 05:04 PM,technical_60170.pdf,Finance,BOS,Rajesh Thakur,03-Jul-2023 10:33 AM,finance_60170.pdf,BOQ Comparative Chart,27-Jul-2023,"INR 255,823.5",60.0,Rajesh Thakur,27-Jul-2023 10:22 AM,2020_MC_40794_1.pdf (309.00 KB),AOC,EE,Internal,AGM AO,Gopesh Behl,06-Oct-2020 12:03 PM,06-Oct-2020 12:15 PM,techsummary_60170.pdf (1733.16 KB),1.0,180235.0,VINAYAK ASSOCIATES,INR,"239,690",Municipal Corporation Shimla,2020_MC_40794_1,2318Dated05092020,Construction of Path Providing and Laying chequred tiles adjoining Sharma niwas north oak in ward No 19 Sanjuali,1.0,DD - Demand Draft,17-Sep-2020 06:30 PM,29-Sep-2020 11:00 AM,17-Sep-2020 06:30 PM,29-Sep-2020 10:30 AM,NA ,NA ,17-Sep-2020 06:30 PM,29-Sep-2020 10:30 AM,06-Oct-2020 12:15 PM,350.0,Executive Engineer RB MC Shimla,Shimla,No,"3,200",No,fixed,,Executive Engineer RB MC Shimla,Shimla,Construction of Path Providing and Laying chequred tiles adjoining Sharma niwas north oak in ward No 19 Sanjuali,Construction of Path Providing and Laying chequred tiles adjoining Sharma niwas north oak in ward No 19 Sanjuali,Please refer Tender Documents ,NA ,"1,59,895",Civil Works,NA ,Tender,120.0,120.0,Shimla,171001.0,NA ,NA ,NA ,MC Shimla,No ,No,1.0,Fee/PreQual/Technical,.pdf,Cost of form in shape of DD as per E procurement notice,Municipal Corporation Shimla,2318Dated05092020,2020_MC_40794_1,Yes,Open Tender,Item Rate,Works,2.0,No,No,Offline,No,No,No,Executive Engineer RB MC Shimla,Executive Engineer RB MC Shimla
2,180243,Devender Gupta,28-Sep-2020 08:43 PM,Rejected-Finance,Rejected,27-Jul-2023,,,,,,,,,,,,,,,,,,,,,,,,,,,,,,,,,,,,,,,,,2.0,FDR - Fixed Deposit,,,,,,,,,,,,,,,,,,,,,,,,,,,,,,,,,,,,,,,,.pdf,Earnest money in shape of FDR and exemption shall not be allowed,,,,,,,,,,,,,,,,
3,180299,HITESH KAITH,29-Sep-2020 12:55 AM,Rejected-Finance,Rejected,27-Jul-2023,,,,,,,,,,,,,,,,,,,,,,,,,,,,,,,,,,,,,,,,,,,,,,,,,,,,,,,,,,,,,,,,,,,,,,,,,,,,,,,,,,.pdf,Certificate of registration with HPPWD in appropriate class and latest renewal thereof,,,,,,,,,,,,,,,,
4,180300,navneet thakur,29-Sep-2020 01:09 AM,Rejected-Finance,Rejected,27-Jul-2023,,,,,,,,,,,,,,,,,,,,,,,,,,,,,,,,,,,,,,,,,,,,,,,,,,,,,,,,,,,,,,,,,,,,,,,,,,,,,,,,,,.pdf,Income Tax GST and EPF registration PAN permanent Account no and GST No,,,,,,,,,,,,,,,,
5,180295,RAM LAL,29-Sep-2020 12:30 AM,Rejected-Finance,Rejected,27-Jul-2023,,,,,,,,,,,,,,,,,,,,,,,,,,,,,,,,,,,,,,,,,,,,,,,,,,,,,,,,,,,,,,,,,,,,,,,,,,,,,,,,,,.pdf,Contractor has to deposit FDR on account of 10 percent performance guarantee at the time of award,,,,,,,,,,,,,,,,
6,180235,VINAYAK ASSOCIATES,28-Sep-2020 08:15 PM,Accepted-AOC,Accepted,27-Jul-2023,,,,,,,,,,,,,,,,,,,,,,,,,,,,,,,,,,,,,,,,,,,,,,,,,,,,,,,,,,,,,,,,,,,,,,,,,,,,,,,,2.0,Finance,.xls,Schedule of Quantity (BOQ),,,,,,,,,,,,,,,,
