Name,Address,Publish Date,Bid Opening Date,Document Download / Sale Start Date,Document Download / Sale End Date,Clarification Start Date,Clarification End Date,Bid Submission Start Date,Bid Submission End Date,Financial Bid Opening Date,Cover No,Cover,Document Type,Description,S.No,Bank Name,Title,Work Description,Pre Qualification Details,Independent External Monitor/Remarks,Tender Value in ₹,Product Category,Sub category,Contract Type,Bid Validity(Days),Period Of Work(Days),Location,Pincode,Pre Bid Meeting Place,Pre Bid Meeting Address,Pre Bid Meeting Date,Bid Opening Place,Should Allow NDA Tender,Allow Preferential Bidder,Tender Fee in ₹,Fee Payable To,Fee Payable At,Tender Fee Exemption Allowed,EMD Amount in ₹,EMD through BG/ST or EMD Exemption Allowed,EMD Fee Type,EMD Percentage,EMD Payable To,EMD Payable At,Organisation Chain,Tender Reference Number,Tender ID,Withdrawal Allowed,Tender Type,Form of contract,Tender Category,No. of Covers,General Technical Evaluation Allowed,ItemWise Technical Evaluation Allowed,Payment Mode,Is Multi Currency Allowed For BOQ,Is Multi Currency Allowed For Fee,Allow Two Stage Bidding,Tender Stage,Type :,Summary :,Updated By :,Updated On :,Document :,Contract Date :,Contract Value :,Work Completion Period in days :,Updated By :.1,Updated on :,AOC document :,AOC Description :,Type :.1,Summary :.1,Updated By :.2,Updated On :.1,Document :.1,BOQ Comparative Chart :,Committee Chairperson/Co-ordinator Name :,Committee Chairperson/Co-ordinator Type :,Committee Members :,Updated By :.3,Updated On :.2,Financial Bid Opening Date:,Document :.2,S.No,Bid Number,Bidder Name,Awarded Currency,Awarded Value,Organisation Chain :,Tender ID :,Tender Ref No :,Tender Title :,S.No.1,Bid Number.1,Bidder Name.1,Submitted Date,Status,Remarks,Status Updated On,Committee Chairperson/Co-ordinator Name :.1,Committee Chairperson/Co-ordinator Type :.1,Committee Members :.1,Updated By :.4,Updated on :.1,Document :.3,Tender Stage
Mission Director NHM Assam,"O/o Mission Director,NHM,Assam,Christanbasti,Ghy-5",08-Dec-2022 05:00 PM,23-Dec-2022 03:30 PM,08-Dec-2022 05:00 PM,22-Dec-2022 02:00 PM,NA ,NA ,08-Dec-2022 05:10 PM,22-Dec-2022 02:00 PM,15-Feb-2023 01:00 PM,1.0,Fee/PreQual/Technical,.pdf,SBD,1.0,SBI Bank,Establishment of Proposed 6 bedded ward at various SHCs n PHCs of Assam under ECRP II NHM Assam Group 157 4 nos scheme in Karimganj district,Establishment of Proposed 6 bedded ward at various SHCs n PHCs of Assam under ECRP II NHM Assam Group 157 4 nos scheme in Karimganj district,Please refer Tender documents. ,NA ,"46,39,828",Civil Works - Building,NA ,Tender,180.0,120.0,Karimganj District,788710.0,NA ,NA ,NA ,"O/o Mission Director,NHM,Assam,Christanbasti,Ghy-5",No ,No,950.0,Nil,Nil,No,"92,797",Yes,percentage,2.0%,Nil,Nil,National Health Mission||State Programme Management Unit - NHM,NHM 32031 4 2021 Construction NHM Part 34 62,2022_NHM_28018_153,Yes,Open Tender,Turn-key,Works,2.0,No,No,Online,No,No,No,AOC,Technical,TBE,Dipjyoti Deka,15-Feb-2023 11:41 AM,technical_44741.pdf,31-Jul-2023,INR 4175845.0,120.0,Himangshu Kalita,31-Jul-2023 08:04 PM,WO157.pdf (472.00 KB),AOC,Finance,Financial bid is opened,Himangshu Kalita,31-Jul-2023 07:58 PM,,BOQ Comparative Chart,ED,Internal,"OSD, FA, DF, Chief(CCW), SE(C), SE(E)",Dipjyoti Deka,15-Feb-2023 11:44 AM,15-Feb-2023 01:00 PM,techsummary_44741.pdf (569.31 KB),1.0,169746.0,M S P and B ENTERPRISE,INR,4175845.0,National Health Mission||State Programme Management Unit - NHM,2022_NHM_28018_153,NHM 32031 4 2021 Construction NHM Part 34 62,Establishment of Proposed 6 bedded ward at various SHCs n PHCs of Assam under ECRP II NHM Assam Group 157 4 nos scheme in Karimganj district,1.0,169746.0,M S P and B ENTERPRISE,22-Dec-2022 01:58 PM,Accepted-AOC,L1 rate is accepted,31-Jul-2023 08:04 PM,ED,Internal,,Himangshu Kalita,31-Jul-2023 08:00 PM,finsummary_44741.pdf (368.42 KB),AOC
,,,,,,,,,,,,,.pdf,Technical Qualifiaction,,,,,,,,,,,,,,,,,,,,,,,,,,,,,,,,,,,,,,,,,,,,,AOC,,,,,,,,,,,,,,,,,,,,,,,,,,,,,,,,,,,2.0,169332.0,SOURAV DAS,22-Dec-2022 05:59 AM,Not Admitted-Fee/PreQual/Technical,Not Complied with technical specification,15-Feb-2023 11:41 AM,,,,,,,AOC
,,,,,,,,,,,,,.pdf,Receipt of EMD and Tender processing fees,,,,,,,,,,,,,,,,,,,,,,,,,,,,,,,,,,,,,,,,,,,,,AOC,,,,,,,,,,,,,,,,,,,,,,,,,,,,,,,,,,,3.0,169326.0,SOURAV GOSWAMI,22-Dec-2022 05:42 AM,Rejected-Finance,L2 rate is not accepted,31-Jul-2023 08:00 PM,,,,,,,AOC
,,,,,,,,,,,2.0,Finance,.xls,BOQ,,,,,,,,,,,,,,,,,,,,,,,,,,,,,,,,,,,,,,,,,,,,,AOC,,,,,,,,,,,,,,,,,,,,,,,,,,,,,,,,,,,4.0,169322.0,SUJATA KAIRA,22-Dec-2022 05:18 AM,Not Admitted-Fee/PreQual/Technical,Not Complied with technical specification,15-Feb-2023 11:41 AM,,,,,,,AOC
,,,,,,,,,,,,,.pdf,FOB,,,,,,,,,,,,,,,,,,,,,,,,,,,,,,,,,,,,,,,,,,,,,AOC,,,,,,,,,,,,,,,,,,,,,,,,,,,,,,,,,,,,,,,,,,,,,,,,AOC
