Cover No,Cover,Document Type,Description,Publish Date,Bid Opening Date,Document Download / Sale Start Date,Document Download / Sale End Date,Clarification Start Date,Clarification End Date,Bid Submission Start Date,Bid Submission End Date,Financial Bid Opening Date,Name,Address,Organisation Chain,Tender Reference Number,Tender ID,Withdrawal Allowed,Tender Type,Form of contract,Tender Category,No. of Covers,General Technical Evaluation Allowed,ItemWise Technical Evaluation Allowed,Payment Mode,Is Multi Currency Allowed For BOQ,Is Multi Currency Allowed For Fee,Allow Two Stage Bidding,EMD Amount in ₹,EMD through BG/ST or EMD Exemption Allowed,EMD Fee Type,EMD Percentage,EMD Payable To,EMD Payable At,S.No,Bank Name,Tender Fee in ₹,Fee Payable To,Fee Payable At,Tender Fee Exemption Allowed,S.No.1,Corrigendum Title,Corrigendum Type,View,Title,Work Description,Pre Qualification Details,Independent External Monitor/Remarks,Tender Value in ₹,Product Category,Sub category,Contract Type,Bid Validity(Days),Period Of Work(Days),Location,Pincode,Pre Bid Meeting Place,Pre Bid Meeting Address,Pre Bid Meeting Date,Bid Opening Place,Should Allow NDA Tender,Allow Preferential Bidder,Tender Stage,Organisation Chain :,Tender ID :,Tender Ref No :,Tender Title :,S.No,Bid Number,Bidder Name,Awarded Currency,Awarded Value,S.No.1,Bid Number.1,Bidder Name.1,Submitted Date,Status,Remarks,Status Updated On,Contract Date :,Contract Value :,Work Completion Period in days :,Updated By :,Updated on :,AOC document :,AOC Description :,Committee Chairperson/Co-ordinator Name :,Committee Chairperson/Co-ordinator Type :,Committee Members :,Updated By :.1,Updated On :,Financial Bid Opening Date:,Document :,Committee Chairperson/Co-ordinator Name :.1,Committee Chairperson/Co-ordinator Type :.1,Committee Members :.1,Updated By :.2,Updated on :.1,Document :.1,Type :,Summary :,Updated By :.3,Updated On :.1,Document :.2,Type :.1,Summary :.1,Updated By :.4,Updated On :.2,Document :.3,BOQ Comparative Chart :,Tender Stage
1.0,Fee/PreQual/Technical,.pdf,DOCUMENT COST,12-Apr-2023 04:00 PM,03-May-2023 12:30 PM,12-Apr-2023 04:00 PM,02-May-2023 02:00 PM,NA ,NA ,12-Apr-2023 04:00 PM,02-May-2023 02:00 PM,09-Jun-2023 12:30 PM,Chief Engineer,Assam Police Housing Corporation Ltd Rehabari Guwahati 8,Assam Police Housing Corporation Ltd,APHC/CS/27/2022-23_PMC_GrVI,2023_APHC_30458_1,Yes,Open Tender,Item Rate,Works,2.0,No,No,Online,No,No,No,"1,15,705",Yes,percentage,2.0%,Nil,Nil,1.0,SBI Bank,"1,000",Nil,Nil,No,1.0,Corrigendum,Date,,PMC Services for the Construction and development of PS in different location of Assam under MOITRI Scheme on EPC mode (Group - VI),PMC Services for the Construction and development of PS in different location of Assam under MOITRI Scheme on EPC mode (Group - VI),Please refer Tender documents. ,NA ,"57,85,253",Civil Works - Building,NA ,Tender,180.0,540.0,"Guwahati City, Morigaon",781001.0,NA ,NA ,NA ,Assam Police Housing Corporation Ltd.,No ,No,AOC,Assam Police Housing Corporation Ltd,2023_APHC_30458_1,APHC/CS/27/2022-23_PMC_GrVI,PMC Services for the Construction and development of PS in different location of Assam under MOITRI Scheme on EPC mode (Group - VI),1.0,184637.0,ARC Test House and Consultant LLP,INR,5435080.0,1.0,184637.0,ARC Test House and Consultant LLP,26-Apr-2023 04:17 PM,Accepted-AOC,Awarded,20-Jul-2023 03:06 PM,20-Jul-2023,INR 5435080.0,540.0,Mukul Chandra Das,20-Jul-2023 03:05 PM,ARC_Gr_VI.pdf (361.00 KB),Formal Work Order,"Managing Director, APHC Ltd.",Internal,List Uploaded,Mukul Chandra Das,29-May-2023 06:37 PM,09-Jun-2023 12:30 PM,techsummary_48996.pdf (384.53 KB),Managing Director. APHC Ltd.,Internal,,Mukul Chandra Das,23-Jun-2023 02:37 PM,finsummary_48996.pdf (4657.18 KB),Technical,Minutes,Mukul Chandra Das,29-May-2023 05:42 PM,technical_48996.pdf,Finance,Financial Bid has opened,Mukul Chandra Das,23-Jun-2023 01:31 PM,,BOQ Comparative Chart,AOC
,,.pdf,BID SECURITY,,,,,,,,,,,,,,,,,,,,,,,,,,,,,,,,,,,,,,2.0,Time Extension,Financial Bid Opening Date Corrigendum,,,,,,,,,,,,,,,,,,,,AOC,,,,,,,,,,2.0,184870.0,BASIC CONSULTANT,26-Apr-2023 07:46 PM,Rejected-Technical,Technically Non Responsive,29-May-2023 06:37 PM,,,,,,,,,,,,,,,,,,,,,,,,,,,,,,,,AOC
,,.pdf,TECHNICAL DOCUMENT,,,,,,,,,,,,,,,,,,,,,,,,,,,,,,,,,,,,,,,,,,,,,,,,,,,,,,,,,,,,AOC,,,,,,,,,,3.0,184837.0,DESIGN ACTION GROUP,26-Apr-2023 07:51 PM,Rejected-Finance,Financial Proposal not submitted,23-Jun-2023 02:37 PM,,,,,,,,,,,,,,,,,,,,,,,,,,,,,,,,AOC
,,.pdf,BID DOCUMENT,,,,,,,,,,,,,,,,,,,,,,,,,,,,,,,,,,,,,,,,,,,,,,,,,,,,,,,,,,,,AOC,,,,,,,,,,4.0,184708.0,FAR INFRASTRUCTURES PVT. LTD,27-Apr-2023 11:27 AM,Rejected-Technical,Technically Non Responsive,29-May-2023 06:37 PM,,,,,,,,,,,,,,,,,,,,,,,,,,,,,,,,AOC
2.0,Finance,.xls,BOQ,,,,,,,,,,,,,,,,,,,,,,,,,,,,,,,,,,,,,,,,,,,,,,,,,,,,,,,,,,,,AOC,,,,,,,,,,5.0,184548.0,TransBiz Associates Pvt Ltd,25-Apr-2023 05:28 PM,Rejected-AOC,Not Awarded,20-Jul-2023 03:06 PM,,,,,,,,,,,,,,,,,,,,,,,,,,,,,,,,AOC
,,.pdf,Financial Proposal,,,,,,,,,,,,,,,,,,,,,,,,,,,,,,,,,,,,,,,,,,,,,,,,,,,,,,,,,,,,AOC,,,,,,,,,,,,,,,,,,,,,,,,,,,,,,,,,,,,,,,,,,,,,,,,AOC
