Type :,Summary :,Updated By :,Updated On :,Document :,Committee Chairperson/Co-ordinator Name :,Committee Chairperson/Co-ordinator Type :,Committee Members :,Updated By :.1,Updated On :.1,Financial Bid Opening Date:,Document :.1,S.No,Bid Number,Bidder Name,Submitted Date,Status,Remarks,Status Updated On,Type :.1,Summary :.1,Updated By :.2,Updated On :.2,Document :.2,BOQ Comparative Chart :,Committee Chairperson/Co-ordinator Name :.1,Committee Chairperson/Co-ordinator Type :.1,Committee Members :.1,Updated By :.3,Updated on :,Document :.3,Organisation Chain :,Tender ID :,Tender Ref No :,Tender Title :,Contract Date :,Contract Value :,Work Completion Period in days :,Updated By :.4,Updated on :.1,AOC document :,AOC Description :,S.No.1,Bid Number.1,Bidder Name.1,Awarded Currency,Awarded Value,Organisation Chain,Tender Reference Number,Tender ID,Withdrawal Allowed,Tender Type,Form of contract,Tender Category,No. of Covers,General Technical Evaluation Allowed,ItemWise Technical Evaluation Allowed,Payment Mode,Is Multi Currency Allowed For BOQ,Is Multi Currency Allowed For Fee,Allow Two Stage Bidding,Title,Work Description,Pre Qualification Details,Independent External Monitor/Remarks,Tender Value in ₹,Product Category,Sub category,Contract Type,Bid Validity(Days),Period Of Work(Days),Location,Pincode,Pre Bid Meeting Place,Pre Bid Meeting Address,Pre Bid Meeting Date,Bid Opening Place,Should Allow NDA Tender,Allow Preferential Bidder,Tender Fee in ₹,Fee Payable To,Fee Payable At,Tender Fee Exemption Allowed,Publish Date,Bid Opening Date,Document Download / Sale Start Date,Document Download / Sale End Date,Clarification Start Date,Clarification End Date,Bid Submission Start Date,Bid Submission End Date,Financial Bid Opening Date,Name,Address,EMD Amount in ₹,EMD Exemption Allowed,EMD Fee Type,EMD Percentage,EMD Payable To,EMD Payable At,S.No.2,Bank Name,S.No.1.1,Corrigendum Title,Corrigendum Type,View,Cover No,Cover,Document Type,Description
Technical,Tender Summary,Sushant Singh Negi,27-Jun-2023 11:26 AM,technical_111541.pdf,EE,Internal,"DM, Manager(F), AE(HQ)",Sushant Singh Negi,27-Jun-2023 11:27 AM,27-Jun-2023 03:00 PM,techsummary_111541.pdf (422.57 KB),1.0,353503.0,Balwant Kumar,16-Jun-2023 11:28 AM,Accepted-AOC,AOC,21-Aug-2023,Finance,Financial Summary,Sushant Singh Negi,03-Jul-2023 02:24 PM,finance_111541.pdf,BOQ Comparative Chart,EE,Internal,"DM, Manager(F), AE(HQ)",Sushant Singh Negi,03-Jul-2023 02:27 PM,finsummary_111541.pdf (25.51 KB),HP SIDC Limited,2023_SIDC_74359_1,Job No. 6,Development of Ind. Area Pandoga Distt. Una (HP) (SH- SRMO Working Hostel).,14-Jul-2023,"INR 478,034",60.0,Sushant Singh Negi,21-Aug-2023 01:15 PM,pandogaaoc.pdf (1546.00 KB),Award letter,1.0,353503.0,Balwant Kumar,INR,"478,034",HP SIDC Limited,Job No. 6,2023_SIDC_74359_1,Yes,Open Tender,Item Rate,Works,2.0,No,No,Online,No,No,No,Development of Ind. Area Pandoga Distt. Una (HP) (SH- SRMO Working Hostel).,(SH- SRMO Working Hostel).,Please refer Tender documents. ,NA ,"5,69,019",Civil Works,NA ,Tender,120.0,60.0,Una,174303.0,NA ,NA ,NA ,HPSIDC Shimla,No ,No,700.0,Nil,Nil,No,03-Jun-2023 11:00 AM,24-Jun-2023 11:00 AM,03-Jun-2023 11:00 AM,23-Jun-2023 05:00 PM,NA ,NA ,03-Jun-2023 11:00 AM,23-Jun-2023 05:00 PM,27-Jun-2023 03:00 PM,Executive Engineer,HPSIDC Shimla,"11,400",No,fixed,,Nil,Nil,1.0,ICICI BANK,1.0,Corrigendum-II,Date,,1.0,Fee/PreQual/Technical,.pdf,Appropriate Contractor registration (as per tender condition)
,,,,,,,,,,,,2.0,353034.0,Bhisham Kumar,12-Jun-2023 11:36 AM,Rejected-Finance,Third lowest bidder,03-Jul-2023,,,,,,,,,,,,,,,,,,,,,,,,,,,,,,,,,,,,,,,,,,,,,,,,,,,,,,,,,,,,,,,,,,,,,,,,,,,,,,,,,,2.0,ICICI NEFT/RTGS,,,,,,,.pdf,Signed copy of agreement form and approved make for materials
,,,,,,,,,,,,3.0,353055.0,Saurabh Loomba,09-Jun-2023 07:57 PM,Rejected-Finance,Second lowest bidder,03-Jul-2023,,,,,,,,,,,,,,,,,,,,,,,,,,,,,,,,,,,,,,,,,,,,,,,,,,,,,,,,,,,,,,,,,,,,,,,,,,,,,,,,,,,,,,,,,,.pdf,Affidavit that the information furnished with the bid documents is true and correct.
,,,,,,,,,,,,,,,,,,,,,,,,,,,,,,,,,,,,,,,,,,,,,,,,,,,,,,,,,,,,,,,,,,,,,,,,,,,,,,,,,,,,,,,,,,,,,,,,,,,,,,,,,,,,.pdf,Affidavit that you have not more than 2 works in hand each of Rs.100 lakh or above in any department
,,,,,,,,,,,,,,,,,,,,,,,,,,,,,,,,,,,,,,,,,,,,,,,,,,,,,,,,,,,,,,,,,,,,,,,,,,,,,,,,,,,,,,,,,,,,,,,,,,,,,,,,,,,,.pdf,Proof copy of EPF registration No.
,,,,,,,,,,,,,,,,,,,,,,,,,,,,,,,,,,,,,,,,,,,,,,,,,,,,,,,,,,,,,,,,,,,,,,,,,,,,,,,,,,,,,,,,,,,,,,,,,,,,,,,,,,,,.pdf,Proof copy of GST registration No.
,,,,,,,,,,,,,,,,,,,,,,,,,,,,,,,,,,,,,,,,,,,,,,,,,,,,,,,,,,,,,,,,,,,,,,,,,,,,,,,,,,,,,,,,,,,,,,,,,,,,,,,,,,,,.pdf,Copy of latest ITR and pan card
,,,,,,,,,,,,,,,,,,,,,,,,,,,,,,,,,,,,,,,,,,,,,,,,,,,,,,,,,,,,,,,,,,,,,,,,,,,,,,,,,,,,,,,,,,,,,,,,,,,,,,,,,,,,.pdf,Copy of receipt of EMD and cost of form
,,,,,,,,,,,,,,,,,,,,,,,,,,,,,,,,,,,,,,,,,,,,,,,,,,,,,,,,,,,,,,,,,,,,,,,,,,,,,,,,,,,,,,,,,,,,,,,,,,,,,,,,,,2.0,Finance,.xls,BOQ
