Type :,Summary :,Updated By :,Updated On :,Document :,Committee Chairperson/Co-ordinator Name :,Committee Chairperson/Co-ordinator Type :,Committee Members :,Updated By :.1,Updated on :,Document :.1,S.No,Bid Number,Bidder Name,Submitted Date,Status,Remarks,Status Updated On,Contract Date :,Contract Value :,Work Completion Period in days :,Updated By :.2,Updated on :.1,AOC document :,AOC Description :,Type :.1,Summary :.1,Updated By :.3,Updated On :.1,Document :.2,BOQ Comparative Chart :,Committee Chairperson/Co-ordinator Name :.1,Committee Chairperson/Co-ordinator Type :.1,Committee Members :.1,Updated By :.4,Updated On :.2,Financial Bid Opening Date:,Document :.3,Organisation Chain :,Tender ID :,Tender Ref No :,Tender Title :,S.No.1,Bid Number.1,Bidder Name.1,Awarded Currency,Awarded Value,Tender Stage,Name,Address,Tender Fee in ₹,Fee Payable To,Fee Payable At,Tender Fee Exemption Allowed,Title,Work Description,Pre Qualification Details,Independent External Monitor/Remarks,Tender Value in ₹,Product Category,Sub category,Contract Type,Bid Validity(Days),Period Of Work(Days),Location,Pincode,Pre Bid Meeting Place,Pre Bid Meeting Address,Pre Bid Meeting Date,Bid Opening Place,Should Allow NDA Tender,Allow Preferential Bidder,Organisation Chain,Tender Reference Number,Tender ID,Withdrawal Allowed,Tender Type,Form of contract,Tender Category,No. of Covers,General Technical Evaluation Allowed,ItemWise Technical Evaluation Allowed,Payment Mode,Is Multi Currency Allowed For BOQ,Is Multi Currency Allowed For Fee,Allow Two Stage Bidding,S.No,Instrument Type,Publish Date,Bid Opening Date,Document Download / Sale Start Date,Document Download / Sale End Date,Clarification Start Date,Clarification End Date,Bid Submission Start Date,Bid Submission End Date,Financial Bid Opening Date,EMD Amount in ₹,EMD Exemption Allowed,EMD Fee Type,EMD Percentage,EMD Payable To,EMD Payable At,Cover No,Cover,Document Type,Description,Tender Stage
Technical,technical summary,KAMAL JASWAL,02-Feb-2021 04:23 PM,technical_65363.pdf,"TR Dhiman, HPFS DFO Nachan",Internal,"NN Sharma AE office of CCF Mandi, Tarun Kumar FRRO Pandoh and Suresh Kumar Accountant",T R Dhiman,17-Mar-2021 12:05 PM,finsummary_65363.pdf (100.95 KB),1.0,196617.0,KAUL SINGH,01-Feb-2021 01:17 PM,Rejected-Finance,rates on higher side,17-Mar-2021 12:05 PM,17-Mar-2021,"INR 6,515,988",150.0,T R Dhiman,17-Mar-2021 12:10 PM,bandalu-converted.pdf (101.00 KB),Permission has been granted by the Pr. CCF HoFF HP Shimla vide letter No. Fts. 1652-514/2020-21 (Bud) dated 04.03.2021 for the award of work to the contractor,Finance,financial evaluation,T R Dhiman,17-Mar-2021 11:58 AM,finance_65363.pdf,BOQ Comparative Chart,TR Dhiman HPFS DFO Nachan,Internal,"N.N. Sharma, AE forests o/o CCF Mandi, Suresh Kumar Divisional Accountant and Tarun Kumar FRRO Pandoh",KAMAL JASWAL,03-Feb-2021 10:28 AM,03-Feb-2021 10:35 AM,techsummary_65363.pdf (758.79 KB),Himachal Pradesh Forest Department||Mandi - HPFD||Nachan Division - HPFD,2021_FD_43772_1,7942B,C/o I/center Bandal,1.0,196724.0,PURAN CHAND,INR,"6,515,988",AOC,DFO Nachan,Nachan Forest Division at Gohar,500.0,DFO Nachan,DFO Office Nachan at Gohar,No,C/o I/center Bandal,construction of interpretation center at Bandal in Pandoh Forest Range of Nachan Forest Division,Please refer Tender documents. ,NA ,,Civil Works - Buildings,building ,Tender,120.0,150.0,Gohar,175029.0,NA ,NA ,NA ,DFO Office Gohar,No ,No,Himachal Pradesh Forest Department||Mandi - HPFD||Nachan Division - HPFD,7942B,2021_FD_43772_1,Yes,Open Tender,Item Wise,Works,2.0,No,No,Offline,No,No,No,1.0,DD - Demand Draft,25-Jan-2021 09:00 AM,02-Feb-2021 11:30 AM,25-Jan-2021 10:00 AM,02-Feb-2021 10:20 AM,26-Jan-2021 02:00 PM ,26-Jan-2021 04:00 PM ,27-Jan-2021 09:00 AM,02-Feb-2021 10:20 AM,03-Feb-2021 10:35 AM,"74,326",No,fixed,,DFO Nachan,Nachan at Gohar,1.0,Fee/PreQual/Technical,.pdf,Cost of tender indicated in schedule F and the earnest money indicated in schedule F,AOC
,,,,,,,,,,,2.0,196383.0,LABH CHAND,01-Feb-2021 08:25 PM,Rejected-Finance,rates on higher side,17-Mar-2021 12:05 PM,,,,,,,,,,,,,,,,,,,,,,,,,,,,,,AOC,,,,,,,,,,,,,,,,,,,,,,,,,,,,,,,,,,,,,,,2.0,FDR - Fixed Deposit,,,,,,,,,,,,,,,,,,.pdf,contractors registration refer general rules No. 23,AOC
,,,,,,,,,,,3.0,196724.0,PURAN CHAND,01-Feb-2021 06:06 PM,Accepted-AOC,lowest bidder,17-Mar-2021 12:10 PM,,,,,,,,,,,,,,,,,,,,,,,,,,,,,,AOC,,,,,,,,,,,,,,,,,,,,,,,,,,,,,,,,,,,,,,,,,,,,,,,,,,,,,,,,,,.pdf,GST registration general rules No. 21 and permanent account number,AOC
,,,,,,,,,,,,,,,,,,,,,,,,,,,,,,,,,,,,,,,,,,,,,,,AOC,,,,,,,,,,,,,,,,,,,,,,,,,,,,,,,,,,,,,,,,,,,,,,,,,,,,,,,,,,.pdf,Minimum one similar work done of amount not less than 40 percent,AOC
,,,,,,,,,,,,,,,,,,,,,,,,,,,,,,,,,,,,,,,,,,,,,,,AOC,,,,,,,,,,,,,,,,,,,,,,,,,,,,,,,,,,,,,,,,,,,,,,,,,,,,,,,,,,.pdf,"List of machinery tool, plant schedule F with reference to clause 18",AOC
,,,,,,,,,,,,,,,,,,,,,,,,,,,,,,,,,,,,,,,,,,,,,,,AOC,,,,,,,,,,,,,,,,,,,,,,,,,,,,,,,,,,,,,,,,,,,,,,,,,,,,,,,,,,.pdf,Form No. 7/8 prefer general rules No. 26.7,AOC
,,,,,,,,,,,,,,,,,,,,,,,,,,,,,,,,,,,,,,,,,,,,,,,AOC,,,,,,,,,,,,,,,,,,,,,,,,,,,,,,,,,,,,,,,,,,,,,,,,,,,,,,,,,,.pdf,Employee provident fund and miscellaneous provision Act 1952 (General Rule 25A),AOC
,,,,,,,,,,,,,,,,,,,,,,,,,,,,,,,,,,,,,,,,,,,,,,,AOC,,,,,,,,,,,,,,,,,,,,,,,,,,,,,,,,,,,,,,,,,,,,,,,,,,,,,,,,2.0,Finance,.xls,BOQ,AOC
,,,,,,,,,,,,,,,,,,,,,,,,,,,,,,,,,,,,,,,,,,,,,,,AOC,,,,,,,,,,,,,,,,,,,,,,,,,,,,,,,,,,,,,,,,,,,,,,,,,,,,,,,,,,.pdf,bid document,AOC
