Organisation Chain,Tender Reference Number,Tender ID,Withdrawal Allowed,Tender Type,Form of contract,Tender Category,No. of Covers,General Technical Evaluation Allowed,ItemWise Technical Evaluation Allowed,Payment Mode,Is Multi Currency Allowed For BOQ,Is Multi Currency Allowed For Fee,Allow Two Stage Bidding,Cover No,Cover,Document Type,Description,Publish Date,Bid Opening Date,Document Download / Sale Start Date,Document Download / Sale End Date,Clarification Start Date,Clarification End Date,Bid Submission Start Date,Bid Submission End Date,Financial Bid Opening Date,EMD Amount in ₹,EMD Exemption Allowed,EMD Fee Type,EMD Percentage,EMD Payable To,EMD Payable At,S.No,Bank Name,Tender Fee in ₹,Fee Payable To,Fee Payable At,Tender Fee Exemption Allowed,Name,Address,Title,Work Description,Pre Qualification Details,Independent External Monitor/Remarks,Tender Value in ₹,Product Category,Sub category,Contract Type,Bid Validity(Days),Period Of Work(Days),Location,Pincode,Pre Bid Meeting Place,Pre Bid Meeting Address,Pre Bid Meeting Date,Bid Opening Place,Should Allow NDA Tender,Allow Preferential Bidder,Tender Stage
HPSEBL||CE(OP) CZ Mandi||SE(OP) Kullu||Sr. Xen (E) Keylong,HPSEBL/KLED/NIT-20/2023-24,2023_HPSEB_81414_1,Yes,Open Tender,Item Rate,Works,2.0,No,No,Online,No,No,No,1.0,Fee/PreQual/Technical,.pdf,Bidder License of A Class contractor  from competent authority,14-Nov-2023 06:00 PM,22-Nov-2023 11:30 AM,15-Nov-2023 11:00 AM,21-Nov-2023 03:00 PM,,,15-Nov-2023 11:00 AM,21-Nov-2023 03:00 PM,22-Nov-2023 03:00 PM,"1,810",No,fixed,,Nil,Nil,1.0,ICICI BANK,560.0,Nil,Nil,Yes,Sr. Executive Engineer,"Sr. Executive Engineer, ED, HPSEBL. keylong","RM of 33 KV HT Line under ECSD, HPSEBL, Karga for the year  2023-24.  Sub Head Re-sagging of conductor, Jumpering, Nozzeling, Tightening of Stay","RM of 33 KV HT Line under ECSD, HPSEBL, Karga for the year 
2023-24. 
Sub Head Re-sagging of conductor, Jumpering, Nozzeling, 
Tightening of Stay",Please refer Tender documents.,,"1,80,370",Electrical Works,,Tender,120.0,365.0,Keylong,175132.0,,,,"ED, HPSEBL. keylong",No,No,AOC
,,,,,,,,,,,,,,,,.pdf,Certificate of performance/experience for similar nature of work as per bid,,,,,,,,,,,,,,,,2.0,ICICI NEFT/RTGS,,,,,,,,,,,,,,,,,,,,,,,,,AOC
,,,,,,,,,,,,,,,,.pdf,Average annual turnover duly attested from CA as per bid,,,,,,,,,,,,,,,,,,,,,,,,,,,,,,,,,,,,,,,,,,AOC
,,,,,,,,,,,,,,,,.pdf,Declaration regarding non black listed in non judicial stamp paper with notary attested as per bid,,,,,,,,,,,,,,,,,,,,,,,,,,,,,,,,,,,,,,,,,,AOC
,,,,,,,,,,,,,,,,.pdf,"Certificate of GSTIN,PAN,AADHAR, ITR",,,,,,,,,,,,,,,,,,,,,,,,,,,,,,,,,,,,,,,,,,AOC
,,,,,,,,,,,,,,,,.pdf,Self undertaking regarding completion of work within scheduled time as per bid,,,,,,,,,,,,,,,,,,,,,,,,,,,,,,,,,,,,,,,,,,AOC
,,,,,,,,,,,,,,,,.pdf,Self undertaking regarding that studied all term and conditions as per bid,,,,,,,,,,,,,,,,,,,,,,,,,,,,,,,,,,,,,,,,,,AOC
,,,,,,,,,,,,,,2.0,Finance,.xls,Financial Bid,,,,,,,,,,,,,,,,,,,,,,,,,,,,,,,,,,,,,,,,,,AOC
