Organisation Chain,Tender Reference Number,Tender ID,Withdrawal Allowed,Tender Type,Form of contract,Tender Category,No. of Covers,General Technical Evaluation Allowed,ItemWise Technical Evaluation Allowed,Payment Mode,Is Multi Currency Allowed For BOQ,Is Multi Currency Allowed For Fee,Allow Two Stage Bidding,Cover No,Cover,Document Type,Description,Publish Date,Bid Opening Date,Document Download / Sale Start Date,Document Download / Sale End Date,Clarification Start Date,Clarification End Date,Bid Submission Start Date,Bid Submission End Date,Financial Bid Opening Date,EMD Amount in ₹,EMD Exemption Allowed,EMD Fee Type,EMD Percentage,EMD Payable To,EMD Payable At,S.No,Bank Name,Tender Fee in ₹,Fee Payable To,Fee Payable At,Tender Fee Exemption Allowed,Name,Address,Title,Work Description,Pre Qualification Details,Independent External Monitor/Remarks,Tender Value in ₹,Product Category,Sub category,Contract Type,Bid Validity(Days),Period Of Work(Days),Location,Pincode,Pre Bid Meeting Place,Pre Bid Meeting Address,Pre Bid Meeting Date,Bid Opening Place,Should Allow NDA Tender,Allow Preferential Bidder,Tender Stage
"Himachal Urban Development Authority||Supdt. Engineer (N),HIMUDA||Executive Engineer Division,Dharamsala,HIMUDA",HIMUDA/DD/CB/W-7/2022-4471-95,2024_HIMUD_90881_1,Yes,Open Tender,Percentage,Works,2.0,No,No,Online,No,No,No,1.0,Fee/PreQual/Technical,.pdf,Earnest Money (As per NIT),23-Jul-2024 04:00 PM,02-Aug-2024 12:00 PM,23-Jul-2024 05:00 PM,01-Aug-2024 04:00 PM,23-Jul-2024 05:00 PM,01-Aug-2024 04:00 PM,23-Jul-2024 05:00 PM,01-Aug-2024 04:00 PM,03-Aug-2024 03:40 PM,"20,700",Yes,fixed,,Nil,Nil,1.0,ICICI BANK,590.0,Nil,Nil,Yes,Executive Engineer,HIMUDA Division Dharamshala,DSP Residence building at Dehra Distt Kangra,SH Repair work of building,Please refer Tender documents.,,"10,33,339",Civil Works,,Tender,30.0,60.0,Dehra Distt. Kangra,177117.0,,,,HIMUDA Division Dharamshala,No,No,AOC
,,,,,,,,,,,,,,,,.pdf,Cost of Tender Form (As per NIT),,,,,,,,,,,,,,,,2.0,ICICI NEFT/RTGS,,,,,,,,,,,,,,,,,,,,,,,,,AOC
,,,,,,,,,,,,,,,,.pdf,Certificate of  Registration in appropriate class.,,,,,,,,,,,,,,,,,,,,,,,,,,,,,,,,,,,,,,,,,,AOC
,,,,,,,,,,,,,,,,.pdf,Undertaking  for acceptance of terms and Condition as per Form No. 6 and 8,,,,,,,,,,,,,,,,,,,,,,,,,,,,,,,,,,,,,,,,,,AOC
,,,,,,,,,,,,,,,,.pdf,Income Tax PAN/TAN No.,,,,,,,,,,,,,,,,,,,,,,,,,,,,,,,,,,,,,,,,,,AOC
,,,,,,,,,,,,,,,,.pdf,GST  Registration  No and  GST R 1 and  3 and EPF Registration No.and Clearance certificate.,,,,,,,,,,,,,,,,,,,,,,,,,,,,,,,,,,,,,,,,,,AOC
,,,,,,,,,,,,,,,,.pdf,Work done certificate and  work in hand certificate/ List of machinery  tools and   Plants.,,,,,,,,,,,,,,,,,,,,,,,,,,,,,,,,,,,,,,,,,,AOC
,,,,,,,,,,,,,,,,.pdf,Eligibility  Criteria as per  form  6 and  8 of  tender document,,,,,,,,,,,,,,,,,,,,,,,,,,,,,,,,,,,,,,,,,,AOC
,,,,,,,,,,,,,,2.0,Finance,.xls,BOQ,,,,,,,,,,,,,,,,,,,,,,,,,,,,,,,,,,,,,,,,,,AOC
