Type :,Summary :,Updated By :,Updated On :,Document :,BOQ Comparative Chart :,Committee Chairperson/Co-ordinator Name :,Committee Chairperson/Co-ordinator Type :,Committee Members :,Updated By :.1,Updated on :,Document :.1,Contract Date :,Contract Value :,Work Completion Period in days :,Updated By :.2,Updated on :.1,AOC document :,AOC Description :,S.No,Bid Number,Bidder Name,Submitted Date,Status,Remarks,Status Updated On,S.No.1,Bid Number.1,Bidder Name.1,Awarded Currency,Awarded Value,Committee Chairperson/Co-ordinator Name :.1,Committee Chairperson/Co-ordinator Type :.1,Committee Members :.1,Updated By :.3,Updated On :.1,Financial Bid Opening Date:,Document :.2,Organisation Chain :,Tender ID :,Tender Ref No :,Tender Title :,Type :.1,Summary :.1,Updated By :.4,Updated On :.2,Document :.3,Tender Stage,Publish Date,Bid Opening Date,Document Download / Sale Start Date,Document Download / Sale End Date,Clarification Start Date,Clarification End Date,Bid Submission Start Date,Bid Submission End Date,Financial Bid Opening Date,Organisation Chain,Tender Reference Number,Tender ID,Withdrawal Allowed,Tender Type,Form of contract,Tender Category,No. of Covers,General Technical Evaluation Allowed,ItemWise Technical Evaluation Allowed,Payment Mode,Is Multi Currency Allowed For BOQ,Is Multi Currency Allowed For Fee,Allow Two Stage Bidding,S.No,Corrigendum Title,Corrigendum Type,View,Cover No,Cover,Document Type,Description,EMD Amount in ₹,EMD Exemption Allowed,EMD Fee Type,EMD Percentage,EMD Payable To,EMD Payable At,Tender Fee in ₹,Fee Payable To,Fee Payable At,Tender Fee Exemption Allowed,Title,Work Description,Pre Qualification Details,Independent External Monitor/Remarks,Tender Value in ₹,Product Category,Sub category,Contract Type,Bid Validity(Days),Period Of Work(Days),Location,Pincode,Pre Bid Meeting Place,Pre Bid Meeting Address,Pre Bid Meeting Date,Bid Opening Place,Should Allow NDA Tender,Allow Preferential Bidder,S.No.1,Instrument Type,Name,Address,Tender Stage
Finance,F B Opened by T O C,Ashwani Kumar,11-Aug-2020 06:16 PM,finance_57651.pdf,BOQ Comparative Chart,SH AS BEDI,Internal,EO AE JE,Ashwani Kumar,11-Aug-2020 07:03 PM,finsummary_57651.pdf (179.21 KB),19-Sep-2020,"INR 697,461",90.0,Ashwani Kumar,23-Sep-2020 12:41 PM,22aoc24.pdf (821.00 KB),Work Awarded at 52 percent above,1.0,170937.0,MAHESH ANGRA,01-Aug-2020 08:11 PM,Accepted-AOC,Work Awarded to L1,23-Sep-2020 12:42 PM,1.0,170937.0,MAHESH ANGRA,INR,"1,065,868",sh AS Bedi,Internal,EO AE JE,Rajinder Kumar,11-Aug-2020 06:09 PM,11-Aug-2020 06:10 PM,techsummary_57651.pdf (177.26 KB),Directorate of Urban Development||Urban Development - UDDHP||Municipal Council Una - UDDHP,2020_UDDHP_39039_19,MCU/E-TENDER/2020/1444-1449 DATED 16/07/2020,Improvement of drain from Katna well towards Moh. Jole w.no. 7 MC Una.,Technical,Three no bids found technically ok,Rajinder Kumar,11-Aug-2020 05:45 PM,technical_57651.pdf,AOC,18-Jul-2020 09:00 AM,05-Aug-2020 01:00 PM,18-Jul-2020 09:00 AM,04-Aug-2020 06:00 PM,NA ,NA ,18-Jul-2020 01:00 PM,04-Aug-2020 06:00 PM,11-Aug-2020 06:10 PM,Directorate of Urban Development||Urban Development - UDDHP||Municipal Council Una - UDDHP,MCU/E-TENDER/2020/1444-1449 DATED 16/07/2020,2020_UDDHP_39039_19,Yes,Open Tender,Item Rate,Works,2.0,No,No,Offline,No,No,No,1.0,Due Date Extended,Admin Corrigendum Date Extend,,1.0,Fee/PreQual/Technical,.pdf,EMD (in shape of FDR),"14,000",No,fixed,,"Executive Officer, MC Una",Una,"1,000","Executive Officer, MC Una",Una,No,Improvement of drain from Katna well towards Moh. Jole w.no. 7 MC Una.,Improvement of drain from Katna well towards Moh. Jole w.no. 7 MC Una.,Please refer Tender documents. ,NA ,"6,97,461",Civil Works,NA ,Rate Contract,90.0,90.0,ward no. 7,174303.0,NA ,NA ,NA ,"O/o The Assistant Engineer, Municipal Council Una",No ,No,1.0,DD - Demand Draft,"Assistant Engineer, Municipal Council Una",O/o Municipal Council Una Distt Una HP,AOC
,,,,,,,,,,,,,,,,,,,2.0,171095.0,Prafull Bedi,01-Aug-2020 09:23 PM,Rejected-Finance,DUE TO HIGHER SIDE RATE,11-Aug-2020 07:03 PM,,,,,,,,,,,,,,,,,,,,,,AOC,,,,,,,,,,,,,,,,,,,,,,,,,,,,,,.pdf,Tender Fee (in shape of DD),,,,,,,,,,,,,,,,,,,,,,,,,,,,,2.0,FDR - Fixed Deposit,,,AOC
,,,,,,,,,,,,,,,,,,,3.0,170917.0,Tilak Raj,02-Aug-2020 12:31 PM,Rejected-Finance,DUE TO HIGHER SIDE RATE,11-Aug-2020 07:03 PM,,,,,,,,,,,,,,,,,,,,,,AOC,,,,,,,,,,,,,,,,,,,,,,,,,,,,,,.pdf,"CONTRACTOR REGISTRATION (HPPWD,IPH HP,CPWD, UD HP)",,,,,,,,,,,,,,,,,,,,,,,,,,,,,,,,,AOC
,,,,,,,,,,,,,,,,,,,,,,,,,,,,,,,,,,,,,,,,,,,,,,,AOC,,,,,,,,,,,,,,,,,,,,,,,,,,,,,,.pdf,"GST, PAN copy",,,,,,,,,,,,,,,,,,,,,,,,,,,,,,,,,AOC
,,,,,,,,,,,,,,,,,,,,,,,,,,,,,,,,,,,,,,,,,,,,,,,AOC,,,,,,,,,,,,,,,,,,,,,,,,,,,,,,.pdf,EPF Reg,,,,,,,,,,,,,,,,,,,,,,,,,,,,,,,,,AOC
,,,,,,,,,,,,,,,,,,,,,,,,,,,,,,,,,,,,,,,,,,,,,,,AOC,,,,,,,,,,,,,,,,,,,,,,,,,,,,,,.pdf,Experience Certificate-2 no.s works eg similar kinds of work,,,,,,,,,,,,,,,,,,,,,,,,,,,,,,,,,AOC
,,,,,,,,,,,,,,,,,,,,,,,,,,,,,,,,,,,,,,,,,,,,,,,AOC,,,,,,,,,,,,,,,,,,,,,,,,,,,,,,.pdf,Affidavit-start work within time or complete well in time otherwise EMD Forfieted by MC,,,,,,,,,,,,,,,,,,,,,,,,,,,,,,,,,AOC
,,,,,,,,,,,,,,,,,,,,,,,,,,,,,,,,,,,,,,,,,,,,,,,AOC,,,,,,,,,,,,,,,,,,,,,,,,,,,,2.0,Finance,.xls,BOQ,,,,,,,,,,,,,,,,,,,,,,,,,,,,,,,,,AOC
