Organisation Chain :,Tender ID :,Tender Ref No :,Tender Title :,Committee Chairperson/Co-ordinator Name :,Committee Chairperson/Co-ordinator Type :,Committee Members :,Updated By :,Updated on :,Document :,S.No,Bid Number,Bidder Name,Awarded Currency,Awarded Value,Contract Date :,Contract Value :,Work Completion Period in days :,Updated By :.1,Updated on :.1,AOC document :,AOC Description :,S.No.1,Bid Number.1,Bidder Name.1,Submitted Date,Status,Remarks,Status Updated On,Committee Chairperson/Co-ordinator Name :.1,Committee Chairperson/Co-ordinator Type :.1,Committee Members :.1,Updated By :.2,Updated On :,Financial Bid Opening Date:,Document :.1,Type :,Summary :,Updated By :.3,Updated On :.1,Document :.2,Type :.1,Summary :.1,Updated By :.4,Updated On :.2,Document :.3,BOQ Comparative Chart :,Tender Stage,Cover No,Cover,Document Type,Description,Tender Fee in ₹,Fee Payable To,Fee Payable At,Tender Fee Exemption Allowed,Name,Address,Organisation Chain,Tender Reference Number,Tender ID,Withdrawal Allowed,Tender Type,Form of contract,Tender Category,No. of Covers,General Technical Evaluation Allowed,ItemWise Technical Evaluation Allowed,Payment Mode,Is Multi Currency Allowed For BOQ,Is Multi Currency Allowed For Fee,Allow Two Stage Bidding,Title,Work Description,Pre Qualification Details,Independent External Monitor/Remarks,Tender Value in ₹,Product Category,Sub category,Contract Type,Bid Validity(Days),Period Of Work(Days),Location,Pincode,Pre Bid Meeting Place,Pre Bid Meeting Address,Pre Bid Meeting Date,Bid Opening Place,Should Allow NDA Tender,Allow Preferential Bidder,EMD Amount in ₹,EMD Exemption Allowed,EMD Fee Type,EMD Percentage,EMD Payable To,EMD Payable At,S.No,Bank Name,Publish Date,Bid Opening Date,Document Download / Sale Start Date,Document Download / Sale End Date,Clarification Start Date,Clarification End Date,Bid Submission Start Date,Bid Submission End Date,Financial Bid Opening Date,Tender Stage
HP SIDC Limited,2020_SIDC_35952_1,Job No. 7,"Construction of entrance gate, pavement and retaining wall at the HPSCS corporation Godown Kullu, Distt. Kullu (HP).",SE,Internal,"DM, AE(HQ), Dy. Manager(P)",Sushant Singh Negi,20-May-2020 10:57 AM,finsummary_52889.pdf (563.53 KB),1.0,156219.0,ranjeet singh,INR,"872,098",08-Sep-2020,"INR 872,098",120.0,Sushant Singh Negi,10-Sep-2020 02:11 PM,kullugodown.pdf (1639.00 KB),Award letter,1.0,155537.0,GEETA NAND,18-Mar-2020 01:01 PM,Rejected-Finance,Second lowest bidder,20-May-2020 10:57 AM,SE,Internal,"DM, AE(HQ), Dy. Manager(P)",Sushant Singh Negi,16-May-2020 04:02 PM,18-May-2020 11:00 AM,techsummary_52889.pdf (630.02 KB),Technical,Opening summary,Sushant Singh Negi,06-May-2020 02:26 PM,technical_52889.pdf,Finance,Financial summary,Sushant Singh Negi,20-May-2020 10:55 AM,finance_52889.pdf,BOQ Comparative Chart,AOC,1.0,Fee/PreQual/Technical,.pdf,Contractor registration (as per tender conditions),900.0,EE HPSIDC Ltd. Shimla,HPSIDC Ltd. Shimla,No,Executive Engineer,HPSIDC Ltd. Shimla,HP SIDC Limited,Job No. 7,2020_SIDC_35952_1,Yes,Open Tender,Item Rate,Works,2.0,No,No,Online,No,No,No,"Construction of entrance gate, pavement and retaining wall at the HPSCS corporation Godown Kullu, Distt. Kullu (HP).","Construction of entrance gate, pavement and retaining wall at the HPSCS corporation Godown Kullu, Distt. Kullu (HP).",Please refer Tender documents. ,NA ,"7,76,256",Civil Works,NA ,Tender,120.0,120.0,Kullu,175101.0,NA ,NA ,NA ,HPSIDC Ltd. Shimla,No ,No,"15,500",No,fixed,,EE HPSIDC Ltd. Shimla,HPSIDC Ltd. Shimla,1.0,ICICI BANK,05-Mar-2020 04:00 PM,24-Mar-2020 11:00 AM,05-Mar-2020 04:00 PM,23-Mar-2020 05:00 PM,NA ,NA ,05-Mar-2020 04:00 PM,23-Mar-2020 05:00 PM,18-May-2020 11:00 AM,AOC
,,,,,,,,,,,,,,,,,,,,,,2.0,156219.0,ranjeet singh,21-Mar-2020 09:47 PM,Accepted-AOC,lowest bidder,10-Sep-2020 02:12 PM,,,,,,,,,,,,,,,,,,,AOC,,,.pdf,Affidavit that the information furnished with the bid documents is correct in all respect.,,,,,,,,,,,,,,,,,,,,,,,,,,,,,,,,,,,,,,,,,,,,,2.0,ICICI NEFT/RTGS,,,,,,,,,,AOC
,,,,,,,,,,,,,,,,,,,,,,,,,,,,,,,,,,,,,,,,,,,,,,,AOC,,,.pdf,Affidavit that you have not more than two work in hand each of 100 lacs or above.,,,,,,,,,,,,,,,,,,,,,,,,,,,,,,,,,,,,,,,,,,,,,,,,,,,,,,,,AOC
,,,,,,,,,,,,,,,,,,,,,,,,,,,,,,,,,,,,,,,,,,,,,,,AOC,,,.pdf,Signe copy of agreement form,,,,,,,,,,,,,,,,,,,,,,,,,,,,,,,,,,,,,,,,,,,,,,,,,,,,,,,,AOC
,,,,,,,,,,,,,,,,,,,,,,,,,,,,,,,,,,,,,,,,,,,,,,,AOC,,,.pdf,Copy of latest ITR and pan card,,,,,,,,,,,,,,,,,,,,,,,,,,,,,,,,,,,,,,,,,,,,,,,,,,,,,,,,AOC
,,,,,,,,,,,,,,,,,,,,,,,,,,,,,,,,,,,,,,,,,,,,,,,AOC,,,.pdf,Proof copy of EPF registration No.,,,,,,,,,,,,,,,,,,,,,,,,,,,,,,,,,,,,,,,,,,,,,,,,,,,,,,,,AOC
,,,,,,,,,,,,,,,,,,,,,,,,,,,,,,,,,,,,,,,,,,,,,,,AOC,,,.pdf,Proof copy of GST registration No.,,,,,,,,,,,,,,,,,,,,,,,,,,,,,,,,,,,,,,,,,,,,,,,,,,,,,,,,AOC
,,,,,,,,,,,,,,,,,,,,,,,,,,,,,,,,,,,,,,,,,,,,,,,AOC,,,.pdf,Copy of receipt of EMD and cost of form,,,,,,,,,,,,,,,,,,,,,,,,,,,,,,,,,,,,,,,,,,,,,,,,,,,,,,,,AOC
,,,,,,,,,,,,,,,,,,,,,,,,,,,,,,,,,,,,,,,,,,,,,,,AOC,2.0,Finance,.xls,BOQ,,,,,,,,,,,,,,,,,,,,,,,,,,,,,,,,,,,,,,,,,,,,,,,,,,,,,,,,AOC
