Title,Work Description,Pre Qualification Details,Independent External Monitor/Remarks,Tender Value in ₹,Product Category,Sub category,Contract Type,Bid Validity(Days),Period Of Work(Days),Location,Pincode,Pre Bid Meeting Place,Pre Bid Meeting Address,Pre Bid Meeting Date,Bid Opening Place,Should Allow NDA Tender,Allow Preferential Bidder,Organisation Chain,Tender Reference Number,Tender ID,Withdrawal Allowed,Tender Type,Form of contract,Tender Category,No. of Covers,General Technical Evaluation Allowed,ItemWise Technical Evaluation Allowed,Payment Mode,Is Multi Currency Allowed For BOQ,Is Multi Currency Allowed For Fee,Allow Two Stage Bidding,S.No,Bank Name,Publish Date,Bid Opening Date,Document Download / Sale Start Date,Document Download / Sale End Date,Clarification Start Date,Clarification End Date,Bid Submission Start Date,Bid Submission End Date,Financial Bid Opening Date,Name,Address,Cover No,Cover,Document Type,Description,EMD Amount in ₹,EMD Exemption Allowed,EMD Fee Type,EMD Percentage,EMD Payable To,EMD Payable At,Tender Fee in ₹,Fee Payable To,Fee Payable At,Tender Fee Exemption Allowed,S.No.2,Bid Number,Bidder Name,Awarded Currency,Awarded Value,Contract Date :,Contract Value :,Work Completion Period in days :,Updated By :,Updated on :,AOC document :,Organisation Chain :,Tender ID :,Tender Ref No :,Tender Title :,Committee Chairperson/Co-ordinator Name :,Committee Chairperson/Co-ordinator Type :,Committee Members :,Updated By :.1,Updated on :.1,Document :,Type :,Summary :,Updated By :.2,Updated On :,Document :.1,BOQ Comparative Chart :,S.No.1,Bid Number.1,Bidder Name.1,Submitted Date,Status,Remarks,Status Updated On,Type :.1,Summary :.1,Updated By :.3,Updated On :.1,Document :.2,Committee Chairperson/Co-ordinator Name :.1,Committee Chairperson/Co-ordinator Type :.1,Committee Members :.1,Updated By :.4,Updated On :.2,Financial Bid Opening Date:,Document :.3
"R/R Damages on Tehtoli Standli Bajohaghat Road in K.M. 0/00 to 7/300, C/o, B/Wall at R.D. 0/300 to 0/340","R/R Damages on Tehtoli Standli Bajohaghat Road in K.M. 0/00 to 7/300, C/o, B/Wall at R.D. 0/300 to 0/340",Please refer Tender documents. ,NA ,"6,52,820",Civil Works - Roads,NA ,Tender,30.0,45.0,Kotkhai,171202.0,NA ,NA ,NA ,Kotkhai,No ,No,PWD,PW-KD-E-Tender/2023-24- 4724-28 Dated 26-10-2023,2023_PWD_80813_11,Yes,Open Tender,Item Rate,Works,2.0,No,No,Online,No,No,No,1.0,ICICI BANK,03-Nov-2023 11:00 AM,09-Nov-2023 11:00 AM,03-Nov-2023 11:00 AM,08-Nov-2023 06:00 PM,NA ,NA ,03-Nov-2023 11:00 AM,08-Nov-2023 06:00 PM,29-Nov-2023 04:40 PM,Executive Engineer,HPPWD DIVISION KOTKHAI,1.0,Fee/PreQual/Technical,.pdf,Cost Of Tender (Indicated In Schedule F),"13,100",No,fixed,,Nil,Nil,350.0,Nil,Nil,No,1.0,382694.0,Rakesh Chauhan,INR,"683,500",26-Dec-2023,"INR 652,820",45.0,Vinod Shyam,26-Dec-2023 02:31 PM,340.pdf (731.00 KB),PWD,2023_PWD_80813_11,PW-KD-E-Tender/2023-24- 4724-28 Dated 26-10-2023,"R/R Damages on Tehtoli Standli Bajohaghat Road in K.M. 0/00 to 7/300, C/o, B/Wall at R.D. 0/300 to 0/340",Executive Engineer,Internal,"XEN, AE, Supdt. HDM and Contr.",Akhil Chauhan,04-Dec-2023 12:33 PM,finsummary_120410.pdf (188.45 KB),Finance,summary uploaded,Akhil Chauhan,04-Dec-2023 12:30 PM,finance_120410.pdf,BOQ Comparative Chart,1.0,382694.0,Rakesh Chauhan,06-Nov-2023 01:34 PM,Accepted-AOC,Lowest bidder to awarded the work,26-Dec-2023,Technical,summary uploaded,Akhil Chauhan,29-Nov-2023 04:36 PM,technical_120410.pdf,Executive Engineer,Internal,"XEN, AE, Supdt. HDM and Contr.",Akhil Chauhan,29-Nov-2023 04:37 PM,29-Nov-2023 04:40 PM,techsummary_120410.pdf (3272.32 KB)
,,,,,,,,,,,,,,,,,,,,,,,,,,,,,,,,2.0,ICICI NEFT/RTGS,,,,,,,,,,,,,,.pdf,The Earnest Money (Indicated In Schedule F),,,,,,,,,,,,,,,,,,,,,,,,,,,,,,,,,,,,,,2.0,382730.0,RAMESH KUMAR,06-Nov-2023 02:41 PM,Rejected-Finance,L2 BIDDER,04-Dec-2023,,,,,,,,,,,,
,,,,,,,,,,,,,,,,,,,,,,,,,,,,,,,,,,,,,,,,,,,,,,,.pdf,Contractors Registration (Refer General Rules No 23),,,,,,,,,,,,,,,,,,,,,,,,,,,,,,,,,,,,,,,,,,,,,,,,,,,,,,,,
,,,,,,,,,,,,,,,,,,,,,,,,,,,,,,,,,,,,,,,,,,,,,,,.pdf,GST Registration (General Rules No 21),,,,,,,,,,,,,,,,,,,,,,,,,,,,,,,,,,,,,,,,,,,,,,,,,,,,,,,,
,,,,,,,,,,,,,,,,,,,,,,,,,,,,,,,,,,,,,,,,,,,,,,,.pdf,"List Of Machinery, Tool, Plant(Refer Schedule F With Reference To Clause 18)",,,,,,,,,,,,,,,,,,,,,,,,,,,,,,,,,,,,,,,,,,,,,,,,,,,,,,,,
,,,,,,,,,,,,,,,,,,,,,,,,,,,,,,,,,,,,,,,,,,,,,,,.pdf,Form No 8 (Refer General Rules No.26.7),,,,,,,,,,,,,,,,,,,,,,,,,,,,,,,,,,,,,,,,,,,,,,,,,,,,,,,,
,,,,,,,,,,,,,,,,,,,,,,,,,,,,,,,,,,,,,,,,,,,,,,,.pdf,List Of Both Gazetted And Non-Gazetted Hppwd Employees Related To Him (General Rule No 16),,,,,,,,,,,,,,,,,,,,,,,,,,,,,,,,,,,,,,,,,,,,,,,,,,,,,,,,
,,,,,,,,,,,,,,,,,,,,,,,,,,,,,,,,,,,,,,,,,,,,,,,.pdf,Affidavit That Information Furnished With The Bid Is Correct In All Respect,,,,,,,,,,,,,,,,,,,,,,,,,,,,,,,,,,,,,,,,,,,,,,,,,,,,,,,,
,,,,,,,,,,,,,,,,,,,,,,,,,,,,,,,,,,,,,,,,,,,,,,,.pdf,Proof of Registration under Employees Provident Funds(Refer General Rule 25 A),,,,,,,,,,,,,,,,,,,,,,,,,,,,,,,,,,,,,,,,,,,,,,,,,,,,,,,,
,,,,,,,,,,,,,,,,,,,,,,,,,,,,,,,,,,,,,,,,,,,,,,,.pdf,Other Important Documents As Specified By The State In Proforma Of Schedule,,,,,,,,,,,,,,,,,,,,,,,,,,,,,,,,,,,,,,,,,,,,,,,,,,,,,,,,
,,,,,,,,,,,,,,,,,,,,,,,,,,,,,,,,,,,,,,,,,,,,,2.0,Finance,.xls,BOQ,,,,,,,,,,,,,,,,,,,,,,,,,,,,,,,,,,,,,,,,,,,,,,,,,,,,,,,,
