Tender Fee in ₹,Fee Payable To,Fee Payable At,Tender Fee Exemption Allowed,S.No,Corrigendum Title,Corrigendum Type,View,EMD Amount in ₹,EMD Exemption Allowed,EMD Fee Type,EMD Percentage,EMD Payable To,EMD Payable At,Title,Work Description,Pre Qualification Details,Independent External Monitor/Remarks,Tender Value in ₹,Product Category,Sub category,Contract Type,Bid Validity(Days),Period Of Work(Days),Location,Pincode,Pre Bid Meeting Place,Pre Bid Meeting Address,Pre Bid Meeting Date,Bid Opening Place,Should Allow NDA Tender,Allow Preferential Bidder,S.No.1,Instrument Type,Cover No,Cover,Document Type,Description,Name,Address,Publish Date,Bid Opening Date,Document Download / Sale Start Date,Document Download / Sale End Date,Clarification Start Date,Clarification End Date,Bid Submission Start Date,Bid Submission End Date,Financial Bid Opening Date,Organisation Chain,Tender Reference Number,Tender ID,Withdrawal Allowed,Tender Type,Form of contract,Tender Category,No. of Covers,General Technical Evaluation Allowed,ItemWise Technical Evaluation Allowed,Payment Mode,Is Multi Currency Allowed For BOQ,Is Multi Currency Allowed For Fee,Allow Two Stage Bidding,S.No.2,Bid Number,Bidder Name,Awarded Currency,Awarded Value,Type :,Summary :,Updated By :,Updated On :,Document :,BOQ Comparative Chart :,S.No.1.1,Bid Number.1,Bidder Name.1,Submitted Date,Status,Remarks,Status Updated On,Type :.1,Summary :.1,Updated By :.1,Updated On :.1,Document :.1,Organisation Chain :,Tender ID :,Tender Ref No :,Tender Title :,Committee Chairperson/Co-ordinator Name :,Committee Chairperson/Co-ordinator Type :,Committee Members :,Updated By :.2,Updated On :.2,Financial Bid Opening Date:,Document :.2,Committee Chairperson/Co-ordinator Name :.1,Committee Chairperson/Co-ordinator Type :.1,Committee Members :.1,Updated By :.3,Updated on :,Document :.3,Contract Date :,Contract Value :,Work Completion Period in days :,Updated By :.4,Updated on :.1,AOC document :,AOC Description :
500.0,Executive Engineer R B M C Shimla,Shimla,No,1.0,Due Date Extended,Admin Corrigendum Date Extend,,"46,000",No,fixed,,Executive Engineer R B M C Shimla,Shimla,Restoration of rain damages on path from Guru Niwas to Negi House in ward No 3 Kaithu,Restoration of rain damages on path from Guru Niwas to Negi House in ward No 3 Kaithu,Please refer Tender Documents ,NA ,"22,71,900",Civil Works,NA ,Tender,120.0,60.0,Shimla,171001.0,NA ,NA ,NA ,MC Shimla,No ,No,1.0,DD - Demand Draft,1.0,Fee/PreQual/Technical,.pdf,Cost of form in shape of DD and Earnest money in shape of FDR as per E procurement notice,Executive Engineer R B M C Shimla,Executive Engineer R B M C Shimla,22-Sep-2023 10:00 AM,02-Oct-2023 03:00 PM,22-Sep-2023 10:00 AM,30-Sep-2023 05:00 PM,NA ,NA ,22-Sep-2023 10:00 AM,30-Sep-2023 05:00 PM,09-Oct-2023 11:20 AM,Municipal Corporation Shimla,1885Dated14092023,2023_MC_79187_12,Yes,Open Tender,Item Rate,Works,2.0,No,No,Offline,No,No,No,1.0,374892.0,ROHIT DIWAN,INR,"2,062,752",Finance,BOS,Dinesh Thakur,09-Oct-2023 12:46 PM,finance_118034.pdf,BOQ Comparative Chart,1.0,374861.0,Ashu Chauhan,28-Sep-2023 02:44 PM,Rejected-Technical,Rejected,09-Oct-2023,Technical,BOS,Dinesh Thakur,03-Oct-2023 03:42 PM,technical_118034.pdf,Municipal Corporation Shimla,2023_MC_79187_12,1885Dated14092023,Restoration of rain damages on path from Guru Niwas to Negi House in ward No 3 Kaithu,EE,Internal,AO AE,Rajesh Thakur,09-Oct-2023 11:18 AM,09-Oct-2023 11:20 AM,techsummary_118034.pdf (1953.69 KB),EE,Internal,AO AE,Rajesh Thakur,08-Dec-2023 12:14 PM,finsummary_118034.pdf (314.77 KB),08-Dec-2023,"INR 2,080,622.2",60.0,Rajesh Thakur,08-Dec-2023 12:16 PM,2023_MC_79187_12.pdf (776.00 KB),AOC
,,,,,,,,,,,,,,,,,,,,,,,,,,,,,,,,2.0,FDR - Fixed Deposit,,,.pdf,Certificate of registration with HPPWD in appropriate class and latest renewal thereof,,,,,,,,,,,,,,,,,,,,,,,,,,,,,,,,,,,,,2.0,374772.0,ATMA RAM CHAUHAN,28-Sep-2023 11:49 AM,Rejected-Technical,Rejected,09-Oct-2023,,,,,,,,,,,,,,,,,,,,,,,,,,,,,
,,,,,,,,,,,,,,,,,,,,,,,,,,,,,,,,,,,,.pdf,Income Tax GST and EPF registration PAN Permanent Account No and GST No,,,,,,,,,,,,,,,,,,,,,,,,,,,,,,,,,,,,,3.0,374510.0,devinder singh,27-Sep-2023 11:29 AM,Rejected-Finance,Rejected,08-Dec-2023,,,,,,,,,,,,,,,,,,,,,,,,,,,,,
,,,,,,,,,,,,,,,,,,,,,,,,,,,,,,,,,,,,.pdf,Scanned Copy of tender documents i.e. NIT (E-procurement notice) Performa and Form MW-7 duly signed,,,,,,,,,,,,,,,,,,,,,,,,,,,,,,,,,,,,,4.0,374892.0,ROHIT DIWAN,28-Sep-2023 04:38 PM,Accepted-AOC,Accepted,08-Dec-2023,,,,,,,,,,,,,,,,,,,,,,,,,,,,,
,,,,,,,,,,,,,,,,,,,,,,,,,,,,,,,,,,,,.pdf,Scanned copy of Letter Head with reference to condition No. 11.1,,,,,,,,,,,,,,,,,,,,,,,,,,,,,,,,,,,,,5.0,374462.0,vikas jaswal,27-Sep-2023 08:52 AM,Rejected-Finance,Rejected,08-Dec-2023,,,,,,,,,,,,,,,,,,,,,,,,,,,,,
,,,,,,,,,,,,,,,,,,,,,,,,,,,,,,,,,,,,.pdf,Scanned copy of Affidavit duly signed with reference to condition No. 11.4,,,,,,,,,,,,,,,,,,,,,,,,,,,,,,,,,,,,,,,,,,,,,,,,,,,,,,,,,,,,,,,,,,,,,,,,
,,,,,,,,,,,,,,,,,,,,,,,,,,,,,,,,,,2.0,Finance,.xls,BOQ,,,,,,,,,,,,,,,,,,,,,,,,,,,,,,,,,,,,,,,,,,,,,,,,,,,,,,,,,,,,,,,,,,,,,,,,
