S.No,Bank Name,EMD Amount in ₹,EMD Exemption Allowed,EMD Fee Type,EMD Percentage,EMD Payable To,EMD Payable At,Publish Date,Bid Opening Date,Document Download / Sale Start Date,Document Download / Sale End Date,Clarification Start Date,Clarification End Date,Bid Submission Start Date,Bid Submission End Date,Financial Bid Opening Date,Organisation Chain,Tender Reference Number,Tender ID,Withdrawal Allowed,Tender Type,Form of contract,Tender Category,No. of Covers,General Technical Evaluation Allowed,ItemWise Technical Evaluation Allowed,Payment Mode,Is Multi Currency Allowed For BOQ,Is Multi Currency Allowed For Fee,Allow Two Stage Bidding,Name,Address,Title,Work Description,Pre Qualification Details,Independent External Monitor/Remarks,Tender Value in ₹,Product Category,Sub category,Contract Type,Bid Validity(Days),Period Of Work(Days),Location,Pincode,Pre Bid Meeting Place,Pre Bid Meeting Address,Pre Bid Meeting Date,Bid Opening Place,Should Allow NDA Tender,Allow Preferential Bidder,Cover No,Cover,Document Type,Description,Tender Fee in ₹,Fee Payable To,Fee Payable At,Tender Fee Exemption Allowed,S.No.2,Bid Number,Bidder Name,Awarded Currency,Awarded Value,Type :,Summary :,Updated By :,Updated On :,Document :,BOQ Comparative Chart :,S.No.1,Bid Number.1,Bidder Name.1,Submitted Date,Status,Remarks,Status Updated On,Type :.1,Summary :.1,Updated By :.1,Updated On :.1,Document :.1,Organisation Chain :,Tender ID :,Tender Ref No :,Tender Title :,Committee Chairperson/Co-ordinator Name :,Committee Chairperson/Co-ordinator Type :,Committee Members :,Updated By :.2,Updated On :.2,Financial Bid Opening Date:,Document :.2,Committee Chairperson/Co-ordinator Name :.1,Committee Chairperson/Co-ordinator Type :.1,Committee Members :.1,Updated By :.3,Updated on :,Document :.3,Contract Date :,Contract Value :,Work Completion Period in days :,Updated By :.4,Updated on :.1,AOC document :,AOC Description :
1.0,ICICI BANK,"1,83,100",No,fixed,,Nil,Nil,27-Oct-2023 12:00 PM,07-Nov-2023 11:30 AM,27-Oct-2023 12:00 PM,06-Nov-2023 05:00 PM,NA ,NA ,27-Oct-2023 05:00 PM,06-Nov-2023 05:00 PM,01-Dec-2023 11:30 AM,PWD,PW-JND-B and R-EA-I-NIT- 19594-19643dt.07.10.2023,2023_PWD_80750_1,Yes,Open Tender,Percentage,Works,2.0,No,No,Online,No,No,No,Executive Engineer,"O/o Executive Engineer, B and R Division, HPPWD, Joginder Nagar",Construction of Horticulture office cum residence at Chauntra Tehsil Joginder Nagar Distt. Mandi (H.P.),"Construction of Civil work Building portion, Water Supply and Sanitary Installation, Septic Tank and Solar Water heating System",As Per bid documents ,NA ,"91,52,567",Civil Works - Roads,NA ,Tender,30.0,365.0,Chauntra,175032.0,NA ,NA ,NA ,"E.E. B and R Division, HPPWD, Joginder Nagar",No ,No,1.0,Fee/PreQual/Technical,.pdf,Cost of tender Form and Earnest money (Indicated in Schedule E),"2,000",Nil,Nil,No,1.0,382659.0,NAVNEET SINGH RATHORE,INR,"8,054,262",Finance,Financial bid opening summary,Jai Pal Naik,04-Dec-2023 11:54 AM,finance_120209.pdf,BOQ Comparative Chart,1.0,382262.0,Dinesh kumar,06-Nov-2023 04:15 PM,Rejected-Technical,Non Responsive,25-Nov-2023,Technical,Techncalcl bid open summary,Jai Pal Naik,09-Nov-2023 12:57 PM,,PWD,2023_PWD_80750_1,PW-JND-B and R-EA-I-NIT- 19594-19643dt.07.10.2023,Construction of Horticulture office cum residence at Chauntra Tehsil Joginder Nagar Distt. Mandi (H.P.),Executive Engineer,Internal,"Assistant Engineer Joginder Nagar, Head Draughtsman, Superintendent Gr-II, Divisional Accounts Officer, Tender Assistant",Jai Pal Naik,25-Nov-2023 11:10 AM,01-Dec-2023 11:30 AM,techsummary_120209.pdf (378.32 KB),Executive Engineer,Internal,"Assistant Engineer Joginder Nagar, Head Draughtsman, Superintendent Gr-II, Divisional Accounts Officer, Tender Assistant",Jai Pal Naik,04-Dec-2023 12:03 PM,finsummary_120209.pdf (218.18 KB),13-Dec-2023,"INR 8,054,262",365.0,Jai Pal Naik,14-Dec-2023 10:58 AM,awardletter.pdf (284.00 KB),Work awarded to the lowest contractor L-1
2.0,ICICI NEFT/RTGS,,,,,,,,,,,,,,,,,,,,,,,,,,,,,,,,,,,,,,,,,,,,,,,,,,,,.pdf,Contractors Registration (General Rule No.20),,,,,,,,,,,,,,,,2.0,382256.0,Gajraj Singh,04-Nov-2023 03:38 PM,Rejected-Finance,Rejected due to L-2,04-Dec-2023,,,,,,,,,,,,,,,,,,,,,,,,,,,,,
,,,,,,,,,,,,,,,,,,,,,,,,,,,,,,,,,,,,,,,,,,,,,,,,,,,,,.pdf,GST Registration and GST Clarence certificate Document Refer HPPWD-6 16(3),,,,,,,,,,,,,,,,3.0,382738.0,Man Singh,06-Nov-2023 03:55 PM,Rejected-Technical,Non Responsive,25-Nov-2023,,,,,,,,,,,,,,,,,,,,,,,,,,,,,
,,,,,,,,,,,,,,,,,,,,,,,,,,,,,,,,,,,,,,,,,,,,,,,,,,,,,.pdf,Work done and work in hand certificate(Gen.Rule No.16)Mini amount of work done as per Schedule-F,,,,,,,,,,,,,,,,4.0,382659.0,NAVNEET SINGH RATHORE,06-Nov-2023 11:32 AM,Accepted-AOC,Work awarded to the lowest contractor L-1,14-Dec-2023,,,,,,,,,,,,,,,,,,,,,,,,,,,,,
,,,,,,,,,,,,,,,,,,,,,,,,,,,,,,,,,,,,,,,,,,,,,,,,,,,,,.pdf,Affidavit of machineries Indicated in Sch.F contractor must upload the proofofownershipof machinery,,,,,,,,,,,,,,,,5.0,382748.0,yogesh,06-Nov-2023 03:49 PM,Rejected-Technical,Non Responsive,25-Nov-2023,,,,,,,,,,,,,,,,,,,,,,,,,,,,,
,,,,,,,,,,,,,,,,,,,,,,,,,,,,,,,,,,,,,,,,,,,,,,,,,,,,,.pdf,Form No.7 and 8 duly signed on judiciary paper (General Rulesand directions in Schedule A to F),,,,,,,,,,,,,,,,,,,,,,,,,,,,,,,,,,,,,,,,,,,,,,,,,,,
,,,,,,,,,,,,,,,,,,,,,,,,,,,,,,,,,,,,,,,,,,,,,,,,,,,,,.pdf,Affidavit of both Gazetted and non gazetted Officer HPPWD employees related to him (Gen.Rule No.16,,,,,,,,,,,,,,,,,,,,,,,,,,,,,,,,,,,,,,,,,,,,,,,,,,,
,,,,,,,,,,,,,,,,,,,,,,,,,,,,,,,,,,,,,,,,,,,,,,,,,,,,,.pdf,Affidavit regarding all the information furnished with the bid is correct in all respect,,,,,,,,,,,,,,,,,,,,,,,,,,,,,,,,,,,,,,,,,,,,,,,,,,,
,,,,,,,,,,,,,,,,,,,,,,,,,,,,,,,,,,,,,,,,,,,,,,,,,,,2.0,Finance,.xls,BOQ,,,,,,,,,,,,,,,,,,,,,,,,,,,,,,,,,,,,,,,,,,,,,,,,,,,
