Cover No,Cover,Document Type,Description,Title,Work Description,Pre Qualification Details,Independent External Monitor/Remarks,Tender Value in ₹,Product Category,Sub category,Contract Type,Bid Validity(Days),Period Of Work(Days),Location,Pincode,Pre Bid Meeting Place,Pre Bid Meeting Address,Pre Bid Meeting Date,Bid Opening Place,Should Allow NDA Tender,Allow Preferential Bidder,Publish Date,Bid Opening Date,Document Download / Sale Start Date,Document Download / Sale End Date,Clarification Start Date,Clarification End Date,Bid Submission Start Date,Bid Submission End Date,Financial Bid Opening Date,Name,Address,S.No,Instrument Type,EMD Amount in ₹,EMD Exemption Allowed,EMD Fee Type,EMD Percentage,EMD Payable To,EMD Payable At,Organisation Chain,Tender Reference Number,Tender ID,Withdrawal Allowed,Tender Type,Form of contract,Tender Category,No. of Covers,General Technical Evaluation Allowed,ItemWise Technical Evaluation Allowed,Payment Mode,Is Multi Currency Allowed For BOQ,Is Multi Currency Allowed For Fee,Allow Two Stage Bidding,Tender Fee in ₹,Fee Payable To,Fee Payable At,Tender Fee Exemption Allowed,Organisation Chain :,Tender ID :,Tender Ref No :,Tender Title :,Committee Chairperson/Co-ordinator Name :,Committee Chairperson/Co-ordinator Type :,Committee Members :,Updated By :,Updated On :,Financial Bid Opening Date:,Document :,Committee Chairperson/Co-ordinator Name :.1,Committee Chairperson/Co-ordinator Type :.1,Committee Members :.1,Updated By :.1,Updated on :,Document :.1,Contract Date :,Contract Value :,Work Completion Period in days :,Updated By :.2,Updated on :.1,AOC document :,AOC Description :,S.No.2,Bid Number,Bidder Name,Submitted Date,Status,Remarks,Status Updated On,Type :,Summary :,Updated By :.3,Updated On :.1,Document :.2,S.No.1,Bid Number.1,Bidder Name.1,Awarded Currency,Awarded Value,Type :.1,Summary :.1,Updated By :.4,Updated On :.2,Document :.3,BOQ Comparative Chart :
1.0,Fee/PreQual/Technical,.pdf,Earnest Money,Repair work of AEO Sale centre Bharog Bhaneri Distt Sirmour (H.P.),Repair work of AEO Sale centre Bharog Bhaneri Distt Sirmour (H.P.),As per Bidding Documents ,NA ,"5,38,965",Civil Works - Buildings,NA ,Tender,60.0,30.0,Nahan,173001.0,NA ,NA ,NA ,Office of DDA Nahan,No ,No,18-Nov-2023 05:00 PM,29-Nov-2023 11:30 AM,18-Nov-2023 05:00 PM,28-Nov-2023 01:00 PM,NA ,NA ,18-Nov-2023 05:00 PM,28-Nov-2023 01:00 PM,29-Nov-2023 04:10 PM,Deputy Director of Agriculture,Office of the Deputy Director of Agriculture District Sirmaur at Nahan,1.0,DD - Demand Draft,"10,800",No,fixed,,"DDA, District Sirmaur at Nahan",Nahan,Director of Agriculture||Agriculture Head Office - DoA||DDA Sirmour - DoA,NAHAN 3332,2023_DoA_81597_1,Yes,Open Tender,Item Rate,Works,2.0,No,No,Offline,No,No,No,300.0,"DDA, District Sirmaur at Nahan",Nahan,No,Director of Agriculture||Agriculture Head Office - DoA||DDA Sirmour - DoA,2023_DoA_81597_1,NAHAN 3332,Repair work of AEO Sale centre Bharog Bhaneri Distt Sirmour (H.P.),Rajinder Singh Thakur,Internal,ACF SDSCO JE,Rajender Singh,29-Nov-2023 04:08 PM,29-Nov-2023 04:10 PM,techsummary_121403.pdf (3909.88 KB),Rajinder Singh Thakur,Internal,ACF SDSCO JE,Rajender Singh,02-Dec-2023 01:13 PM,finsummary_121403.pdf (186.01 KB),07-Dec-2023,"INR 468,403.65",30.0,Rajender Singh,07-Dec-2023 12:45 PM,AWARDLETTER.pdf (1257.00 KB),This work is awarded to Sh.Chaman Lal Contractor,1,386141,Chaman Lal Contractor,27-Nov-2023 06:41 PM,Accepted-AOC,Lowest Bidder,07-Dec-2023,Technical,technical summary,Rajender Singh,29-Nov-2023 03:54 PM,technical_121403.pdf,1.0,386141.0,Chaman Lal Contractor,INR,"468,403.65",Finance,Financial evaluation,Rajender Singh,02-Dec-2023 12:03 PM,,BOQ Comparative Chart
,,.pdf,Cost of tender from,,,,,,,,,,,,,,,,,,,,,,,,,,,,,,2.0,FDR - Fixed Deposit,,,,,,,,,,,,,,,,,,,,,,,,,,,,,,,,,,,,,,,,,,,,,,,,,2,386259,DALIP SINGH CONTRUCTOR,28-Nov-2023 12:39 PM,Rejected-Technical,did not submit documents physically,29-Nov-2023,,,,,,,,,,,,,,,,
,,.pdf,"Certificate of Registration with HPPWD, HP Jal Shakti Vibhag, HP Housing Board, HPTDC",,,,,,,,,,,,,,,,,,,,,,,,,,,,,,,,,,,,,,,,,,,,,,,,,,,,,,,,,,,,,,,,,,,,,,,,,,,,,,,,3,386144,Deepak Kumar Contractor,27-Nov-2023 06:45 PM,Rejected-Technical,did not submit documents physically,29-Nov-2023,,,,,,,,,,,,,,,,
,,.pdf,Pan number and GST registration and latest I.T.R.,,,,,,,,,,,,,,,,,,,,,,,,,,,,,,,,,,,,,,,,,,,,,,,,,,,,,,,,,,,,,,,,,,,,,,,,,,,,,,,,4,386240,Devinder sumra,28-Nov-2023 12:42 PM,Rejected-Finance,highest,02-Dec-2023,,,,,,,,,,,,,,,,
,,.pdf,Undertaking that Bidder has carefully studied all the terms and conditions,,,,,,,,,,,,,,,,,,,,,,,,,,,,,,,,,,,,,,,,,,,,,,,,,,,,,,,,,,,,,,,,,,,,,,,,,,,,,,,,5,386147,RAMAN KUMAR,27-Nov-2023 06:49 PM,Rejected-Technical,did not submit documents physically,29-Nov-2023,,,,,,,,,,,,,,,,
,,.pdf,A scanned copy of valid EPF number,,,,,,,,,,,,,,,,,,,,,,,,,,,,,,,,,,,,,,,,,,,,,,,,,,,,,,,,,,,,,,,,,,,,,,,,,,,,,,,,6,386252,RAMESH CHAND,28-Nov-2023 12:22 PM,Rejected-Finance,2nd highest,02-Dec-2023,,,,,,,,,,,,,,,,
2.0,Finance,.xls,Bill of Quantity,,,,,,,,,,,,,,,,,,,,,,,,,,,,,,,,,,,,,,,,,,,,,,,,,,,,,,,,,,,,,,,,,,,,,,,,,,,,,,,,7,386149,Vijay pal,28-Nov-2023 12:08 PM,Rejected-Technical,did not submit documents physically,29-Nov-2023,,,,,,,,,,,,,,,,
