Committee Chairperson/Co-ordinator Name :,Committee Chairperson/Co-ordinator Type :,Committee Members :,Updated By :,Updated On :,Financial Bid Opening Date:,Document :,Organisation Chain :,Tender ID :,Tender Ref No :,Tender Title :,S.No,Bid Number,Bidder Name,Awarded Currency,Awarded Value,Type :,Summary :,Updated By :.1,Updated On :.1,Document :.1,Committee Chairperson/Co-ordinator Name :.1,Committee Chairperson/Co-ordinator Type :.1,Committee Members :.1,Updated By :.2,Updated on :,Document :.2,S.No.1,Bid Number.1,Bidder Name.1,Submitted Date,Status,Remarks,Status Updated On,Contract Date :,Contract Value :,Work Completion Period in days :,Updated By :.3,Updated on :.1,AOC document :,AOC Description :,Type :.1,Summary :.1,Updated By :.4,Updated On :.2,Document :.3,BOQ Comparative Chart :,Title,Work Description,Pre Qualification Details,Independent External Monitor/Remarks,Tender Value in ₹,Product Category,Sub category,Contract Type,Bid Validity(Days),Period Of Work(Days),Location,Pincode,Pre Bid Meeting Place,Pre Bid Meeting Address,Pre Bid Meeting Date,Bid Opening Place,Should Allow NDA Tender,Allow Preferential Bidder,Organisation Chain,Tender Reference Number,Tender ID,Withdrawal Allowed,Tender Type,Form of contract,Tender Category,No. of Covers,General Technical Evaluation Allowed,ItemWise Technical Evaluation Allowed,Payment Mode,Is Multi Currency Allowed For BOQ,Is Multi Currency Allowed For Fee,Allow Two Stage Bidding,Cover No,Cover,Document Type,Description,Publish Date,Bid Opening Date,Document Download / Sale Start Date,Document Download / Sale End Date,Clarification Start Date,Clarification End Date,Bid Submission Start Date,Bid Submission End Date,Financial Bid Opening Date,Tender Fee in ₹,Fee Payable To,Fee Payable At,Tender Fee Exemption Allowed,S.No.2,Instrument Type,Name,Address,EMD Amount in ₹,EMD Exemption Allowed,EMD Fee Type,EMD Percentage,EMD Payable To,EMD Payable At
EE,Internal,AO AE,Rajesh Thakur,03-Oct-2023 10:12 AM,03-Oct-2023 10:15 AM,techsummary_117802.pdf (655.95 KB),Municipal Corporation Shimla,2023_MC_79011_2,1853Dated12092023,Construction of Toilet Block with Dressing Room at Jungli Ground in ward No 10,1.0,372925.0,Devinder Thakur,INR,"1,386,100",Technical,BOS,Dinesh Thakur,28-Sep-2023 11:17 AM,technical_117802.pdf,EE,Internal,AO AE,Rajesh Thakur,08-Dec-2023 10:42 AM,finsummary_117802.pdf (314.77 KB),1.0,372936.0,DALIP SINGH,21-Sep-2023 11:02 PM,Rejected-Finance,Rejected,08-Dec-2023,08-Dec-2023,"INR 1,517,298.6",60.0,Rajesh Thakur,08-Dec-2023 10:43 AM,2023_MC_79011_2.pdf (2842.00 KB),AOC,Finance,BOS,Dinesh Thakur,03-Oct-2023 11:01 AM,finance_117802.pdf,BOQ Comparative Chart,Construction of Toilet Block with Dressing Room at Jungli Ground in ward No 10,Construction of Toilet Block with Dressing Room at Jungli Ground in ward No 10,Please refer Tender Documents ,NA ,"14,56,400",Civil Works,NA ,Tender,120.0,60.0,Shimla,171001.0,NA ,NA ,NA ,MC Shimla,No ,No,Municipal Corporation Shimla,1853Dated12092023,2023_MC_79011_2,Yes,Open Tender,Item Rate,Works,2.0,No,No,Offline,No,No,No,1.0,Fee/PreQual/Technical,.pdf,Cost of form in shape of DD and Earnest money in shape of FDR as per E procurement notice,18-Sep-2023 06:55 PM,25-Sep-2023 03:00 PM,18-Sep-2023 06:55 PM,25-Sep-2023 11:00 AM,NA ,NA ,18-Sep-2023 06:55 PM,25-Sep-2023 11:00 AM,03-Oct-2023 10:15 AM,500.0,Executive Engineer R B M C Shimla,Shimla,No,1.0,DD - Demand Draft,Executive Engineer R B M C Shimla,Executive Engineer R B M C Shimla,"29,100",No,fixed,,Executive Engineer R B M C Shimla,Shimla
,,,,,,,,,,,,,,,,,,,,,,,,,,,2.0,372925.0,Devinder Thakur,21-Sep-2023 10:51 PM,Accepted-AOC,Accepted,08-Dec-2023,,,,,,,,,,,,,,,,,,,,,,,,,,,,,,,,,,,,,,,,,,,,,,,,.pdf,Certificate of registration with HPPWD in appropriate class and latest renewal thereof,,,,,,,,,,,,,,2.0,FDR - Fixed Deposit,,,,,,,,
,,,,,,,,,,,,,,,,,,,,,,,,,,,3.0,372942.0,SUNIL KUMAR MEHTA,21-Sep-2023 10:41 PM,Rejected-Finance,Rejected,08-Dec-2023,,,,,,,,,,,,,,,,,,,,,,,,,,,,,,,,,,,,,,,,,,,,,,,,.pdf,Income Tax GST and EPF registration PAN Permanent Account No and GST No,,,,,,,,,,,,,,,,,,,,,,,
,,,,,,,,,,,,,,,,,,,,,,,,,,,4.0,373578.0,Vinod Kumar Shah,23-Sep-2023 12:40 PM,Rejected-Technical,Rejected,03-Oct-2023,,,,,,,,,,,,,,,,,,,,,,,,,,,,,,,,,,,,,,,,,,,,,,,,.pdf,Scanned Copy of tender documents i.e. NIT (E-procurement notice) Performa and Form MW-7 duly signed,,,,,,,,,,,,,,,,,,,,,,,
,,,,,,,,,,,,,,,,,,,,,,,,,,,,,,,,,,,,,,,,,,,,,,,,,,,,,,,,,,,,,,,,,,,,,,,,,,,,,,,,,.pdf,Scanned copy of Affidavit duly signed with reference to condition No. 11.4,,,,,,,,,,,,,,,,,,,,,,,
,,,,,,,,,,,,,,,,,,,,,,,,,,,,,,,,,,,,,,,,,,,,,,,,,,,,,,,,,,,,,,,,,,,,,,,,,,,,,,,,,.pdf,Scanned copy of Letter Head with reference to condition No. 11.1,,,,,,,,,,,,,,,,,,,,,,,
,,,,,,,,,,,,,,,,,,,,,,,,,,,,,,,,,,,,,,,,,,,,,,,,,,,,,,,,,,,,,,,,,,,,,,,,,,,,,,,2.0,Finance,.xls,BOQ,,,,,,,,,,,,,,,,,,,,,,,
