Title,Work Description,Pre Qualification Details,Independent External Monitor/Remarks,Tender Value in ₹,Product Category,Sub category,Contract Type,Bid Validity(Days),Period Of Work(Days),Location,Pincode,Pre Bid Meeting Place,Pre Bid Meeting Address,Pre Bid Meeting Date,Bid Opening Place,Should Allow NDA Tender,Allow Preferential Bidder,Tender Fee in ₹,Fee Payable To,Fee Payable At,Tender Fee Exemption Allowed,S.No,Instrument Type,EMD Amount in ₹,EMD Exemption Allowed,EMD Fee Type,EMD Percentage,EMD Payable To,EMD Payable At,Cover No,Cover,Document Type,Description,Name,Address,Organisation Chain,Tender Reference Number,Tender ID,Withdrawal Allowed,Tender Type,Form of contract,Tender Category,No. of Covers,General Technical Evaluation Allowed,ItemWise Technical Evaluation Allowed,Payment Mode,Is Multi Currency Allowed For BOQ,Is Multi Currency Allowed For Fee,Allow Two Stage Bidding,Publish Date,Bid Opening Date,Document Download / Sale Start Date,Document Download / Sale End Date,Clarification Start Date,Clarification End Date,Bid Submission Start Date,Bid Submission End Date,Financial Bid Opening Date,Tender Stage,Type :,Summary :,Updated By :,Updated On :,Document :,BOQ Comparative Chart :,S.No,Bid Number,Bidder Name,Awarded Currency,Awarded Value,S.No.1,Bid Number.1,Bidder Name.1,Submitted Date,Status,Remarks,Status Updated On,Type :.1,Summary :.1,Updated By :.1,Updated On :.1,Document :.1,Committee Chairperson/Co-ordinator Name :,Committee Chairperson/Co-ordinator Type :,Committee Members :,Updated By :.2,Updated On :.2,Financial Bid Opening Date:,Document :.2,Organisation Chain :,Tender ID :,Tender Ref No :,Tender Title :,Contract Date :,Contract Value :,Work Completion Period in days :,Updated By :.3,Updated on :,AOC document :,AOC Description :,Committee Chairperson/Co-ordinator Name :.1,Committee Chairperson/Co-ordinator Type :.1,Committee Members :.1,Updated By :.4,Updated on :.1,Document :.3,Tender Stage
Restoration of rain damages channelization of nallah from vijay house to NH 22 Bye pass road Bhatta Kuffer in ward No 23,Restoration of rain damages channelization of nallah from vijay house to NH 22 Bye pass road Bhatta Kuffer in ward No 23,Please refer Tender Documents ,NA ,"15,81,209",Civil Works,NA ,Tender,120.0,90.0,Shimla,171001.0,NA ,NA ,NA ,MC Shimla,No ,No,500.0,Executive Engineer RB MC Shimla,Shimla,No,1.0,DD - Demand Draft,"31,700",No,fixed,,Executive Engineer RB MC Shimla,Shimla,1.0,Fee/PreQual/Technical,.pdf,Cost of form in shape of DD as per e procurement notice,Executive Engineer RB MC Shimla,Executive Engineer RB MC Shimla,Municipal Corporation Shimla,111Dated13012021,2021_MC_44005_16,Yes,Open Tender,Item Rate,Works,2.0,No,No,Offline,No,No,No,04-Feb-2021 02:00 PM,19-Feb-2021 02:00 PM,04-Feb-2021 02:00 PM,18-Feb-2021 05:00 PM,NA ,NA ,04-Feb-2021 02:00 PM,18-Feb-2021 05:00 PM,01-Mar-2021 03:10 PM,AOC,Finance,BOS,Gopesh Behl,01-Mar-2021 03:53 PM,finance_65784.pdf,BOQ Comparative Chart,1.0,199117.0,HARGOVIND RANA,INR,"2,354,900",1.0,199124.0,DALEEP TOMAR,18-Feb-2021 02:06 PM,Rejected-Finance,The rates are on higher side hence rejected,05-Apr-2021 03:24 PM,Technical,BOS,Gopesh Behl,01-Mar-2021 12:25 PM,technical_65784.pdf,EE,Internal,AO AE,Rajesh Thakur,01-Mar-2021 03:02 PM,01-Mar-2021 03:10 PM,techsummary_65784.pdf (1605.68 KB),Municipal Corporation Shimla,2021_MC_44005_16,111Dated13012021,Restoration of rain damages channelization of nallah from vijay house to NH 22 Bye pass road Bhatta Kuffer in ward No 23,05-Apr-2021,"INR 2,682,667.5",60.0,Rajesh Thakur,05-Apr-2021 03:31 PM,2021_MC_44005_16.pdf (570.00 KB),AOC,EE,Internal,AO AE,Rajesh Thakur,05-Apr-2021 03:24 PM,finsummary_65784.pdf (294.95 KB),AOC
,,,,,,,,,,,,,,,,,,,,,,2.0,FDR - Fixed Deposit,,,,,,,,,.pdf,Earnest money in shape of FDR and exemption shall not be allowed,,,,,,,,,,,,,,,,,,,,,,,,,,AOC,,,,,,,,,,,,2.0,199117.0,HARGOVIND RANA,18-Feb-2021 01:55 PM,Accepted-AOC,Accepted due to lowest rates,05-Apr-2021 03:31 PM,,,,,,,,,,,,,,,,,,,,,,,,,,,,,,AOC
,,,,,,,,,,,,,,,,,,,,,,,,,,,,,,,,.pdf,Certificate of registration with HPPWD in appropriate class and latest renewal thereof,,,,,,,,,,,,,,,,,,,,,,,,,,AOC,,,,,,,,,,,,3.0,199149.0,Suresh Kumar,18-Feb-2021 03:07 PM,Rejected-Finance,The rates are on higher side hence rejected,05-Apr-2021 03:24 PM,,,,,,,,,,,,,,,,,,,,,,,,,,,,,,AOC
,,,,,,,,,,,,,,,,,,,,,,,,,,,,,,,,.pdf,Income Tax GST and EPF registration PAN Permanent Account No and GST No,,,,,,,,,,,,,,,,,,,,,,,,,,AOC,,,,,,,,,,,,,,,,,,,,,,,,,,,,,,,,,,,,,,,,,,,,,,,,AOC
,,,,,,,,,,,,,,,,,,,,,,,,,,,,,,,,.pdf,"Scanned copy of Proforma, Tender Notice and Form MW-7 duly signed",,,,,,,,,,,,,,,,,,,,,,,,,,AOC,,,,,,,,,,,,,,,,,,,,,,,,,,,,,,,,,,,,,,,,,,,,,,,,AOC
,,,,,,,,,,,,,,,,,,,,,,,,,,,,,,2.0,Finance,.xls,Schedule of Quantity (BOQ),,,,,,,,,,,,,,,,,,,,,,,,,,AOC,,,,,,,,,,,,,,,,,,,,,,,,,,,,,,,,,,,,,,,,,,,,,,,,AOC
