Publish Date,Bid Opening Date,Document Download / Sale Start Date,Document Download / Sale End Date,Clarification Start Date,Clarification End Date,Bid Submission Start Date,Bid Submission End Date,Financial Bid Opening Date,Cover No,Cover,Document Type,Description,EMD Amount in ₹,EMD Exemption Allowed,EMD Fee Type,EMD Percentage,EMD Payable To,EMD Payable At,Organisation Chain,Tender Reference Number,Tender ID,Withdrawal Allowed,Tender Type,Form of contract,Tender Category,No. of Covers,General Technical Evaluation Allowed,ItemWise Technical Evaluation Allowed,Payment Mode,Is Multi Currency Allowed For BOQ,Is Multi Currency Allowed For Fee,Allow Two Stage Bidding,S.No,Bank Name,Tender Fee in ₹,Fee Payable To,Fee Payable At,Tender Fee Exemption Allowed,Name,Address,Title,Work Description,Pre Qualification Details,Independent External Monitor/Remarks,Tender Value in ₹,Product Category,Sub category,Contract Type,Bid Validity(Days),Period Of Work(Days),Location,Pincode,Pre Bid Meeting Place,Pre Bid Meeting Address,Pre Bid Meeting Date,Bid Opening Place,Should Allow NDA Tender,Allow Preferential Bidder,Tender Stage,Type :,Summary :,Updated By :,Updated On :,Document :,BOQ Comparative Chart :,Type :.1,Summary :.1,Updated By :.1,Updated On :.1,Document :.1,Contract Date :,Contract Value :,Work Completion Period in days :,Updated By :.2,Updated on :,AOC document :,AOC Description :,Committee Chairperson/Co-ordinator Name :,Committee Chairperson/Co-ordinator Type :,Committee Members :,Updated By :.3,Updated On :.2,Financial Bid Opening Date:,Document :.2,S.No,Bid Number,Bidder Name,Submitted Date,Status,Remarks,Status Updated On,Committee Chairperson/Co-ordinator Name :.1,Committee Chairperson/Co-ordinator Type :.1,Committee Members :.1,Updated By :.4,Updated on :.1,Document :.3,S.No.1,Bid Number.1,Bidder Name.1,Awarded Currency,Awarded Value,Organisation Chain :,Tender ID :,Tender Ref No :,Tender Title :,Tender Stage
10-Feb-2021 03:00 PM,16-Feb-2021 11:30 AM,10-Feb-2021 03:00 PM,16-Feb-2021 11:00 AM,10-Feb-2021 03:00 PM ,16-Feb-2021 11:00 AM ,10-Feb-2021 03:00 PM,16-Feb-2021 11:00 AM,17-Feb-2021 11:00 AM,1.0,Fee/PreQual/Technical,.pdf,Cost of bid documents and earnest money etc may be deposited either through online/offline mode,"13,500",Yes,fixed,,Executive Engineer,Shahpur,"HP Irrigation and Public Health||Dharamshala Circle,Irrigation and Public Health,HP||Shahpur,Irrigation and Public Health,HP",No. SHP-KNG15-754/2020-13457-506 dt. 10/02/2021,2021_HPIPH_44230_1,Yes,Open Tender,Lump-sum,Works,2.0,No,No,Both(Online/Offline),No,No,No,1.0,ICICI BANK,250.0,Executive Engineer,Shahpur,No,Executive Engineer,Executive Engineer Jal Shakti Division Shahpur,Restoration of rain damage WSS Boh Darini,Construction of RCC storage tank OHSR of 50000 ltrs capacity with 5 mtrs staging height at Talh,Please refer Tender documents. ,NA ,,Civil Works,NA ,Tender,120.0,180.0,Shahpur,176206.0,NA ,NA ,NA ,Jal Shakti Division Shahpur,No ,No,AOC,Finance,Summary,Rajeev Kumar Mahajan,17-Feb-2021 11:32 AM,finance_66255.pdf,BOQ Comparative Chart,Technical,Proceedingofcover1,Rajeev Kumar Mahajan,17-Feb-2021 10:48 AM,technical_66255.pdf,23-Apr-2021,"INR 937,500",180.0,Rajeev Kumar Mahajan,23-Apr-2021 12:27 PM,AOC.pdf (366.00 KB),AOC,Executive Engineer,Internal,Tender Assistant Sr Assistant HDM Supdt,Rajeev Kumar Mahajan,17-Feb-2021 10:49 AM,17-Feb-2021 11:00 AM,techsummary_66255.pdf (285.60 KB),1.0,198746.0,Harminder Singh,15-Feb-2021 09:25 PM,Rejected-Finance,Due to highest rate,23-Apr-2021 12:26 PM,Executive Engineer,Internal,Tender Assistant Sr Assistant HDM Supdt,Rajeev Kumar Mahajan,23-Apr-2021 12:26 PM,finsummary_66255.pdf (278.09 KB),1.0,198644.0,RAJIV SHAKTI GOVT CONTRACTOR,INR,"937,500","HP Irrigation and Public Health||Dharamshala Circle,Irrigation and Public Health,HP||Shahpur,Irrigation and Public Health,HP",2021_HPIPH_44230_1,No. SHP-KNG15-754/2020-13457-506 dt. 10/02/2021,Restoration of rain damage WSS Boh Darini,AOC
,,,,,,,,,,,.pdf,Registration in IPH department and latest renewal as prescribed in the NIT,,,,,,,,,,,,,,,,,,,,,2.0,ICICI NEFT/RTGS,,,,,,,,,,,,,,,,,,,,,,,,,AOC,,,,,,,,,,,,,,,,,,,,,,,,,,2.0,198644.0,RAJIV SHAKTI GOVT CONTRACTOR,15-Feb-2021 05:55 PM,Accepted-AOC,Due to lowest rate,23-Apr-2021 12:27 PM,,,,,,,,,,,,,,,,AOC
,,,,,,,,,,,.pdf,Income tax GST registration and latest clearance as prescribed in the NIT,,,,,,,,,,,,,,,,,,,,,,,,,,,,,,,,,,,,,,,,,,,,,,,AOC,,,,,,,,,,,,,,,,,,,,,,,,,,3.0,198722.0,SEWA SINGH,15-Feb-2021 05:34 PM,Rejected-Finance,Due to highest rate,23-Apr-2021 12:26 PM,,,,,,,,,,,,,,,,AOC
,,,,,,,,,,,.pdf,Registration copy of EPF,,,,,,,,,,,,,,,,,,,,,,,,,,,,,,,,,,,,,,,,,,,,,,,AOC,,,,,,,,,,,,,,,,,,,,,,,,,,,,,,,,,,,,,,,,,,,,,,,,AOC
,,,,,,,,,,,.pdf,The list of similar nature work done/ completed /work in progress with performance certificate duly,,,,,,,,,,,,,,,,,,,,,,,,,,,,,,,,,,,,,,,,,,,,,,,AOC,,,,,,,,,,,,,,,,,,,,,,,,,,,,,,,,,,,,,,,,,,,,,,,,AOC
,,,,,,,,,,,.pdf,An affidavit regarding the exemption letter submitted by you must not have been used anywhere before,,,,,,,,,,,,,,,,,,,,,,,,,,,,,,,,,,,,,,,,,,,,,,,AOC,,,,,,,,,,,,,,,,,,,,,,,,,,,,,,,,,,,,,,,,,,,,,,,,AOC
,,,,,,,,,,,.pdf,An affidavit that any Government/semi government/board/corporation/private organization etc have not,,,,,,,,,,,,,,,,,,,,,,,,,,,,,,,,,,,,,,,,,,,,,,,AOC,,,,,,,,,,,,,,,,,,,,,,,,,,,,,,,,,,,,,,,,,,,,,,,,AOC
,,,,,,,,,2.0,Finance,.xls,BOQ,,,,,,,,,,,,,,,,,,,,,,,,,,,,,,,,,,,,,,,,,,,,,,,AOC,,,,,,,,,,,,,,,,,,,,,,,,,,,,,,,,,,,,,,,,,,,,,,,,AOC
