Organisation Chain,Tender Reference Number,Tender ID,Withdrawal Allowed,Tender Type,Form of contract,Tender Category,No. of Covers,General Technical Evaluation Allowed,ItemWise Technical Evaluation Allowed,Payment Mode,Is Multi Currency Allowed For BOQ,Is Multi Currency Allowed For Fee,Allow Two Stage Bidding,Cover No,Cover,Document Type,Description,Publish Date,Bid Opening Date,Document Download / Sale Start Date,Document Download / Sale End Date,Clarification Start Date,Clarification End Date,Bid Submission Start Date,Bid Submission End Date,Financial Bid Opening Date,EMD Amount in ₹,EMD Exemption Allowed,EMD Fee Type,EMD Percentage,EMD Payable To,EMD Payable At,S.No,Bank Name,Tender Fee in ₹,Fee Payable To,Fee Payable At,Tender Fee Exemption Allowed,Name,Address,Title,Work Description,Pre Qualification Details,Independent External Monitor/Remarks,Tender Value in ₹,Product Category,Sub category,Contract Type,Bid Validity(Days),Period Of Work(Days),Location,Pincode,Pre Bid Meeting Place,Pre Bid Meeting Address,Pre Bid Meeting Date,Bid Opening Place,Should Allow NDA Tender,Allow Preferential Bidder,Tender Stage
PWD,11868-74 dated 26/12/2025,2025_PWD_124557_1,Yes,Open Tender,Percentage,Works,2.0,No,No,Online,No,No,No,1.0,Fee/PreQual/Technical,.pdf,Copy of UTR Number of payment made against cost of tender form and EMD,29-Dec-2025 09:00 AM,05-Jan-2026 10:00 AM,29-Dec-2025 09:00 AM,04-Jan-2026 05:00 PM,29-Dec-2025 09:00 AM,04-Jan-2026 09:00 AM,29-Dec-2025 01:00 PM,04-Jan-2026 05:00 PM,12-Jan-2026 10:30 AM,"47,000",No,fixed,,Nil,Nil,1.0,ICICI BANK,"2,000",Nil,Nil,No,EXECUTIVE ENGINEER,O/O EE HPPWD DIVISION GHUMARWIN,"Restoration of rain damages on Bhadhaghat Kotla Sohni Devi road km 0/00 to 5/500 SH   C/o V-Shape drain at Rd 4/400 to 4/900 AND R/wall at Rd 4/400 to 4/430, 4/433 to 4/451 AND 4/870 to 4/886 Under PDNA Year 2023","Restoration of rain damages on Bhadhaghat Kotla Sohni Devi road km 0/00 to 5/500 SH   C/o V-Shape drain at Rd 4/400 to 4/900 AND R/wall at Rd 4/400 to 4/430, 4/433 to 4/451 AND 4/870 to 4/886 Under PDNA Year 2023",AS PER SBD,,"26,27,327",Civil Works,,Tender,75.0,90.0,GHAMARWIN,174021.0,,,,GHUMARWIN,No,No,AOC
,,,,,,,,,,,,,,,,.pdf,"Copy of  Registration,GST Number,EPF Registration and Pan No",,,,,,,,,,,,,,,,2.0,ICICI NEFT/RTGS,,,,,,,,,,,,,,,,,,,,,,,,,AOC
,,,,,,,,,,,,,,,,.pdf,Work in hand detail as per performa prescribed in SBD,,,,,,,,,,,,,,,,,,,,,,,,,,,,,,,,,,,,,,,,,,AOC
,,,,,,,,,,,,,,,,.pdf,Form No.7/8 duly signed,,,,,,,,,,,,,,,,,,,,,,,,,,,,,,,,,,,,,,,,,,AOC
,,,,,,,,,,,,,,,,.pdf,Affidavit that bid information furnished with the Bid is correct and true in all respects,,,,,,,,,,,,,,,,,,,,,,,,,,,,,,,,,,,,,,,,,,AOC
,,,,,,,,,,,,,,,,.pdf,Affidavit regarding list of both gazetted and non gazetted hppwd employess,,,,,,,,,,,,,,,,,,,,,,,,,,,,,,,,,,,,,,,,,,AOC
,,,,,,,,,,,,,,,,.pdf,Undertaking of Bid validity for a period jof 75 days after the last date of submission of bid,,,,,,,,,,,,,,,,,,,,,,,,,,,,,,,,,,,,,,,,,,AOC
,,,,,,,,,,,,,,,,.pdf,All the GCC and special condition applicable and accepted by the me(contractor) duly signed,,,,,,,,,,,,,,,,,,,,,,,,,,,,,,,,,,,,,,,,,,AOC
,,,,,,,,,,,,,,2.0,Finance,.xls,BOQ,,,,,,,,,,,,,,,,,,,,,,,,,,,,,,,,,,,,,,,,,,AOC
