S.No,Bid Number,Bidder Name,Awarded Currency,Awarded Value,Type :,Summary :,Updated By :,Updated On :,Document :,BOQ Comparative Chart :,Type :.1,Summary :.1,Updated By :.1,Updated On :.1,Document :.1,S.No.1,Bid Number.1,Bidder Name.1,Submitted Date,Status,Remarks,Status Updated On,Contract Date :,Contract Value :,Work Completion Period in days :,Updated By :.2,Updated on :,AOC document :,AOC Description :,Committee Chairperson/Co-ordinator Name :,Committee Chairperson/Co-ordinator Type :,Committee Members :,Updated By :.3,Updated on :.1,Document :.2,Committee Chairperson/Co-ordinator Name :.1,Committee Chairperson/Co-ordinator Type :.1,Committee Members :.1,Updated By :.4,Updated On :.2,Financial Bid Opening Date:,Document :.3,Organisation Chain :,Tender ID :,Tender Ref No :,Tender Title :,Tender Stage,Name,Address,Title,Work Description,Pre Qualification Details,Independent External Monitor/Remarks,Tender Value in ₹,Product Category,Sub category,Contract Type,Bid Validity(Days),Period Of Work(Days),Location,Pincode,Pre Bid Meeting Place,Pre Bid Meeting Address,Pre Bid Meeting Date,Bid Opening Place,Should Allow NDA Tender,Allow Preferential Bidder,Publish Date,Bid Opening Date,Document Download / Sale Start Date,Document Download / Sale End Date,Clarification Start Date,Clarification End Date,Bid Submission Start Date,Bid Submission End Date,Financial Bid Opening Date,Tender Fee in ₹,Fee Payable To,Fee Payable At,Tender Fee Exemption Allowed,Cover No,Cover,Document Type,Description,S.No,Instrument Type,EMD Amount in ₹,EMD Exemption Allowed,EMD Fee Type,EMD Percentage,EMD Payable To,EMD Payable At,Organisation Chain,Tender Reference Number,Tender ID,Withdrawal Allowed,Tender Type,Form of contract,Tender Category,No. of Covers,General Technical Evaluation Allowed,ItemWise Technical Evaluation Allowed,Payment Mode,Is Multi Currency Allowed For BOQ,Is Multi Currency Allowed For Fee,Allow Two Stage Bidding,Tender Stage
1.0,165728.0,Rakesh Kumar,INR,"9,234,840",Finance,Two number bids were found uploaded on e-procurement both were qualified in TQC accordingly opened for financial part today on dated 10.08.2020 in which Sh. Rakesh Kumar Electrical contractor was found the L-1.,Rohan Thakur,10-Aug-2020 01:42 PM,finance_56109.pdf,BOQ Comparative Chart,Technical,Two number bids were found uploaded on e-procurement both made their physical submission of documents accordingly opened for technical part today on 06.07.2020.,Rohan Thakur,06-Jul-2020 12:29 PM,technical_56109.pdf,1.0,165743.0,D.S Ranta Electrical Contractor,02-Jul-2020 06:23 PM,Rejected-AOC,L2,03-Jun-2021 06:42 AM,03-Jun-2021,"INR 9,234,840",730.0,Ravi Singh Rana,03-Jun-2021 06:42 AM,2020_38080.pdf (1553.00 KB),Awarded to L1,XEN ELECTRICAL,Internal,SUPD DA HDM,Ravi Singh Rana,03-Jun-2021 06:40 AM,finsummary_56109.pdf (431.92 KB),SE ELECTRICAL,External,SUPDT EO EE D EE 1,Rohan Thakur,10-Aug-2020 01:05 PM,10-Aug-2020 01:10 PM,techsummary_56109.pdf (217.40 KB),PWD,2020_PWD_38080_1,Electrical Division No.I 500.05 Dated 02.06.2020,C O 50 Beded Civil Hospital at Baddi Distt. Solan SH Providing E.I therein,AOC,Executive Engineer Electrical Division No-1 HPPWD,Executive Engineer Electrical Division No-1 HPPWD Shimla-9,C O 50 Beded Civil Hospital at Baddi Distt. Solan SH Providing E.I therein,Providing E.I,Please refer Tender documents. ,NA ,"76,95,748",Electrical Works,NA ,Tender,120.0,730.0,SHIMLA,171009.0,NA ,NA ,NA ,SHIMLA-9,No ,No,22-Jun-2020 05:00 PM,06-Jul-2020 11:30 AM,22-Jun-2020 05:30 PM,04-Jul-2020 05:00 PM,NA ,NA ,22-Jun-2020 05:30 PM,04-Jul-2020 05:00 PM,10-Aug-2020 01:10 PM,"2,000",E.E.Electrical Division No-I Shimla,SHIMLA,No,1.0,Fee/PreQual/Technical,.pdf,Cost of Tender in shape of DD,1.0,DD - Demand Draft,"1,09,500",No,fixed,,E.E.Electrical Division No-I Shimla,SHIMLA,PWD,Electrical Division No.I 500.05 Dated 02.06.2020,2020_PWD_38080_1,Yes,Open Tender,Item Rate,Works,2.0,No,No,Offline,No,No,No,AOC
,,,,,,,,,,,,,,,,2.0,165728.0,Rakesh Kumar,03-Jul-2020 12:50 PM,Accepted-AOC,L1,03-Jun-2021 06:42 AM,,,,,,,,,,,,,,,,,,,,,,,,,AOC,,,,,,,,,,,,,,,,,,,,,,,,,,,,,,,,,,,,.pdf,EMD in shape of FDR,2.0,FDR - Fixed Deposit,,,,,,,,,,,,,,,,,,,,,AOC
,,,,,,,,,,,,,,,,,,,,,,,,,,,,,,,,,,,,,,,,,,,,,,,AOC,,,,,,,,,,,,,,,,,,,,,,,,,,,,,,,,,,,,.pdf,GST/PAN Registration,,,,,,,,,,,,,,,,,,,,,,,AOC
,,,,,,,,,,,,,,,,,,,,,,,,,,,,,,,,,,,,,,,,,,,,,,,AOC,,,,,,,,,,,,,,,,,,,,,,,,,,,,,,,,,,,,.pdf,Valid electrical enlistment issued from competent authority,,,,,,,,,,,,,,,,,,,,,,,AOC
,,,,,,,,,,,,,,,,,,,,,,,,,,,,,,,,,,,,,,,,,,,,,,,AOC,,,,,,,,,,,,,,,,,,,,,,,,,,,,,,,,,,,,.pdf,TQC Technical Qualification Criteria as per tender document,,,,,,,,,,,,,,,,,,,,,,,AOC
,,,,,,,,,,,,,,,,,,,,,,,,,,,,,,,,,,,,,,,,,,,,,,,AOC,,,,,,,,,,,,,,,,,,,,,,,,,,,,,,,,,,,,.pdf,Certificate of undertaking,,,,,,,,,,,,,,,,,,,,,,,AOC
,,,,,,,,,,,,,,,,,,,,,,,,,,,,,,,,,,,,,,,,,,,,,,,AOC,,,,,,,,,,,,,,,,,,,,,,,,,,,,,,,,,,2.0,Finance,.xls,SCHEDULE OF QUANTITY BOQ,,,,,,,,,,,,,,,,,,,,,,,AOC
,,,,,,,,,,,,,,,,,,,,,,,,,,,,,,,,,,,,,,,,,,,,,,,AOC,,,,,,,,,,,,,,,,,,,,,,,,,,,,,,,,,,,,.pdf,STANDARD BIDDING DOCUMENT SBD Form-8,,,,,,,,,,,,,,,,,,,,,,,AOC
