S.No,Bid Number,Bidder Name,Submitted Date,Status,Remarks,Status Updated On,S.No.1,Bid Number.1,Bidder Name.1,Awarded Currency,Awarded Value,Contract Date :,Contract Value :,Work Completion Period in days :,Updated By :,Updated on :,AOC document :,AOC Description :,Committee Chairperson/Co-ordinator Name :,Committee Chairperson/Co-ordinator Type :,Committee Members :,Updated By :.1,Updated on :.1,Document :,Committee Chairperson/Co-ordinator Name :.1,Committee Chairperson/Co-ordinator Type :.1,Committee Members :.1,Updated By :.2,Updated On :,Document :.1,Organisation Chain :,Tender ID :,Tender Ref No :,Tender Title :,Type :,Summary :,Updated By :.3,Updated On :.1,Document :.2,BOQ Comparative Chart :,Tender Stage,Cover No,Cover,Document Type,Description,EMD Amount in ₹,EMD Exemption Allowed,EMD Fee Type,EMD Percentage,EMD Payable To,EMD Payable At,Name,Address,Publish Date,Bid Opening Date,Document Download / Sale Start Date,Document Download / Sale End Date,Clarification Start Date,Clarification End Date,Bid Submission Start Date,Bid Submission End Date,Tender Fee in ₹,Fee Payable To,Fee Payable At,Tender Fee Exemption Allowed,S.No,Instrument Type,Title,Work Description,Pre Qualification Details,Independent External Monitor/Remarks,Tender Value in ₹,Product Category,Sub category,Contract Type,Bid Validity(Days),Period Of Work(Days),Location,Pincode,Pre Bid Meeting Place,Pre Bid Meeting Address,Pre Bid Meeting Date,Bid Opening Place,Should Allow NDA Tender,Allow Preferential Bidder,Organisation Chain,Tender Reference Number,Tender ID,Withdrawal Allowed,Tender Type,Form of contract,Tender Category,No. of Covers,General Technical Evaluation Allowed,ItemWise Technical Evaluation Allowed,Payment Mode,Is Multi Currency Allowed For BOQ,Is Multi Currency Allowed For Fee,Allow Two Stage Bidding,Tender Stage
1.0,184509.0,D.S Ranta Electrical Contractor,29-Oct-2020 03:18 PM,Rejected-AOC,L2,03-Jun-2021 09:42 AM,1.0,184459.0,vijan agencies,INR,"1,962,004",03-Jun-2021,"INR 1,962,004",90.0,Ravi Singh Rana,03-Jun-2021 09:42 AM,2020_41422.pdf (1169.00 KB),AWARDED TO L1,XEN ELECTRICAL,Internal,SUPDT DA HDM,Ravi Singh Rana,03-Jun-2021 09:41 AM,finsummary_61136.pdf (59.69 KB),XEN ELECTRICAL,Internal,SUPDT DA HDM,Ravi Singh Rana,03-Jun-2021 09:40 AM,techsummary_61136.pdf (59.69 KB),PWD,2020_PWD_41422_1,Electrical Div.No-1PWD Shimla 2020-21-3658-63dt.3,Providing Installation of suitable Heating System setup in Multipurpose Hall Old Gothic Hall and Conference Hall in Gaiety Theater Complex Shimla,Finance,Three number bid was found uploaded on e-procurement out of which only two made their physical submission of documents accordingly opened for financial part today on dated 30.10.2020 in which Ms Vijan agencies have been found the L-1.,Ravi Singh Rana,02-Nov-2020 03:47 PM,finance_61136.pdf,BOQ Comparative Chart,AOC,1.0,Fee/PreQual/Technical/Finance,.pdf,Cost of Tender in shape of DD,"35,000",No,fixed,,E.E.Electrical Division No-I Shimla-9,SHIMLA KASUMPTI -9,XEX Electrical division No. 1 Shimla-9,The Executive Engineer Electrical Division No-1 HPPWD Shimla-9,13-Oct-2020 06:00 PM,30-Oct-2020 11:30 AM,13-Oct-2020 06:30 PM,29-Oct-2020 05:30 PM,NA ,NA ,13-Oct-2020 06:30 PM,29-Oct-2020 05:30 PM,500.0,E.E.Electrical Division No-I Shimla-9,SHIMLA KASUMPTI -9,No,1.0,DD - Demand Draft,Providing Installation of suitable Heating System setup in Multipurpose Hall Old Gothic Hall and Conference Hall in Gaiety Theater Complex Shimla,Providing Installation of suitable Heating System setup in Multipurpose Hall Old Gothic Hall and Conference Hall in Gaiety Theater Complex Shimla,Please refer Tender documents. ,NA ,"18,31,390",Electrical Works,NA ,Tender,90.0,90.0,SHIMLA KASUMPTI -9,171009.0,NA ,NA ,NA ,SHIMLA KASUMPTI -9,No ,No,PWD,Electrical Div.No-1PWD Shimla 2020-21-3658-63dt.3,2020_PWD_41422_1,Yes,Open Tender,Item Rate,Works,1.0,No,No,Offline,No,No,No,AOC
2.0,184499.0,KHARBANDA ELECTRICALS,29-Oct-2020 01:28 PM,Not Admitted-Fee/PreQual/Technical/Finance,Not qualified for AOC,02-Nov-2020 03:49 PM,,,,,,,,,,,,,,,,,,,,,,,,,,,,,,,,,,,AOC,,,.pdf,EMD in shape of FDR,,,,,,,,,,,,,,,,,,,,,2.0,FDR - Fixed Deposit,,,,,,,,,,,,,,,,,,,,,,,,,,,,,,,,,AOC
3.0,184459.0,vijan agencies,28-Oct-2020 07:11 PM,Accepted-AOC,L1,03-Jun-2021 09:42 AM,,,,,,,,,,,,,,,,,,,,,,,,,,,,,,,,,,,AOC,,,.pdf,GST/PAN Registration,,,,,,,,,,,,,,,,,,,,,,,,,,,,,,,,,,,,,,,,,,,,,,,,,,,,,,,AOC
,,,,,,,,,,,,,,,,,,,,,,,,,,,,,,,,,,,,,,,,,AOC,,,.pdf,Valid electrical enlistment issued from competent authority,,,,,,,,,,,,,,,,,,,,,,,,,,,,,,,,,,,,,,,,,,,,,,,,,,,,,,,AOC
,,,,,,,,,,,,,,,,,,,,,,,,,,,,,,,,,,,,,,,,,AOC,,,.xls,SCHEDULE OF QUANTITY BOQ,,,,,,,,,,,,,,,,,,,,,,,,,,,,,,,,,,,,,,,,,,,,,,,,,,,,,,,AOC
,,,,,,,,,,,,,,,,,,,,,,,,,,,,,,,,,,,,,,,,,AOC,,,.pdf,Certificate of undertaking,,,,,,,,,,,,,,,,,,,,,,,,,,,,,,,,,,,,,,,,,,,,,,,,,,,,,,,AOC
,,,,,,,,,,,,,,,,,,,,,,,,,,,,,,,,,,,,,,,,,AOC,,,.pdf,STANDARD BIDDING DOCUMENT SBD Form-8,,,,,,,,,,,,,,,,,,,,,,,,,,,,,,,,,,,,,,,,,,,,,,,,,,,,,,,AOC
