S.No,Bid Number,Bidder Name,Awarded Currency,Awarded Value,Organisation Chain :,Tender ID :,Tender Ref No :,Tender Title :,Committee Chairperson/Co-ordinator Name :,Committee Chairperson/Co-ordinator Type :,Committee Members :,Updated By :,Updated on :,Document :,Type :,Summary :,Updated By :.1,Updated On :,Document :.1,BOQ Comparative Chart :,Type :.1,Summary :.1,Updated By :.2,Updated On :.1,Document :.2,Contract Date :,Contract Value :,Work Completion Period in days :,Updated By :.3,Updated on :.1,AOC document :,AOC Description :,Committee Chairperson/Co-ordinator Name :.1,Committee Chairperson/Co-ordinator Type :.1,Committee Members :.1,Updated By :.4,Updated On :.2,Financial Bid Opening Date:,Document :.3,S.No.1,Bid Number.1,Bidder Name.1,Submitted Date,Status,Remarks,Status Updated On,Tender Stage,S.No,Bank Name,Organisation Chain,Tender Reference Number,Tender ID,Withdrawal Allowed,Tender Type,Form of contract,Tender Category,No. of Covers,General Technical Evaluation Allowed,ItemWise Technical Evaluation Allowed,Payment Mode,Is Multi Currency Allowed For BOQ,Is Multi Currency Allowed For Fee,Allow Two Stage Bidding,Title,Work Description,Pre Qualification Details,Independent External Monitor/Remarks,Tender Value in ₹,Product Category,Sub category,Contract Type,Bid Validity(Days),Period Of Work(Days),Location,Pincode,Pre Bid Meeting Place,Pre Bid Meeting Address,Pre Bid Meeting Date,Bid Opening Place,Should Allow NDA Tender,Allow Preferential Bidder,EMD Amount in ₹,EMD Exemption Allowed,EMD Fee Type,EMD Percentage,EMD Payable To,EMD Payable At,Publish Date,Bid Opening Date,Document Download / Sale Start Date,Document Download / Sale End Date,Clarification Start Date,Clarification End Date,Bid Submission Start Date,Bid Submission End Date,Financial Bid Opening Date,Tender Fee in ₹,Fee Payable To,Fee Payable At,Tender Fee Exemption Allowed,Cover No,Cover,Document Type,Description,Name,Address,Tender Stage
1.0,202709.0,Bharat Singh Verma,INR,"6,144,036","HP Irrigation and Public Health||Shimla-9 Circle,Irrigation and Public Health,HP||Suni,Irrigation and Public Health,HP",2021_HPIPH_44984_1,SNN-SML-03-740/2021-6251-70 dt 2/03/2021,"Providing Household connection LWSS Pandoa Khad to Kail Bagri in G.P. Ogli,Dharogra,Himari Saraj Area in Tehsil Sunni Distt Shimla HP",SE,External,EEDEESUNIAEDCHDSUPDT,Dinesh Kumar Lohia,08-Jun-2021 11:01 AM,finsummary_67577.pdf (365.23 KB),Finance,Financial bids opened successfully,Dinesh Kumar Lohia,22-Apr-2021 01:25 PM,finance_67577.pdf,BOQ Comparative Chart,Technical,Cover-1 opened sucessfully,Dinesh Kumar Lohia,18-Mar-2021 05:08 PM,technical_67577.pdf,08-Jun-2021,"INR 9,326,204",365.0,Dinesh Kumar Lohia,08-Jun-2021 11:12 AM,award.pdf (440.00 KB),Tendered value,EE,Internal,SUPDTHDMDAO,Dinesh Kumar Lohia,18-Mar-2021 05:11 PM,18-Mar-2021 05:15 PM,techsummary_67577.pdf (542.36 KB),1.0,202709.0,Bharat Singh Verma,10-Mar-2021 03:32 PM,Accepted-AOC,Lowest bid,08-Jun-2021 11:12 AM,AOC,1.0,ICICI BANK,"HP Irrigation and Public Health||Shimla-9 Circle,Irrigation and Public Health,HP||Suni,Irrigation and Public Health,HP",SNN-SML-03-740/2021-6251-70 dt 2/03/2021,2021_HPIPH_44984_1,Yes,Open Tender,Item Rate,Works,2.0,No,No,Online,No,No,No,"Providing Household connection LWSS Pandoa Khad to Kail Bagri in G.P. Ogli,Dharogra,Himari Saraj Area in Tehsil Sunni Distt Shimla HP","L-J of GI pipe 15 , 20, 32,40,50 and 65 mm dia at various nodes under JJM",Please refer Tender documents. ,NA ,"93,26,204",Civil Works - Lift Irrigation Schemes,NA ,Tender,120.0,365.0,Suni,171301.0,NA ,NA ,NA ,Suni,No ,No,"1,25,800",Yes,fixed,,Nil,Nil,02-Mar-2021 05:00 PM,15-Mar-2021 11:30 AM,02-Mar-2021 05:00 PM,15-Mar-2021 11:00 AM,02-Mar-2021 05:00 PM ,15-Mar-2021 11:00 AM ,02-Mar-2021 05:00 PM,15-Mar-2021 11:00 AM,18-Mar-2021 05:15 PM,800.0,Nil,Nil,No,1.0,Fee/PreQual/Technical,.pdf,Earnest money as per NIT,Executive Engineer,Jal Shakti Division Suni,AOC
,,,,,,,,,,,,,,,,,,,,,,,,,,,,,,,,,,,,,,,,2.0,202235.0,Neeraj Gupta,08-Mar-2021 03:16 PM,Rejected-AOC,Higher bid,08-Jun-2021 11:12 AM,AOC,2.0,ICICI NEFT/RTGS,,,,,,,,,,,,,,,,,,,,,,,,,,,,,,,,,,,,,,,,,,,,,,,,,,,,,,.pdf,Cost of tender form as per NIT,,,AOC
,,,,,,,,,,,,,,,,,,,,,,,,,,,,,,,,,,,,,,,,3.0,202262.0,Rohit Sharma,08-Mar-2021 02:18 PM,Rejected-AOC,Higher bid,08-Jun-2021 11:12 AM,AOC,,,,,,,,,,,,,,,,,,,,,,,,,,,,,,,,,,,,,,,,,,,,,,,,,,,,,,,,.pdf,Certificate of registration with Jal Shakti Department in appropriate class and latest renewal,,,AOC
,,,,,,,,,,,,,,,,,,,,,,,,,,,,,,,,,,,,,,,,,,,,,,,AOC,,,,,,,,,,,,,,,,,,,,,,,,,,,,,,,,,,,,,,,,,,,,,,,,,,,,,,,,.pdf,Copy of PAN,,,AOC
,,,,,,,,,,,,,,,,,,,,,,,,,,,,,,,,,,,,,,,,,,,,,,,AOC,,,,,,,,,,,,,,,,,,,,,,,,,,,,,,,,,,,,,,,,,,,,,,,,,,,,,,,,.pdf,Copy of GSTIN,,,AOC
,,,,,,,,,,,,,,,,,,,,,,,,,,,,,,,,,,,,,,,,,,,,,,,AOC,,,,,,,,,,,,,,,,,,,,,,,,,,,,,,,,,,,,,,,,,,,,,,,,,,,,,,,,.pdf,Copy of EPF certificate,,,AOC
,,,,,,,,,,,,,,,,,,,,,,,,,,,,,,,,,,,,,,,,,,,,,,,AOC,,,,,,,,,,,,,,,,,,,,,,,,,,,,,,,,,,,,,,,,,,,,,,,,,,,,,,,,.pdf,Copy of registration under ESI,,,AOC
,,,,,,,,,,,,,,,,,,,,,,,,,,,,,,,,,,,,,,,,,,,,,,,AOC,,,,,,,,,,,,,,,,,,,,,,,,,,,,,,,,,,,,,,,,,,,,,,,,,,,,,,,,.pdf,Copy of latest Income Tax clearance,,,AOC
,,,,,,,,,,,,,,,,,,,,,,,,,,,,,,,,,,,,,,,,,,,,,,,AOC,,,,,,,,,,,,,,,,,,,,,,,,,,,,,,,,,,,,,,,,,,,,,,,,,,,,,,2.0,Finance,.xls,BOQ,,,AOC
