S.No,Bid Number,Bidder Name,Awarded Currency,Awarded Value,Organisation Chain :,Tender ID :,Tender Ref No :,Tender Title :,Committee Chairperson/Co-ordinator Name :,Committee Chairperson/Co-ordinator Type :,Committee Members :,Updated By :,Updated on :,Document :,S.No.1,Bid Number.1,Bidder Name.1,Submitted Date,Status,Remarks,Status Updated On,Committee Chairperson/Co-ordinator Name :.1,Committee Chairperson/Co-ordinator Type :.1,Committee Members :.1,Updated By :.1,Updated On :,Financial Bid Opening Date:,Document :.1,Contract Date :,Contract Value :,Work Completion Period in days :,Updated By :.2,Updated on :.1,AOC document :,AOC Description :,Type :,Summary :,Updated By :.3,Updated On :.1,Document :.2,Type :.1,Summary :.1,Updated By :.4,Updated On :.2,Document :.3,BOQ Comparative Chart :,Tender Stage,Cover No,Cover,Document Type,Description,Tender Fee in ₹,Fee Payable To,Fee Payable At,Tender Fee Exemption Allowed,EMD Amount in ₹,EMD Exemption Allowed,EMD Fee Type,EMD Percentage,EMD Payable To,EMD Payable At,Publish Date,Bid Opening Date,Document Download / Sale Start Date,Document Download / Sale End Date,Clarification Start Date,Clarification End Date,Bid Submission Start Date,Bid Submission End Date,Financial Bid Opening Date,Organisation Chain,Tender Reference Number,Tender ID,Withdrawal Allowed,Tender Type,Form of contract,Tender Category,No. of Covers,General Technical Evaluation Allowed,ItemWise Technical Evaluation Allowed,Payment Mode,Is Multi Currency Allowed For BOQ,Is Multi Currency Allowed For Fee,Allow Two Stage Bidding,Title,Work Description,Pre Qualification Details,Independent External Monitor/Remarks,Tender Value in ₹,Product Category,Sub category,Contract Type,Bid Validity(Days),Period Of Work(Days),Location,Pincode,Pre Bid Meeting Place,Pre Bid Meeting Address,Pre Bid Meeting Date,Bid Opening Place,Should Allow NDA Tender,Allow Preferential Bidder,Name,Address,S.No,Bank Name,Tender Stage
1.0,177512.0,Lalit Singh,INR,"196,662","HP Irrigation and Public Health||Bilaspur Circle,Irrigation and Public Health,HP||Ghumarwin,Irrigation and Public Health,HP",2020_HPIPH_40541_1,GMR-BLP02(5595-5645),Retrofitting of LWSS Bharari Ladhyani in Ghumarwin constituency to provide functional household tap connection FHTC to leftout households under Jal Jeevan Mission Har Ghar Nal Se Jal,ER SATISH KUMAR SHARMA,Internal,DAO HDM SUPDGRII,Satish Kumar,07-Dec-2020 04:13 PM,finsummary_59815.pdf (266.97 KB),1.0,178035.0,A K Infratech,17-Sep-2020 03:30 PM,Rejected-Finance,Rejected being L4,07-Dec-2020 04:16 PM,Er Satish Kumar Sharma,Internal,Supdt DAO HDM,Satish Kumar,30-Sep-2020 02:24 PM,30-Sep-2020 02:30 PM,techsummary_59815.pdf (266.97 KB),07-Dec-2020,"INR 766,593",180.0,Satish Kumar,07-Dec-2020 04:22 PM,766593AOC.pdf (1004.00 KB),WORK AWARDED TO LALIT SINGH VILLAGE THADOH PO BHATWARA,Technical,Summary,Satish Kumar,30-Sep-2020 02:18 PM,technical_59815.pdf,Finance,Summary,Satish Kumar,30-Sep-2020 03:00 PM,finance_59815.pdf,BOQ Comparative Chart,AOC,1.0,Fee/PreQual/Technical,.pdf,Earnest money,250.0,EE JSD Ghumarwin,EE JSD Ghumarwin,Yes,"15,400",Yes,fixed,,EE JSD Ghumarwin,EE JSD Ghumarwin,10-Sep-2020 05:00 PM,18-Sep-2020 11:30 AM,10-Sep-2020 05:00 PM,17-Sep-2020 05:00 PM,10-Sep-2020 05:00 PM ,17-Sep-2020 05:00 PM ,10-Sep-2020 05:00 PM,17-Sep-2020 05:00 PM,30-Sep-2020 02:30 PM,"HP Irrigation and Public Health||Bilaspur Circle,Irrigation and Public Health,HP||Ghumarwin,Irrigation and Public Health,HP",GMR-BLP02(5595-5645),2020_HPIPH_40541_1,Yes,Open Tender,Item Rate,Works,2.0,No,No,Both(Online/Offline),No,No,No,Retrofitting of LWSS Bharari Ladhyani in Ghumarwin constituency to provide functional household tap connection FHTC to leftout households under Jal Jeevan Mission Har Ghar Nal Se Jal,SH Laying jointing in trenches and testing of GI pipe line of various diameters in distribution system Job NO III,Please refer Tender documents. ,NA ,"7,66,593",Civil Works,NA ,Tender,120.0,180.0,Bharari,174027.0,NA ,NA ,NA ,EE JSD Ghumarwin,No ,No,EE JSD Ghumarwin,EE JSD Ghumarwin,1.0,ICICI BANK,AOC
,,,,,,,,,,,,,,,2.0,178146.0,HARISH KUMAR,17-Sep-2020 03:53 PM,Rejected-Finance,Rejected being L5,07-Dec-2020 04:16 PM,,,,,,,,,,,,,,,,,,,,,,,,,,AOC,,,.pdf,Cost of tender form,,,,,,,,,,,,,,,,,,,,,,,,,,,,,,,,,,,,,,,,,,,,,,,,,,,,,,2.0,ICICI NEFT/RTGS,AOC
,,,,,,,,,,,,,,,3.0,177512.0,Lalit Singh,17-Sep-2020 03:30 PM,Accepted-AOC,WORK AWARDED BEING L1,07-Dec-2020 04:25 PM,,,,,,,,,,,,,,,,,,,,,,,,,,AOC,,,.pdf,Registration with Jal Shakti Vibhag,,,,,,,,,,,,,,,,,,,,,,,,,,,,,,,,,,,,,,,,,,,,,,,,,,,,,,,,AOC
,,,,,,,,,,,,,,,4.0,177951.0,RAMESH KUMAR,16-Sep-2020 03:40 PM,Rejected-Finance,Rejected being L2,07-Dec-2020 04:16 PM,,,,,,,,,,,,,,,,,,,,,,,,,,AOC,,,.pdf,ITR GST EPF PAN Number,,,,,,,,,,,,,,,,,,,,,,,,,,,,,,,,,,,,,,,,,,,,,,,,,,,,,,,,AOC
,,,,,,,,,,,,,,,5.0,177988.0,RAM LAL,17-Sep-2020 03:39 PM,Rejected-Finance,Rejected being L3,07-Dec-2020 04:16 PM,,,,,,,,,,,,,,,,,,,,,,,,,,AOC,,,.pdf,Undertaking,,,,,,,,,,,,,,,,,,,,,,,,,,,,,,,,,,,,,,,,,,,,,,,,,,,,,,,,AOC
,,,,,,,,,,,,,,,,,,,,,,,,,,,,,,,,,,,,,,,,,,,,,,,AOC,2.0,Finance,.xls,BOQ,,,,,,,,,,,,,,,,,,,,,,,,,,,,,,,,,,,,,,,,,,,,,,,,,,,,,,,,AOC
