Type :,Summary :,Updated By :,Updated On :,Document :,BOQ Comparative Chart :,Committee Chairperson/Co-ordinator Name :,Committee Chairperson/Co-ordinator Type :,Committee Members :,Updated By :.1,Updated on :,Document :.1,Contract Date :,Contract Value :,Work Completion Period in days :,Updated By :.2,Updated on :.1,AOC document :,S.No,Bid Number,Bidder Name,Submitted Date,Status,Remarks,Status Updated On,S.No.1,Bid Number.1,Bidder Name.1,Awarded Currency,Awarded Value,Committee Chairperson/Co-ordinator Name :.1,Committee Chairperson/Co-ordinator Type :.1,Committee Members :.1,Updated By :.3,Updated On :.1,Financial Bid Opening Date:,Document :.2,Organisation Chain :,Tender ID :,Tender Ref No :,Tender Title :,Type :.1,Summary :.1,Updated By :.4,Updated On :.2,Document :.3,Tender Stage,EMD Amount in ₹,EMD Exemption Allowed,EMD Fee Type,EMD Percentage,EMD Payable To,EMD Payable At,Cover No,Cover,Document Type,Description,Publish Date,Bid Opening Date,Document Download / Sale Start Date,Document Download / Sale End Date,Clarification Start Date,Clarification End Date,Bid Submission Start Date,Bid Submission End Date,Financial Bid Opening Date,Title,Work Description,Pre Qualification Details,Independent External Monitor/Remarks,Tender Value in ₹,Product Category,Sub category,Contract Type,Bid Validity(Days),Period Of Work(Days),Location,Pincode,Pre Bid Meeting Place,Pre Bid Meeting Address,Pre Bid Meeting Date,Bid Opening Place,Should Allow NDA Tender,Allow Preferential Bidder,S.No,Instrument Type,Organisation Chain,Tender Reference Number,Tender ID,Withdrawal Allowed,Tender Type,Form of contract,Tender Category,No. of Covers,General Technical Evaluation Allowed,ItemWise Technical Evaluation Allowed,Payment Mode,Is Multi Currency Allowed For BOQ,Is Multi Currency Allowed For Fee,Allow Two Stage Bidding,Name,Address,Tender Fee in ₹,Fee Payable To,Fee Payable At,Tender Fee Exemption Allowed,Tender Stage
Finance,"Financial bid has open in the presence of EO, President AE and JE MC Hamriprur",Sanjay Kumar,18-Nov-2020 05:36 PM,None,BOQ Comparative Chart,SALOCHNA DEVI,Internal,"EO, President AE and JE MC Hamirpur",Sanjay Kumar,18-Nov-2020 05:41 PM,finsummary_62278.pdf (336.43 KB),07-Dec-2020,"INR 1,201,636",90.0,Kishori Lal thakur,11-Dec-2020 04:57 PM,AWARD.pdf (1428.00 KB),1.0,186222.0,AJAY SINGH GOVT. CONTRQACTOR,13-Nov-2020 11:26 AM,Accepted-AOC,accepted,11-Dec-2020 05:00 PM,1.0,186222.0,AJAY SINGH GOVT. CONTRQACTOR,INR,"1,201,636",SALOCHNA DEVI,Internal,"EO, PRESIDENT AND JE MC HAMIRPUR",Kishori Lal thakur,17-Nov-2020 04:19 PM,17-Nov-2020 04:25 PM,techsummary_62278.pdf (339.90 KB),Directorate of Urban Development||Urban Development - UDDHP||Municipal Council Hamirpur - UDDHP,2020_UDDHP_42138_12,No MCH-Tender-Est/Awd/-..2877. Dated 02 /11/ 202,Restoration of path and drain from Thakur Nursing Home in Ward no.8 towards ward no 10 Phase-2,Technical,Technical Bid open,Kishori Lal thakur,17-Nov-2020 04:16 PM,None,AOC,"21,060",No,fixed,,Executive Officer Municipal Council Hamirpur,Hamirpur,1.0,Fee/PreQual/Technical,.pdf,Tender Cost,04-Nov-2020 10:00 AM,17-Nov-2020 02:00 PM,04-Nov-2020 10:00 AM,13-Nov-2020 01:00 PM,NA ,NA ,04-Nov-2020 11:00 AM,13-Nov-2020 01:00 PM,17-Nov-2020 04:25 PM,Restoration of path and drain from Thakur Nursing Home in Ward no.8 towards ward no 10 Phase-2,Restoration of path and drain from Thakur Nursing Home in Ward no.8 towards ward no 10 Phase-2,Please refer Tender documents. ,NA ,"8,42,093",Civil Works,NA ,Tender,30.0,90.0,Municipal Council Hamirpur,177001.0,NA ,NA ,NA ,Executive Officer Municipal Council Hamirpur,No ,No,1.0,DD - Demand Draft,Directorate of Urban Development||Urban Development - UDDHP||Municipal Council Hamirpur - UDDHP,No MCH-Tender-Est/Awd/-..2877. Dated 02 /11/ 202,2020_UDDHP_42138_12,Yes,Open Tender,Item Rate,Works,2.0,No,No,Offline,No,No,No,Executive Officer Municipal Council Hamirpur,Executive Officer Municipal Council Hamirpur,500.0,Executive Officer Municipal Council Hamirpur,Hamirpur,No,AOC
,,,,,,,,,,,,,,,,,,2.0,186309.0,Anil Chandel,12-Nov-2020 04:56 PM,Rejected-AOC,rejected,11-Dec-2020 05:00 PM,,,,,,,,,,,,,,,,,,,,,,AOC,,,,,,,,,.pdf,Earnest Money,,,,,,,,,,,,,,,,,,,,,,,,,,,,2.0,FDR - Fixed Deposit,,,,,,,,,,,,,,,,,,,,,AOC
,,,,,,,,,,,,,,,,,,3.0,185341.0,Karan Sharma,05-Nov-2020 11:05 PM,Not Admitted-Fee/PreQual/Technical,Not Complied with technical specification,17-Nov-2020 04:19 PM,,,,,,,,,,,,,,,,,,,,,,AOC,,,,,,,,,.pdf,"Registration/ Enlistment HPPWD, CPWD or UD Department of HP",,,,,,,,,,,,,,,,,,,,,,,,,,,,,,,,,,,,,,,,,,,,,,,,,,AOC
,,,,,,,,,,,,,,,,,,4.0,186511.0,SHIVEN GUPTA,13-Nov-2020 12:20 PM,Not Admitted-Fee/PreQual/Technical,Not Complied with technical specification,17-Nov-2020 04:19 PM,,,,,,,,,,,,,,,,,,,,,,AOC,,,,,,,,,.pdf,PAN,,,,,,,,,,,,,,,,,,,,,,,,,,,,,,,,,,,,,,,,,,,,,,,,,,AOC
,,,,,,,,,,,,,,,,,,5.0,186335.0,Surjeet Kumar,12-Nov-2020 05:20 PM,Rejected-AOC,rejected,11-Dec-2020 05:00 PM,,,,,,,,,,,,,,,,,,,,,,AOC,,,,,,,,,.pdf,Income tax clearance certificate (ITR),,,,,,,,,,,,,,,,,,,,,,,,,,,,,,,,,,,,,,,,,,,,,,,,,,AOC
,,,,,,,,,,,,,,,,,,,,,,,,,,,,,,,,,,,,,,,,,,,,,,AOC,,,,,,,,,.pdf,Registration of EPF and Latest Return,,,,,,,,,,,,,,,,,,,,,,,,,,,,,,,,,,,,,,,,,,,,,,,,,,AOC
,,,,,,,,,,,,,,,,,,,,,,,,,,,,,,,,,,,,,,,,,,,,,,AOC,,,,,,,,,.pdf,Copy Of GST Number and latest Return,,,,,,,,,,,,,,,,,,,,,,,,,,,,,,,,,,,,,,,,,,,,,,,,,,AOC
,,,,,,,,,,,,,,,,,,,,,,,,,,,,,,,,,,,,,,,,,,,,,,AOC,,,,,,,,,.pdf,Experience and work done certificate at least one similar work,,,,,,,,,,,,,,,,,,,,,,,,,,,,,,,,,,,,,,,,,,,,,,,,,,AOC
,,,,,,,,,,,,,,,,,,,,,,,,,,,,,,,,,,,,,,,,,,,,,,AOC,,,,,,,2.0,Finance,.xls,BOQ,,,,,,,,,,,,,,,,,,,,,,,,,,,,,,,,,,,,,,,,,,,,,,,,,,AOC
