Organisation Chain,Tender Reference Number,Tender ID,Withdrawal Allowed,Tender Type,Form of contract,Tender Category,No. of Covers,General Technical Evaluation Allowed,ItemWise Technical Evaluation Allowed,Payment Mode,Is Multi Currency Allowed For BOQ,Is Multi Currency Allowed For Fee,Allow Two Stage Bidding,Cover No,Cover,Document Type,Description,Publish Date,Bid Opening Date,Document Download / Sale Start Date,Document Download / Sale End Date,Clarification Start Date,Clarification End Date,Bid Submission Start Date,Bid Submission End Date,Financial Bid Opening Date,EMD Amount in ₹,EMD Exemption Allowed,EMD Fee Type,EMD Percentage,EMD Payable To,EMD Payable At,S.No,Corrigendum Title,Corrigendum Type,View,S.No.1,Bank Name,Tender Fee in ₹,Fee Payable To,Fee Payable At,Tender Fee Exemption Allowed,Name,Address,Title,Work Description,Pre Qualification Details,Independent External Monitor/Remarks,Tender Value in ₹,Product Category,Sub category,Contract Type,Bid Validity(Days),Period Of Work(Days),Location,Pincode,Pre Bid Meeting Place,Pre Bid Meeting Address,Pre Bid Meeting Date,Bid Opening Place,Should Allow NDA Tender,Allow Preferential Bidder,Tender Stage
"HP Irrigation and Public Health||Dharamshala Circle,Irrigation and Public Health,HP||Palampur,Irrigation and Public Health,HP",HPIPH 17476-17520 DATED 21.03.2023,2023_HPIPH_71366_1,Yes,Open Tender,Item Rate,Works,2.0,No,No,Both(Online/Offline),No,No,No,1.0,Fee/PreQual/Technical,.pdf,Scan copy of deduction of Earnest money and cost of tender through offline and online are admissible,21-Mar-2023 06:55 PM,04-Apr-2023 11:30 AM,21-Mar-2023 06:55 PM,03-Apr-2023 05:00 PM,,,21-Mar-2023 06:55 PM,03-Apr-2023 05:00 PM,12-Apr-2023 02:00 PM,"12,030",Yes,fixed,,EXECUTIVE ENGINEER,JSD PALAMPUR,1.0,Corrigendum,Date,,1.0,ICICI BANK,250.0,EXECUTIVE ENGINEER,JSD PALAMPUR,No,EXECUTIVE ENGINEER,JAL SHAKTI DIVISION PALAMPUR,"Drilling, lowering and energisation of 25 Nos hand pumps in Palampur constituency under Jal Shakti Division, Palampur District Kangra H P",Drilling and lowering of 3 Nos bore well at various locations,Please refer Tender documents.,,"6,01,278",Water Equipments/ Meter/ Drilling/ Boring,,Tender,120.0,90.0,PALAMPUR,176061.0,,,,JSD PALAMPUR,No,No,AOC
,,,,,,,,,,,,,,,,.pdf,Certificate of registration with JSV Department in appropriate class and latest renewal thereof,,,,,,,,,,,,,,,,,,,,2.0,ICICI NEFT/RTGS,,,,,,,,,,,,,,,,,,,,,,,,,AOC
,,,,,,,,,,,,,,,,.pdf,"Income tax and GST, EPF registration",,,,,,,,,,,,,,,,,,,,,,,,,,,,,,,,,,,,,,,,,,,,,,AOC
,,,,,,,,,,,,,,,,.pdf,The authorization letter regarding digital certificate (DSC) of the person authorized,,,,,,,,,,,,,,,,,,,,,,,,,,,,,,,,,,,,,,,,,,,,,,AOC
,,,,,,,,,,,,,,,,.pdf,Affidavit if used exemption not more than its limit,,,,,,,,,,,,,,,,,,,,,,,,,,,,,,,,,,,,,,,,,,,,,,AOC
,,,,,,,,,,,,,,,,.pdf,Copy of registration with ground water authority of H.P,,,,,,,,,,,,,,,,,,,,,,,,,,,,,,,,,,,,,,,,,,,,,,AOC
,,,,,,,,,,,,,,2.0,Finance,.xls,BOQ,,,,,,,,,,,,,,,,,,,,,,,,,,,,,,,,,,,,,,,,,,,,,,AOC
,,,,,,,,,,,,,,,,.pdf,Form 6 dully signed,,,,,,,,,,,,,,,,,,,,,,,,,,,,,,,,,,,,,,,,,,,,,,AOC
