Type :,Summary :,Updated By :,Updated On :,Document :,S.No,Bid Number,Bidder Name,Submitted Date,Status,Remarks,Status Updated On,Committee Chairperson/Co-ordinator Name :,Committee Chairperson/Co-ordinator Type :,Committee Members :,Updated By :.1,Updated on :,Document :.1,Contract Date :,Contract Value :,Work Completion Period in days :,Updated By :.2,Updated on :.1,AOC document :,AOC Description :,Type :.1,Summary :.1,Updated By :.3,Updated On :.1,Document :.2,BOQ Comparative Chart :,Committee Chairperson/Co-ordinator Name :.1,Committee Chairperson/Co-ordinator Type :.1,Committee Members :.1,Updated By :.4,Updated On :.2,Financial Bid Opening Date:,Document :.3,Organisation Chain :,Tender ID :,Tender Ref No :,Tender Title :,S.No.1,Bid Number.1,Bidder Name.1,Awarded Currency,Awarded Value,Tender Stage,Tender Fee in ₹,Fee Payable To,Fee Payable At,Tender Fee Exemption Allowed,S.No,Instrument Type,EMD Amount in ₹,EMD Exemption Allowed,EMD Fee Type,EMD Percentage,EMD Payable To,EMD Payable At,Title,Work Description,Pre Qualification Details,Independent External Monitor/Remarks,Tender Value in ₹,Product Category,Sub category,Contract Type,Bid Validity(Days),Period Of Work(Days),Location,Pincode,Pre Bid Meeting Place,Pre Bid Meeting Address,Pre Bid Meeting Date,Bid Opening Place,Should Allow NDA Tender,Allow Preferential Bidder,Publish Date,Bid Opening Date,Document Download / Sale Start Date,Document Download / Sale End Date,Clarification Start Date,Clarification End Date,Bid Submission Start Date,Bid Submission End Date,Financial Bid Opening Date,Cover No,Cover,Document Type,Description,Name,Address,Organisation Chain,Tender Reference Number,Tender ID,Withdrawal Allowed,Tender Type,Form of contract,Tender Category,No. of Covers,General Technical Evaluation Allowed,ItemWise Technical Evaluation Allowed,Payment Mode,Is Multi Currency Allowed For BOQ,Is Multi Currency Allowed For Fee,Allow Two Stage Bidding,Tender Stage
Technical,summary,RAJEEV KUMAR,16-Jan-2019 01:42 PM,technical_36068.pdf,1.0,107750.0,Anil Kumar,15-Jan-2019 05:05 PM,Rejected-Finance,Being L2,28-Jan-2019 06:24 PM,Sh. Rajeev Kumar,Internal,R.O. Joginder Nagar Supdt,RAJEEV KUMAR,28-Jan-2019 06:24 PM,finsummary_36068.pdf (514.16 KB),02-Dec-2019,"INR 1,150,000",240.0,DEVENDER SINGH,02-Dec-2019 04:22 PM,AOC-25743.pdf (552.00 KB),AOC,Finance,fbosummary,RAJEEV KUMAR,18-Jan-2019 02:20 PM,finance_36068.pdf,BOQ Comparative Chart,Sh. Rajeev Kumar,Internal,RO Joginder Nagar Supdt. Jogidner Nagar,RAJEEV KUMAR,17-Jan-2019 01:57 PM,18-Jan-2019 11:00 AM,techsummary_36068.pdf (358.68 KB),Himachal Pradesh Forest Department||Mandi - HPFD||J/Nagar Division - HPFD,2019_FD_25743_1,DFO JNR- 6411 dated 31.12.2018,Construction of Block Officer Quarter Pandol in Lad Bharol Range of Joginder Nagar Forest Division Tehsil Lad Bharol Distt. Mandi (H.P.),1.0,107760.0,RAKESH SHARMA,INR,"1,150,000",AOC,500.0,DFO Joginder Nagar,Joginder Nagar,No,1.0,DD - Demand Draft,"27,000",No,fixed,,DFO Joginder Nagar,Joginder Nagar,Construction of Block Officer Quarter Pandol in Lad Bharol Range of Joginder Nagar Forest Division Tehsil Lad Bharol Distt. Mandi (H.P.),Building work,as per SBD-TOR ,NA ,"11,74,706",Civil Works - Buildings,NA ,Tender,120.0,240.0,Joginder Nagar,175015.0,NA ,NA ,NA ,Joginder Nagar,No ,No,05-Jan-2019 11:00 AM,16-Jan-2019 11:30 AM,05-Jan-2019 11:00 AM,16-Jan-2019 10:00 AM,NA ,NA ,05-Jan-2019 11:00 AM,16-Jan-2019 10:00 AM,18-Jan-2019 11:00 AM,1.0,Fee/PreQual/Technical,.pdf,Cost of tender Form in shape of Demand Drafts,DFO Joginder Nagar,DFO Joginder Nagar,Himachal Pradesh Forest Department||Mandi - HPFD||J/Nagar Division - HPFD,DFO JNR- 6411 dated 31.12.2018,2019_FD_25743_1,Yes,Open Tender,Item Rate,Works,2.0,No,No,Offline,No,No,No,AOC
,,,,,2.0,107760.0,RAKESH SHARMA,15-Jan-2019 05:49 PM,Accepted-AOC,AOC,02-Dec-2019 04:22 PM,,,,,,,,,,,,,,,,,,,,,,,,,,,,,,,,,,,,AOC,,,,,2.0,FDR - Fixed Deposit,,,,,,,,,,,,,,,,,,,,,,,,,,,,,,,,,,,,.pdf,Earnest money in shape of FDR,,,,,,,,,,,,,,,,,AOC
,,,,,,,,,,,,,,,,,,,,,,,,,,,,,,,,,,,,,,,,,,,,,,,AOC,,,,,,,,,,,,,,,,,,,,,,,,,,,,,,,,,,,,,,,,,,.pdf,Contractors Registration HPPWD (eligible of Class D and C),,,,,,,,,,,,,,,,,AOC
,,,,,,,,,,,,,,,,,,,,,,,,,,,,,,,,,,,,,,,,,,,,,,,AOC,,,,,,,,,,,,,,,,,,,,,,,,,,,,,,,,,,,,,,,,,,.pdf,GST,,,,,,,,,,,,,,,,,AOC
,,,,,,,,,,,,,,,,,,,,,,,,,,,,,,,,,,,,,,,,,,,,,,,AOC,,,,,,,,,,,,,,,,,,,,,,,,,,,,,,,,,,,,,,,,,,.pdf,Work done in civil work,,,,,,,,,,,,,,,,,AOC
,,,,,,,,,,,,,,,,,,,,,,,,,,,,,,,,,,,,,,,,,,,,,,,AOC,,,,,,,,,,,,,,,,,,,,,,,,,,,,,,,,,,,,,,,,,,.pdf,SBD/Terms and conditions duly signed by the contractor on judiciary paper,,,,,,,,,,,,,,,,,AOC
,,,,,,,,,,,,,,,,,,,,,,,,,,,,,,,,,,,,,,,,,,,,,,,AOC,,,,,,,,,,,,,,,,,,,,,,,,,,,,,,,,,,,,,,,,,,.pdf,Permanent Account Number (PAN) and Affidavit regarding information furnished is correct,,,,,,,,,,,,,,,,,AOC
,,,,,,,,,,,,,,,,,,,,,,,,,,,,,,,,,,,,,,,,,,,,,,,AOC,,,,,,,,,,,,,,,,,,,,,,,,,,,,,,,,,,,,,,,,2.0,Finance,.xls,BOQ,,,,,,,,,,,,,,,,,AOC
