S.No,Bid Number,Bidder Name,Awarded Currency,Awarded Value,Organisation Chain :,Tender ID :,Tender Ref No :,Tender Title :,Committee Chairperson/Co-ordinator Name :,Committee Chairperson/Co-ordinator Type :,Committee Members :,Updated By :,Updated on :,Document :,S.No.1,Bid Number.1,Bidder Name.1,Submitted Date,Status,Remarks,Status Updated On,Committee Chairperson/Co-ordinator Name :.1,Committee Chairperson/Co-ordinator Type :.1,Committee Members :.1,Updated By :.1,Updated On :,Financial Bid Opening Date:,Document :.1,Type :,Summary :,Updated By :.2,Updated On :.1,Document :.2,Type :.1,Summary :.1,Updated By :.3,Updated On :.2,Document :.3,BOQ Comparative Chart :,Contract Date :,Contract Value :,Work Completion Period in days :,Updated By :.4,Updated on :.1,AOC document :,AOC Description :,Tender Stage,Title,Work Description,Pre Qualification Details,Independent External Monitor/Remarks,Tender Value in ₹,Product Category,Sub category,Contract Type,Bid Validity(Days),Period Of Work(Days),Location,Pincode,Pre Bid Meeting Place,Pre Bid Meeting Address,Pre Bid Meeting Date,Bid Opening Place,Should Allow NDA Tender,Allow Preferential Bidder,Organisation Chain,Tender Reference Number,Tender ID,Withdrawal Allowed,Tender Type,Form of contract,Tender Category,No. of Covers,General Technical Evaluation Allowed,ItemWise Technical Evaluation Allowed,Payment Mode,Is Multi Currency Allowed For BOQ,Is Multi Currency Allowed For Fee,Allow Two Stage Bidding,Publish Date,Bid Opening Date,Document Download / Sale Start Date,Document Download / Sale End Date,Clarification Start Date,Clarification End Date,Bid Submission Start Date,Bid Submission End Date,Financial Bid Opening Date,Name,Address,Cover No,Cover,Document Type,Description,EMD Amount in ₹,EMD Exemption Allowed,EMD Fee Type,EMD Percentage,EMD Payable To,EMD Payable At,Tender Fee in ₹,Fee Payable To,Fee Payable At,Tender Fee Exemption Allowed,S.No,Bank Name,Tender Stage
1.0,117376.0,Dalip Singh,INR,"1,582,065","HP Irrigation and Public Health||Nahan Circle,Irrigation and Public Health,HP||Nahan,Irrigation and Public Health,HP",2019_HPIPH_27942_1,No- 15645-15710 dated 21-02-2019,Augmentation of GWSS Tarapur Dukki in GP Surla in Tehsil Nahan Distt Sirmour HP,Er. JS Chouhan,Internal,SE EED EE AED CHD Supdt WA,Mandeep Gupta,09-Aug-2019 05:18 PM,finsummary_39959.pdf (1284.62 KB),1.0,117376.0,Dalip Singh,06-Mar-2019 04:25 PM,Accepted-AOC,AOC,09-Aug-2019 05:22 PM,Er. Mandeep Gupta EE,Internal,Supdt. HDM DAO TA,Mandeep Gupta,13-Mar-2019 04:15 PM,13-Mar-2019 04:20 PM,techsummary_39959.pdf (178.87 KB),Technical,Technical Bid Opening Summary,Mandeep Gupta,13-Mar-2019 03:45 PM,technical_39959.pdf,Finance,Financial Bid Opening Summary,Mandeep Gupta,13-Mar-2019 06:57 PM,finance_39959.pdf,BOQ Comparative Chart,15-Aug-2019,"INR 1,652,705",90.0,Mandeep Gupta,09-Aug-2019 05:22 PM,AOC.pdf (1285.00 KB),Award to Contractor,AOC,Augmentation of GWSS Tarapur Dukki in GP Surla in Tehsil Nahan Distt Sirmour HP,SH- C-O intake chamber 2 Nos Main S-tank 17000 ltrs cap RCC sector S-tank 10000 ltrs cap RCC Sector S-tank 5000 ltrs RCC main Storage tank 10000 ltrs cap Dismantled GI pipe RCC piller to protect the pipe for Nallah crossing and source of selling RD 0,Please refer Tender documents. ,NA ,"16,52,705",Pipe Laying Works,NA ,Tender,120.0,90.0,Nahan,173001.0,NA ,NA ,NA ,Executive Engineer IPH Division Nahan,No ,No,"HP Irrigation and Public Health||Nahan Circle,Irrigation and Public Health,HP||Nahan,Irrigation and Public Health,HP",No- 15645-15710 dated 21-02-2019,2019_HPIPH_27942_1,Yes,Open Tender,Item Rate,Works,2.0,No,No,Both(Online/Offline),No,No,No,28-Feb-2019 09:00 AM,07-Mar-2019 11:30 AM,28-Feb-2019 09:00 AM,07-Mar-2019 11:00 AM,NA ,NA ,28-Feb-2019 09:00 AM,07-Mar-2019 11:00 AM,13-Mar-2019 04:20 PM,Executive Engineer,Executive Engineer IPH Division Nahan,1.0,Fee/PreQual/Technical,.pdf,Earnest Money as per mentioned in NIT,"23,000",Yes,fixed,,EE IPH Division Nahan,Nahan,400.0,EE IPH Division Nahan,Nahan,No,1.0,ICICI BANK,AOC
,,,,,,,,,,,,,,,2.0,117163.0,desh raj,05-Mar-2019 01:55 PM,Rejected-Finance,Rejected,09-Aug-2019 05:18 PM,,,,,,,,,,,,,,,,,,,,,,,,,,AOC,,,,,,,,,,,,,,,,,,,,,,,,,,,,,,,,,,,,,,,,,,,,,,.pdf,Cost of bid as per mentioned in NIT,,,,,,,,,,,2.0,ICICI NEFT/RTGS,AOC
,,,,,,,,,,,,,,,3.0,117425.0,Dhanvir Singh,06-Mar-2019 06:11 PM,Rejected-Finance,Rejected,09-Aug-2019 05:18 PM,,,,,,,,,,,,,,,,,,,,,,,,,,AOC,,,,,,,,,,,,,,,,,,,,,,,,,,,,,,,,,,,,,,,,,,,,,,.pdf,Copy of registration as per NIT,,,,,,,,,,,,,AOC
,,,,,,,,,,,,,,,4.0,117398.0,SURENDER SINGH,06-Mar-2019 05:17 PM,Rejected-Finance,Rejected,09-Aug-2019 05:18 PM,,,,,,,,,,,,,,,,,,,,,,,,,,AOC,,,,,,,,,,,,,,,,,,,,,,,,,,,,,,,,,,,,,,,,,,,,,,.pdf,Copy of EPF registration,,,,,,,,,,,,,AOC
,,,,,,,,,,,,,,,5.0,117021.0,The Nandini Enterprises and Sons,07-Mar-2019 10:00 AM,Rejected-Finance,Rejected,09-Aug-2019 05:18 PM,,,,,,,,,,,,,,,,,,,,,,,,,,AOC,,,,,,,,,,,,,,,,,,,,,,,,,,,,,,,,,,,,,,,,,,,,,,.pdf,Undertaking of Joint venture is not alloed,,,,,,,,,,,,,AOC
,,,,,,,,,,,,,,,6.0,117521.0,Vijay Pal Singh,07-Mar-2019 09:46 AM,Rejected-Finance,Rejected,09-Aug-2019 05:18 PM,,,,,,,,,,,,,,,,,,,,,,,,,,AOC,,,,,,,,,,,,,,,,,,,,,,,,,,,,,,,,,,,,,,,,,,,,,,.pdf,Copy of PAN No. and GST registarion,,,,,,,,,,,,,AOC
,,,,,,,,,,,,,,,,,,,,,,,,,,,,,,,,,,,,,,,,,,,,,,,AOC,,,,,,,,,,,,,,,,,,,,,,,,,,,,,,,,,,,,,,,,,,,,,,.pdf,Undertaking of carefully studied all the terms and conditions,,,,,,,,,,,,,AOC
,,,,,,,,,,,,,,,,,,,,,,,,,,,,,,,,,,,,,,,,,,,,,,,AOC,,,,,,,,,,,,,,,,,,,,,,,,,,,,,,,,,,,,,,,,,,,,,,.pdf,Undertaking with the provision of contract Labour as per NIT,,,,,,,,,,,,,AOC
,,,,,,,,,,,,,,,,,,,,,,,,,,,,,,,,,,,,,,,,,,,,,,,AOC,,,,,,,,,,,,,,,,,,,,,,,,,,,,,,,,,,,,,,,,,,,,2.0,Finance,.xls,B.O.Q,,,,,,,,,,,,,AOC
