Organisation Chain :,Tender ID :,Tender Ref No :,Tender Title :,S.No,Bid Number,Bidder Name,Awarded Currency,Awarded Value,Committee Chairperson/Co-ordinator Name :,Committee Chairperson/Co-ordinator Type :,Committee Members :,Updated By :,Updated on :,Document :,Type :,Summary :,Updated By :.1,Updated On :,Document :.1,BOQ Comparative Chart :,Type :.1,Summary :.1,Updated By :.2,Updated On :.1,Document :.2,Contract Date :,Contract Value :,Work Completion Period in days :,Updated By :.3,Updated on :.1,AOC document :,AOC Description :,Committee Chairperson/Co-ordinator Name :.1,Committee Chairperson/Co-ordinator Type :.1,Committee Members :.1,Updated By :.4,Updated On :.2,Financial Bid Opening Date:,Document :.3,S.No.1,Bid Number.1,Bidder Name.1,Submitted Date,Status,Remarks,Status Updated On,Tender Stage,Name,Address,Tender Fee in ₹,Fee Payable To,Fee Payable At,Tender Fee Exemption Allowed,Cover No,Cover,Document Type,Description,Publish Date,Bid Opening Date,Document Download / Sale Start Date,Document Download / Sale End Date,Clarification Start Date,Clarification End Date,Bid Submission Start Date,Bid Submission End Date,Financial Bid Opening Date,S.No,Bank Name,Organisation Chain,Tender Reference Number,Tender ID,Withdrawal Allowed,Tender Type,Form of contract,Tender Category,No. of Covers,General Technical Evaluation Allowed,ItemWise Technical Evaluation Allowed,Payment Mode,Is Multi Currency Allowed For BOQ,Is Multi Currency Allowed For Fee,Allow Two Stage Bidding,Title,Work Description,Pre Qualification Details,Independent External Monitor/Remarks,Tender Value in ₹,Product Category,Sub category,Contract Type,Bid Validity(Days),Period Of Work(Days),Location,Pincode,Pre Bid Meeting Place,Pre Bid Meeting Address,Pre Bid Meeting Date,Bid Opening Place,Should Allow NDA Tender,Allow Preferential Bidder,EMD Amount in ₹,EMD Exemption Allowed,EMD Fee Type,EMD Percentage,EMD Payable To,EMD Payable At,Tender Stage
"HP Irrigation and Public Health||Nahan Circle,Irrigation and Public Health,HP||Solan,Irrigation and Public Health,HP",2019_HPIPH_29234_1,IPHS-TA-NIT/2019-2962-3061,Augmentation of LWSS Patti Kolian Tehsil and District Solan,1.0,123612.0,Suneel Dutt,INR,"594,751",Er. Sumit Sood EE,Internal,Sh Parminder Pal Singh Supdt Sh Anil Kumar Antal Smt Madhu Sood,Sumit Sood,03-Aug-2019 12:47 PM,finsummary_42352.pdf (36.81 KB),Finance,Financial bid opened successfuly,Sumit Sood,03-Aug-2019 12:11 PM,finance_42352.pdf,BOQ Comparative Chart,Technical,All document downloaded successfully,Sumit Sood,08-Jul-2019 11:07 AM,technical_42352.pdf,03-Aug-2019,"INR 509,198",90.0,Sumit Sood,03-Aug-2019 12:51 PM,Awardletterpattikoliyan.pdf (514.00 KB),Award letter,Executive Engineer,Internal,"Sh Parminder Pal Singh Supdt, Sh Anil Kumar Antal DAO, Smt Madhu Sood DHD",Sumit Sood,08-Jul-2019 11:45 AM,08-Jul-2019 11:50 AM,techsummary_42352.pdf (906.91 KB),1.0,123455.0,Rajesh Bhardwaj,03-Jul-2019 10:39 AM,Rejected-Finance,higher rate,03-Aug-2019 12:47 PM,AOC,Executive Engineer,EEIPHDivision Arki,250.0,EE IPH Division Solan,IPH Division Solan,No,1.0,Fee/PreQual/Technical,.pdf,Earnest Money as mentioned in NIT,11-Jun-2019 02:00 PM,03-Jul-2019 11:30 AM,11-Jun-2019 02:00 PM,03-Jul-2019 11:00 AM,11-Jun-2019 02:00 PM ,25-Jun-2019 05:00 PM ,11-Jun-2019 02:00 PM,03-Jul-2019 11:00 AM,08-Jul-2019 11:50 AM,1.0,ICICI BANK,"HP Irrigation and Public Health||Nahan Circle,Irrigation and Public Health,HP||Solan,Irrigation and Public Health,HP",IPHS-TA-NIT/2019-2962-3061,2019_HPIPH_29234_1,Yes,Open Tender,Item Rate,Works,2.0,No,No,Online,No,No,No,Augmentation of LWSS Patti Kolian Tehsil and District Solan,C/O RCC storage tank of 200000 Ltr Capacity,Please refer Tender documents. ,NA ,"5,09,198",Civil Works,NA ,Tender,120.0,90.0,Solan,173211.0,NA ,NA ,NA ,IPH Division Solan,No ,No,"10,000",Yes,fixed,,EE IPH Division Solan,Solan,AOC
,,,,,,,,,,,,,,,,,,,,,,,,,,,,,,,,,,,,,,,,2.0,123391.0,Rakesh Thakur,02-Jul-2019 06:47 PM,Rejected-Finance,higher rate,03-Aug-2019 12:47 PM,AOC,,,,,,,,,.pdf,Cost of Tender form mentioned in the NIT,,,,,,,,,,2.0,ICICI NEFT/RTGS,,,,,,,,,,,,,,,,,,,,,,,,,,,,,,,,,,,,,,,AOC
,,,,,,,,,,,,,,,,,,,,,,,,,,,,,,,,,,,,,,,,3.0,123593.0,R.K.Manhotra,03-Jul-2019 10:57 AM,Rejected-Finance,higher rate,03-Aug-2019 12:47 PM,AOC,,,,,,,,,.pdf,Certificate of Registration as mentioned in the NIT,,,,,,,,,,,,,,,,,,,,,,,,,,,,,,,,,,,,,,,,,,,,,,,,,,AOC
,,,,,,,,,,,,,,,,,,,,,,,,,,,,,,,,,,,,,,,,4.0,123612.0,Suneel Dutt,03-Jul-2019 10:28 AM,Accepted-AOC,Lowest rate,03-Aug-2019 12:51 PM,AOC,,,,,,,,,.pdf,Copy of PAN card GST as mentioned in the NIT,,,,,,,,,,,,,,,,,,,,,,,,,,,,,,,,,,,,,,,,,,,,,,,,,,AOC
,,,,,,,,,,,,,,,,,,,,,,,,,,,,,,,,,,,,,,,,,,,,,,,AOC,,,,,,,,,.pdf,DSC authorisation Certificate,,,,,,,,,,,,,,,,,,,,,,,,,,,,,,,,,,,,,,,,,,,,,,,,,,AOC
,,,,,,,,,,,,,,,,,,,,,,,,,,,,,,,,,,,,,,,,,,,,,,,AOC,,,,,,,,,.pdf,EPF/ESIS registration as mentioned in NIT,,,,,,,,,,,,,,,,,,,,,,,,,,,,,,,,,,,,,,,,,,,,,,,,,,AOC
,,,,,,,,,,,,,,,,,,,,,,,,,,,,,,,,,,,,,,,,,,,,,,,AOC,,,,,,,,,.pdf,Affidavit specifying that the benefit availed under earnest money exemption has not been exhausted s,,,,,,,,,,,,,,,,,,,,,,,,,,,,,,,,,,,,,,,,,,,,,,,,,,AOC
,,,,,,,,,,,,,,,,,,,,,,,,,,,,,,,,,,,,,,,,,,,,,,,AOC,,,,,,,2.0,Finance,.xls,BOQ,,,,,,,,,,,,,,,,,,,,,,,,,,,,,,,,,,,,,,,,,,,,,,,,,,AOC
