S.No,Bank Name,Title,Work Description,Pre Qualification Details,Independent External Monitor/Remarks,Tender Value in ₹,Product Category,Sub category,Contract Type,Bid Validity(Days),Period Of Work(Days),Location,Pincode,Pre Bid Meeting Place,Pre Bid Meeting Address,Pre Bid Meeting Date,Bid Opening Place,Should Allow NDA Tender,Allow Preferential Bidder,Tender Fee in ₹,Fee Payable To,Fee Payable At,Tender Fee Exemption Allowed,Publish Date,Bid Opening Date,Document Download / Sale Start Date,Document Download / Sale End Date,Clarification Start Date,Clarification End Date,Bid Submission Start Date,Bid Submission End Date,Financial Bid Opening Date,Organisation Chain,Tender Reference Number,Tender ID,Withdrawal Allowed,Tender Type,Form of contract,Tender Category,No. of Covers,General Technical Evaluation Allowed,ItemWise Technical Evaluation Allowed,Payment Mode,Is Multi Currency Allowed For BOQ,Is Multi Currency Allowed For Fee,Allow Two Stage Bidding,Name,Address,EMD Amount in ₹,EMD Exemption Allowed,EMD Fee Type,EMD Percentage,EMD Payable To,EMD Payable At,Cover No,Cover,Document Type,Description,Type :,Summary :,Updated By :,Updated On :,Document :,BOQ Comparative Chart :,Committee Chairperson/Co-ordinator Name :,Committee Chairperson/Co-ordinator Type :,Committee Members :,Updated By :.1,Updated On :.1,Financial Bid Opening Date:,Document :.1,Type :.1,Summary :.1,Updated By :.2,Updated On :.2,Document :.2,S.No.2,Bid Number,Bidder Name,Submitted Date,Status,Remarks,Status Updated On,Contract Date :,Contract Value :,Work Completion Period in days :,Updated By :.3,Updated on :,AOC document :,AOC Description :,S.No.1,Bid Number.1,Bidder Name.1,Awarded Currency,Awarded Value,Committee Chairperson/Co-ordinator Name :.1,Committee Chairperson/Co-ordinator Type :.1,Committee Members :.1,Updated By :.4,Updated on :.1,Document :.3,Organisation Chain :,Tender ID :,Tender Ref No :,Tender Title :
1.0,ICICI BANK,Development of Industrial Area Bal Bihal Distt. Hamirpur (HP). (SH- Design and construction of one No. RCC Over head Water Storage Tank of 0.50 lakh ltrs capacity with 15.00 mtrs staging height and other work contingent complete in all respect).,Development of Industrial Area Bal Bihal Distt. Hamirpur (HP). (SH- Design and construction of one No. RCC Over head Water Storage Tank of 0.50 lakh ltrs capacity with 15.00 mtrs staging height and other work contingent complete in all respect).,Please refer Tender documents. ,NA ,"9,06,376",Civil Works,NA ,Tender,120.0,180.0,Hamirpur,176040.0,NA ,NA ,NA ,HPSIDC Shimla,No ,No,"1,100",Nil,Nil,No,24-Mar-2023 11:00 AM,01-Apr-2023 11:00 AM,24-Mar-2023 11:00 AM,31-Mar-2023 05:00 PM,NA ,NA ,24-Mar-2023 11:00 AM,31-Mar-2023 05:00 PM,10-Apr-2023 02:00 PM,HP SIDC Limited,job No. 1,2023_SIDC_71482_1,Yes,Open Tender,Item Rate,Works,2.0,No,No,Online,No,No,No,Executive Engineer,HPSIDC Shimla,"18,100",No,fixed,,Nil,Nil,1.0,Fee/PreQual/Technical,.pdf,Appropriate Contractor registration (as per tender condition),Finance,Financial summary,BHUP SINGH,18-Apr-2023 04:11 PM,finance_107577.pdf,BOQ Comparative Chart,EE,Internal,"DM, Manager(F), AE(HQ)",Sushant Singh Negi,10-Apr-2023 01:12 PM,10-Apr-2023 02:00 PM,techsummary_107577.pdf (459.52 KB),Technical,Tender Summary,Sushant Singh Negi,10-Apr-2023 01:11 PM,technical_107577.pdf,1.0,339715.0,shashi kant,31-Mar-2023 02:27 PM,Accepted-AOC,AOC,15-Jun-2023,05-Jun-2023,"INR 1,434,660",180.0,Sushant Singh Negi,15-Jun-2023 11:04 AM,shashikant.pdf (1488.00 KB),Award letter,1.0,339715.0,shashi kant,INR,"1,434,660",SE,Internal,"DM, Manager(F), AE(HQ), EE(HQ)",BHUP SINGH,18-Apr-2023 04:16 PM,finsummary_107577.pdf (34.00 KB),HP SIDC Limited,2023_SIDC_71482_1,job No. 1,Development of Industrial Area Bal Bihal Distt. Hamirpur (HP). (SH- Design and construction of one No. RCC Over head Water Storage Tank of 0.50 lakh ltrs capacity with 15.00 mtrs staging height and other work contingent complete in all respect).
2.0,ICICI NEFT/RTGS,,,,,,,,,,,,,,,,,,,,,,,,,,,,,,,,,,,,,,,,,,,,,,,,,,,,,,,,.pdf,Signed copy of agreement form and approved make for materials,,,,,,,,,,,,,,,,,,,2.0,339776.0,Surinder Kumar Thakur,31-Mar-2023 12:35 PM,Rejected-Finance,second lowest bidder,18-Apr-2023,,,,,,,,,,,,,,,,,,,,,,
,,,,,,,,,,,,,,,,,,,,,,,,,,,,,,,,,,,,,,,,,,,,,,,,,,,,,,,,,.pdf,Affidavit that you have not more than 2 works in hand each of Rs.100 lakh or above in any department,,,,,,,,,,,,,,,,,,,3.0,339358.0,unique engg. solutions,31-Mar-2023 11:08 AM,Rejected-Finance,Third lowest bidder,18-Apr-2023,,,,,,,,,,,,,,,,,,,,,,
,,,,,,,,,,,,,,,,,,,,,,,,,,,,,,,,,,,,,,,,,,,,,,,,,,,,,,,,,.pdf,Proof copy of EPF registration No.,,,,,,,,,,,,,,,,,,,4.0,338558.0,VARINDER PAL,31-Mar-2023 06:18 AM,Rejected-Finance,4th lowest bidder,18-Apr-2023,,,,,,,,,,,,,,,,,,,,,,
,,,,,,,,,,,,,,,,,,,,,,,,,,,,,,,,,,,,,,,,,,,,,,,,,,,,,,,,,.pdf,Proof copy of GST registration No.,,,,,,,,,,,,,,,,,,,,,,,,,,,,,,,,,,,,,,,,,,,,,,,
,,,,,,,,,,,,,,,,,,,,,,,,,,,,,,,,,,,,,,,,,,,,,,,,,,,,,,,,,.pdf,Copy of latest ITR and pan card,,,,,,,,,,,,,,,,,,,,,,,,,,,,,,,,,,,,,,,,,,,,,,,
,,,,,,,,,,,,,,,,,,,,,,,,,,,,,,,,,,,,,,,,,,,,,,,,,,,,,,,,,.pdf,Copy of receipt of EMD and cost of form,,,,,,,,,,,,,,,,,,,,,,,,,,,,,,,,,,,,,,,,,,,,,,,
,,,,,,,,,,,,,,,,,,,,,,,,,,,,,,,,,,,,,,,,,,,,,,,,,,,,,,,,,.pdf,Affidavit that the information furnished with the bid documents is true and correct.,,,,,,,,,,,,,,,,,,,,,,,,,,,,,,,,,,,,,,,,,,,,,,,
,,,,,,,,,,,,,,,,,,,,,,,,,,,,,,,,,,,,,,,,,,,,,,,,,,,,,,,2.0,Finance,.xls,BOQ,,,,,,,,,,,,,,,,,,,,,,,,,,,,,,,,,,,,,,,,,,,,,,,
