Committee Chairperson/Co-ordinator Name :,Committee Chairperson/Co-ordinator Type :,Committee Members :,Updated By :,Updated On :,Financial Bid Opening Date:,Document :,Organisation Chain :,Tender ID :,Tender Ref No :,Tender Title :,S.No,Bid Number,Bidder Name,Awarded Currency,Awarded Value,Type :,Summary :,Updated By :.1,Updated On :.1,Document :.1,Committee Chairperson/Co-ordinator Name :.1,Committee Chairperson/Co-ordinator Type :.1,Committee Members :.1,Updated By :.2,Updated on :,Document :.2,S.No.1,Bid Number.1,Bidder Name.1,Submitted Date,Status,Remarks,Status Updated On,Contract Date :,Contract Value :,Work Completion Period in days :,Updated By :.3,Updated on :.1,AOC document :,AOC Description :,Type :.1,Summary :.1,Updated By :.4,Updated On :.2,Document :.3,BOQ Comparative Chart :,Publish Date,Bid Opening Date,Document Download / Sale Start Date,Document Download / Sale End Date,Clarification Start Date,Clarification End Date,Bid Submission Start Date,Bid Submission End Date,Financial Bid Opening Date,Organisation Chain,Tender Reference Number,Tender ID,Withdrawal Allowed,Tender Type,Form of contract,Tender Category,No. of Covers,General Technical Evaluation Allowed,ItemWise Technical Evaluation Allowed,Payment Mode,Is Multi Currency Allowed For BOQ,Is Multi Currency Allowed For Fee,Allow Two Stage Bidding,Title,Work Description,Pre Qualification Details,Independent External Monitor/Remarks,Tender Value in ₹,Product Category,Sub category,Contract Type,Bid Validity(Days),Period Of Work(Days),Location,Pincode,Pre Bid Meeting Place,Pre Bid Meeting Address,Pre Bid Meeting Date,Bid Opening Place,Should Allow NDA Tender,Allow Preferential Bidder,EMD Amount in ₹,EMD Exemption Allowed,EMD Fee Type,EMD Percentage,EMD Payable To,EMD Payable At,S.No.2,Instrument Type,Tender Fee in ₹,Fee Payable To,Fee Payable At,Tender Fee Exemption Allowed,S.No.1.1,Corrigendum Title,Corrigendum Type,View,Name,Address,Cover No,Cover,Document Type,Description
EE,Internal,AGM SJPNL AO,Rajesh Thakur,18-May-2023 10:49 AM,18-May-2023 10:55 AM,techsummary_108334.pdf (1269.87 KB),Municipal Corporation Shimla,2023_MC_71966_2,634Dated29032023,Construction of Sarai Langar Bhawan at Krishna Nagar,1.0,346463.0,Bhaw Singh Chauhan,INR,"295,864",Technical,bos,Sunil Attri,12-May-2023 11:38 AM,technical_108334.pdf,EE,Internal,AGM SJPNL AO,Rajesh Thakur,19-Jun-2023 12:13 PM,finsummary_108334.pdf (314.77 KB),1.0,346554.0,ABDUL RAZAK BUTT,10-May-2023 04:09 PM,Rejected-Finance,Rejected,19-Jun-2023,19-Jun-2023,"INR 341,486.8",30.0,Rajesh Thakur,19-Jun-2023 12:18 PM,2023_MC_71966_2.pdf (731.00 KB),AOC,Finance,BOS,Rajesh Thakur,18-May-2023 12:23 PM,finance_108334.pdf,BOQ Comparative Chart,06-Apr-2023 02:00 PM,11-May-2023 03:00 PM,06-Apr-2023 02:00 PM,10-May-2023 05:00 PM,NA ,NA ,06-Apr-2023 02:00 PM,10-May-2023 05:00 PM,18-May-2023 10:55 AM,Municipal Corporation Shimla,634Dated29032023,2023_MC_71966_2,Yes,Open Tender,Item Rate,Works,2.0,No,No,Offline,No,No,No,Construction of Sarai Langar Bhawan at Krishna Nagar,Construction of Sarai Langar Bhawan at Krishna Nagar,Please refer Tender Documents ,NA ,"2,97,271",Civil Works,NA ,Tender,120.0,30.0,Shimla,171001.0,NA ,NA ,NA ,MC Shimla,No ,No,"6,000",No,fixed,,Executive Engineer R B M C Shimla,Shimla,1.0,DD - Demand Draft,350.0,Executive Engineer R B M C Shimla,Shimla,No,1.0,Corrigendum2,Date,,Executive Engineer R B M C Shimla,Executive Engineer R B M C Shimla,1.0,Fee/PreQual/Technical,.pdf,Cost of form in shape of DD and Earnest money in shape of FDR as per E procurement notice
,,,,,,,,,,,,,,,,,,,,,,,,,,,2.0,346463.0,Bhaw Singh Chauhan,10-May-2023 01:12 PM,Accepted-AOC,Accepted,19-Jun-2023,,,,,,,,,,,,,,,,,,,,,,,,,,,,,,,,,,,,,,,,,,,,,,,,,,,,,,,,,,,,,2.0,FDR - Fixed Deposit,,,,,,,,,,,,,.pdf,Certificate of registration with HPPWD in appropriate class and latest renewal thereof
,,,,,,,,,,,,,,,,,,,,,,,,,,,3.0,346467.0,BILAL AHMED BUTT,10-May-2023 01:26 PM,Rejected-Finance,Rejected,19-Jun-2023,,,,,,,,,,,,,,,,,,,,,,,,,,,,,,,,,,,,,,,,,,,,,,,,,,,,,,,,,,,,,,,,,,,,,,,,,,,.pdf,Income Tax GST and EPF registration PAN Permanent Account No and GST No
,,,,,,,,,,,,,,,,,,,,,,,,,,,,,,,,,,,,,,,,,,,,,,,,,,,,,,,,,,,,,,,,,,,,,,,,,,,,,,,,,,,,,,,,,,,,,,,,,,,,,,,,,,,,.pdf,Scanned Copy of tender documents i.e. NIT (E-procurement notice) Performa and Form MW-7 duly signed
,,,,,,,,,,,,,,,,,,,,,,,,,,,,,,,,,,,,,,,,,,,,,,,,,,,,,,,,,,,,,,,,,,,,,,,,,,,,,,,,,,,,,,,,,,,,,,,,,,,,,,,,,,,,.pdf,Scanned copy of Affidavit duly signed with reference to condition No. 10.4
,,,,,,,,,,,,,,,,,,,,,,,,,,,,,,,,,,,,,,,,,,,,,,,,,,,,,,,,,,,,,,,,,,,,,,,,,,,,,,,,,,,,,,,,,,,,,,,,,,,,,,,,,,,,.pdf,Scanned copy of Letter Head with reference to condition No. 10.1
,,,,,,,,,,,,,,,,,,,,,,,,,,,,,,,,,,,,,,,,,,,,,,,,,,,,,,,,,,,,,,,,,,,,,,,,,,,,,,,,,,,,,,,,,,,,,,,,,,,,,,,,,,2.0,Finance,.xls,BOQ
