Organisation Chain,Tender Reference Number,Tender ID,Withdrawal Allowed,Tender Type,Form of contract,Tender Category,No. of Covers,General Technical Evaluation Allowed,ItemWise Technical Evaluation Allowed,Payment Mode,Is Multi Currency Allowed For BOQ,Is Multi Currency Allowed For Fee,Allow Two Stage Bidding,Title,Work Description,Pre Qualification Details,Independent External Monitor/Remarks,Tender Value in ₹,Product Category,Sub category,Contract Type,Bid Validity(Days),Period Of Work(Days),Location,Pincode,Pre Bid Meeting Place,Pre Bid Meeting Address,Pre Bid Meeting Date,Bid Opening Place,Should Allow NDA Tender,Allow Preferential Bidder,Cover No,Cover,Document Type,Description,Publish Date,Bid Opening Date,Document Download / Sale Start Date,Document Download / Sale End Date,Clarification Start Date,Clarification End Date,Bid Submission Start Date,Bid Submission End Date,Financial Bid Opening Date,Name,Address,S.No,Corrigendum Title,Corrigendum Type,View,Tender Fee in ₹,Fee Payable To,Fee Payable At,Tender Fee Exemption Allowed,S.No.1,Bank Name,EMD Amount in ₹,EMD through BG/ST or EMD Exemption Allowed,EMD Fee Type,EMD Percentage,EMD Payable To,EMD Payable At,Tender Stage,Type :,Summary :,Updated By :,Updated On :,Document :,S.No,Bid Number,Bidder Name,Awarded Currency,Awarded Value,Committee Chairperson/Co-ordinator Name :,Committee Chairperson/Co-ordinator Type :,Committee Members :,Updated By :.1,Updated on :,Document :.1,Organisation Chain :,Tender ID :,Tender Ref No :,Tender Title :,S.No.1,Bid Number.1,Bidder Name.1,Submitted Date,Status,Remarks,Status Updated On,Type :.1,Summary :.1,Updated By :.2,Updated On :.1,Document :.2,BOQ Comparative Chart :,Committee Chairperson/Co-ordinator Name :.1,Committee Chairperson/Co-ordinator Type :.1,Committee Members :.1,Updated By :.3,Updated On :.2,Financial Bid Opening Date:,Document :.3,Contract Date :,Contract Value :,Work Completion Period in days :,Updated By :.4,Updated on :.1,AOC document :,AOC Description :,Tender Stage
National Health Mission||State Programme Management Unit - NHM,NHM-32023/11/2022-CONS-NHM/95,2022_NHM_28421_81,Yes,Open Tender,Turn-key,Works,2.0,No,No,Online,No,No,No,Construction of Buildingless Sub Health Centre in Pokalagi SC at Dhubri District for FY 2022 23 under PM ABHIM on Turnkey Basis,Construction of Buildingless Sub Health Centre in Pokalagi SC at Dhubri District for FY 2022 23 under PM ABHIM on Turnkey Basis,Please refer Tender documents. ,NA ,"52,03,000",Civil Works - Building,NA ,Tender,180.0,180.0,Dhubri,783301.0,NA ,NA ,NA ,"O/o MD, NHM, ASSAM",No ,No,1.0,Fee/PreQual/Technical,.pdf,SBD,26-Dec-2022 06:55 PM,20-Jan-2023 03:30 PM,26-Dec-2022 06:55 PM,19-Jan-2023 02:00 PM,NA ,NA ,26-Dec-2022 06:55 PM,19-Jan-2023 02:00 PM,04-Apr-2023 09:00 AM,"MD, NHM, ASSAM","O/o MD, NHM, ASSAM, CHRISTANBASTI, GUWAHATI-05",1.0,DATE,Date,,"1,500",Nil,Nil,No,1.0,SBI Bank,"1,04,060",Yes,percentage,2.0%,Nil,Nil,AOC,Technical,TBER,Arindam Pathak,03-Apr-2023 07:51 PM,technical_45463.pdf,1.0,174370.0,ANOWAR UZ ZAMAN AHMED,INR,5150000.0,ED,Internal,,Arindam Pathak,24-Jun-2023 02:22 PM,finsummary_45463.pdf (418.96 KB),National Health Mission||State Programme Management Unit - NHM,2022_NHM_28421_81,NHM-32023/11/2022-CONS-NHM/95,Construction of Buildingless Sub Health Centre in Pokalagi SC at Dhubri District for FY 2022 23 under PM ABHIM on Turnkey Basis,1.0,172672.0,ABDUL MONNAF MONDAL,19-Jan-2023 01:50 AM,Rejected-Finance,NOT ADMITTED,24-Jun-2023 02:22 PM,Finance,financial bid opened,Arindam Pathak,24-Jun-2023 02:19 PM,,BOQ Comparative Chart,ED,Internal,,Arindam Pathak,03-Apr-2023 07:54 PM,04-Apr-2023 09:00 AM,techsummary_45463.pdf (2454.92 KB),24-Jun-2023,INR 5150000.0,180.0,Arindam Pathak,24-Jun-2023 02:23 PM,pokalagi.pdf (419.00 KB),WORK ALOTTED,AOC
,,,,,,,,,,,,,,,,,,,,,,,,,,,,,,,,,,.pdf,TECHNICAL QUALIFICATION,,,,,,,,,,,,2.0,Corrigendum,Other,,,,,,,,,,,,,,AOC,,,,,,,,,,,,,,,,,,,,,2.0,174370.0,ANOWAR UZ ZAMAN AHMED,18-Jan-2023 08:43 PM,Accepted-AOC,WORK ALOTTED,24-Jun-2023 02:23 PM,,,,,,,,,,,,,,,,,,,,,AOC
,,,,,,,,,,,,,,,,,,,,,,,,,,,,,,,,,,.pdf,EMD AND TENDER FEE,,,,,,,,,,,,,,,,,,,,,,,,,,,,AOC,,,,,,,,,,,,,,,,,,,,,3.0,174431.0,Foyzal Hoque,19-Jan-2023 12:50 PM,Rejected-Finance,NOT ADMITTED,24-Jun-2023 02:22 PM,,,,,,,,,,,,,,,,,,,,,AOC
,,,,,,,,,,,,,,,,,,,,,,,,,,,,,,,,2.0,Finance,.xls,BOQ,,,,,,,,,,,,,,,,,,,,,,,,,,,,AOC,,,,,,,,,,,,,,,,,,,,,,,,,,,,,,,,,,,,,,,,,,,,,,,,AOC
,,,,,,,,,,,,,,,,,,,,,,,,,,,,,,,,,,.pdf,FOB,,,,,,,,,,,,,,,,,,,,,,,,,,,,AOC,,,,,,,,,,,,,,,,,,,,,,,,,,,,,,,,,,,,,,,,,,,,,,,,AOC
