Contract Date :,Contract Value :,Work Completion Period in days :,Updated By :,Updated on :,AOC document :,Organisation Chain :,Tender ID :,Tender Ref No :,Tender Title :,Committee Chairperson/Co-ordinator Name :,Committee Chairperson/Co-ordinator Type :,Committee Members :,Updated By :.1,Updated On :,Financial Bid Opening Date:,Document :,S.No,Bid Number,Bidder Name,Awarded Currency,Awarded Value,Committee Chairperson/Co-ordinator Name :.1,Committee Chairperson/Co-ordinator Type :.1,Committee Members :.1,Updated By :.2,Updated on :.1,Document :.1,S.No.1,Bid Number.1,Bidder Name.1,Submitted Date,Status,Remarks,Status Updated On,Type :,Summary :,Updated By :.3,Updated On :.1,Document :.2,Type :.1,Summary :.1,Updated By :.4,Updated On :.2,Document :.3,BOQ Comparative Chart :,Tender Stage,Organisation Chain,Tender Reference Number,Tender ID,Withdrawal Allowed,Tender Type,Form of contract,Tender Category,No. of Covers,General Technical Evaluation Allowed,ItemWise Technical Evaluation Allowed,Payment Mode,Is Multi Currency Allowed For BOQ,Is Multi Currency Allowed For Fee,Allow Two Stage Bidding,Tender Fee in ₹,Fee Payable To,Fee Payable At,Tender Fee Exemption Allowed,Cover No,Cover,Document Type,Description,Title,Work Description,Pre Qualification Details,Independent External Monitor/Remarks,Tender Value in ₹,Product Category,Sub category,Contract Type,Bid Validity(Days),Period Of Work(Days),Location,Pincode,Pre Bid Meeting Place,Pre Bid Meeting Address,Pre Bid Meeting Date,Bid Opening Place,Should Allow NDA Tender,Allow Preferential Bidder,S.No,Bank Name,EMD Amount in ₹,EMD through BG/ST or EMD Exemption Allowed,EMD Fee Type,EMD Percentage,EMD Payable To,EMD Payable At,Name,Address,S.No.1,Corrigendum Title,Corrigendum Type,View,Publish Date,Bid Opening Date,Document Download / Sale Start Date,Document Download / Sale End Date,Clarification Start Date,Clarification End Date,Bid Submission Start Date,Bid Submission End Date,Financial Bid Opening Date,Tender Stage
03-Jun-2023,INR 4901223.0,180.0,Dipjyoti Deka,03-Jun-2023 01:54 PM,hazratali.pdf (304.00 KB),National Health Mission||State Programme Management Unit - NHM,2022_NHM_28421_17,NHM-32023/11/2022-CONS-NHM/95,Construction of Buildingless Sub Health Centre in Batiporia SC at Golaghat District for FY 2022 23 under PM ABHIM on Turnkey Basis,ED,Internal,,Dipjyoti Deka,09-Mar-2023 02:07 PM,09-Mar-2023 02:10 PM,techsummary_45305.pdf (351.96 KB),1.0,172709.0,MD HAZRAT ALI,INR,4901223.0,ED,Internal,,Dipjyoti Deka,03-Jun-2023 01:53 PM,finsummary_45305.pdf (223.42 KB),1.0,172879.0,Kazimuddin Ahmed,11-Jan-2023 11:54 AM,Rejected-Finance,Second lowest quoted rate bidder,03-Jun-2023 01:53 PM,Technical,TBER,Dipjyoti Deka,09-Mar-2023 02:05 PM,technical_45305.pdf,Finance,Financial bid opened.,Dipjyoti Deka,03-Jun-2023 01:44 PM,,BOQ Comparative Chart,AOC,National Health Mission||State Programme Management Unit - NHM,NHM-32023/11/2022-CONS-NHM/95,2022_NHM_28421_17,Yes,Open Tender,Turn-key,Works,2.0,No,No,Online,No,No,No,"1,500",Nil,Nil,No,1.0,Fee/PreQual/Technical,.pdf,SBD,Construction of Buildingless Sub Health Centre in Batiporia SC at Golaghat District for FY 2022 23 under PM ABHIM on Turnkey Basis,Construction of Buildingless Sub Health Centre in Batiporia SC at Golaghat District for FY 2022 23 under PM ABHIM on Turnkey Basis,Please refer Tender documents. ,NA ,"52,03,000",Civil Works - Building,NA ,Tender,180.0,180.0,Golaghat,785621.0,NA ,NA ,NA ,"O/o MD, NHM, ASSAM",No ,No,1.0,SBI Bank,"1,04,060",Yes,percentage,2.0%,Nil,Nil,"MD, NHM, ASSAM","O/o MD, NHM, ASSAM, CHRISTANBASTI, GUWAHATI-05",1.0,Corrigendum,Other,,23-Dec-2022 06:55 PM,12-Jan-2023 03:30 PM,23-Dec-2022 06:55 PM,11-Jan-2023 02:00 PM,NA ,NA ,23-Dec-2022 06:55 PM,11-Jan-2023 02:00 PM,09-Mar-2023 02:10 PM,AOC
,,,,,,,,,,,,,,,,,,,,,,,,,,,,2.0,172276.0,MD. AZADUR RAHMAN,11-Jan-2023 06:26 AM,Not Admitted-Fee/PreQual/Technical,Not Complied with technical specification,09-Mar-2023 02:05 PM,,,,,,,,,,,,AOC,,,,,,,,,,,,,,,,,,,,,.pdf,TECHNICAL QUALIFICATION,,,,,,,,,,,,,,,,,,,,,,,,,,,,,,,,,,,,,,,,,,AOC
,,,,,,,,,,,,,,,,,,,,,,,,,,,,3.0,172709.0,MD HAZRAT ALI,10-Jan-2023 05:24 PM,Accepted-AOC,Award of Contract.,03-Jun-2023 01:55 PM,,,,,,,,,,,,AOC,,,,,,,,,,,,,,,,,,,,,.pdf,EMD AND TENDER FEE,,,,,,,,,,,,,,,,,,,,,,,,,,,,,,,,,,,,,,,,,,AOC
,,,,,,,,,,,,,,,,,,,,,,,,,,,,,,,,,,,,,,,,,,,,,,AOC,,,,,,,,,,,,,,,,,,,2.0,Finance,.xls,BOQ,,,,,,,,,,,,,,,,,,,,,,,,,,,,,,,,,,,,,,,,,,AOC
,,,,,,,,,,,,,,,,,,,,,,,,,,,,,,,,,,,,,,,,,,,,,,AOC,,,,,,,,,,,,,,,,,,,,,.pdf,FOB,,,,,,,,,,,,,,,,,,,,,,,,,,,,,,,,,,,,,,,,,,AOC
