S.No,Bank Name,EMD Amount in ₹,EMD Exemption Allowed,EMD Fee Type,EMD Percentage,EMD Payable To,EMD Payable At,Cover No,Cover,Document Type,Description,Organisation Chain,Tender Reference Number,Tender ID,Withdrawal Allowed,Tender Type,Form of contract,Tender Category,No. of Covers,General Technical Evaluation Allowed,ItemWise Technical Evaluation Allowed,Payment Mode,Is Multi Currency Allowed For BOQ,Is Multi Currency Allowed For Fee,Allow Two Stage Bidding,Tender Fee in ₹,Fee Payable To,Fee Payable At,Tender Fee Exemption Allowed,Name,Address,Title,Work Description,Pre Qualification Details,Independent External Monitor/Remarks,Tender Value in ₹,Product Category,Sub category,Contract Type,Bid Validity(Days),Period Of Work(Days),Location,Pincode,Pre Bid Meeting Place,Pre Bid Meeting Address,Pre Bid Meeting Date,Bid Opening Place,Should Allow NDA Tender,Allow Preferential Bidder,S.No.1,Corrigendum Title,Corrigendum Type,View,Publish Date,Bid Opening Date,Document Download / Sale Start Date,Document Download / Sale End Date,Clarification Start Date,Clarification End Date,Bid Submission Start Date,Bid Submission End Date,Financial Bid Opening Date,Tender Stage,Organisation Chain :,Tender ID :,Tender Ref No :,Tender Title :,Committee Chairperson/Co-ordinator Name :,Committee Chairperson/Co-ordinator Type :,Committee Members :,Updated By :,Updated On :,Financial Bid Opening Date:,Document :,Committee Chairperson/Co-ordinator Name :.1,Committee Chairperson/Co-ordinator Type :.1,Committee Members :.1,Updated By :.1,Updated on :,Document :.1,Contract Date :,Contract Value :,Work Completion Period in days :,Updated By :.2,Updated on :.1,AOC document :,AOC Description :,Type :,Summary :,Updated By :.3,Updated On :.1,Document :.2,BOQ Comparative Chart :,S.No,Bid Number,Bidder Name,Awarded Currency,Awarded Value,S.No.1,Bid Number.1,Bidder Name.1,Submitted Date,Status,Remarks,Status Updated On,Type :.1,Summary :.1,Updated By :.4,Updated On :.2,Document :.3,Tender Stage
1.0,ICICI BANK,"36,600",No,fixed,,Nil,Nil,1.0,Fee/PreQual/Technical,.pdf,"Cost of Tender, EMD and other terms and conditions as per indicated in SBD",PWD,No-PW-NLD-Tender /2021-22 16932-36 Dated 28.03.202,2022_PWD_59284_1,Yes,Open Tender,Item Rate,Works,2.0,No,No,Online,No,No,No,500.0,Nil,Nil,No,EE HPPWD Division Nalagarh,EE HPPWD Division Nalagarh,AMP for the year 2022-23 on Sitalpur to Nanowal road km 0/0 to 18/400(P/L 30 MM Bituminous concrete in km 0/00 to 1/00 along with road side drain).,.,Please refer Tender documents. ,NA ,"18,28,615",Civil Works,NA ,Tender,75.0,90.0,NALAGARH,174101.0,NA ,NA ,NA ,NALAGARH,No ,No,1.0,Corrigendum regarding dates,Date,,07-Apr-2022 02:15 PM,18-Apr-2022 11:30 AM,07-Apr-2022 02:15 PM,18-Apr-2022 11:00 AM,NA ,NA ,07-Apr-2022 02:15 PM,18-Apr-2022 11:00 AM,20-Apr-2022 05:40 PM,AOC,PWD,2022_PWD_59284_1,No-PW-NLD-Tender /2021-22 16932-36 Dated 28.03.202,AMP for the year 2022-23 on Sitalpur to Nanowal road km 0/0 to 18/400(P/L 30 MM Bituminous concrete in km 0/00 to 1/00 along with road side drain).,EE,Internal,EE,Raj Kumar,20-Apr-2022 05:35 PM,20-Apr-2022 05:40 PM,techsummary_89732.pdf (476.62 KB),EE,Internal,EE,Raj Kumar,22-Apr-2022 07:01 PM,finsummary_89732.pdf (19.98 KB),30-Apr-2022,"INR 1,828,615",90.0,Raj Kumar,20-Jul-2022 11:39 AM,34-2022-23.pdf (593.00 KB),AOC,Finance,Summary,Ajay Kumar Sharma,22-Apr-2022 10:35 AM,finance_89732.pdf,BOQ Comparative Chart,1.0,277659.0,lrc builders privated ltd,INR,"1,829,594",1.0,277424.0,Abhishek Kumar,17-Apr-2022 11:20 AM,Rejected-Finance,L2,22-Apr-2022 07:01 PM,Technical,Summary,Raj Kumar,20-Apr-2022 05:26 PM,None,AOC
2.0,ICICI NEFT/RTGS,,,,,,,,,.pdf,Contractor Registration/GST/PAN/EPF and follow the other all conditions indicated in SBD,,,,,,,,,,,,,,,,,,,,,,,,,,,,,,,,,,,,,,,,,,,,,,,,,,,,AOC,,,,,,,,,,,,,,,,,,,,,,,,,,,,,,,,,,,,2.0,277659.0,lrc builders privated ltd,17-Apr-2022 01:24 PM,Accepted-AOC,AOC Done,20-Jul-2022 11:39 AM,,,,,,AOC
,,,,,,,,,,.pdf,Duly filled and signed from No 7/8 General Rule and Direction,,,,,,,,,,,,,,,,,,,,,,,,,,,,,,,,,,,,,,,,,,,,,,,,,,,,AOC,,,,,,,,,,,,,,,,,,,,,,,,,,,,,,,,,,,,,,,,,,,,,,,,AOC
,,,,,,,,,,.pdf,Affidavit reg. detail of Machinery (Hot mix plant paver etc.) as per contract data to General Condit,,,,,,,,,,,,,,,,,,,,,,,,,,,,,,,,,,,,,,,,,,,,,,,,,,,,AOC,,,,,,,,,,,,,,,,,,,,,,,,,,,,,,,,,,,,,,,,,,,,,,,,AOC
,,,,,,,,2.0,Finance,.xls,BOQ,,,,,,,,,,,,,,,,,,,,,,,,,,,,,,,,,,,,,,,,,,,,,,,,,,,,AOC,,,,,,,,,,,,,,,,,,,,,,,,,,,,,,,,,,,,,,,,,,,,,,,,AOC
