S.No,Bank Name,EMD Amount in ₹,EMD Exemption Allowed,EMD Fee Type,EMD Percentage,EMD Payable To,EMD Payable At,Name,Address,Title,Work Description,Pre Qualification Details,Independent External Monitor/Remarks,Tender Value in ₹,Product Category,Sub category,Contract Type,Bid Validity(Days),Period Of Work(Days),Location,Pincode,Pre Bid Meeting Place,Pre Bid Meeting Address,Pre Bid Meeting Date,Bid Opening Place,Should Allow NDA Tender,Allow Preferential Bidder,Tender Fee in ₹,Fee Payable To,Fee Payable At,Tender Fee Exemption Allowed,Cover No,Cover,Document Type,Description,Organisation Chain,Tender Reference Number,Tender ID,Withdrawal Allowed,Tender Type,Form of contract,Tender Category,No. of Covers,General Technical Evaluation Allowed,ItemWise Technical Evaluation Allowed,Payment Mode,Is Multi Currency Allowed For BOQ,Is Multi Currency Allowed For Fee,Allow Two Stage Bidding,Publish Date,Bid Opening Date,Document Download / Sale Start Date,Document Download / Sale End Date,Clarification Start Date,Clarification End Date,Bid Submission Start Date,Bid Submission End Date,Financial Bid Opening Date,Tender Stage,S.No,Bid Number,Bidder Name,Submitted Date,Status,Remarks,Status Updated On,Committee Chairperson/Co-ordinator Name :,Committee Chairperson/Co-ordinator Type :,Committee Members :,Updated By :,Updated On :,Financial Bid Opening Date:,Document :,Contract Date :,Contract Value :,Work Completion Period in days :,Updated By :.1,Updated on :,AOC document :,AOC Description :,Type :,Summary :,Updated By :.2,Updated On :.1,Document :.1,Type :.1,Summary :.1,Updated By :.3,Updated On :.2,Document :.2,BOQ Comparative Chart :,Committee Chairperson/Co-ordinator Name :.1,Committee Chairperson/Co-ordinator Type :.1,Committee Members :.1,Updated By :.4,Updated on :.1,Document :.3,Organisation Chain :,Tender ID :,Tender Ref No :,Tender Title :,S.No.1,Bid Number.1,Bidder Name.1,Awarded Currency,Awarded Value,Tender Stage
1.0,ICICI BANK,"30,535",Yes,fixed,,EE Jal Shakti Division Bilaspur,Jal Shakti Division Bilaspur,Executive Engineer,Jal Shakti Division Bilaspur,A/R and M/O various LWSS/ GWSs under JSV Sub-Division Bilaspur Tehsil Sadar District Bilaspur (SH Supply of manpower for distribution system under JSV Section Bilaspur for one year),A/R and M/O various LWSS/ GWSs under JSV Sub-Division Bilaspur Tehsil Sadar District Bilaspur (SH Supply of manpower for distribution system under JSV Section Bilaspur for one year),Please refer tender documents ,NA ,,Repair and Maintenance Works,NA ,Tender,120.0,30535.0,Under JSV Sub Division Bilaspur,174001.0,NA ,NA ,NA ,Jal Shakti Division Bilaspur,No ,No,400.0,EE Jal Shakti Division Bilaspur,Jal Shakti Division Bilaspur,Yes,1.0,Fee/PreQual/Technical,.pdf,Cost of Tender form proof,"HP Irrigation and Public Health||Bilaspur Circle,Irrigation and Public Health,HP||Bilaspur,Irrigation and Public Health,HP",BLP-BLP00-736 NIT No. 9299-9398 dt. 28-06-2022,2022_HPIPH_62284_1,Yes,Open Tender,Item Rate,Works,2.0,No,No,Both(Online/Offline),No,No,No,29-Jun-2022 01:50 PM,05-Jul-2022 11:30 AM,29-Jun-2022 01:50 PM,05-Jul-2022 11:00 AM,29-Jun-2022 01:50 PM ,04-Jul-2022 05:00 PM ,29-Jun-2022 01:50 PM,05-Jul-2022 11:00 AM,05-Jul-2022 12:15 PM,AOC,1.0,289834.0,ROOP THAKUR,03-Jul-2022 08:31 PM,Accepted-AOC,Accepted,08-Jul-2022 02:38 PM,Er. Rakesh Kumar Vaidya Executive Engineer,Internal,"Sh Bala Ram Thakur Superintendent Gr-II, ,Sh. Rakesh Kumar DHD ,Sh. Yash Pal Senior Assistant ,",Rakesh Kumar,05-Jul-2022 12:11 PM,05-Jul-2022 12:15 PM,techsummary_93942.pdf (247.16 KB),08-Jul-2022,"INR 1,550,000",30535.0,Rakesh Kumar,08-Jul-2022 02:38 PM,Award.pdf (74.00 KB),The work has been awarded to Sh Sandeep Kumar Village Jabli P.O. Raghunathpur Tehsil Sadar District Bilaspur,Technical,Three bidders have been participated in the e tender process documents of all bidders downloaded successfully.,Rakesh Kumar,05-Jul-2022 12:08 PM,technical_93942.pdf,Finance,BOQ of all bidders downloaded and boq comparative chart generated successfully.,Rakesh Kumar,05-Jul-2022 12:24 PM,finance_93942.pdf,BOQ Comparative Chart,Er. Rakesh Kumar Vaidya Executive Engineer,Internal,"Sh Bala Ram Thakur Superintendent Gr-II, ,Sh. Rakesh Kumar DHD ,Sh. Yash Pal Senior Assistant ,",Rakesh Kumar,05-Jul-2022 12:27 PM,finsummary_93942.pdf (74.19 KB),"HP Irrigation and Public Health||Bilaspur Circle,Irrigation and Public Health,HP||Bilaspur,Irrigation and Public Health,HP",2022_HPIPH_62284_1,BLP-BLP00-736 NIT No. 9299-9398 dt. 28-06-2022,A/R and M/O various LWSS/ GWSs under JSV Sub-Division Bilaspur Tehsil Sadar District Bilaspur (SH Supply of manpower for distribution system under JSV Section Bilaspur for one year),1.0,289832.0,Sh.Ram Lal,INR,0,AOC
2.0,ICICI NEFT/RTGS,,,,,,,,,,,,,,,,,,,,,,,,,,,,,,,,,.pdf,Earnest money proof scan copy of EMD of Certificate of exemption of earnest money with affidavit,,,,,,,,,,,,,,,,,,,,,,,,AOC,2.0,289888.0,Sandeep Kumar,04-Jul-2022 11:01 AM,Accepted-AOC,Accepted,08-Jul-2022 02:38 PM,,,,,,,,,,,,,,,,,,,,,,,,,,,,,,,,,,,,2.0,289834.0,ROOP THAKUR,INR,0,AOC
,,,,,,,,,,,,,,,,,,,,,,,,,,,,,,,,,,.pdf,Certificate of registration with Jal Shakti Vighag in appropriate class and latest renewal thereof.,,,,,,,,,,,,,,,,,,,,,,,,AOC,3.0,289832.0,Sh.Ram Lal,03-Jul-2022 08:24 PM,Accepted-AOC,Accepted,08-Jul-2022 02:38 PM,,,,,,,,,,,,,,,,,,,,,,,,,,,,,,,,,,,,3.0,289888.0,Sandeep Kumar,INR,"1,550,000",AOC
,,,,,,,,,,,,,,,,,,,,,,,,,,,,,,,,,,.pdf,PAN No. / GST registration.,,,,,,,,,,,,,,,,,,,,,,,,AOC,,,,,,,,,,,,,,,,,,,,,,,,,,,,,,,,,,,,,,,,,,,,,,,,AOC
,,,,,,,,,,,,,,,,,,,,,,,,,,,,,,,,,,.pdf,Scan copy of EPF No.,,,,,,,,,,,,,,,,,,,,,,,,AOC,,,,,,,,,,,,,,,,,,,,,,,,,,,,,,,,,,,,,,,,,,,,,,,,AOC
,,,,,,,,,,,,,,,,,,,,,,,,,,,,,,,,,,.pdf,The contractor already having two works especially O and M in hand under this Division is not eligib,,,,,,,,,,,,,,,,,,,,,,,,AOC,,,,,,,,,,,,,,,,,,,,,,,,,,,,,,,,,,,,,,,,,,,,,,,,AOC
,,,,,,,,,,,,,,,,,,,,,,,,,,,,,,,,,,.pdf,Work experience certificate of having executed the similar work issued by an officer of rank not bel,,,,,,,,,,,,,,,,,,,,,,,,AOC,,,,,,,,,,,,,,,,,,,,,,,,,,,,,,,,,,,,,,,,,,,,,,,,AOC
,,,,,,,,,,,,,,,,,,,,,,,,,,,,,,,,2.0,Finance,.xls,BOQ,,,,,,,,,,,,,,,,,,,,,,,,AOC,,,,,,,,,,,,,,,,,,,,,,,,,,,,,,,,,,,,,,,,,,,,,,,,AOC
