S.No,Bid Number,Bidder Name,Submitted Date,Status,Remarks,Status Updated On,Committee Chairperson/Co-ordinator Name :,Committee Chairperson/Co-ordinator Type :,Committee Members :,Updated By :,Updated On :,Financial Bid Opening Date:,Document :,Type :,Summary :,Updated By :.1,Updated On :.1,Document :.1,Type :.1,Summary :.1,Updated By :.2,Updated On :.2,Document :.2,BOQ Comparative Chart :,Contract Date :,Contract Value :,Work Completion Period in days :,Updated By :.3,Updated on :,AOC document :,AOC Description :,S.No.1,Bid Number.1,Bidder Name.1,Awarded Currency,Awarded Value,Organisation Chain :,Tender ID :,Tender Ref No :,Tender Title :,Committee Chairperson/Co-ordinator Name :.1,Committee Chairperson/Co-ordinator Type :.1,Committee Members :.1,Updated By :.4,Updated on :.1,Document :.3,Tender Stage,Cover No,Cover,Document Type,Description,S.No,Bank Name,Tender Fee in ₹,Fee Payable To,Fee Payable At,Tender Fee Exemption Allowed,Organisation Chain,Tender Reference Number,Tender ID,Withdrawal Allowed,Tender Type,Form of contract,Tender Category,No. of Covers,General Technical Evaluation Allowed,ItemWise Technical Evaluation Allowed,Payment Mode,Is Multi Currency Allowed For BOQ,Is Multi Currency Allowed For Fee,Allow Two Stage Bidding,Title,Work Description,Pre Qualification Details,Independent External Monitor/Remarks,Tender Value in ₹,Product Category,Sub category,Contract Type,Bid Validity(Days),Period Of Work(Days),Location,Pincode,Pre Bid Meeting Place,Pre Bid Meeting Address,Pre Bid Meeting Date,Bid Opening Place,Should Allow NDA Tender,Allow Preferential Bidder,Name,Address,EMD Amount in ₹,EMD Exemption Allowed,EMD Fee Type,EMD Percentage,EMD Payable To,EMD Payable At,Publish Date,Bid Opening Date,Document Download / Sale Start Date,Document Download / Sale End Date,Clarification Start Date,Clarification End Date,Bid Submission Start Date,Bid Submission End Date,Financial Bid Opening Date,Tender Stage
1.0,285864.0,Dogra Construction Company Pvt Ltd,08-Jun-2022 11:20 AM,Rejected-AOC,accept,13-Jul-2022 06:49 PM,Executive Engineer JSV Division Thural,Internal,"Tender Asstt,Supdtt,HDM,AEtoEE",Anil Kumar,15-Jun-2022 03:00 PM,15-Jun-2022 03:05 PM,techsummary_92527.pdf (1785.89 KB),Technical,4 Nos contractor/Firm bid documents downloaded sucessfully summary attached,Anil Kumar,15-Jun-2022 02:56 PM,technical_92527.pdf,Finance,BOQ downloaded sucessfully summary attached,Anil Kumar,15-Jun-2022 03:23 PM,finance_92527.pdf,BOQ Comparative Chart,16-Jun-2022,"INR 2,903,400",90.0,Anil Kumar,13-Jul-2022 06:49 PM,AOC.pdf (53.00 KB),Sh. Saurabh Vasudeva Govt.Cont. Ward No.4 Palampur. Tehsil Palampur District Kangra HP.,1.0,285797.0,Saurabh Vasudeva,INR,"2,903,400","HP Irrigation and Public Health||Dharamshala Circle,Irrigation and Public Health,HP||Thural,Irrigation and Public Health,HP",2022_HPIPH_61294_1,THL-KNG05-729 (3932-82 dated 31.05.2022),"Augmentation of 7 Nos LWSS in Sullah Constituency (LWSS Lahru Bhanwar, Thana Bhanwar, Barsola Lahru, Kiarwan Sunpur, Lahru, Duhak Dhaniyara and Dugni Malahoo in Tehsil Palampur, Distt.Kangra",Executive Engineer JSV Division Thural,Internal,"Tender Asstt,HDM,DAO,AEtoEE",Anil Kumar,15-Jun-2022 03:27 PM,finsummary_92527.pdf (1785.89 KB),AOC,1.0,Fee/PreQual/Technical,.pdf,Cost of Bid Documents and Earnest money etc Shall be deposited through online mode ( E-Payment ).,1.0,ICICI BANK,800.0,Nil,Nil,No,"HP Irrigation and Public Health||Dharamshala Circle,Irrigation and Public Health,HP||Thural,Irrigation and Public Health,HP",THL-KNG05-729 (3932-82 dated 31.05.2022),2022_HPIPH_61294_1,Yes,Open Tender,Item Wise,Works,2.0,No,No,Online,No,No,No,"Augmentation of 7 Nos LWSS in Sullah Constituency (LWSS Lahru Bhanwar, Thana Bhanwar, Barsola Lahru, Kiarwan Sunpur, Lahru, Duhak Dhaniyara and Dugni Malahoo in Tehsil Palampur, Distt.Kangra","Augmentation of 7 Nos LWSS in Sullah Constituency (LWSS Lahru Bhanwar, Thana Bhanwar, Barsola Lahru, Kiarwan Sunpur, Lahru, Duhak Dhaniyara and Dugni Malahoo in Tehsil Palampur, Distt.Kangra",Please refer Tender documents. ,NA ,"19,90,000",Civil Works - Others,NA ,Tender,120.0,90.0,Augmentation of 7 Nos LWSS in Sullah Constituency,176107.0,NA ,NA ,NA ,O/O The Executive Engineer JSV Division Thural,No ,No,Executive Engineer JSV Division Thural,O/O The Executive Engineer JSV Division Thural,"39,800",Yes,fixed,,Nil,Nil,31-May-2022 05:00 PM,09-Jun-2022 11:30 AM,31-May-2022 05:00 PM,08-Jun-2022 05:00 PM,NA ,NA ,31-May-2022 05:00 PM,08-Jun-2022 05:00 PM,15-Jun-2022 03:05 PM,AOC
2.0,285914.0,GOVT CONTRACTOR,08-Jun-2022 02:44 PM,Rejected-AOC,accept,13-Jul-2022 06:49 PM,,,,,,,,,,,,,,,,,,,,,,,,,,,,,,,,,,,,,,,,,AOC,,,.pdf,Certificate of Registration with JSV (IPH) Department in appropriate class and latest renewal th,2.0,ICICI NEFT/RTGS,,,,,,,,,,,,,,,,,,,,,,,,,,,,,,,,,,,,,,,,,,,,,,,,,,,,,,AOC
3.0,285774.0,P C Construction,07-Jun-2022 06:33 PM,Rejected-AOC,accept,13-Jul-2022 06:49 PM,,,,,,,,,,,,,,,,,,,,,,,,,,,,,,,,,,,,,,,,,AOC,,,.pdf,Income Tax and GST registration and latest clearance certificate thereof,,,,,,,,,,,,,,,,,,,,,,,,,,,,,,,,,,,,,,,,,,,,,,,,,,,,,,,,AOC
4.0,285797.0,Saurabh Vasudeva,07-Jun-2022 06:48 PM,Accepted-AOC,accept,13-Jul-2022 06:49 PM,,,,,,,,,,,,,,,,,,,,,,,,,,,,,,,,,,,,,,,,,AOC,,,.pdf,The list of similar nature work done/ completed /work in progress with performance certificate d,,,,,,,,,,,,,,,,,,,,,,,,,,,,,,,,,,,,,,,,,,,,,,,,,,,,,,,,AOC
,,,,,,,,,,,,,,,,,,,,,,,,,,,,,,,,,,,,,,,,,,,,,,,AOC,,,.pdf,Registration copy of EPF,,,,,,,,,,,,,,,,,,,,,,,,,,,,,,,,,,,,,,,,,,,,,,,,,,,,,,,,AOC
,,,,,,,,,,,,,,,,,,,,,,,,,,,,,,,,,,,,,,,,,,,,,,,AOC,,,.pdf,An affidavit that any Government/Semi Government/Board/Corporation/ Private Organization etc h,,,,,,,,,,,,,,,,,,,,,,,,,,,,,,,,,,,,,,,,,,,,,,,,,,,,,,,,AOC
,,,,,,,,,,,,,,,,,,,,,,,,,,,,,,,,,,,,,,,,,,,,,,,AOC,,,.pdf,Copy of authorization DSC be uploaded,,,,,,,,,,,,,,,,,,,,,,,,,,,,,,,,,,,,,,,,,,,,,,,,,,,,,,,,AOC
,,,,,,,,,,,,,,,,,,,,,,,,,,,,,,,,,,,,,,,,,,,,,,,AOC,,,.pdf,Other conditions as per terms and conditions folder be required,,,,,,,,,,,,,,,,,,,,,,,,,,,,,,,,,,,,,,,,,,,,,,,,,,,,,,,,AOC
,,,,,,,,,,,,,,,,,,,,,,,,,,,,,,,,,,,,,,,,,,,,,,,AOC,2.0,Finance,.xls,BOQ,,,,,,,,,,,,,,,,,,,,,,,,,,,,,,,,,,,,,,,,,,,,,,,,,,,,,,,,AOC
