Cover No,Cover,Document Type,Description,Organisation Chain,Tender Reference Number,Tender ID,Withdrawal Allowed,Tender Type,Form of contract,Tender Category,No. of Covers,General Technical Evaluation Allowed,ItemWise Technical Evaluation Allowed,Payment Mode,Is Multi Currency Allowed For BOQ,Is Multi Currency Allowed For Fee,Allow Two Stage Bidding,Tender Fee in ₹,Fee Payable To,Fee Payable At,Tender Fee Exemption Allowed,EMD Amount in ₹,EMD Exemption Allowed,EMD Fee Type,EMD Percentage,EMD Payable To,EMD Payable At,S.No,Bank Name,Publish Date,Bid Opening Date,Document Download / Sale Start Date,Document Download / Sale End Date,Clarification Start Date,Clarification End Date,Bid Submission Start Date,Bid Submission End Date,Financial Bid Opening Date,Name,Address,Title,Work Description,Pre Qualification Details,Independent External Monitor/Remarks,Tender Value in ₹,Product Category,Sub category,Contract Type,Bid Validity(Days),Period Of Work(Days),Location,Pincode,Pre Bid Meeting Place,Pre Bid Meeting Address,Pre Bid Meeting Date,Bid Opening Place,Should Allow NDA Tender,Allow Preferential Bidder,Tender Stage,Type :,Summary :,Updated By :,Updated On :,Document :,BOQ Comparative Chart :,S.No,Bid Number,Bidder Name,Submitted Date,Status,Remarks,Status Updated On,Type :.1,Summary :.1,Updated By :.1,Updated On :.1,Document :.1,Committee Chairperson/Co-ordinator Name :,Committee Chairperson/Co-ordinator Type :,Committee Members :,Updated By :.2,Updated On :.2,Financial Bid Opening Date:,Document :.2,S.No.1,Bid Number.1,Bidder Name.1,Awarded Currency,Awarded Value,Contract Date :,Contract Value :,Work Completion Period in days :,Updated By :.3,Updated on :,AOC document :,AOC Description :,Organisation Chain :,Tender ID :,Tender Ref No :,Tender Title :,Committee Chairperson/Co-ordinator Name :.1,Committee Chairperson/Co-ordinator Type :.1,Committee Members :.1,Updated By :.4,Updated on :.1,Document :.3,Tender Stage
1.0,Fee/PreQual/Technical,.pdf,Appropriate Contractor registration (as per tender condition),HP SIDC Limited,Job No. 10,2022_SIDC_60580_1,Yes,Open Tender,Item Rate,Works,2.0,No,No,Online,No,No,No,"1,300",Nil,Nil,No,"22,200",No,fixed,,Nil,Nil,1.0,ICICI BANK,13-May-2022 11:00 AM,21-May-2022 11:00 AM,13-May-2022 11:00 AM,20-May-2022 05:00 PM,NA ,NA ,13-May-2022 11:00 AM,20-May-2022 05:00 PM,07-Jun-2022 11:00 AM,Executive Engineer,HPSIDC Shimla,"Construction of Pucca path from Trilokpur Road to Kumar Steelways (P) Ltd. at Kala Amb, Distt. Sirmour (HP).","Construction of Pucca path from Trilokpur Road to Kumar Steelways (P) Ltd. at Kala Amb, Distt. Sirmour (HP).",Please refer Tender documents. ,NA ,"11,11,377",Civil Works,NA ,Tender,120.0,90.0,Kala Amb,173030.0,NA ,NA ,NA ,HPSIDC Shimla,No ,No,AOC,Finance,Financial summary,Sushant Singh Negi,17-Jun-2022 03:15 PM,finance_91498.pdf,BOQ Comparative Chart,1.0,283100.0,ANIL KUMAR,20-May-2022 02:27 PM,Accepted-AOC,AOC,06-Jul-2022 04:19 PM,Technical,Technical summary,Sushant Singh Negi,06-Jun-2022 04:05 PM,technical_91498.pdf,EE,Internal,"DM, Manager(F), AE(HQ)",Sushant Singh Negi,06-Jun-2022 04:07 PM,07-Jun-2022 11:00 AM,techsummary_91498.pdf (532.06 KB),1.0,283100.0,ANIL KUMAR,INR,"740,160",06-Jul-2022,"INR 740,160",90.0,Sushant Singh Negi,06-Jul-2022 04:19 PM,steelway.pdf (1613.00 KB),Award letter,HP SIDC Limited,2022_SIDC_60580_1,Job No. 10,"Construction of Pucca path from Trilokpur Road to Kumar Steelways (P) Ltd. at Kala Amb, Distt. Sirmour (HP).",EE,Internal,"DM, Manager(F), AE(HQ)",Sushant Singh Negi,17-Jun-2022 03:20 PM,finsummary_91498.pdf (30.57 KB),AOC
,,.pdf,Signed copy of agreement form and approved make for materials,,,,,,,,,,,,,,,,,,,,,,,,,2.0,ICICI NEFT/RTGS,,,,,,,,,,,,,,,,,,,,,,,,,,,,,,AOC,,,,,,,2.0,283127.0,GIAN CHAND,20-May-2022 04:26 PM,Rejected-Finance,Second lowest bidder,17-Jun-2022 03:20 PM,,,,,,,,,,,,,,,,,,,,,,,,,,,,,,,,,,,AOC
,,.pdf,Affidavit that the information furnished with the bid documents is true and correct.,,,,,,,,,,,,,,,,,,,,,,,,,,,,,,,,,,,,,,,,,,,,,,,,,,,,,,,,AOC,,,,,,,3.0,282761.0,Jai Parkash,19-May-2022 06:49 PM,Rejected-Finance,Third lowest bidder,17-Jun-2022 03:20 PM,,,,,,,,,,,,,,,,,,,,,,,,,,,,,,,,,,,AOC
,,.pdf,Affidavit that you have not more than 2 works in hand each of Rs.100 lakh or above in any department,,,,,,,,,,,,,,,,,,,,,,,,,,,,,,,,,,,,,,,,,,,,,,,,,,,,,,,,AOC,,,,,,,4.0,283080.0,Mohan Singh,20-May-2022 01:42 PM,Rejected-Finance,Fourth lowest bidder,17-Jun-2022 03:20 PM,,,,,,,,,,,,,,,,,,,,,,,,,,,,,,,,,,,AOC
,,.pdf,Proof copy of EPF registration No.,,,,,,,,,,,,,,,,,,,,,,,,,,,,,,,,,,,,,,,,,,,,,,,,,,,,,,,,AOC,,,,,,,,,,,,,,,,,,,,,,,,,,,,,,,,,,,,,,,,,,,,,,,,AOC
,,.pdf,Proof copy of GST registration No.,,,,,,,,,,,,,,,,,,,,,,,,,,,,,,,,,,,,,,,,,,,,,,,,,,,,,,,,AOC,,,,,,,,,,,,,,,,,,,,,,,,,,,,,,,,,,,,,,,,,,,,,,,,AOC
,,.pdf,Copy of latest ITR and pan card,,,,,,,,,,,,,,,,,,,,,,,,,,,,,,,,,,,,,,,,,,,,,,,,,,,,,,,,AOC,,,,,,,,,,,,,,,,,,,,,,,,,,,,,,,,,,,,,,,,,,,,,,,,AOC
,,.pdf,Copy of receipt of EMD and cost of form,,,,,,,,,,,,,,,,,,,,,,,,,,,,,,,,,,,,,,,,,,,,,,,,,,,,,,,,AOC,,,,,,,,,,,,,,,,,,,,,,,,,,,,,,,,,,,,,,,,,,,,,,,,AOC
2.0,Finance,.xls,BOQ,,,,,,,,,,,,,,,,,,,,,,,,,,,,,,,,,,,,,,,,,,,,,,,,,,,,,,,,AOC,,,,,,,,,,,,,,,,,,,,,,,,,,,,,,,,,,,,,,,,,,,,,,,,AOC
