Contract Date :,Contract Value :,Work Completion Period in days :,Updated By :,Updated on :,AOC document :,AOC Description :,Committee Chairperson/Co-ordinator Name :,Committee Chairperson/Co-ordinator Type :,Committee Members :,Updated By :.1,Updated on :.1,Document :,Committee Chairperson/Co-ordinator Name :.1,Committee Chairperson/Co-ordinator Type :.1,Committee Members :.1,Updated By :.2,Updated On :,Financial Bid Opening Date:,Document :.1,Organisation Chain :,Tender ID :,Tender Ref No :,Tender Title :,Type :,Summary :,Updated By :.3,Updated On :.1,Document :.2,S.No,Bid Number,Bidder Name,Submitted Date,Status,Remarks,Status Updated On,Type :.1,Summary :.1,Updated By :.4,Updated On :.2,Document :.3,BOQ Comparative Chart :,S.No.1,Bid Number.1,Bidder Name.1,Awarded Currency,Awarded Value,Tender Stage,Title,Work Description,Pre Qualification Details,Independent External Monitor/Remarks,Tender Value in ₹,Product Category,Sub category,Contract Type,Bid Validity(Days),Period Of Work(Days),Location,Pincode,Pre Bid Meeting Place,Pre Bid Meeting Address,Pre Bid Meeting Date,Bid Opening Place,Should Allow NDA Tender,Allow Preferential Bidder,Cover No,Cover,Document Type,Description,Publish Date,Bid Opening Date,Document Download / Sale Start Date,Document Download / Sale End Date,Clarification Start Date,Clarification End Date,Bid Submission Start Date,Bid Submission End Date,Financial Bid Opening Date,Name,Address,EMD Amount in ₹,EMD Exemption Allowed,EMD Fee Type,EMD Percentage,EMD Payable To,EMD Payable At,Tender Fee in ₹,Fee Payable To,Fee Payable At,Tender Fee Exemption Allowed,Organisation Chain,Tender Reference Number,Tender ID,Withdrawal Allowed,Tender Type,Form of contract,Tender Category,No. of Covers,General Technical Evaluation Allowed,ItemWise Technical Evaluation Allowed,Payment Mode,Is Multi Currency Allowed For BOQ,Is Multi Currency Allowed For Fee,Allow Two Stage Bidding,S.No,Bank Name,Tender Stage
19-Jul-2022,"INR 2,409,057",60.0,Jeet Singh Thakur,19-Jul-2022 07:31 PM,10.3350.pdf (659.00 KB),"Improvement and widening of Shahpur Sihunta Chowari Jot Chamba road Km. 76/0 to 87/0 (SH P/L Bituminous concrete in extended width between Km. 80/0 to 81/0, 82/0 to 87/0)",EE,Internal,Assistant engineer superintendent and senior assistant,Jeet Singh Thakur,07-Jul-2022 05:00 PM,finsummary_91162.pdf (101.57 KB),EE,Internal,Assistant Engineer Superintendent and Senior Assistant,Jeet Singh Thakur,18-May-2022 05:09 PM,23-May-2022 11:30 AM,techsummary_91162.pdf (233.94 KB),PWD,2022_PWD_60323_1,NO.PWC-WA-II 1603-702 dated 28.4.2022,"Improvement and widening of Shahpur Sihunta Chowari Jot Chamba road Km. 76/0 to 87/0 (SH P/L Bituminous concrete in extended width between Km. 80/0 to 81/0, 82/0 to 87/0)",Technical,BOS,Jeet Singh Thakur,18-May-2022 05:05 PM,technical_91162.pdf,1.0,281886.0,VP SHARMA,12-May-2022 12:36 PM,Rejected-Finance,2nd lowest,07-Jul-2022 05:00 PM,Finance,BOS,Jeet Singh Thakur,07-Jul-2022 04:53 PM,finance_91162.pdf,BOQ Comparative Chart,1.0,281643.0,Yashpal,INR,"2,363,038",AOC,"Improvement and widening of Shahpur Sihunta Chowari Jot Chamba road Km. 76/0 to 87/0 (SH P/L Bituminous concrete in extended width between Km. 80/0 to 81/0, 82/0 to 87/0)","Improvement and widening of Shahpur Sihunta Chowari Jot Chamba road Km. 76/0 to 87/0 (SH P/L Bituminous concrete in extended width between Km. 80/0 to 81/0, 82/0 to 87/0)",Please refer Tender documents. ,NA ,"24,09,057",Civil Works,NA ,Tender,75.0,60.0,chamba,176310.0,NA ,NA ,NA ,Executive Engineer Chamba Division HPPWD Chamba,No ,No,1.0,Fee/PreQual/Technical,.pdf,Cost of Tender Form only online mode through e-payment,05-May-2022 05:00 PM,13-May-2022 11:30 AM,05-May-2022 05:00 PM,12-May-2022 05:00 PM,NA ,NA ,05-May-2022 05:00 PM,12-May-2022 05:00 PM,23-May-2022 11:30 AM,Executive Engineer Chamba Division HPPWD Chamba,Executive Engineer Chamba Division HPPWD Chamba,"48,200",No,fixed,,Nil,Nil,500.0,Nil,Nil,No,PWD,NO.PWC-WA-II 1603-702 dated 28.4.2022,2022_PWD_60323_1,Yes,Open Tender,Item Rate,Works,2.0,No,No,Online,No,No,No,1.0,ICICI BANK,AOC
,,,,,,,,,,,,,,,,,,,,,,,,,,,,,2.0,281643.0,Yashpal,12-May-2022 01:27 PM,Accepted-AOC,Work awarded/completed,19-Jul-2022 07:31 PM,,,,,,,,,,,,AOC,,,,,,,,,,,,,,,,,,,,,.pdf,Earnest Money only online mode through e-payment,,,,,,,,,,,,,,,,,,,,,,,,,,,,,,,,,,,,2.0,ICICI NEFT/RTGS,AOC
,,,,,,,,,,,,,,,,,,,,,,,,,,,,,,,,,,,,,,,,,,,,,,,AOC,,,,,,,,,,,,,,,,,,,,,.pdf,Contractors Registration ( Refer General Rule No.24.3 and as per invitation of bid ),,,,,,,,,,,,,,,,,,,,,,,,,,,,,,,,,,,,,,AOC
,,,,,,,,,,,,,,,,,,,,,,,,,,,,,,,,,,,,,,,,,,,,,,,AOC,,,,,,,,,,,,,,,,,,,,,.pdf,Copy of G.S.T. No.,,,,,,,,,,,,,,,,,,,,,,,,,,,,,,,,,,,,,,AOC
,,,,,,,,,,,,,,,,,,,,,,,,,,,,,,,,,,,,,,,,,,,,,,,AOC,,,,,,,,,,,,,,,,,,,,,.pdf,Copy of PAN No.,,,,,,,,,,,,,,,,,,,,,,,,,,,,,,,,,,,,,,AOC
,,,,,,,,,,,,,,,,,,,,,,,,,,,,,,,,,,,,,,,,,,,,,,,AOC,,,,,,,,,,,,,,,,,,,,,.pdf,"Form HPPWD 7/8,duly signed by the contractor",,,,,,,,,,,,,,,,,,,,,,,,,,,,,,,,,,,,,,AOC
,,,,,,,,,,,,,,,,,,,,,,,,,,,,,,,,,,,,,,,,,,,,,,,AOC,,,,,,,,,,,,,,,,,,,,,.pdf,An affidavit/undertaking that information furnished with the bid is correct in all respect.,,,,,,,,,,,,,,,,,,,,,,,,,,,,,,,,,,,,,,AOC
,,,,,,,,,,,,,,,,,,,,,,,,,,,,,,,,,,,,,,,,,,,,,,,AOC,,,,,,,,,,,,,,,,,,,,,.pdf,"Own Mini Hot Mix Plant, Paver Finisher and road Roller documentary proof",,,,,,,,,,,,,,,,,,,,,,,,,,,,,,,,,,,,,,AOC
,,,,,,,,,,,,,,,,,,,,,,,,,,,,,,,,,,,,,,,,,,,,,,,AOC,,,,,,,,,,,,,,,,,,,,,.pdf,List of technical staff,,,,,,,,,,,,,,,,,,,,,,,,,,,,,,,,,,,,,,AOC
,,,,,,,,,,,,,,,,,,,,,,,,,,,,,,,,,,,,,,,,,,,,,,,AOC,,,,,,,,,,,,,,,,,,,,,.pdf,Work done at least one similar work of forty percent of the estimated value of work (without L.D.),,,,,,,,,,,,,,,,,,,,,,,,,,,,,,,,,,,,,,AOC
,,,,,,,,,,,,,,,,,,,,,,,,,,,,,,,,,,,,,,,,,,,,,,,AOC,,,,,,,,,,,,,,,,,,,2.0,Finance,.xls,BOQ,,,,,,,,,,,,,,,,,,,,,,,,,,,,,,,,,,,,,,AOC
