Publish Date,Bid Opening Date,Document Download / Sale Start Date,Document Download / Sale End Date,Clarification Start Date,Clarification End Date,Bid Submission Start Date,Bid Submission End Date,Financial Bid Opening Date,Name,Address,Cover No,Cover,Document Type,Description,S.No,Bank Name,Title,Work Description,Pre Qualification Details,Independent External Monitor/Remarks,Tender Value in ₹,Product Category,Sub category,Contract Type,Bid Validity(Days),Period Of Work(Days),Location,Pincode,Pre Bid Meeting Place,Pre Bid Meeting Address,Pre Bid Meeting Date,Bid Opening Place,Should Allow NDA Tender,Allow Preferential Bidder,EMD Amount in ₹,EMD Exemption Allowed,EMD Fee Type,EMD Percentage,EMD Payable To,EMD Payable At,S.No.1,Corrigendum Title,Corrigendum Type,View,Organisation Chain,Tender Reference Number,Tender ID,Withdrawal Allowed,Tender Type,Form of contract,Tender Category,No. of Covers,General Technical Evaluation Allowed,ItemWise Technical Evaluation Allowed,Payment Mode,Is Multi Currency Allowed For BOQ,Is Multi Currency Allowed For Fee,Allow Two Stage Bidding,Tender Fee in ₹,Fee Payable To,Fee Payable At,Tender Fee Exemption Allowed,Tender Stage,Committee Chairperson/Co-ordinator Name :,Committee Chairperson/Co-ordinator Type :,Committee Members :,Updated By :,Updated on :,Document :,S.No,Bid Number,Bidder Name,Awarded Currency,Awarded Value,Organisation Chain :,Tender ID :,Tender Ref No :,Tender Title :,Committee Chairperson/Co-ordinator Name :.1,Committee Chairperson/Co-ordinator Type :.1,Committee Members :.1,Updated By :.1,Updated On :,Financial Bid Opening Date:,Document :.1,S.No.1,Bid Number.1,Bidder Name.1,Submitted Date,Status,Remarks,Status Updated On,Contract Date :,Contract Value :,Work Completion Period in days :,Updated By :.2,Updated on :.1,AOC document :,AOC Description :,Type :,Summary :,Updated By :.3,Updated On :.1,Document :.2,BOQ Comparative Chart :,Type :.1,Summary :.1,Updated By :.4,Updated On :.2,Document :.3,Tender Stage
03-Mar-2022 11:00 AM,29-Mar-2022 11:30 AM,03-Mar-2022 11:30 AM,28-Mar-2022 11:30 AM,NA ,NA ,03-Mar-2022 11:30 AM,28-Mar-2022 11:30 AM,08-Apr-2022 02:30 PM,Chief Engineer OP South,"O/o Chief Engineer Op South , HPSEBL Shimla-04",1.0,Fee,.pdf,Scanned copy of EMD Submitted online,1.0,ICICI BANK,CEO/MC/T. No.10/SOP -Kashang (HEP)/ 2021-22,Providing SOP to Kashang HEP stage-II III by strengthening/re-routing of existing 22KV Lippa- Asrang spur line from 6-pole str. at Spillow to village Lapo (Lippa) by providing 2X 630KVA S/stn a/w allied accessories and C/o 9 pole Structure to facili,Please refer Tender documents. ,NA ,"1,52,86,023",Supply and Erection,NA ,Tender,180.0,180.0,"Pooh, Kinnaur",172111.0,NA ,NA ,NA ,o/o CE OP South Shimla-04,No ,No,"1,52,860",No,fixed,,Nil,Nil,1.0,Extension of dates,Date,,HPSEBL||CE(OP) South,CEO/MC/T. No.10/SOP -Kashang (HEP)/ 2021-22,2022_HPSEB_57218_1,Yes,Open Tender,Item Rate,Services,3.0,No,No,Online,No,No,No,"2,000",Nil,Nil,No,AOC,Er G.C Shandilya,Internal,SE W Rajesh Chandla AO FA Yuvraj Negi,Sushma Verma,11-May-2022 11:29 AM,finsummary_86377.pdf (365.21 KB),1.0,269130.0,H S Traders,INR,"12,830,624",HPSEBL||CE(OP) South,2022_HPSEB_57218_1,CEO/MC/T. No.10/SOP -Kashang (HEP)/ 2021-22,CEO/MC/T. No.10/SOP -Kashang (HEP)/ 2021-22,ER Rajesh Chandla,Internal,AE W AE MC AAO FA,Sushma Verma,08-Apr-2022 02:21 PM,08-Apr-2022 02:30 PM,techsummary_86377.pdf (161.36 KB),1.0,269130.0,H S Traders,19-Mar-2022 09:03 PM,Accepted-AOC,L-I bidder,29-Jul-2022 11:33 AM,28-Jun-2022,"INR 12,830,624",180.0,Sushma Verma,29-Jul-2022 11:33 AM,AOCKASHANG.pdf (835.00 KB),Tender for Providing SOP to Kashang HEP stage-II and III by strengthening/re-routing of existing 22KV Lippa- Asrang spur line from 6- pole str. at Spillow to village Lapo Lippa,Finance,The price bid of both the participants bidder was downloaded successfully and M/s H.S Traders was found L-I bidder,Sushma Verma,08-Apr-2022 03:04 PM,finance_86377.pdf,BOQ Comparative Chart,Technical,The Techno Commercial bids of the all three firms were downloaded successfully and validity is subject to further scrutiny by the committee,Sushma Verma,29-Mar-2022 12:28 PM,technical_86377.pdf,AOC
,,,,,,,,,,,,,.pdf,Scanned copy of Tender Fee Submitted online,2.0,ICICI NEFT/RTGS,,,,,,,,,,,,,,,,,,,,,,,,,,,,,,,,,,,,,,,,,,,,,,,AOC,,,,,,,,,,,,,,,,,,,,,,,2.0,272933.0,Nikum Energy Control India Ltd,28-Mar-2022 12:04 AM,Rejected-Technical,Bid Documents NOT found in order as per techno Commerical Conditions,08-Apr-2022 02:21 PM,,,,,,,,,,,,,,,,,,,AOC
,,,,,,,,,,,2.0,PreQual/Technical,.xls,Duly filled Techno Commercial Checklist,,,,,,,,,,,,,,,,,,,,,,,,,,,,,,,,,,,,,,,,,,,,,,,,,AOC,,,,,,,,,,,,,,,,,,,,,,,3.0,268887.0,VINAY ENTERPRISES,20-Mar-2022 07:17 AM,Rejected-AOC,L-II bidder,29-Jul-2022 11:33 AM,,,,,,,,,,,,,,,,,,,AOC
,,,,,,,,,,,,,.pdf,Technical documents as per Checklist,,,,,,,,,,,,,,,,,,,,,,,,,,,,,,,,,,,,,,,,,,,,,,,,,AOC,,,,,,,,,,,,,,,,,,,,,,,,,,,,,,,,,,,,,,,,,,,,,,,,AOC
,,,,,,,,,,,,,.pdf,Commercial documents as per Checklist,,,,,,,,,,,,,,,,,,,,,,,,,,,,,,,,,,,,,,,,,,,,,,,,,AOC,,,,,,,,,,,,,,,,,,,,,,,,,,,,,,,,,,,,,,,,,,,,,,,,AOC
,,,,,,,,,,,,,.pdf,Any other Document,,,,,,,,,,,,,,,,,,,,,,,,,,,,,,,,,,,,,,,,,,,,,,,,,AOC,,,,,,,,,,,,,,,,,,,,,,,,,,,,,,,,,,,,,,,,,,,,,,,,AOC
,,,,,,,,,,,3.0,Finance,.xls,Duly Filled Price Bid/ BOQ,,,,,,,,,,,,,,,,,,,,,,,,,,,,,,,,,,,,,,,,,,,,,,,,,AOC,,,,,,,,,,,,,,,,,,,,,,,,,,,,,,,,,,,,,,,,,,,,,,,,AOC
