S.No,Bank Name,Organisation Chain,Tender Reference Number,Tender ID,Withdrawal Allowed,Tender Type,Form of contract,Tender Category,No. of Covers,General Technical Evaluation Allowed,ItemWise Technical Evaluation Allowed,Payment Mode,Is Multi Currency Allowed For BOQ,Is Multi Currency Allowed For Fee,Allow Two Stage Bidding,Publish Date,Bid Opening Date,Document Download / Sale Start Date,Document Download / Sale End Date,Clarification Start Date,Clarification End Date,Bid Submission Start Date,Bid Submission End Date,Financial Bid Opening Date,Tender Fee in ₹,Fee Payable To,Fee Payable At,Tender Fee Exemption Allowed,Title,Work Description,Pre Qualification Details,Independent External Monitor/Remarks,Tender Value in ₹,Product Category,Sub category,Contract Type,Bid Validity(Days),Period Of Work(Days),Location,Pincode,Pre Bid Meeting Place,Pre Bid Meeting Address,Pre Bid Meeting Date,Bid Opening Place,Should Allow NDA Tender,Allow Preferential Bidder,EMD Amount in ₹,EMD Exemption Allowed,EMD Fee Type,EMD Percentage,EMD Payable To,EMD Payable At,Name,Address,Cover No,Cover,Document Type,Description,Tender Stage,Committee Chairperson/Co-ordinator Name :,Committee Chairperson/Co-ordinator Type :,Committee Members :,Updated By :,Updated On :,Financial Bid Opening Date:,Document :,S.No,Bid Number,Bidder Name,Submitted Date,Status,Remarks,Status Updated On,Type :,Summary :,Updated By :.1,Updated On :.1,Document :.1,BOQ Comparative Chart :,Type :.1,Summary :.1,Updated By :.2,Updated On :.2,Document :.2,Contract Date :,Contract Value :,Work Completion Period in days :,Updated By :.3,Updated on :,AOC document :,AOC Description :,Committee Chairperson/Co-ordinator Name :.1,Committee Chairperson/Co-ordinator Type :.1,Committee Members :.1,Updated By :.4,Updated on :.1,Document :.3,Organisation Chain :,Tender ID :,Tender Ref No :,Tender Title :,S.No.1,Bid Number.1,Bidder Name.1,Awarded Currency,Awarded Value,Tender Stage
1.0,ICICI BANK,HPSEBL||CE(OP) South||SE(OP) Solan,01-2022-23,2023_HPSEB_69647_1,Yes,Open Tender,Turn-key,Works,2.0,No,No,Online,No,No,No,25-Feb-2023 10:00 AM,06-Mar-2023 11:00 AM,25-Feb-2023 10:05 AM,04-Mar-2023 04:00 PM,25-Feb-2023 10:10 AM ,26-Feb-2023 12:00 PM ,26-Feb-2023 12:05 PM,04-Mar-2023 04:00 PM,06-Mar-2023 04:30 PM,590.0,Nil,Nil,No,01-2022-23,E Tendering on partial turnkey basis for shifting of four pole structures to maintained mandatory clearance of 11KV HT Line at Dharampur Block Building construction Site in Electrical Section 2 Dharampur under ESD HPSEBL Dharampur,A-Class Electrical License with Chief Electrical Inspector Shimla ,NA ,"1,91,082",Electrical Works,HT ,Tender,180.0,90.0,Parwanoo,173220.0,NA ,NA ,NA ,"ED, Parwanoo",No ,No,"1,911",No,percentage,1.0%,Nil,Nil,Sr.Executive Engineer,"Electrical Division, HPSEBL, Parwnoo, Sector-I, Parwanoo",1.0,Fee/PreQual/Technical,.pdf,Proof of EMD and Tender Fee,AOC,Sr. Executive Engineer,Internal,Committee Members Uploaded,Vikas Gupta,06-Mar-2023 03:59 PM,06-Mar-2023 04:30 PM,techsummary_105073.pdf (321.32 KB),1.0,331522.0,Aman Electrical,04-Mar-2023 12:23 PM,Rejected-Finance,Rejected,16-Mar-2023 12:33 PM,Finance,Price BID Downloaded successfully,Vikas Gupta,06-Mar-2023 04:43 PM,finance_105073.pdf,BOQ Comparative Chart,Technical,Technical Document has been downloaded successfully,Vikas Gupta,06-Mar-2023 11:27 AM,None,16-Mar-2023,"INR 143,331",90.0,Vikas Gupta,16-Mar-2023 12:41 PM,Award-01.pdf (2752.00 KB),Detail Award uploaded,Sr. Executive Engineer,Internal,Committee Members detail uploaded,Vikas Gupta,16-Mar-2023 12:33 PM,finsummary_105073.pdf (315.02 KB),HPSEBL||CE(OP) South||SE(OP) Solan,2023_HPSEB_69647_1,01-2022-23,01-2022-23,1.0,331210.0,Srishti Enterprises,INR,"143,331",AOC
2.0,ICICI NEFT/RTGS,,,,,,,,,,,,,,,,,,,,,,,,,,,,,,,,,,,,,,,,,,,,,,,,,,,,,,,,.pdf,A-Class Electrical License with Chief Electrical Inspector Shimla,AOC,,,,,,,,2.0,331166.0,M/S Lal Singh,03-Mar-2023 01:39 PM,Rejected-Finance,Rejected,16-Mar-2023 12:33 PM,,,,,,,,,,,,,,,,,,,,,,,,,,,,,,,,,,AOC
,,,,,,,,,,,,,,,,,,,,,,,,,,,,,,,,,,,,,,,,,,,,,,,,,,,,,,,,,.pdf,Bid Capacity/Turnover certificate with CA Certified (Balance Sheets and ITR not Mandatory),AOC,,,,,,,,3.0,331470.0,M/S RAVINDER PAL SINGH,04-Mar-2023 11:13 AM,Rejected-Finance,Rejected,16-Mar-2023 12:33 PM,,,,,,,,,,,,,,,,,,,,,,,,,,,,,,,,,,AOC
,,,,,,,,,,,,,,,,,,,,,,,,,,,,,,,,,,,,,,,,,,,,,,,,,,,,,,,,,.pdf,GST NO. and Pan Card,AOC,,,,,,,,4.0,330309.0,M/S UPINDER PAL SINGH,03-Mar-2023 02:54 PM,Rejected-Finance,Rejected,16-Mar-2023 12:33 PM,,,,,,,,,,,,,,,,,,,,,,,,,,,,,,,,,,AOC
,,,,,,,,,,,,,,,,,,,,,,,,,,,,,,,,,,,,,,,,,,,,,,,,,,,,,,,,,.pdf,"Work Done Certificate/completion certificate as per SBD Volume-I, Section-III, Clause No. 1.0",AOC,,,,,,,,5.0,330857.0,Prabhat Singh,02-Mar-2023 07:49 PM,Rejected-Finance,Rejected,16-Mar-2023 12:33 PM,,,,,,,,,,,,,,,,,,,,,,,,,,,,,,,,,,AOC
,,,,,,,,,,,,,,,,,,,,,,,,,,,,,,,,,,,,,,,,,,,,,,,,,,,,,,,,,.pdf,Affidavit for Blacklisting/change of ownership/litigation,AOC,,,,,,,,6.0,330959.0,Sai Bholey Consultancy,02-Mar-2023 05:57 PM,Rejected-Finance,Rejected,16-Mar-2023 12:33 PM,,,,,,,,,,,,,,,,,,,,,,,,,,,,,,,,,,AOC
,,,,,,,,,,,,,,,,,,,,,,,,,,,,,,,,,,,,,,,,,,,,,,,,,,,,,,,,,.pdf,EPFO/ESI No.,AOC,,,,,,,,7.0,330649.0,Sh. Jai Prakash,02-Mar-2023 04:52 PM,Rejected-Finance,Rejected,16-Mar-2023 12:33 PM,,,,,,,,,,,,,,,,,,,,,,,,,,,,,,,,,,AOC
,,,,,,,,,,,,,,,,,,,,,,,,,,,,,,,,,,,,,,,,,,,,,,,,,,,,,,,,,.pdf,Joint Venture if applicable,AOC,,,,,,,,8.0,331210.0,Srishti Enterprises,03-Mar-2023 04:03 PM,Accepted-AOC,Accepted L1,16-Mar-2023 12:44 PM,,,,,,,,,,,,,,,,,,,,,,,,,,,,,,,,,,AOC
,,,,,,,,,,,,,,,,,,,,,,,,,,,,,,,,,,,,,,,,,,,,,,,,,,,,,,,2.0,Finance,.xls,Price BID,AOC,,,,,,,,,,,,,,,,,,,,,,,,,,,,,,,,,,,,,,,,,,,,,,,,AOC
