Type :,Summary :,Updated By :,Updated On :,Document :,S.No,Bid Number,Bidder Name,Submitted Date,Status,Remarks,Status Updated On,S.No.1,Bid Number.1,Bidder Name.1,Awarded Currency,Awarded Value,Type :.1,Summary :.1,Updated By :.1,Updated On :.1,Document :.1,BOQ Comparative Chart :,Committee Chairperson/Co-ordinator Name :,Committee Chairperson/Co-ordinator Type :,Committee Members :,Updated By :.2,Updated on :,Document :.2,Contract Date :,Contract Value :,Work Completion Period in days :,Updated By :.3,Updated on :.1,AOC document :,AOC Description :,Organisation Chain :,Tender ID :,Tender Ref No :,Tender Title :,Committee Chairperson/Co-ordinator Name :.1,Committee Chairperson/Co-ordinator Type :.1,Committee Members :.1,Updated By :.4,Updated On :.2,Financial Bid Opening Date:,Document :.3,S.No.2,Instrument Type,Organisation Chain,Tender Reference Number,Tender ID,Withdrawal Allowed,Tender Type,Form of contract,Tender Category,No. of Covers,General Technical Evaluation Allowed,ItemWise Technical Evaluation Allowed,Payment Mode,Is Multi Currency Allowed For BOQ,Is Multi Currency Allowed For Fee,Allow Two Stage Bidding,Title,Work Description,Pre Qualification Details,Independent External Monitor/Remarks,Tender Value in ₹,Product Category,Sub category,Contract Type,Bid Validity(Days),Period Of Work(Days),Location,Pincode,Pre Bid Meeting Place,Pre Bid Meeting Address,Pre Bid Meeting Date,Bid Opening Place,Should Allow NDA Tender,Allow Preferential Bidder,Cover No,Cover,Document Type,Description,Publish Date,Bid Opening Date,Document Download / Sale Start Date,Document Download / Sale End Date,Clarification Start Date,Clarification End Date,Bid Submission Start Date,Bid Submission End Date,Financial Bid Opening Date,Name,Address,EMD Amount in ₹,EMD Exemption Allowed,EMD Fee Type,EMD Percentage,EMD Payable To,EMD Payable At,Tender Fee in ₹,Fee Payable To,Fee Payable At,Tender Fee Exemption Allowed
Technical,All the documents have been downloaded successfully,Dinesh Kumar Sen,28-Oct-2022 01:05 PM,technical_99571.pdf,1.0,307857.0,RIPAN KUMAR,11-Oct-2022 02:11 PM,Accepted-AOC,"Due to L-1, work awarded to lowest Contractor",03-Aug-2023,1.0,307857.0,RIPAN KUMAR,INR,"12,370,517",Finance,BOQ downloaded successfully,Ashok Kumar Negi,28-Oct-2022 01:35 PM,finance_99571.pdf,BOQ Comparative Chart,Executive Engineer,Internal,All the members of Tender committee,Ashok Kumar Negi,28-Oct-2022 01:47 PM,finsummary_99571.pdf (345.76 KB),14-Mar-2023,"INR 12,370,517",365.0,Dinesh Kumar Sen,03-Aug-2023 03:59 PM,66176_1.pdf (622.00 KB),AOC,PWD,2022_PWD_66176_1,PW-KNR-E-Tender-9695-9705 dated 04-10-2022,Metalling and Tarring of link road to Village Shiaso Km. 0/00 to 5/200 (SH- Providing and laying Grading-III and premix carpet from Km. 0/00 to 4/690,Executive Engineer,Internal,All the members of Tender Committee,Dinesh Kumar Sen,28-Oct-2022 01:17 PM,28-Oct-2022 01:20 PM,techsummary_99571.pdf (345.79 KB),1.0,DD - Demand Draft,PWD,PW-KNR-E-Tender-9695-9705 dated 04-10-2022,2022_PWD_66176_1,Yes,Open Tender,Item Rate,Works,2.0,No,No,Offline,No,No,No,Metalling and Tarring of link road to Village Shiaso Km. 0/00 to 5/200 (SH- Providing and laying Grading-III and premix carpet from Km. 0/00 to 4/690,Metalling and Tarring of link road to Village Shiaso Km. 0/00 to 5/200 (SH- Providing and laying Grading-III and premix carpet from Km. 0/00 to 4/690,Please refer Tender documents. ,NA ,"1,18,45,549",Civil Works - Roads,NA ,Rate Contract,90.0,365.0,Shiaso under Pooh Sub Division,172110.0,NA ,NA ,NA ,O/O E.E. HP.PWD. Division Kalpa,No ,No,1.0,Fee/PreQual/Technical,.pdf,"PWD form 7/8, Copy of Registration, EPF, GST and Pan No.",08-Oct-2022 09:00 AM,15-Oct-2022 11:30 AM,08-Oct-2022 09:00 AM,14-Oct-2022 05:00 PM,NA ,NA ,08-Oct-2022 09:00 AM,14-Oct-2022 05:00 PM,28-Oct-2022 01:20 PM,Executive Engineer,"Executive Engineer, Kalpa Division, HP.PWD. Kalpa","2,37,000",No,fixed,,EE Kalpa Division,Kalpa,"5,000",EE Kalpa Division,Kalpa,No
,,,,,2.0,307948.0,Vikas puri,12-Oct-2022 09:57 PM,Rejected-AOC,Due to L-2,03-Aug-2023,,,,,,,,,,,,,,,,,,,,,,,,,,,,,,,,,,,,2.0,FDR - Fixed Deposit,,,,,,,,,,,,,,,,,,,,,,,,,,,,,,,,,,,.pdf,Cost of Tender in DD and EMD in FDR duly pledged to EE Kalpa,,,,,,,,,,,,,,,,,,,,,
,,,,,,,,,,,,,,,,,,,,,,,,,,,,,,,,,,,,,,,,,,,,,,,,,,,,,,,,,,,,,,,,,,,,,,,,,,,,,,,,,,,.pdf,Work done certificate of similar nature not less than 40 percent of estimated cost,,,,,,,,,,,,,,,,,,,,,
,,,,,,,,,,,,,,,,,,,,,,,,,,,,,,,,,,,,,,,,,,,,,,,,,,,,,,,,,,,,,,,,,,,,,,,,,,,,,,,,,,,.pdf,Work in hand in affidavit.,,,,,,,,,,,,,,,,,,,,,
,,,,,,,,,,,,,,,,,,,,,,,,,,,,,,,,,,,,,,,,,,,,,,,,,,,,,,,,,,,,,,,,,,,,,,,,,,,,,,,,,,,.pdf,Work in hand duly issued from Engineer-in- Charge,,,,,,,,,,,,,,,,,,,,,
,,,,,,,,,,,,,,,,,,,,,,,,,,,,,,,,,,,,,,,,,,,,,,,,,,,,,,,,,,,,,,,,,,,,,,,,,,,,,,,,,,,.pdf,"List of machinery, Tools, Equipements etc. in afdfidavit",,,,,,,,,,,,,,,,,,,,,
,,,,,,,,,,,,,,,,,,,,,,,,,,,,,,,,,,,,,,,,,,,,,,,,,,,,,,,,,,,,,,,,,,,,,,,,,,,,,,,,,,,.pdf,Turn over of last five years duly issued from CA,,,,,,,,,,,,,,,,,,,,,
,,,,,,,,,,,,,,,,,,,,,,,,,,,,,,,,,,,,,,,,,,,,,,,,,,,,,,,,,,,,,,,,,,,,,,,,,,,,,,,,,2.0,Finance,.xls,BOQ,,,,,,,,,,,,,,,,,,,,,
