Organisation Chain,Tender Reference Number,Tender ID,Withdrawal Allowed,Tender Type,Form of contract,Tender Category,No. of Covers,General Technical Evaluation Allowed,ItemWise Technical Evaluation Allowed,Payment Mode,Is Multi Currency Allowed For BOQ,Is Multi Currency Allowed For Fee,Allow Two Stage Bidding,Name,Address,Title,Work Description,Pre Qualification Details,Independent External Monitor/Remarks,Tender Value in ₹,Product Category,Sub category,Contract Type,Bid Validity(Days),Period Of Work(Days),Location,Pincode,Pre Bid Meeting Place,Pre Bid Meeting Address,Pre Bid Meeting Date,Bid Opening Place,Should Allow NDA Tender,Allow Preferential Bidder,Tender Fee in ₹,Fee Payable To,Fee Payable At,Tender Fee Exemption Allowed,Publish Date,Bid Opening Date,Document Download / Sale Start Date,Document Download / Sale End Date,Clarification Start Date,Clarification End Date,Bid Submission Start Date,Bid Submission End Date,Financial Bid Opening Date,EMD Amount in ₹,EMD Exemption Allowed,EMD Fee Type,EMD Percentage,EMD Payable To,EMD Payable At,Cover No,Cover,Document Type,Description,S.No,Bank Name,Tender Stage,Type :,Summary :,Updated By :,Updated On :,Document :,BOQ Comparative Chart :,Type :.1,Summary :.1,Updated By :.1,Updated On :.1,Document :.1,Contract Date :,Contract Value :,Work Completion Period in days :,Updated By :.2,Updated on :,AOC document :,AOC Description :,Committee Chairperson/Co-ordinator Name :,Committee Chairperson/Co-ordinator Type :,Committee Members :,Updated By :.3,Updated On :.2,Financial Bid Opening Date:,Document :.2,S.No,Bid Number,Bidder Name,Submitted Date,Status,Remarks,Status Updated On,Committee Chairperson/Co-ordinator Name :.1,Committee Chairperson/Co-ordinator Type :.1,Committee Members :.1,Updated By :.4,Updated on :.1,Document :.3,Organisation Chain :,Tender ID :,Tender Ref No :,Tender Title :,S.No.1,Bid Number.1,Bidder Name.1,Awarded Currency,Awarded Value,Tender Stage
HPSEBL||CE(Gen) Sundernagar||SE(Gen) Nahan||RE Girinagar,RE-GPHD-25/2022-23,2023_HPSEB_69519_1,Yes,Open Tender,Item Rate,Works,2.0,No,No,Online,No,No,No,Resident Engineer,Giri Power House Division HPSEBL Girinagar,O and M of Power House,"Dismantling, repair and assembly of shaft sealing ring, Sealing body, TGB tank and vibration analysis and balancing",Please refer Tender documents. ,NA ,,Repair and Maintenance Works,NA ,Tender,90.0,45.0,Giri Power House Girinagar,173031.0,NA ,NA ,NA ,Girinagar,No ,No,590.0,Nil,Nil,No,24-Feb-2023 11:00 AM,03-Mar-2023 11:00 AM,24-Feb-2023 11:00 AM,02-Mar-2023 05:00 PM,NA ,NA ,24-Feb-2023 11:00 AM,02-Mar-2023 05:00 PM,06-Mar-2023 01:15 PM,"3,870",No,fixed,,Nil,Nil,1.0,Fee/PreQual/Technical,.pdf,fee and emd and other documents required as per SBD,1.0,ICICI BANK,AOC,Finance,3 nos price bids opened,Randhir singh Thakur,06-Mar-2023 01:23 PM,None,BOQ Comparative Chart,Technical,5 No Bidders documents downloaded successfully,Anup Ramaul,03-Mar-2023 11:29 AM,None,13-Mar-2023,"INR 395,300",45.0,Randhir singh Thakur,13-Mar-2023 04:16 PM,Notificationofaward25.pdf (649.00 KB),NOA for Dismantling repair and assembly of shaft sealing ring sealing body TGB tank of 30 MW unit1 at Giri Power House,Randhir Singh Thakur,Internal,Randhir Singh Thakur Ranjit Singh Anup Ramaul,Randhir singh Thakur,06-Mar-2023 01:06 PM,06-Mar-2023 01:15 PM,techsummary_104876.pdf (141.30 KB),1,330930,ESPEE ENTERPRISES,02-Mar-2023 04:58 PM,Rejected-Finance,L3 bidder,13-Mar-2023 10:48 AM,Randhir Singh Thakur,Internal,Randhir Singh Thakur Ranjit Singh Anup Ramaul,Randhir singh Thakur,13-Mar-2023 10:48 AM,finsummary_104876.pdf (141.30 KB),HPSEBL||CE(Gen) Sundernagar||SE(Gen) Nahan||RE Girinagar,2023_HPSEB_69519_1,RE-GPHD-25/2022-23,O and M of Power House,1.0,329509.0,M/S Multitech Enigneers,INR,"395,300",AOC
,,,,,,,,,,,,,,,,,,,,,,,,,,,,,,,,,,,,,,,,,,,,,,,,,,,,,2.0,Finance,.xls,price bid,2.0,ICICI NEFT/RTGS,AOC,,,,,,,,,,,,,,,,,,,,,,,,,,2,329509,M/S Multitech Enigneers,02-Mar-2023 12:23 PM,Accepted-AOC,L1 Bidder,13-Mar-2023 04:17 PM,,,,,,,,,,,,,,,,AOC
,,,,,,,,,,,,,,,,,,,,,,,,,,,,,,,,,,,,,,,,,,,,,,,,,,,,,,,,,,,AOC,,,,,,,,,,,,,,,,,,,,,,,,,,3,330886,NORTHERN POWER ERECTORS LIMITED,02-Mar-2023 03:59 PM,Rejected-Finance,L2 bidder,13-Mar-2023 10:48 AM,,,,,,,,,,,,,,,,AOC
,,,,,,,,,,,,,,,,,,,,,,,,,,,,,,,,,,,,,,,,,,,,,,,,,,,,,,,,,,,AOC,,,,,,,,,,,,,,,,,,,,,,,,,,4,330557,RAJU ENGINEERING WORKS,01-Mar-2023 06:44 PM,Rejected-Technical,Nonsubmission of complete bid documents,06-Mar-2023 01:06 PM,,,,,,,,,,,,,,,,AOC
,,,,,,,,,,,,,,,,,,,,,,,,,,,,,,,,,,,,,,,,,,,,,,,,,,,,,,,,,,,AOC,,,,,,,,,,,,,,,,,,,,,,,,,,5,329946,SHARMA LIGHT HOUSE,28-Feb-2023 03:36 PM,Rejected-Technical,Nonsubmission of complete bid documents,06-Mar-2023 01:06 PM,,,,,,,,,,,,,,,,AOC
