Contract Date :,Contract Value :,Work Completion Period in days :,Updated By :,Updated on :,AOC document :,AOC Description :,Type :,Summary :,Updated By :.1,Updated On :,Document :,BOQ Comparative Chart :,Type :.1,Summary :.1,Updated By :.2,Updated On :.1,Document :.1,Committee Chairperson/Co-ordinator Name :,Committee Chairperson/Co-ordinator Type :,Committee Members :,Updated By :.3,Updated On :.2,Financial Bid Opening Date:,Document :.2,S.No,Bid Number,Bidder Name,Submitted Date,Status,Remarks,Status Updated On,Organisation Chain :,Tender ID :,Tender Ref No :,Tender Title :,S.No.1,Bid Number.1,Bidder Name.1,Awarded Currency,Awarded Value,Committee Chairperson/Co-ordinator Name :.1,Committee Chairperson/Co-ordinator Type :.1,Committee Members :.1,Updated By :.4,Updated on :.1,Document :.3,Tender Stage,Title,Work Description,Pre Qualification Details,Independent External Monitor/Remarks,Tender Value in ₹,Product Category,Sub category,Contract Type,Bid Validity(Days),Period Of Work(Days),Location,Pincode,Pre Bid Meeting Place,Pre Bid Meeting Address,Pre Bid Meeting Date,Bid Opening Place,Should Allow NDA Tender,Allow Preferential Bidder,Cover No,Cover,Document Type,Description,Tender Fee in ₹,Fee Payable To,Fee Payable At,Tender Fee Exemption Allowed,Publish Date,Bid Opening Date,Document Download / Sale Start Date,Document Download / Sale End Date,Clarification Start Date,Clarification End Date,Bid Submission Start Date,Bid Submission End Date,Financial Bid Opening Date,Name,Address,Organisation Chain,Tender Reference Number,Tender ID,Withdrawal Allowed,Tender Type,Form of contract,Tender Category,No. of Covers,General Technical Evaluation Allowed,ItemWise Technical Evaluation Allowed,Payment Mode,Is Multi Currency Allowed For BOQ,Is Multi Currency Allowed For Fee,Allow Two Stage Bidding,S.No,Bank Name,EMD Amount in ₹,EMD Exemption Allowed,EMD Fee Type,EMD Percentage,EMD Payable To,EMD Payable At,Tender Stage
09-Mar-2023,"INR 557,406",365.0,Ajay Sharma,09-Mar-2023 02:46 PM,68105.pdf (210.00 KB),Awarded to Sandeep Kumar Govt. Contr.,Finance,summary,Ajay Sharma,14-Feb-2023 04:26 PM,finance_102575.pdf,BOQ Comparative Chart,Technical,document summary of technical bid for cover 1,Ajay Sharma,13-Feb-2023 03:11 PM,technical_102575.pdf,Executive Engineer,Internal,EA-1 Auditor HDM Supdt. AE Jawali,Ajay Sharma,13-Feb-2023 03:13 PM,13-Feb-2023 03:25 PM,techsummary_102575.pdf (266.26 KB),1.0,321201.0,ANKUSH KUMAR,09-Feb-2023 02:51 PM,Rejected-AOC,highest bidder,09-Mar-2023 02:49 PM,"HP Irrigation and Public Health||Fatehpur Circle,Irrigation and Public Health,HP||Jawali,Irrigation and Public Health,HP",2023_HPIPH_68105_1,EE/JSV Divn/JWL-Tender/10087-10115 dt. 04.02.2023,Repair and maitenance of various LWSS and LIS under JSV Sub Divison Nagrota Surian Tehsil Jawali Distt Kangra HP SH Repair of various pumping machinery and providing various accessories.,1.0,321259.0,Sandeep Mehra,INR,"557,406",Executive Engineer,Internal,EA1 Sudt. HDM AE Jawali,Ajay Sharma,09-Mar-2023 02:44 PM,finsummary_102575.pdf (270.87 KB),AOC,Repair and maitenance of various LWSS and LIS under JSV Sub Divison Nagrota Surian Tehsil Jawali Distt Kangra HP SH Repair of various pumping machinery and providing various accessories.,Repair and maitenance of various LWSS and LIS under JSV Sub Divison Nagrota Surian Tehsil Jawali Distt Kangra HP SH Repair of various pumping machinery and providing various accessories.,Please refer Tender documents. ,NA ,"9,29,010",Civil Works - Water Works,NA ,Tender,90.0,365.0,Nagrota Surian,176027.0,NA ,NA ,NA ,Jawali,No ,No,1.0,Fee/PreQual/Technical,.pdf,scan copy of cost of bid security,250.0,Nil,Nil,No,04-Feb-2023 06:00 PM,10-Feb-2023 11:30 AM,04-Feb-2023 06:00 PM,10-Feb-2023 11:00 AM,NA ,NA ,04-Feb-2023 06:00 PM,10-Feb-2023 11:00 AM,13-Feb-2023 03:25 PM,Executive Engineer,JSV Division Jawali,"HP Irrigation and Public Health||Fatehpur Circle,Irrigation and Public Health,HP||Jawali,Irrigation and Public Health,HP",EE/JSV Divn/JWL-Tender/10087-10115 dt. 04.02.2023,2023_HPIPH_68105_1,Yes,Open Tender,Item Rate,Works,2.0,No,No,Online,No,No,No,1.0,ICICI BANK,"18,580",No,fixed,,Nil,Nil,AOC
,,,,,,,,,,,,,,,,,,,,,,,,,2.0,321244.0,CHAIN SINGH,09-Feb-2023 01:35 PM,Rejected-AOC,highest bidder,09-Mar-2023 02:49 PM,,,,,,,,,,,,,,,,AOC,,,,,,,,,,,,,,,,,,,,,.pdf,scan copy of cost of bid form,,,,,,,,,,,,,,,,,,,,,,,,,,,,,,2.0,ICICI NEFT/RTGS,,,,,,,AOC
,,,,,,,,,,,,,,,,,,,,,,,,,3.0,321259.0,Sandeep Mehra,09-Feb-2023 03:06 PM,Accepted-AOC,lowest bidder,09-Mar-2023 02:49 PM,,,,,,,,,,,,,,,,AOC,,,,,,,,,,,,,,,,,,,,,.pdf,scan copy of registration /renewal with JSV Department.,,,,,,,,,,,,,,,,,,,,,,,,,,,,,,,,,,,,,,AOC
,,,,,,,,,,,,,,,,,,,,,,,,,4.0,321089.0,SS ENGINEERING WORKS,08-Feb-2023 07:06 PM,Rejected-AOC,highest bidder,09-Mar-2023 02:49 PM,,,,,,,,,,,,,,,,AOC,,,,,,,,,,,,,,,,,,,,,.pdf,"scan copy of EPF, PAN, GST registration",,,,,,,,,,,,,,,,,,,,,,,,,,,,,,,,,,,,,,AOC
,,,,,,,,,,,,,,,,,,,,,,,,,,,,,,,,,,,,,,,,,,,,,,,AOC,,,,,,,,,,,,,,,,,,,,,.pdf,scan copy of income tax return of 2021-22,,,,,,,,,,,,,,,,,,,,,,,,,,,,,,,,,,,,,,AOC
,,,,,,,,,,,,,,,,,,,,,,,,,,,,,,,,,,,,,,,,,,,,,,,AOC,,,,,,,,,,,,,,,,,,,2.0,Finance,.xls,boq,,,,,,,,,,,,,,,,,,,,,,,,,,,,,,,,,,,,,,AOC
