Type :,Summary :,Updated By :,Updated On :,Document :,S.No,Bid Number,Bidder Name,Submitted Date,Status,Remarks,Status Updated On,S.No.1,Bid Number.1,Bidder Name.1,Awarded Currency,Awarded Value,Type :.1,Summary :.1,Updated By :.1,Updated On :.1,Document :.1,BOQ Comparative Chart :,Committee Chairperson/Co-ordinator Name :,Committee Chairperson/Co-ordinator Type :,Committee Members :,Updated By :.2,Updated on :,Document :.2,Contract Date :,Contract Value :,Work Completion Period in days :,Updated By :.3,Updated on :.1,AOC document :,AOC Description :,Organisation Chain :,Tender ID :,Tender Ref No :,Tender Title :,Committee Chairperson/Co-ordinator Name :.1,Committee Chairperson/Co-ordinator Type :.1,Committee Members :.1,Updated By :.4,Updated On :.2,Financial Bid Opening Date:,Document :.3,Tender Stage,Organisation Chain,Tender Reference Number,Tender ID,Withdrawal Allowed,Tender Type,Form of contract,Tender Category,No. of Covers,General Technical Evaluation Allowed,ItemWise Technical Evaluation Allowed,Payment Mode,Is Multi Currency Allowed For BOQ,Is Multi Currency Allowed For Fee,Allow Two Stage Bidding,Cover No,Cover,Document Type,Description,S.No,Instrument Type,EMD Amount in ₹,EMD Exemption Allowed,EMD Fee Type,EMD Percentage,EMD Payable To,EMD Payable At,Name,Address,Publish Date,Bid Opening Date,Document Download / Sale Start Date,Document Download / Sale End Date,Clarification Start Date,Clarification End Date,Bid Submission Start Date,Bid Submission End Date,Financial Bid Opening Date,Tender Fee in ₹,Fee Payable To,Fee Payable At,Tender Fee Exemption Allowed,Title,Work Description,Pre Qualification Details,Independent External Monitor/Remarks,Tender Value in ₹,Product Category,Sub category,Contract Type,Bid Validity(Days),Period Of Work(Days),Location,Pincode,Pre Bid Meeting Place,Pre Bid Meeting Address,Pre Bid Meeting Date,Bid Opening Place,Should Allow NDA Tender,Allow Preferential Bidder,Tender Stage
Technical,As per Bid opening summary attached,Chaman Singh,02-Jun-2021 12:52 PM,technical_71284.pdf,1.0,213157.0,Ashadeep Construction Pvt Ltd,24-May-2021 02:09 PM,Accepted-AOC,Found in order,31-Mar-2023 10:09 AM,1.0,213157.0,Ashadeep Construction Pvt Ltd,INR,"4,280,944",Finance,As per opening summary attached,Chaman Singh,03-Jun-2021 11:34 AM,finance_71284.pdf,BOQ Comparative Chart,Er. Chaman Singh Thakur Executive Engineer,Internal,Sh. Paru Ram Superintendent Sh. Vimal Kumar Head Draughtsman Divisional Accounts Officer Banjar,Chaman Singh,31-Mar-2023 10:04 AM,finsummary_71284.pdf (2535.93 KB),31-Mar-2023,"INR 4,280,944",90.0,Chaman Singh,31-Mar-2023 10:08 AM,awardgarsa47481.pdf (6251.00 KB),As per award letter attached,PWD,2021_PWD_47481_1,973-1040 dt.04.05.2021,Annual periiodical maintenance for the year 2021-22 on Garsa Shiyah Hawai Gharat road Km 0-0 to 7-0,Er. Chaman Singh Thakur,Internal,Shri Paru Ram Superintendent Gr.II Shri Vimal Kumar Head Draughtsman Divisional Accounts Officer,Chaman Singh,02-Jun-2021 12:55 PM,02-Jun-2021 02:00 PM,techsummary_71284.pdf (364.35 KB),AOC,PWD,973-1040 dt.04.05.2021,2021_PWD_47481_1,Yes,Open Tender,Item Rate,Works,2.0,No,No,Offline,No,No,No,1.0,Fee/PreQual/Technical,.pdf,Scanned copy of Registration/ Enlistment with HPPWD,1.0,DD - Demand Draft,"68,000",No,fixed,,EE Banjar,Banjar,Executive Engineer Banjar Division HPPWD Banjar,HPPWD Division Banjar Tehsil Banjar District Kullu HP,17-May-2021 12:00 PM,25-May-2021 11:00 AM,17-May-2021 12:00 PM,24-May-2021 05:00 PM,NA ,NA ,17-May-2021 12:00 PM,24-May-2021 05:00 PM,02-Jun-2021 02:00 PM,"1,500",EE Banjar,Banjar,No,Annual periiodical maintenance for the year 2021-22 on Garsa Shiyah Hawai Gharat road Km 0-0 to 7-0,"Providing and laying BUSG, Bituminous Concrete in Km.4-0 to 7-040, providing and laying Hot applied thermoplastic edge line and construction of PCC Hill side drain in 300 mtr Length",Please refer Tender documents. ,NA ,"33,84,381",Civil Works - Roads,NA ,Tender,90.0,90.0,Garsa,175141.0,NA ,NA ,NA ,Banjar,No ,No,AOC
,,,,,2.0,213345.0,VARNAGCONSTRUCTIONS,23-May-2021 04:52 PM,Rejected-AOC,Not found in order,31-Mar-2023 10:09 AM,,,,,,,,,,,,,,,,,,,,,,,,,,,,,,,,,,,,AOC,,,,,,,,,,,,,,,,,.pdf,Scanned copy of proof of Registration under Employees Provident Fund,2.0,FDR - Fixed Deposit,,,,,,,,,,,,,,,,,,,,,,,,,,,,,,,,,,,,,,,,AOC
,,,,,,,,,,,,,,,,,,,,,,,,,,,,,,,,,,,,,,,,,,,,,,,AOC,,,,,,,,,,,,,,,,,.pdf,Scanned copy of PAN GST Income tax clearance certificate,,,,,,,,,,,,,,,,,,,,,,,,,,,,,,,,,,,,,,,,,,AOC
,,,,,,,,,,,,,,,,,,,,,,,,,,,,,,,,,,,,,,,,,,,,,,,AOC,,,,,,,,,,,,,,,,,.pdf,Scanned copy of Earnest money and cost of Form may be pledged in the name of EE Banjar division HPPW,,,,,,,,,,,,,,,,,,,,,,,,,,,,,,,,,,,,,,,,,,AOC
,,,,,,,,,,,,,,,,,,,,,,,,,,,,,,,,,,,,,,,,,,,,,,,AOC,,,,,,,,,,,,,,,,,.pdf,Scanned copy of Work Done Certificate of similar nature of work,,,,,,,,,,,,,,,,,,,,,,,,,,,,,,,,,,,,,,,,,,AOC
,,,,,,,,,,,,,,,,,,,,,,,,,,,,,,,,,,,,,,,,,,,,,,,AOC,,,,,,,,,,,,,,,,,.pdf,"Scanned copy of Machinery i.e. Tippers, Tractor, Bitumen extraction Test Apparatus, Digital Thermome",,,,,,,,,,,,,,,,,,,,,,,,,,,,,,,,,,,,,,,,,,AOC
,,,,,,,,,,,,,,,,,,,,,,,,,,,,,,,,,,,,,,,,,,,,,,,AOC,,,,,,,,,,,,,,,,,.pdf,Form 7 and 8 duly signed,,,,,,,,,,,,,,,,,,,,,,,,,,,,,,,,,,,,,,,,,,AOC
,,,,,,,,,,,,,,,,,,,,,,,,,,,,,,,,,,,,,,,,,,,,,,,AOC,,,,,,,,,,,,,,,2.0,Finance,.xls,BOQ,,,,,,,,,,,,,,,,,,,,,,,,,,,,,,,,,,,,,,,,,,AOC
