Tender Fee in ₹,Fee Payable To,Fee Payable At,Tender Fee Exemption Allowed,S.No,Bank Name,Organisation Chain,Tender Reference Number,Tender ID,Withdrawal Allowed,Tender Type,Form of contract,Tender Category,No. of Covers,General Technical Evaluation Allowed,ItemWise Technical Evaluation Allowed,Payment Mode,Is Multi Currency Allowed For BOQ,Is Multi Currency Allowed For Fee,Allow Two Stage Bidding,Cover No,Cover,Document Type,Description,EMD Amount in ₹,EMD Exemption Allowed,EMD Fee Type,EMD Percentage,EMD Payable To,EMD Payable At,Publish Date,Bid Opening Date,Document Download / Sale Start Date,Document Download / Sale End Date,Clarification Start Date,Clarification End Date,Bid Submission Start Date,Bid Submission End Date,Financial Bid Opening Date,Title,Work Description,Pre Qualification Details,Independent External Monitor/Remarks,Tender Value in ₹,Product Category,Sub category,Contract Type,Bid Validity(Days),Period Of Work(Days),Location,Pincode,Pre Bid Meeting Place,Pre Bid Meeting Address,Pre Bid Meeting Date,Bid Opening Place,Should Allow NDA Tender,Allow Preferential Bidder,Name,Address,Tender Stage,Organisation Chain :,Tender ID :,Tender Ref No :,Tender Title :,Committee Chairperson/Co-ordinator Name :,Committee Chairperson/Co-ordinator Type :,Committee Members :,Updated By :,Updated On :,Financial Bid Opening Date:,Document :,Committee Chairperson/Co-ordinator Name :.1,Committee Chairperson/Co-ordinator Type :.1,Committee Members :.1,Updated By :.1,Updated on :,Document :.1,Contract Date :,Contract Value :,Work Completion Period in days :,Updated By :.2,Updated on :.1,AOC document :,AOC Description :,S.No,Bid Number,Bidder Name,Submitted Date,Status,Remarks,Status Updated On,Type :,Summary :,Updated By :.3,Updated On :.1,Document :.2,Type :.1,Summary :.1,Updated By :.4,Updated On :.2,Document :.3,BOQ Comparative Chart :,S.No.1,Bid Number.1,Bidder Name.1,Awarded Currency,Awarded Value,Tender Stage
"2,000",Nil,Nil,No,1.0,ICICI BANK,PWD,EE Salooni Letter No. 12258-12307 dated 10-03-2021,2021_PWD_45931_1,Yes,Open Tender,Item Rate,Works,2.0,No,No,Online,No,No,No,1.0,Fee/PreQual/Technical,.pdf,Cost of tender from only online mode through E-payment,"1,07,500",No,fixed,,Nil,Nil,25-Mar-2021 12:00 PM,01-Apr-2021 11:30 AM,25-Mar-2021 12:00 PM,01-Apr-2021 11:00 AM,NA ,NA ,25-Mar-2021 12:00 PM,01-Apr-2021 11:00 AM,13-Apr-2021 11:30 AM,"Periodical Maintenance on Bhalei Bridge to Bhalei K.M. 0/0 to 1/500 and Bhalei Matta Temple to village Athed road (VR081) K.M. 0/0 to 1/0, 1/0/2/0, 2/0 to 3/0 and 3/0 to 4/0 under AMP for the year 2021-2022",Providing and laying 30mm thick bituminous concrete and PCC drain,Please refer Tender documents. ,NA ,,Civil Works,NA ,Tender,75.0,60.0,Salooni,176320.0,NA ,NA ,NA ,"Executive Engineer, Salooni Division HPPWD Salooni",No ,No,Executive Engineer,"Executive Engineer, Salooni Division HPPWD Salooni",AOC,PWD,2021_PWD_45931_1,EE Salooni Letter No. 12258-12307 dated 10-03-2021,"Periodical Maintenance on Bhalei Bridge to Bhalei K.M. 0/0 to 1/500 and Bhalei Matta Temple to village Athed road (VR081) K.M. 0/0 to 1/0, 1/0/2/0, 2/0 to 3/0 and 3/0 to 4/0 under AMP for the year 2021-2022",EE Salooni,Internal,Assistant engineer head draughtsman superintendent and senior assistant of salooni division,Jeet Singh Thakur,09-Apr-2021 07:15 PM,13-Apr-2021 11:30 AM,techsummary_69140.pdf (1170.48 KB),Executive Engineer,Internal,Senior Assistant Superintendent HDM AE,Rajeev Kumar,07-Jul-2021 02:48 PM,finsummary_69140.pdf (17.75 KB),19-Nov-2021,"INR 7,294,140.25",60.0,Deepak Mahajan,01-Jan-2022 04:49 PM,AL.pdf (1353.00 KB),Award letter,1.0,206659.0,Kamal Thakur,01-Apr-2021 10:21 AM,Rejected-Finance,2 Lowest,07-Jul-2021 02:48 PM,Technical,BOS,Jeet Singh Thakur,09-Apr-2021 07:02 PM,technical_69140.pdf,Finance,Finance Bid Opening Summary,Rajeev Kumar,07-Jul-2021 02:43 PM,finance_69140.pdf,BOQ Comparative Chart,1.0,206483.0,Rahul Thakur,INR,"7,294,140",AOC
,,,,2.0,ICICI NEFT/RTGS,,,,,,,,,,,,,,,,,.pdf,Earnest Money from only online mode through E-payment,,,,,,,,,,,,,,,,,,,,,,,,,,,,,,,,,,,,AOC,,,,,,,,,,,,,,,,,,,,,,,,,2.0,206483.0,Rahul Thakur,31-Mar-2021 06:47 PM,Accepted-AOC,Award letter,01-Jan-2022 04:49 PM,,,,,,,,,,,,,,,,,AOC
,,,,,,,,,,,,,,,,,,,,,,.pdf,Contractors Registration (Refer General Rule No.23 and as per invitation of bid,,,,,,,,,,,,,,,,,,,,,,,,,,,,,,,,,,,,AOC,,,,,,,,,,,,,,,,,,,,,,,,,,,,,,,,,,,,,,,,,,,,,,,,AOC
,,,,,,,,,,,,,,,,,,,,,,.pdf,Copy of G.S.T. Number,,,,,,,,,,,,,,,,,,,,,,,,,,,,,,,,,,,,AOC,,,,,,,,,,,,,,,,,,,,,,,,,,,,,,,,,,,,,,,,,,,,,,,,AOC
,,,,,,,,,,,,,,,,,,,,,,.pdf,Copy of PAN Number,,,,,,,,,,,,,,,,,,,,,,,,,,,,,,,,,,,,AOC,,,,,,,,,,,,,,,,,,,,,,,,,,,,,,,,,,,,,,,,,,,,,,,,AOC
,,,,,,,,,,,,,,,,,,,,,,.pdf,"Form No. 8, duly signed by the contractor",,,,,,,,,,,,,,,,,,,,,,,,,,,,,,,,,,,,AOC,,,,,,,,,,,,,,,,,,,,,,,,,,,,,,,,,,,,,,,,,,,,,,,,AOC
,,,,,,,,,,,,,,,,,,,,,,.pdf,An affidavit that information furnished with the bid (Name of works is correct in all respect),,,,,,,,,,,,,,,,,,,,,,,,,,,,,,,,,,,,AOC,,,,,,,,,,,,,,,,,,,,,,,,,,,,,,,,,,,,,,,,,,,,,,,,AOC
,,,,,,,,,,,,,,,,,,,,,,.pdf,"Documentary proof for ownership of 30/40 tonne capacity of Hotmixplant,paver finisher and RoadRoller",,,,,,,,,,,,,,,,,,,,,,,,,,,,,,,,,,,,AOC,,,,,,,,,,,,,,,,,,,,,,,,,,,,,,,,,,,,,,,,,,,,,,,,AOC
,,,,,,,,,,,,,,,,,,,,2.0,Finance,.xls,Bill of Quantity,,,,,,,,,,,,,,,,,,,,,,,,,,,,,,,,,,,,AOC,,,,,,,,,,,,,,,,,,,,,,,,,,,,,,,,,,,,,,,,,,,,,,,,AOC
