Contract Date :,Contract Value :,Work Completion Period in days :,Updated By :,Updated on :,AOC document :,AOC Description :,S.No,Bid Number,Bidder Name,Submitted Date,Status,Remarks,Status Updated On,S.No.1,Bid Number.1,Bidder Name.1,Awarded Currency,Awarded Value,Type :,Summary :,Updated By :.1,Updated On :,Document :,BOQ Comparative Chart :,Committee Chairperson/Co-ordinator Name :,Committee Chairperson/Co-ordinator Type :,Committee Members :,Updated By :.2,Updated On :.1,Financial Bid Opening Date:,Document :.1,Organisation Chain :,Tender ID :,Tender Ref No :,Tender Title :,Committee Chairperson/Co-ordinator Name :.1,Committee Chairperson/Co-ordinator Type :.1,Committee Members :.1,Updated By :.3,Updated on :.1,Document :.2,Type :.1,Summary :.1,Updated By :.4,Updated On :.2,Document :.3,Tender Stage,S.No,Instrument Type,EMD Amount in ₹,EMD through BG/ST or EMD Exemption Allowed,EMD Fee Type,EMD Percentage,EMD Payable To,EMD Payable At,Cover No,Cover,Document Type,Description,Title,Work Description,Pre Qualification Details,Independent External Monitor/Remarks,Tender Value in ₹,Product Category,Sub category,Contract Type,Bid Validity(Days),Period Of Work(Days),Location,Pincode,Pre Bid Meeting Place,Pre Bid Meeting Address,Pre Bid Meeting Date,Bid Opening Place,Should Allow NDA Tender,Allow Preferential Bidder,Tender Fee in ₹,Fee Payable To,Fee Payable At,Tender Fee Exemption Allowed,Publish Date,Bid Opening Date,Document Download / Sale Start Date,Document Download / Sale End Date,Clarification Start Date,Clarification End Date,Bid Submission Start Date,Bid Submission End Date,Financial Bid Opening Date,S.No.1,Corrigendum Title,Corrigendum Type,View,Organisation Chain,Tender Reference Number,Tender ID,Withdrawal Allowed,Tender Type,Form of contract,Tender Category,No. of Covers,General Technical Evaluation Allowed,ItemWise Technical Evaluation Allowed,Payment Mode,Is Multi Currency Allowed For BOQ,Is Multi Currency Allowed For Fee,Allow Two Stage Bidding,Name,Address,Tender Stage
16-Oct-2021,INR 5498800.0,30.0,Rajib Kumar Saikia,16-Oct-2021 03:24 PM,work_order_IITF.pdf (903.00 KB),Design and Decoration of both interior and exterior of Assam Pavilion including Theme Pavilion at Pragati Maidan New Delhi for India International Trade Fair 2021,1,124360,Deepali designs and Exhibits Pvt Ltd,07-Oct-2021 12:00 PM,Rejected-Technical,Ref to Tech Minutes,09-Oct-2021 12:35 PM,1.0,123273.0,Square Communications Pvt. Ltd.,INR,5498800.0,Finance,Bid opening summery,Pulak Jyoti Das,09-Oct-2021 12:51 PM,finance_35444.pdf,BOQ Comparative Chart,"Principal Secretary GOA, Ind, Comm and PE deptt",Internal,"CIC Assam, Jt DI, Dy DI and DGM AIIDC",Rajib Kumar Saikia,09-Oct-2021 12:35 PM,09-Oct-2021 12:45 PM,techsummary_35444.pdf (269.59 KB),Industries and Commerce Department||Commissioner Industries and Commerce Assam,2021_ICD_23029_1,CIC(V)IITF21/65/2021/3 date 22/09/2021,Design and Decoration of both interior and exterior of Assam Pavilion including Theme Pavilion at Pragati Maidan New Delhi for India International Trade Fair 2021,Dr K K Dwivedi IAS Principal Secretary to the Govt of Assam Industries Commerce and Public Enterprises Department,Internal,"Commissioner of Industries and Commerce Assam, Joint Director of Industries and Commerce Assam, Deputy Director of Industries",Rajib Kumar Saikia,16-Oct-2021 03:21 PM,finsummary_35444.pdf (269.59 KB),Technical,Bid opening summery,Pulak Jyoti Das,07-Oct-2021 04:07 PM,technical_35444.pdf,AOC,1.0,DD - Demand Draft,"55,000",No,fixed,,Commissioner of Industries and Commerce,Ghy,1.0,Fee/PreQual/Technical,.pdf,Cost of Bid and Bid Security,Design and Decoration of both interior and exterior of Assam Pavilion including Theme Pavilion at Pragati Maidan New Delhi for India International Trade Fair 2021,Design and Decoration of both interior and exterior of Assam Pavilion including Theme Pavilion at Pragati Maidan New Delhi for India International Trade Fair 2021,Please refer Tender documents. ,NA ,"55,00,000",Composite Works,NA ,Tender,90.0,30.0,IITF Assam Pavilion New Delhi,110001.0,NA ,NA ,NA ,Udyog Bhawan Bamunimaidam Ghy,No ,No,"1,500",Commissioner of Industries and Commerce,Ghy,No,23-Sep-2021 10:00 AM,07-Oct-2021 03:00 PM,23-Sep-2021 10:00 AM,07-Oct-2021 02:00 PM,23-Sep-2021 10:00 AM ,07-Oct-2021 02:00 PM ,23-Sep-2021 10:00 AM,07-Oct-2021 02:00 PM,09-Oct-2021 12:45 PM,1.0,Corrigendum,Technical Bid,,Industries and Commerce Department||Commissioner Industries and Commerce Assam,CIC(V)IITF21/65/2021/3 date 22/09/2021,2021_ICD_23029_1,Yes,Open Tender,Item Rate,Works,2.0,No,No,Offline,No,No,No,CIC Assam,Udyog Bhawan Bamunimaidam Ghy 21,AOC
,,,,,,,2,124283,INCREDIBLE DEDSIGN,07-Oct-2021 12:57 PM,Rejected-Technical,Ref to Tech Minutes,09-Oct-2021 12:35 PM,,,,,,,,,,,,,,,,,,,,,,,,,,,,,,,,,,AOC,2.0,BC - Bankers Cheque,,,,,,,,,.pdf,Signed Bid document,,,,,,,,,,,,,,,,,,,,,,,,,,,,,,,,,,,,,,,,,,,,,,,,,,,,AOC
,,,,,,,3,124345,MG ENTERPRISE,06-Oct-2021 06:44 PM,Rejected-Technical,Ref to Tech Minutes,09-Oct-2021 12:35 PM,,,,,,,,,,,,,,,,,,,,,,,,,,,,,,,,,,AOC,,,,,,,,,,,.pdf,Technical Qualification,,,,,,,,,,,,,,,,,,,,,,,,,,,,,,,,,,,,,,,,,,,,,,,,,,,,AOC
,,,,,,,4,124317,PALOMINO HOSPITALITY PRIVATE LIMITED,06-Oct-2021 03:52 PM,Rejected-Technical,Ref to Tech Minutes,09-Oct-2021 12:35 PM,,,,,,,,,,,,,,,,,,,,,,,,,,,,,,,,,,AOC,,,,,,,,,2.0,Finance,.xls,BOQ,,,,,,,,,,,,,,,,,,,,,,,,,,,,,,,,,,,,,,,,,,,,,,,,,,,,AOC
,,,,,,,5,123768,PYRAMIDFABCON EVENTMANAGER PVT. LTD.,06-Oct-2021 12:47 PM,Rejected-Technical,Ref to Tech Minutes,09-Oct-2021 12:35 PM,,,,,,,,,,,,,,,,,,,,,,,,,,,,,,,,,,AOC,,,,,,,,,,,,,,,,,,,,,,,,,,,,,,,,,,,,,,,,,,,,,,,,,,,,,,,,,,,,,,,,AOC
,,,,,,,6,123273,Square Communications Pvt. Ltd.,06-Oct-2021 01:55 PM,Accepted-AOC,Selected bidder,16-Oct-2021 03:24 PM,,,,,,,,,,,,,,,,,,,,,,,,,,,,,,,,,,AOC,,,,,,,,,,,,,,,,,,,,,,,,,,,,,,,,,,,,,,,,,,,,,,,,,,,,,,,,,,,,,,,,AOC
