Organisation Chain,Tender Reference Number,Tender ID,Withdrawal Allowed,Tender Type,Form of contract,Tender Category,No. of Covers,General Technical Evaluation Allowed,ItemWise Technical Evaluation Allowed,Payment Mode,Is Multi Currency Allowed For BOQ,Is Multi Currency Allowed For Fee,Allow Two Stage Bidding,Cover No,Cover,Document Type,Description,Publish Date,Bid Opening Date,Document Download / Sale Start Date,Document Download / Sale End Date,Clarification Start Date,Clarification End Date,Bid Submission Start Date,Bid Submission End Date,Financial Bid Opening Date,EMD Amount in ₹,EMD Exemption Allowed,EMD Fee Type,EMD Percentage,EMD Payable To,EMD Payable At,S.No,Bank Name,Tender Fee in ₹,Fee Payable To,Fee Payable At,Tender Fee Exemption Allowed,Name,Address,Title,Work Description,Pre Qualification Details,Independent External Monitor/Remarks,Tender Value in ₹,Product Category,Sub category,Contract Type,Bid Validity(Days),Period Of Work(Days),Location,Pincode,Pre Bid Meeting Place,Pre Bid Meeting Address,Pre Bid Meeting Date,Bid Opening Place,Should Allow NDA Tender,Allow Preferential Bidder,Tender Stage
PWD,NIT No. 17141-17190 dated 16.02.2024,2024_PWD_86561_1,Yes,Open Tender,Percentage,Works,2.0,No,No,Online,No,No,No,1.0,Fee/PreQual/Technical,.pdf,Cost of tender from only online mode through E-payment,20-Feb-2024 05:00 PM,29-Feb-2024 11:30 AM,20-Feb-2024 05:00 PM,29-Feb-2024 11:00 AM,,,20-Feb-2024 05:00 PM,29-Feb-2024 11:00 AM,27-Mar-2024 11:00 AM,"49,467",No,fixed,,Nil,Nil,1.0,ICICI BANK,500.0,Nil,Nil,No,Executive Engineer,HPPWD Division Chowari,Restoration of rain damage on Patka to Dalhousie road Km 45/00 to 68/00,SH- Construction of damaged 900 mm dia HP Culvert alongwith wing walls at Rd 62/655 and retaining walls at variojs RDs.,Please refer Tender documents.,,"24,73,352",Civil Works,,Tender,75.0,,Chowari,176302.0,,,,Chowari,No,No,AOC
,,,,,,,,,,,,,,,,.pdf,Earnest Money from only online more through e-payment,,,,,,,,,,,,,,,,2.0,ICICI NEFT/RTGS,,,,,,,,,,,,,,,,,,,,,,,,,AOC
,,,,,,,,,,,,,,,,.pdf,Contractors Registration (Refer General Rule No. 24.3 and as per invitation of bid),,,,,,,,,,,,,,,,,,,,,,,,,,,,,,,,,,,,,,,,,,AOC
,,,,,,,,,,,,,,,,.pdf,Copy of G.S.T. Number,,,,,,,,,,,,,,,,,,,,,,,,,,,,,,,,,,,,,,,,,,AOC
,,,,,,,,,,,,,,,,.pdf,Copy of PAN Number,,,,,,,,,,,,,,,,,,,,,,,,,,,,,,,,,,,,,,,,,,AOC
,,,,,,,,,,,,,,,,.pdf,"Form No. 8, duly signed by the contractor",,,,,,,,,,,,,,,,,,,,,,,,,,,,,,,,,,,,,,,,,,AOC
,,,,,,,,,,,,,,,,.pdf,An affidavit that information furnished in the bid is correct,,,,,,,,,,,,,,,,,,,,,,,,,,,,,,,,,,,,,,,,,,AOC
,,,,,,,,,,,,,,,,.pdf,E mail address/phone number,,,,,,,,,,,,,,,,,,,,,,,,,,,,,,,,,,,,,,,,,,AOC
,,,,,,,,,,,,,,2.0,Finance,.xls,BOQ,,,,,,,,,,,,,,,,,,,,,,,,,,,,,,,,,,,,,,,,,,AOC
