Organisation Chain,Tender Reference Number,Tender ID,Withdrawal Allowed,Tender Type,Form of contract,Tender Category,No. of Covers,General Technical Evaluation Allowed,ItemWise Technical Evaluation Allowed,Payment Mode,Is Multi Currency Allowed For BOQ,Is Multi Currency Allowed For Fee,Allow Two Stage Bidding,Cover No,Cover,Document Type,Description,Publish Date,Bid Opening Date,Document Download / Sale Start Date,Document Download / Sale End Date,Clarification Start Date,Clarification End Date,Bid Submission Start Date,Bid Submission End Date,Financial Bid Opening Date,EMD Amount in ₹,EMD Exemption Allowed,EMD Fee Type,EMD Percentage,EMD Payable To,EMD Payable At,S.No,Bank Name,Tender Fee in ₹,Fee Payable To,Fee Payable At,Tender Fee Exemption Allowed,Name,Address,Title,Work Description,Pre Qualification Details,Independent External Monitor/Remarks,Tender Value in ₹,Product Category,Sub category,Contract Type,Bid Validity(Days),Period Of Work(Days),Location,Pincode,Pre Bid Meeting Place,Pre Bid Meeting Address,Pre Bid Meeting Date,Bid Opening Place,Should Allow NDA Tender,Allow Preferential Bidder,Tender Stage
Directorate of Urban Development||Urban Development - UDDHP||Nagar Panchayat Arki - UDDHP,tender 663-666-1,2024_UDDHP_90637_1,Yes,Open Tender,Item Rate,Works,2.0,No,No,Both(Online/Offline),No,No,No,1.0,Fee/PreQual/Technical,.pdf,Valid Copy of Registration as required,22-Jul-2024 10:00 AM,02-Aug-2024 11:00 AM,22-Jul-2024 10:00 AM,01-Aug-2024 05:00 PM,,,22-Jul-2024 10:00 AM,01-Aug-2024 05:00 PM,02-Aug-2024 11:35 AM,"6,000",No,fixed,,Secretary Nagar Panchayat Arki,Nagar Panchayat Arki,1.0,ICICI BANK,500.0,Secretary Nagar Panchayat Arki,Nagar Panchayat Arki,No,Secretary,Nagar Panchayat Arki,Repair and beautification of chogan ground w.no.4 Phase-1,Repair and beautification of chogan ground w.no.4 Phase-1,Please refer Tender documents.,,"2,43,200",Civil Works,,Tender,60.0,90.0,Nagar Panchayat Arki,173208.0,,,,office of Nagar Panchayat Arki,No,No,AOC
,,,,,,,,,,,,,,,,.pdf,Copy of GST/CGST,,,,,,,,,,,,,,,,2.0,ICICI NEFT/RTGS,,,,,,,,,,,,,,,,,,,,,,,,,AOC
,,,,,,,,,,,,,,,,.pdf,Earnest Money,,,,,,,,,,,,,,,,,,,,,,,,,,,,,,,,,,,,,,,,,,AOC
,,,,,,,,,,,,,,,,.pdf,Cost of tender Form,,,,,,,,,,,,,,,,,,,,,,,,,,,,,,,,,,,,,,,,,,AOC
,,,,,,,,,,,,,,,,.pdf,Copy Of PAN Card,,,,,,,,,,,,,,,,,,,,,,,,,,,,,,,,,,,,,,,,,,AOC
,,,,,,,,,,,,,,,,.pdf,Work Done certificates as required,,,,,,,,,,,,,,,,,,,,,,,,,,,,,,,,,,,,,,,,,,AOC
,,,,,,,,,,,,,,,,.pdf,Affidavit of required machinery (with owner Ship proof),,,,,,,,,,,,,,,,,,,,,,,,,,,,,,,,,,,,,,,,,,AOC
,,,,,,,,,,,,,,2.0,Finance,.xls,BOQ,,,,,,,,,,,,,,,,,,,,,,,,,,,,,,,,,,,,,,,,,,AOC
