Tender Fee in ₹,Fee Payable To,Fee Payable At,Tender Fee Exemption Allowed,Publish Date,Bid Opening Date,Document Download / Sale Start Date,Document Download / Sale End Date,Clarification Start Date,Clarification End Date,Bid Submission Start Date,Bid Submission End Date,Financial Bid Opening Date,Organisation Chain,Tender Reference Number,Tender ID,Withdrawal Allowed,Tender Type,Form of contract,Tender Category,No. of Covers,General Technical Evaluation Allowed,ItemWise Technical Evaluation Allowed,Payment Mode,Is Multi Currency Allowed For BOQ,Is Multi Currency Allowed For Fee,Allow Two Stage Bidding,Title,Work Description,Pre Qualification Details,Independent External Monitor/Remarks,Tender Value in ₹,Product Category,Sub category,Contract Type,Bid Validity(Days),Period Of Work(Days),Location,Pincode,Pre Bid Meeting Place,Pre Bid Meeting Address,Pre Bid Meeting Date,Bid Opening Place,Should Allow NDA Tender,Allow Preferential Bidder,Name,Address,S.No,Corrigendum Title,Corrigendum Type,View,Cover No,Cover,Document Type,Description,EMD Amount in ₹,EMD Exemption Allowed,EMD Fee Type,EMD Percentage,EMD Payable To,EMD Payable At,S.No.1,Bank Name,Committee Chairperson/Co-ordinator Name :,Committee Chairperson/Co-ordinator Type :,Committee Members :,Updated By :,Updated on :,Document :,S.No.2,Bid Number,Bidder Name,Awarded Currency,Awarded Value,Organisation Chain :,Tender ID :,Tender Ref No :,Tender Title :,Committee Chairperson/Co-ordinator Name :.1,Committee Chairperson/Co-ordinator Type :.1,Committee Members :.1,Updated By :.1,Updated On :,Financial Bid Opening Date:,Document :.1,S.No.1.1,Bid Number.1,Bidder Name.1,Submitted Date,Status,Remarks,Status Updated On,Contract Date :,Contract Value :,Work Completion Period in days :,Updated By :.2,Updated on :.1,AOC document :,Type :,Summary :,Updated By :.3,Updated On :.1,Document :.2,BOQ Comparative Chart :,Type :.1,Summary :.1,Updated By :.4,Updated On :.2,Document :.3
590.0,Nil,Nil,No,08-Jun-2023 05:00 PM,18-Jul-2023 12:00 PM,08-Jun-2023 05:00 PM,17-Jul-2023 10:00 AM,NA ,NA ,08-Jun-2023 05:00 PM,17-Jul-2023 10:00 AM,15-Sep-2023 10:00 AM,HPSEBL||CE(OP) CZ Mandi||SE(OP) Bilaspur||Sr. Xen (E) Karsog,184619/2023-24-1454-59 Dated 02-06-2023,2023_HPSEB_74716_1,Yes,Open Tender,Item Wise,Services,2.0,No,No,Online,No,No,No,Tender for LT line from proposed 63 KVA Sub. Station Kanda -2nd under ESD Churag.,Tender for LT line from proposed 63 KVA Sub. Station Kanda -2nd under ESD Churag.,Please refer tender document  ,N/A ,"90,082",Supply and Erection,Electrical work ,Tender,180.0,60.0,Churag,175010.0,NA ,NA ,NA ,"Office of Sr. Executive Engineer,ED Karsog",No ,No,"Er. Sushil Kumar, Sr. Executive Engineer,ED Karsog","Office of Sr. Executive Engineer,ED Karsog",1.0,Date Corrigendum-6,Date,,1.0,Fee/PreQual/Technical,.pdf,Cost of Tender form,"2,252",No,fixed,,Nil,Nil,1.0,ICICI BANK,"Er. Sushil Kumar, Sr. Executive Engineer,ED Karsog",Internal,Attached,Sushil Kumar,27-Sep-2023 01:55 PM,finsummary_112002.pdf (428.44 KB),1.0,354097.0,HARISH BHARDWAJ,INR,"75,540.11",HPSEBL||CE(OP) CZ Mandi||SE(OP) Bilaspur||Sr. Xen (E) Karsog,2023_HPSEB_74716_1,184619/2023-24-1454-59 Dated 02-06-2023,Tender for LT line from proposed 63 KVA Sub. Station Kanda -2nd under ESD Churag.,"Er. Sushil Kumar, Sr. Executive Engineer,ED Karsog",Internal,Attached,Sushil Kumar,14-Sep-2023 05:03 PM,15-Sep-2023 10:00 AM,techsummary_112002.pdf (470.79 KB),1.0,354097.0,HARISH BHARDWAJ,14-Jun-2023 08:52 AM,Accepted-AOC,M/S Harish Bhardwas (L-1) which found lowest,27-Sep-2023,27-Sep-2023,"INR 90,082",60.0,Sushil Kumar,27-Sep-2023 02:02 PM,LTKandaaward.pdf (1580.00 KB),Finance,Financial bid opened by tender committee.,Sushil Kumar,27-Sep-2023 01:49 PM,finance_112002.pdf,BOQ Comparative Chart,Technical,Fulfill all the techno-commercial condition as per bid document,Sushil Kumar,14-Sep-2023 05:01 PM,technical_112002.pdf
,,,,,,,,,,,,,,,,,,,,,,,,,,,,,,,,,,,,,,,,,,,,,,,,,,,,,.pdf,EMD,,,,,,,2.0,ICICI NEFT/RTGS,,,,,,,,,,,,,,,,,,,,,,,2.0,354090.0,Shivalik.inc,09-Jul-2023 05:51 PM,Rejected-Finance,L2,27-Sep-2023,,,,,,,,,,,,,,,,,
,,,,,,,,,,,,,,,,,,,,,,,,,,,,,,,,,,,,,,,,,,,,,,,,,,,,,.pdf,A Class Electrical License from competent authority as per bid document,,,,,,,,,,,,,,,,,,,,,,,,,,,,,,,,,,,,,,,,,,,,,,,,,,,,,,
,,,,,,,,,,,,,,,,,,,,,,,,,,,,,,,,,,,,,,,,,,,,,,,,,,,,,.pdf,Certificate of turnover from CA as per bid document,,,,,,,,,,,,,,,,,,,,,,,,,,,,,,,,,,,,,,,,,,,,,,,,,,,,,,
,,,,,,,,,,,,,,,,,,,,,,,,,,,,,,,,,,,,,,,,,,,,,,,,,,,,,.pdf,Affidavit of non blacklisting as per bid document,,,,,,,,,,,,,,,,,,,,,,,,,,,,,,,,,,,,,,,,,,,,,,,,,,,,,,
,,,,,,,,,,,,,,,,,,,,,,,,,,,,,,,,,,,,,,,,,,,,,,,,,,,,,.pdf,Undertaking of no litigation in Govt./ Semi Govt. institution as per bid document,,,,,,,,,,,,,,,,,,,,,,,,,,,,,,,,,,,,,,,,,,,,,,,,,,,,,,
,,,,,,,,,,,,,,,,,,,,,,,,,,,,,,,,,,,,,,,,,,,,,,,,,,,,,.pdf,"Registration of PAN, GST, EPF and insurance policies for work man as per bid document",,,,,,,,,,,,,,,,,,,,,,,,,,,,,,,,,,,,,,,,,,,,,,,,,,,,,,
,,,,,,,,,,,,,,,,,,,,,,,,,,,,,,,,,,,,,,,,,,,,,,,,,,,,,.pdf,"Cancelled Check, Contact no. and Email ID as per bid document",,,,,,,,,,,,,,,,,,,,,,,,,,,,,,,,,,,,,,,,,,,,,,,,,,,,,,
,,,,,,,,,,,,,,,,,,,,,,,,,,,,,,,,,,,,,,,,,,,,,,,,,,,2.0,Finance,.xls,BOQ,,,,,,,,,,,,,,,,,,,,,,,,,,,,,,,,,,,,,,,,,,,,,,,,,,,,,,
