Contract Date :,Contract Value :,Work Completion Period in days :,Updated By :,Updated on :,AOC document :,AOC Description :,Committee Chairperson/Co-ordinator Name :,Committee Chairperson/Co-ordinator Type :,Committee Members :,Updated By :.1,Updated on :.1,Document :,Committee Chairperson/Co-ordinator Name :.1,Committee Chairperson/Co-ordinator Type :.1,Committee Members :.1,Updated By :.2,Updated On :,Financial Bid Opening Date:,Document :.1,Organisation Chain :,Tender ID :,Tender Ref No :,Tender Title :,S.No,Bid Number,Bidder Name,Awarded Currency,Awarded Value,Type :,Summary :,Updated By :.3,Updated On :.1,Document :.2,BOQ Comparative Chart :,Type :.1,Summary :.1,Updated By :.4,Updated On :.2,Document :.3,S.No.1,Bid Number.1,Bidder Name.1,Submitted Date,Status,Remarks,Status Updated On,S.No.2,Bank Name,EMD Amount in ₹,EMD Exemption Allowed,EMD Fee Type,EMD Percentage,EMD Payable To,EMD Payable At,Publish Date,Bid Opening Date,Document Download / Sale Start Date,Document Download / Sale End Date,Clarification Start Date,Clarification End Date,Bid Submission Start Date,Bid Submission End Date,Financial Bid Opening Date,Cover No,Cover,Document Type,Description,Title,Work Description,Pre Qualification Details,Independent External Monitor/Remarks,Tender Value in ₹,Product Category,Sub category,Contract Type,Bid Validity(Days),Period Of Work(Days),Location,Pincode,Pre Bid Meeting Place,Pre Bid Meeting Address,Pre Bid Meeting Date,Bid Opening Place,Should Allow NDA Tender,Allow Preferential Bidder,Name,Address,Tender Fee in ₹,Fee Payable To,Fee Payable At,Tender Fee Exemption Allowed,Organisation Chain,Tender Reference Number,Tender ID,Withdrawal Allowed,Tender Type,Form of contract,Tender Category,No. of Covers,General Technical Evaluation Allowed,ItemWise Technical Evaluation Allowed,Payment Mode,Is Multi Currency Allowed For BOQ,Is Multi Currency Allowed For Fee,Allow Two Stage Bidding
14-Sep-2023,"INR 1,150,341",90.0,Ravi Singh Rana,14-Sep-2023 11:08 AM,76163.pdf (1089.00 KB),AWARDED TO L1,EXECUTIVE EINGINEER,Internal,SUPDT DAO HDM,Ravi Singh Rana,25-Aug-2023 10:25 AM,finsummary_113955.pdf (26.30 KB),EXECUTIVE EINGINEER,Internal,SUPDT DAO HDM,Ravi Singh Rana,01-Aug-2023 04:14 PM,01-Aug-2023 04:15 PM,techsummary_113955.pdf (366.94 KB),PWD,2023_PWD_76163_1,Electrical Division-I dated 13.07.2023,CO Directorate of Energy in Second Floor Level 62.60M in Existing Parking Complex Tutikandi at Shimla SH Providing 10 KVA UPS 2 Nos therein.,1.0,361227.0,D.S Ranta Electrical Contractor,INR,"1,150,341",Finance,Three number bids were found qualified in TQC accordingly opened for financial part today on dated 01.08.2023 in which Ms D.S Ranta Electrical Contractor was found L-1,Ravi Singh Rana,01-Aug-2023 04:28 PM,finance_113955.pdf,BOQ Comparative Chart,Technical,Four number bids were found uploaded on e-procurement accordingly opened for technical part today on 24.07.2023.,Ravi Singh Rana,24-Jul-2023 12:17 PM,technical_113955.pdf,1.0,361227.0,D.S Ranta Electrical Contractor,22-Jul-2023 10:39 AM,Accepted-AOC,L1,14-Sep-2023,1.0,ICICI BANK,"26,000",No,fixed,,E.E.Electrical Division No-I Shimla-9,Shimla-9,14-Jul-2023 10:00 AM,24-Jul-2023 11:30 AM,14-Jul-2023 10:00 AM,22-Jul-2023 05:00 PM,NA ,NA ,14-Jul-2023 10:00 AM,22-Jul-2023 05:00 PM,01-Aug-2023 04:15 PM,1.0,Fee/PreQual/Technical,.pdf,Cost of Tender in shape of DD,CO Directorate of Energy in Second Floor Level 62.60M in Existing Parking Complex Tutikandi at Shimla SH Providing 10 KVA UPS 2 Nos therein.,CO Directorate of Energy in Second Floor Level 62.60M in Existing Parking Complex Tutikandi at Shimla SH Providing 10 KVA UPS 2 Nos therein.,Please refer Tender documents. ,NA ,"12,71,096",Electrical Works,NA ,Tender,90.0,90.0,SHIMLA,171009.0,NA ,NA ,NA ,SHIMLA KASUMPTI -9,No ,No,XEN Electrical Division No. 1 Shimla,The Executive Engineer Electrical Division No-1 HPPWD Shimla-9,500.0,E.E.Electrical Division No-I Shimla-9,Shimla-9,No,PWD,Electrical Division-I dated 13.07.2023,2023_PWD_76163_1,Yes,Open Tender,Percentage,Works,2.0,No,No,Both(Online/Offline),No,No,No
,,,,,,,,,,,,,,,,,,,,,,,,,,,,,,,,,,,,,,,,2.0,361827.0,Elsan Electricals Eneterprises,22-Jul-2023 02:50 PM,Rejected-AOC,L2,14-Sep-2023,2.0,ICICI NEFT/RTGS,,,,,,,,,,,,,,,,,,.pdf,EMD in shape of FDR,,,,,,,,,,,,,,,,,,,,,,,,,,,,,,,,,,,,,,
,,,,,,,,,,,,,,,,,,,,,,,,,,,,,,,,,,,,,,,,3.0,361919.0,RAJNEESH THAKUR,22-Jul-2023 04:46 PM,Rejected-Technical,Not qualified,01-Aug-2023,,,,,,,,,,,,,,,,,,,,.pdf,GST/PAN Registration,,,,,,,,,,,,,,,,,,,,,,,,,,,,,,,,,,,,,,
,,,,,,,,,,,,,,,,,,,,,,,,,,,,,,,,,,,,,,,,4.0,361675.0,SHARMA ELECTRICAL CO.,22-Jul-2023 10:26 AM,Rejected-AOC,L3,14-Sep-2023,,,,,,,,,,,,,,,,,,,,.pdf,TQC Technical Qualification Criteria as per Tender document,,,,,,,,,,,,,,,,,,,,,,,,,,,,,,,,,,,,,,
,,,,,,,,,,,,,,,,,,,,,,,,,,,,,,,,,,,,,,,,,,,,,,,,,,,,,,,,,,,,,,,,,,.pdf,Certificate of undertaking /Declaration by the Contractor,,,,,,,,,,,,,,,,,,,,,,,,,,,,,,,,,,,,,,
,,,,,,,,,,,,,,,,,,,,,,,,,,,,,,,,,,,,,,,,,,,,,,,,,,,,,,,,,,,,,,,,2.0,Finance,.xls,SCHEDULE of QUANTITY BOQ,,,,,,,,,,,,,,,,,,,,,,,,,,,,,,,,,,,,,,
,,,,,,,,,,,,,,,,,,,,,,,,,,,,,,,,,,,,,,,,,,,,,,,,,,,,,,,,,,,,,,,,,,.pdf,STANDARD BIDDING DOCUMENT Form-8,,,,,,,,,,,,,,,,,,,,,,,,,,,,,,,,,,,,,,
