Title,Work Description,Pre Qualification Details,Independent External Monitor/Remarks,Tender Value in ₹,Product Category,Sub category,Contract Type,Bid Validity(Days),Period Of Work(Days),Location,Pincode,Pre Bid Meeting Place,Pre Bid Meeting Address,Pre Bid Meeting Date,Bid Opening Place,Should Allow NDA Tender,Allow Preferential Bidder,EMD Amount in ₹,EMD Exemption Allowed,EMD Fee Type,EMD Percentage,EMD Payable To,EMD Payable At,S.No,Bank Name,Organisation Chain,Tender Reference Number,Tender ID,Withdrawal Allowed,Tender Type,Form of contract,Tender Category,No. of Covers,General Technical Evaluation Allowed,ItemWise Technical Evaluation Allowed,Payment Mode,Is Multi Currency Allowed For BOQ,Is Multi Currency Allowed For Fee,Allow Two Stage Bidding,Name,Address,S.No.1,Corrigendum Title,Corrigendum Type,View,Publish Date,Bid Opening Date,Document Download / Sale Start Date,Document Download / Sale End Date,Clarification Start Date,Clarification End Date,Bid Submission Start Date,Bid Submission End Date,Financial Bid Opening Date,Cover No,Cover,Document Type,Description,Tender Fee in ₹,Fee Payable To,Fee Payable At,Tender Fee Exemption Allowed,S.No.2,Bid Number,Bidder Name,Awarded Currency,Awarded Value,Contract Date :,Contract Value :,Work Completion Period in days :,Updated By :,Updated on :,AOC document :,AOC Description :,Organisation Chain :,Tender ID :,Tender Ref No :,Tender Title :,Committee Chairperson/Co-ordinator Name :,Committee Chairperson/Co-ordinator Type :,Committee Members :,Updated By :.1,Updated on :.1,Document :,Type :,Summary :,Updated By :.2,Updated On :,Document :.1,BOQ Comparative Chart :,S.No.1.1,Bid Number.1,Bidder Name.1,Submitted Date,Status,Remarks,Status Updated On,Committee Chairperson/Co-ordinator Name :.1,Committee Chairperson/Co-ordinator Type :.1,Committee Members :.1,Updated By :.3,Updated On :.1,Financial Bid Opening Date:,Document :.2,Type :.1,Summary :.1,Updated By :.4,Updated On :.2,Document :.3
Renovation of Superintendant Residential Building and 3 Nos. staff quarters at Observation Home cum special home and place of safety Samoorkalan Distt. Una (HP).,Renovation of Superintendant Residential Building and 3 Nos. staff quarters at Observation Home cum special home and place of safety Samoorkalan Distt. Una (HP).,Please refer Tender documents. ,NA ,"17,02,540",Civil Works,NA ,Tender,120.0,180.0,Samoorkalan (Una),174303.0,NA ,NA ,NA ,HPSIDC Shimla,No ,No,"34,000",No,fixed,,Nil,Nil,1.0,ICICI BANK,HP SIDC Limited,Job No. 8,2023_SIDC_74373_1,Yes,Open Tender,Item Rate,Works,2.0,No,No,Online,No,No,No,Executive Engineer,HPSIDC Shimla,1.0,Corrigendum-II,Date,,03-Jun-2023 11:00 AM,24-Jun-2023 11:00 AM,03-Jun-2023 11:00 AM,23-Jun-2023 05:00 PM,NA ,NA ,03-Jun-2023 11:00 AM,23-Jun-2023 05:00 PM,05-Jul-2023 02:00 PM,1.0,Fee/PreQual/Technical,.pdf,Appropriate Contractor registration (as per tender condition),"2,000",Nil,Nil,No,1.0,353056.0,Saurabh Loomba,INR,"1,141,790",11-Sep-2023,"INR 1,141,790",180.0,Sushant Singh Negi,04-Dec-2023 11:12 AM,sauravhaoc.pdf (2688.00 KB),Award letter,HP SIDC Limited,2023_SIDC_74373_1,Job No. 8,Renovation of Superintendant Residential Building and 3 Nos. staff quarters at Observation Home cum special home and place of safety Samoorkalan Distt. Una (HP).,SE,Internal,"DM, Manager(F), AE(HQ), EE(HQ)",Sushant Singh Negi,12-Jul-2023 10:37 AM,finsummary_111556.pdf (40.24 KB),Finance,Financial summary,Sushant Singh Negi,12-Jul-2023 10:32 AM,finance_111556.pdf,BOQ Comparative Chart,1.0,353480.0,abhishek guleria,12-Jun-2023 11:01 AM,Rejected-Finance,Sixth lowest bidder,12-Jul-2023,SE,Internal,"DM, Manager(F), AE(HQ), EE(HQ)",Sushant Singh Negi,05-Jul-2023 11:59 AM,05-Jul-2023 02:00 PM,techsummary_111556.pdf (458.32 KB),Technical,Tender Summary,Sushant Singh Negi,05-Jul-2023 11:57 AM,technical_111556.pdf
,,,,,,,,,,,,,,,,,,,,,,,,2.0,ICICI NEFT/RTGS,,,,,,,,,,,,,,,,,,,,,,,,,,,,,,,,.pdf,Signed copy of agreement form and approved make for materials,,,,,,,,,,,,,,,,,,,,,,,,,,,,,,,,,2.0,353036.0,Bhisham Kumar,12-Jun-2023 11:45 AM,Rejected-Finance,Fifth lowest bidder,12-Jul-2023,,,,,,,,,,,,
,,,,,,,,,,,,,,,,,,,,,,,,,,,,,,,,,,,,,,,,,,,,,,,,,,,,,,,,,.pdf,Affidavit that the information furnished with the bid documents is true and correct.,,,,,,,,,,,,,,,,,,,,,,,,,,,,,,,,,3.0,352301.0,Pankaj Rana Govt Contractor,08-Jun-2023 08:33 PM,Rejected-Finance,Seventh lowest bidder,12-Jul-2023,,,,,,,,,,,,
,,,,,,,,,,,,,,,,,,,,,,,,,,,,,,,,,,,,,,,,,,,,,,,,,,,,,,,,,.pdf,Affidavit that you have not more than 2 works in hand each of Rs.100 lakh or above in any department,,,,,,,,,,,,,,,,,,,,,,,,,,,,,,,,,4.0,353470.0,Rajinder Kumar,12-Jun-2023 12:51 PM,Rejected-Finance,Third lowest bidder,12-Jul-2023,,,,,,,,,,,,
,,,,,,,,,,,,,,,,,,,,,,,,,,,,,,,,,,,,,,,,,,,,,,,,,,,,,,,,,.pdf,Proof copy of EPF registration No.,,,,,,,,,,,,,,,,,,,,,,,,,,,,,,,,,5.0,353056.0,Saurabh Loomba,09-Jun-2023 08:06 PM,Accepted-AOC,AOC,04-Dec-2023,,,,,,,,,,,,
,,,,,,,,,,,,,,,,,,,,,,,,,,,,,,,,,,,,,,,,,,,,,,,,,,,,,,,,,.pdf,Proof copy of GST registration No.,,,,,,,,,,,,,,,,,,,,,,,,,,,,,,,,,6.0,353490.0,U R Construction,12-Jun-2023 12:34 AM,Rejected-Finance,Forth lowest bidder,12-Jul-2023,,,,,,,,,,,,
,,,,,,,,,,,,,,,,,,,,,,,,,,,,,,,,,,,,,,,,,,,,,,,,,,,,,,,,,.pdf,Copy of latest ITR and pan card,,,,,,,,,,,,,,,,,,,,,,,,,,,,,,,,,7.0,353660.0,VK CONSTRUCTIONS,14-Jun-2023 01:07 PM,Rejected-Finance,Second lowest bidder,12-Jul-2023,,,,,,,,,,,,
,,,,,,,,,,,,,,,,,,,,,,,,,,,,,,,,,,,,,,,,,,,,,,,,,,,,,,,,,.pdf,Copy of receipt of EMD and cost of form,,,,,,,,,,,,,,,,,,,,,,,,,,,,,,,,,,,,,,,,,,,,,,,,,,,
,,,,,,,,,,,,,,,,,,,,,,,,,,,,,,,,,,,,,,,,,,,,,,,,,,,,,,,2.0,Finance,.xls,BOQ,,,,,,,,,,,,,,,,,,,,,,,,,,,,,,,,,,,,,,,,,,,,,,,,,,,
