Tender Fee in ₹,Fee Payable To,Fee Payable At,Tender Fee Exemption Allowed,S.No,Bank Name,Title,Work Description,Pre Qualification Details,Independent External Monitor/Remarks,Tender Value in ₹,Product Category,Sub category,Contract Type,Bid Validity(Days),Period Of Work(Days),Location,Pincode,Pre Bid Meeting Place,Pre Bid Meeting Address,Pre Bid Meeting Date,Bid Opening Place,Should Allow NDA Tender,Allow Preferential Bidder,Organisation Chain,Tender Reference Number,Tender ID,Withdrawal Allowed,Tender Type,Form of contract,Tender Category,No. of Covers,General Technical Evaluation Allowed,ItemWise Technical Evaluation Allowed,Payment Mode,Is Multi Currency Allowed For BOQ,Is Multi Currency Allowed For Fee,Allow Two Stage Bidding,EMD Amount in ₹,EMD Exemption Allowed,EMD Fee Type,EMD Percentage,EMD Payable To,EMD Payable At,Cover No,Cover,Document Type,Description,Publish Date,Bid Opening Date,Document Download / Sale Start Date,Document Download / Sale End Date,Clarification Start Date,Clarification End Date,Bid Submission Start Date,Bid Submission End Date,Financial Bid Opening Date,Name,Address,Committee Chairperson/Co-ordinator Name :,Committee Chairperson/Co-ordinator Type :,Committee Members :,Updated By :,Updated On :,Financial Bid Opening Date:,Document :,Contract Date :,Contract Value :,Work Completion Period in days :,Updated By :.1,Updated on :,AOC document :,AOC Description :,Type :,Summary :,Updated By :.2,Updated On :.1,Document :.1,Type :.1,Summary :.1,Updated By :.3,Updated On :.2,Document :.2,Committee Chairperson/Co-ordinator Name :.1,Committee Chairperson/Co-ordinator Type :.1,Committee Members :.1,Updated By :.4,Updated on :.1,Document :.3,Organisation Chain :,Tender ID :,Tender Ref No :,Tender Title :
560.0,Nil,Nil,No,1.0,ICICI BANK,"Tender for Shifting of existing 63KVA, 11/0.4KV DTR Police Line in (E) Section Babeli under ESD No.II, HPSEBL, Kullu.","Tender for Shifting of existing 63KVA, 11/0.4KV DTR Police Line in (E) Section Babeli under ESD No.II, HPSEBL, Kullu",Please refer tender documents ,NA ,"3,19,568",Electrical Works,NA ,Tender,180.0,90.0,Babeli,175138.0,NA ,NA ,NA ,"Office of Sr. Xen, ED, HPSEBL, Kullu",No ,No,HPSEBL||CE(OP) CZ Mandi||SE(OP) Kullu||Sr. Xen (E) Kullu,NIT-37/2023-24,2023_HPSEB_77616_1,Yes,Open Tender,Percentage,Works,2.0,No,No,Online,No,No,No,"4,000",No,fixed,,Nil,Nil,1.0,Fee/PreQual/Technical,.pdf,Bidder license of A Class contractor from competent authority,16-Aug-2023 11:00 AM,24-Aug-2023 11:00 AM,17-Aug-2023 11:30 AM,23-Aug-2023 01:00 PM,NA ,NA ,17-Aug-2023 11:30 AM,23-Aug-2023 01:00 PM,24-Aug-2023 04:30 PM,"Sr. Xen, ED, HPSEBL, Kullu","Office of Sr. Xen, ED, HPSEBL, Kullu",Sr. Xen,Internal,AE (Works and Comm.) and Divisional Accountant,Virender Kumar,24-Aug-2023 03:35 PM,24-Aug-2023 04:30 PM,techsummary_115931.pdf,25-Sep-2023,"INR 319,565.68",90.0,Virender Kumar,25-Sep-2023 10:42 AM,NIT37AWARD.pdf,AOC,Finance,Financial,Virender Kumar,25-Sep-2023 10:36 AM,finance_115931.pdf,Technical,Techno,Virender Kumar,24-Aug-2023 03:02 PM,technical_115931.pdf,Sr. Xen,Internal,AE (Works) and Divisional Accountant,Virender Kumar,25-Sep-2023 10:39 AM,finsummary_115931.pdf,HPSEBL||CE(OP) CZ Mandi||SE(OP) Kullu||Sr. Xen (E) Kullu,2023_HPSEB_77616_1,NIT-37/2023-24,"Tender for Shifting of existing 63KVA, 11/0.4KV DTR Police Line in (E) Section Babeli under ESD No.II, HPSEBL, Kullu."
,,,,2.0,ICICI NEFT/RTGS,,,,,,,,,,,,,,,,,,,,,,,,,,,,,,,,,,,,,,,,,.pdf,Certificate of performance/experience for similar nature of work as per bid,,,,,,,,,,,,,,,,,,,,,,,,,,,,,,,,,,,,,,,,,,,,,
,,,,,,,,,,,,,,,,,,,,,,,,,,,,,,,,,,,,,,,,,,,,,,.pdf,Average annual turnover duly attested from CA as per bid,,,,,,,,,,,,,,,,,,,,,,,,,,,,,,,,,,,,,,,,,,,,,
,,,,,,,,,,,,,,,,,,,,,,,,,,,,,,,,,,,,,,,,,,,,,,.pdf,Declaration regarding non blacklisted in non judicial stamp paper with notary attested as per bid,,,,,,,,,,,,,,,,,,,,,,,,,,,,,,,,,,,,,,,,,,,,,
,,,,,,,,,,,,,,,,,,,,,,,,,,,,,,,,,,,,,,,,,,,,,,.pdf,"Certificate of GSTIN, PAN, AADHAR, ITR",,,,,,,,,,,,,,,,,,,,,,,,,,,,,,,,,,,,,,,,,,,,,
,,,,,,,,,,,,,,,,,,,,,,,,,,,,,,,,,,,,,,,,,,,,,,.pdf,Self undertaking regarding completion of work within scheduled time as per bid,,,,,,,,,,,,,,,,,,,,,,,,,,,,,,,,,,,,,,,,,,,,,
,,,,,,,,,,,,,,,,,,,,,,,,,,,,,,,,,,,,,,,,,,,,,,.pdf,Self undertaking regarding that studied all term and conditions in the bid,,,,,,,,,,,,,,,,,,,,,,,,,,,,,,,,,,,,,,,,,,,,,
,,,,,,,,,,,,,,,,,,,,,,,,,,,,,,,,,,,,,,,,,,,,2.0,Finance,.xls,BOQ,,,,,,,,,,,,,,,,,,,,,,,,,,,,,,,,,,,,,,,,,,,,,
