Organisation Chain :,Tender ID :,Tender Ref No :,Tender Title :,Committee Chairperson/Co-ordinator Name :,Committee Chairperson/Co-ordinator Type :,Committee Members :,Updated By :,Updated on :,Document :,S.No,Bid Number,Bidder Name,Awarded Currency,Awarded Value,Contract Date :,Contract Value :,Work Completion Period in days :,Updated By :.1,Updated on :.1,AOC document :,AOC Description :,S.No.1,Bid Number.1,Bidder Name.1,Submitted Date,Status,Remarks,Status Updated On,Committee Chairperson/Co-ordinator Name :.1,Committee Chairperson/Co-ordinator Type :.1,Committee Members :.1,Updated By :.2,Updated On :,Financial Bid Opening Date:,Document :.1,Type :,Summary :,Updated By :.3,Updated On :.1,Document :.2,Type :.1,Summary :.1,Updated By :.4,Updated On :.2,Document :.3,BOQ Comparative Chart :,S.No.2,Bank Name,Organisation Chain,Tender Reference Number,Tender ID,Withdrawal Allowed,Tender Type,Form of contract,Tender Category,No. of Covers,General Technical Evaluation Allowed,ItemWise Technical Evaluation Allowed,Payment Mode,Is Multi Currency Allowed For BOQ,Is Multi Currency Allowed For Fee,Allow Two Stage Bidding,Publish Date,Bid Opening Date,Document Download / Sale Start Date,Document Download / Sale End Date,Clarification Start Date,Clarification End Date,Bid Submission Start Date,Bid Submission End Date,Financial Bid Opening Date,Tender Fee in ₹,Fee Payable To,Fee Payable At,Tender Fee Exemption Allowed,EMD Amount in ₹,EMD Exemption Allowed,EMD Fee Type,EMD Percentage,EMD Payable To,EMD Payable At,Cover No,Cover,Document Type,Description,Title,Work Description,Pre Qualification Details,Independent External Monitor/Remarks,Tender Value in ₹,Product Category,Sub category,Contract Type,Bid Validity(Days),Period Of Work(Days),Location,Pincode,Pre Bid Meeting Place,Pre Bid Meeting Address,Pre Bid Meeting Date,Bid Opening Place,Should Allow NDA Tender,Allow Preferential Bidder,Name,Address
Hp State Cooperative Milk Producers Fed Ltd,2023_MPFL_77405_1,493 PI 8/21-XXVI,Raw material of Panjiri,Managing Director,Internal,Sr Manager P Manager Acctts DDO Asstt Manager Acctts,Preeti Arya,26-Aug-2023 01:06 PM,finsummary_115598.pdf (669.85 KB),1.0,366559.0,P A SALES CORPORATION,INR,"3,519,450",04-Sep-2023,"INR 13,279,762",120.0,Preeti Arya,04-Sep-2023 04:47 PM,panjiriso.pdf (4231.00 KB),Supply order Black Gram Ground Nut Seed Soyabean and cotton seed refined oil,1.0,368022.0,Ashutosh Trading Corporation,24-Aug-2023 03:58 PM,Accepted-AOC,quoted L-1 rates for the sypply of Cotton Seed Refined Oil,04-Sep-2023,Managing Director,Internal,Sr Manager P Manager Acctts DDo Asstt Manager Acctts,Preeti Arya,25-Aug-2023 04:56 PM,25-Aug-2023 05:00 PM,techsummary_115598.pdf (595.54 KB),Technical,Technical Summary,Preeti Arya,25-Aug-2023 04:51 PM,technical_115598.pdf,Finance,Financial Summary,Preeti Arya,26-Aug-2023 01:00 PM,finance_115598.pdf,BOQ Comparative Chart,1.0,ICICI BANK,Hp State Cooperative Milk Producers Fed Ltd,493 PI 8/21-XXVI,2023_MPFL_77405_1,Yes,Open Tender,Item Wise,Goods,2.0,No,Yes,Online,No,No,No,09-Aug-2023 04:50 PM,25-Aug-2023 12:00 PM,09-Aug-2023 05:00 PM,24-Aug-2023 04:00 PM,NA ,NA ,09-Aug-2023 05:00 PM,24-Aug-2023 04:00 PM,25-Aug-2023 05:00 PM,"2,360",Nil,Nil,Yes,"5,62,500",Yes,percentage,2.5%,Nil,Nil,1.0,Fee/PreQual/Technical,.pdf,Whether earnest money and Tender Cost Uploaded,Raw material of Panjiri,Raw material of Panjiri,Please refer Tender documents. ,NA ,"2,25,00,000",Food Products,NA ,Tender,120.0,NA ,HP Milkfed Totu Shimla,171011.0,NA ,NA ,NA ,Totu Shimla,No ,No,Managing Director,HP Milkfed Totu Shimla
,,,,,,,,,,2.0,368007.0,S K FOOD PRODUCT,INR,"5,932,500",,,,,,,,2.0,368023.0,CSA Corporation Pvt.Ltd,23-Aug-2023 04:10 PM,Accepted-AOC,quoted L-1 rates for the sypply of Ground nut seed,04-Sep-2023,,,,,,,,,,,,,,,,,,,2.0,ICICI NEFT/RTGS,,,,,,,,,,,,,,,,,,,,,,,,,,,,,,,,,,,,.pdf,Copies of the proof/balance sheet and income tax returns of the last three years,,,,,,,,,,,,,,,,,,,,
,,,,,,,,,,3.0,368022.0,Ashutosh Trading Corporation,INR,"2,352,000",,,,,,,,3.0,367674.0,Dashmesh Agri Traders,23-Aug-2023 05:05 PM,Rejected-Finance,rate quoted high,26-Aug-2023,,,,,,,,,,,,,,,,,,,,,,,,,,,,,,,,,,,,,,,,,,,,,,,,,,,,,,,,.pdf,GST PAN and TAN no. from the income tax authorities uploaded,,,,,,,,,,,,,,,,,,,,
,,,,,,,,,,4.0,368023.0,CSA Corporation Pvt.Ltd,INR,"1,460,812.5",,,,,,,,4.0,366559.0,P A SALES CORPORATION,24-Aug-2023 11:39 AM,Accepted-AOC,quated L-1 rates for supply of Black Gram,04-Sep-2023,,,,,,,,,,,,,,,,,,,,,,,,,,,,,,,,,,,,,,,,,,,,,,,,,,,,,,,,.pdf,Duly signed and stamp tender document uploaded,,,,,,,,,,,,,,,,,,,,
,,,,,,,,,,,,,,,,,,,,,,5.0,368007.0,S K FOOD PRODUCT,24-Aug-2023 02:26 PM,Accepted-AOC,quoted L-1 rates for the sypply of Soyabean,04-Sep-2023,,,,,,,,,,,,,,,,,,,,,,,,,,,,,,,,,,,,,,,,,,,,,,,,,,,,,,,,.pdf,Testing report of the cotton seed refined oil should be as per specification uploaded,,,,,,,,,,,,,,,,,,,,
,,,,,,,,,,,,,,,,,,,,,,,,,,,,,,,,,,,,,,,,,,,,,,,,,,,,,,,,,,,,,,,,,,,,,,,,,,,,,,,,,,,,.pdf,Declaration as provide at annexure A Uploaded,,,,,,,,,,,,,,,,,,,,
,,,,,,,,,,,,,,,,,,,,,,,,,,,,,,,,,,,,,,,,,,,,,,,,,,,,,,,,,,,,,,,,,,,,,,,,,,,,,,,,,,2.0,Finance,.xls,BOQ,,,,,,,,,,,,,,,,,,,,
