Organisation Chain,Tender Reference Number,Tender ID,Withdrawal Allowed,Tender Type,Form of contract,Tender Category,No. of Covers,General Technical Evaluation Allowed,ItemWise Technical Evaluation Allowed,Payment Mode,Is Multi Currency Allowed For BOQ,Is Multi Currency Allowed For Fee,Allow Two Stage Bidding,Cover No,Cover,Document Type,Description,Publish Date,Bid Opening Date,Document Download / Sale Start Date,Document Download / Sale End Date,Clarification Start Date,Clarification End Date,Bid Submission Start Date,Bid Submission End Date,Financial Bid Opening Date,EMD Amount in ₹,EMD Exemption Allowed,EMD Fee Type,EMD Percentage,EMD Payable To,EMD Payable At,S.No,Bank Name,Tender Fee in ₹,Fee Payable To,Fee Payable At,Tender Fee Exemption Allowed,Name,Address,Title,Work Description,Pre Qualification Details,Independent External Monitor/Remarks,Tender Value in ₹,Product Category,Sub category,Contract Type,Bid Validity(Days),Period Of Work(Days),Location,Pincode,Pre Bid Meeting Place,Pre Bid Meeting Address,Pre Bid Meeting Date,Bid Opening Place,Should Allow NDA Tender,Allow Preferential Bidder,Tender Stage
"HP Irrigation and Public Health||Rohru Circle,Irrigation and Public Health,HP||Jubbal,Irrigation and Public Health,HP",JBL-SML-09-718,2024_HPIPH_84296_1,Yes,Open Tender,Item Rate,Works,2.0,No,No,Online,No,No,No,1.0,Fee/PreQual/Technical,.pdf,Cost of form,19-Jan-2024 06:00 PM,30-Jan-2024 11:30 AM,19-Jan-2024 06:00 PM,30-Jan-2024 11:00 AM,,,19-Jan-2024 06:00 PM,30-Jan-2024 11:00 AM,28-Feb-2024 04:25 PM,"1,85,050",Yes,fixed,,Nil,Nil,1.0,ICICI BANK,"1,500",Nil,Nil,Yes,Executive Engineer,JSV Division Jubbal,Providing LIS from horticulture land Maghara and Astandli in GP Sari in Tehsil Jubbal Distt Shimla HP,Providing LIS from horticulture land Maghara and Astandli in GP Sari in Tehsil Jubbal Distt Shimla HP,Please refer Tender documents.,,"1,52,50,803",Civil Works,Civil pipe line and pumping machinery,Tender,120.0,365.0,Sari,171205.0,,,,JSV Division Jubbal,No,No,AOC
,,,,,,,,,,,,,,,,.pdf,EMD or Exemption with required affidavit as per NIT,,,,,,,,,,,,,,,,2.0,ICICI NEFT/RTGS,,,,,,,,,,,,,,,,,,,,,,,,,AOC
,,,,,,,,,,,,,,,,.pdf,Valid enlistment in B or C Class only,,,,,,,,,,,,,,,,,,,,,,,,,,,,,,,,,,,,,,,,,,AOC
,,,,,,,,,,,,,,,,.pdf,PAN GST EPF and ITR AY 2023-24,,,,,,,,,,,,,,,,,,,,,,,,,,,,,,,,,,,,,,,,,,AOC
,,,,,,,,,,,,,,,,.pdf,Affidavit as per NIT condition 4 (v),,,,,,,,,,,,,,,,,,,,,,,,,,,,,,,,,,,,,,,,,,AOC
,,,,,,,,,,,,,,,,.pdf,Signed copy of Form8 Page_1 and 2 by the bidder,,,,,,,,,,,,,,,,,,,,,,,,,,,,,,,,,,,,,,,,,,AOC
,,,,,,,,,,,,,,,,.pdf,Authorisation letter from dealer of pumping machinery with required curve duly calculated,,,,,,,,,,,,,,,,,,,,,,,,,,,,,,,,,,,,,,,,,,AOC
,,,,,,,,,,,,,,,,.pdf,Affidavit that bidder is not a blacklisted contractor,,,,,,,,,,,,,,,,,,,,,,,,,,,,,,,,,,,,,,,,,,AOC
,,,,,,,,,,,,,,2.0,Finance,.xls,SOQ,,,,,,,,,,,,,,,,,,,,,,,,,,,,,,,,,,,,,,,,,,AOC
