Publish Date,Bid Opening Date,Document Download / Sale Start Date,Document Download / Sale End Date,Clarification Start Date,Clarification End Date,Bid Submission Start Date,Bid Submission End Date,Financial Bid Opening Date,Organisation Chain,Tender Reference Number,Tender ID,Withdrawal Allowed,Tender Type,Form of contract,Tender Category,No. of Covers,General Technical Evaluation Allowed,ItemWise Technical Evaluation Allowed,Payment Mode,Is Multi Currency Allowed For BOQ,Is Multi Currency Allowed For Fee,Allow Two Stage Bidding,Title,Work Description,Pre Qualification Details,Independent External Monitor/Remarks,Tender Value in ₹,Product Category,Sub category,Contract Type,Bid Validity(Days),Period Of Work(Days),Location,Pincode,Pre Bid Meeting Place,Pre Bid Meeting Address,Pre Bid Meeting Date,Bid Opening Place,Should Allow NDA Tender,Allow Preferential Bidder,Cover No,Cover,Document Type,Description,Tender Fee in ₹,Fee Payable To,Fee Payable At,Tender Fee Exemption Allowed,Name,Address,S.No,Instrument Type,EMD Amount in ₹,EMD Exemption Allowed,EMD Fee Type,EMD Percentage,EMD Payable To,EMD Payable At,Tender Stage,Committee Chairperson/Co-ordinator Name :,Committee Chairperson/Co-ordinator Type :,Committee Members :,Updated By :,Updated on :,Document :,S.No,Bid Number,Bidder Name,Awarded Currency,Awarded Value,Organisation Chain :,Tender ID :,Tender Ref No :,Tender Title :,Committee Chairperson/Co-ordinator Name :.1,Committee Chairperson/Co-ordinator Type :.1,Committee Members :.1,Updated By :.1,Updated On :,Financial Bid Opening Date:,Document :.1,S.No.1,Bid Number.1,Bidder Name.1,Submitted Date,Status,Remarks,Status Updated On,Contract Date :,Contract Value :,Work Completion Period in days :,Updated By :.2,Updated on :.1,AOC document :,AOC Description :,Type :,Summary :,Updated By :.3,Updated On :.1,Document :.2,BOQ Comparative Chart :,Type :.1,Summary :.1,Updated By :.4,Updated On :.2,Document :.3,Tender Stage
19-Aug-2017 02:00 PM,25-Aug-2017 11:30 AM,19-Aug-2017 02:00 PM,24-Aug-2017 04:00 PM,19-Aug-2017 02:00 PM ,19-Aug-2017 02:00 PM ,19-Aug-2017 02:00 PM,24-Aug-2017 04:00 PM,26-Aug-2017 04:35 PM,"HP Irrigation and Public Health||Hamirpur Circle,Irrigation and Public Health,HP||Barsar,Irrigation and Public Health,HP",No. EE IPH BBR TA E-Tender 2016-17- 7292-7321,2017_HPIPH_17748_1,Yes,Open Tender,Item Rate,Works,2.0,No,No,Offline,No,No,No,Replacement of pumping machinery of LWSS Railly Jajari in Tehsil Barsar Distt. Hamirpur Supply erection of,Replacement of pumping machinery of LWSS Railly Jajari in Tehsil Barsar Distt. Hamirpur Supply erection of 2 Nos centrifugal pumping machinery of 60 H.P. each along with allied accessories,Please refer Tender documents. ,NA ,"5,40,000",Civil Works,NA ,Tender,120.0,NA ,IPH Sub division Barsar,174305.0,NA ,NA ,NA ,Executive Engineer IPH Division Ba,No ,No,1.0,Fee/PreQual/Technical,.pdf,Certificate of registration with IPH Department in appropriate class and latest renewal thereof.,250.0,Executive Engineer IPH Division Ba,Executive Engineer IPH Division Ba,Yes,Executive Engineer IPH Division Ba,Executive Engineer IPH Division Barsar.,1.0,SS - Small Savings Instrument,"10,800",Yes,fixed,,Executive Engineer IPH Division Ba,Executive Engineer IPH Division Ba,AOC,EE IPH Division Barsar,Internal,Sh. Shushil Kumar Sr. Assistant Supdtt. Gr-II HDM IPH Division Barsar,Jitender Kumar,20-Jun-2019 07:35 PM,finsummary_24024.pdf (40.94 KB),1.0,66170.0,RAJESH ENGINEERING SERVICES,INR,"794,841","HP Irrigation and Public Health||Hamirpur Circle,Irrigation and Public Health,HP||Barsar,Irrigation and Public Health,HP",2017_HPIPH_17748_1,No. EE IPH BBR TA E-Tender 2016-17- 7292-7321,Replacement of pumping machinery of LWSS Railly Jajari in Tehsil Barsar Distt. Hamirpur Supply erection of,EE IPH Division Barsar,Internal,BOS,Rajender Kumar Khawla,26-Aug-2017 04:31 PM,26-Aug-2017 04:35 PM,techsummary_24024.pdf (71.86 KB),1.0,66118.0,competent associates,21-Aug-2017 07:51 PM,Not Admitted-Fee/PreQual/Technical,Not Complied with technical specification,26-Aug-2017 04:29 PM,20-Jun-2019,"INR 540,000",365.0,Jitender Kumar,20-Jun-2019 07:39 PM,AOC.pdf (43.00 KB),AOC,Finance,BOS,Rajender Kumar Khawla,26-Aug-2017 04:45 PM,finance_24024.pdf,BOQ Comparative Chart,Technical,BOS,Rajender Kumar Khawla,26-Aug-2017 04:29 PM,technical_24024.pdf,AOC
,,,,,,,,,,,,,,,,,,,,,,,,,,,,,,,,,,,,,,,,,,,.pdf,Earnest money amounting to Rs10800. only plugged in favour of EE IPH Division Barsar,,,,,,,2.0,FDR - Fixed Deposit,,,,,,,AOC,,,,,,,2.0,66299.0,VERMA ELECTRIC INDUSTRY,INR,"803,750",,,,,,,,,,,,2.0,66170.0,RAJESH ENGINEERING SERVICES,22-Aug-2017 05:38 PM,Accepted-AOC,accepted,20-Jun-2019 07:39 PM,,,,,,,,,,,,,,,,,,,AOC
,,,,,,,,,,,,,,,,,,,,,,,,,,,,,,,,,,,,,,,,,,,.pdf,The cost of tender form demand draft in favour of E E IPH Divin. Barsar amounting to Rs. 250 four h,,,,,,,,,,,,,,,AOC,,,,,,,3.0,66418.0,SHARMA INTERPRISES,INR,"728,200",,,,,,,,,,,,3.0,66418.0,SHARMA INTERPRISES,24-Aug-2017 03:28 PM,Accepted-AOC,accepted and awareded,20-Jun-2019 07:39 PM,,,,,,,,,,,,,,,,,,,AOC
,,,,,,,,,,,,,,,,,,,,,,,,,,,,,,,,,,,,,,,,,,,.pdf,Tin and GST registration No. and latest clearance certificates thereof.,,,,,,,,,,,,,,,AOC,,,,,,,,,,,,,,,,,,,,,,,4.0,66299.0,VERMA ELECTRIC INDUSTRY,23-Aug-2017 06:32 PM,Accepted-AOC,accepted,20-Jun-2019 07:39 PM,,,,,,,,,,,,,,,,,,,AOC
,,,,,,,,,,,,,,,,,,,,,,,,,,,,,,,,,,,,,,,,,,,.pdf,Under taking from the contractor firm who have already two or more incomplete work in hand in this D,,,,,,,,,,,,,,,AOC,,,,,,,,,,,,,,,,,,,,,,,,,,,,,,,,,,,,,,,,,,,,,,,,AOC
,,,,,,,,,,,,,,,,,,,,,,,,,,,,,,,,,,,,,,,,,,,.pdf,Copy of EPF registration No.,,,,,,,,,,,,,,,AOC,,,,,,,,,,,,,,,,,,,,,,,,,,,,,,,,,,,,,,,,,,,,,,,,AOC
,,,,,,,,,,,,,,,,,,,,,,,,,,,,,,,,,,,,,,,,,2.0,Finance,.xls,BOQ where contractor will quote his offer for each item,,,,,,,,,,,,,,,AOC,,,,,,,,,,,,,,,,,,,,,,,,,,,,,,,,,,,,,,,,,,,,,,,,AOC
