EMD Amount in ₹,EMD Exemption Allowed,EMD Fee Type,EMD Percentage,EMD Payable To,EMD Payable At,S.No,Instrument Type,Tender Fee in ₹,VAT Charges in ₹,Processing Fee in ₹,Other charges in ₹,Fee Payable To,Fee Payable At,Tender Fee Exemption Allowed,Title,Work Description,Pre Qualification Details,Independent External Monitor/Remarks,Tender Value in ₹,Product Category,Sub category,Contract Type,Bid Validity(Days),Period Of Work(Days),Location,Pincode,Pre Bid Meeting Place,Pre Bid Meeting Address,Pre Bid Meeting Date,Bid Opening Place,Should Allow NDA Tender,Allow Preferential Bidder,Cover No,Cover,Document Type,Description,Name,Address,Organisation Chain,Tender Reference Number,Tender ID,Withdrawal Allowed,Tender Type,Form of contract,Tender Category,No. of Covers,General Technical Evaluation Allowed,ItemWise Technical Evaluation Allowed,Payment Mode,Is Multi Currency Allowed For BOQ,Is Multi Currency Allowed For Fee,Allow Two Stage Bidding,Publish Date,Bid Opening Date,Document Download / Sale Start Date,Document Download / Sale End Date,Clarification Start Date,Clarification End Date,Bid Submission Start Date,Bid Submission End Date,Financial Bid Opening Date,Tender Stage,S.No,Bid Number,Bidder Name,Awarded Currency,Awarded Value,Contract Date :,Contract Value :,Work Completion Period in days :,Updated By :,Updated on :,AOC document :,Organisation Chain :,Tender ID :,Tender Ref No :,Tender Title :,Committee Chairperson/Co-ordinator Name :,Committee Chairperson/Co-ordinator Type :,Committee Members :,Updated By :.1,Updated on :.1,Document :,Type :,Summary :,Updated By :.2,Updated On :,Document :.1,BOQ Comparative Chart :,S.No.1,Bid Number.1,Bidder Name.1,Submitted Date,Status,Remarks,Status Updated On,Committee Chairperson/Co-ordinator Name :.1,Committee Chairperson/Co-ordinator Type :.1,Committee Members :.1,Updated By :.3,Updated On :.1,Financial Bid Opening Date:,Document :.2,Type :.1,Summary :.1,Updated By :.4,Updated On :.2,Document :.3,Tender Stage
"29,200",Yes,fixed,,"Executive Engineer, IPH Division No.1 Kullu",Kulllu,1.0,DD - Demand Draft,400.0,0.0,0.0,0.0,EE IPH Div.No.I Kullu,Kullu,Yes,"Providing Sewerage Scheme Kullu Town Connectivity of House Connection beyond 6 mtr in Zone 1 SH Laying and jointing D. I. Pipe C. I. Pipe, C O Man Hole Cover Deep","Providing Sewerage Scheme Kullu Town Connectivity of House Connection beyond 6 mtr in Zone 1 SH Laying and jointing D. I. Pipe C. I. Pipe, C O Man Hole Cover Deep Square Job I",Please refer Tender documents ,NA ,"14,60,022",Civil Works,NA ,Tender,120.0,180.0,Kullu,175101.0,NA ,NA ,NA ,IPH Division No.1 Kullu,No ,No,1.0,Fee/PreQual/Technical,.pdf,Cost of tender form,"Executive Engineer, IPH Division No1 Kullu","Executive Engineer, IPH Division Kullu","HP Irrigation and Public Health||Kullu Circle,Irrigation and Public Health,HP||Kullu -1,Irrigation and Public Health,HP",6661.0,2013_HPIPH_2566_1,No,Open Tender,Item Rate,Works,2.0,No,No,Offline,No,No,No,11-Sep-2013 06:00 PM,01-Oct-2013 11:15 AM,11-Sep-2013 06:00 PM,30-Sep-2013 06:30 PM,11-Sep-2013 06:00 PM ,30-Sep-2013 06:30 PM ,11-Sep-2013 06:30 PM,30-Sep-2013 06:30 PM,04-Oct-2013 10:40 AM,AOC,1.0,8624.0,individual,INR,"1,932,452.38",18-Jun-2019,"INR 1,932,452.38",180.0,Keshav Ram Kulvi,18-Jun-2019 12:35 PM,ta.pdf (25.00 KB),"HP Irrigation and Public Health||Kullu Circle,Irrigation and Public Health,HP||Kullu -1,Irrigation and Public Health,HP",2013_HPIPH_2566_1,6661.0,"Providing Sewerage Scheme Kullu Town Connectivity of House Connection beyond 6 mtr in Zone 1 SH Laying and jointing D. I. Pipe C. I. Pipe, C O Man Hole Cover Deep",Upender Vaidya,Internal,Executive Engineer (D) IPH Circle Kullu Executive Engineer IPH Division No.1 Kullu,Upender Vaidya,08-Oct-2013 12:02 PM,finsummary_2939.pdf (29.00 KB),Finance,The finical bid is opened and comparative statement generated,Upender Vaidya,08-Oct-2013 11:39 AM,finance_2939.pdf,BOQ Comparative Chart,1.0,8615.0,Amar Chand Negi,29-Sep-2013 02:02 PM,Rejected-AOC,L2,18-Jun-2019 12:35 PM,Upender Vaidya,Internal,Executive Engineer IPH division No.1 Kullu Executive Engineer (D) IPH Circle Kullu,Upender Vaidya,04-Oct-2013 10:36 AM,04-Oct-2013 10:40 AM,techsummary_2939.pdf (29.00 KB),Technical,found three bidders are participated,Upender Vaidya,03-Oct-2013 03:56 PM,None,AOC
,,,,,,2.0,BC - Bankers Cheque,,,,,,,,,,,,,,,,,,,,,,,,,,,,.pdf,Earnest money,,,,,,,,,,,,,,,,,,,,,,,,,,AOC,,,,,,,,,,,,,,,,,,,,,,,,,,,,2.0,8617.0,chuni lal,29-Sep-2013 02:44 PM,Rejected-AOC,L3,18-Jun-2019 12:35 PM,,,,,,,,,,,,,AOC
,,,,,,3.0,FDR - Fixed Deposit,,,,,,,,,,,,,,,,,,,,,,,,,,,,.pdf,"Income Tax, PAN No., CST, GST No., TIN No",,,,,,,,,,,,,,,,,,,,,,,,,,AOC,,,,,,,,,,,,,,,,,,,,,,,,,,,,3.0,8624.0,individual,30-Sep-2013 01:30 PM,Accepted-AOC,L1,18-Jun-2019 12:35 PM,,,,,,,,,,,,,AOC
,,,,,,,,,,,,,,,,,,,,,,,,,,,,,,,,,,,.pdf,registration with HP IPH Department,,,,,,,,,,,,,,,,,,,,,,,,,,AOC,,,,,,,,,,,,,,,,,,,,,,,,,,,,,,,,,,,,,,,,,,,,,,,AOC
,,,,,,,,,,,,,,,,,,,,,,,,,,,,,,,,,2.0,Finance,.xls,BOQ,,,,,,,,,,,,,,,,,,,,,,,,,,AOC,,,,,,,,,,,,,,,,,,,,,,,,,,,,,,,,,,,,,,,,,,,,,,,AOC
