Contract Date :,Contract Value :,Work Completion Period in days :,Updated By :,Updated on :,AOC document :,AOC Description :,Committee Chairperson/Co-ordinator Name :,Committee Chairperson/Co-ordinator Type :,Committee Members :,Updated By :.1,Updated on :.1,Document :,Committee Chairperson/Co-ordinator Name :.1,Committee Chairperson/Co-ordinator Type :.1,Committee Members :.1,Updated By :.2,Updated On :,Financial Bid Opening Date:,Document :.1,Organisation Chain :,Tender ID :,Tender Ref No :,Tender Title :,Type :,Summary :,Updated By :.3,Updated On :.1,Document :.2,S.No,Bid Number,Bidder Name,Submitted Date,Status,Remarks,Status Updated On,S.No.1,Bid Number.1,Bidder Name.1,Awarded Currency,Awarded Value,Type :.1,Summary :.1,Updated By :.4,Updated On :.2,Document :.3,BOQ Comparative Chart :,Tender Stage,S.No,Instrument Type,EMD Amount in ₹,EMD Exemption Allowed,EMD Fee Type,EMD Percentage,EMD Payable To,EMD Payable At,Title,Work Description,Pre Qualification Details,Independent External Monitor/Remarks,Tender Value in ₹,Product Category,Sub category,Contract Type,Bid Validity(Days),Period Of Work(Days),Location,Pincode,Pre Bid Meeting Place,Pre Bid Meeting Address,Pre Bid Meeting Date,Bid Opening Place,Should Allow NDA Tender,Allow Preferential Bidder,Organisation Chain,Tender Reference Number,Tender ID,Withdrawal Allowed,Tender Type,Form of contract,Tender Category,No. of Covers,General Technical Evaluation Allowed,ItemWise Technical Evaluation Allowed,Payment Mode,Is Multi Currency Allowed For BOQ,Is Multi Currency Allowed For Fee,Allow Two Stage Bidding,Name,Address,Cover No,Cover,Document Type,Description,Tender Fee in ₹,Fee Payable To,Fee Payable At,Tender Fee Exemption Allowed,Publish Date,Bid Opening Date,Document Download / Sale Start Date,Document Download / Sale End Date,Clarification Start Date,Clarification End Date,Bid Submission Start Date,Bid Submission End Date,Financial Bid Opening Date,Tender Stage
03-Jun-2019,"INR 897,297",120.0,Sudhir Gupta,03-Jun-2019 12:06 PM,1192A.pdf (368.00 KB),AOC,Executive Engineer,Internal,Municipal Engineer Accounts Officer,Sudhir Gupta,01-Jun-2019 04:49 PM,finsummary_40830.pdf (368.14 KB),Executive Engineer,Internal,Municipal Engineer Accounts Officer,Sudhir Gupta,10-May-2019 11:31 AM,10-May-2019 11:35 AM,techsummary_40830.pdf (726.79 KB),Municipal Corporation Shimla||Road and Building - MC,2019_MC_28425_10,670Dated05.03.2019,Construction of Park at Dhalli Mashobra in ward No. 21 Under AMRUT.,Technical,bos,Vijay Gupta,10-May-2019 11:05 AM,technical_40830.pdf,1,120645,Buildway Infraengineers,17-Apr-2019 01:14 PM,Accepted-AOC,due to lowest rates,03-Jun-2019 12:06 PM,1.0,120645.0,Buildway Infraengineers,INR,"897,297",Finance,Award Letter,Sudhir Gupta,01-Jun-2019 04:41 PM,finance_40830.pdf,BOQ Comparative Chart,AOC,1.0,DD - Demand Draft,"14,500",No,fixed,,Executive Engineer RB MC Shimla,Shimla,Construction of Park at Dhalli Mashobra in ward No. 21 Under AMRUT.,Construction of Park at Dhalli Mashobra in ward No. 21 Under AMRUT.,Please refer tender documents ,NA ,"7,25,000",Civil Works,NA ,Tender,120.0,120.0,Shimla,171001.0,NA ,NA ,NA ,MC Shimla,No ,No,Municipal Corporation Shimla||Road and Building - MC,670Dated05.03.2019,2019_MC_28425_10,Yes,Open Tender,Item Rate,Works,2.0,No,No,Offline,No,No,No,Executive Engineer RB MC Shimla,Executive Engineer RB MC Shimla,1.0,Fee/PreQual/Technical,.pdf,Cost of form in shape of DD as per e procurement notice,350.0,Executive Engineer RB MC Shimla,Shimla,No,12-Mar-2019 05:00 PM,18-Apr-2019 11:00 AM,12-Mar-2019 05:00 PM,18-Apr-2019 10:30 AM,NA ,NA ,12-Mar-2019 05:00 PM,18-Apr-2019 10:30 AM,10-May-2019 11:35 AM,AOC
,,,,,,,,,,,,,,,,,,,,,,,,,,,,,2,120638,DEEP CHAND SHARMA,17-Apr-2019 02:26 PM,Rejected-Finance,Rejected,01-Jun-2019 04:49 PM,,,,,,,,,,,,AOC,2.0,FDR - Fixed Deposit,,,,,,,,,,,,,,,,,,,,,,,,,,,,,,,,,,,,,,,,,,,.pdf,Earnest money in shape of FDR and exemption shall not be allowed,,,,,,,,,,,,,,AOC
,,,,,,,,,,,,,,,,,,,,,,,,,,,,,3,120662,DHEERAJ PARMAR,17-Apr-2019 08:12 PM,Rejected-Finance,Rejected,01-Jun-2019 04:49 PM,,,,,,,,,,,,AOC,,,,,,,,,,,,,,,,,,,,,,,,,,,,,,,,,,,,,,,,,,,,,.pdf,Certificate of registration with HPPWD in appropriate class and latest renewal thereof,,,,,,,,,,,,,,AOC
,,,,,,,,,,,,,,,,,,,,,,,,,,,,,4,120632,KAPIL CHAND,17-Apr-2019 04:47 PM,Rejected-Finance,Rejected,01-Jun-2019 04:49 PM,,,,,,,,,,,,AOC,,,,,,,,,,,,,,,,,,,,,,,,,,,,,,,,,,,,,,,,,,,,,.pdf,Income Tax GST and EPF registration PAN Permanent Account No and GST No,,,,,,,,,,,,,,AOC
,,,,,,,,,,,,,,,,,,,,,,,,,,,,,5,120656,KHAJAN SINGH,17-Apr-2019 03:58 PM,Rejected-Finance,Rejected,01-Jun-2019 04:49 PM,,,,,,,,,,,,AOC,,,,,,,,,,,,,,,,,,,,,,,,,,,,,,,,,,,,,,,,,,,2.0,Finance,.xls,Schedule of Quantity (BOQ),,,,,,,,,,,,,,AOC
,,,,,,,,,,,,,,,,,,,,,,,,,,,,,6,120650,Kuldeep Sharma,17-Apr-2019 01:57 PM,Rejected-Finance,Rejected,01-Jun-2019 04:49 PM,,,,,,,,,,,,AOC,,,,,,,,,,,,,,,,,,,,,,,,,,,,,,,,,,,,,,,,,,,,,,,,,,,,,,,,,,,,AOC
,,,,,,,,,,,,,,,,,,,,,,,,,,,,,7,120347,Suresh Kumar,04-Apr-2019 05:02 PM,Rejected-Finance,Rejected,01-Jun-2019 04:49 PM,,,,,,,,,,,,AOC,,,,,,,,,,,,,,,,,,,,,,,,,,,,,,,,,,,,,,,,,,,,,,,,,,,,,,,,,,,,AOC
