Type :,Summary :,Updated By :,Updated On :,Document :,BOQ Comparative Chart :,Type :.1,Summary :.1,Updated By :.1,Updated On :.1,Document :.1,Contract Date :,Contract Value :,Work Completion Period in days :,Updated By :.2,Updated on :,AOC document :,AOC Description :,Committee Chairperson/Co-ordinator Name :,Committee Chairperson/Co-ordinator Type :,Committee Members :,Updated By :.3,Updated On :.2,Financial Bid Opening Date:,Document :.2,S.No,Bid Number,Bidder Name,Submitted Date,Status,Remarks,Status Updated On,S.No.1,Bid Number.1,Bidder Name.1,Awarded Currency,Awarded Value,Organisation Chain :,Tender ID :,Tender Ref No :,Tender Title :,Committee Chairperson/Co-ordinator Name :.1,Committee Chairperson/Co-ordinator Type :.1,Committee Members :.1,Updated By :.4,Updated on :.1,Document :.3,Tender Stage,Name,Address,S.No,Instrument Type,EMD Amount in ₹,EMD Exemption Allowed,EMD Fee Type,EMD Percentage,EMD Payable To,EMD Payable At,Publish Date,Bid Opening Date,Document Download / Sale Start Date,Document Download / Sale End Date,Clarification Start Date,Clarification End Date,Bid Submission Start Date,Bid Submission End Date,Financial Bid Opening Date,Organisation Chain,Tender Reference Number,Tender ID,Withdrawal Allowed,Tender Type,Form of contract,Tender Category,No. of Covers,General Technical Evaluation Allowed,ItemWise Technical Evaluation Allowed,Payment Mode,Is Multi Currency Allowed For BOQ,Is Multi Currency Allowed For Fee,Allow Two Stage Bidding,Tender Fee in ₹,Fee Payable To,Fee Payable At,Tender Fee Exemption Allowed,Title,Work Description,Pre Qualification Details,Independent External Monitor/Remarks,Tender Value in ₹,Product Category,Sub category,Contract Type,Bid Validity(Days),Period Of Work(Days),Location,Pincode,Pre Bid Meeting Place,Pre Bid Meeting Address,Pre Bid Meeting Date,Bid Opening Place,Should Allow NDA Tender,Allow Preferential Bidder,Cover No,Cover,Document Type,Description,Tender Stage
Finance,Financial bid opening summary attached,Mukesh Kumar Hira,15-Jul-2017 06:22 PM,finance_23090.pdf,BOQ Comparative Chart,Technical,Bid opening summary attached,Mukesh Kumar Hira,15-Jul-2017 05:21 PM,technical_23090.pdf,21-Jun-2019,"INR 6,595,436",180.0,Naresh Dhiman,21-Jun-2019 02:08 PM,Dhiman.pdf (156.00 KB),-----,Er M K Hira,Internal,Sh Pawan Kumar HDM Sh Manoranjan DAO Sh Varinder Kumar Supdt Sh Gurmeet Singh TA,Mukesh Kumar Hira,15-Jul-2017 05:23 PM,15-Jul-2017 05:25 PM,techsummary_23090.pdf (120.75 KB),1.0,63457.0,OP DHIMAN,11-Jul-2017 12:10 PM,Accepted-AOC,Found L-1,21-Jun-2019 02:08 PM,1.0,63457.0,OP DHIMAN,INR,"6,595,436","HP Irrigation and Public Health||Una Circle,Irrigation and Public Health,HP||Una-I,Irrigation and Public Health,HP",2017_HPIPH_16994_1,No. IDU-I/E-tender/17-26443-92 dt 24-6-17,Improvement of distribution system of Lower Rora Lower Dharampur Lower Nangal Khurd Lower Kante Badehra Lawana Majra Ispur Mohalla Bahti Beetan in Haroli Consty in Distt Una HP,-,Internal,---,Naresh Dhiman,21-Jun-2019 01:14 PM,finsummary_23090.pdf (156.04 KB),AOC,Executive Engineer IPH Divn No.1 Una HP,Executive Engineer IPH Divn No.1 Una HP,1.0,DD - Demand Draft,"88,677",Yes,fixed,,Executive Engineer IPH Divn No.1 Una HP,Executive Engineer IPH Divn No.1 Una HP,26-Jun-2017 10:00 AM,15-Jul-2017 11:00 AM,26-Jun-2017 10:00 AM,14-Jul-2017 05:00 PM,26-Jun-2017 10:00 AM ,14-Jul-2017 05:00 PM ,26-Jun-2017 10:00 AM,14-Jul-2017 05:00 PM,15-Jul-2017 05:25 PM,"HP Irrigation and Public Health||Una Circle,Irrigation and Public Health,HP||Una-I,Irrigation and Public Health,HP",No. IDU-I/E-tender/17-26443-92 dt 24-6-17,2017_HPIPH_16994_1,Yes,Open Tender,Item Rate,Works,2.0,No,No,Offline,No,No,No,800.0,Executive Engineer IPH Divn No.1 Una HP,Executive Engineer IPH Divn No.1 Una HP,Yes,Improvement of distribution system of Lower Rora Lower Dharampur Lower Nangal Khurd Lower Kante Badehra Lawana Majra Ispur Mohalla Bahti Beetan in Haroli Consty in Distt Una HP,SH C O of OHSR 65000 litrs capacity 2 Nos 105000 litrs capacity 52000 litrs capacity 90000 litrs capacity with 15 meter staging height and 46000 litrs capacity with 10 meter staging height and construction of 3 Nos pump houses,"Earnest Money cost of tender document Copy of EPF number Work done certificate Sale tax number Income tax number or latest their clearance Certificate, Registration with IPH Department in appropriate class and latest renewal thereof  ",NA ,"56,17,718",Civil Works,NA ,Tender,120.0,180.0,Haroli Consty in Distt Una HP,174303.0,NA ,NA ,NA ,Una HP,No ,No,1.0,Fee/PreQual/Technical,.pdf,Registration with IPH department,AOC
,,,,,,,,,,,,,,,,,,,,,,,,,2.0,63658.0,RAMAN KUMAR,14-Jul-2017 11:44 AM,Rejected-AOC,Not found L-1,21-Jun-2019 02:08 PM,,,,,,,,,,,,,,,,AOC,,,2.0,SS - Small Savings Instrument,,,,,,,,,,,,,,,,,,,,,,,,,,,,,,,,,,,,,,,,,,,,,,,,,,,,,,.pdf,Cost of tender form,AOC
,,,,,,,,,,,,,,,,,,,,,,,,,3.0,63656.0,SHIV KANT PRASHAR,13-Jul-2017 11:39 PM,Rejected-AOC,Not found L-1,21-Jun-2019 02:08 PM,,,,,,,,,,,,,,,,AOC,,,3.0,FDR - Fixed Deposit,,,,,,,,,,,,,,,,,,,,,,,,,,,,,,,,,,,,,,,,,,,,,,,,,,,,,,.pdf,Income tax sale tax registration and PAN number EPF number,AOC
,,,,,,,,,,,,,,,,,,,,,,,,,,,,,,,,,,,,,,,,,,,,,,,AOC,,,,,,,,,,,,,,,,,,,,,,,,,,,,,,,,,,,,,,,,,,,,,,,,,,,,,,,,,,.pdf,Work done certificate and undertaking regarding he has executed work two or more work under divn,AOC
,,,,,,,,,,,,,,,,,,,,,,,,,,,,,,,,,,,,,,,,,,,,,,,AOC,,,,,,,,,,,,,,,,,,,,,,,,,,,,,,,,,,,,,,,,,,,,,,,,,,,,,,,,,,.pdf,EMD exemption certificate if exempted and affidavit of non exhaustion in case of exemption,AOC
,,,,,,,,,,,,,,,,,,,,,,,,,,,,,,,,,,,,,,,,,,,,,,,AOC,,,,,,,,,,,,,,,,,,,,,,,,,,,,,,,,,,,,,,,,,,,,,,,,,,,,,,,,2.0,Finance,.xls,BOQ,AOC
