Cover No,Cover,Document Type,Description,Tender Fee in ₹,Fee Payable To,Fee Payable At,Tender Fee Exemption Allowed,Title,Work Description,Pre Qualification Details,Independent External Monitor/Remarks,Tender Value in ₹,Product Category,Sub category,Contract Type,Bid Validity(Days),Period Of Work(Days),Location,Pincode,Pre Bid Meeting Place,Pre Bid Meeting Address,Pre Bid Meeting Date,Bid Opening Place,Should Allow NDA Tender,Allow Preferential Bidder,Publish Date,Bid Opening Date,Document Download / Sale Start Date,Document Download / Sale End Date,Clarification Start Date,Clarification End Date,Bid Submission Start Date,Bid Submission End Date,Financial Bid Opening Date,Organisation Chain,Tender Reference Number,Tender ID,Withdrawal Allowed,Tender Type,Form of contract,Tender Category,No. of Covers,General Technical Evaluation Allowed,ItemWise Technical Evaluation Allowed,Payment Mode,Is Multi Currency Allowed For BOQ,Is Multi Currency Allowed For Fee,Allow Two Stage Bidding,Name,Address,S.No,Instrument Type,EMD Amount in ₹,EMD Exemption Allowed,EMD Fee Type,EMD Percentage,EMD Payable To,EMD Payable At,Tender Stage,Committee Chairperson/Co-ordinator Name :,Committee Chairperson/Co-ordinator Type :,Committee Members :,Updated By :,Updated on :,Document :,Organisation Chain :,Tender ID :,Tender Ref No :,Tender Title :,S.No,Bid Number,Bidder Name,Submitted Date,Status,Remarks,Status Updated On,Committee Chairperson/Co-ordinator Name :.1,Committee Chairperson/Co-ordinator Type :.1,Committee Members :.1,Updated By :.1,Updated On :,Financial Bid Opening Date:,Document :.1,Type :,Summary :,Updated By :.2,Updated On :.1,Document :.2,Type :.1,Summary :.1,Updated By :.3,Updated On :.2,Document :.3,BOQ Comparative Chart :,Tender Stage
1.0,Fee/PreQual/Technical,.pdf,Certificate of registration with IPH Department in appropriate class and latest renewal thereof.,250.0,EEIPH Division Barsar,EEIPH Division Barsar,Yes,Shifting of pipe line in respect of IPH Sub Division Bhota Store section due to National High Way N.H.-130 from Shimla Hamirpur Dharamsala in Tehsil Barsar Distt. Hamirpur Deposit work SH Excavation laying jointing and testing of GMS pipe of var,Shifting of pipe line in respect of IPH Sub Division Bhota Store section due to National High Way N.H.-130 from Shimla Hamirpur Dharamsala in Tehsil Barsar Distt. Hamirpur Deposit work SH Excavation laying jointing and testing of GMS pipe of var,Please refer Tender documents. ,NA ,"3,44,844",Civil Works,NA ,Tender,120.0,NA ,IPH Sub Division Bhota,174305.0,NA ,NA ,NA ,EEIPH Division Barsar,No ,No,09-Aug-2017 05:00 PM,17-Aug-2017 11:30 AM,09-Aug-2017 05:00 PM,16-Aug-2017 04:00 PM,09-Aug-2017 05:00 PM ,09-Aug-2017 05:00 PM ,09-Aug-2017 05:00 PM,16-Aug-2017 04:00 PM,23-Aug-2017 09:00 AM,"HP Irrigation and Public Health||Hamirpur Circle,Irrigation and Public Health,HP||Barsar,Irrigation and Public Health,HP",No. EE IPH BBR TA E-Tender 2016-17-6333-46,2017_HPIPH_17630_1,Yes,Open Tender,Item Rate,Works,2.0,No,No,Offline,No,No,No,EEIPH Division Barsar,EEIPH Division Barsar,1.0,SS - Small Savings Instrument,"6,897",Yes,fixed,,EEIPH Division Barsar,EEIPH Division Barsar,AOC,EE IPH division Barsar,Internal,Sh. Shushil Kumar Sr. Assistant Supdtt. Gr-II HDM IPH Division Barsar,Jitender Kumar,18-Jun-2019 06:45 PM,finsummary_23869.pdf (42.08 KB),"HP Irrigation and Public Health||Hamirpur Circle,Irrigation and Public Health,HP||Barsar,Irrigation and Public Health,HP",2017_HPIPH_17630_1,No. EE IPH BBR TA E-Tender 2016-17-6333-46,Shifting of pipe line in respect of IPH Sub Division Bhota Store section due to National High Way N.H.-130 from Shimla Hamirpur Dharamsala in Tehsil Barsar Distt. Hamirpur Deposit work SH Excavation laying jointing and testing of GMS pipe of var,1.0,65681.0,GOVIND CONTRACTOR PVT LTD,15-Aug-2017 12:11 PM,Accepted-AOC,Accepted as L2,18-Jun-2019 06:48 PM,EE IPH Division Barsar,Internal,Sr. Asstt. Ajay Supdtt. Gr-II HDM Barsa,Rajender Kumar Khawla,22-Aug-2017 06:44 PM,23-Aug-2017 09:00 AM,techsummary_23869.pdf (85.90 KB),Technical,BOS,Rajender Kumar Khawla,22-Aug-2017 06:42 PM,technical_23869.pdf,Finance,BOS,Rajender Kumar Khawla,23-Aug-2017 01:20 PM,finance_23869.pdf,BOQ Comparative Chart,AOC
,,.pdf,Earnest money amounting to Rs6897. only plugged in favour of EE IPH Division Barsar,,,,,,,,,,,,,,,,,,,,,,,,,,,,,,,,,,,,,,,,,,,,,,,,2.0,FDR - Fixed Deposit,,,,,,,AOC,,,,,,,,,,,2.0,65741.0,M/s.Pawan Kumar Sharma,14-Aug-2017 10:12 PM,Not Admitted-Finance,Not qualified for AOC,23-Aug-2017 01:20 PM,,,,,,,,,,,,,,,,,,,AOC
,,.pdf,The cost of tender form demand draft in favour of E E IPH Divin. Barsar amounting to Rs. 250 four h,,,,,,,,,,,,,,,,,,,,,,,,,,,,,,,,,,,,,,,,,,,,,,,,,,,,,,,,AOC,,,,,,,,,,,3.0,65806.0,SHARMA INTERPRISES,16-Aug-2017 01:56 PM,Accepted-AOC,Accepted as L3,18-Jun-2019 06:48 PM,,,,,,,,,,,,,,,,,,,AOC
,,.pdf,Tin and GST registration No. and latest clearance certificates thereof.,,,,,,,,,,,,,,,,,,,,,,,,,,,,,,,,,,,,,,,,,,,,,,,,,,,,,,,,AOC,,,,,,,,,,,4.0,65737.0,VINAY KUMAR SHARDA,14-Aug-2017 07:01 PM,Accepted-AOC,Awarded as L1,18-Jun-2019 06:48 PM,,,,,,,,,,,,,,,,,,,AOC
,,.pdf,Under taking from the contractor firm who have already two or more incomplete work in hand in this D,,,,,,,,,,,,,,,,,,,,,,,,,,,,,,,,,,,,,,,,,,,,,,,,,,,,,,,,AOC,,,,,,,,,,,,,,,,,,,,,,,,,,,,,,,,,,,,AOC
,,.pdf,Copy of EPF/GST registration No.,,,,,,,,,,,,,,,,,,,,,,,,,,,,,,,,,,,,,,,,,,,,,,,,,,,,,,,,AOC,,,,,,,,,,,,,,,,,,,,,,,,,,,,,,,,,,,,AOC
2.0,Finance,.xls,BOQ where contractor will quote his offer for each item,,,,,,,,,,,,,,,,,,,,,,,,,,,,,,,,,,,,,,,,,,,,,,,,,,,,,,,,AOC,,,,,,,,,,,,,,,,,,,,,,,,,,,,,,,,,,,,AOC
