Type :,Summary :,Updated By :,Updated On :,Document :,S.No,Bid Number,Bidder Name,Submitted Date,Status,Remarks,Status Updated On,Committee Chairperson/Co-ordinator Name :,Committee Chairperson/Co-ordinator Type :,Committee Members :,Updated By :.1,Updated On :.1,Financial Bid Opening Date:,Document :.1,Organisation Chain :,Tender ID :,Tender Ref No :,Tender Title :,Tender Stage,Tender Fee in ₹,Fee Payable To,Fee Payable At,Tender Fee Exemption Allowed,S.No,Instrument Type,EMD Amount in ₹,EMD Exemption Allowed,EMD Fee Type,EMD Percentage,EMD Payable To,EMD Payable At,Organisation Chain,Tender Reference Number,Tender ID,Withdrawal Allowed,Tender Type,Form of contract,Tender Category,No. of Covers,General Technical Evaluation Allowed,ItemWise Technical Evaluation Allowed,Payment Mode,Is Multi Currency Allowed For BOQ,Is Multi Currency Allowed For Fee,Allow Two Stage Bidding,Title,Work Description,Pre Qualification Details,Independent External Monitor/Remarks,Tender Value in ₹,Product Category,Sub category,Contract Type,Bid Validity(Days),Period Of Work(Days),Location,Pincode,Pre Bid Meeting Place,Pre Bid Meeting Address,Pre Bid Meeting Date,Bid Opening Place,Should Allow NDA Tender,Allow Preferential Bidder,Cover No,Cover,Document Type,Description,Name,Address,Publish Date,Bid Opening Date,Document Download / Sale Start Date,Document Download / Sale End Date,Clarification Start Date,Clarification End Date,Bid Submission Start Date,Bid Submission End Date,Financial Bid Opening Date,Tender Stage
Technical,Summary,Krishan Kumar Kaushal,01-Dec-2018 12:00 PM,technical_34222.pdf,1.0,100501.0,RAJ PAL SINGH GOVT CONT,17-Nov-2018 07:35 AM,Rejected-AOC,L-4,25-Jun-2019 05:39 PM,Er. K K Kaushal,Internal,Sh. Meg Singh Rana Supdt Sh. Partap Singh DHD,Krishan Kumar Kaushal,01-Dec-2018 12:03 PM,01-Dec-2018 12:10 PM,techsummary_34222.pdf (173.87 KB),PWD,2018_PWD_24480_1,No.PW.SRJ.ETender/2018 4153-55 dated 26.10.2018,C/O Missing CD work on Bilagad Magarugalla road km 0/0 to 8/500 (SH- C/O 6.00 mtr Span RCC Slab culvert with both side wing wall at RD 0/670),AOC,500.0,EE Seraj at janjehli,Seraj at janjehli,Yes,1.0,DD - Demand Draft,"26,400",Yes,fixed,,EE Seraj at janjehli,Seraj at janjehli,PWD,No.PW.SRJ.ETender/2018 4153-55 dated 26.10.2018,2018_PWD_24480_1,Yes,Open Tender,Item Rate,Works,2.0,No,No,Offline,No,No,No,C/O Missing CD work on Bilagad Magarugalla road km 0/0 to 8/500 (SH- C/O 6.00 mtr Span RCC Slab culvert with both side wing wall at RD 0/670),C/O Missing CD work on Bilagad Magarugalla road km 0/0 to 8/500 (SH- C/O 6.00 mtr Span RCC Slab culvert with both side wing wall at RD 0/670),Please refer Tender documents. ,NA ,"13,18,615",Civil Works,NA ,Tender,90.0,90.0,Janjehli,175047.0,NA ,NA ,NA ,EE Janjehli,No ,No,1.0,Fee/PreQual/Technical,.pdf,Cost of tender form (General rule No. 26.1),EE Janjehli,Executive Engineer Seraj Division HP PWD Janjehli,06-Nov-2018 01:00 PM,17-Nov-2018 11:00 AM,06-Nov-2018 01:30 PM,17-Nov-2018 09:00 AM,NA ,NA ,06-Nov-2018 01:30 PM,17-Nov-2018 09:00 AM,01-Dec-2018 12:10 PM,AOC
,,,,,2.0,100425.0,RISHABH THAKUR,16-Nov-2018 04:38 PM,Rejected-AOC,L-3,25-Jun-2019 05:39 PM,,,,,,,,,,,,AOC,,,,,2.0,BC - Bankers Cheque,,,,,,,,,,,,,,,,,,,,,,,,,,,,,,,,,,,,,,,,,.pdf,Earnest Money (General rule No. 26.2),,,,,,,,,,,,AOC
,,,,,3.0,100467.0,SHOBHA RAM GOVT CONT,16-Nov-2018 07:50 PM,Rejected-AOC,L-2,25-Jun-2019 05:39 PM,,,,,,,,,,,,AOC,,,,,3.0,FDR - Fixed Deposit,,,,,,,,,,,,,,,,,,,,,,,,,,,,,,,,,,,,,,,,,.pdf,Contractor registration (General rule No. 26.3),,,,,,,,,,,,AOC
,,,,,4.0,100417.0,Taru Ram,16-Nov-2018 06:27 PM,Accepted-AOC,L-1,25-Jun-2019 05:39 PM,,,,,,,,,,,,AOC,,,,,,,,,,,,,,,,,,,,,,,,,,,,,,,,,,,,,,,,,,,,,,,.pdf,GST registration (General rule No. 26.4),,,,,,,,,,,,AOC
,,,,,,,,,,,,,,,,,,,,,,,AOC,,,,,,,,,,,,,,,,,,,,,,,,,,,,,,,,,,,,,,,,,,,,,,,.pdf,Work done and work in hand certificate(General rule 26.5),,,,,,,,,,,,AOC
,,,,,,,,,,,,,,,,,,,,,,,AOC,,,,,,,,,,,,,,,,,,,,,,,,,,,,,,,,,,,,,,,,,,,,,,,.pdf,List of machinery tool plant (General rule 26.6),,,,,,,,,,,,AOC
,,,,,,,,,,,,,,,,,,,,,,,AOC,,,,,,,,,,,,,,,,,,,,,,,,,,,,,,,,,,,,,,,,,,,,,,,.pdf,Employees Provident Fund and Miscellaneous Provision Act 1952 (General rule 25 A),,,,,,,,,,,,AOC
,,,,,,,,,,,,,,,,,,,,,,,AOC,,,,,,,,,,,,,,,,,,,,,,,,,,,,,,,,,,,,,,,,,,,,,2.0,Finance,.xls,BOQ,,,,,,,,,,,,AOC
