EMD Amount in ₹,EMD Exemption Allowed,EMD Fee Type,EMD Percentage,EMD Payable To,EMD Payable At,Cover No,Cover,Document Type,Description,Tender Fee in ₹,Fee Payable To,Fee Payable At,Tender Fee Exemption Allowed,Publish Date,Bid Opening Date,Document Download / Sale Start Date,Document Download / Sale End Date,Clarification Start Date,Clarification End Date,Bid Submission Start Date,Bid Submission End Date,Financial Bid Opening Date,S.No,Bank Name,Organisation Chain,Tender Reference Number,Tender ID,Withdrawal Allowed,Tender Type,Form of contract,Tender Category,No. of Covers,General Technical Evaluation Allowed,ItemWise Technical Evaluation Allowed,Payment Mode,Is Multi Currency Allowed For BOQ,Is Multi Currency Allowed For Fee,Allow Two Stage Bidding,Title,Work Description,Pre Qualification Details,Independent External Monitor/Remarks,Tender Value in ₹,Product Category,Sub category,Contract Type,Bid Validity(Days),Period Of Work(Days),Location,Pincode,Pre Bid Meeting Place,Pre Bid Meeting Address,Pre Bid Meeting Date,Bid Opening Place,Should Allow NDA Tender,Allow Preferential Bidder,Name,Address,Tender Stage,Contract Date :,Contract Value :,Work Completion Period in days :,Updated By :,Updated on :,AOC document :,AOC Description :,Type :,Summary :,Updated By :.1,Updated On :,Document :,BOQ Comparative Chart :,Type :.1,Summary :.1,Updated By :.2,Updated On :.1,Document :.1,Committee Chairperson/Co-ordinator Name :,Committee Chairperson/Co-ordinator Type :,Committee Members :,Updated By :.3,Updated On :.2,Financial Bid Opening Date:,Document :.2,S.No,Bid Number,Bidder Name,Submitted Date,Status,Remarks,Status Updated On,Committee Chairperson/Co-ordinator Name :.1,Committee Chairperson/Co-ordinator Type :.1,Committee Members :.1,Updated By :.4,Updated on :.1,Document :.3,S.No.1,Bid Number.1,Bidder Name.1,Awarded Currency,Awarded Value,Organisation Chain :,Tender ID :,Tender Ref No :,Tender Title :,Tender Stage
"17,250",Yes,fixed,,Executive Engineer Jal Shakti Division Shillai,Executive Engineer Jal Shakti Division Shillai,1.0,Fee/PreQual/Technical,.pdf,Earnest Money as mentioned in NIT,250.0,Executive Engineer Jal Shakti Division Shillai,Executive Engineer Jal Shakti Division Shillai,No,24-Aug-2022 05:00 PM,02-Sep-2022 12:30 PM,24-Aug-2022 05:00 PM,01-Sep-2022 05:00 PM,NA ,NA ,24-Aug-2022 05:00 PM,01-Sep-2022 05:00 PM,06-Sep-2022 01:00 PM,1.0,ICICI BANK,"HP Irrigation and Public Health||Nahan Circle,Irrigation and Public Health,HP",SHL-SMR03-780-JSV DIV-SHILLAI-3731-80 DT 24.08.22,2022_HPIPH_64000_1,Yes,Open Tender,Item Rate,Works,2.0,No,No,Both(Online/Offline),No,No,No,Construction of GWSS to Bakras in GP Bakras Tehsil Shillai Distt Sirmour HP,SH C O 2 Nos RCC Intake 2 Nos Storage tank Laying jointing of GI pipes,Please refer Tender documents. ,NA ,"8,61,819",Civil Works,NA ,Tender,120.0,180.0,Shillai,173027.0,NA ,NA ,NA ,Shillai,No ,No,Executive Engineer Jal Shakti Division Shillai,Executive Engineer Jal Shakti Division Shillai,AOC,22-Oct-2022,"INR 861,819",180.0,Rajesh Kumar,22-Oct-2022 11:48 AM,Awardletter_bakras.pdf (411.00 KB),Awarded,Finance,Financial Bid Opening Summary,Rajesh Kumar,06-Sep-2022 01:14 PM,finance_96418.pdf,BOQ Comparative Chart,Technical,Technical Bid Opening Proceeding,Rajesh Kumar,06-Sep-2022 12:54 PM,technical_96418.pdf,Rajesh Kumar,Internal,TA Supdt HDM DAO AE EE,Rajesh Kumar,06-Sep-2022 12:59 PM,06-Sep-2022 01:00 PM,techsummary_96418.pdf (149.36 KB),1.0,298644.0,Dhanvir Singh,01-Sep-2022 02:49 PM,Rejected-Finance,Rejected,22-Oct-2022 11:46 AM,Rajesh Kumar,Internal,TA HDM AE Shillai Supdt EE,Rajesh Kumar,22-Oct-2022 11:46 AM,finsummary_96418.pdf (76.25 KB),1.0,298402.0,SUNIL DUTT,INR,"668,062","HP Irrigation and Public Health||Nahan Circle,Irrigation and Public Health,HP",2022_HPIPH_64000_1,SHL-SMR03-780-JSV DIV-SHILLAI-3731-80 DT 24.08.22,Construction of GWSS to Bakras in GP Bakras Tehsil Shillai Distt Sirmour HP,AOC
,,,,,,,,.pdf,Tender Fees as mentioned in NIT,,,,,,,,,,,,,,2.0,ICICI NEFT/RTGS,,,,,,,,,,,,,,,,,,,,,,,,,,,,,,,,,,,AOC,,,,,,,,,,,,,,,,,,,,,,,,,,2.0,298765.0,KARAM BIR SINGH,01-Sep-2022 01:12 PM,Not Admitted-Fee/PreQual/Technical,Not Complied with technical specification,06-Sep-2022 12:54 PM,,,,,,,,,,,,,,,,AOC
,,,,,,,,.pdf,Certificate of registration with Jal Shakti Vibhag in appropriate Class and latest renewal thereof,,,,,,,,,,,,,,,,,,,,,,,,,,,,,,,,,,,,,,,,,,,,,,,,,,AOC,,,,,,,,,,,,,,,,,,,,,,,,,,3.0,298096.0,Kuldeep Singh,29-Aug-2022 12:30 PM,Rejected-Finance,Rejected,22-Oct-2022 11:46 AM,,,,,,,,,,,,,,,,AOC
,,,,,,,,.pdf,"Copy of EPF registration, GST and PAN as mentioned in NIT",,,,,,,,,,,,,,,,,,,,,,,,,,,,,,,,,,,,,,,,,,,,,,,,,,AOC,,,,,,,,,,,,,,,,,,,,,,,,,,4.0,298762.0,munshi ram,01-Sep-2022 03:07 PM,Rejected-Finance,Rejected,22-Oct-2022 11:46 AM,,,,,,,,,,,,,,,,AOC
,,,,,,,,.pdf,"Joint Venture is not allowed, undertaking thereof as mentioned in NIT",,,,,,,,,,,,,,,,,,,,,,,,,,,,,,,,,,,,,,,,,,,,,,,,,,AOC,,,,,,,,,,,,,,,,,,,,,,,,,,5.0,298626.0,rattan singh,01-Sep-2022 04:22 PM,Rejected-Finance,Rejected,22-Oct-2022 11:46 AM,,,,,,,,,,,,,,,,AOC
,,,,,,,,.pdf,Undertaking of carefully studied all the terms and conditions as mentioned in NIT,,,,,,,,,,,,,,,,,,,,,,,,,,,,,,,,,,,,,,,,,,,,,,,,,,AOC,,,,,,,,,,,,,,,,,,,,,,,,,,6.0,298529.0,SOHAN SINGH,31-Aug-2022 10:38 AM,Rejected-Finance,Rejected,22-Oct-2022 11:46 AM,,,,,,,,,,,,,,,,AOC
,,,,,,,,.pdf,affidavit specifying that the benefit availed under earnest money exemption has not been exhausted s,,,,,,,,,,,,,,,,,,,,,,,,,,,,,,,,,,,,,,,,,,,,,,,,,,AOC,,,,,,,,,,,,,,,,,,,,,,,,,,7.0,298402.0,SUNIL DUTT,30-Aug-2022 03:57 PM,Accepted-AOC,Awarded,22-Oct-2022 11:49 AM,,,,,,,,,,,,,,,,AOC
,,,,,,,,.pdf,undertaking that he will comply with the provision of contract Labour (Regulation of Abolition) HP r,,,,,,,,,,,,,,,,,,,,,,,,,,,,,,,,,,,,,,,,,,,,,,,,,,AOC,,,,,,,,,,,,,,,,,,,,,,,,,,8.0,298484.0,SUNIL THAKUR,01-Sep-2022 04:12 PM,Rejected-Finance,Rejected,22-Oct-2022 11:46 AM,,,,,,,,,,,,,,,,AOC
,,,,,,2.0,Finance,.xls,BOQ,,,,,,,,,,,,,,,,,,,,,,,,,,,,,,,,,,,,,,,,,,,,,,,,,,AOC,,,,,,,,,,,,,,,,,,,,,,,,,,,,,,,,,,,,,,,,,,,,,,,,AOC
