Title,Work Description,Pre Qualification Details,Independent External Monitor/Remarks,Tender Value in ₹,Product Category,Sub category,Contract Type,Bid Validity(Days),Period Of Work(Days),Location,Pincode,Pre Bid Meeting Place,Pre Bid Meeting Address,Pre Bid Meeting Date,Bid Opening Place,Should Allow NDA Tender,Allow Preferential Bidder,Organisation Chain,Tender Reference Number,Tender ID,Withdrawal Allowed,Tender Type,Form of contract,Tender Category,No. of Covers,General Technical Evaluation Allowed,ItemWise Technical Evaluation Allowed,Payment Mode,Is Multi Currency Allowed For BOQ,Is Multi Currency Allowed For Fee,Allow Two Stage Bidding,Name,Address,EMD Amount in ₹,EMD Exemption Allowed,EMD Fee Type,EMD Percentage,EMD Payable To,EMD Payable At,Tender Fee in ₹,Fee Payable To,Fee Payable At,Tender Fee Exemption Allowed,S.No,Category,Sub Category,Sub Category Description,Format/File,S.No.1,Instrument Type,Publish Date,Bid Opening Date,Document Download / Sale Start Date,Document Download / Sale End Date,Clarification Start Date,Clarification End Date,Bid Submission Start Date,Bid Submission End Date,Financial Bid Opening Date,Cover No,Cover,Document Type,Description,Type :,Summary :,Updated By :,Updated On :,Document :,BOQ Comparative Chart :,S.No.2,Bid Number,Bidder Name,Awarded Currency,Awarded Value,S.No.1.1,Bid Number.1,Bidder Name.1,Submitted Date,Status,Remarks,Status Updated On,Type :.1,Summary :.1,Updated By :.1,Updated On :.1,Document :.1,Organisation Chain :,Tender ID :,Tender Ref No :,Tender Title :,Committee Chairperson/Co-ordinator Name :,Committee Chairperson/Co-ordinator Type :,Committee Members :,Updated By :.2,Updated On :.2,Financial Bid Opening Date:,Document :.2,Committee Chairperson/Co-ordinator Name :.1,Committee Chairperson/Co-ordinator Type :.1,Committee Members :.1,Updated By :.3,Updated on :,Document :.3,Contract Date :,Contract Value :,Work Completion Period in days :,Updated By :.4,Updated on :.1,AOC document :,AOC Description :
C/o Steel footpath on Kalka Shimla Wangtoo Road NH 22 (New NH 05) in various reaches between km 153/180 to 155/00 against Smart City Project,C/o Steel footpath on Kalka Shimla Wangtoo Road NH 22 (New NH 05) in various reaches between km 153/180 to 155/00 against Smart City Project,As per tender document ,NA ,,Civil Works,NA ,Tender,120.0,365.0,Shimla,171012.0,NA ,NA ,NA ,Solan,No ,No,PWD,221-252 DATED 19.04.2021,2021_PWD_46785_1,Yes,Open Tender,Item Rate,Works,2.0,No,No,Offline,No,No,No,Executive Engineer NH Division HPPWD Solan,Executive Engineer NH Division HPPWD Solan,"3,72,800",No,fixed,,Executive Engineer NH Division HPPWD Solan,Solan,"5,000",Executive Engineer NH Division HPPWD Solan,Solan,No,1.0,Certificate Details ,Permanent Account Number ,Permanent Account Number Details ,,1.0,DD - Demand Draft,22-Apr-2021 05:00 PM,30-Apr-2021 11:00 AM,22-Apr-2021 05:00 PM,30-Apr-2021 10:30 AM,NA ,NA ,22-Apr-2021 05:00 PM,30-Apr-2021 10:30 AM,07-May-2021 12:00 PM,1.0,Fee/PreQual/Technical,.pdf,Cost of tender and earnest money,Finance,financial summary,Kulbir Singh Thakur,07-May-2021 02:58 PM,finance_70308.pdf,BOQ Comparative Chart,1.0,210420.0,RITESH SOOD,INR,"19,322,700",1.0,210420.0,RITESH SOOD,30-Apr-2021 05:24 AM,Accepted-AOC,being L1,07-Aug-2023,Technical,Technical summary,Kulbir Singh Thakur,07-May-2021 11:26 AM,technical_70308.pdf,PWD,2021_PWD_46785_1,221-252 DATED 19.04.2021,C/o Steel footpath on Kalka Shimla Wangtoo Road NH 22 (New NH 05) in various reaches between km 153/180 to 155/00 against Smart City Project,Er Kulbir Singh Thakur EE,Internal,Miss Akriti Agrrawal AO Sh Ghanshyam Mehta HDM Sh Rajinder Singh Supdtt Gr II Smt Samriti Verma TA,Kulbir Singh Thakur,07-May-2021 11:32 AM,07-May-2021 12:00 PM,techsummary_70308.pdf (586.48 KB),Er Kulbir Singh Thakur EE,Internal,Miss Akriti Aggrawal AO Sh Ghanshyam Mehta HDM Sh Rajinder Singh Supdtt Gr II Smt Samriti Verma TA,Kulbir Singh Thakur,07-May-2021 03:02 PM,finsummary_70308.pdf (237.58 KB),19-Oct-2022,"INR 19,322,700",365.0,Kulbir Singh Thakur,07-Aug-2023 02:23 PM,riteshLOA.pdf (415.00 KB),AOC
,,,,,,,,,,,,,,,,,,,,,,,,,,,,,,,,,,,,,,,,,,,,2.0,Certificate Details ,Sales Tax/VAT ,Sales Tax/VAT ,,2.0,FDR - Fixed Deposit,,,,,,,,,,,,.pdf,contractor registration,,,,,,,,,,,,,,,,,,,,,,,,,,,,,,,,,,,,,,,,,,,,,,,
,,,,,,,,,,,,,,,,,,,,,,,,,,,,,,,,,,,,,,,,,,,,3.0,Certificate Details ,Bidders Address Format ,Bidders Address Format Details ,,,,,,,,,,,,,,,.pdf,EPF Number,,,,,,,,,,,,,,,,,,,,,,,,,,,,,,,,,,,,,,,,,,,,,,,
,,,,,,,,,,,,,,,,,,,,,,,,,,,,,,,,,,,,,,,,,,,,4.0,Certificate Details ,Affidavit regarding correctness of bid ,Required in tender document in bidder file 1 ,,,,,,,,,,,,,,,.pdf,GST / Sales Tax number,,,,,,,,,,,,,,,,,,,,,,,,,,,,,,,,,,,,,,,,,,,,,,,
,,,,,,,,,,,,,,,,,,,,,,,,,,,,,,,,,,,,,,,,,,,,5.0,Miscellaneous ,Existing Work Order Commitment ,Ongoing Work Order Details with percentage of work completed ,,,,,,,,,,,,,,,.pdf,"List of machinery, tools and plant",,,,,,,,,,,,,,,,,,,,,,,,,,,,,,,,,,,,,,,,,,,,,,,
,,,,,,,,,,,,,,,,,,,,,,,,,,,,,,,,,,,,,,,,,,,,6.0,Work Details ,Work Completed Certificate Copies ,Work Completed Certificate Copies ,,,,,,,,,,,,,,,.pdf,Form of bid,,,,,,,,,,,,,,,,,,,,,,,,,,,,,,,,,,,,,,,,,,,,,,,
,,,,,,,,,,,,,,,,,,,,,,,,,,,,,,,,,,,,,,,,,,,,,,,,,,,,,,,,,,,,,,.pdf,Affidavit regarding correctness of all the documents,,,,,,,,,,,,,,,,,,,,,,,,,,,,,,,,,,,,,,,,,,,,,,,
,,,,,,,,,,,,,,,,,,,,,,,,,,,,,,,,,,,,,,,,,,,,,,,,,,,,,,,,,,,,,,.pdf,Affidavit regarding gazetted and non gazetted employees in HPPWD related to him,,,,,,,,,,,,,,,,,,,,,,,,,,,,,,,,,,,,,,,,,,,,,,,
,,,,,,,,,,,,,,,,,,,,,,,,,,,,,,,,,,,,,,,,,,,,,,,,,,,,,,,,,,,,,,.pdf,Work in hand,,,,,,,,,,,,,,,,,,,,,,,,,,,,,,,,,,,,,,,,,,,,,,,
,,,,,,,,,,,,,,,,,,,,,,,,,,,,,,,,,,,,,,,,,,,,,,,,,,,,,,,,,,,,,,.pdf,Work done certificate,,,,,,,,,,,,,,,,,,,,,,,,,,,,,,,,,,,,,,,,,,,,,,,
,,,,,,,,,,,,,,,,,,,,,,,,,,,,,,,,,,,,,,,,,,,,,,,,,,,,,,,,,,,,,,.pdf,working programme,,,,,,,,,,,,,,,,,,,,,,,,,,,,,,,,,,,,,,,,,,,,,,,
,,,,,,,,,,,,,,,,,,,,,,,,,,,,,,,,,,,,,,,,,,,,,,,,,,,,,,,,,,,,,,.pdf,Report of CA showing total annual volume in last five years,,,,,,,,,,,,,,,,,,,,,,,,,,,,,,,,,,,,,,,,,,,,,,,
,,,,,,,,,,,,,,,,,,,,,,,,,,,,,,,,,,,,,,,,,,,,,,,,,,,,,,,,,,,,2.0,Finance,.xls,Bill of quantity,,,,,,,,,,,,,,,,,,,,,,,,,,,,,,,,,,,,,,,,,,,,,,,
