Organisation Chain,Tender Reference Number,Tender ID,Withdrawal Allowed,Tender Type,Form of contract,Tender Category,No. of Covers,General Technical Evaluation Allowed,ItemWise Technical Evaluation Allowed,Payment Mode,Is Multi Currency Allowed For BOQ,Is Multi Currency Allowed For Fee,Allow Two Stage Bidding,Cover No,Cover,Document Type,Description,Publish Date,Bid Opening Date,Document Download / Sale Start Date,Document Download / Sale End Date,Clarification Start Date,Clarification End Date,Bid Submission Start Date,Bid Submission End Date,Financial Bid Opening Date,EMD Amount in ₹,EMD Exemption Allowed,EMD Fee Type,EMD Percentage,EMD Payable To,EMD Payable At,S.No,Bank Name,Tender Fee in ₹,Fee Payable To,Fee Payable At,Tender Fee Exemption Allowed,Name,Address,Title,Work Description,Pre Qualification Details,Independent External Monitor/Remarks,Tender Value in ₹,Product Category,Sub category,Contract Type,Bid Validity(Days),Period Of Work(Days),Location,Pincode,Pre Bid Meeting Place,Pre Bid Meeting Address,Pre Bid Meeting Date,Bid Opening Place,Should Allow NDA Tender,Allow Preferential Bidder,Tender Stage
HPSEBL||CE(OP) South||SE(OP) Solan,29-2025-26,2025_HPSEB_123843_1,Yes,Open Tender,Turn-key,Works,2.0,No,No,Online,No,No,No,1.0,Fee/PreQual/Technical,.pdf,Proof of EMD and Tender Fee,18-Dec-2025 04:00 PM,27-Dec-2025 12:00 PM,18-Dec-2025 04:10 PM,26-Dec-2025 03:00 PM,18-Dec-2025 04:10 PM,24-Dec-2025 10:00 AM,18-Dec-2025 04:10 PM,26-Dec-2025 03:00 PM,27-Dec-2025 04:35 PM,555.0,No,percentage,1.0%,Nil,Nil,1.0,ICICI BANK,590.0,Nil,Nil,No,Sr.Executive Engineer,"Sr. Executive office ELectrical Division HPSEBL Parwanoo, Sector-1 Parwanoo.",29-2025-26,etenderingpnpartialturmnkeybasisforprovadditionalpoleunderesdhpseblKasauli,Please refer Tender documents.,,"55,495",Electrical Works,,Tender,180.0,30.0,Sr.Executive Office Parwanoo,173220.0,,,,Parwanoo,No,No,AOC
,,,,,,,,,,,,,,,,.pdf,A-Class Electrical License with Chief Electrical Inspector Shimla.,,,,,,,,,,,,,,,,2.0,ICICI NEFT/RTGS,,,,,,,,,,,,,,,,,,,,,,,,,AOC
,,,,,,,,,,,,,,,,.pdf,Bid Capacity/Turnover certificate with CA Certified (Balance Sheets and ITR not Mandatory),,,,,,,,,,,,,,,,,,,,,,,,,,,,,,,,,,,,,,,,,,AOC
,,,,,,,,,,,,,,,,.pdf,GST NO. and Pan Card,,,,,,,,,,,,,,,,,,,,,,,,,,,,,,,,,,,,,,,,,,AOC
,,,,,,,,,,,,,,,,.pdf,"Work Done Certificate/completion certificate as per SBD Volume-I, Section-III, Clause No. 1.0",,,,,,,,,,,,,,,,,,,,,,,,,,,,,,,,,,,,,,,,,,AOC
,,,,,,,,,,,,,,,,.pdf,Affidavit for Blacklisting/change of ownership/litigation,,,,,,,,,,,,,,,,,,,,,,,,,,,,,,,,,,,,,,,,,,AOC
,,,,,,,,,,,,,,,,.pdf,EPFO/ESI No.,,,,,,,,,,,,,,,,,,,,,,,,,,,,,,,,,,,,,,,,,,AOC
,,,,,,,,,,,,,,2.0,Finance,.xls,BOQ,,,,,,,,,,,,,,,,,,,,,,,,,,,,,,,,,,,,,,,,,,AOC
