Organisation Chain,Tender Reference Number,Tender ID,Withdrawal Allowed,Tender Type,Form of contract,Tender Category,No. of Covers,General Technical Evaluation Allowed,ItemWise Technical Evaluation Allowed,Payment Mode,Is Multi Currency Allowed For BOQ,Is Multi Currency Allowed For Fee,Allow Two Stage Bidding,Cover No,Cover,Document Type,Description,Publish Date,Bid Opening Date,Document Download / Sale Start Date,Document Download / Sale End Date,Clarification Start Date,Clarification End Date,Bid Submission Start Date,Bid Submission End Date,Financial Bid Opening Date,EMD Amount in ₹,EMD Exemption Allowed,EMD Fee Type,EMD Percentage,EMD Payable To,EMD Payable At,S.No,Bank Name,Tender Fee in ₹,Fee Payable To,Fee Payable At,Tender Fee Exemption Allowed,Name,Address,Title,Work Description,Pre Qualification Details,Independent External Monitor/Remarks,Tender Value in ₹,Product Category,Sub category,Contract Type,Bid Validity(Days),Period Of Work(Days),Location,Pincode,Pre Bid Meeting Place,Pre Bid Meeting Address,Pre Bid Meeting Date,Bid Opening Place,Should Allow NDA Tender,Allow Preferential Bidder,Tender Stage
"HP Irrigation and Public Health||Kullu Circle,Irrigation and Public Health,HP||Kullu -1,Irrigation and Public Health,HP",6128-78 Manauni Jaun,2025_HPIPH_116368_1,Yes,Open Tender,Item Rate,Works,2.0,No,No,Both(Online/Offline),No,No,No,1.0,Fee/PreQual/Technical,.pdf,Earnest Money and Cost of tender as per NIT,30-Sep-2025 05:00 PM,10-Oct-2025 11:30 AM,30-Sep-2025 05:00 PM,09-Oct-2025 05:00 PM,,,30-Sep-2025 05:00 PM,09-Oct-2025 05:00 PM,28-Oct-2025 11:15 AM,"5,000",No,fixed,,Executive Engineer,Jal Shakti Division Kullu,1.0,ICICI BANK,500.0,Executive Engineer,Jal Shakti Division Kullu,No,Executive Engineer,jal shakti division kullu,Retrofitting of various WSS in GP Shat Jallugran in Tehsil Bhuntar Distt. Kullu,SH Excavation laying jointing and testing of GI pipe 32mm dia in Govt. Middle School  Barogi and Manauni Jaun,Please refer Tender documents.,,"2,47,865",Civil Works,,Tender,120.0,60.0,Jallugran,175126.0,,,,jal shakti division kullu,No,No,AOC
,,,,,,,,,,,,,,,,.pdf,Certificate of registration as per NIT,,,,,,,,,,,,,,,,2.0,ICICI NEFT/RTGS,,,,,,,,,,,,,,,,,,,,,,,,,AOC
,,,,,,,,,,,,,,,,.pdf,Copy of PAN No GST registration EPF registration as per NIT,,,,,,,,,,,,,,,,,,,,,,,,,,,,,,,,,,,,,,,,,,AOC
,,,,,,,,,,,,,,,,.pdf,Scanned copy of undertaking that i have carefully studied all the Terms and Condition as per NIT,,,,,,,,,,,,,,,,,,,,,,,,,,,,,,,,,,,,,,,,,,AOC
,,,,,,,,,,,,,,,,.pdf,The authorization letter regarding digital signature certificate (DSC) as per NIT,,,,,,,,,,,,,,,,,,,,,,,,,,,,,,,,,,,,,,,,,,AOC
,,,,,,,,,,,,,,2.0,Finance,.xls,BOQ,,,,,,,,,,,,,,,,,,,,,,,,,,,,,,,,,,,,,,,,,,AOC
