Organisation Chain,Tender Reference Number,Tender ID,Withdrawal Allowed,Tender Type,Form of contract,Tender Category,No. of Covers,General Technical Evaluation Allowed,ItemWise Technical Evaluation Allowed,Payment Mode,Is Multi Currency Allowed For BOQ,Is Multi Currency Allowed For Fee,Allow Two Stage Bidding,Cover No,Cover,Document Type,Description,Publish Date,Bid Opening Date,Document Download / Sale Start Date,Document Download / Sale End Date,Clarification Start Date,Clarification End Date,Bid Submission Start Date,Bid Submission End Date,Financial Bid Opening Date,EMD Amount in ₹,EMD Exemption Allowed,EMD Fee Type,EMD Percentage,EMD Payable To,EMD Payable At,S.No,Category,Sub Category,Sub Category Description,Format/File,S.No.1,Bank Name,Tender Fee in ₹,Fee Payable To,Fee Payable At,Tender Fee Exemption Allowed,Name,Address,Title,Work Description,Pre Qualification Details,Independent External Monitor/Remarks,Tender Value in ₹,Product Category,Sub category,Contract Type,Bid Validity(Days),Period Of Work(Days),Location,Pincode,Pre Bid Meeting Place,Pre Bid Meeting Address,Pre Bid Meeting Date,Bid Opening Place,Should Allow NDA Tender,Allow Preferential Bidder,Tender Stage
PWD,10418-38 Dated-29.11.2025,2025_PWD_123496_5,Yes,Open Tender,Percentage,Works,2.0,No,No,Online,No,No,No,1.0,Fee/PreQual/Technical,.pdf,Scanned copy of Registration /Enlistment with  HPPWD,13-Dec-2025 12:30 PM,18-Dec-2025 02:30 PM,13-Dec-2025 12:30 PM,18-Dec-2025 02:00 PM,,,13-Dec-2025 12:30 PM,18-Dec-2025 02:00 PM,03-Jan-2026 06:40 PM,"22,000",No,fixed,,Nil,Nil,1.0,Certificate Details,Affidavit regarding correctness of bid,Required in tender document in bidder file 1,,1.0,ICICI BANK,350.0,Nil,Nil,Yes,Executive Engineer Banjar division HPPWD Banjar,Near HPPWD rest House  Banjar Tehsil Banjar District Kullu HP,RRD on Sainj  Ghat Parganoo road Km. 0/00 to 9/00.,Construction of  wire crated R/wall at RD. 3/160 to 3/190) (Under PDNA).,Please refer Tender documents.,,"5,60,072",Civil Works - Roads,,Tender,75.0,90.0,Sainj,175134.0,,,,Banjar,No,No,AOC
,,,,,,,,,,,,,,,,.pdf,Scanned copy of proof of Registration under Employees Provident Fund,,,,,,,,,,,,,,,,,,,,,,,,,,,,,,,,,,,,,,,,,,,,,,,AOC
,,,,,,,,,,,,,,,,.pdf,Scanned copy of PAN   GST  Income Tax Clearance  certificate,,,,,,,,,,,,,,,,,,,,,,,,,,,,,,,,,,,,,,,,,,,,,,,AOC
,,,,,,,,,,,,,,,,.pdf,Copy of online payment i.e. E-challan for EMD and Cost of tender form,,,,,,,,,,,,,,,,,,,,,,,,,,,,,,,,,,,,,,,,,,,,,,,AOC
,,,,,,,,,,,,,,,,.pdf,Scanned copy of work done certificate  i.e. similar nature of work and work in hand detail,,,,,,,,,,,,,,,,,,,,,,,,,,,,,,,,,,,,,,,,,,,,,,,AOC
,,,,,,,,,,,,,,,,.pdf,"Scanned copy machinery detail i.e. JCB, L and T, Tipper,  Mixer, Water Tanker, Vibrator  etc and emp",,,,,,,,,,,,,,,,,,,,,,,,,,,,,,,,,,,,,,,,,,,,,,,AOC
,,,,,,,,,,,,,,,,.pdf,Form 7  and  8 duly signed,,,,,,,,,,,,,,,,,,,,,,,,,,,,,,,,,,,,,,,,,,,,,,,AOC
,,,,,,,,,,,,,,,,.pdf,Affidavit  regarding correctness of bid,,,,,,,,,,,,,,,,,,,,,,,,,,,,,,,,,,,,,,,,,,,,,,,AOC
,,,,,,,,,,,,,,2.0,Finance,.xls,BOQ,,,,,,,,,,,,,,,,,,,,,,,,,,,,,,,,,,,,,,,,,,,,,,,AOC
