Organisation Chain,Tender Reference Number,Tender ID,Withdrawal Allowed,Tender Type,Form of contract,Tender Category,No. of Covers,General Technical Evaluation Allowed,ItemWise Technical Evaluation Allowed,Payment Mode,Is Multi Currency Allowed For BOQ,Is Multi Currency Allowed For Fee,Allow Two Stage Bidding,Cover No,Cover,Document Type,Description,Publish Date,Bid Opening Date,Document Download / Sale Start Date,Document Download / Sale End Date,Clarification Start Date,Clarification End Date,Bid Submission Start Date,Bid Submission End Date,Financial Bid Opening Date,EMD Amount in ₹,EMD Exemption Allowed,EMD Fee Type,EMD Percentage,EMD Payable To,EMD Payable At,S.No,Bank Name,Tender Fee in ₹,Fee Payable To,Fee Payable At,Tender Fee Exemption Allowed,Name,Address,Title,Work Description,Pre Qualification Details,Independent External Monitor/Remarks,Tender Value in ₹,Product Category,Sub category,Contract Type,Bid Validity(Days),Period Of Work(Days),Location,Pincode,Pre Bid Meeting Place,Pre Bid Meeting Address,Pre Bid Meeting Date,Bid Opening Place,Should Allow NDA Tender,Allow Preferential Bidder,Tender Stage
HPSEBL||CE(ES) Hamirpur||SE(Design) Hamirpur||Senior Executive Engineer-IV,SSD-575/2025,2025_HPSEB_119193_1,Yes,Open Tender,Percentage,Works,2.0,No,No,Online,No,No,No,1.0,Fee/PreQual/Technical,.pdf,Technical Qualification Related Documents,31-Oct-2025 03:00 PM,15-Nov-2025 03:00 PM,31-Oct-2025 05:00 PM,14-Nov-2025 01:00 PM,,,01-Nov-2025 10:00 AM,14-Nov-2025 01:00 PM,01-Dec-2025 02:30 PM,"14,209",No,fixed,,Nil,Nil,1.0,ICICI BANK,590.0,Nil,Nil,No,"SE(Design), ES, HPSEBL, Hamirpur","O/o SE(Design), ES, HPSEBL, Hamirpur at Mattansidh (H.P.)- 177001","Preliminary and Detailed survey including route alignment, profiling, Tower Spotting, Optimization of Locations, Contouring,  Soil tests etc. complete in all respect for the Rerouting of 132kV DC line Larji-Bajaura, T-1 to T-18 under ES Div. Mandi","Preliminary and Detailed survey including route alignment, profiling, Tower Spotting, Optimization of Locations, Contouring,  Soil tests etc. complete in all respect for the Rerouting of 132kV DC line Larji-Bajaura, T-1 to T-18 under ES Div. Mandi",As per Tender specifications,,"14,20,921",Electrical Works,,Tender,180.0,45.0,Distt. Mandi HP,175121.0,"O/o SE(Design), ES, HPSEBL, Hamirpur at Mattansidh","O/o SE(Design), ES, HPSEBL, Hamirpur at Mattansidh (H.P.)- 177001",06-Nov-2025 11:30 AM,"Mattansidh, Hamirpur",No,No,AOC
,,,,,,,,,,,,,,,,.pdf,Finance / Commercial Qualification related documents,,,,,,,,,,,,,,,,2.0,ICICI NEFT/RTGS,,,,,,,,,,,,,,,,,,,,,,,,,AOC
,,,,,,,,,,,,,,,,.pdf,Signed copy of Detailed Estimate,,,,,,,,,,,,,,,,,,,,,,,,,,,,,,,,,,,,,,,,,,AOC
,,,,,,,,,,,,,,,,.pdf,"Proforma for Bid, Letter of Undertaking and other Tender Forms",,,,,,,,,,,,,,,,,,,,,,,,,,,,,,,,,,,,,,,,,,AOC
,,,,,,,,,,,,,,,,.pdf,"Contractor License, GST, PAN, ITRs, Audited financial statements, Bid Capacity etc.",,,,,,,,,,,,,,,,,,,,,,,,,,,,,,,,,,,,,,,,,,AOC
,,,,,,,,,,,,,,,,.pdf,"Undertaking regarding non-blacklisting of firm, Power of Attorney etc.",,,,,,,,,,,,,,,,,,,,,,,,,,,,,,,,,,,,,,,,,,AOC
,,,,,,,,,,,,,,,,.rar,Any other Tender related document,,,,,,,,,,,,,,,,,,,,,,,,,,,,,,,,,,,,,,,,,,AOC
,,,,,,,,,,,,,,2.0,Finance,.xls,Percentage BOQ,,,,,,,,,,,,,,,,,,,,,,,,,,,,,,,,,,,,,,,,,,AOC
