Committee Chairperson/Co-ordinator Name :,Committee Chairperson/Co-ordinator Type :,Committee Members :,Updated By :,Updated On :,Financial Bid Opening Date:,Document :,Organisation Chain :,Tender ID :,Tender Ref No :,Tender Title :,S.No,Bid Number,Bidder Name,Submitted Date,Status,Remarks,Status Updated On,S.No.1,Bid Number.1,Bidder Name.1,Awarded Currency,Awarded Value,Contract Date :,Contract Value :,Work Completion Period in days :,Updated By :.1,Updated on :,AOC document :,AOC Description :,Committee Chairperson/Co-ordinator Name :.1,Committee Chairperson/Co-ordinator Type :.1,Committee Members :.1,Updated By :.2,Updated on :.1,Document :.1,Type :,Summary :,Updated By :.3,Updated On :.1,Document :.2,BOQ Comparative Chart :,Type :.1,Summary :.1,Updated By :.4,Updated On :.2,Document :.3,Tender Stage,Name,Address,Publish Date,Bid Opening Date,Document Download / Sale Start Date,Document Download / Sale End Date,Clarification Start Date,Clarification End Date,Bid Submission Start Date,Bid Submission End Date,Financial Bid Opening Date,S.No,Corrigendum Title,Corrigendum Type,View,Title,Work Description,Pre Qualification Details,Independent External Monitor/Remarks,Tender Value in ₹,Product Category,Sub category,Contract Type,Bid Validity(Days),Period Of Work(Days),Location,Pincode,Pre Bid Meeting Place,Pre Bid Meeting Address,Pre Bid Meeting Date,Bid Opening Place,Should Allow NDA Tender,Allow Preferential Bidder,EMD Amount in ₹,EMD through BG/ST or EMD Exemption Allowed,EMD Fee Type,EMD Percentage,EMD Payable To,EMD Payable At,Tender Fee in ₹,Fee Payable To,Fee Payable At,Tender Fee Exemption Allowed,S.No.1,Instrument Type,Cover No,Cover,Document Type,Description,Organisation Chain,Tender Reference Number,Tender ID,Withdrawal Allowed,Tender Type,Form of contract,Tender Category,No. of Covers,General Technical Evaluation Allowed,ItemWise Technical Evaluation Allowed,Payment Mode,Is Multi Currency Allowed For BOQ,Is Multi Currency Allowed For Fee,Allow Two Stage Bidding,Tender Stage
MANAGING DIRECTOR,Internal,"D.C PHUKAN, V.KR L, A.N HAZARIKA, M.K BARUAH",Utpal Borgohain,18-Nov-2019 02:35 PM,18-Nov-2019 02:40 PM,techsummary_21552.pdf (414.22 KB),Industries and Commerce Department||Assam Gas Company Ltd - ICD,2019_ICD_13962_1,AGCL/BD/PMC-GHT/VALVES/2019/24 DT 29/08/19,PROCUREMENT OF MAINLINE VALVES,1,65254,MICROFINISH VALVES PVT LTD,24-Oct-2019 05:00 PM,Not Admitted-Fee/PreQual/Technical,Not Complied with technical specification,18-Nov-2019 02:27 PM,1.0,64605.0,Tirupati Industrial Stores,INR,39854239.0,26-Feb-2020,INR 39854239,150.0,Utpal Borgohain,26-Feb-2020 04:12 PM,MAINLINE_VALVES_LOI.pdf (1812.00 KB),M/s Tirupati Industrial Stores is awarded the contract to supply of ball valve pipe line,MANAGING DIRECTOR,Internal,"D. K DUTTA, D.C PHUKAN, M.K. BARUAH, A.N HAZARIKA,V.KR L",Utpal Borgohain,26-Feb-2020 04:09 PM,finsummary_21552.pdf (492.40 KB),Finance,LOI for above tender is attached,Utpal Borgohain,11-Jan-2020 10:22 AM,finance_21552.pdf,BOQ Comparative Chart,Technical,"Only Tirupati Industrial Stores, Tinsukia is technically qualified . P.C note attached",Utpal Borgohain,18-Nov-2019 02:27 PM,technical_21552.pdf,AOC,CM C AND BD,ASSAM GAS COMPANY LIMITED DULIAJAN ASSAM 786602,29-Aug-2019 02:00 PM,28-Oct-2019 03:00 PM,29-Aug-2019 02:00 PM,28-Oct-2019 02:30 PM,29-Aug-2019 06:00 PM ,11-Sep-2019 06:00 PM ,13-Sep-2019 09:00 AM,28-Oct-2019 02:30 PM,18-Nov-2019 02:40 PM,1.0,CORRIGENDUM 5,Date,,PROCUREMENT OF MAINLINE VALVES,PROCUREMENT OF MAINLINE VALVES,Please refer Tender documents. ,NA ,0.0,Supply of Materials,NA ,Tender,180.0,150.0,URIAMGHAT,785601.0,NOIDA ,VCS QUALITY SERVICES PVT LTD B 10 2ND FLOOR BAJAJ BHAWAN SECTOR 3 NOIDA 201301 ,12-Sep-2019 10:00 AM ,DULIAJAN,No ,No,"5,58,000",Yes,fixed,,ASSAM GAS COMPANY LIMITED,DULIAJAN,"15,000",ASSAM GAS COMPANY LIMITED,DULIAJAN,Yes,1.0,DD - Demand Draft,1.0,Fee/PreQual/Technical,.pdf,COMMERCIAL,Industries and Commerce Department||Assam Gas Company Ltd - ICD,AGCL/BD/PMC-GHT/VALVES/2019/24 DT 29/08/19,2019_ICD_13962_1,Yes,Open Tender,Item Rate,Goods,2.0,No,No,Offline,No,No,No,AOC
,,,,,,,,,,,2,66381,SPARE PARTS ENTERPRISE,28-Oct-2019 01:48 PM,Not Admitted-Fee/PreQual/Technical,Not Complied with technical specification,18-Nov-2019 02:27 PM,,,,,,,,,,,,,,,,,,,,,,,,,,,,,,AOC,,,,,,,,,,,,2.0,CORRIGENDUM 1,Other,,,,,,,,,,,,,,,,,,,,,,,,,,,,,,2.0,BC - Bankers Cheque,,,.pdf,TECHNICAL,,,,,,,,,,,,,,,AOC
,,,,,,,,,,,3,65491,SteelStrong Valves (I) Pvt. Ltd.,24-Oct-2019 11:43 AM,Not Admitted-Fee/PreQual/Technical,Not Complied with technical specification,18-Nov-2019 02:27 PM,,,,,,,,,,,,,,,,,,,,,,,,,,,,,,AOC,,,,,,,,,,,,3.0,TECHNICAL QUERIES,Technical Bid,,,,,,,,,,,,,,,,,,,,,,,,,,,,,,3.0,BG - Bank Guarantee Irrevocable,2.0,Finance,.xls,SOR,,,,,,,,,,,,,,,AOC
,,,,,,,,,,,4,64605,Tirupati Industrial Stores,27-Oct-2019 12:50 PM,Accepted-AOC,awarded and qualified as L1 BIDDER. Amt is exclusive of GST,26-Feb-2020 04:12 PM,,,,,,,,,,,,,,,,,,,,,,,,,,,,,,AOC,,,,,,,,,,,,,,,,,,,,,,,,,,,,,,,,,,,,,,,,,,,,,,,,,,,,,,,,,,,,,,,,AOC
,,,,,,,,,,,5,66105,ZED VALVES COMPANY PRIVATE LIMITED,19-Oct-2019 07:16 PM,Not Admitted-Fee/PreQual/Technical,Not Complied with technical specification,18-Nov-2019 02:27 PM,,,,,,,,,,,,,,,,,,,,,,,,,,,,,,AOC,,,,,,,,,,,,,,,,,,,,,,,,,,,,,,,,,,,,,,,,,,,,,,,,,,,,,,,,,,,,,,,,AOC
