Title,Work Description,Pre Qualification Details,Independent External Monitor/Remarks,Tender Value in ₹,Product Category,Sub category,Contract Type,Bid Validity(Days),Period Of Work(Days),Location,Pincode,Pre Bid Meeting Place,Pre Bid Meeting Address,Pre Bid Meeting Date,Bid Opening Place,Should Allow NDA Tender,Allow Preferential Bidder,Name,Address,Publish Date,Bid Opening Date,Document Download / Sale Start Date,Document Download / Sale End Date,Clarification Start Date,Clarification End Date,Bid Submission Start Date,Bid Submission End Date,Financial Bid Opening Date,Tender Fee in ₹,Fee Payable To,Fee Payable At,Tender Fee Exemption Allowed,S.No,Instrument Type,Cover No,Cover,Document Type,Description,EMD Amount in ₹,EMD Exemption Allowed,EMD Fee Type,EMD Percentage,EMD Payable To,EMD Payable At,Organisation Chain,Tender Reference Number,Tender ID,Withdrawal Allowed,Tender Type,Form of contract,Tender Category,No. of Covers,General Technical Evaluation Allowed,ItemWise Technical Evaluation Allowed,Payment Mode,Is Multi Currency Allowed For BOQ,Is Multi Currency Allowed For Fee,Allow Two Stage Bidding,Tender Stage,Committee Chairperson/Co-ordinator Name :,Committee Chairperson/Co-ordinator Type :,Committee Members :,Updated By :,Updated on :,Document :,Organisation Chain :,Tender ID :,Tender Ref No :,Tender Title :,S.No,Bid Number,Bidder Name,Awarded Currency,Awarded Value,S.No.1,Bid Number.1,Bidder Name.1,Submitted Date,Status,Remarks,Status Updated On,Committee Chairperson/Co-ordinator Name :.1,Committee Chairperson/Co-ordinator Type :.1,Committee Members :.1,Updated By :.1,Updated On :,Financial Bid Opening Date:,Document :.1,Contract Date :,Contract Value :,Work Completion Period in days :,Updated By :.2,Updated on :.1,AOC document :,AOC Description :,Type :,Summary :,Updated By :.3,Updated On :.1,Document :.2,Type :.1,Summary :.1,Updated By :.4,Updated On :.2,Document :.3,BOQ Comparative Chart :,Tender Stage
Construction of CID office Building at Bilaspur Distt Bilaspur HP including internal water supply and sanitary installation external sewerage system development of site and Co 5000 litres capacity Rain Water Harvesting Tank,Construction of CID office Building at Bilaspur Distt Bilaspur HP including internal water supply and sanitary installation external sewerage system development of site and Co 5000 litres capacity Rain Water Harvesting Tank,Please refer to tender documents ,NA ,"74,08,316",Civil Works,NA ,Tender,120.0,270.0,Bilaspur,174001.0,NA ,NA ,NA ,EE HIMUDA DIVISION MANDI,No ,No,EE HIMUDA DIVISION MANDI,EE HIMUDA DIVISION MANDI,18-Oct-2019 04:00 PM,02-Nov-2019 11:30 AM,19-Oct-2019 10:30 AM,30-Oct-2019 05:00 PM,NA ,NA ,19-Oct-2019 10:30 AM,30-Oct-2019 05:00 PM,05-Nov-2019 12:20 PM,"5,000",EE HIMUDA DIVISION MANDI,EE HIMUDA DIVISION MANDI,Yes,1.0,DD - Demand Draft,1.0,Fee/PreQual/Technical,.pdf,Cost of Tender Document (As per NIT),"1,06,585",Yes,fixed,,EE HIMUDA DIVISION MANDI,EE HIMUDA DIVISION MANDI,"Himachal Urban Development Authority||Supdt. Engineer (N),HIMUDA",HIMUDA-MD-E-87/2019,2019_HIMUD_32193_1,Yes,Open Tender,Item Rate,Works,2.0,No,No,Offline,No,No,No,AOC,Er Lalit Thakur,Internal,Smt Bandana Katoch Sh Biri Singh Sh Rakesh Kumar,Lalit Thakur,05-Nov-2019 12:46 PM,finsummary_46286.pdf (262.25 KB),"Himachal Urban Development Authority||Supdt. Engineer (N),HIMUDA",2019_HIMUD_32193_1,HIMUDA-MD-E-87/2019,Construction of CID office Building at Bilaspur Distt Bilaspur HP including internal water supply and sanitary installation external sewerage system development of site and Co 5000 litres capacity Rain Water Harvesting Tank,1.0,135230.0,Rakesh Kumar,INR,"11,527,040.27",1.0,135230.0,Rakesh Kumar,29-Oct-2019 04:37 PM,Accepted-AOC,Accepted,24-Feb-2020 02:22 PM,Er Lalit Thakur,Internal,Smt Bandana katoch Sh Biri Singh Sh Rakesh Kumar,Lalit Thakur,05-Nov-2019 12:18 PM,05-Nov-2019 12:20 PM,techsummary_46286.pdf (557.63 KB),20-Feb-2020,"INR 11,527,040.27",270.0,Lalit Thakur,24-Feb-2020 02:22 PM,AOCCID.pdf (546.00 KB),Tender has been awarded to Sh Rakesh Kumar,Technical,BIDOPENINGSUMMARY,Lalit Thakur,05-Nov-2019 12:12 PM,technical_46286.pdf,Finance,BIDOPENINGSUMMARY,Lalit Thakur,05-Nov-2019 12:33 PM,finance_46286.pdf,BOQ Comparative Chart,AOC
,,,,,,,,,,,,,,,,,,,,,,,,,,,,,,,,,2.0,FDR - Fixed Deposit,,,.pdf,Earnest Money (As per NIT),,,,,,,,,,,,,,,,,,,,,AOC,,,,,,,,,,,,,,,,2.0,135308.0,Surinder Kumar,30-Oct-2019 02:51 PM,Rejected-AOC,Accepted,24-Feb-2020 02:22 PM,,,,,,,,,,,,,,,,,,,,,,,,,,AOC
,,,,,,,,,,,,,,,,,,,,,,,,,,,,,,,,,,,,,.pdf,Contractor Registration (As mentioned in NIT),,,,,,,,,,,,,,,,,,,,,AOC,,,,,,,,,,,,,,,,,,,,,,,,,,,,,,,,,,,,,,,,,,,,,,,,AOC
,,,,,,,,,,,,,,,,,,,,,,,,,,,,,,,,,,,,,.pdf,"GST Registration, income tax clearance if not than affidavit and PAN (As mentioned in NIT)",,,,,,,,,,,,,,,,,,,,,AOC,,,,,,,,,,,,,,,,,,,,,,,,,,,,,,,,,,,,,,,,,,,,,,,,AOC
,,,,,,,,,,,,,,,,,,,,,,,,,,,,,,,,,,,,,.pdf,"Work done, work in hand certificate if not then affidavit (As mentioned in NIT)",,,,,,,,,,,,,,,,,,,,,AOC,,,,,,,,,,,,,,,,,,,,,,,,,,,,,,,,,,,,,,,,,,,,,,,,AOC
,,,,,,,,,,,,,,,,,,,,,,,,,,,,,,,,,,,,,.pdf,"Exemption certificate for EMD, if any(As per condition of NIT)",,,,,,,,,,,,,,,,,,,,,AOC,,,,,,,,,,,,,,,,,,,,,,,,,,,,,,,,,,,,,,,,,,,,,,,,AOC
,,,,,,,,,,,,,,,,,,,,,,,,,,,,,,,,,,,,,.pdf,Undertaking (As mentioned in NIT),,,,,,,,,,,,,,,,,,,,,AOC,,,,,,,,,,,,,,,,,,,,,,,,,,,,,,,,,,,,,,,,,,,,,,,,AOC
,,,,,,,,,,,,,,,,,,,,,,,,,,,,,,,,,,,,,.pdf,Report of CA for the last five years turnover (indicated in form 6 condition No 36),,,,,,,,,,,,,,,,,,,,,AOC,,,,,,,,,,,,,,,,,,,,,,,,,,,,,,,,,,,,,,,,,,,,,,,,AOC
,,,,,,,,,,,,,,,,,,,,,,,,,,,,,,,,,,,2.0,Finance,.xls,BOQ,,,,,,,,,,,,,,,,,,,,,AOC,,,,,,,,,,,,,,,,,,,,,,,,,,,,,,,,,,,,,,,,,,,,,,,,AOC
