Organisation Chain,Tender Reference Number,Tender ID,Withdrawal Allowed,Tender Type,Form of contract,Tender Category,No. of Covers,General Technical Evaluation Allowed,ItemWise Technical Evaluation Allowed,Payment Mode,Is Multi Currency Allowed For BOQ,Is Multi Currency Allowed For Fee,Allow Two Stage Bidding,Name,Address,Tender Fee in ₹,Fee Payable To,Fee Payable At,Tender Fee Exemption Allowed,Cover No,Cover,Document Type,Description,EMD Amount in ₹,EMD Exemption Allowed,EMD Fee Type,EMD Percentage,EMD Payable To,EMD Payable At,Publish Date,Bid Opening Date,Document Download / Sale Start Date,Document Download / Sale End Date,Clarification Start Date,Clarification End Date,Bid Submission Start Date,Bid Submission End Date,Financial Bid Opening Date,S.No,Bank Name,Title,Work Description,Pre Qualification Details,Independent External Monitor/Remarks,Tender Value in ₹,Product Category,Sub category,Contract Type,Bid Validity(Days),Period Of Work(Days),Location,Pincode,Pre Bid Meeting Place,Pre Bid Meeting Address,Pre Bid Meeting Date,Bid Opening Place,Should Allow NDA Tender,Allow Preferential Bidder,Tender Stage,S.No,Bid Number,Bidder Name,Awarded Currency,Awarded Value,Type :,Summary :,Updated By :,Updated On :,Document :,BOQ Comparative Chart :,S.No.1,Bid Number.1,Bidder Name.1,Submitted Date,Status,Remarks,Status Updated On,Type :.1,Summary :.1,Updated By :.1,Updated On :.1,Document :.1,Organisation Chain :,Tender ID :,Tender Ref No :,Tender Title :,Committee Chairperson/Co-ordinator Name :,Committee Chairperson/Co-ordinator Type :,Committee Members :,Updated By :.2,Updated On :.2,Financial Bid Opening Date:,Document :.2,Committee Chairperson/Co-ordinator Name :.1,Committee Chairperson/Co-ordinator Type :.1,Committee Members :.1,Updated By :.3,Updated on :,Document :.3,Contract Date :,Contract Value :,Work Completion Period in days :,Updated By :.4,Updated on :.1,AOC document :,AOC Description :,Tender Stage
PWD,C/O link road to Harizan Basti Kohin,2021_PWD_53000_1,Yes,Open Tender,Item Rate,Works,2.0,No,No,Online,No,No,No,EE Hamirpur,Executive Engineer HPPWD Hamirpur,"1,000",Nil,Nil,No,1.0,Fee/PreQual/Technical,.pdf,Contractor Registration,"48,500",No,fixed,,Nil,Nil,14-Oct-2021 06:00 PM,21-Oct-2021 11:30 AM,14-Oct-2021 06:00 PM,21-Oct-2021 10:30 AM,NA ,NA ,14-Oct-2021 06:00 PM,21-Oct-2021 10:30 AM,29-Oct-2021 10:30 AM,1.0,ICICI BANK,Construction of link road to Harizan Basti Kohin and Baffrin km 0/0 to 1/700,SH Providing and laying GSB WMM and Metalling/ Tarring in km 0/500 to 1/700 and 80mm thick interlocking paver block at various RDs Under SCSP Head,Please refer Tender documents. ,NA ,"27,32,225",Civil Works - Roads,NA ,Tender,60.0,90.0,Hamirpur,177001.0,NA ,NA ,NA ,Hamirpur,No ,No,AOC,1.0,240936.0,sonam soni,INR,"3,070,402.68",Finance,Attached,Vivek Sharma,18-Nov-2021 06:45 PM,finance_79284.pdf,BOQ Comparative Chart,1.0,240932.0,bhanu partap singh,21-Oct-2021 09:44 AM,Rejected-Technical,Rejected,28-Oct-2021 05:37 PM,Technical,Attached,Vivek Sharma,28-Oct-2021 04:48 PM,technical_79284.pdf,PWD,2021_PWD_53000_1,C/O link road to Harizan Basti Kohin,Construction of link road to Harizan Basti Kohin and Baffrin km 0/0 to 1/700,EEHamirpur,Internal,SupdtHDMSrDAO,Vivek Sharma,28-Oct-2021 05:37 PM,29-Oct-2021 10:30 AM,techsummary_79284.pdf (1023.85 KB),EE Hamirpur,Internal,SupdtHDMSrDAOAEtoEE,Vivek Sharma,18-Nov-2021 06:48 PM,finsummary_79284.pdf (589.53 KB),02-Apr-2022,"INR 2,756,237",90.0,Vivek Sharma,02-Apr-2022 07:51 PM,AwardKohin.pdf (1611.00 KB),Ward,AOC
,,,,,,,,,,,,,,,,,,,,,,.pdf,Work in hand certificate counter signed by Engineer-in-Charge as per General rules direction-16,,,,,,,,,,,,,,,,2.0,ICICI NEFT/RTGS,,,,,,,,,,,,,,,,,,,AOC,,,,,,,,,,,,2.0,240936.0,sonam soni,21-Oct-2021 01:03 AM,Accepted-AOC,l1,02-Apr-2022 07:51 PM,,,,,,,,,,,,,,,,,,,,,,,,,,,,,,AOC
,,,,,,,,,,,,,,,,,,,,,,.pdf,Copy of online receipt of EMD and Cost of Tender form,,,,,,,,,,,,,,,,,,,,,,,,,,,,,,,,,,,,AOC,,,,,,,,,,,,3.0,240938.0,sumeet contractor,21-Oct-2021 01:22 AM,Rejected-Finance,l2,18-Nov-2021 06:48 PM,,,,,,,,,,,,,,,,,,,,,,,,,,,,,,AOC
,,,,,,,,,,,,,,,,,,,,,,.pdf,An Affidavit that information furnished with the bid true and corrects,,,,,,,,,,,,,,,,,,,,,,,,,,,,,,,,,,,,AOC,,,,,,,,,,,,,,,,,,,,,,,,,,,,,,,,,,,,,,,,,,,,,,,,AOC
,,,,,,,,,,,,,,,,,,,,,,.pdf,GST and EPF Registration latest clearance statement,,,,,,,,,,,,,,,,,,,,,,,,,,,,,,,,,,,,AOC,,,,,,,,,,,,,,,,,,,,,,,,,,,,,,,,,,,,,,,,,,,,,,,,AOC
,,,,,,,,,,,,,,,,,,,,,,.pdf,An Affidavit the contr. should not have more two works at a time each of Rs. 100 lacs in any circle,,,,,,,,,,,,,,,,,,,,,,,,,,,,,,,,,,,,AOC,,,,,,,,,,,,,,,,,,,,,,,,,,,,,,,,,,,,,,,,,,,,,,,,AOC
,,,,,,,,,,,,,,,,,,,,,,.pdf,Copy of Pan No,,,,,,,,,,,,,,,,,,,,,,,,,,,,,,,,,,,,AOC,,,,,,,,,,,,,,,,,,,,,,,,,,,,,,,,,,,,,,,,,,,,,,,,AOC
,,,,,,,,,,,,,,,,,,,,,,.pdf,"Detail of machinery as per SBD with proof RC, Affidavit/lease agreement for hired Machinery",,,,,,,,,,,,,,,,,,,,,,,,,,,,,,,,,,,,AOC,,,,,,,,,,,,,,,,,,,,,,,,,,,,,,,,,,,,,,,,,,,,,,,,AOC
,,,,,,,,,,,,,,,,,,,,,,.pdf,Working Programme,,,,,,,,,,,,,,,,,,,,,,,,,,,,,,,,,,,,AOC,,,,,,,,,,,,,,,,,,,,,,,,,,,,,,,,,,,,,,,,,,,,,,,,AOC
,,,,,,,,,,,,,,,,,,,,,,.pdf,PWD Form No 8 in SBD duly signed by the bidder and Witness with complete address,,,,,,,,,,,,,,,,,,,,,,,,,,,,,,,,,,,,AOC,,,,,,,,,,,,,,,,,,,,,,,,,,,,,,,,,,,,,,,,,,,,,,,,AOC
,,,,,,,,,,,,,,,,,,,,,,.pdf,The bidders required to have paver Machine and Hot Mini Plant in the radius of 30km for execution,,,,,,,,,,,,,,,,,,,,,,,,,,,,,,,,,,,,AOC,,,,,,,,,,,,,,,,,,,,,,,,,,,,,,,,,,,,,,,,,,,,,,,,AOC
,,,,,,,,,,,,,,,,,,,,2.0,Finance,.xls,BOQ,,,,,,,,,,,,,,,,,,,,,,,,,,,,,,,,,,,,AOC,,,,,,,,,,,,,,,,,,,,,,,,,,,,,,,,,,,,,,,,,,,,,,,,AOC
