Committee Chairperson/Co-ordinator Name :,Committee Chairperson/Co-ordinator Type :,Committee Members :,Updated By :,Updated on :,Document :,Type :,Summary :,Updated By :.1,Updated On :,Document :.1,Contract Date :,Contract Value :,Work Completion Period in days :,Updated By :.2,Updated on :.1,AOC document :,AOC Description :,S.No,Bid Number,Bidder Name,Submitted Date,Status,Remarks,Status Updated On,Organisation Chain :,Tender ID :,Tender Ref No :,Tender Title :,Committee Chairperson/Co-ordinator Name :.1,Committee Chairperson/Co-ordinator Type :.1,Committee Members :.1,Updated By :.3,Updated On :.1,Financial Bid Opening Date:,Document :.2,S.No.1,Bid Number.1,Bidder Name.1,Awarded Currency,Awarded Value,Type :.1,Summary :.1,Updated By :.4,Updated On :.2,Document :.3,BOQ Comparative Chart :,Tender Stage,Name,Address,Organisation Chain,Tender Reference Number,Tender ID,Withdrawal Allowed,Tender Type,Form of contract,Tender Category,No. of Covers,General Technical Evaluation Allowed,ItemWise Technical Evaluation Allowed,Payment Mode,Is Multi Currency Allowed For BOQ,Is Multi Currency Allowed For Fee,Allow Two Stage Bidding,EMD Amount in ₹,EMD through BG/ST or EMD Exemption Allowed,EMD Fee Type,EMD Percentage,EMD Payable To,EMD Payable At,Tender Fee in ₹,Fee Payable To,Fee Payable At,Tender Fee Exemption Allowed,Publish Date,Bid Opening Date,Document Download / Sale Start Date,Document Download / Sale End Date,Clarification Start Date,Clarification End Date,Bid Submission Start Date,Bid Submission End Date,Financial Bid Opening Date,S.No,Bank Name,Title,Work Description,Pre Qualification Details,Independent External Monitor/Remarks,Tender Value in ₹,Product Category,Sub category,Contract Type,Bid Validity(Days),Period Of Work(Days),Location,Pincode,Pre Bid Meeting Place,Pre Bid Meeting Address,Pre Bid Meeting Date,Bid Opening Place,Should Allow NDA Tender,Allow Preferential Bidder,Cover No,Cover,Document Type,Description,Tender Stage
Director Design,Internal,,Jayanta Kumar Barman,30-Jan-2023 01:32 PM,finsummary_44690.pdf (435.11 KB),Technical,All Bids are opened for Technical Evaluation,Jayanta Kumar Barman,06-Jan-2023 12:29 PM,,03-Apr-2023,INR 88447445,100.0,Jayanta Kumar Barman,24-May-2023 11:12 AM,murkata_morigaon.pdf (2473.00 KB),Anti-erosion measures to protect Murkata area under Mayong Revenue Circle from the erosion of river Brahmaputra,1,170746,D KUMAR AND COMPANY,28-Dec-2022 10:17 AM,Rejected-AOC,Not Qualified for AOC,24-May-2023 11:13 AM,Department of Water Resources||Chief Engineer - DoWR,2022_DoWR_28085_1,MORIGAON/2022-23/RIDF/I,Anti-erosion measures to protect Murkata area under Mayong Revenue Circle from the erosion of river Brahmaputra,Director Design,Internal,,Jayanta Kumar Barman,06-Jan-2023 01:04 PM,06-Jan-2023 01:05 PM,techsummary_44690.pdf (373.81 KB),1.0,170534.0,M/S. M.P. AGARWALLA,INR,88447445.0,Finance,Updated CS may be prepared,Jayanta Kumar Barman,08-Jan-2023 11:48 AM,,BOQ Comparative Chart,AOC,Chief Engineer Water Resources Department,"O/O Chief Engineer Water Resources Department, Basistha, Guwahati 29",Department of Water Resources||Chief Engineer - DoWR,MORIGAON/2022-23/RIDF/I,2022_DoWR_28085_1,Yes,Open Tender,Works,Works,2.0,No,No,Online,No,No,No,"19,65,499",Yes,percentage,2.0%,Nil,Nil,"20,000",Nil,Nil,No,07-Dec-2022 06:30 PM,28-Dec-2022 03:00 PM,07-Dec-2022 06:35 PM,28-Dec-2022 02:00 PM,NA ,NA ,16-Dec-2022 10:00 AM,28-Dec-2022 02:00 PM,06-Jan-2023 01:05 PM,1.0,SBI Bank,Anti-erosion measures to protect Murkata area under Mayong Revenue Circle from the erosion of river Brahmaputra,Anti-erosion measures to protect Murkata area under Mayong Revenue Circle from the erosion of river Brahmaputra,Please refer Tender documents. ,NA ,"9,82,74,939",Civil Works,NA ,Tender,180.0,100.0,Morigaon,782105.0,NA ,NA ,NA ,GUWAHATI,No ,No,1.0,Fee/PreQual/Technical,.pdf,TECHNICAL DOCUMENTS,AOC
,,,,,,,,,,,,,,,,,,2,169558,M/s. Jaichand Lal Singhi,28-Dec-2022 01:16 PM,Rejected-AOC,Not Qualified for AOC,24-May-2023 11:13 AM,,,,,,,,,,,,,,,,,,,,,,,AOC,,,,,,,,,,,,,,,,,,,,,,,,,,,,,,,,,,,,,,,,,,,,,,,,,,,,,,,,2.0,Finance,.xls,BOQ,AOC
,,,,,,,,,,,,,,,,,,3,170534,M/S. M.P. AGARWALLA,28-Dec-2022 11:36 AM,Accepted-AOC,PROPER,24-May-2023 11:13 AM,,,,,,,,,,,,,,,,,,,,,,,AOC,,,,,,,,,,,,,,,,,,,,,,,,,,,,,,,,,,,,,,,,,,,,,,,,,,,,,,,,,,,,AOC
,,,,,,,,,,,,,,,,,,4,170653,TAPAN MEDHI,27-Dec-2022 09:37 PM,Rejected-AOC,Not Qualified for AOC,24-May-2023 11:13 AM,,,,,,,,,,,,,,,,,,,,,,,AOC,,,,,,,,,,,,,,,,,,,,,,,,,,,,,,,,,,,,,,,,,,,,,,,,,,,,,,,,,,,,AOC
,,,,,,,,,,,,,,,,,,5,170766,UCN CONSTRUCTION COMPANY PRIVATE LIMITED,28-Dec-2022 12:02 PM,Rejected-AOC,Not Qualified for AOC,24-May-2023 11:13 AM,,,,,,,,,,,,,,,,,,,,,,,AOC,,,,,,,,,,,,,,,,,,,,,,,,,,,,,,,,,,,,,,,,,,,,,,,,,,,,,,,,,,,,AOC
