Cover No,Cover,Document Type,Description,EMD Amount in ₹,EMD through BG/ST or EMD Exemption Allowed,EMD Fee Type,EMD Percentage,EMD Payable To,EMD Payable At,Publish Date,Bid Opening Date,Document Download / Sale Start Date,Document Download / Sale End Date,Clarification Start Date,Clarification End Date,Bid Submission Start Date,Bid Submission End Date,Financial Bid Opening Date,Tender Fee in ₹,Fee Payable To,Fee Payable At,Tender Fee Exemption Allowed,S.No,Bank Name,Name,Address,Organisation Chain,Tender Reference Number,Tender ID,Withdrawal Allowed,Tender Type,Form of contract,Tender Category,No. of Covers,General Technical Evaluation Allowed,ItemWise Technical Evaluation Allowed,Payment Mode,Is Multi Currency Allowed For BOQ,Is Multi Currency Allowed For Fee,Allow Two Stage Bidding,Title,Work Description,Pre Qualification Details,Independent External Monitor/Remarks,Tender Value in ₹,Product Category,Sub category,Contract Type,Bid Validity(Days),Period Of Work(Days),Location,Pincode,Pre Bid Meeting Place,Pre Bid Meeting Address,Pre Bid Meeting Date,Bid Opening Place,Should Allow NDA Tender,Allow Preferential Bidder,Tender Stage,Type :,Summary :,Updated By :,Updated On :,Document :,BOQ Comparative Chart :,Committee Chairperson/Co-ordinator Name :,Committee Chairperson/Co-ordinator Type :,Committee Members :,Updated By :.1,Updated on :,Document :.1,S.No,Bid Number,Bidder Name,Awarded Currency,Awarded Value,S.No.1,Bid Number.1,Bidder Name.1,Submitted Date,Status,Remarks,Status Updated On,Committee Chairperson/Co-ordinator Name :.1,Committee Chairperson/Co-ordinator Type :.1,Committee Members :.1,Updated By :.2,Updated On :.1,Financial Bid Opening Date:,Document :.2,Organisation Chain :,Tender ID :,Tender Ref No :,Tender Title :,Contract Date :,Contract Value :,Work Completion Period in days :,Updated By :.3,Updated on :.1,AOC document :,AOC Description :,Type :.1,Summary :.1,Updated By :.4,Updated On :.2,Document :.3,Tender Stage
1.0,Fee/PreQual/Technical,.pdf,SBD,"1,04,060",Yes,percentage,2.0%,Nil,Nil,07-Dec-2022 12:00 PM,28-Dec-2022 03:30 PM,07-Dec-2022 12:00 PM,27-Dec-2022 02:00 PM,NA ,NA ,07-Dec-2022 12:00 PM,27-Dec-2022 02:00 PM,10-Feb-2023 01:10 PM,"1,500",Nil,Nil,No,1.0,SBI Bank,"MD, NHM, ASSAM","O/O MD, NHM, ASSAM, CHRISTANBASTI, GUWAHATI-05",National Health Mission||State Programme Management Unit - NHM,NHM-32034/33/2022-CON-NHM/363,2022_NHM_28056_1,Yes,Open Tender,Turn-key,Works,2.0,No,No,Online,No,No,No,Construction of Buildingless Sub Health Centre in Nowkhat SC in Udalguri District under PM ABHIM for the FY 2021 22 under NHM on Turnkey Basis,Construction of Buildingless Sub Health Centre in Nowkhat SC in Udalguri District under PM ABHIM for the FY 2021 22 under NHM on Turnkey Basis,Please refer Tender documents. ,NA ,"52,03,000",Civil Works - Building,NA ,Tender,180.0,180.0,UDALGURI,784509.0,NA ,NA ,NA ,"O/O MD, NHM, ASSAM",No ,No,AOC,Finance,AOC,Arindam Pathak,12-May-2023 06:02 PM,finance_44520.pdf,BOQ Comparative Chart,ED,Internal,,Arindam Pathak,12-May-2023 06:04 PM,finsummary_44520.pdf (358.65 KB),1.0,170224.0,PRANJAL KUMAR PATHAK,INR,5200000.0,1.0,170325.0,ARYA ENTERPRISE,27-Dec-2022 12:54 AM,Rejected-Technical,NOT ADMITTED,10-Feb-2023 12:52 PM,ED,Internal,,Arindam Pathak,10-Feb-2023 12:52 PM,10-Feb-2023 01:10 PM,techsummary_44520.pdf (2819.33 KB),National Health Mission||State Programme Management Unit - NHM,2022_NHM_28056_1,NHM-32034/33/2022-CON-NHM/363,Construction of Buildingless Sub Health Centre in Nowkhat SC in Udalguri District under PM ABHIM for the FY 2021 22 under NHM on Turnkey Basis,12-May-2023,INR 5200000.0,180.0,Arindam Pathak,12-May-2023 06:05 PM,nowakhat.pdf (359.00 KB),WORK ALLOTED,Technical,TBER,Arindam Pathak,10-Feb-2023 12:50 PM,technical_44520.pdf,AOC
,,.pdf,TECHNICAL QUALIFICATION,,,,,,,,,,,,,,,,,,,,,,,,,,,,,,,,,,,,,,,,,,,,,,,,,,,,,,,,AOC,,,,,,,,,,,,,,,,,,2.0,170427.0,M/S M B ENTERPRISE,26-Dec-2022 05:28 PM,Rejected-Finance,NOT ADMITTED,12-May-2023 06:04 PM,,,,,,,,,,,,,,,,,,,,,,,,AOC
,,.pdf,EMD AND TENDER FEE,,,,,,,,,,,,,,,,,,,,,,,,,,,,,,,,,,,,,,,,,,,,,,,,,,,,,,,,AOC,,,,,,,,,,,,,,,,,,3.0,170224.0,PRANJAL KUMAR PATHAK,26-Dec-2022 06:03 PM,Accepted-AOC,WORK ALLOTED,12-May-2023 06:05 PM,,,,,,,,,,,,,,,,,,,,,,,,AOC
2.0,Finance,.xls,BOQ,,,,,,,,,,,,,,,,,,,,,,,,,,,,,,,,,,,,,,,,,,,,,,,,,,,,,,,,AOC,,,,,,,,,,,,,,,,,,4.0,170426.0,SRI MINTU BISWAS,26-Dec-2022 05:42 PM,Rejected-Finance,NOT ADMITTED,12-May-2023 06:04 PM,,,,,,,,,,,,,,,,,,,,,,,,AOC
,,.pdf,FOB,,,,,,,,,,,,,,,,,,,,,,,,,,,,,,,,,,,,,,,,,,,,,,,,,,,,,,,,AOC,,,,,,,,,,,,,,,,,,,,,,,,,,,,,,,,,,,,,,,,,,,,,,,,AOC
