Organisation Chain :,Tender ID :,Tender Ref No :,Tender Title :,S.No,Bid Number,Bidder Name,Submitted Date,Status,Remarks,Status Updated On,Type :,Summary :,Updated By :,Updated On :,Document :,BOQ Comparative Chart :,S.No.1,Bid Number.1,Bidder Name.1,Awarded Currency,Awarded Value,Committee Chairperson/Co-ordinator Name :,Committee Chairperson/Co-ordinator Type :,Committee Members :,Updated By :.1,Updated On :.1,Financial Bid Opening Date:,Document :.1,Committee Chairperson/Co-ordinator Name :.1,Committee Chairperson/Co-ordinator Type :.1,Committee Members :.1,Updated By :.2,Updated on :,Document :.2,Contract Date :,Contract Value :,Work Completion Period in days :,Updated By :.3,Updated on :.1,AOC document :,AOC Description :,Type :.1,Summary :.1,Updated By :.4,Updated On :.2,Document :.3,Tender Stage,EMD Amount in ₹,EMD through BG/ST or EMD Exemption Allowed,EMD Fee Type,EMD Percentage,EMD Payable To,EMD Payable At,Name,Address,Title,Work Description,Pre Qualification Details,Independent External Monitor/Remarks,Tender Value in ₹,Product Category,Sub category,Contract Type,Bid Validity(Days),Period Of Work(Days),Location,Pincode,Pre Bid Meeting Place,Pre Bid Meeting Address,Pre Bid Meeting Date,Bid Opening Place,Should Allow NDA Tender,Allow Preferential Bidder,Publish Date,Bid Opening Date,Document Download / Sale Start Date,Document Download / Sale End Date,Clarification Start Date,Clarification End Date,Bid Submission Start Date,Bid Submission End Date,Financial Bid Opening Date,Tender Fee in ₹,Fee Payable To,Fee Payable At,Tender Fee Exemption Allowed,Organisation Chain,Tender Reference Number,Tender ID,Withdrawal Allowed,Tender Type,Form of contract,Tender Category,No. of Covers,General Technical Evaluation Allowed,ItemWise Technical Evaluation Allowed,Payment Mode,Is Multi Currency Allowed For BOQ,Is Multi Currency Allowed For Fee,Allow Two Stage Bidding,Cover No,Cover,Document Type,Description,S.No,Bank Name,Tender Stage
Public Works Building and NH Department||Chief Engineer-Building - PWBNH||SE-Guwahati Circle-2 - PWBNH,2023_PWBNH_30188_1,SE/BII_Academic bldg_College_Art_Crafts,"Construction of Ground floor of New Academic Building (provision for Three Storied) for one Academic Department cum Library at Govt. College of Art and Crafts, Assam, Basistha, Guwahati-29",1,183086,ABUL FAZAL ABDULLAH,13-Apr-2023 01:21 PM,Rejected-AOC,Unsuccessful bidder,19-May-2023 07:00 PM,Finance,Minutes,Kanak Chandra Roy,19-Apr-2023 01:53 PM,finance_48479.pdf,BOQ Comparative Chart,1.0,182748.0,M/S PIONEER ELECTRONICS,INR,12537992.0,Chairperson,Internal,Member Secretary Members,Kanak Chandra Roy,18-Apr-2023 12:40 PM,19-Apr-2023 11:00 AM,techsummary_48479.pdf (1081.48 KB),Chairperson,Internal,Member Secretary Members,Kanak Chandra Roy,28-Apr-2023 07:08 PM,finsummary_48479.pdf (508.58 KB),19-May-2023,INR 12537992,300.0,Kanak Chandra Roy,19-May-2023 06:59 PM,AoCarts.pdf (2344.00 KB),AoC_Agreement,Technical,Minutes,Kanak Chandra Roy,13-Apr-2023 09:16 PM,technical_48479.pdf,AOC,"3,08,627",Yes,percentage,2.0%,Nil,Nil,"SE, PWD Guwahati Building Circle-II Ghy-3","O/o the SE, PWD Guwahati Building Circle-II Chandmari Ghy-3","Construction of Ground floor of New Academic Building (provision for Three Storied) for one Academic Department cum Library at Govt. College of Art and Crafts, Assam, Basistha, Guwahati-29","Construction of Ground floor of New Academic Building (provision for Three Storied) for one Academic Department cum Library at Govt. College of Art and Crafts, Assam, Basistha, Guwahati-29",Please refer Tender documents. ,NA ,"1,54,31,374",Civil Works - Building,NA ,Tender,180.0,300.0,Basistha Guwahati,781029.0,"O/o the SE, PWD Guwahati Building Circle-II Ghy-3 ","O/o the SE, PWD Guwahati Building Circle-II Chandmari Ghy-3 ",04-Apr-2023 12:00 PM ,"O/o the SE, PWD Guwahati Building Circle-II Ghy-3",No ,No,01-Apr-2023 12:00 PM,13-Apr-2023 04:30 PM,01-Apr-2023 12:00 PM,13-Apr-2023 02:00 PM,NA ,NA ,01-Apr-2023 12:00 PM,13-Apr-2023 02:00 PM,19-Apr-2023 11:00 AM,"3,000",Nil,Nil,No,Public Works Building and NH Department||Chief Engineer-Building - PWBNH||SE-Guwahati Circle-2 - PWBNH,SE/BII_Academic bldg_College_Art_Crafts,2023_PWBNH_30188_1,Yes,Open Tender,Item Wise,Works,2.0,No,No,Online,No,No,No,1.0,Fee/PreQual/Technical,.pdf,Bidding Document,1.0,SBI Bank,AOC
,,,,2,183074,Constellation Construction Company Private Limited,13-Apr-2023 11:18 AM,Rejected-AOC,Unsuccessful bidder,19-May-2023 07:00 PM,,,,,,,,,,,,,,,,,,,,,,,,,,,,,,,,,,,,,AOC,,,,,,,,,,,,,,,,,,,,,,,,,,,,,,,,,,,,,,,,,,,,,,,,,,,,,,,,.pdf,Technical Qualification,,,AOC
,,,,3,182915,GURUCHARAN PRAJAPATI,13-Apr-2023 04:42 AM,Rejected-Technical,Technically not qualified,18-Apr-2023 12:40 PM,,,,,,,,,,,,,,,,,,,,,,,,,,,,,,,,,,,,,AOC,,,,,,,,,,,,,,,,,,,,,,,,,,,,,,,,,,,,,,,,,,,,,,,,,,,,,,2.0,Finance,.xls,BOQ,,,AOC
,,,,4,182748,M/S PIONEER ELECTRONICS,13-Apr-2023 10:44 AM,Accepted-AOC,Successful bidder PBG submitted,19-May-2023 07:00 PM,,,,,,,,,,,,,,,,,,,,,,,,,,,,,,,,,,,,,AOC,,,,,,,,,,,,,,,,,,,,,,,,,,,,,,,,,,,,,,,,,,,,,,,,,,,,,,,,.pdf,Form of bid,,,AOC
,,,,5,183049,UTPAL JYOTI KALITA,13-Apr-2023 10:19 AM,Rejected-AOC,Unsuccessful bidder,19-May-2023 07:00 PM,,,,,,,,,,,,,,,,,,,,,,,,,,,,,,,,,,,,,AOC,,,,,,,,,,,,,,,,,,,,,,,,,,,,,,,,,,,,,,,,,,,,,,,,,,,,,,,,,,,,AOC
