Title,Work Description,Pre Qualification Details,Independent External Monitor/Remarks,Tender Value in ₹,Product Category,Sub category,Contract Type,Bid Validity(Days),Period Of Work(Days),Location,Pincode,Pre Bid Meeting Place,Pre Bid Meeting Address,Pre Bid Meeting Date,Bid Opening Place,Should Allow NDA Tender,Allow Preferential Bidder,S.No,Bank Name,Tender Fee in ₹,Fee Payable To,Fee Payable At,Tender Fee Exemption Allowed,Name,Address,EMD Amount in ₹,EMD Exemption Allowed,EMD Fee Type,EMD Percentage,EMD Payable To,EMD Payable At,Organisation Chain,Tender Reference Number,Tender ID,Withdrawal Allowed,Tender Type,Form of contract,Tender Category,No. of Covers,General Technical Evaluation Allowed,ItemWise Technical Evaluation Allowed,Payment Mode,Is Multi Currency Allowed For BOQ,Is Multi Currency Allowed For Fee,Allow Two Stage Bidding,Publish Date,Bid Opening Date,Document Download / Sale Start Date,Document Download / Sale End Date,Clarification Start Date,Clarification End Date,Bid Submission Start Date,Bid Submission End Date,Financial Bid Opening Date,Cover No,Cover,Document Type,Description,Type :,Summary :,Updated By :,Updated On :,Document :,BOQ Comparative Chart :,S.No.2,Bid Number,Bidder Name,Submitted Date,Status,Remarks,Status Updated On,Committee Chairperson/Co-ordinator Name :,Committee Chairperson/Co-ordinator Type :,Committee Members :,Updated By :.1,Updated On :.1,Financial Bid Opening Date:,Document :.1,Type :.1,Summary :.1,Updated By :.2,Updated On :.2,Document :.2,S.No.1,Bid Number.1,Bidder Name.1,Awarded Currency,Awarded Value,Contract Date :,Contract Value :,Work Completion Period in days :,Updated By :.3,Updated on :,AOC document :,AOC Description :,Organisation Chain :,Tender ID :,Tender Ref No :,Tender Title :,Committee Chairperson/Co-ordinator Name :.1,Committee Chairperson/Co-ordinator Type :.1,Committee Members :.1,Updated By :.4,Updated on :.1,Document :.3
"Repair/Renovation to various residential buildings under division no III Shimla. (SH- Repair of flooring, ceiling, Repair of door windows and other miscellenous repair work in block 20 set no.19 at U.S Club Shimla.)","Repair/Renovation to various residential buildings under division no III Shimla. (SH- Repair of flooring, ceiling, Repair of door windows and other miscellenous repair work in block 20 set no.19 at U.S Club Shimla.)",As per SBD ,NA ,"3,93,945",Civil Works - Buildings,NA ,Tender,75.0,30.0,U.S.Club,171002.0,NA ,NA ,NA ,"E. E. SHIMLA DIVISION NO. III, HPPWD, Shimla-3",No ,No,1.0,ICICI BANK,350.0,Nil,Nil,No,"E. E. SHIMLA DIVISION NO. III, HPPWD, Shimla-3","E. E. SHIMLA DIVISION NO. III, HPPWD, Shimla-3","7,879",No,fixed,,Nil,Nil,PWD,SD-T-23-31980-3200dt.18-3-2023,2023_PWD_71280_17,Yes,Open Tender,Percentage,Works,2.0,No,No,Online,No,No,No,23-Mar-2023 11:10 AM,01-Apr-2023 11:00 AM,23-Mar-2023 11:10 AM,31-Mar-2023 06:00 PM,NA ,NA ,23-Mar-2023 11:10 AM,31-Mar-2023 06:00 PM,04-Apr-2023 01:10 PM,1.0,Fee/PreQual/Technical,.pdf,Cost of tender document as per schedule F (6.3) and Earnest Money as per schedule F (6.5),Finance,BOS,Bhupender Singh,04-Apr-2023 04:42 PM,finance_107558.pdf,BOQ Comparative Chart,1.0,339410.0,jai prakash sharma,29-Mar-2023 03:00 PM,Accepted-AOC,L1,08-Jul-2023,PKVermaE.E.,Internal,SanjeevChauhanSupdt.KamleshMehtaHDMDeepakSharmaSr.DAO,Bhupender Singh,04-Apr-2023 01:00 PM,04-Apr-2023 01:10 PM,techsummary_107558.pdf (297.56 KB),Technical,Bid Opening Summary,Bhupender Singh,04-Apr-2023 12:44 PM,technical_107558.pdf,1.0,339410.0,jai prakash sharma,INR,"399,170",11-May-2023,"INR 399,170",30.0,Bhupender Singh,08-Jul-2023 01:07 PM,JP1.pdf (526.00 KB),AOC,PWD,2023_PWD_71280_17,SD-T-23-31980-3200dt.18-3-2023,"Repair/Renovation to various residential buildings under division no III Shimla. (SH- Repair of flooring, ceiling, Repair of door windows and other miscellenous repair work in block 20 set no.19 at U.S Club Shimla.)",E.E P.K Verma,Internal,ShSanjeevchauhanSupdtdivnoIIIShKamleshMehtaHDMShDeepakSharmaSrDAO,Bhupender Singh,13-Apr-2023 11:27 AM,finsummary_107558.pdf (508.48 KB)
,,,,,,,,,,,,,,,,,,2.0,ICICI NEFT/RTGS,,,,,,,,,,,,,,,,,,,,,,,,,,,,,,,,,,,,,,.pdf,Contractor registration as per general Rule 23 and as per invitation of bid.,,,,,,,2.0,339421.0,Suresh Kumar Sharma,29-Mar-2023 03:30 PM,Rejected-Finance,L2,13-Apr-2023,,,,,,,,,,,,,,,,,,,,,,,,,,,,,,,,,,
,,,,,,,,,,,,,,,,,,,,,,,,,,,,,,,,,,,,,,,,,,,,,,,,,,,,,,,,,.pdf,GST registration as per General Rule No 21. Copy of GST No./ Copy of Tin No. and Copy of PAN Card.,,,,,,,,,,,,,,,,,,,,,,,,,,,,,,,,,,,,,,,,,,,,,,,
,,,,,,,,,,,,,,,,,,,,,,,,,,,,,,,,,,,,,,,,,,,,,,,,,,,,,,,,,.pdf,Proof of registration under Employees Provident Funds and Miscellaneous Provision Act. 1952.,,,,,,,,,,,,,,,,,,,,,,,,,,,,,,,,,,,,,,,,,,,,,,,
,,,,,,,,,,,,,,,,,,,,,,,,,,,,,,,,,,,,,,,,,,,,,,,,,,,,,,,,,.pdf,HP.PWD Form No-7/8,,,,,,,,,,,,,,,,,,,,,,,,,,,,,,,,,,,,,,,,,,,,,,,
,,,,,,,,,,,,,,,,,,,,,,,,,,,,,,,,,,,,,,,,,,,,,,,,,,,,,,,,,.pdf,Affidavit of Gazetted and non-Gazetted HPPWD employees related to him (General Rule No 16).,,,,,,,,,,,,,,,,,,,,,,,,,,,,,,,,,,,,,,,,,,,,,,,
,,,,,,,,,,,,,,,,,,,,,,,,,,,,,,,,,,,,,,,,,,,,,,,,,,,,,,,,,.pdf,"Affidavit of no relative working in PWD, Information furnished in the bid is correct in all respect.",,,,,,,,,,,,,,,,,,,,,,,,,,,,,,,,,,,,,,,,,,,,,,,
,,,,,,,,,,,,,,,,,,,,,,,,,,,,,,,,,,,,,,,,,,,,,,,,,,,,,,,,,.pdf,Proof of Machinery Tools plant and ownership as per sr. No. 6.19 of schedule F Clause 18.,,,,,,,,,,,,,,,,,,,,,,,,,,,,,,,,,,,,,,,,,,,,,,,
,,,,,,,,,,,,,,,,,,,,,,,,,,,,,,,,,,,,,,,,,,,,,,,,,,,,,,,2.0,Finance,.xls,BOQ,,,,,,,,,,,,,,,,,,,,,,,,,,,,,,,,,,,,,,,,,,,,,,,
