Committee Chairperson/Co-ordinator Name :,Committee Chairperson/Co-ordinator Type :,Committee Members :,Updated By :,Updated On :,Financial Bid Opening Date:,Document :,S.No,Bid Number,Bidder Name,Submitted Date,Status,Remarks,Status Updated On,Type :,Summary :,Updated By :.1,Updated On :.1,Document :.1,BOQ Comparative Chart :,Type :.1,Summary :.1,Updated By :.2,Updated On :.2,Document :.2,Contract Date :,Contract Value :,Work Completion Period in days :,Updated By :.3,Updated on :,AOC document :,AOC Description :,Organisation Chain :,Tender ID :,Tender Ref No :,Tender Title :,S.No.1,Bid Number.1,Bidder Name.1,Awarded Currency,Awarded Value,Committee Chairperson/Co-ordinator Name :.1,Committee Chairperson/Co-ordinator Type :.1,Committee Members :.1,Updated By :.4,Updated on :.1,Document :.3,Name,Address,Title,Work Description,Pre Qualification Details,Independent External Monitor/Remarks,Tender Value in ₹,Product Category,Sub category,Contract Type,Bid Validity(Days),Period Of Work(Days),Location,Pincode,Pre Bid Meeting Place,Pre Bid Meeting Address,Pre Bid Meeting Date,Bid Opening Place,Should Allow NDA Tender,Allow Preferential Bidder,Organisation Chain,Tender Reference Number,Tender ID,Withdrawal Allowed,Tender Type,Form of contract,Tender Category,No. of Covers,General Technical Evaluation Allowed,ItemWise Technical Evaluation Allowed,Payment Mode,Is Multi Currency Allowed For BOQ,Is Multi Currency Allowed For Fee,Allow Two Stage Bidding,Tender Fee in ₹,Fee Payable To,Fee Payable At,Tender Fee Exemption Allowed,Cover No,Cover,Document Type,Description,EMD Amount in ₹,EMD Exemption Allowed,EMD Fee Type,EMD Percentage,EMD Payable To,EMD Payable At,S.No.2,Bank Name,Publish Date,Bid Opening Date,Document Download / Sale Start Date,Document Download / Sale End Date,Clarification Start Date,Clarification End Date,Bid Submission Start Date,Bid Submission End Date,Financial Bid Opening Date
Er. Rakesh Kumar Vaidya Executive Engineer,Internal,"Sh Bala Ram Thakur Superintendent Gr-II, Sh. Jitender Sharma DAO Gr.I , Sh. Rajesh Malhotra DHD , Sh Ravinder Kumar Senior Assistant",Rakesh Kumar,14-Mar-2023 11:11 AM,14-Mar-2023 11:15 AM,techsummary_105177.pdf (542.51 KB),1.0,332614.0,AMERENDER SINGH,09-Mar-2023 09:46 AM,Rejected-Finance,L4,17-Apr-2023,Finance,Financial bid summery,Rakesh Kumar,14-Mar-2023 06:39 PM,finance_105177.pdf,BOQ Comparative Chart,Technical,Documents downloaded,Rakesh Kumar,09-Mar-2023 02:56 PM,,01-May-2023,"INR 766,000",30.0,Rakesh Kumar,08-Jun-2023 03:31 PM,KoDam20.pdf (613.00 KB),The work has been awarded to Sh. Tqarsem Kumar Prop. MS Bharat Engg. and Suppliers Ward No. 6 Near Geeta Bhawan Masita Wali Galli Una vide this office letter No. 2523-30 dated 01/05/2023,"HP Irrigation and Public Health||Bilaspur Circle,Irrigation and Public Health,HP||Bilaspur,Irrigation and Public Health,HP",2023_HPIPH_69729_1,BLP-BLP-00736_NIT No. 26797-898 Dated 25/02/2023,Augmentation of source of water supply schemes of GP Talyana Hawan Bhulswai Harlog Sarwin Khas Balh Churadi and other adjoining GP from Satluj river Block Ghumarwin District Bilaspur HP SH Providing and fixing Cast steel non return valve 450mm dia 1N,1.0,332458.0,Bharat Engg and Suppliers,INR,"766,000",Er. Rakesh Kumar Vaidya Executive Engineer,Internal,"Sh Bala Ram Thakur Superintendent Gr-II, Sh. Jitender Sharma DAO Gr.I , Sh. Ajay Kumar JDM, Sh Ravinder Kumar Senior Assistant",Rakesh Kumar,17-Apr-2023 03:56 PM,finsummary_105177.pdf (55.37 KB),Executive Engineer,Jal Shakti Division Bilaspur,Augmentation of source of water supply schemes of GP Talyana Hawan Bhulswai Harlog Sarwin Khas Balh Churadi and other adjoining GP from Satluj river Block Ghumarwin District Bilaspur HP SH Providing and fixing Cast steel non return valve 450mm dia 1N,Augmentation of source of water supply schemes of GP Talyana Hawan Bhulswai Harlog Sarwin Khas Balh Churadi and other adjoining GP from Satluj river Block Ghumarwin District Bilaspur HP SH Providing and fixing Cast steel non return valve 450mm dia 1N,Please refer Tender documents. ,NA ,"9,35,663",Civil Works,NA ,Tender,120.0,30.0,Sub Division Kandrour,174001.0,NA ,NA ,NA ,EE JSV Bilaspur,No ,No,"HP Irrigation and Public Health||Bilaspur Circle,Irrigation and Public Health,HP||Bilaspur,Irrigation and Public Health,HP",BLP-BLP-00736_NIT No. 26797-898 Dated 25/02/2023,2023_HPIPH_69729_1,Yes,Open Tender,Item Rate,Works,2.0,No,No,Online,No,No,No,250.0,Nil,Nil,Yes,1.0,Fee/PreQual/Technical,.pdf,Tender Cost Proof as per NIT,"18,720",Yes,fixed,,Nil,Nil,1.0,ICICI BANK,27-Feb-2023 10:00 AM,09-Mar-2023 11:30 AM,27-Feb-2023 10:00 AM,09-Mar-2023 11:00 AM,NA ,NA ,27-Feb-2023 10:00 AM,09-Mar-2023 11:00 AM,14-Mar-2023 11:15 AM
,,,,,,,2.0,332617.0,Banarshi Dass,07-Mar-2023 03:17 PM,Rejected-Finance,L2,17-Apr-2023,,,,,,,,,,,,,,,,,,,,,,,,,,,,,,,,,,,,,,,,,,,,,,,,,,,,,,,,,,,,,,,,,,,,,,,,,,.pdf,Earnest money proof scan copy of EMD of Certificate of exemption of earnest money with affidavit,,,,,,,2.0,ICICI NEFT/RTGS,,,,,,,,,
,,,,,,,3.0,332458.0,Bharat Engg and Suppliers,07-Mar-2023 09:42 AM,Accepted-AOC,L1,08-Jun-2023,,,,,,,,,,,,,,,,,,,,,,,,,,,,,,,,,,,,,,,,,,,,,,,,,,,,,,,,,,,,,,,,,,,,,,,,,,.pdf,Certificate of registration with Jal Shakti Vighag in appropriate class and latest renewal thereof.,,,,,,,,,,,,,,,,,
,,,,,,,4.0,332747.0,M/S THAKUR ELECTRICAL & HARDWARE STORE,07-Mar-2023 07:16 PM,Rejected-Finance,L3,17-Apr-2023,,,,,,,,,,,,,,,,,,,,,,,,,,,,,,,,,,,,,,,,,,,,,,,,,,,,,,,,,,,,,,,,,,,,,,,,,,.pdf,PAN No. / GST registration/ Latest ITR.,,,,,,,,,,,,,,,,,
,,,,,,,5.0,333043.0,SHIV KANT PRASHAR,08-Mar-2023 11:11 PM,Rejected-Technical,Not Eligbile as per Govt. Notification,14-Mar-2023,,,,,,,,,,,,,,,,,,,,,,,,,,,,,,,,,,,,,,,,,,,,,,,,,,,,,,,,,,,,,,,,,,,,,,,,,,.pdf,Scan copy of EPF No. (if EPF not registered then before award of work).,,,,,,,,,,,,,,,,,
,,,,,,,6.0,333029.0,ShriBalajiEnginearingWorks,08-Mar-2023 10:25 PM,Rejected-Finance,L5,17-Apr-2023,,,,,,,,,,,,,,,,,,,,,,,,,,,,,,,,,,,,,,,,,,,,,,,,,,,,,,,,,,,,,,,,,,,,,,,,,,.pdf,Copy of undertaking that I have carefully studied all the terms and conditions stipulated in the con,,,,,,,,,,,,,,,,,
,,,,,,,7.0,332870.0,Vijay Kumar C/O Vasudeva Electricals,08-Mar-2023 05:04 PM,Rejected-Technical,Not eligible as per Govt. Notification,14-Mar-2023,,,,,,,,,,,,,,,,,,,,,,,,,,,,,,,,,,,,,,,,,,,,,,,,,,,,,,,,,,,,,,,,,,,,,,,,,,.pdf,Authorization letter regarding digital signature certificate (DSC) of the person authorized by the r,,,,,,,,,,,,,,,,,
,,,,,,,,,,,,,,,,,,,,,,,,,,,,,,,,,,,,,,,,,,,,,,,,,,,,,,,,,,,,,,,,,,,,,,,,,,,,,,,,,,,,,2.0,Finance,.xls,BOQ,,,,,,,,,,,,,,,,,
