Tender Fee in ₹,Fee Payable To,Fee Payable At,Tender Fee Exemption Allowed,Title,Work Description,Pre Qualification Details,Independent External Monitor/Remarks,Tender Value in ₹,Product Category,Sub category,Contract Type,Bid Validity(Days),Period Of Work(Days),Location,Pincode,Pre Bid Meeting Place,Pre Bid Meeting Address,Pre Bid Meeting Date,Bid Opening Place,Should Allow NDA Tender,Allow Preferential Bidder,Name,Address,Cover No,Cover,Document Type,Description,S.No,Bank Name,EMD Amount in ₹,EMD Exemption Allowed,EMD Fee Type,EMD Percentage,EMD Payable To,EMD Payable At,Organisation Chain,Tender Reference Number,Tender ID,Withdrawal Allowed,Tender Type,Form of contract,Tender Category,No. of Covers,General Technical Evaluation Allowed,ItemWise Technical Evaluation Allowed,Payment Mode,Is Multi Currency Allowed For BOQ,Is Multi Currency Allowed For Fee,Allow Two Stage Bidding,Publish Date,Bid Opening Date,Document Download / Sale Start Date,Document Download / Sale End Date,Clarification Start Date,Clarification End Date,Bid Submission Start Date,Bid Submission End Date,Financial Bid Opening Date,Tender Stage,S.No,Bid Number,Bidder Name,Submitted Date,Status,Remarks,Status Updated On,Type :,Summary :,Updated By :,Updated On :,Document :,Organisation Chain :,Tender ID :,Tender Ref No :,Tender Title :,Tender Stage
400.0,EE Jal Shakti Division Bilaspur,Jal Shakti Division Bilaspur,Yes,"Retrofitting and source level augmentation of various left out habitations under JJM 3rd phase of Jal Shakti sub-Division Swarghat and Bassi in Tehsil Sh. Naina Devi Ji District Bilaspur. JSV Sub-Division Swarghat (SH Demolition of old pump house, C","Retrofitting and source level augmentation of various left out habitations under JJM 3rd phase of Jal Shakti sub-Division Swarghat and Bassi in Tehsil Sh. Naina Devi Ji District Bilaspur. JSV Sub-Division Swarghat (SH Demolition of old pump house, C",Please refer tender documents ,NA ,,Civil Works,NA ,Tender,120.0,180.0,Under JSV Sub division Swarghat,174001.0,NA ,NA ,NA ,Jal Shakti Division Bilaspur,No ,No,Executive Engineer,Jal Shakti Division Bilaspur,1.0,Fee/PreQual/Technical,.pdf,Cost of Tender form proof,1.0,ICICI BANK,"46,050",Yes,fixed,,EE Jal Shakti Division Bilaspur,Jal Shakti Division Bilaspur,"HP Irrigation and Public Health||Bilaspur Circle,Irrigation and Public Health,HP||Bilaspur,Irrigation and Public Health,HP",BPL-BLP00-736 NIT No. 1637-1736 dt. 22-04-2021,2021_HPIPH_46791_1,Yes,Open Tender,Item Rate,Works,2.0,No,No,Both(Online/Offline),No,No,No,22-Apr-2021 05:00 PM,07-May-2021 11:30 AM,22-Apr-2021 05:00 PM,07-May-2021 11:00 AM,22-Apr-2021 05:00 PM ,06-May-2021 05:00 PM ,22-Apr-2021 05:00 PM,07-May-2021 11:00 AM,12-May-2021 11:00 AM,AOC,1.0,210871.0,Pawan Kumar,04-May-2021 11:42 AM,Accepted-AOC,Accepted,13-Jul-2021 12:01 PM,Technical,Three bidder has been participated in the e tender process documents of all bidders downloaded successfully.,ARVIND KUMAR VERMA,12-May-2021 10:55 AM,technical_70327.pdf,"HP Irrigation and Public Health||Bilaspur Circle,Irrigation and Public Health,HP||Bilaspur,Irrigation and Public Health,HP",2021_HPIPH_46791_1,BPL-BLP00-736 NIT No. 1637-1736 dt. 22-04-2021,"Retrofitting and source level augmentation of various left out habitations under JJM 3rd phase of Jal Shakti sub-Division Swarghat and Bassi in Tehsil Sh. Naina Devi Ji District Bilaspur. JSV Sub-Division Swarghat (SH Demolition of old pump house, C",AOC
,,,,,,,,,,,,,,,,,,,,,,,,,,.pdf,Earnest money proof scan copy of EMD of Certificate of exemption of earnest money with affidavit,2.0,ICICI NEFT/RTGS,,,,,,,,,,,,,,,,,,,,,,,,,,,,,,AOC,2.0,210949.0,prakash thakur,04-May-2021 11:54 AM,Accepted-AOC,Accepted,13-Jul-2021 12:01 PM,,,,,,,,,,AOC
,,,,,,,,,,,,,,,,,,,,,,,,,,.pdf,Certificate of registration with Jal Shakti Vibhag in appropriate class and latest renewal thereof,,,,,,,,,,,,,,,,,,,,,,,,,,,,,,,,AOC,3.0,211495.0,RATTAN LAL,06-May-2021 08:48 PM,Accepted-AOC,Accepted,13-Jul-2021 12:01 PM,,,,,,,,,,AOC
,,,,,,,,,,,,,,,,,,,,,,,,,,.pdf,PAN No. / GST registration.,,,,,,,,,,,,,,,,,,,,,,,,,,,,,,,,AOC,,,,,,,,,,,,,,,,,AOC
,,,,,,,,,,,,,,,,,,,,,,,,,,.pdf,Scan copy of EPF No.,,,,,,,,,,,,,,,,,,,,,,,,,,,,,,,,AOC,,,,,,,,,,,,,,,,,AOC
,,,,,,,,,,,,,,,,,,,,,,,,2.0,Finance,.xls,BOQ,,,,,,,,,,,,,,,,,,,,,,,,,,,,,,,,AOC,,,,,,,,,,,,,,,,,AOC
