Title,Work Description,Pre Qualification Details,Independent External Monitor/Remarks,Tender Value in ₹,Product Category,Sub category,Contract Type,Bid Validity(Days),Period Of Work(Days),Location,Pincode,Pre Bid Meeting Place,Pre Bid Meeting Address,Pre Bid Meeting Date,Bid Opening Place,Should Allow NDA Tender,Allow Preferential Bidder,Cover No,Cover,Document Type,Description,Tender Fee in ₹,Fee Payable To,Fee Payable At,Tender Fee Exemption Allowed,Name,Address,Organisation Chain,Tender Reference Number,Tender ID,Withdrawal Allowed,Tender Type,Form of contract,Tender Category,No. of Covers,General Technical Evaluation Allowed,ItemWise Technical Evaluation Allowed,Payment Mode,Is Multi Currency Allowed For BOQ,Is Multi Currency Allowed For Fee,Allow Two Stage Bidding,Publish Date,Bid Opening Date,Document Download / Sale Start Date,Document Download / Sale End Date,Clarification Start Date,Clarification End Date,Bid Submission Start Date,Bid Submission End Date,Financial Bid Opening Date,EMD Amount in ₹,EMD Exemption Allowed,EMD Fee Type,EMD Percentage,EMD Payable To,EMD Payable At,S.No,Bank Name,Tender Stage,S.No,Bid Number,Bidder Name,Submitted Date,Status,Remarks,Status Updated On,Type :,Summary :,Updated By :,Updated On :,Document :,BOQ Comparative Chart :,Organisation Chain :,Tender ID :,Tender Ref No :,Tender Title :,Committee Chairperson/Co-ordinator Name :,Committee Chairperson/Co-ordinator Type :,Committee Members :,Updated By :.1,Updated On :.1,Financial Bid Opening Date:,Document :.1,Type :.1,Summary :.1,Updated By :.2,Updated On :.2,Document :.2,Tender Stage
Providing FHTC to lefout house hold for JSJ under JJM under Jubbal Kotkhai constituency in JSV Division Jubbal SH CO RCC work Supply and Errection of pumping machinery and laying of GI Pipes etc Job 1st,Providing FHTC to lefout house hold for JSJ under JJM under Jubbal Kotkhai constituency in JSV Division Jubbal SH CO RCC work Supply and Errection of pumping machinery and laying of GI Pipes etc Job 1st,Please refer Tender documents. ,NA ,"26,52,539",Civil Works,Civil pipe line pumping machienry work ,Tender,120.0,180.0,Jubbal,171205.0,NA ,NA ,NA ,JSV Division Jubbal,No ,No,1.0,Fee/PreQual/Technical,.pdf,Cost of form and EMD,400.0,Nil,Nil,No,Executive Engineer,JSV Division Jubbal,"HP Irrigation and Public Health||Rohru Circle,Irrigation and Public Health,HP||Jubbal,Irrigation and Public Health,HP",JBL-SML09-718,2021_HPIPH_46729_11,Yes,Open Tender,Item Rate,Works,2.0,No,No,Online,No,No,No,20-Apr-2021 06:00 PM,01-May-2021 11:30 AM,20-Apr-2021 06:00 PM,01-May-2021 11:00 AM,NA ,NA ,20-Apr-2021 06:00 PM,01-May-2021 11:00 AM,12-May-2021 02:20 PM,"47,300",Yes,fixed,,Nil,Nil,1.0,ICICI BANK,AOC,1.0,210657.0,rupinder justa govt contractor,30-Apr-2021 05:07 PM,Accepted-AOC,Lowest bidder,19-Jul-2021 05:42 PM,Finance,Financial summary attached,BODHBERDHAN GUPTA,13-May-2021 02:56 PM,finance_70246.pdf,BOQ Comparative Chart,"HP Irrigation and Public Health||Rohru Circle,Irrigation and Public Health,HP||Jubbal,Irrigation and Public Health,HP",2021_HPIPH_46729_11,JBL-SML09-718,Providing FHTC to lefout house hold for JSJ under JJM under Jubbal Kotkhai constituency in JSV Division Jubbal SH CO RCC work Supply and Errection of pumping machinery and laying of GI Pipes etc Job 1st,Executive Engineer,Internal,Tender Asstt Supdt HDM AE,BODHBERDHAN GUPTA,12-May-2021 02:18 PM,12-May-2021 02:20 PM,techsummary_70246.pdf (502.78 KB),Technical,Technical summary attached,BODHBERDHAN GUPTA,12-May-2021 01:59 PM,technical_70246.pdf,AOC
,,,,,,,,,,,,,,,,,,,,.pdf,Valid Registration,,,,,,,,,,,,,,,,,,,,,,,,,,,,,,,,,,,,2.0,ICICI NEFT/RTGS,AOC,2.0,210627.0,VIRENDER THAKUR CONTRACTOR,30-Apr-2021 02:54 PM,Rejected-Finance,L-2,19-Jul-2021 05:37 PM,,,,,,,,,,,,,,,,,,,,,,,AOC
,,,,,,,,,,,,,,,,,,,,.pdf,PAN GST EPF with latest ITR,,,,,,,,,,,,,,,,,,,,,,,,,,,,,,,,,,,,,,AOC,,,,,,,,,,,,,,,,,,,,,,,,,,,,,,AOC
,,,,,,,,,,,,,,,,,,,,.pdf,Undertaking that before bidding contractor have gone through all tender documents and conditions,,,,,,,,,,,,,,,,,,,,,,,,,,,,,,,,,,,,,,AOC,,,,,,,,,,,,,,,,,,,,,,,,,,,,,,AOC
,,,,,,,,,,,,,,,,,,,,.pdf,Work done for Pumping machinery Rising Main and Water testing Lab is essential,,,,,,,,,,,,,,,,,,,,,,,,,,,,,,,,,,,,,,AOC,,,,,,,,,,,,,,,,,,,,,,,,,,,,,,AOC
,,,,,,,,,,,,,,,,,,,,.pdf,Other documents as per NIT conditions,,,,,,,,,,,,,,,,,,,,,,,,,,,,,,,,,,,,,,AOC,,,,,,,,,,,,,,,,,,,,,,,,,,,,,,AOC
,,,,,,,,,,,,,,,,,,2.0,Finance,.xls,SOQ,,,,,,,,,,,,,,,,,,,,,,,,,,,,,,,,,,,,,,AOC,,,,,,,,,,,,,,,,,,,,,,,,,,,,,,AOC
