Publish Date,Bid Opening Date,Document Download / Sale Start Date,Document Download / Sale End Date,Clarification Start Date,Clarification End Date,Bid Submission Start Date,Bid Submission End Date,Financial Bid Opening Date,Tender Fee in ₹,Fee Payable To,Fee Payable At,Tender Fee Exemption Allowed,EMD Amount in ₹,EMD Exemption Allowed,EMD Fee Type,EMD Percentage,EMD Payable To,EMD Payable At,S.No,Bank Name,Title,Work Description,Pre Qualification Details,Independent External Monitor/Remarks,Tender Value in ₹,Product Category,Sub category,Contract Type,Bid Validity(Days),Period Of Work(Days),Location,Pincode,Pre Bid Meeting Place,Pre Bid Meeting Address,Pre Bid Meeting Date,Bid Opening Place,Should Allow NDA Tender,Allow Preferential Bidder,Organisation Chain,Tender Reference Number,Tender ID,Withdrawal Allowed,Tender Type,Form of contract,Tender Category,No. of Covers,General Technical Evaluation Allowed,ItemWise Technical Evaluation Allowed,Payment Mode,Is Multi Currency Allowed For BOQ,Is Multi Currency Allowed For Fee,Allow Two Stage Bidding,Cover No,Cover,Document Type,Description,Name,Address,Tender Stage,Committee Chairperson/Co-ordinator Name :,Committee Chairperson/Co-ordinator Type :,Committee Members :,Updated By :,Updated on :,Document :,Organisation Chain :,Tender ID :,Tender Ref No :,Tender Title :,S.No,Bid Number,Bidder Name,Awarded Currency,Awarded Value,Type :,Summary :,Updated By :.1,Updated On :,Document :.1,Type :.1,Summary :.1,Updated By :.2,Updated On :.1,Document :.2,BOQ Comparative Chart :,Contract Date :,Contract Value :,Work Completion Period in days :,Updated By :.3,Updated on :.1,AOC document :,AOC Description :,S.No.1,Bid Number.1,Bidder Name.1,Submitted Date,Status,Remarks,Status Updated On,Committee Chairperson/Co-ordinator Name :.1,Committee Chairperson/Co-ordinator Type :.1,Committee Members :.1,Updated By :.4,Updated On :.2,Financial Bid Opening Date:,Document :.3,Tender Stage
11-Feb-2021 10:00 AM,18-Feb-2021 11:30 AM,11-Feb-2021 10:00 AM,17-Feb-2021 06:00 PM,11-Feb-2021 10:00 AM ,17-Feb-2021 06:00 PM ,11-Feb-2021 10:00 AM,17-Feb-2021 06:00 PM,20-Mar-2021 12:35 PM,800.0,EE JSD Dalhousiie,Dalhousie,Yes,"1,03,339",Yes,fixed,,EE JSD Dalhousie,Dalhousie,1.0,ICICI BANK,Remodelling of Lift Irrigation Scheme Naddle in G.P. Parchhore in Tehsil Bhattiyat Distt. Chamba (HP),"Supplying and Errection of Submersible and Centrifugal Pumping Machinery with all allied accessories and Providing, Laying Jointing and testing of G.M.S.E.R.W. Pipe 200 mm Dia",Remodelling of Lift Irrigation Scheme Naddle in G.P. Parchhore in Tehsil Bhattiyat Distt. Chamba (HP)  ,NA ,,Civil Works,NA ,Tender,120.0,365.0,Naddle,176302.0,NA ,NA ,NA ,Dalhousie,No ,No,"HP Irrigation and Public Health||Chamba Circle,Irrigation and Public Health,HP||Dalhousie,Irrigation and Public Health,HP",JSV-DLU-EA-I-E-Ten/21-16076-96,2021_HPIPH_44241_1,Yes,Open Tender,Item Rate,Works,2.0,No,No,Both(Online/Offline),No,No,No,1.0,Fee/PreQual/Technical,.pdf,Cost of form through online mode as well as offline mode also,Executive Engineer,"Jal Shakti Division, Dalhousie",AOC,Er. Rohit Dubey SE,Internal,Er Desh Raj EE Er Rakesh Thakur EE Er Hamminder Chona AED Bihari Lal HDM Ashwani Kumat Supdt Jaiso Ram Dealing Assistant,Rakesh Chand Thakur,19-Jul-2021 03:46 PM,finsummary_66267.pdf (3799.67 KB),"HP Irrigation and Public Health||Chamba Circle,Irrigation and Public Health,HP||Dalhousie,Irrigation and Public Health,HP",2021_HPIPH_44241_1,JSV-DLU-EA-I-E-Ten/21-16076-96,Remodelling of Lift Irrigation Scheme Naddle in G.P. Parchhore in Tehsil Bhattiyat Distt. Chamba (HP),1.0,198883.0,Bharat Engg and Suppliers,INR,"6,050,066",Technical,only 5 bids admitted,Rakesh Chand Thakur,20-Mar-2021 12:30 PM,technical_66267.pdf,Finance,L1,Rajneesh Onkar,12-Apr-2021 12:14 PM,finance_66267.pdf,BOQ Comparative Chart,19-Jul-2021,"INR 6,100,058.72",365.0,Rakesh Chand Thakur,19-Jul-2021 03:56 PM,AwardLetter.pdf (566.00 KB),Out of 5 Nos 1 No. Acceipt i.e. Lower 1,1,198883,Bharat Engg and Suppliers,16-Feb-2021 11:30 PM,Accepted-AOC,Lower 1,19-Jul-2021 03:56 PM,Rakesh Chand Thakur,Internal,N.S.Thakur Supdt Chaman JDM Pritam Account Branch,Rakesh Chand Thakur,20-Mar-2021 12:34 PM,20-Mar-2021 12:35 PM,techsummary_66267.pdf (461.23 KB),AOC
,,,,,,,,,,,,,,,,,,,2.0,ICICI NEFT/RTGS,,,,,,,,,,,,,,,,,,,,,,,,,,,,,,,,,,,.pdf,Earnest money through on line mode as well as offline mode,,,AOC,,,,,,,,,,,,,,,,,,,,,,,,,,,,,,,,,,2,198665,KRP Engineering Pvt. Ltd.,17-Feb-2021 12:13 PM,Rejected-Finance,Lower 2,19-Jul-2021 03:46 PM,,,,,,,,AOC
,,,,,,,,,,,,,,,,,,,,,,,,,,,,,,,,,,,,,,,,,,,,,,,,,,,,,,,.pdf,Certificate of registration with Jal Shakti Vibhag in appropriate Class and latest renewal thereof,,,AOC,,,,,,,,,,,,,,,,,,,,,,,,,,,,,,,,,,3,198894,Naik Electrical Works,17-Feb-2021 11:55 AM,Rejected-Finance,Lower 3,19-Jul-2021 03:46 PM,,,,,,,,AOC
,,,,,,,,,,,,,,,,,,,,,,,,,,,,,,,,,,,,,,,,,,,,,,,,,,,,,,,.pdf,Income tax and latest clearance certificate thereof,,,AOC,,,,,,,,,,,,,,,,,,,,,,,,,,,,,,,,,,4,198565,P C Construction,17-Feb-2021 02:04 PM,Rejected-Finance,Lower 5,19-Jul-2021 03:46 PM,,,,,,,,AOC
,,,,,,,,,,,,,,,,,,,,,,,,,,,,,,,,,,,,,,,,,,,,,,,,,,,,,,,.pdf,Sale tax clearance/GST registration,,,AOC,,,,,,,,,,,,,,,,,,,,,,,,,,,,,,,,,,5,198757,sadeep kumar,17-Feb-2021 10:06 AM,Not Admitted-Fee/PreQual/Technical,Not Complied with technical specification,20-Mar-2021 12:30 PM,,,,,,,,AOC
,,,,,,,,,,,,,,,,,,,,,,,,,,,,,,,,,,,,,,,,,,,,,,,,,,,,,,,.pdf,EPF No. and labour licence,,,AOC,,,,,,,,,,,,,,,,,,,,,,,,,,,,,,,,,,6,198892,Sandeep Kumar,17-Feb-2021 04:20 PM,Rejected-Finance,Lower 4,19-Jul-2021 03:46 PM,,,,,,,,AOC
,,,,,,,,,,,,,,,,,,,,,,,,,,,,,,,,,,,,,,,,,,,,,,,,,,,,,2.0,Finance,.xls,BOQ,,,AOC,,,,,,,,,,,,,,,,,,,,,,,,,,,,,,,,,,7,198770,SHIV KUMAR,17-Feb-2021 12:48 PM,Not Admitted-Fee/PreQual/Technical,Not Complied with technical specification,20-Mar-2021 12:30 PM,,,,,,,,AOC
,,,,,,,,,,,,,,,,,,,,,,,,,,,,,,,,,,,,,,,,,,,,,,,,,,,,,,,,,,,AOC,,,,,,,,,,,,,,,,,,,,,,,,,,,,,,,,,,8,198954,Universal Electric Engineers,17-Feb-2021 04:32 PM,Not Admitted-Fee/PreQual/Technical,Not Complied with technical specification,20-Mar-2021 12:30 PM,,,,,,,,AOC
