Committee Chairperson/Co-ordinator Name :,Committee Chairperson/Co-ordinator Type :,Committee Members :,Updated By :,Updated on :,Document :,Organisation Chain :,Tender ID :,Tender Ref No :,Tender Title :,Type :,Summary :,Updated By :.1,Updated On :,Document :.1,Committee Chairperson/Co-ordinator Name :.1,Committee Chairperson/Co-ordinator Type :.1,Committee Members :.1,Updated By :.2,Updated On :.1,Financial Bid Opening Date:,Document :.2,S.No,Bid Number,Bidder Name,Submitted Date,Status,Remarks,Status Updated On,S.No.1,Bid Number.1,Bidder Name.1,Awarded Currency,Awarded Value,Type :.1,Summary :.1,Updated By :.3,Updated On :.2,Document :.3,BOQ Comparative Chart :,Contract Date :,Contract Value :,Work Completion Period in days :,Updated By :.4,Updated on :.1,AOC document :,AOC Description :,Tender Stage,S.No,Corrigendum Title,Corrigendum Type,View,Cover No,Cover,Document Type,Description,Tender Fee in ₹,Fee Payable To,Fee Payable At,Tender Fee Exemption Allowed,S.No.1,Bank Name,Publish Date,Bid Opening Date,Document Download / Sale Start Date,Document Download / Sale End Date,Clarification Start Date,Clarification End Date,Bid Submission Start Date,Bid Submission End Date,Financial Bid Opening Date,Name,Address,EMD Amount in ₹,EMD through BG/ST or EMD Exemption Allowed,EMD Fee Type,EMD Percentage,EMD Payable To,EMD Payable At,Title,Work Description,Pre Qualification Details,Independent External Monitor/Remarks,Tender Value in ₹,Product Category,Sub category,Contract Type,Bid Validity(Days),Period Of Work(Days),Location,Pincode,Pre Bid Meeting Place,Pre Bid Meeting Address,Pre Bid Meeting Date,Bid Opening Place,Should Allow NDA Tender,Allow Preferential Bidder,Organisation Chain,Tender Reference Number,Tender ID,Withdrawal Allowed,Tender Type,Form of contract,Tender Category,No. of Covers,General Technical Evaluation Allowed,ItemWise Technical Evaluation Allowed,Payment Mode,Is Multi Currency Allowed For BOQ,Is Multi Currency Allowed For Fee,Allow Two Stage Bidding,Tender Stage
Hirdesh Mishra IFS,Internal,Kadam Suhas Tarachand IFS Nandha Kumar IFS Rubul Pathak AFS,Rubul Pathak,19-May-2022 04:46 PM,finsummary_37509.pdf (473.80 KB),"Pr. Chief Conservator of Forest and Head of Forest Force||Chief Conservator of Forests (Upper Assam Zone)||Eastern Assam Circle, Jorhat",2022_PCCF_24464_1,FG.22/CAMPA/E-TENDER/EAC,Erection of Fitting and Fixing of Fencing Material,Technical,Bids are opened for evaluation,Nandhakumar N,12-Apr-2022 11:44 AM,,Hirdesh Mishra IFS,Internal,Kadam Suhas Tarachand IFS Nandha Kumar IFS Rubul Pathak AFS,Rubul Pathak,27-Apr-2022 03:18 PM,29-Apr-2022 11:30 AM,techsummary_37509.pdf (898.48 KB),1,144362,hima enterprise,31-Mar-2022 01:33 PM,Rejected-Technical,GST upto date and self attested bank details are not submitted,27-Apr-2022 03:18 PM,1.0,144314.0,STANDARD CREATION,INR,4532863.5,Finance,Price bid opened.,Rubul Pathak,29-Apr-2022 02:38 PM,,BOQ Comparative Chart,24-May-2022,INR 5036515.0,60.0,Rubul Pathak,24-May-2022 05:56 PM,Gola.pdf (323.00 KB),Erection of fitting and fixing of fencing material at 4590 RM at 70.68 ha as SSP at Nambor Doigrung wildlife sanctuary under Golaghat Range of Golaghat forest division under CAMPA scheme APO 2020-21,AOC,1.0,Corrigendum,Other,,1.0,Fee/PreQual/Technical,.pdf,Scan copy of technical qualification documents,"1,007",Nil,Nil,No,1.0,SBI Bank,28-Feb-2022 04:00 PM,04-Apr-2022 11:00 AM,01-Mar-2022 09:00 AM,31-Mar-2022 03:00 PM,NA ,NA ,07-Mar-2022 03:00 PM,31-Mar-2022 03:00 PM,29-Apr-2022 11:30 AM,"DCF, O/o CF, EAC, Jorhat","O/o Conservator of Forest, Eastern Assam Circle,Jorhat","1,00,730",Yes,percentage,2.0%,Nil,Nil,Erection of Fitting and Fixing of Fencing Material,Erection of Fitting and Fixing of Fencing Material,Please refer tender documents ,NA ,"50,36,515",Civil Works,Civil Works ,Tender,30.0,60.0,Nambor Doigrung WLS under Golaghat Range,785621.0,"Divisional Forest Office, Golaghat ","O/o DFO Golaghat, Kachugaon, Golaghat ",06-Mar-2022 11:30 AM ,"Conservator of Forest, Eastern Assam Circle,Jorhat",No ,No,"Pr. Chief Conservator of Forest and Head of Forest Force||Chief Conservator of Forests (Upper Assam Zone)||Eastern Assam Circle, Jorhat",FG.22/CAMPA/E-TENDER/EAC,2022_PCCF_24464_1,Yes,Open Tender,Fixed-rate,Works,2.0,No,No,Online,No,No,No,AOC
,,,,,,,,,,,,,,,,,,,,,,2,144164,Himanshu Boruah,29-Mar-2022 07:42 PM,Rejected-AOC,Rejected based on the criteria 1.31 E of the bid evaluation criteria,24-May-2022 05:56 PM,,,,,,,,,,,,,,,,,,,AOC,,,,,2.0,Finance,.xls,Price Bid,,,,,,,,,,,,,,,,,,,,,,,,,,,,,,,,,,,,,,,,,,,,,,,,,,,,,,,,AOC
,,,,,,,,,,,,,,,,,,,,,,3,144317,Hitendra Pegu,30-Mar-2022 09:52 PM,Rejected-Technical,Not upto date GST registartion certificate and No document showing experience in fencing work,27-Apr-2022 03:18 PM,,,,,,,,,,,,,,,,,,,AOC,,,,,,,,,,,,,,,,,,,,,,,,,,,,,,,,,,,,,,,,,,,,,,,,,,,,,,,,,,,,,,,,AOC
,,,,,,,,,,,,,,,,,,,,,,4,144320,MOHAMMAD TAJNUR ISLAM,31-Mar-2022 10:14 AM,Rejected-Technical,Document showing annual turnover for last 3 years not submitted and No document showing experience in fencing work,27-Apr-2022 03:18 PM,,,,,,,,,,,,,,,,,,,AOC,,,,,,,,,,,,,,,,,,,,,,,,,,,,,,,,,,,,,,,,,,,,,,,,,,,,,,,,,,,,,,,,AOC
,,,,,,,,,,,,,,,,,,,,,,5,144314,STANDARD CREATION,30-Mar-2022 07:57 PM,Accepted-AOC,Accepted based on the criteria 1.31 E of the bid evaluation criteria,24-May-2022 05:56 PM,,,,,,,,,,,,,,,,,,,AOC,,,,,,,,,,,,,,,,,,,,,,,,,,,,,,,,,,,,,,,,,,,,,,,,,,,,,,,,,,,,,,,,AOC
,,,,,,,,,,,,,,,,,,,,,,6,143933,TAHIMDUR RAHMAN,30-Mar-2022 02:45 PM,Rejected-AOC,Rejected due to not being the lowest bidder,24-May-2022 05:56 PM,,,,,,,,,,,,,,,,,,,AOC,,,,,,,,,,,,,,,,,,,,,,,,,,,,,,,,,,,,,,,,,,,,,,,,,,,,,,,,,,,,,,,,AOC
