Organisation Chain :,Tender ID :,Tender Ref No :,Tender Title :,S.No,Bid Number,Bidder Name,Awarded Currency,Awarded Value,Committee Chairperson/Co-ordinator Name :,Committee Chairperson/Co-ordinator Type :,Committee Members :,Updated By :,Updated on :,Document :,Type :,Summary :,Updated By :.1,Updated On :,Document :.1,Type :.1,Summary :.1,Updated By :.2,Updated On :.1,Document :.2,BOQ Comparative Chart :,Contract Date :,Contract Value :,Work Completion Period in days :,Updated By :.3,Updated on :.1,AOC document :,AOC Description :,S.No.1,Bid Number.1,Bidder Name.1,Submitted Date,Status,Remarks,Status Updated On,Committee Chairperson/Co-ordinator Name :.1,Committee Chairperson/Co-ordinator Type :.1,Committee Members :.1,Updated By :.4,Updated On :.2,Financial Bid Opening Date:,Document :.3,Tender Stage,Tender Fee in ₹,Fee Payable To,Fee Payable At,Tender Fee Exemption Allowed,Name,Address,Publish Date,Bid Opening Date,Document Download / Sale Start Date,Document Download / Sale End Date,Clarification Start Date,Clarification End Date,Bid Submission Start Date,Bid Submission End Date,Financial Bid Opening Date,EMD Amount in ₹,EMD Exemption Allowed,EMD Fee Type,EMD Percentage,EMD Payable To,EMD Payable At,S.No,Bank Name,Cover No,Cover,Document Type,Description,Organisation Chain,Tender Reference Number,Tender ID,Withdrawal Allowed,Tender Type,Form of contract,Tender Category,No. of Covers,General Technical Evaluation Allowed,ItemWise Technical Evaluation Allowed,Payment Mode,Is Multi Currency Allowed For BOQ,Is Multi Currency Allowed For Fee,Allow Two Stage Bidding,Title,Work Description,Pre Qualification Details,Independent External Monitor/Remarks,Tender Value in ₹,Product Category,Sub category,Contract Type,Bid Validity(Days),Period Of Work(Days),Location,Pincode,Pre Bid Meeting Place,Pre Bid Meeting Address,Pre Bid Meeting Date,Bid Opening Place,Should Allow NDA Tender,Allow Preferential Bidder,Tender Stage
"HP Irrigation and Public Health||S Nagar Circle,Irrigation and Public Health,HP",2021_HPIPH_50035_1,4416-65 dt. 16.07.2021,"Providing LWSS to PC Habitation of GP Bihun and Nauhli alogwith house hold connection SH Co intake , WTP Pump house",1.0,223917.0,SANJEEV THAKUR,INR,"14,128,603",Er. Deepak Garg,Internal,"SandeepKant Sharma EED, Yogesh Kapoor EECTR,Deekshant Sharma AED, Piar Chand Supdt. Gr.II,Ravinder Kumar JE",Yogesh Kapoor,05-May-2022 05:39 PM,finsummary_74848.pdf (642.04 KB),Technical,Three No. Bidder out of four found elgible to open the financial bid as per proceeding.,Yogesh Kapoor,07-Aug-2021 02:25 PM,technical_74848.pdf,Finance,Three Nos bidder BOQ and comparative chart downloaded successfully.,Yogesh Kapoor,07-Mar-2022 03:45 PM,finance_74848.pdf,BOQ Comparative Chart,05-May-2022,"INR 13,077,758",270.0,Yogesh Kapoor,05-May-2022 05:40 PM,7award.pdf (592.00 KB),Estimated cost,1.0,225027.0,SANGRAM NAIK,23-Jul-2021 04:13 PM,Rejected-Finance,Other then lowest,05-May-2022 05:39 PM,Er. Yogesh Kumar,Internal,Punnet Sharma HDM Tilak Raj Supdt Devi Singh Accountant,Yogesh Kapoor,07-Aug-2021 02:37 PM,07-Aug-2021 02:40 PM,techsummary_74848.pdf (206.97 KB),AOC,"1,500",EE CHAUNTRA,CHAUNTRA/JOGINDER NAGAR,No,EXECUTIVE ENGINEER,EE JS DIVISION CHAUNTRA,17-Jul-2021 05:00 PM,24-Jul-2021 11:30 AM,17-Jul-2021 05:00 PM,23-Jul-2021 05:00 PM,NA ,NA ,17-Jul-2021 05:00 PM,23-Jul-2021 05:00 PM,07-Aug-2021 02:40 PM,"1,63,300",Yes,fixed,,EE CHAUNTRA,CHAUNTRA/JOGINDER NAGAR,1.0,ICICI BANK,1.0,Fee/PreQual/Technical,.pdf,Cost of Tender form,"HP Irrigation and Public Health||S Nagar Circle,Irrigation and Public Health,HP",4416-65 dt. 16.07.2021,2021_HPIPH_50035_1,Yes,Open Tender,Item Rate,Works,2.0,No,No,Both(Online/Offline),No,No,No,"Providing LWSS to PC Habitation of GP Bihun and Nauhli alogwith house hold connection SH Co intake , WTP Pump house","Providing LWSS to PC Habitation of GP Bihun and Nauhli alogwith house hold connection SH Co intake , WTP Pump house",Please refer Tender documents. ,NA ,"1,30,77,758",Civil Works - Water Works,NA ,Tender,60.0,270.0,Joginder Nagar,175032.0,NA ,NA ,NA ,JS DIVISION CHAUNTRA,No ,No,AOC
,,,,,,,,,,,,,,,,,,,,,,,,,,,,,,,,,2.0,223917.0,SANJEEV THAKUR,19-Jul-2021 12:45 PM,Accepted-AOC,l1,05-May-2022 05:40 PM,,,,,,,,AOC,,,,,,,,,,,,,,,,,,,,,,2.0,ICICI NEFT/RTGS,,,.pdf,Earnest money as per NIT,,,,,,,,,,,,,,,,,,,,,,,,,,,,,,,,,AOC
,,,,,,,,,,,,,,,,,,,,,,,,,,,,,,,,,3.0,224974.0,VIPAT RAM,23-Jul-2021 01:49 PM,Not Admitted-Fee/PreQual/Technical,Not Complied with technical specification,07-Aug-2021 02:25 PM,,,,,,,,AOC,,,,,,,,,,,,,,,,,,,,,,,,,,.pdf,Registration as per NIT,,,,,,,,,,,,,,,,,,,,,,,,,,,,,,,,,AOC
,,,,,,,,,,,,,,,,,,,,,,,,,,,,,,,,,4.0,224956.0,YOG RAJ,23-Jul-2021 04:09 PM,Rejected-Finance,Other then lowest,05-May-2022 05:39 PM,,,,,,,,AOC,,,,,,,,,,,,,,,,,,,,,,,,,,.pdf,PAN and GST No.,,,,,,,,,,,,,,,,,,,,,,,,,,,,,,,,,AOC
,,,,,,,,,,,,,,,,,,,,,,,,,,,,,,,,,,,,,,,,,,,,,,,AOC,,,,,,,,,,,,,,,,,,,,,,,,,,.pdf,DSC authorization letter,,,,,,,,,,,,,,,,,,,,,,,,,,,,,,,,,AOC
,,,,,,,,,,,,,,,,,,,,,,,,,,,,,,,,,,,,,,,,,,,,,,,AOC,,,,,,,,,,,,,,,,,,,,,,,,,,.pdf,Undertaking as PER NIT,,,,,,,,,,,,,,,,,,,,,,,,,,,,,,,,,AOC
,,,,,,,,,,,,,,,,,,,,,,,,,,,,,,,,,,,,,,,,,,,,,,,AOC,,,,,,,,,,,,,,,,,,,,,,,,,,.pdf,Experience as PER NIT,,,,,,,,,,,,,,,,,,,,,,,,,,,,,,,,,AOC
,,,,,,,,,,,,,,,,,,,,,,,,,,,,,,,,,,,,,,,,,,,,,,,AOC,,,,,,,,,,,,,,,,,,,,,,,,2.0,Finance,.xls,BOQ,,,,,,,,,,,,,,,,,,,,,,,,,,,,,,,,,AOC
