Cover No,Cover,Document Type,Description,Organisation Chain,Tender Reference Number,Tender ID,Withdrawal Allowed,Tender Type,Form of contract,Tender Category,No. of Covers,General Technical Evaluation Allowed,ItemWise Technical Evaluation Allowed,Payment Mode,Is Multi Currency Allowed For BOQ,Is Multi Currency Allowed For Fee,Allow Two Stage Bidding,Name,Address,Tender Fee in ₹,Fee Payable To,Fee Payable At,Tender Fee Exemption Allowed,Title,Work Description,Pre Qualification Details,Independent External Monitor/Remarks,Tender Value in ₹,Product Category,Sub category,Contract Type,Bid Validity(Days),Period Of Work(Days),Location,Pincode,Pre Bid Meeting Place,Pre Bid Meeting Address,Pre Bid Meeting Date,Bid Opening Place,Should Allow NDA Tender,Allow Preferential Bidder,EMD Amount in ₹,EMD Exemption Allowed,EMD Fee Type,EMD Percentage,EMD Payable To,EMD Payable At,S.No,Instrument Type,Publish Date,Bid Opening Date,Document Download / Sale Start Date,Document Download / Sale End Date,Clarification Start Date,Clarification End Date,Bid Submission Start Date,Bid Submission End Date,Tender Stage,Committee Chairperson/Co-ordinator Name :,Committee Chairperson/Co-ordinator Type :,Committee Members :,Updated By :,Updated On :,Document :,Type :,Summary :,Updated By :.1,Updated On :.1,Document :.1,BOQ Comparative Chart :,Organisation Chain :,Tender ID :,Tender Ref No :,Tender Title :,Contract Date :,Contract Value :,Work Completion Period in days :,Updated By :.2,Updated on :,AOC document :,AOC Description :,Committee Chairperson/Co-ordinator Name :.1,Committee Chairperson/Co-ordinator Type :.1,Committee Members :.1,Updated By :.3,Updated on :.1,Document :.2,S.No,Bid Number,Bidder Name,Awarded Currency,Awarded Value,S.No.1,Bid Number.1,Bidder Name.1,Submitted Date,Status,Remarks,Status Updated On,Tender Stage
1.0,Fee/PreQual/Technical/Finance,.pdf,Cost of Tender in shape of DD,PWD,ED.1.PWD Shimla 2021-22-8593-98 dt 23.02.22,2022_PWD_57316_1,Yes,Open Tender,Item Rate,Works,1.0,No,No,Offline,No,No,No,XEN Electrical Division No. 1 Shimla-9,Executive Engineer Electrical Division No-1 HPPWD Shimla-9,350.0,E.E.Electrical Division No-I Shimla-9,Shimla-9.,No,Re-construction of type-I Qtrs. On old line replacing Block No. 42 at U.S Club Shimla SH Providing E.I. in 9 Nos sets,Re-construction of type-I Qtrs. On old line replacing Block No. 42 at U.S Club Shimla under ESD-I SH Providing E.I therein in Block-42 9 Nos sets,Please refer Tender documents. ,NA ,"6,95,456",Electrical Works,NA ,Tender,90.0,365.0,SHIMLA,171009.0,NA ,NA ,NA ,SHIMLA KASUMPTI -9,No ,No,"14,000",No,fixed,,E.E.Electrical Division No-I Shimla-9,Shimla-9.,1.0,DD - Demand Draft,01-Mar-2022 01:00 PM,10-Mar-2022 11:30 AM,01-Mar-2022 01:30 PM,09-Mar-2022 05:00 PM,NA ,NA ,01-Mar-2022 01:30 PM,09-Mar-2022 05:00 PM,AOC,XEN,Internal,SUPDT DAO HDM,Ravi Singh Rana,22-May-2022 07:30 PM,techsummary_86517.pdf (38.42 KB),Finance,Three number bids were found uploaded on e-procurement all made their physical submission and were found in order accordingly opened for financial part today on dated 10.03.2022 in which Sh. MANOJ KUMAR BANSAL Electrical contractor was found L-1,Ravi Singh Rana,10-Mar-2022 01:16 PM,finance_86517.pdf,BOQ Comparative Chart,PWD,2022_PWD_57316_1,ED.1.PWD Shimla 2021-22-8593-98 dt 23.02.22,Re-construction of type-I Qtrs. On old line replacing Block No. 42 at U.S Club Shimla SH Providing E.I. in 9 Nos sets,22-May-2022,"INR 728,035",365.0,Ravi Singh Rana,22-May-2022 07:33 PM,22_57316.pdf (1524.00 KB),AWARD,XEN,Internal,SUPDT DAO HDM,Ravi Singh Rana,22-May-2022 07:32 PM,finsummary_86517.pdf (38.42 KB),1.0,268755.0,MANOJ KUMAR BANSAL,INR,"728,035",1.0,268755.0,MANOJ KUMAR BANSAL,09-Mar-2022 01:58 PM,Accepted-AOC,L1,22-May-2022 07:33 PM,AOC
,,.pdf,EMD in shape of FDR,,,,,,,,,,,,,,,,,,,,,,,,,,,,,,,,,,,,,,,,,,,,,2.0,FDR - Fixed Deposit,,,,,,,,,AOC,,,,,,,,,,,,,,,,,,,,,,,,,,,,,,,,,,,2.0,268839.0,Navneet Sood,09-Mar-2022 04:56 PM,Rejected-AOC,L2,22-May-2022 07:33 PM,AOC
,,.pdf,GST/PAN Registration,,,,,,,,,,,,,,,,,,,,,,,,,,,,,,,,,,,,,,,,,,,,,,,,,,,,,,,AOC,,,,,,,,,,,,,,,,,,,,,,,,,,,,,,,,,,,3.0,268724.0,Rakesh Sharma,09-Mar-2022 11:58 AM,Rejected-AOC,L3,22-May-2022 07:33 PM,AOC
,,.pdf,Vaild electrical enlistment issued from competent authority,,,,,,,,,,,,,,,,,,,,,,,,,,,,,,,,,,,,,,,,,,,,,,,,,,,,,,,AOC,,,,,,,,,,,,,,,,,,,,,,,,,,,,,,,,,,,,,,,,,,AOC
,,.pdf,DECLARATION BY the CONTRACTOR,,,,,,,,,,,,,,,,,,,,,,,,,,,,,,,,,,,,,,,,,,,,,,,,,,,,,,,AOC,,,,,,,,,,,,,,,,,,,,,,,,,,,,,,,,,,,,,,,,,,AOC
,,.xls,SCHEDULE of QUANTITY BOQ,,,,,,,,,,,,,,,,,,,,,,,,,,,,,,,,,,,,,,,,,,,,,,,,,,,,,,,AOC,,,,,,,,,,,,,,,,,,,,,,,,,,,,,,,,,,,,,,,,,,AOC
,,.pdf,STANDARD BIDDING DOCUMENT SBD From-8,,,,,,,,,,,,,,,,,,,,,,,,,,,,,,,,,,,,,,,,,,,,,,,,,,,,,,,AOC,,,,,,,,,,,,,,,,,,,,,,,,,,,,,,,,,,,,,,,,,,AOC
