Type :,Summary :,Updated By :,Updated On :,Document :,Type :.1,Summary :.1,Updated By :.1,Updated On :.1,Document :.1,BOQ Comparative Chart :,Contract Date :,Contract Value :,Work Completion Period in days :,Updated By :.2,Updated on :,AOC document :,AOC Description :,S.No,Bid Number,Bidder Name,Submitted Date,Status,Remarks,Status Updated On,Committee Chairperson/Co-ordinator Name :,Committee Chairperson/Co-ordinator Type :,Committee Members :,Updated By :.3,Updated On :.2,Financial Bid Opening Date:,Document :.2,Organisation Chain :,Tender ID :,Tender Ref No :,Tender Title :,S.No.1,Bid Number.1,Bidder Name.1,Awarded Currency,Awarded Value,Committee Chairperson/Co-ordinator Name :.1,Committee Chairperson/Co-ordinator Type :.1,Committee Members :.1,Updated By :.4,Updated on :.1,Document :.3,Cover No,Cover,Document Type,Description,S.No.2,Bank Name,Publish Date,Bid Opening Date,Document Download / Sale Start Date,Document Download / Sale End Date,Clarification Start Date,Clarification End Date,Bid Submission Start Date,Bid Submission End Date,Financial Bid Opening Date,Tender Fee in ₹,Fee Payable To,Fee Payable At,Tender Fee Exemption Allowed,Organisation Chain,Tender Reference Number,Tender ID,Withdrawal Allowed,Tender Type,Form of contract,Tender Category,No. of Covers,General Technical Evaluation Allowed,ItemWise Technical Evaluation Allowed,Payment Mode,Is Multi Currency Allowed For BOQ,Is Multi Currency Allowed For Fee,Allow Two Stage Bidding,EMD Amount in ₹,EMD Exemption Allowed,EMD Fee Type,EMD Percentage,EMD Payable To,EMD Payable At,Name,Address,Title,Work Description,Pre Qualification Details,Independent External Monitor/Remarks,Tender Value in ₹,Product Category,Sub category,Contract Type,Bid Validity(Days),Period Of Work(Days),Location,Pincode,Pre Bid Meeting Place,Pre Bid Meeting Address,Pre Bid Meeting Date,Bid Opening Place,Should Allow NDA Tender,Allow Preferential Bidder
Technical,Bid Opening summery attached,Vikas Gupta,23-Jan-2024 12:29 PM,technical_124812.pdf,Finance,Financial bid documents downloaded sucessfully,Vikas Gupta,23-Jan-2024 12:50 PM,finance_124812.pdf,BOQ Comparative Chart,20-Feb-2024,"INR 125,259",90.0,Vikas Gupta,20-Feb-2024 03:25 PM,award.pdf (3392.00 KB),Award Attached,1.0,398937.0,chand kamal sharma contractor,19-Jan-2024 07:00 PM,Accepted-AOC,Accepted L1,20-Feb-2024,Er. Vikas Gupta,Internal,Committee member detail attached,Vikas Gupta,23-Jan-2024 12:34 PM,23-Jan-2024 12:40 PM,techsummary_124812.pdf (320.32 KB),HPSEBL||CE(OP) South||SE(OP) Solan,2024_HPSEB_84026_1,PED-33-2023-24,PED-33-2023-24,1.0,398937.0,chand kamal sharma contractor,INR,"124,633",Er. Vikas Gupta,Internal,Committee Member detail uploaded,Vikas Gupta,20-Feb-2024 03:09 PM,finsummary_124812.pdf (320.32 KB),1.0,Fee/PreQual/Technical,.pdf,Proof of EMD and Tender Fee,1.0,ICICI BANK,15-Jan-2024 03:00 PM,23-Jan-2024 12:00 PM,15-Jan-2024 03:00 PM,22-Jan-2024 03:30 PM,15-Jan-2024 04:00 PM ,16-Jan-2024 10:00 AM ,15-Jan-2024 04:00 PM,22-Jan-2024 03:30 PM,23-Jan-2024 12:40 PM,590.0,Nil,Nil,No,HPSEBL||CE(OP) South||SE(OP) Solan,PED-33-2023-24,2024_HPSEB_84026_1,Yes,Limited,Turn-key,Works,2.0,No,No,Online,No,No,No,"1,253",No,percentage,1.0%,Nil,Nil,Sr.Executive Engineer,Sr.Executive office electrical division HPSEBL Parwanoo Sector-1,PED-33-2023-24,etenderingonpartialturnkeybasisforshiftingiofctptstructuremsindsphinxatsector5fromtheplotofveervisionpvtltd,Please refer Tender documents. ,NA ,"1,25,259",Electrical Works,NA ,Tender,180.0,90.0,Parwanoo,173220.0,NA ,NA ,NA ,"ED, Parwanoo",No ,No
,,,,,,,,,,,,,,,,,,2.0,399297.0,M/S RAVINDER PAL SINGH,20-Jan-2024 09:36 PM,Rejected-Finance,Rejected,20-Feb-2024,,,,,,,,,,,,,,,,,,,,,,,,,.pdf,A-Class Electrical License with Chief Electrical Inspector Shimla.,2.0,ICICI NEFT/RTGS,,,,,,,,,,,,,,,,,,,,,,,,,,,,,,,,,,,,,,,,,,,,,,,,,,,,,
,,,,,,,,,,,,,,,,,,3.0,399293.0,M/S UPINDER PAL SINGH,20-Jan-2024 09:13 PM,Rejected-Finance,Rejected,20-Feb-2024,,,,,,,,,,,,,,,,,,,,,,,,,.pdf,Bid Capacity/Turnover certificate with CA Certified (Balance Sheets and ITR not Mandatory),,,,,,,,,,,,,,,,,,,,,,,,,,,,,,,,,,,,,,,,,,,,,,,,,,,,,,,
,,,,,,,,,,,,,,,,,,,,,,,,,,,,,,,,,,,,,,,,,,,,,,,,,.pdf,GST NO. and Pan Card,,,,,,,,,,,,,,,,,,,,,,,,,,,,,,,,,,,,,,,,,,,,,,,,,,,,,,,
,,,,,,,,,,,,,,,,,,,,,,,,,,,,,,,,,,,,,,,,,,,,,,,,,.pdf,"Work Done Certificate/completion certificate as per SBD Volume-I, Section-III, Clause No. 1.0",,,,,,,,,,,,,,,,,,,,,,,,,,,,,,,,,,,,,,,,,,,,,,,,,,,,,,,
,,,,,,,,,,,,,,,,,,,,,,,,,,,,,,,,,,,,,,,,,,,,,,,,,.pdf,Affidavit for Blacklisting/change of ownership/litigation,,,,,,,,,,,,,,,,,,,,,,,,,,,,,,,,,,,,,,,,,,,,,,,,,,,,,,,
,,,,,,,,,,,,,,,,,,,,,,,,,,,,,,,,,,,,,,,,,,,,,,,,,.pdf,EPFO/ESI No.,,,,,,,,,,,,,,,,,,,,,,,,,,,,,,,,,,,,,,,,,,,,,,,,,,,,,,,
,,,,,,,,,,,,,,,,,,,,,,,,,,,,,,,,,,,,,,,,,,,,,,,2.0,Finance,.xls,BOQ,,,,,,,,,,,,,,,,,,,,,,,,,,,,,,,,,,,,,,,,,,,,,,,,,,,,,,,
