Type :,Summary :,Updated By :,Updated On :,Document :,Type :.1,Summary :.1,Updated By :.1,Updated On :.1,Document :.1,BOQ Comparative Chart :,Contract Date :,Contract Value :,Work Completion Period in days :,Updated By :.2,Updated on :,AOC document :,AOC Description :,S.No,Bid Number,Bidder Name,Submitted Date,Status,Remarks,Status Updated On,Committee Chairperson/Co-ordinator Name :,Committee Chairperson/Co-ordinator Type :,Committee Members :,Updated By :.3,Updated On :.2,Financial Bid Opening Date:,Document :.2,S.No.1,Bid Number.1,Bidder Name.1,Awarded Currency,Awarded Value,Organisation Chain :,Tender ID :,Tender Ref No :,Tender Title :,Committee Chairperson/Co-ordinator Name :.1,Committee Chairperson/Co-ordinator Type :.1,Committee Members :.1,Updated By :.4,Updated on :.1,Document :.3,Title,Work Description,Pre Qualification Details,Independent External Monitor/Remarks,Tender Value in ₹,Product Category,Sub category,Contract Type,Bid Validity(Days),Period Of Work(Days),Location,Pincode,Pre Bid Meeting Place,Pre Bid Meeting Address,Pre Bid Meeting Date,Bid Opening Place,Should Allow NDA Tender,Allow Preferential Bidder,Publish Date,Bid Opening Date,Document Download / Sale Start Date,Document Download / Sale End Date,Clarification Start Date,Clarification End Date,Bid Submission Start Date,Bid Submission End Date,Financial Bid Opening Date,S.No.2,Bank Name,Name,Address,Tender Fee in ₹,Fee Payable To,Fee Payable At,Tender Fee Exemption Allowed,EMD Amount in ₹,EMD Exemption Allowed,EMD Fee Type,EMD Percentage,EMD Payable To,EMD Payable At,Cover No,Cover,Document Type,Description,Organisation Chain,Tender Reference Number,Tender ID,Withdrawal Allowed,Tender Type,Form of contract,Tender Category,No. of Covers,General Technical Evaluation Allowed,ItemWise Technical Evaluation Allowed,Payment Mode,Is Multi Currency Allowed For BOQ,Is Multi Currency Allowed For Fee,Allow Two Stage Bidding
Technical,Technical bid opened and summary is being uploaded,DINESH VERMA,29-Dec-2023 03:29 PM,technical_123181.pdf,Finance,Financial bid opened and summary is being uploaded,DINESH VERMA,05-Feb-2024 01:05 PM,finance_123181.pdf,BOQ Comparative Chart,05-Feb-2024,"INR 508,941",60.0,DINESH VERMA,05-Feb-2024 01:22 PM,ProceedingAOCBasal.pdf (1125.00 KB),Work awarded to Sh. Suman Kumar Sharma lowest contractor,1.0,393985.0,HARINDER KUMAR VERMA.,26-Dec-2023 02:46 PM,Rejected-AOC,4th position,05-Feb-2024,Executive Engieneer,Internal,EE DAO SUPDT HDM,DINESH VERMA,29-Dec-2023 03:45 PM,29-Dec-2023 03:55 PM,techsummary_123181.pdf (19.30 KB),1.0,393383.0,suman kumar sharma,INR,"508,941","Himachal Urban Development Authority||Supdt. Engineer (N),HIMUDA||Executive Engineer Division,Dharamsala,HIMUDA",2023_HIMUD_82813_1,HIMUDA/ND/CB/e-Tender3348-57,Housing Colony at Basal Distt Solan HP,Executive Engineer,Internal,EE DAO SUPDT HDM,DINESH VERMA,05-Feb-2024 01:10 PM,finsummary_123181.pdf (118.03 KB),Housing Colony at Basal Distt Solan HP,Channelization of Nallah from Plot No 84 to Plot No 63 and 2 Nos culverts at Housing Colony at Basal Distt Solan HP,Please refer Tender documents. ,NA ,"7,27,884",Civil Works,NA ,Tender,30.0,60.0,Basal Solan,173213.0,NA ,NA ,NA ,HIMUDA Division Nahan,No ,No,18-Dec-2023 04:00 PM,27-Dec-2023 12:00 PM,18-Dec-2023 04:00 PM,26-Dec-2023 04:00 PM,NA ,NA ,18-Dec-2023 04:00 PM,26-Dec-2023 04:00 PM,29-Dec-2023 03:55 PM,1.0,ICICI BANK,Executive Engineer,HIMUDA Division Nahan Distt Sirmour HP,413.0,Nil,Nil,Yes,"14,560",Yes,fixed,,Nil,Nil,1.0,Fee/PreQual/Technical,.pdf,Cost of Tender document as per NIT,"Himachal Urban Development Authority||Supdt. Engineer (N),HIMUDA||Executive Engineer Division,Dharamsala,HIMUDA",HIMUDA/ND/CB/e-Tender3348-57,2023_HIMUD_82813_1,Yes,Open Tender,Item Rate,Works,2.0,No,No,Online,No,No,No
,,,,,,,,,,,,,,,,,,2.0,393975.0,PWD Department,26-Dec-2023 02:48 PM,Rejected-AOC,3rd position,05-Feb-2024,,,,,,,,,,,,,,,,,,,,,,,,,,,,,,,,,,,,,,,,,,,,,,,,,,2.0,ICICI NEFT/RTGS,,,,,,,,,,,,,,,.pdf,Earnest Money deposit or Exemption Certificate for EMD if any as per NIT Document,,,,,,,,,,,,,,
,,,,,,,,,,,,,,,,,,3.0,393194.0,RAMESH CHAND,21-Dec-2023 04:09 PM,Rejected-AOC,2nd position,05-Feb-2024,,,,,,,,,,,,,,,,,,,,,,,,,,,,,,,,,,,,,,,,,,,,,,,,,,,,,,,,,,,,,,,,,,.pdf,Contractor Registration as per NIT,,,,,,,,,,,,,,
,,,,,,,,,,,,,,,,,,4.0,394140.0,Sandeep Kumar,26-Dec-2023 03:58 PM,Rejected-AOC,5th position,05-Feb-2024,,,,,,,,,,,,,,,,,,,,,,,,,,,,,,,,,,,,,,,,,,,,,,,,,,,,,,,,,,,,,,,,,,.pdf,EPF and GST registration No Income tax PAN No as per NIT,,,,,,,,,,,,,,
,,,,,,,,,,,,,,,,,,5.0,393383.0,suman kumar sharma,26-Dec-2023 02:26 PM,Accepted-AOC,1st position,05-Feb-2024,,,,,,,,,,,,,,,,,,,,,,,,,,,,,,,,,,,,,,,,,,,,,,,,,,,,,,,,,,,,,,,,,,.pdf,Eligibility criteria as per form No. 6 of tender document,,,,,,,,,,,,,,
,,,,,,,,,,,,,,,,,,,,,,,,,,,,,,,,,,,,,,,,,,,,,,,,,,,,,,,,,,,,,,,,,,,,,,,,,,,,,,,,,,,,,,,,,,.pdf,work in hand detail as form 6 of biding capacity which ever applicable and work done certificate,,,,,,,,,,,,,,
,,,,,,,,,,,,,,,,,,,,,,,,,,,,,,,,,,,,,,,,,,,,,,,,,,,,,,,,,,,,,,,,,,,,,,,,,,,,,,,,,,,,,,,,,,.pdf,Undertaking of acceptance of term and condition of form 6 and 8,,,,,,,,,,,,,,
,,,,,,,,,,,,,,,,,,,,,,,,,,,,,,,,,,,,,,,,,,,,,,,,,,,,,,,,,,,,,,,,,,,,,,,,,,,,,,,,,,,,,,,,,,.pdf,Undertaking regarding not more than two work in hand in shape of affidavit,,,,,,,,,,,,,,
,,,,,,,,,,,,,,,,,,,,,,,,,,,,,,,,,,,,,,,,,,,,,,,,,,,,,,,,,,,,,,,,,,,,,,,,,,,,,,,,,,,,,,,,2.0,Finance,.xls,BOQ,,,,,,,,,,,,,,
