Organisation Chain,Tender Reference Number,Tender ID,Withdrawal Allowed,Tender Type,Form of contract,Tender Category,No. of Covers,General Technical Evaluation Allowed,ItemWise Technical Evaluation Allowed,Payment Mode,Is Multi Currency Allowed For BOQ,Is Multi Currency Allowed For Fee,Allow Two Stage Bidding,Publish Date,Bid Opening Date,Document Download / Sale Start Date,Document Download / Sale End Date,Clarification Start Date,Clarification End Date,Bid Submission Start Date,Bid Submission End Date,Financial Bid Opening Date,EMD Amount in ₹,EMD Exemption Allowed,EMD Fee Type,EMD Percentage,EMD Payable To,EMD Payable At,Tender Fee in ₹,Fee Payable To,Fee Payable At,Tender Fee Exemption Allowed,Title,Work Description,Pre Qualification Details,Independent External Monitor/Remarks,Tender Value in ₹,Product Category,Sub category,Contract Type,Bid Validity(Days),Period Of Work(Days),Location,Pincode,Pre Bid Meeting Place,Pre Bid Meeting Address,Pre Bid Meeting Date,Bid Opening Place,Should Allow NDA Tender,Allow Preferential Bidder,Name,Address,S.No,Corrigendum Title,Corrigendum Type,View,S.No.1,Instrument Type,Cover No,Cover,Document Type,Description,S.No.2,Bid Number,Bidder Name,Awarded Currency,Awarded Value,Organisation Chain :,Tender ID :,Tender Ref No :,Tender Title :,Committee Chairperson/Co-ordinator Name :,Committee Chairperson/Co-ordinator Type :,Committee Members :,Updated By :,Updated On :,Financial Bid Opening Date:,Document :,Type :,Summary :,Updated By :.1,Updated On :.1,Document :.1,BOQ Comparative Chart :,Contract Date :,Contract Value :,Work Completion Period in days :,Updated By :.2,Updated on :,AOC document :,AOC Description :,S.No.1.1,Bid Number.1,Bidder Name.1,Submitted Date,Status,Remarks,Status Updated On,Committee Chairperson/Co-ordinator Name :.1,Committee Chairperson/Co-ordinator Type :.1,Committee Members :.1,Updated By :.3,Updated on :.1,Document :.2,Type :.1,Summary :.1,Updated By :.4,Updated On :.2,Document :.3
Municipal Corporation Shimla,1446Dated19072023,2023_MC_76708_6,Yes,Open Tender,Item Rate,Works,2.0,No,No,Offline,No,No,No,24-Jul-2023 06:30 PM,05-Aug-2023 03:00 PM,24-Jul-2023 06:30 PM,05-Aug-2023 11:00 AM,NA ,NA ,24-Jul-2023 06:30 PM,05-Aug-2023 11:00 AM,29-Aug-2023 02:40 PM,"3,400",No,fixed,,Executive Engineer R B M C Shimla,Shimla,350.0,Executive Engineer R B M C Shimla,Shimla,No,Repair and maintenance of MC Qtr allotted to Sh Pardeep Kumar Driver House No.227 Suji Line SubziMandi in ward No 14 Ram Bazar,Repair and maintenance of MC Qtr allotted to Sh Pardeep Kumar Driver House No.227 Suji Line SubziMandi in ward No 14 Ram Bazar,Please refer Tender Documents ,NA ,"1,68,819",Civil Works,NA ,Tender,120.0,30.0,Shimla,171001.0,NA ,NA ,NA ,MC Shimla,No ,No,Executive Engineer R B M C Shimla,Executive Engineer R B M C Shimla,1.0,Corrigendum,Date,,1.0,DD - Demand Draft,1.0,Fee/PreQual/Technical,.pdf,Cost of form in shape of DD and Earnest money in shape of FDR as per E procurement notice,1.0,363046.0,Pawan Kumar,INR,"141,693",Municipal Corporation Shimla,2023_MC_76708_6,1446Dated19072023,Repair and maintenance of MC Qtr allotted to Sh Pardeep Kumar Driver House No.227 Suji Line SubziMandi in ward No 14 Ram Bazar,EE,Internal,AO AE,Rajesh Thakur,29-Aug-2023 02:37 PM,29-Aug-2023 02:40 PM,techsummary_114662.pdf (958.33 KB),Finance,BOS,Dinesh Thakur,29-Aug-2023 02:59 PM,finance_114662.pdf,BOQ Comparative Chart,22-Feb-2024,"INR 151,067.2",30.0,Rajesh Thakur,22-Feb-2024 01:08 PM,2023_MC_76708_6.pdf (690.00 KB),AOC,1.0,363250.0,ABDUL RAZAK BUTT,29-Jul-2023 05:40 PM,Rejected-Finance,Rejected,22-Feb-2024,EE,Internal,AO AE,Rajesh Thakur,22-Feb-2024 01:06 PM,finsummary_114662.pdf (314.77 KB),Technical,BOS,Rajesh Thakur,28-Aug-2023 03:42 PM,technical_114662.pdf
,,,,,,,,,,,,,,,,,,,,,,,,,,,,,,,,,,,,,,,,,,,,,,,,,,,,,,,,,2.0,FDR - Fixed Deposit,,,.pdf,Certificate of registration with HPPWD in appropriate class and latest renewal thereof,,,,,,,,,,,,,,,,,,,,,,,,,,,,,,2.0,363213.0,Bhaw Singh Chauhan,29-Jul-2023 03:12 PM,Rejected-Finance,Rejected,22-Feb-2024,,,,,,,,,,,
,,,,,,,,,,,,,,,,,,,,,,,,,,,,,,,,,,,,,,,,,,,,,,,,,,,,,,,,,,,,,.pdf,Income Tax GST and EPF registration PAN Permanent Account No and GST No,,,,,,,,,,,,,,,,,,,,,,,,,,,,,,3.0,363816.0,mukul thakur,01-Aug-2023 02:34 PM,Rejected-Finance,Rejected,22-Feb-2024,,,,,,,,,,,
,,,,,,,,,,,,,,,,,,,,,,,,,,,,,,,,,,,,,,,,,,,,,,,,,,,,,,,,,,,,,.pdf,Scanned Copy of tender documents i.e. NIT (E-procurement notice) Performa and Form MW-7 duly signed,,,,,,,,,,,,,,,,,,,,,,,,,,,,,,4.0,363046.0,Pawan Kumar,28-Jul-2023 01:16 PM,Accepted-AOC,Accepted,22-Feb-2024,,,,,,,,,,,
,,,,,,,,,,,,,,,,,,,,,,,,,,,,,,,,,,,,,,,,,,,,,,,,,,,,,,,,,,,,,.pdf,Scanned copy of Affidavit duly signed with reference to condition No. 11.4,,,,,,,,,,,,,,,,,,,,,,,,,,,,,,,,,,,,,,,,,,,,,,,
,,,,,,,,,,,,,,,,,,,,,,,,,,,,,,,,,,,,,,,,,,,,,,,,,,,,,,,,,,,,,.pdf,Scanned copy of Letter Head with reference to condition No. 11.1,,,,,,,,,,,,,,,,,,,,,,,,,,,,,,,,,,,,,,,,,,,,,,,
,,,,,,,,,,,,,,,,,,,,,,,,,,,,,,,,,,,,,,,,,,,,,,,,,,,,,,,,,,,2.0,Finance,.xls,BOQ,,,,,,,,,,,,,,,,,,,,,,,,,,,,,,,,,,,,,,,,,,,,,,,
