Type :,Summary :,Updated By :,Updated On :,Document :,Type :.1,Summary :.1,Updated By :.1,Updated On :.1,Document :.1,BOQ Comparative Chart :,Contract Date :,Contract Value :,Work Completion Period in days :,Updated By :.2,Updated on :,AOC document :,S.No,Bid Number,Bidder Name,Submitted Date,Status,Remarks,Status Updated On,Committee Chairperson/Co-ordinator Name :,Committee Chairperson/Co-ordinator Type :,Committee Members :,Updated By :.3,Updated On :.2,Financial Bid Opening Date:,Document :.2,Organisation Chain :,Tender ID :,Tender Ref No :,Tender Title :,S.No.1,Bid Number.1,Bidder Name.1,Awarded Currency,Awarded Value,Committee Chairperson/Co-ordinator Name :.1,Committee Chairperson/Co-ordinator Type :.1,Committee Members :.1,Updated By :.4,Updated on :.1,Document :.3,Title,Work Description,Pre Qualification Details,Independent External Monitor/Remarks,Tender Value in ₹,Product Category,Sub category,Contract Type,Bid Validity(Days),Period Of Work(Days),Location,Pincode,Pre Bid Meeting Place,Pre Bid Meeting Address,Pre Bid Meeting Date,Bid Opening Place,Should Allow NDA Tender,Allow Preferential Bidder,Organisation Chain,Tender Reference Number,Tender ID,Withdrawal Allowed,Tender Type,Form of contract,Tender Category,No. of Covers,General Technical Evaluation Allowed,ItemWise Technical Evaluation Allowed,Payment Mode,Is Multi Currency Allowed For BOQ,Is Multi Currency Allowed For Fee,Allow Two Stage Bidding,EMD Amount in ₹,EMD Exemption Allowed,EMD Fee Type,EMD Percentage,EMD Payable To,EMD Payable At,S.No.2,Bank Name,S.No.1.1,Corrigendum Title,Corrigendum Type,View,Name,Address,Publish Date,Bid Opening Date,Document Download / Sale Start Date,Document Download / Sale End Date,Clarification Start Date,Clarification End Date,Bid Submission Start Date,Bid Submission End Date,Financial Bid Opening Date,Tender Fee in ₹,Fee Payable To,Fee Payable At,Tender Fee Exemption Allowed,Cover No,Cover,Document Type,Description
Technical,Technical Bid Opening Summary,Karan Chandel,30-Nov-2023 03:59 PM,technical_121031.pdf,Finance,Financial summary,Karan Chandel,04-Jan-2024 02:46 PM,finance_121031.pdf,BOQ Comparative Chart,01-Feb-2024,"INR 142,165",60.0,Karan Chandel,27-Mar-2024 02:53 PM,Award40.pdf (1898.00 KB),1.0,385741.0,aman deep,23-Nov-2023 08:22 PM,Rejected-Finance,Higher,04-Jan-2024,Er Karan Chandel,Internal,"AE Works, Sr. Asst (Account Branch)",Karan Chandel,03-Jan-2024 11:48 AM,04-Jan-2024 12:00 PM,techsummary_121031.pdf (534.40 KB),HPSEBL||CE(OP) CZ Mandi||SE(OP) Bilaspur||Sr. Xen (E) Ghumarwin,2023_HPSEB_81290_1,NIT-40/2023-24,Provide 33 KV HT line from 33/11 KV S/Stn Jhabola yard to four pole structure at Jhabola under ESD HPSEBL Talai.,1.0,383982.0,M/s Rudra Power Xmission,INR,"142,165",Er. Karan Chandel,Internal,"AE Works, Supdt (Divisional Accountant)",Karan Chandel,04-Jan-2024 03:00 PM,finsummary_121031.pdf (598.18 KB),Provide 33 KV HT line from 33/11 KV S/Stn Jhabola yard to four pole structure at Jhabola under ESD HPSEBL Talai.,"Provide 33 KV HT line from 33/11 KV S/Stn Jhabola yard to four pole structure at Jhabola under ESD HPSEBL, Talai. CH To Estimate for prov. 2x1.6 MVA, 33/11 KV S/Stn. At Kut Bounger under ESD HPSEBL, Talai.",Please refer Tender documents. ,NA ,,Electrical Works,NA ,Tender,180.0,60.0,Talai,174021.0,NA ,NA ,NA ,Ghumarwin,No ,No,HPSEBL||CE(OP) CZ Mandi||SE(OP) Bilaspur||Sr. Xen (E) Ghumarwin,NIT-40/2023-24,2023_HPSEB_81290_1,Yes,Open Tender,Percentage,Works,2.0,No,No,Online,No,No,No,"3,419",No,fixed,,Nil,Nil,1.0,ICICI BANK,1.0,Tender date extended,Date,,Sr. Executive Engineer,"Electrical Division HPSEBL, Ghumarwin.",10-Nov-2023 11:00 AM,30-Nov-2023 02:30 PM,10-Nov-2023 05:00 PM,30-Nov-2023 11:00 AM,NA ,NA ,10-Nov-2023 05:00 PM,30-Nov-2023 11:00 AM,04-Jan-2024 12:00 PM,590.0,Nil,Nil,No,1.0,Fee/PreQual/Technical,.pdf,Scanned copy of Tender Cost
,,,,,,,,,,,,,,,,,2.0,385738.0,M/s Dhiman Electrical,23-Nov-2023 07:58 PM,Rejected-Finance,Higher,04-Jan-2024,,,,,,,,,,,,,,,,,,,,,,,,,,,,,,,,,,,,,,,,,,,,,,,,,,,,,,,,,,,,,2.0,ICICI NEFT/RTGS,,,,,,,,,,,,,,,,,,,,,,.pdf,Scanned copy of EMD
,,,,,,,,,,,,,,,,,3.0,383982.0,M/s Rudra Power Xmission,23-Nov-2023 07:33 PM,Accepted-AOC,Work awarded,27-Mar-2024,,,,,,,,,,,,,,,,,,,,,,,,,,,,,,,,,,,,,,,,,,,,,,,,,,,,,,,,,,,,,,,,,,,,,,,,,,,,,,,,,,,,.pdf,Scanned copy of technical eligibility documents
,,,,,,,,,,,,,,,,,4.0,385015.0,RAVINDER SINGH,20-Nov-2023 02:44 PM,Rejected-Technical,Not Qualified,03-Jan-2024,,,,,,,,,,,,,,,,,,,,,,,,,,,,,,,,,,,,,,,,,,,,,,,,,,,,,,,,,,,,,,,,,,,,,,,,,,,,,,,,,,,,.pdf,Scanned copy of signed bid document
,,,,,,,,,,,,,,,,,,,,,,,,,,,,,,,,,,,,,,,,,,,,,,,,,,,,,,,,,,,,,,,,,,,,,,,,,,,,,,,,,,,,,,,,,,,,,,,,,,,,,,,,,2.0,Finance,.xls,BOQ
