S.No,Bid Number,Bidder Name,Awarded Currency,Awarded Value,Type :,Summary :,Updated By :,Updated On :,Document :,BOQ Comparative Chart :,Type :.1,Summary :.1,Updated By :.1,Updated On :.1,Document :.1,S.No.1,Bid Number.1,Bidder Name.1,Submitted Date,Status,Remarks,Status Updated On,Committee Chairperson/Co-ordinator Name :,Committee Chairperson/Co-ordinator Type :,Committee Members :,Updated By :.2,Updated on :,Document :.2,Contract Date :,Contract Value :,Work Completion Period in days :,Updated By :.3,Updated on :.1,AOC document :,AOC Description :,Organisation Chain :,Tender ID :,Tender Ref No :,Tender Title :,Committee Chairperson/Co-ordinator Name :.1,Committee Chairperson/Co-ordinator Type :.1,Committee Members :.1,Updated By :.4,Updated On :.2,Financial Bid Opening Date:,Document :.3,Tender Stage,Cover No,Cover,Document Type,Description,Tender Fee in ₹,Fee Payable To,Fee Payable At,Tender Fee Exemption Allowed,Name,Address,Title,Work Description,Pre Qualification Details,Independent External Monitor/Remarks,Tender Value in ₹,Product Category,Sub category,Contract Type,Bid Validity(Days),Period Of Work(Days),Location,Pincode,Pre Bid Meeting Place,Pre Bid Meeting Address,Pre Bid Meeting Date,Bid Opening Place,Should Allow NDA Tender,Allow Preferential Bidder,S.No,Bank Name,Publish Date,Bid Opening Date,Document Download / Sale Start Date,Document Download / Sale End Date,Clarification Start Date,Clarification End Date,Bid Submission Start Date,Bid Submission End Date,Financial Bid Opening Date,EMD Amount in ₹,EMD Exemption Allowed,EMD Fee Type,EMD Percentage,EMD Payable To,EMD Payable At,Organisation Chain,Tender Reference Number,Tender ID,Withdrawal Allowed,Tender Type,Form of contract,Tender Category,No. of Covers,General Technical Evaluation Allowed,ItemWise Technical Evaluation Allowed,Payment Mode,Is Multi Currency Allowed For BOQ,Is Multi Currency Allowed For Fee,Allow Two Stage Bidding,Tender Stage
1.0,182352.0,Ranjeet Thakur,INR,"915,496",Finance,Financial Bid Open Summary,Gurminder Singh,29-Oct-2020 10:53 AM,finance_61239.pdf,BOQ Comparative Chart,Technical,Technical Bid Open Summary,Gurminder Singh,27-Oct-2020 03:48 PM,technical_61239.pdf,1.0,182513.0,M/S LALIT KUMAR,14-Oct-2020 05:58 PM,Rejected-Finance,Due to L2,29-Oct-2020 10:58 AM,Executive Engineer,Internal,EAI SUPDT HDM SRDAO,Gurminder Singh,29-Oct-2020 10:56 AM,finsummary_61239.pdf (606.47 KB),12-Mar-2021,"INR 554,324",90.0,Gurminder Singh,12-Mar-2021 05:02 PM,awardleeter.PDF (1563.00 KB),Award Letter,PWD,2020_PWD_41503_1,PW-NBT/CB/Tender/2020-7196-99 dated 16.09.2020,A/R and M/O Ghial Dabar road Km. 0/0 to 11/0 (SH- Repair of Pot holes in Km. 7/0 to 11/0),Executive Engineer,Internal,EAI SUPDT HDM SRDAO,Gurminder Singh,27-Oct-2020 04:00 PM,27-Oct-2020 04:05 PM,techsummary_61239.pdf (760.91 KB),AOC,1.0,Fee/PreQual/Technical,.pdf,Receipt of Cost of Tender and Earnest Money refer in Schedule F,350.0,EE Bilaspur Division No. 2 HPPWD Bilaspur,Bilaspur,No,EE Bilaspur Division No. 2 HPPWD Bilaspur,EE Bilaspur Division No. 2 HPPWD Bilaspur,A/R and M/O Ghial Dabar road Km. 0/0 to 11/0 (SH- Repair of Pot holes in Km. 7/0 to 11/0),A/R and M/O Ghial Dabar road Km. 0/0 to 11/0 (SH- Repair of Pot holes in Km. 7/0 to 11/0),Refer in SBD ,NA ,"5,54,324",Civil Works,NA ,Tender,45.0,90.0,Bilaspur,174001.0,NA ,NA ,NA ,EE Bilaspur Division No. 2 HPPWD Bilaspur,No ,No,1.0,ICICI BANK,08-Oct-2020 06:30 PM,15-Oct-2020 11:30 AM,08-Oct-2020 06:30 PM,15-Oct-2020 11:00 AM,NA ,NA ,08-Oct-2020 06:30 PM,15-Oct-2020 11:00 AM,27-Oct-2020 04:05 PM,"11,200",No,fixed,,EE Bilaspur Division No. 2 HPPWD Bilaspur,Bilaspur,PWD,PW-NBT/CB/Tender/2020-7196-99 dated 16.09.2020,2020_PWD_41503_1,Yes,Open Tender,Item Rate,Works,2.0,No,No,Online,No,No,No,AOC
,,,,,,,,,,,,,,,,2.0,182352.0,Ranjeet Thakur,13-Oct-2020 06:33 PM,Accepted-AOC,Due to L1,12-Mar-2021 05:02 PM,,,,,,,,,,,,,,,,,,,,,,,,,AOC,,,.pdf,Contractor Registration refer General rule No 23,,,,,,,,,,,,,,,,,,,,,,,,,2.0,ICICI NEFT/RTGS,,,,,,,,,,,,,,,,,,,,,,,,,,,,,,AOC
,,,,,,,,,,,,,,,,,,,,,,,,,,,,,,,,,,,,,,,,,,,,,,,AOC,,,.pdf,"GST, PAN and EPF refer General rule No 21",,,,,,,,,,,,,,,,,,,,,,,,,,,,,,,,,,,,,,,,,,,,,,,,,,,,,,,,AOC
,,,,,,,,,,,,,,,,,,,,,,,,,,,,,,,,,,,,,,,,,,,,,,,AOC,,,.pdf,Work done certificate and work in hand certificate refer General rule No 19,,,,,,,,,,,,,,,,,,,,,,,,,,,,,,,,,,,,,,,,,,,,,,,,,,,,,,,,AOC
,,,,,,,,,,,,,,,,,,,,,,,,,,,,,,,,,,,,,,,,,,,,,,,AOC,,,.pdf,"List of machinery, Tool, Plant refer in Schedule F with reference to clause 18",,,,,,,,,,,,,,,,,,,,,,,,,,,,,,,,,,,,,,,,,,,,,,,,,,,,,,,,AOC
,,,,,,,,,,,,,,,,,,,,,,,,,,,,,,,,,,,,,,,,,,,,,,,AOC,,,.pdf,Affidavit of Correctness of all documents by bidder,,,,,,,,,,,,,,,,,,,,,,,,,,,,,,,,,,,,,,,,,,,,,,,,,,,,,,,,AOC
,,,,,,,,,,,,,,,,,,,,,,,,,,,,,,,,,,,,,,,,,,,,,,,AOC,,,.pdf,Form No 8,,,,,,,,,,,,,,,,,,,,,,,,,,,,,,,,,,,,,,,,,,,,,,,,,,,,,,,,AOC
,,,,,,,,,,,,,,,,,,,,,,,,,,,,,,,,,,,,,,,,,,,,,,,AOC,2.0,Finance,.xls,BOQ,,,,,,,,,,,,,,,,,,,,,,,,,,,,,,,,,,,,,,,,,,,,,,,,,,,,,,,,AOC
