Organisation Chain,Tender Reference Number,Tender ID,Withdrawal Allowed,Tender Type,Form of contract,Tender Category,No. of Covers,General Technical Evaluation Allowed,ItemWise Technical Evaluation Allowed,Payment Mode,Is Multi Currency Allowed For BOQ,Is Multi Currency Allowed For Fee,Allow Two Stage Bidding,Cover No,Cover,Document Type,Description,Tender Fee in ₹,Fee Payable To,Fee Payable At,Tender Fee Exemption Allowed,S.No,Instrument Type,EMD Amount in ₹,EMD Exemption Allowed,EMD Fee Type,EMD Percentage,EMD Payable To,EMD Payable At,Title,Work Description,Pre Qualification Details,Independent External Monitor/Remarks,Tender Value in ₹,Product Category,Sub category,Contract Type,Bid Validity(Days),Period Of Work(Days),Location,Pincode,Pre Bid Meeting Place,Pre Bid Meeting Address,Pre Bid Meeting Date,Bid Opening Place,Should Allow NDA Tender,Allow Preferential Bidder,Publish Date,Bid Opening Date,Document Download / Sale Start Date,Document Download / Sale End Date,Clarification Start Date,Clarification End Date,Bid Submission Start Date,Bid Submission End Date,Name,Address,Tender Stage,S.No,Bid Number,Bidder Name,Submitted Date,Status,Remarks,Status Updated On,Organisation Chain :,Tender ID :,Tender Ref No :,Tender Title :,Type :,Summary :,Updated By :,Updated On :,Document :,BOQ Comparative Chart :,Committee Chairperson/Co-ordinator Name :,Committee Chairperson/Co-ordinator Type :,Committee Members :,Updated By :.1,Updated On :.1,Document :.1,Committee Chairperson/Co-ordinator Name :.1,Committee Chairperson/Co-ordinator Type :.1,Committee Members :.1,Updated By :.2,Updated on :,Document :.2,Contract Date :,Contract Value :,Work Completion Period in days :,Updated By :.3,Updated on :.1,AOC document :,AOC Description :,Tender Stage
"HP State Forest Development Corporation||Director south ,FDC,HP||DM,Rampur,Director South,FDC,HP",No.4428-53 dated 05.02.2021,2021_FDC_44170_1,Yes,Open Tender,Item Rate,Works,1.0,No,No,Offline,No,No,No,1.0,Fee/PreQual/Technical/Finance,.pdf,Cost of tender form,672.0,DM FWD Rampur,Rampur,Yes,1.0,DD - Demand Draft,"75,000",Yes,fixed,,DM FWD Rampur,Rampur,Lot No.17-2020-21 Rampur Felling conversion and carriage of timber upto RSD Miragnala and further TT to HSD baddi,Extraction and carriage of timber upto HSD,Please refer Tender documents. ,NA ,,Composite Works,NA ,Tender,45.0,365.0,Rampur range,172001.0,NA ,NA ,NA ,FWD Rampur,No ,No,09-Feb-2021 02:00 PM,18-Feb-2021 02:30 PM,10-Feb-2021 10:00 AM,18-Feb-2021 02:00 PM,NA ,NA ,10-Feb-2021 10:00 AM,18-Feb-2021 02:00 PM,Divisional Manager,Forest Working Division Rampur,AOC,1.0,198934.0,M/S SUNDER SINGH,17-Feb-2021 02:40 PM,Accepted-AOC,Lowest,31-Mar-2021 02:58 PM,"HP State Forest Development Corporation||Director south ,FDC,HP||DM,Rampur,Director South,FDC,HP",2021_FDC_44170_1,No.4428-53 dated 05.02.2021,Lot No.17-2020-21 Rampur Felling conversion and carriage of timber upto RSD Miragnala and further TT to HSD baddi,Finance,Lowest rate quoted by sunder singh,CHAMAN LAL,26-Feb-2021 12:17 PM,finance_66190.pdf,BOQ Comparative Chart,DM,Internal,Om Incharge works,CHAMAN LAL,26-Feb-2021 12:18 PM,techsummary_66190.pdf (155.46 KB),DM,Internal,OM and Incharge works,CHAMAN LAL,31-Mar-2021 02:51 PM,finsummary_66190.pdf (155.46 KB),31-Mar-2021,"INR 824,342",365.0,CHAMAN LAL,31-Mar-2021 02:58 PM,AOC.pdf (353.00 KB),Work allotted to Sunder Singh,AOC
,,,,,,,,,,,,,,,,.pdf,Earnest money,,,,,2.0,FDR - Fixed Deposit,,,,,,,,,,,,,,,,,,,,,,,,,,,,,,,,,,,AOC,,,,,,,,,,,,,,,,,,,,,,,,,,,,,,,,,,,,,AOC
,,,,,,,,,,,,,,,,.pdf,Copy of GST No,,,,,,,,,,,,,,,,,,,,,,,,,,,,,,,,,,,,,,,,,AOC,,,,,,,,,,,,,,,,,,,,,,,,,,,,,,,,,,,,,AOC
,,,,,,,,,,,,,,,,.pdf,Copy of registration no,,,,,,,,,,,,,,,,,,,,,,,,,,,,,,,,,,,,,,,,,AOC,,,,,,,,,,,,,,,,,,,,,,,,,,,,,,,,,,,,,AOC
,,,,,,,,,,,,,,,,.xls,BOQ tender form,,,,,,,,,,,,,,,,,,,,,,,,,,,,,,,,,,,,,,,,,AOC,,,,,,,,,,,,,,,,,,,,,,,,,,,,,,,,,,,,,AOC
