Type :,Summary :,Updated By :,Updated On :,Document :,BOQ Comparative Chart :,S.No,Bid Number,Bidder Name,Awarded Currency,Awarded Value,Committee Chairperson/Co-ordinator Name :,Committee Chairperson/Co-ordinator Type :,Committee Members :,Updated By :.1,Updated On :.1,Document :.1,Contract Date :,Contract Value :,Work Completion Period in days :,Updated By :.2,Updated on :,AOC document :,S.No.1,Bid Number.1,Bidder Name.1,Submitted Date,Status,Remarks,Status Updated On,Organisation Chain :,Tender ID :,Tender Ref No :,Tender Title :,Committee Chairperson/Co-ordinator Name :.1,Committee Chairperson/Co-ordinator Type :.1,Committee Members :.1,Updated By :.3,Updated on :.1,Document :.2,Tender Stage,Cover No,Cover,Document Type,Description,S.No,Instrument Type,Organisation Chain,Tender Reference Number,Tender ID,Withdrawal Allowed,Tender Type,Form of contract,Tender Category,No. of Covers,General Technical Evaluation Allowed,ItemWise Technical Evaluation Allowed,Payment Mode,Is Multi Currency Allowed For BOQ,Is Multi Currency Allowed For Fee,Allow Two Stage Bidding,EMD Amount in ₹,EMD through BG/ST or EMD Exemption Allowed,EMD Fee Type,EMD Percentage,EMD Payable To,EMD Payable At,S.No.1,Corrigendum Title,Corrigendum Type,View,Name,Address,Publish Date,Bid Opening Date,Document Download / Sale Start Date,Document Download / Sale End Date,Clarification Start Date,Clarification End Date,Bid Submission Start Date,Bid Submission End Date,Title,Work Description,Pre Qualification Details,Independent External Monitor/Remarks,Tender Value in ₹,Product Category,Sub category,Contract Type,Bid Validity(Days),Period Of Work(Days),Location,Pincode,Pre Bid Meeting Place,Pre Bid Meeting Address,Pre Bid Meeting Date,Bid Opening Place,Should Allow NDA Tender,Allow Preferential Bidder,Tender Fee in ₹,Fee Payable To,Fee Payable At,Tender Fee Exemption Allowed,Tender Stage
Finance,Bid Opening Summary,Jayanta Kumar Barman,07-Sep-2019 07:33 PM,finance_20811.pdf,BOQ Comparative Chart,1.0,63848.0,GEE PEE REINFORCED PRODUCTS PVT LTD,INR,4189500.0,"Dhrubajyoti Das,ACS",Internal,"1.Rahul Ch Das,ACS 2.Robin Kalita 3.Dhrubajyoti Sama 3Manik C Sarma 4.Prasanta Bora 5.Antima D Sarawgi",Jayanta Kumar Barman,11-Nov-2019 07:41 PM,techsummary_20811.pdf (12250.83 KB),28-Feb-2020,INR 4189500.0,45.0,Jayanta Kumar Barman,08-Mar-2021 05:33 PM,Contract.pdf (1312.00 KB),1,63870,AQUARIUS SHIPYARD PVT LTD,04-Sep-2019 03:20 PM,Rejected-Finance,Commercially non Responsive,11-Nov-2019 08:00 PM,Assam Inland Water Transport Development Society,2019_AIWTD_13407_1,IN-IWT-120889-GO-RFB,Supply of Manover Board Boat for Assam IWT Vessels,"Dhrubajyoti Das,ACS",Internal,"1.Rahul Ch Das,ACS 2.Robin Kalita 3.Manik Ch Sarma 4.Dhrubajyoti Sarma 5.Prasanta Bora 6.Antima D Sarawgi",Jayanta Kumar Barman,11-Nov-2019 08:00 PM,finsummary_20811.pdf (12250.83 KB),AOC,1.0,Fee/PreQual/Technical/Finance,.pdf,Tender Fee and Bid Security/EMD,1.0,DD - Demand Draft,Assam Inland Water Transport Development Society,IN-IWT-120889-GO-RFB,2019_AIWTD_13407_1,Yes,Open Tender,Lump-sum,Goods,1.0,No,No,Offline,No,No,No,"1,20,000",No,fixed,,AIWTDS,Guwahati,1.0,Corrigendum-III for Supply of Manover Board Boat for Assam IWT Vessels,Date,,"Deputy State Project Director,AIWTDS","ASSAM INLAND WATER TRANSPORT DEVELOPMENT SOCIETY 3rd Floor, Directorate of Inland Water Transport, Assam Ulubari, Guwahati-781007",29-Jun-2019 03:00 PM,05-Sep-2019 03:30 PM,29-Jun-2019 03:00 PM,05-Sep-2019 01:00 PM,30-Jun-2019 09:00 AM ,16-Jul-2019 02:00 PM ,22-Jul-2019 10:00 AM,05-Sep-2019 01:00 PM,Supply of Manover Board Boat for Assam IWT Vessels,SUPPLY OF 3 NOS. MAN OVER BOARD (MOB) / RESCUE BOATS FOR INSTALLING ON VARIOUS LARGE VESSELS OF IWT ASSAM,Please refer Tender documents. ,NA ,"60,00,000",Surveillance Equipments,NA ,Tender,90.0,45.0,Guwahati,781007.0,NA ,NA ,NA ,Assam IWTD Society Office,No ,No,"2,000",AIWTDS,Guwahati,No,AOC
,,,,,,,,,,,,,,,,,,,,,,,2,63877,Chowgule And Company Private Limited,27-Aug-2019 07:31 PM,Rejected-Finance,Commercially non Responsive,11-Nov-2019 08:00 PM,,,,,,,,,,,AOC,,,.pdf,Technical Bid Document,2.0,BC - Bankers Cheque,,,,,,,,,,,,,,,,,,,,,,,,,,,,,,,,,,,,,,,,,,,,,,,,,,,,,,,,,AOC
,,,,,,,,,,,,,,,,,,,,,,,3,63848,GEE PEE REINFORCED PRODUCTS PVT LTD,28-Aug-2019 12:09 PM,Accepted-AOC,Lowest Evaluated Responsive Bidder,08-Mar-2021 05:33 PM,,,,,,,,,,,AOC,,,.pdf,Documents against the Tender,3.0,BG - Bank Guarantee Irrevocable,,,,,,,,,,,,,,,,,,,,,,,,,,,,,,,,,,,,,,,,,,,,,,,,,,,,,,,,,AOC
,,,,,,,,,,,,,,,,,,,,,,,4,63024,SHM SHIPCARE,09-Aug-2019 12:42 PM,Rejected-Finance,Commercially non Responsive,11-Nov-2019 08:00 PM,,,,,,,,,,,AOC,,,.pdf,Drawing,,,,,,,,,,,,,,,,,,,,,,,,,,,,,,,,,,,,,,,,,,,,,,,,,,,,,,,,,,,AOC
,,,,,,,,,,,,,,,,,,,,,,,5,63021,SUNNY WATER SPORTS PRODUCTS PVT LTD,24-Aug-2019 05:27 PM,Rejected-Technical,Non Responsive,11-Nov-2019 07:41 PM,,,,,,,,,,,AOC,,,.pdf,Additional Documents,,,,,,,,,,,,,,,,,,,,,,,,,,,,,,,,,,,,,,,,,,,,,,,,,,,,,,,,,,,AOC
,,,,,,,,,,,,,,,,,,,,,,,6,63846,Ultramarine Yachts Private Limited,28-Aug-2019 12:33 PM,Rejected-Technical,Non Responsive,11-Nov-2019 07:41 PM,,,,,,,,,,,AOC,,,.xls,Financial Folder,,,,,,,,,,,,,,,,,,,,,,,,,,,,,,,,,,,,,,,,,,,,,,,,,,,,,,,,,,,AOC
