Organisation Chain,Tender Reference Number,Tender ID,Withdrawal Allowed,Tender Type,Form of contract,Tender Category,No. of Covers,General Technical Evaluation Allowed,ItemWise Technical Evaluation Allowed,Payment Mode,Is Multi Currency Allowed For BOQ,Is Multi Currency Allowed For Fee,Allow Two Stage Bidding,Cover No,Cover,Document Type,Description,Publish Date,Bid Opening Date,Document Download / Sale Start Date,Document Download / Sale End Date,Clarification Start Date,Clarification End Date,Bid Submission Start Date,Bid Submission End Date,Financial Bid Opening Date,EMD Amount in ₹,EMD Exemption Allowed,EMD Fee Type,EMD Percentage,EMD Payable To,EMD Payable At,S.No,Bank Name,Tender Fee in ₹,Fee Payable To,Fee Payable At,Tender Fee Exemption Allowed,Name,Address,Title,Work Description,Pre Qualification Details,Independent External Monitor/Remarks,Tender Value in ₹,Product Category,Sub category,Contract Type,Bid Validity(Days),Period Of Work(Days),Location,Pincode,Pre Bid Meeting Place,Pre Bid Meeting Address,Pre Bid Meeting Date,Bid Opening Place,Should Allow NDA Tender,Allow Preferential Bidder,Tender Stage
"Himachal Urban Development Authority||Supdt. Engineer (S),HIMUDA||Executive Engineer,Shimla Division-I,HIMUDA",NO HIMUDA SD E TENDER 4509-19 DATED 06.01.2025,2025_HIMUD_97529_1,Yes,Open Tender,Percentage,Works,2.0,No,No,Online,No,No,No,1.0,Fee/PreQual/Technical,.pdf,Cost of tender and Earnest money (Indicated in Schedule E),06-Jan-2025 04:00 PM,16-Jan-2025 02:00 PM,06-Jan-2025 05:00 PM,15-Jan-2025 04:00 PM,,,06-Jan-2025 05:00 PM,15-Jan-2025 04:00 PM,23-Jan-2025 09:00 AM,"2,73,400",No,fixed,,Nil,Nil,1.0,ICICI BANK,"5,900",Nil,Nil,No,EE HIMUDA DIVISION SHIMLA,HIMUDA DIVISION SHIMLA,Housing Colony  under SFS 49 nos.plots Phase II New Rampur Distt. Shimla H.P.  Sub Head  Providing and laying  Metalling and tarring V and  U shape drain.,Housing Colony  under SFS 49 nos.plots Phase II New Rampur Distt. Shimla H.P.  Sub Head  Providing and laying  Metalling and tarring V and  U shape drain.,Please refer Tender documents.,,"1,36,69,946",Civil Works,,Tender,50.0,45.0,RAMPUR,172001.0,SHIMLA,HIMUDA DIVISION SHIMLA KASUMPIT SHIMLA 9,10-Jan-2025 11:30 AM,HIMUDA DIVISION SHIMLA,No,No,AOC
,,,,,,,,,,,,,,,,.pdf,Contractors Registration (General Rule No.20),,,,,,,,,,,,,,,,2.0,ICICI NEFT/RTGS,,,,,,,,,,,,,,,,,,,,,,,,,AOC
,,,,,,,,,,,,,,,,.pdf,GST registration EPF and PAN as per NIT. Latest GST clearance certificate,,,,,,,,,,,,,,,,,,,,,,,,,,,,,,,,,,,,,,,,,,AOC
,,,,,,,,,,,,,,,,.pdf,"Work Done, Work in Hand, Bid Capacity and Similar work as per SBD",,,,,,,,,,,,,,,,,,,,,,,,,,,,,,,,,,,,,,,,,,AOC
,,,,,,,,,,,,,,,,.pdf,Non judicial stamp paper that he is not black listed by any Central or state Govt. agency or deptt.,,,,,,,,,,,,,,,,,,,,,,,,,,,,,,,,,,,,,,,,,,AOC
,,,,,,,,,,,,,,,,.pdf,"List of machinery and Equipment as per Schedule F Clause 18 of GCC,  Detail of Machinery of SBD P-85",,,,,,,,,,,,,,,,,,,,,,,,,,,,,,,,,,,,,,,,,,AOC
,,,,,,,,,,,,,,,,.pdf,Under taking of acceptance of term and condition of form 6 and 7/8,,,,,,,,,,,,,,,,,,,,,,,,,,,,,,,,,,,,,,,,,,AOC
,,,,,,,,,,,,,,,,.pdf,Affidavit regarding all the information furnished with the bid is correct in all respect,,,,,,,,,,,,,,,,,,,,,,,,,,,,,,,,,,,,,,,,,,AOC
,,,,,,,,,,,,,,2.0,Finance,.xls,BOQ,,,,,,,,,,,,,,,,,,,,,,,,,,,,,,,,,,,,,,,,,,AOC
