Organisation Chain,Tender Reference Number,Tender ID,Withdrawal Allowed,Tender Type,Form of contract,Tender Category,No. of Covers,General Technical Evaluation Allowed,ItemWise Technical Evaluation Allowed,Payment Mode,Is Multi Currency Allowed For BOQ,Is Multi Currency Allowed For Fee,Allow Two Stage Bidding,Cover No,Cover,Document Type,Description,Publish Date,Bid Opening Date,Document Download / Sale Start Date,Document Download / Sale End Date,Clarification Start Date,Clarification End Date,Bid Submission Start Date,Bid Submission End Date,Financial Bid Opening Date,EMD Amount in ₹,EMD Exemption Allowed,EMD Fee Type,EMD Percentage,EMD Payable To,EMD Payable At,S.No,Bank Name,Tender Fee in ₹,Fee Payable To,Fee Payable At,Tender Fee Exemption Allowed,Name,Address,Title,Work Description,Pre Qualification Details,Independent External Monitor/Remarks,Tender Value in ₹,Product Category,Sub category,Contract Type,Bid Validity(Days),Period Of Work(Days),Location,Pincode,Pre Bid Meeting Place,Pre Bid Meeting Address,Pre Bid Meeting Date,Bid Opening Place,Should Allow NDA Tender,Allow Preferential Bidder,Tender Stage
PWD,653-58 dated 26.04.2023,2023_PWD_72608_1,Yes,Open Tender,Percentage,Works,2.0,No,No,Online,No,No,No,1.0,Fee/PreQual/Technical,.pdf,Cost of Tender Form (indicated in Schedule F),01-May-2023 09:00 AM,08-May-2023 11:00 AM,01-May-2023 09:00 AM,07-May-2023 05:00 PM,,,01-May-2023 09:00 AM,07-May-2023 05:00 PM,10-May-2023 11:25 AM,"45,000",No,fixed,,Nil,Nil,1.0,ICICI BANK,500.0,Nil,Nil,No,EXECUTIVE ENGINEER,EXECUTIVE ENGINEER KARCHHAM DIVISION HPPWD BHABANAGAR,Improvement of link road to EMRS at Nichar Km. 0/00 to 1/675 (SH- Mettaling tarring with premix carpet OGPC 20mm thick with seal coat on link road to EMRS Km. 0/00 to 1/675),Improvement of link road to EMRS at Nichar Km. 0/00 to 1/675 (SH- Mettaling tarring with premix carpet OGPC 20mm thick with seal coat on link road to EMRS Km. 0/00 to 1/675),Please refer Tender documents.,,"22,32,023",Civil Works,,Tender,120.0,90.0,BHABANAGAR,172115.0,,,,BHABANAGAR,No,No,AOC
,,,,,,,,,,,,,,,,.pdf,Earnest Money Deposit (indicated in Schedule F),,,,,,,,,,,,,,,,2.0,ICICI NEFT/RTGS,,,,,,,,,,,,,,,,,,,,,,,,,AOC
,,,,,,,,,,,,,,,,.pdf,Contractors Registration (Refer General Rule No 23),,,,,,,,,,,,,,,,,,,,,,,,,,,,,,,,,,,,,,,,,,AOC
,,,,,,,,,,,,,,,,.pdf,GST Number (Refer General Rule No 21),,,,,,,,,,,,,,,,,,,,,,,,,,,,,,,,,,,,,,,,,,AOC
,,,,,,,,,,,,,,,,.pdf,Permanent Account Number (PAN),,,,,,,,,,,,,,,,,,,,,,,,,,,,,,,,,,,,,,,,,,AOC
,,,,,,,,,,,,,,,,.pdf,Work Done Certificate of similar nature and work in hand (Refer General Rule No 19),,,,,,,,,,,,,,,,,,,,,,,,,,,,,,,,,,,,,,,,,,AOC
,,,,,,,,,,,,,,,,.pdf,"List of Machinery, Tool, Plant (Refer Schedule F with reference to Clause 18)",,,,,,,,,,,,,,,,,,,,,,,,,,,,,,,,,,,,,,,,,,AOC
,,,,,,,,,,,,,,,,.pdf,EPF Number,,,,,,,,,,,,,,,,,,,,,,,,,,,,,,,,,,,,,,,,,,AOC
,,,,,,,,,,,,,,2.0,Finance,.xls,BOQ,,,,,,,,,,,,,,,,,,,,,,,,,,,,,,,,,,,,,,,,,,AOC
