Organisation Chain,Tender Reference Number,Tender ID,Withdrawal Allowed,Tender Type,Form of contract,Tender Category,No. of Covers,General Technical Evaluation Allowed,ItemWise Technical Evaluation Allowed,Payment Mode,Is Multi Currency Allowed For BOQ,Is Multi Currency Allowed For Fee,Allow Two Stage Bidding,Cover No,Cover,Document Type,Description,Publish Date,Bid Opening Date,Document Download / Sale Start Date,Document Download / Sale End Date,Clarification Start Date,Clarification End Date,Bid Submission Start Date,Bid Submission End Date,Financial Bid Opening Date,EMD Amount in ₹,EMD Exemption Allowed,EMD Fee Type,EMD Percentage,EMD Payable To,EMD Payable At,S.No,Category,Sub Category,Sub Category Description,Format/File,S.No.1,Bank Name,Tender Fee in ₹,Fee Payable To,Fee Payable At,Tender Fee Exemption Allowed,Name,Address,Title,Work Description,Pre Qualification Details,Independent External Monitor/Remarks,Tender Value in ₹,Product Category,Sub category,Contract Type,Bid Validity(Days),Period Of Work(Days),Location,Pincode,Pre Bid Meeting Place,Pre Bid Meeting Address,Pre Bid Meeting Date,Bid Opening Place,Should Allow NDA Tender,Allow Preferential Bidder,Tender Stage
PWD,PW/CHV/Tender/24-18646-18680 dt. 23.2.24,2024_PWD_87316_1,Yes,Open Tender,Percentage,Works,2.0,No,No,Online,No,No,No,1.0,Fee/PreQual/Technical,.pdf,"Cost of Tender Documents, EMD/Bid Security.",27-Feb-2024 05:35 PM,05-Mar-2024 10:30 AM,27-Feb-2024 05:35 PM,04-Mar-2024 05:00 PM,,,27-Feb-2024 05:35 PM,04-Mar-2024 05:00 PM,12-Mar-2024 12:15 PM,"53,200",No,fixed,,Nil,Nil,1.0,Certificate Details,Permanent Account Number,Permanent Account Number Details,,1.0,ICICI BANK,"1,500",Nil,Nil,No,Er. Pawan Rana,"Executive Engineer,
Chenab Valley Division,
 HP.PWD, Udaipur","Improvement and widening of link road Mooring, Chowkhang Naingarh Km.0/0 to 14/00 SH C/o Crated R/wall at Rd.13/520 to 13/580)","Improvement  and  widening of link road Mooring, Chowkhang Naingarh Km.0/0 to 14/00 SH C/o Crated R/wall at Rd.13/520 to 13/580)",As refer to bid document,,"26,56,260",Civil Works - Roads,,Tender,90.0,90.0,Udaipur,175142.0,,,,Kullu,No,No,AOC
,,,,,,,,,,,,,,,,.pdf,Scanned copy of Registration/Enlistment with  H.P.P.W.D. Deptt. as per general rule No.23.,,,,,,,,,,,,,,,,2.0,Certificate Details,Sales Tax/VAT,Sales Tax/VAT,,2.0,ICICI NEFT/RTGS,,,,,,,,,,,,,,,,,,,,,,,,,AOC
,,,,,,,,,,,,,,,,.pdf,Scanned copy of PAN and TIN  and  Income Tax clearance certificate.,,,,,,,,,,,,,,,,3.0,Certificate Details,Bidders Address Format,Bidders Address Format Details,,,,,,,,,,,,,,,,,,,,,,,,,,,,AOC
,,,,,,,,,,,,,,,,.pdf,Scanned copy of work done certificate of similar nature of work.,,,,,,,,,,,,,,,,4.0,Certificate Details,Affidavit regarding correctness of bid,Required in tender document in bidder file 1,,,,,,,,,,,,,,,,,,,,,,,,,,,,AOC
,,,,,,,,,,,,,,,,.pdf,Scanned copy of GST as per general rule-21.,,,,,,,,,,,,,,,,5.0,Work Details,Work Completed Certificate Copies,Work Completed Certificate Copies,,,,,,,,,,,,,,,,,,,,,,,,,,,,AOC
,,,,,,,,,,,,,,,,.pdf,Any other information as bidder/firm may like to provide.,,,,,,,,,,,,,,,,,,,,,,,,,,,,,,,,,,,,,,,,,,,,,,,AOC
,,,,,,,,,,,,,,,,.pdf,Affidavit or self-certificate regarding information furnished is correct.,,,,,,,,,,,,,,,,,,,,,,,,,,,,,,,,,,,,,,,,,,,,,,,AOC
,,,,,,,,,,,,,,2.0,Finance,.pdf,Form of bid  as specified in Section-7/8,,,,,,,,,,,,,,,,,,,,,,,,,,,,,,,,,,,,,,,,,,,,,,,AOC
,,,,,,,,,,,,,,,,.xls,BOQ,,,,,,,,,,,,,,,,,,,,,,,,,,,,,,,,,,,,,,,,,,,,,,,AOC
