Publish Date,Bid Opening Date,Document Download / Sale Start Date,Document Download / Sale End Date,Clarification Start Date,Clarification End Date,Bid Submission Start Date,Bid Submission End Date,Financial Bid Opening Date,S.No,Bank Name,Cover No,Cover,Document Type,Description,EMD Amount in ₹,EMD Exemption Allowed,EMD Fee Type,EMD Percentage,EMD Payable To,EMD Payable At,Title,Work Description,Pre Qualification Details,Independent External Monitor/Remarks,Tender Value in ₹,Product Category,Sub category,Contract Type,Bid Validity(Days),Period Of Work(Days),Location,Pincode,Pre Bid Meeting Place,Pre Bid Meeting Address,Pre Bid Meeting Date,Bid Opening Place,Should Allow NDA Tender,Allow Preferential Bidder,Tender Fee in ₹,Fee Payable To,Fee Payable At,Tender Fee Exemption Allowed,Organisation Chain,Tender Reference Number,Tender ID,Withdrawal Allowed,Tender Type,Form of contract,Tender Category,No. of Covers,General Technical Evaluation Allowed,ItemWise Technical Evaluation Allowed,Payment Mode,Is Multi Currency Allowed For BOQ,Is Multi Currency Allowed For Fee,Allow Two Stage Bidding,Name,Address,Organisation Chain :,Tender ID :,Tender Ref No :,Tender Title :,Committee Chairperson/Co-ordinator Name :,Committee Chairperson/Co-ordinator Type :,Committee Members :,Updated By :,Updated On :,Financial Bid Opening Date:,Document :,Committee Chairperson/Co-ordinator Name :.1,Committee Chairperson/Co-ordinator Type :.1,Committee Members :.1,Updated By :.1,Updated on :,Document :.1,Contract Date :,Contract Value :,Work Completion Period in days :,Updated By :.2,Updated on :.1,AOC document :,AOC Description :,S.No.2,Bid Number,Bidder Name,Submitted Date,Status,Remarks,Status Updated On,Type :,Summary :,Updated By :.3,Updated On :.1,Document :.2,Type :.1,Summary :.1,Updated By :.4,Updated On :.2,Document :.3,BOQ Comparative Chart :,S.No.1,Bid Number.1,Bidder Name.1,Awarded Currency,Awarded Value
28-Aug-2023 05:00 PM,06-Sep-2023 11:30 AM,28-Aug-2023 05:30 PM,05-Sep-2023 05:00 PM,NA ,NA ,28-Aug-2023 05:30 PM,05-Sep-2023 05:00 PM,27-Sep-2023 11:00 AM,1.0,ICICI BANK,1.0,Fee/PreQual/Technical,.pdf,Cost of Tender in shape of DD,"58,500",No,fixed,,E.E.Electrical Division No-I Shimla-9,Shimla-9,Construction of Judicial Court Complex Building at Arki Tehsil Arki Distt. Solan H.P SH SITC of 100 KVA DG Set therein.,Construction of Judicial Court Complex Building at Arki Tehsil Arki Distt. Solan H.P SH SITC of 100 KVA DG Set therein.,Please refer Tender documents. ,NA ,"29,18,031",Electrical Works,NA ,Tender,90.0,365.0,SHIMLA,171009.0,NA ,NA ,NA ,SHIMLA KASUMPTI -9,No ,No,"1,500",E.E.Electrical Division No-I Shimla-9,Shimla-9,No,PWD,Electrical Division-I dated 23.08.2023,2023_PWD_78055_1,Yes,Open Tender,Percentage,Works,2.0,No,No,Both(Online/Offline),No,No,No,XEN Electrical Division No. 1 Shimla,The Executive Engineer Electrical Division No-1 HPPWD Shimla-9,PWD,2023_PWD_78055_1,Electrical Division-I dated 23.08.2023,Construction of Judicial Court Complex Building at Arki Tehsil Arki Distt. Solan H.P SH SITC of 100 KVA DG Set therein.,EXECUTIVE EINGINEER,Internal,SUPDT DAO HDM,Ravi Singh Rana,26-Sep-2023 05:21 PM,27-Sep-2023 11:00 AM,techsummary_116495.pdf (397.15 KB),EXECUTIVE ENGINEER,Internal,SUPDT DAO HDM,Ravi Singh Rana,05-Nov-2023 09:13 AM,finsummary_116495.pdf (38.59 KB),17-Jan-2024,"INR 2,042,330",365.0,Ravi Singh Rana,17-Jan-2024 04:19 PM,2023_78055.pdf (1829.00 KB),AWARDED TO L1,1.0,369832.0,Bhardwaj Electrical Co.,05-Sep-2023 01:13 PM,Rejected-AOC,L3,03-Feb-2024,Technical,Three number bids were found uploaded on e-procurement all were found in order accordingly opened for technical part today on 06.09.2023.,Ravi Singh Rana,06-Sep-2023 12:22 PM,technical_116495.pdf,Finance,Three out of three number bids were found qualified in TQC accordingly opened for financial part today on dated 27.09.2023 in which Ms Haminder Pal Contractor was found L-1,Ravi Singh Rana,27-Sep-2023 11:49 AM,finance_116495.pdf,BOQ Comparative Chart,1.0,370202.0,Haminder Pal,INR,"2,042,330"
,,,,,,,,,2.0,ICICI NEFT/RTGS,,,.pdf,EMD in shape of FDR,,,,,,,,,,,,,,,,,,,,,,,,,,,,,,,,,,,,,,,,,,,,,,,,,,,,,,,,,,,,,,,,,,,,,2.0,370202.0,Haminder Pal,05-Sep-2023 03:03 PM,Accepted-AOC,L1,03-Feb-2024,,,,,,,,,,,,,,,,
,,,,,,,,,,,,,.pdf,GST/PAN Registration,,,,,,,,,,,,,,,,,,,,,,,,,,,,,,,,,,,,,,,,,,,,,,,,,,,,,,,,,,,,,,,,,,,,,3.0,369944.0,Kalra Hardware and Electric Store,04-Sep-2023 02:43 PM,Rejected-AOC,L2,03-Feb-2024,,,,,,,,,,,,,,,,
,,,,,,,,,,,,,.pdf,TQC Technical Qualification Criteria as per Tender document,,,,,,,,,,,,,,,,,,,,,,,,,,,,,,,,,,,,,,,,,,,,,,,,,,,,,,,,,,,,,,,,,,,,,,,,,,,,,,,,,,,,,,,,,,,
,,,,,,,,,,,,,.pdf,Certificate of undertaking /Declaration by the Contractor,,,,,,,,,,,,,,,,,,,,,,,,,,,,,,,,,,,,,,,,,,,,,,,,,,,,,,,,,,,,,,,,,,,,,,,,,,,,,,,,,,,,,,,,,,,
,,,,,,,,,,,2.0,Finance,.xls,SCHEDULE of QUANTITY BOQ,,,,,,,,,,,,,,,,,,,,,,,,,,,,,,,,,,,,,,,,,,,,,,,,,,,,,,,,,,,,,,,,,,,,,,,,,,,,,,,,,,,,,,,,,,,
,,,,,,,,,,,,,.pdf,STANDARD BIDDING DOCUMENT Form-8,,,,,,,,,,,,,,,,,,,,,,,,,,,,,,,,,,,,,,,,,,,,,,,,,,,,,,,,,,,,,,,,,,,,,,,,,,,,,,,,,,,,,,,,,,,
