Organisation Chain,Tender Reference Number,Tender ID,Withdrawal Allowed,Tender Type,Form of contract,Tender Category,No. of Covers,General Technical Evaluation Allowed,ItemWise Technical Evaluation Allowed,Payment Mode,Is Multi Currency Allowed For BOQ,Is Multi Currency Allowed For Fee,Allow Two Stage Bidding,Cover No,Cover,Document Type,Description,Publish Date,Bid Opening Date,Document Download / Sale Start Date,Document Download / Sale End Date,Clarification Start Date,Clarification End Date,Bid Submission Start Date,Bid Submission End Date,Financial Bid Opening Date,EMD Amount in ₹,EMD Exemption Allowed,EMD Fee Type,EMD Percentage,EMD Payable To,EMD Payable At,S.No,Corrigendum Title,Corrigendum Type,View,S.No.1,Bank Name,Tender Fee in ₹,Fee Payable To,Fee Payable At,Tender Fee Exemption Allowed,Name,Address,Title,Work Description,Pre Qualification Details,Independent External Monitor/Remarks,Tender Value in ₹,Product Category,Sub category,Contract Type,Bid Validity(Days),Period Of Work(Days),Location,Pincode,Pre Bid Meeting Place,Pre Bid Meeting Address,Pre Bid Meeting Date,Bid Opening Place,Should Allow NDA Tender,Allow Preferential Bidder,Tender Stage
HPSEBL||MD BVPCL Jogindernagar||SE (E)||P/H Div.,BVPCL/ED-I/05 /2025-26-5,2025_HPSEB_120665_1,Yes,Open Tender,Percentage,Services,2.0,No,No,Online,No,No,No,1.0,Fee/PreQual/Technical,.pdf,copy of tender fee and earnest money,17-Nov-2025 10:00 AM,02-Dec-2025 03:30 PM,17-Nov-2025 10:00 AM,02-Dec-2025 11:00 AM,,,17-Nov-2025 10:00 AM,02-Dec-2025 11:00 AM,16-Dec-2025 12:30 PM,"1,267",No,fixed,,Nil,Nil,1.0,Corrigendum2,Date,,1.0,ICICI BANK,560.0,Nil,Nil,No,Sr.Executive Engineer,"ED-I, UhlStage-III, BVPCL, ChullahP.O-TullahTeh.-Lad Bharol, Distt.- Mandi (H.P) 175015.",Providing sweeping and cleaning services under BVPCL complex inside the power house and 132 KV Switchyard,"Providing sweeping and cleaning services under BVPCL complex inside the power house and 132 KV Switchyard under Sr. Executive Engineer, ED no. 1, Uhl stage III, BVPCL, ChullahP.O Tullah for specified period w.e.f 01.12.2025  
 to 31.03.2026)",Please refer Tender documents.,,"1,26,711",Miscellaneous Services,,Tender,90.0,,uhl stage-III HEP,175015.0,,,,chullah,No,No,AOC
,,,,,,,,,,,,,,,,.pdf,filled and duly signed copy of Bid submission form (section- V).,,,,,,,,,,,,,,,,,,,,2.0,ICICI NEFT/RTGS,,,,,,,,,,,,,,,,,,,,,,,,,AOC
,,,,,,,,,,,,,,,,.pdf,Copy GST no. and PAN card,,,,,,,,,,,,,,,,,,,,,,,,,,,,,,,,,,,,,,,,,,,,,,AOC
,,,,,,,,,,,,,,,,.pdf,Copy of current registration under EPF office and ESIC,,,,,,,,,,,,,,,,,,,,,,,,,,,,,,,,,,,,,,,,,,,,,,AOC
,,,,,,,,,,,,,,,,.pdf,certificate issued by the tenderer confirming that the bidder has visited the site,,,,,,,,,,,,,,,,,,,,,,,,,,,,,,,,,,,,,,,,,,,,,,AOC
,,,,,,,,,,,,,,,,.pdf,Self-declaration on letterhead as per Bid clause 12 (VII),,,,,,,,,,,,,,,,,,,,,,,,,,,,,,,,,,,,,,,,,,,,,,AOC
,,,,,,,,,,,,,,,,.pdf,3 years Experience of sweeping/cleaning/housekeeping services in HEPs as per bid clause 12 (VIII),,,,,,,,,,,,,,,,,,,,,,,,,,,,,,,,,,,,,,,,,,,,,,AOC
,,,,,,,,,,,,,,,,.pdf,"Copy of last three financial years (2022-23, 2023-24, 2024-25).",,,,,,,,,,,,,,,,,,,,,,,,,,,,,,,,,,,,,,,,,,,,,,AOC
,,,,,,,,,,,,,,2.0,Finance,.xls,financial bid,,,,,,,,,,,,,,,,,,,,,,,,,,,,,,,,,,,,,,,,,,,,,,AOC
