Publish Date,Bid Opening Date,Document Download / Sale Start Date,Document Download / Sale End Date,Clarification Start Date,Clarification End Date,Bid Submission Start Date,Bid Submission End Date,Financial Bid Opening Date,Title,Work Description,Pre Qualification Details,Independent External Monitor/Remarks,Tender Value in ₹,Product Category,Sub category,Contract Type,Bid Validity(Days),Period Of Work(Days),Location,Pincode,Pre Bid Meeting Place,Pre Bid Meeting Address,Pre Bid Meeting Date,Bid Opening Place,Should Allow NDA Tender,Allow Preferential Bidder,Tender Fee in ₹,Fee Payable To,Fee Payable At,Tender Fee Exemption Allowed,S.No,Instrument Type,Cover No,Cover,Document Type,Description,EMD Amount in ₹,EMD through BG/ST or EMD Exemption Allowed,EMD Fee Type,EMD Percentage,EMD Payable To,EMD Payable At,Organisation Chain,Tender Reference Number,Tender ID,Withdrawal Allowed,Tender Type,Form of contract,Tender Category,No. of Covers,General Technical Evaluation Allowed,ItemWise Technical Evaluation Allowed,Payment Mode,Is Multi Currency Allowed For BOQ,Is Multi Currency Allowed For Fee,Allow Two Stage Bidding,Name,Address,Tender Stage,Committee Chairperson/Co-ordinator Name :,Committee Chairperson/Co-ordinator Type :,Committee Members :,Updated By :,Updated on :,Document :,Type :,Summary :,Updated By :.1,Updated On :,Document :.1,BOQ Comparative Chart :,Contract Date :,Contract Value :,Work Completion Period in days :,Updated By :.2,Updated on :.1,AOC document :,AOC Description :,S.No,Bid Number,Bidder Name,Awarded Currency,Awarded Value,Committee Chairperson/Co-ordinator Name :.1,Committee Chairperson/Co-ordinator Type :.1,Committee Members :.1,Updated By :.3,Updated On :.1,Financial Bid Opening Date:,Document :.2,Type :.1,Summary :.1,Updated By :.4,Updated On :.2,Document :.3,S.No.1,Bid Number.1,Bidder Name.1,Submitted Date,Status,Remarks,Status Updated On,Organisation Chain :,Tender ID :,Tender Ref No :,Tender Title :,Tender Stage
24-Jan-2018 05:00 PM,05-Feb-2018 03:00 PM,24-Jan-2018 05:05 PM,05-Feb-2018 02:00 PM,NA ,NA ,25-Jan-2018 02:00 PM,05-Feb-2018 02:00 PM,28-Mar-2018 11:00 AM,Medical Gas Pipeline System,"Supply, Installation, Testing and Commissioning of Medical Gas Pipeline System and accessories at the first and third floor of Tezpur Medical College and Hospital TMCH Tezpur on turnkey basis",Please refer Tender documents. ,NA ,"25,47,000",Civil Works - Others,NA ,Tender,180.0,30.0,Tezpur Medical College,784010.0,NA ,NA ,NA ,Tezpur Medical College,No ,No,"2,500",Member Secretary SMET,Tezpur,Yes,1.0,DD - Demand Draft,1.0,Fee/PreQual/Technical,.pdf,Technical bid,"1,00,000",Yes,fixed,,Member Secretary SMET,Tezpur,Health and Family Welfare Department||Directorate of Medical Education-HFWD||Tezpur Medical College and Hospital-HFWD,"SMET/TMC/e-NIT/792/2017/334, dtd. 24/01/2018",2018_HFWD_5225_1,Yes,Open Tender,Turn-key,Works,2.0,No,No,Offline,No,No,No,Principal cum Chief Superintendent,Tezpur Medical College,AOC,Dr. S.K. Bordoloi,Internal,Dr ALM Ahmed Dr J Basumatary Dr S Kakati Dr T Talukdar Dr P Sarmah Dr H Deka Mr H Kalita Mr P Das,Pankaj Das,06-Jun-2018 03:02 PM,finsummary_8173.pdf (356.14 KB),Finance,Minutes of Financial Bid,Pankaj Das,06-Jun-2018 02:53 PM,finance_8173.pdf,BOQ Comparative Chart,06-Jun-2018,INR 1409692.48,30.0,Pankaj Das,06-Jun-2018 03:08 PM,aoc.pdf (329.00 KB),AOC,1.0,27944.0,JK ENGINEERING WORKS,INR,1409692.48,Dr SK Bordoloi,Internal,Dr ALM Ahmed Dr Jagadish Basumatary Dr Sanjib Kakati Dr Tapan Talukdar Dr Phanidhar Sarmah Dr Hitesh Deka Sri Hiren Kalita Sri Pranab Das,Pankaj Das,26-Mar-2018 04:48 PM,28-Mar-2018 11:00 AM,techsummary_8173.pdf (356.14 KB),Technical,Refer minutes uploaded in this regard,Pankaj Das,26-Mar-2018 04:39 PM,technical_8173.pdf,1,27744,ASB System,02-Feb-2018 04:29 PM,Not Admitted-Finance,Not qualified for AOC,06-Jun-2018 02:53 PM,Health and Family Welfare Department||Directorate of Medical Education-HFWD||Tezpur Medical College and Hospital-HFWD,2018_HFWD_5225_1,"SMET/TMC/e-NIT/792/2017/334, dtd. 24/01/2018",Medical Gas Pipeline System,AOC
,,,,,,,,,,,,,,,,,,,,,,,,,,,,,,,2.0,BC - Bankers Cheque,,,.pdf,Others Documents,,,,,,,,,,,,,,,,,,,,,,,AOC,,,,,,,,,,,,,,,,,,,,,,,,,,,,,,,,,,,,,2,27944,JK ENGINEERING WORKS,03-Feb-2018 04:50 PM,Accepted-AOC,Lowest Bidder,06-Jun-2018 03:08 PM,,,,,AOC
,,,,,,,,,,,,,,,,,,,,,,,,,,,,,,,,,2.0,Finance,.xls,BOQ,,,,,,,,,,,,,,,,,,,,,,,AOC,,,,,,,,,,,,,,,,,,,,,,,,,,,,,,,,,,,,,3,28024,MEDICAL ELEBORATE CONCEPT PVT LTD,05-Feb-2018 10:31 AM,Not Admitted-Finance,Not qualified for AOC,06-Jun-2018 02:53 PM,,,,,AOC
,,,,,,,,,,,,,,,,,,,,,,,,,,,,,,,,,,,,,,,,,,,,,,,,,,,,,,,,,,,AOC,,,,,,,,,,,,,,,,,,,,,,,,,,,,,,,,,,,,,4,27947,Medical Gases System,03-Feb-2018 03:17 PM,Not Admitted-Fee/PreQual/Technical,Not Complied with technical specification,26-Mar-2018 04:39 PM,,,,,AOC
,,,,,,,,,,,,,,,,,,,,,,,,,,,,,,,,,,,,,,,,,,,,,,,,,,,,,,,,,,,AOC,,,,,,,,,,,,,,,,,,,,,,,,,,,,,,,,,,,,,5,27355,Ovaron infrastructure and mep services,04-Feb-2018 01:58 AM,Not Admitted-Fee/PreQual/Technical,Not Complied with technical specification,26-Mar-2018 04:39 PM,,,,,AOC
