Committee Chairperson/Co-ordinator Name :,Committee Chairperson/Co-ordinator Type :,Committee Members :,Updated By :,Updated on :,Document :,Organisation Chain :,Tender ID :,Tender Ref No :,Tender Title :,Type :,Summary :,Updated By :.1,Updated On :,Document :.1,Committee Chairperson/Co-ordinator Name :.1,Committee Chairperson/Co-ordinator Type :.1,Committee Members :.1,Updated By :.2,Updated On :.1,Financial Bid Opening Date:,Document :.2,S.No,Bid Number,Bidder Name,Submitted Date,Status,Remarks,Status Updated On,Type :.1,Summary :.1,Updated By :.3,Updated On :.2,Document :.3,BOQ Comparative Chart :,Tender Stage,Name,Address,Title,Work Description,Pre Qualification Details,Independent External Monitor/Remarks,Tender Value in ₹,Product Category,Sub category,Contract Type,Bid Validity(Days),Period Of Work(Days),Location,Pincode,Pre Bid Meeting Place,Pre Bid Meeting Address,Pre Bid Meeting Date,Bid Opening Place,Should Allow NDA Tender,Allow Preferential Bidder,Publish Date,Bid Opening Date,Document Download / Sale Start Date,Document Download / Sale End Date,Clarification Start Date,Clarification End Date,Bid Submission Start Date,Bid Submission End Date,Financial Bid Opening Date,S.No,Corrigendum Title,Corrigendum Type,View,S.No.1,Bank Name,Tender Fee in ₹,Fee Payable To,Fee Payable At,Tender Fee Exemption Allowed,EMD Amount in ₹,EMD through BG/ST or EMD Exemption Allowed,EMD Fee Type,EMD Percentage,EMD Payable To,EMD Payable At,Cover No,Cover,Document Type,Description,Organisation Chain,Tender Reference Number,Tender ID,Withdrawal Allowed,Tender Type,Form of contract,Tender Category,No. of Covers,General Technical Evaluation Allowed,ItemWise Technical Evaluation Allowed,Payment Mode,Is Multi Currency Allowed For BOQ,Is Multi Currency Allowed For Fee,Allow Two Stage Bidding,Tender Stage
CE PWD (Bldg),Internal,,Mridul Talukdar,18-Jul-2022 06:24 PM,finsummary_39137.pdf (310.74 KB),Public Works Building and NH Department||Chief Engineer-Building - PWBNH,2022_PWBNH_25323_1,CE/TB-IV/31/2022/1 Dated Guwahati 25th April 2022,"Construction of New Medical College and Hospital at Golaghat District, Assam",Technical,Summary,Chandana Basumatary,14-Jun-2022 01:21 PM,technical_39137.pdf,CE PWD (Bldg),Internal,,Chandana Basumatary,20-Jun-2022 05:27 PM,20-Jun-2022 05:30 PM,techsummary_39137.pdf (75.59 KB),1.0,150131.0,Girdhari Lal Constructions Pvt Ltd,13-Jun-2022 01:27 PM,Rejected-Technical,Not-Qualified,20-Jun-2022 05:28 PM,Finance,Summary,Mridul Talukdar,20-Jun-2022 05:34 PM,finance_39137.pdf,BOQ Comparative Chart,AOC,"Spl. CE, PWD(Bldg) (H AND E) Assam, Ghy-3","O/O The CE, PWD (Bldg), Assam, Chandmari, Ghy-3","Construction of New Medical College and Hospital at Golaghat District, Assam","Construction of New Medical College and Hospital at Golaghat District, Assam",Please refer Tender documents. ,NA ,"4,49,95,00,000",Civil Works - Building,NA ,Tender,180.0,1095.0,Golaghat,785621.0,"O/O The CE, PWD (Bldg), Assam, Chandmari, Ghy-3 ","O/O The CE, PWD (Bldg), Assam, Chandmari, Ghy-3 ",12-May-2022 11:30 AM ,"O/O The CE, PWD (Bldg), Assam, Chandmari, Ghy-3",No ,No,29-Apr-2022 03:35 PM,14-Jun-2022 11:30 AM,29-Apr-2022 03:35 PM,13-Jun-2022 02:00 PM,NA ,NA ,29-Apr-2022 03:35 PM,13-Jun-2022 02:00 PM,20-Jun-2022 05:30 PM,1.0,Addendum-3,Technical Bid,,1.0,SBI Bank,"30,000",Nil,Nil,No,"8,99,90,000",Yes,fixed,,Nil,Nil,1.0,Fee/PreQual/Technical,.pdf,ONLINE PAYMENT RECEIPT (BID COST_BID SECURITY),Public Works Building and NH Department||Chief Engineer-Building - PWBNH,CE/TB-IV/31/2022/1 Dated Guwahati 25th April 2022,2022_PWBNH_25323_1,Yes,Open Tender,Item Rate,Works,2.0,No,No,Online,No,No,No,AOC
,,,,,,,,,,,,,,,,,,,,,,2.0,147465.0,Larsen and Toubro Limited,13-Jun-2022 01:45 PM,Accepted-AOC,Work Order Issued,31-Aug-2022 06:23 PM,,,,,,,AOC,,,,,,,,,,,,,,,,,,,,,,,,,,,,,,,,,,,,,,,,,,,,,,,,.pdf,BIDDING DOCUMENT,,,,,,,,,,,,,,,AOC
,,,,,,,,,,,,,,,,,,,,,,3.0,150155.0,NCC Limited,13-Jun-2022 12:39 PM,Rejected-Finance,Accepted,18-Jul-2022 06:24 PM,,,,,,,AOC,,,,,,,,,,,,,,,,,,,,,,,,,,,,,,,,,,,,,,,,,,,,,,,,.pdf,TECHNICAL QUALIFICATIONS,,,,,,,,,,,,,,,AOC
,,,,,,,,,,,,,,,,,,,,,,4.0,147064.0,SHREE GAUTAM CONSTRUCTION CO. LTD.,13-Jun-2022 12:16 PM,Rejected-Finance,Accepted,18-Jul-2022 06:24 PM,,,,,,,AOC,,,,,,,,,,,,,,,,,,,,,,,,,,,,,,,,,,,,,,,,,,,,,,2.0,Finance,.xls,BOQ,,,,,,,,,,,,,,,AOC
,,,,,,,,,,,,,,,,,,,,,,,,,,,,,,,,,,,AOC,,,,,,,,,,,,,,,,,,,,,,,,,,,,,,,,,,,,,,,,,,,,,,,,.pdf,FORM OF BID,,,,,,,,,,,,,,,AOC
