Type :,Summary :,Updated By :,Updated On :,Document :,BOQ Comparative Chart :,Type :.1,Summary :.1,Updated By :.1,Updated On :.1,Document :.1,Contract Date :,Contract Value :,Work Completion Period in days :,Updated By :.2,Updated on :,AOC document :,AOC Description :,Committee Chairperson/Co-ordinator Name :,Committee Chairperson/Co-ordinator Type :,Committee Members :,Updated By :.3,Updated On :.2,Financial Bid Opening Date:,Document :.2,S.No,Bid Number,Bidder Name,Submitted Date,Status,Remarks,Status Updated On,S.No.1,Bid Number.1,Bidder Name.1,Awarded Currency,Awarded Value,Organisation Chain :,Tender ID :,Tender Ref No :,Tender Title :,Committee Chairperson/Co-ordinator Name :.1,Committee Chairperson/Co-ordinator Type :.1,Committee Members :.1,Updated By :.4,Updated on :.1,Document :.3,Tender Stage,Tender Fee in ₹,Fee Payable To,Fee Payable At,Tender Fee Exemption Allowed,EMD Amount in ₹,EMD Exemption Allowed,EMD Fee Type,EMD Percentage,EMD Payable To,EMD Payable At,Title,Work Description,Pre Qualification Details,Independent External Monitor/Remarks,Tender Value in ₹,Product Category,Sub category,Contract Type,Bid Validity(Days),Period Of Work(Days),Location,Pincode,Pre Bid Meeting Place,Pre Bid Meeting Address,Pre Bid Meeting Date,Bid Opening Place,Should Allow NDA Tender,Allow Preferential Bidder,Organisation Chain,Tender Reference Number,Tender ID,Withdrawal Allowed,Tender Type,Form of contract,Tender Category,No. of Covers,General Technical Evaluation Allowed,ItemWise Technical Evaluation Allowed,Payment Mode,Is Multi Currency Allowed For BOQ,Is Multi Currency Allowed For Fee,Allow Two Stage Bidding,Publish Date,Bid Opening Date,Document Download / Sale Start Date,Document Download / Sale End Date,Clarification Start Date,Clarification End Date,Bid Submission Start Date,Bid Submission End Date,Financial Bid Opening Date,Name,Address,Cover No,Cover,Document Type,Description,S.No,Bank Name,Tender Stage
Finance,BOQ of all bidders downloaded and boq comparative chart generated successfully.,Rakesh Kumar,25-Jun-2022 10:45 AM,finance_93337.pdf,BOQ Comparative Chart,Technical,Two bidders have been participated in the e tender process documents of all bidders downloaded successfully.,Rakesh Kumar,24-Jun-2022 11:49 AM,technical_93337.pdf,13-Jul-2022,"INR 698,372",90.0,Rakesh Kumar,27-Aug-2022 04:56 PM,Award.pdf (3787.00 KB),The work has been awarded to M/S Om Shanti Om Drillers Village Tuhnu PO Kallar Tehsil Sadar District Bilaspur vide TO letter No. 11130-37 dt 13/7/22 for Rs. 698372 only,Er. Rakesh Kumar Vaidya Executive Engineer,Internal,"Sh Bala Ram Thakur Superintendent Gr-II,,Sh. Rakesh Kumar DHD , Sh. Yash Pal Senior Assistant, Sh Ravinder Kishore Senior Assistant",Rakesh Kumar,25-Jun-2022 10:33 AM,25-Jun-2022 10:35 AM,techsummary_93337.pdf (433.82 KB),1.0,288074.0,M/S Hari Om Drillers,23-Jun-2022 01:31 PM,Accepted-AOC,2nd lowest,27-Aug-2022 04:57 PM,1.0,288074.0,M/S Hari Om Drillers,INR,0,"HP Irrigation and Public Health||Bilaspur Circle,Irrigation and Public Health,HP||Bilaspur,Irrigation and Public Health,HP",2022_HPIPH_61837_1,BLP-BLP00-736,Link road from NH-21 Raghunathpura to Mandi Bharari Km 0/0 to 2/750 in Tehsil Sadar District Bilaspur (SH Shifting of utility hand pump at RD 0/480 and 2/510) and laying jointing and testing of GI pipe of various diameter).,Er. Rakesh Kumar Vaidya Executive Engineer,Internal,"Sh Bala Ram Thakur Superintendent Gr-II,,Sh. Rakesh Kumar DHD , Sh. Yash Pal Senior Assistant, Sh Ravinder Kishore Senior Assistant",Rakesh Kumar,25-Jun-2022 10:47 AM,finsummary_93337.pdf (83.28 KB),AOC,250.0,EE Jal Shakti Division Bilaspur,Jal Shakti Division Bilaspur,Yes,"13,900",Yes,fixed,,EE Jal Shakti Division Bilaspur,Jal Shakti Division Bilaspur,Link road from NH-21 Raghunathpura to Mandi Bharari Km 0/0 to 2/750 in Tehsil Sadar District Bilaspur (SH Shifting of utility hand pump at RD 0/480 and 2/510) and laying jointing and testing of GI pipe of various diameter).,Link road from NH-21 Raghunathpura to Mandi Bharari Km 0/0 to 2/750 in Tehsil Sadar District Bilaspur (SH Shifting of utility hand pump at RD 0/480 and 2/510) and laying jointing and testing of GI pipe of various diameter).,Please refer tender documents ,NA ,,Water Equipments/ Meter/ Drilling/ Boring,NA ,Tender,120.0,30.0,Under JSV Sub Division Bilaspur,174001.0,NA ,NA ,NA ,Jal Shakti Division Bilaspur,No ,No,"HP Irrigation and Public Health||Bilaspur Circle,Irrigation and Public Health,HP||Bilaspur,Irrigation and Public Health,HP",BLP-BLP00-736,2022_HPIPH_61837_1,Yes,Open Tender,Item Rate,Works,2.0,No,No,Both(Online/Offline),No,No,No,17-Jun-2022 05:00 PM,24-Jun-2022 11:30 AM,17-Jun-2022 05:00 PM,24-Jun-2022 11:00 AM,17-Jun-2022 05:00 PM ,23-Jun-2022 05:00 PM ,17-Jun-2022 05:00 PM,24-Jun-2022 11:00 AM,25-Jun-2022 10:35 AM,Executive Engineer,Jal Shakti Division Bilaspur,1.0,Fee/PreQual/Technical,.pdf,Cost of Tender form proof,1.0,ICICI BANK,AOC
,,,,,,,,,,,,,,,,,,,,,,,,,2.0,288080.0,Om Santi Om Drillers,23-Jun-2022 01:46 PM,Accepted-AOC,Awarded,27-Aug-2022 04:57 PM,2.0,288080.0,Om Santi Om Drillers,INR,"698,372",,,,,,,,,,,AOC,,,,,,,,,,,,,,,,,,,,,,,,,,,,,,,,,,,,,,,,,,,,,,,,,,,,,,,,.pdf,Earnest money proof scan copy of EMD of Certificate of exemption of earnest money with affidavit,2.0,ICICI NEFT/RTGS,AOC
,,,,,,,,,,,,,,,,,,,,,,,,,,,,,,,,,,,,,,,,,,,,,,,AOC,,,,,,,,,,,,,,,,,,,,,,,,,,,,,,,,,,,,,,,,,,,,,,,,,,,,,,,,.pdf,Certificate of registration with Jal Shakti Vighag in appropriate class and latest renewal thereof.,,,AOC
,,,,,,,,,,,,,,,,,,,,,,,,,,,,,,,,,,,,,,,,,,,,,,,AOC,,,,,,,,,,,,,,,,,,,,,,,,,,,,,,,,,,,,,,,,,,,,,,,,,,,,,,,,.pdf,PAN No. / GST registration.,,,AOC
,,,,,,,,,,,,,,,,,,,,,,,,,,,,,,,,,,,,,,,,,,,,,,,AOC,,,,,,,,,,,,,,,,,,,,,,,,,,,,,,,,,,,,,,,,,,,,,,,,,,,,,,,,.pdf,Scan copy of EPF No.,,,AOC
,,,,,,,,,,,,,,,,,,,,,,,,,,,,,,,,,,,,,,,,,,,,,,,AOC,,,,,,,,,,,,,,,,,,,,,,,,,,,,,,,,,,,,,,,,,,,,,,,,,,,,,,,,.pdf,The firm/ Contractor shall be registered with Central Ground Water Authority for drilling of bore we,,,AOC
,,,,,,,,,,,,,,,,,,,,,,,,,,,,,,,,,,,,,,,,,,,,,,,AOC,,,,,,,,,,,,,,,,,,,,,,,,,,,,,,,,,,,,,,,,,,,,,,,,,,,,,,2.0,Finance,.xls,BOQ,,,AOC
