Cover No,Cover,Document Type,Description,Organisation Chain,Tender Reference Number,Tender ID,Withdrawal Allowed,Tender Type,Form of contract,Tender Category,No. of Covers,General Technical Evaluation Allowed,ItemWise Technical Evaluation Allowed,Payment Mode,Is Multi Currency Allowed For BOQ,Is Multi Currency Allowed For Fee,Allow Two Stage Bidding,Tender Fee in ₹,Fee Payable To,Fee Payable At,Tender Fee Exemption Allowed,Name,Address,Publish Date,Bid Opening Date,Document Download / Sale Start Date,Document Download / Sale End Date,Clarification Start Date,Clarification End Date,Bid Submission Start Date,Bid Submission End Date,Financial Bid Opening Date,EMD Amount in ₹,EMD Exemption Allowed,EMD Fee Type,EMD Percentage,EMD Payable To,EMD Payable At,Title,Work Description,Pre Qualification Details,Independent External Monitor/Remarks,Tender Value in ₹,Product Category,Sub category,Contract Type,Bid Validity(Days),Period Of Work(Days),Location,Pincode,Pre Bid Meeting Place,Pre Bid Meeting Address,Pre Bid Meeting Date,Bid Opening Place,Should Allow NDA Tender,Allow Preferential Bidder,S.No,Bank Name,Tender Stage,Type :,Summary :,Updated By :,Updated On :,Document :,BOQ Comparative Chart :,Type :.1,Summary :.1,Updated By :.1,Updated On :.1,Document :.1,Committee Chairperson/Co-ordinator Name :,Committee Chairperson/Co-ordinator Type :,Committee Members :,Updated By :.2,Updated On :.2,Financial Bid Opening Date:,Document :.2,S.No,Bid Number,Bidder Name,Submitted Date,Status,Remarks,Status Updated On,Contract Date :,Contract Value :,Work Completion Period in days :,Updated By :.3,Updated on :,AOC document :,AOC Description :,S.No.1,Bid Number.1,Bidder Name.1,Awarded Currency,Awarded Value,Committee Chairperson/Co-ordinator Name :.1,Committee Chairperson/Co-ordinator Type :.1,Committee Members :.1,Updated By :.4,Updated on :.1,Document :.3,Organisation Chain :,Tender ID :,Tender Ref No :,Tender Title :,Tender Stage
1.0,Fee/PreQual/Technical,.pdf,Appropriate Contractor registration (as per tender condition),HP SIDC Limited,Job No. 11,2022_SIDC_62734_1,Yes,Open Tender,Item Rate,Works,2.0,No,No,Online,No,No,No,"2,200",Nil,Nil,No,Executive Engineer,HPSIDC Shimla,14-Jul-2022 11:10 AM,22-Jul-2022 11:00 AM,14-Jul-2022 11:10 AM,21-Jul-2022 05:00 PM,NA ,NA ,14-Jul-2022 11:10 AM,21-Jul-2022 05:00 PM,02-Aug-2022 12:00 PM,"37,000",No,fixed,,Nil,Nil,Construction of road near Medisys factory unit village moginand at Kala Amb Distt. Sirmour (HP).,Construction of road near Medisys factory unit village moginand at Kala Amb Distt. Sirmour (HP).,Please refer Tender documents. ,NA ,"19,36,922",Civil Works,NA ,Tender,120.0,90.0,Kala Amb,173030.0,NA ,NA ,NA ,HPSIDC Shimla,No ,No,1.0,ICICI BANK,AOC,Finance,Financial summary,Sushant Singh Negi,05-Aug-2022 10:32 AM,finance_94582.pdf,BOQ Comparative Chart,Technical,Tender summary,Sushant Singh Negi,02-Aug-2022 11:42 AM,technical_94582.pdf,SE,Internal,"DM, Manager(F), AE(HQ)",Sushant Singh Negi,02-Aug-2022 11:44 AM,02-Aug-2022 12:00 PM,techsummary_94582.pdf (402.07 KB),1.0,292267.0,ANIL KUMAR,21-Jul-2022 01:42 PM,Rejected-Finance,Second lowest bidder,05-Aug-2022 10:34 AM,13-Jan-2023,"INR 1,237,208",90.0,Sushant Singh Negi,16-Jan-2023 10:49 AM,medisys.pdf (4851.00 KB),Award letter,1.0,292090.0,HARI SINGH,INR,"1,237,208",EE,Internal,"DM, Manager(F), AE(HQ)",Sushant Singh Negi,05-Aug-2022 10:34 AM,finsummary_94582.pdf (27.21 KB),HP SIDC Limited,2022_SIDC_62734_1,Job No. 11,Construction of road near Medisys factory unit village moginand at Kala Amb Distt. Sirmour (HP).,AOC
,,.pdf,Signed copy of agreement form and approved make for materials,,,,,,,,,,,,,,,,,,,,,,,,,,,,,,,,,,,,,,,,,,,,,,,,,,,,,,2.0,ICICI NEFT/RTGS,AOC,,,,,,,,,,,,,,,,,,,2.0,292090.0,HARI SINGH,20-Jul-2022 08:27 PM,Accepted-AOC,AOC,16-Jan-2023 10:50 AM,,,,,,,,,,,,,,,,,,,,,,,AOC
,,.pdf,Affidavit that the information furnished with the bid documents is true and correct.,,,,,,,,,,,,,,,,,,,,,,,,,,,,,,,,,,,,,,,,,,,,,,,,,,,,,,,,AOC,,,,,,,,,,,,,,,,,,,,,,,,,,,,,,,,,,,,,,,,,,,,,,,,AOC
,,.pdf,Affidavit that you have not more than 2 works in hand each of Rs.100 lakh or above in any department,,,,,,,,,,,,,,,,,,,,,,,,,,,,,,,,,,,,,,,,,,,,,,,,,,,,,,,,AOC,,,,,,,,,,,,,,,,,,,,,,,,,,,,,,,,,,,,,,,,,,,,,,,,AOC
,,.pdf,Proof copy of EPF registration No.,,,,,,,,,,,,,,,,,,,,,,,,,,,,,,,,,,,,,,,,,,,,,,,,,,,,,,,,AOC,,,,,,,,,,,,,,,,,,,,,,,,,,,,,,,,,,,,,,,,,,,,,,,,AOC
,,.pdf,Proof copy of GST registration No.,,,,,,,,,,,,,,,,,,,,,,,,,,,,,,,,,,,,,,,,,,,,,,,,,,,,,,,,AOC,,,,,,,,,,,,,,,,,,,,,,,,,,,,,,,,,,,,,,,,,,,,,,,,AOC
,,.pdf,Copy of latest ITR and pan card,,,,,,,,,,,,,,,,,,,,,,,,,,,,,,,,,,,,,,,,,,,,,,,,,,,,,,,,AOC,,,,,,,,,,,,,,,,,,,,,,,,,,,,,,,,,,,,,,,,,,,,,,,,AOC
,,.pdf,Copy of receipt of EMD and cost of form,,,,,,,,,,,,,,,,,,,,,,,,,,,,,,,,,,,,,,,,,,,,,,,,,,,,,,,,AOC,,,,,,,,,,,,,,,,,,,,,,,,,,,,,,,,,,,,,,,,,,,,,,,,AOC
2.0,Finance,.xls,BOQ,,,,,,,,,,,,,,,,,,,,,,,,,,,,,,,,,,,,,,,,,,,,,,,,,,,,,,,,AOC,,,,,,,,,,,,,,,,,,,,,,,,,,,,,,,,,,,,,,,,,,,,,,,,AOC
