Organisation Chain,Tender Reference Number,Tender ID,Withdrawal Allowed,Tender Type,Form of contract,Tender Category,No. of Covers,General Technical Evaluation Allowed,ItemWise Technical Evaluation Allowed,Payment Mode,Is Multi Currency Allowed For BOQ,Is Multi Currency Allowed For Fee,Allow Two Stage Bidding,Title,Work Description,Pre Qualification Details,Independent External Monitor/Remarks,Tender Value in ₹,Product Category,Sub category,Contract Type,Bid Validity(Days),Period Of Work(Days),Location,Pincode,Pre Bid Meeting Place,Pre Bid Meeting Address,Pre Bid Meeting Date,Bid Opening Place,Should Allow NDA Tender,Allow Preferential Bidder,EMD Amount in ₹,EMD through BG/ST or EMD Exemption Allowed,EMD Fee Type,EMD Percentage,EMD Payable To,EMD Payable At,Name,Address,Cover No,Cover,Document Type,Description,S.No,Bank Name,Publish Date,Bid Opening Date,Document Download / Sale Start Date,Document Download / Sale End Date,Clarification Start Date,Clarification End Date,Bid Submission Start Date,Bid Submission End Date,Financial Bid Opening Date,Tender Fee in ₹,Fee Payable To,Fee Payable At,Tender Fee Exemption Allowed,Tender Stage,S.No,Bid Number,Bidder Name,Submitted Date,Status,Remarks,Status Updated On,Committee Chairperson/Co-ordinator Name :,Committee Chairperson/Co-ordinator Type :,Committee Members :,Updated By :,Updated On :,Financial Bid Opening Date:,Document :,Organisation Chain :,Tender ID :,Tender Ref No :,Tender Title :,Type :,Summary :,Updated By :.1,Updated On :.1,Document :.1,S.No.1,Revocation Title,Revocation Description,Published Date,Document Name,Document Size(in KB),Revocated To,Type :.1,Summary :.1,Updated By :.2,Updated On :.2,Document :.2,BOQ Comparative Chart :,Tender Stage
Directorate of Agriculture and Assam Seed Corporation,A/E/4971/APT/ADO/P-I/21-22/185,2022_DAASC_26420_14,Yes,Open Tender,Works,Works,2.0,No,No,Online,No,No,No,"Construction of office building of the ADO Office Building under APART at Panibharal, Biswanath District","Construction of office building of the ADO Office Building under APART at Panibharal, Biswanath District",Please refer tender documents ,NA ,"45,45,800",Civil Works,NA ,Tender,90.0,120.0,Biswanath,784176.0,NA ,NA ,NA ,"O/o the Chief Engineer, Agriculture",No ,No,"90,916",Yes,percentage,2.0%,Nil,Nil,Director of Agriculture,"Krishi Bhawan, Khanapara, Guwahati-22",1.0,Fee/PreQual/Technical,.pdf,Scan and signed copy of technical Documents,1.0,SBI Bank,23-Jul-2022 10:00 AM,08-Aug-2022 12:00 PM,23-Jul-2022 10:00 AM,06-Aug-2022 04:00 PM,NA ,NA ,23-Jul-2022 12:00 PM,06-Aug-2022 04:00 PM,13-Oct-2022 11:00 AM,0.0,Nil,Nil,No,AOC,1,154843,AKHIL CHANDRA CHOUDHURY,05-Aug-2022 12:10 PM,Rejected-AOC,As per DBC minutes,03-Jan-2023 12:16 PM,DoA,Internal,"DoH, Sr. FAO, MD-Seeds, PME-ARIASS etc.",NEELAKSHI BAITHURI,11-Oct-2022 03:52 PM,13-Oct-2022 11:00 AM,techsummary_40772.pdf (6679.54 KB),Directorate of Agriculture and Assam Seed Corporation,2022_DAASC_26420_14,A/E/4971/APT/ADO/P-I/21-22/185,"Construction of office building of the ADO Office Building under APART at Panibharal, Biswanath District",Technical,Technical cover is opened and processed for evaluation,NEELAKSHI BAITHURI,11-Oct-2022 03:44 PM,,1.0,Corrigenduim,Due to administrative reasons,11-Oct-2022 03:31 PM,Corrigendum_2.pdf ,652.79,Technical Opening,Finance,Financial cover is opened and processed for evaluaion,NEELAKSHI BAITHURI,13-Oct-2022 04:13 PM,,BOQ Comparative Chart,AOC
,,,,,,,,,,,,,,,,,,,,,,,,,,,,,,,,,,,,,,,,,,.pdf,Scan and signed copy of tender documents downloaded from portal,,,,,,,,,,,,,,,,AOC,2,154878,Kamakhya udyog,06-Aug-2022 12:42 PM,Rejected-Technical,As per DBC minutes and corrigendum,11-Oct-2022 03:52 PM,,,,,,,,,,,,,,,,,,,,,,,,,,,,,,AOC
,,,,,,,,,,,,,,,,,,,,,,,,,,,,,,,,,,,,,,,,2.0,Finance,.xls,BOQ,,,,,,,,,,,,,,,,AOC,3,154847,MD BAHARUL ISLAM,05-Aug-2022 02:26 AM,Rejected-AOC,As per DBC minutes,03-Jan-2023 12:16 PM,,,,,,,,,,,,,,,,,,,,,,,,,,,,,,AOC
,,,,,,,,,,,,,,,,,,,,,,,,,,,,,,,,,,,,,,,,,,,,,,,,,,,,,,,,,,,AOC,4,155210,M/S A K Traders,05-Aug-2022 05:43 PM,Accepted-AOC,As per DBC minutes,03-Jan-2023 12:16 PM,,,,,,,,,,,,,,,,,,,,,,,,,,,,,,AOC
,,,,,,,,,,,,,,,,,,,,,,,,,,,,,,,,,,,,,,,,,,,,,,,,,,,,,,,,,,,AOC,5,155398,Sri Beekey Agarwala,06-Aug-2022 02:26 PM,Rejected-AOC,As per DBC minutes,03-Jan-2023 12:16 PM,,,,,,,,,,,,,,,,,,,,,,,,,,,,,,AOC
,,,,,,,,,,,,,,,,,,,,,,,,,,,,,,,,,,,,,,,,,,,,,,,,,,,,,,,,,,,AOC,6,155120,SUSANTA KUMAR BHATTACHARYA,04-Aug-2022 09:44 PM,Rejected-AOC,As per DBC minutes,03-Jan-2023 12:16 PM,,,,,,,,,,,,,,,,,,,,,,,,,,,,,,AOC
