Name,Address,Organisation Chain,Tender Reference Number,Tender ID,Withdrawal Allowed,Tender Type,Form of contract,Tender Category,No. of Covers,General Technical Evaluation Allowed,ItemWise Technical Evaluation Allowed,Payment Mode,Is Multi Currency Allowed For BOQ,Is Multi Currency Allowed For Fee,Allow Two Stage Bidding,Tender Fee in ₹,Fee Payable To,Fee Payable At,Tender Fee Exemption Allowed,S.No,Bank Name,Cover No,Cover,Document Type,Description,Publish Date,Bid Opening Date,Document Download / Sale Start Date,Document Download / Sale End Date,Clarification Start Date,Clarification End Date,Bid Submission Start Date,Bid Submission End Date,Financial Bid Opening Date,S.No.1,Corrigendum Title,Corrigendum Type,View,EMD Amount in ₹,EMD Exemption Allowed,EMD Fee Type,EMD Percentage,EMD Payable To,EMD Payable At,Title,Work Description,Pre Qualification Details,Independent External Monitor/Remarks,Tender Value in ₹,Product Category,Sub category,Contract Type,Bid Validity(Days),Period Of Work(Days),Location,Pincode,Pre Bid Meeting Place,Pre Bid Meeting Address,Pre Bid Meeting Date,Bid Opening Place,Should Allow NDA Tender,Allow Preferential Bidder,Tender Stage,Contract Date :,Contract Value :,Work Completion Period in days :,Updated By :,Updated on :,AOC document :,AOC Description :,Type :,Summary :,Updated By :.1,Updated On :,Document :,Type :.1,Summary :.1,Updated By :.2,Updated On :.1,Document :.1,BOQ Comparative Chart :,S.No,Bid Number,Bidder Name,Submitted Date,Status,Remarks,Status Updated On,Committee Chairperson/Co-ordinator Name :,Committee Chairperson/Co-ordinator Type :,Committee Members :,Updated By :.3,Updated On :.2,Financial Bid Opening Date:,Document :.2,Committee Chairperson/Co-ordinator Name :.1,Committee Chairperson/Co-ordinator Type :.1,Committee Members :.1,Updated By :.4,Updated on :.1,Document :.3,S.No.1,Bid Number.1,Bidder Name.1,Awarded Currency,Awarded Value,Organisation Chain :,Tender ID :,Tender Ref No :,Tender Title :,Tender Stage
Addl. SE,Addl. SE Maintenance Division Shimla 4,HPSEBL||CE(Project-cum-ARB) Shimla||SE (Works)||MTC. Div. Shimla,XEN-MD-KH-DB- 23/ 2022-23,2022_HPSEB_66417_1,Yes,Open Tender,Turn-key,Works,2.0,No,No,Online,No,No,No,560.0,Nil,Nil,No,1.0,ICICI BANK,1.0,Fee/PreQual/Technical,.pdf,EMD and tender fee proof,12-Oct-2022 02:00 PM,04-Nov-2022 02:00 PM,12-Oct-2022 02:00 PM,03-Nov-2022 02:00 PM,NA ,NA ,12-Oct-2022 02:00 PM,03-Nov-2022 02:00 PM,07-Nov-2022 10:55 AM,1.0,Corrigendum Common,Date,,"7,290",No,fixed,,Nil,Nil,"A R and M O Essential Services External Vidyut Bhawan Complex, Shimla 4 and Block 8 SDA Complex Kasumpti, Shimla 9, for the year 2022 2023","A R and M O Essential Services External Vidyut Bhawan Complex, Shimla 4 and Block 8 SDA Complex Kasumpti, Shimla 9, for the year 2022 2023",Please refer Tender documents. ,NA ,"3,64,281",Civil Works - Buildings,NA ,Tender,180.0,60.0,Shimla,171004.0,NA ,NA ,NA ,Maintenance Division Shimla 4,No ,No,AOC,10-Jan-2023,"INR 447,409",60.0,Munish Sharma,10-Jan-2023 04:12 PM,awardnit23.pdf (506.00 KB),Tender has been awarded to Devender Sharma on 12.12.2022,Technical,Packet Name Fee PreQual Technical Four bidders have participated in the tender Four number bidders have submitted the required documents and their documents have been found in order Accordingly we may open the Price bid of remaining Four numbe,Munish Sharma,05-Nov-2022 03:39 PM,technical_99865.pdf,Finance,Packet Name Financial Bid Four bidders have participated in the tender Four number bidders have submitted the required documents and their documents have been found in order Accordingly the Price bid of Four number bidders has been opened today,Munish Sharma,07-Nov-2022 11:09 AM,finance_99865.pdf,BOQ Comparative Chart,1.0,310244.0,akshay construction,03-Nov-2022 12:33 PM,Rejected-AOC,L3,10-Jan-2023 04:13 PM,Er. Munish Sharma Addl SE,Internal,Er. Sachin Thakur AEE Er. SK Mehta AE,Munish Sharma,07-Nov-2022 10:51 AM,07-Nov-2022 10:55 AM,techsummary_99865.pdf (454.32 KB),Munish Sharma,Internal,Sachin Thakur SK Mehta,Munish Sharma,10-Jan-2023 04:06 PM,finsummary_99865.pdf (475.80 KB),1.0,309949.0,Devender,INR,"447,409",HPSEBL||CE(Project-cum-ARB) Shimla||SE (Works)||MTC. Div. Shimla,2022_HPSEB_66417_1,XEN-MD-KH-DB- 23/ 2022-23,"A R and M O Essential Services External Vidyut Bhawan Complex, Shimla 4 and Block 8 SDA Complex Kasumpti, Shimla 9, for the year 2022 2023",AOC
,,,,,,,,,,,,,,,,,,,,2.0,ICICI NEFT/RTGS,,,.pdf,Enlistment Certificate,,,,,,,,,,,,,,,,,,,,,,,,,,,,,,,,,,,,,,AOC,,,,,,,,,,,,,,,,,,,2.0,309574.0,DALIP SINGH VERMA,03-Nov-2022 12:19 PM,Rejected-AOC,L2,10-Jan-2023 04:13 PM,,,,,,,,,,,,,,,,,,,,,,,AOC
,,,,,,,,,,,,,,,,,,,,,,,,.pdf,GST and PAN copy,,,,,,,,,,,,,,,,,,,,,,,,,,,,,,,,,,,,,,AOC,,,,,,,,,,,,,,,,,,,3.0,309949.0,Devender,03-Nov-2022 01:58 PM,Accepted-AOC,L1,10-Jan-2023 04:13 PM,,,,,,,,,,,,,,,,,,,,,,,AOC
,,,,,,,,,,,,,,,,,,,,,,,,.pdf,Undertaking of non blacklisting on affidavit,,,,,,,,,,,,,,,,,,,,,,,,,,,,,,,,,,,,,,AOC,,,,,,,,,,,,,,,,,,,4.0,310191.0,Vanshika Enterprises,02-Nov-2022 10:16 PM,Rejected-AOC,L4,10-Jan-2023 04:13 PM,,,,,,,,,,,,,,,,,,,,,,,AOC
,,,,,,,,,,,,,,,,,,,,,,,,.pdf,Bank Details or cancelled cheque,,,,,,,,,,,,,,,,,,,,,,,,,,,,,,,,,,,,,,AOC,,,,,,,,,,,,,,,,,,,,,,,,,,,,,,,,,,,,,,,,,,,,,,,,AOC
,,,,,,,,,,,,,,,,,,,,,,2.0,Finance,.xls,BOQ,,,,,,,,,,,,,,,,,,,,,,,,,,,,,,,,,,,,,,AOC,,,,,,,,,,,,,,,,,,,,,,,,,,,,,,,,,,,,,,,,,,,,,,,,AOC
