Organisation Chain,Tender Reference Number,Tender ID,Withdrawal Allowed,Tender Type,Form of contract,Tender Category,No. of Covers,General Technical Evaluation Allowed,ItemWise Technical Evaluation Allowed,Payment Mode,Is Multi Currency Allowed For BOQ,Is Multi Currency Allowed For Fee,Allow Two Stage Bidding,Cover No,Cover,Document Type,Description,Publish Date,Bid Opening Date,Document Download / Sale Start Date,Document Download / Sale End Date,Clarification Start Date,Clarification End Date,Bid Submission Start Date,Bid Submission End Date,Financial Bid Opening Date,EMD Amount in ₹,EMD Exemption Allowed,EMD Fee Type,EMD Percentage,EMD Payable To,EMD Payable At,S.No,Bank Name,Tender Fee in ₹,Fee Payable To,Fee Payable At,Tender Fee Exemption Allowed,Name,Address,Title,Work Description,Pre Qualification Details,Independent External Monitor/Remarks,Tender Value in ₹,Product Category,Sub category,Contract Type,Bid Validity(Days),Period Of Work(Days),Location,Pincode,Pre Bid Meeting Place,Pre Bid Meeting Address,Pre Bid Meeting Date,Bid Opening Place,Should Allow NDA Tender,Allow Preferential Bidder,Tender Stage
HPSEBL||CE(OP) CZ Mandi||SE(OP) Kullu||Sr. Xen (E) Manali,HPSEBL/EDM/NIT-01/2022-23,2022_HPSEB_65181_1,Yes,Open Tender,Turn-key,Works,2.0,No,No,Online,No,No,No,1.0,Fee/PreQual/Technical,.pdf,Bidder license of A CLASS contractor from competent authority,19-Sep-2022 05:00 PM,27-Sep-2022 03:00 PM,19-Sep-2022 05:00 PM,26-Sep-2022 03:00 PM,,,19-Sep-2022 05:00 PM,26-Sep-2022 03:00 PM,28-Sep-2022 03:00 PM,"6,410",No,fixed,,Nil,Nil,1.0,ICICI BANK,590.0,Nil,Nil,No,Sr XEN ED HPSEBL MANALI,office of Sr XEN ED HPSEBL MANALI,Tender for providing SOP to The Building of APMC Kullu and Lahul Spiti at Chouribihal under ESD No I HPSEBL Manali on Turnkey Basis,Tender for providing SOP to The Building of APMC Kullu and Lahul Spiti at Chouribihal under ESD No I HPSEBL Manali on Turnkey Basis,Please refer Tender documents.,,"6,40,310",Electrical Works,,Tender,180.0,60.0,Manali aloo ground,175131.0,,,,in chamber of Sr XEN ED HPSEBL MANALI,No,No,AOC
,,,,,,,,,,,,,,,,.pdf,certificate pf performance/ experience for similar nature of work as per bid,,,,,,,,,,,,,,,,2.0,ICICI NEFT/RTGS,,,,,,,,,,,,,,,,,,,,,,,,,AOC
,,,,,,,,,,,,,,,,.pdf,Average annual turnover duly attested from CA as per bid,,,,,,,,,,,,,,,,,,,,,,,,,,,,,,,,,,,,,,,,,,AOC
,,,,,,,,,,,,,,,,.pdf,declaration regarding non blacklisted in non judicial stamp paper with notary attested as per bid,,,,,,,,,,,,,,,,,,,,,,,,,,,,,,,,,,,,,,,,,,AOC
,,,,,,,,,,,,,,,,.pdf,"certificate of GSTIN, PAN, AADHAR, ITR",,,,,,,,,,,,,,,,,,,,,,,,,,,,,,,,,,,,,,,,,,AOC
,,,,,,,,,,,,,,,,.pdf,Self undertaking regarding completion of work within scheduled time as per bid,,,,,,,,,,,,,,,,,,,,,,,,,,,,,,,,,,,,,,,,,,AOC
,,,,,,,,,,,,,,,,.pdf,self undertaking regarding that studied all term and conditions in the bid,,,,,,,,,,,,,,,,,,,,,,,,,,,,,,,,,,,,,,,,,,AOC
,,,,,,,,,,,,,,2.0,Finance,.xls,boq,,,,,,,,,,,,,,,,,,,,,,,,,,,,,,,,,,,,,,,,,,AOC
