Organisation Chain,Tender Reference Number,Tender ID,Withdrawal Allowed,Tender Type,Form of contract,Tender Category,No. of Covers,General Technical Evaluation Allowed,ItemWise Technical Evaluation Allowed,Payment Mode,Is Multi Currency Allowed For BOQ,Is Multi Currency Allowed For Fee,Allow Two Stage Bidding,Cover No,Cover,Document Type,Description,Publish Date,Bid Opening Date,Document Download / Sale Start Date,Document Download / Sale End Date,Clarification Start Date,Clarification End Date,Bid Submission Start Date,Bid Submission End Date,Financial Bid Opening Date,EMD Amount in ₹,EMD Exemption Allowed,EMD Fee Type,EMD Percentage,EMD Payable To,EMD Payable At,S.No,Bank Name,Tender Fee in ₹,Fee Payable To,Fee Payable At,Tender Fee Exemption Allowed,Name,Address,Title,Work Description,Pre Qualification Details,Independent External Monitor/Remarks,Tender Value in ₹,Product Category,Sub category,Contract Type,Bid Validity(Days),Period Of Work(Days),Location,Pincode,Pre Bid Meeting Place,Pre Bid Meeting Address,Pre Bid Meeting Date,Bid Opening Place,Should Allow NDA Tender,Allow Preferential Bidder,Tender Stage
PWD,PW-BLP1-CB-E-proc/25-18521-70 dated 04/02/26,2026_PWD_128375_2,Yes,Open Tender,Percentage,Works,2.0,No,No,Online,No,No,No,1.0,Fee/PreQual/Technical,.pdf,Online receipt of tender form cost and Earnest money as per schedule E,12-Feb-2026 02:20 PM,18-Feb-2026 11:00 AM,12-Feb-2026 02:20 PM,18-Feb-2026 10:30 AM,,,12-Feb-2026 02:20 PM,18-Feb-2026 10:30 AM,24-Feb-2026 04:50 PM,"20,100",No,fixed,,Nil,Nil,1.0,ICICI BANK,500.0,Nil,Nil,No,Executive Engineer,"Division No.1, HPPWD Bilaspur",Restoration of rain damages on Massour more to joleplakhin road.,C/O R/Wall and Hume pipe culvert.,Please refer Tender documents.,,"10,03,802",Civil Works - Roads,C/O R/Wall and Hume pipe culvert.,Tender,75.0,30.0,Bilaspur,174001.0,,,,"Division No.1, HPPWD Bilaspur",No,No,AOC
,,,,,,,,,,,,,,,,.pdf,Registration of appropriate class.,,,,,,,,,,,,,,,,2.0,ICICI NEFT/RTGS,,,,,,,,,,,,,,,,,,,,,,,,,AOC
,,,,,,,,,,,,,,,,.pdf,GST/PAN/EPF,,,,,,,,,,,,,,,,,,,,,,,,,,,,,,,,,,,,,,,,,,AOC
,,,,,,,,,,,,,,,,.pdf,"List of  required machinery, tools and plants as shown in Schedule F with reference to Clause 18",,,,,,,,,,,,,,,,,,,,,,,,,,,,,,,,,,,,,,,,,,AOC
,,,,,,,,,,,,,,,,.pdf,Affidavit of correctness/No relative working in HPPWD/No litigation with the department,,,,,,,,,,,,,,,,,,,,,,,,,,,,,,,,,,,,,,,,,,AOC
,,,,,,,,,,,,,,,,.pdf,Bidder Address.,,,,,,,,,,,,,,,,,,,,,,,,,,,,,,,,,,,,,,,,,,AOC
,,,,,,,,,,,,,,,,.pdf,Form No.8 of SBD,,,,,,,,,,,,,,,,,,,,,,,,,,,,,,,,,,,,,,,,,,AOC
,,,,,,,,,,,,,,2.0,Finance,.xls,BOQ,,,,,,,,,,,,,,,,,,,,,,,,,,,,,,,,,,,,,,,,,,AOC
