Cover No,Cover,Document Type,Description,Publish Date,Bid Opening Date,Document Download / Sale Start Date,Document Download / Sale End Date,Clarification Start Date,Clarification End Date,Bid Submission Start Date,Bid Submission End Date,Financial Bid Opening Date,Name,Address,Title,Work Description,Pre Qualification Details,Independent External Monitor/Remarks,Tender Value in ₹,Product Category,Sub category,Contract Type,Bid Validity(Days),Period Of Work(Days),Location,Pincode,Pre Bid Meeting Place,Pre Bid Meeting Address,Pre Bid Meeting Date,Bid Opening Place,Should Allow NDA Tender,Allow Preferential Bidder,Organisation Chain,Tender Reference Number,Tender ID,Withdrawal Allowed,Tender Type,Form of contract,Tender Category,No. of Covers,General Technical Evaluation Allowed,ItemWise Technical Evaluation Allowed,Payment Mode,Is Multi Currency Allowed For BOQ,Is Multi Currency Allowed For Fee,Allow Two Stage Bidding,Tender Fee in ₹,Fee Payable To,Fee Payable At,Tender Fee Exemption Allowed,S.No,Instrument Type,EMD Amount in ₹,EMD Exemption Allowed,EMD Fee Type,EMD Percentage,EMD Payable To,EMD Payable At,Tender Stage,Committee Chairperson/Co-ordinator Name :,Committee Chairperson/Co-ordinator Type :,Committee Members :,Updated By :,Updated on :,Document :,S.No,Bid Number,Bidder Name,Awarded Currency,Awarded Value,Organisation Chain :,Tender ID :,Tender Ref No :,Tender Title :,Type :,Summary :,Updated By :.1,Updated On :,Document :.1,BOQ Comparative Chart :,Type :.1,Summary :.1,Updated By :.2,Updated On :.1,Document :.2,Contract Date :,Contract Value :,Work Completion Period in days :,Updated By :.3,Updated on :.1,AOC document :,AOC Description :,Committee Chairperson/Co-ordinator Name :.1,Committee Chairperson/Co-ordinator Type :.1,Committee Members :.1,Updated By :.4,Updated On :.2,Financial Bid Opening Date:,Document :.3,S.No.1,Bid Number.1,Bidder Name.1,Submitted Date,Status,Remarks,Status Updated On,Tender Stage
1.0,Fee/PreQual/Technical,.pdf,copy of enlistment as per NIT condition 11 i,19-May-2021 06:00 PM,02-Jun-2021 12:30 PM,19-May-2021 06:00 PM,02-Jun-2021 11:00 AM,NA ,NA ,19-May-2021 06:00 PM,02-Jun-2021 11:00 AM,08-Jun-2021 04:00 PM,Executive Engineer,Jal Shakti Division Amb,Repair and Renovation of existing source of LWSS Dhureen by construction of infiltration gallery in Khad Tehsil Amb Distt. Una HP.Repair and Renovation of existing source of LWSS Dhureen by construction of infiltration gallery in Khad Tehsil Amb Dist,Repair and Renovation of existing source of LWSS Dhureen by construction of infiltration gallery in Khad Tehsil Amb Distt. Una HP.,Please refer Tender documents. ,NA ,,Civil Works,NA ,Tender,120.0,60.0,Amb,177203.0,NA ,NA ,NA ,Amb,No ,No,"HP Irrigation and Public Health||Una Circle,Irrigation and Public Health,HP||Jal Shakti Division, Amb",EEJSVAmb LWSS Dhureen gallery,2021_HPIPH_47545_1,Yes,Open Tender,Item Rate,Works,2.0,No,No,Offline,No,No,No,400.0,EE JSD Amb,Amb,No,1.0,DD - Demand Draft,"24,857",Yes,fixed,,EE JSD Amb,Amb,AOC,ER HOSHIAR SINGH EE,Internal,"Sh. Dinesh Kumar DAO Gr.I , Smt. Devinder Kaur Supdt.Gr.II Sh. Raj Kumar HDM",Hoshiar Singh,24-Jun-2022 02:51 PM,finsummary_71378.pdf (192.13 KB),1.0,214433.0,Naveen Kumar,INR,"961,493","HP Irrigation and Public Health||Una Circle,Irrigation and Public Health,HP||Jal Shakti Division, Amb",2021_HPIPH_47545_1,EEJSVAmb LWSS Dhureen gallery,Repair and Renovation of existing source of LWSS Dhureen by construction of infiltration gallery in Khad Tehsil Amb Distt. Una HP.Repair and Renovation of existing source of LWSS Dhureen by construction of infiltration gallery in Khad Tehsil Amb Dist,Finance,Summary of cover-II,Hoshiar Singh,14-Jun-2021 05:41 PM,finance_71378.pdf,BOQ Comparative Chart,Technical,summary of cover-I,Hoshiar Singh,08-Jun-2021 03:54 PM,technical_71378.pdf,24-Jun-2022,"INR 961,493",90.0,Hoshiar Singh,24-Jun-2022 03:01 PM,award.pdf (2132.00 KB),Award letter,Er. Hoshiar Singh Executive Engineer JS Division Amb,Internal,"Sh. Mohinder Paul, Sr.DAO , Sh. Subhash Chand, DHD and Smt. Devinder Kaur , Superintendent Gr. II, Jal Shakti Divisional Amb",Hoshiar Singh,08-Jun-2021 03:57 PM,08-Jun-2021 04:00 PM,techsummary_71378.pdf (1277.75 KB),1,214436,karan bedi,01-Jun-2021 03:59 PM,Rejected-Finance,Due to L7,24-Jun-2022 02:51 PM,AOC
,,.pdf,"Tender cost and earnest money as per NIT condition 11 ii , iii",,,,,,,,,,,,,,,,,,,,,,,,,,,,,,,,,,,,,,,,,,,,,,,,2.0,FDR - Fixed Deposit,,,,,,,AOC,,,,,,,,,,,,,,,,,,,,,,,,,,,,,,,,,,,,,,,,,2,214433,Naveen Kumar,01-Jun-2021 01:00 PM,Accepted-AOC,Due to L1,24-Jun-2022 03:01 PM,AOC
,,.pdf,"Copy of I/Tax, GST No and its clearance cert. PAN No and EPF regis. as per NIT cond. 11 V",,,,,,,,,,,,,,,,,,,,,,,,,,,,,,,,,,,,,,,,,,,,,,,,,,,,,,,,AOC,,,,,,,,,,,,,,,,,,,,,,,,,,,,,,,,,,,,,,,,,3,214419,Om Parkash Govt Contrator,01-Jun-2021 12:48 PM,Rejected-Finance,Due to L3,24-Jun-2022 02:51 PM,AOC
,,.pdf,Copy of an affidavit as per NIT condition 11 vi,,,,,,,,,,,,,,,,,,,,,,,,,,,,,,,,,,,,,,,,,,,,,,,,,,,,,,,,AOC,,,,,,,,,,,,,,,,,,,,,,,,,,,,,,,,,,,,,,,,,4,214252,Pawan Kumar Sharma Govt Contractor,30-May-2021 02:56 PM,Rejected-Finance,Due to L4,24-Jun-2022 02:51 PM,AOC
,,.pdf,copy of work done as per NIT condition 11 x,,,,,,,,,,,,,,,,,,,,,,,,,,,,,,,,,,,,,,,,,,,,,,,,,,,,,,,,AOC,,,,,,,,,,,,,,,,,,,,,,,,,,,,,,,,,,,,,,,,,5,214479,RAMAN KUMAR,01-Jun-2021 04:45 PM,Rejected-Technical,Due to not fullfils the eligibility of NIeT,08-Jun-2021 03:57 PM,AOC
2.0,Finance,.pdf,form 6 and 8,,,,,,,,,,,,,,,,,,,,,,,,,,,,,,,,,,,,,,,,,,,,,,,,,,,,,,,,AOC,,,,,,,,,,,,,,,,,,,,,,,,,,,,,,,,,,,,,,,,,6,214242,SG Engineers and Consultants,30-May-2021 12:45 PM,Rejected-Finance,Due to L2,24-Jun-2022 02:51 PM,AOC
,,.pdf,terms and conditions,,,,,,,,,,,,,,,,,,,,,,,,,,,,,,,,,,,,,,,,,,,,,,,,,,,,,,,,AOC,,,,,,,,,,,,,,,,,,,,,,,,,,,,,,,,,,,,,,,,,7,214541,SHIV KANT PRASHAR,02-Jun-2021 10:45 AM,Rejected-Finance,Due to L6,24-Jun-2022 02:51 PM,AOC
,,.xls,scheduled of quantities,,,,,,,,,,,,,,,,,,,,,,,,,,,,,,,,,,,,,,,,,,,,,,,,,,,,,,,,AOC,,,,,,,,,,,,,,,,,,,,,,,,,,,,,,,,,,,,,,,,,8,214259,VARINDER PAL,01-Jun-2021 05:19 PM,Rejected-Finance,Due to L5,24-Jun-2022 02:51 PM,AOC
