EMD Amount in ₹,EMD Exemption Allowed,EMD Fee Type,EMD Percentage,EMD Payable To,EMD Payable At,Title,Work Description,Pre Qualification Details,Independent External Monitor/Remarks,Tender Value in ₹,Product Category,Sub category,Contract Type,Bid Validity(Days),Period Of Work(Days),Location,Pincode,Pre Bid Meeting Place,Pre Bid Meeting Address,Pre Bid Meeting Date,Bid Opening Place,Should Allow NDA Tender,Allow Preferential Bidder,Tender Fee in ₹,Fee Payable To,Fee Payable At,Tender Fee Exemption Allowed,Organisation Chain,Tender Reference Number,Tender ID,Withdrawal Allowed,Tender Type,Form of contract,Tender Category,No. of Covers,General Technical Evaluation Allowed,ItemWise Technical Evaluation Allowed,Payment Mode,Is Multi Currency Allowed For BOQ,Is Multi Currency Allowed For Fee,Allow Two Stage Bidding,Cover No,Cover,Document Type,Description,Name,Address,S.No,Instrument Type,Publish Date,Bid Opening Date,Document Download / Sale Start Date,Document Download / Sale End Date,Clarification Start Date,Clarification End Date,Bid Submission Start Date,Bid Submission End Date,Financial Bid Opening Date,Committee Chairperson/Co-ordinator Name :,Committee Chairperson/Co-ordinator Type :,Committee Members :,Updated By :,Updated on :,Document :,Organisation Chain :,Tender ID :,Tender Ref No :,Tender Title :,S.No.2,Bid Number,Bidder Name,Awarded Currency,Awarded Value,Committee Chairperson/Co-ordinator Name :.1,Committee Chairperson/Co-ordinator Type :.1,Committee Members :.1,Updated By :.1,Updated On :,Financial Bid Opening Date:,Document :.1,S.No.1,Bid Number.1,Bidder Name.1,Submitted Date,Status,Remarks,Status Updated On,Contract Date :,Contract Value :,Work Completion Period in days :,Updated By :.2,Updated on :.1,AOC document :,AOC Description :,Type :,Summary :,Updated By :.3,Updated On :.1,Document :.2,BOQ Comparative Chart :,Type :.1,Summary :.1,Updated By :.4,Updated On :.2,Document :.3
"56,500",No,fixed,,Executive Engineer,Shimla,Construction Panchayat Community Centre Panchayat Ghar in Gram Panchayat Poshna Block NirmandDistt Kullu,As per DNIT,Please refer Tender documents. ,NA ,"32,59,656",Civil Works - Buildings,NA ,Tender,90.0,365.0,Poshna Nirmand,171009.0,NA ,NA ,NA ,Shimla Kasumpti,No ,No,"1,500",Executive Engineer,Shimla,No,Directorate Rural Development and Panchayati Ra,Poshna Nirmand,2022_DRDPR_57688_1,Yes,Open Tender,Item Rate,Works,2.0,No,No,Offline,No,No,No,1.0,Fee/PreQual/Technical,.pdf,EMD and tender fee,e,SDA Complex block No 27 Kasumpti,1.0,DD - Demand Draft,10-Mar-2022 11:00 AM,22-Mar-2022 12:00 PM,10-Mar-2022 11:00 AM,21-Mar-2022 05:00 PM,NA ,NA ,10-Mar-2022 11:00 AM,21-Mar-2022 05:00 PM,23-Mar-2022 10:00 AM,Executive Engineer,Internal,Members,Rajesh Chandel,04-Jun-2022 12:49 PM,finsummary_87076.pdf (466.90 KB),Directorate Rural Development and Panchayati Ra,2022_DRDPR_57688_1,Poshna Nirmand,Construction Panchayat Community Centre Panchayat Ghar in Gram Panchayat Poshna Block NirmandDistt Kullu,1.0,271082.0,Smt. Karan Vijay,INR,"3,100,628",Executive Engineer,Internal,Members,Rajesh Chandel,22-Mar-2022 03:45 PM,23-Mar-2022 10:00 AM,techsummary_87076.pdf (459.69 KB),1,271436,Arush Sharma,21-Mar-2022 03:02 PM,Rejected-AOC,L3,16-Jun-2023,05-Jun-2022,"INR 3,259,656",365.0,Rajesh Chandel,16-Jun-2023 04:19 PM,2022_DRDPR_57688_1.pdf (14430.00 KB),AOC,Finance,BOS,Rajesh Chandel,23-Mar-2022 11:30 AM,finance_87076.pdf,BOQ Comparative Chart,Technical,BOS,Rajesh Chandel,22-Mar-2022 03:42 PM,technical_87076.pdf
,,,,,,,,,,,,,,,,,,,,,,,,,,,,,,,,,,,,,,,,,,,,.pdf,GST registration EPF no and PAN no. Contractor registration,,,2.0,FDR - Fixed Deposit,,,,,,,,,,,,,,,,,,,,,,,,,,,,,,,,2,271339,BHOLA DUTT,21-Mar-2022 11:21 AM,Rejected-AOC,L5,16-Jun-2023,,,,,,,,,,,,,,,,,,
,,,,,,,,,,,,,,,,,,,,,,,,,,,,,,,,,,,,,,,,,,,,.pdf,List of machinery tool and plant,,,,,,,,,,,,,,,,,,,,,,,,,,,,,,,,,,,,3,271527,M/s MAST RAM,21-Mar-2022 04:48 PM,Rejected-AOC,L4,16-Jun-2023,,,,,,,,,,,,,,,,,,
,,,,,,,,,,,,,,,,,,,,,,,,,,,,,,,,,,,,,,,,,,,,.pdf,Affidavit not more than two works in hand of this department,,,,,,,,,,,,,,,,,,,,,,,,,,,,,,,,,,,,4,271433,PARVEEN KUMAR,21-Mar-2022 04:45 PM,Rejected-AOC,L2,16-Jun-2023,,,,,,,,,,,,,,,,,,
,,,,,,,,,,,,,,,,,,,,,,,,,,,,,,,,,,,,,,,,,,2.0,Finance,.xls,BOQ,,,,,,,,,,,,,,,,,,,,,,,,,,,,,,,,,,,,5,271082,Smt. Karan Vijay,21-Mar-2022 04:12 PM,Accepted-AOC,L1,16-Jun-2023,,,,,,,,,,,,,,,,,,
