Cover No,Cover,Document Type,Description,Name,Address,Publish Date,Bid Opening Date,Document Download / Sale Start Date,Document Download / Sale End Date,Clarification Start Date,Clarification End Date,Bid Submission Start Date,Bid Submission End Date,Financial Bid Opening Date,S.No,Corrigendum Title,Corrigendum Type,View,EMD Amount in ₹,EMD through BG/ST or EMD Exemption Allowed,EMD Fee Type,EMD Percentage,EMD Payable To,EMD Payable At,Title,Work Description,Pre Qualification Details,Independent External Monitor/Remarks,Tender Value in ₹,Product Category,Sub category,Contract Type,Bid Validity(Days),Period Of Work(Days),Location,Pincode,Pre Bid Meeting Place,Pre Bid Meeting Address,Pre Bid Meeting Date,Bid Opening Place,Should Allow NDA Tender,Allow Preferential Bidder,S.No.1,Instrument Type,Tender Fee in ₹,Fee Payable To,Fee Payable At,Tender Fee Exemption Allowed,Organisation Chain,Tender Reference Number,Tender ID,Withdrawal Allowed,Tender Type,Form of contract,Tender Category,No. of Covers,General Technical Evaluation Allowed,ItemWise Technical Evaluation Allowed,Payment Mode,Is Multi Currency Allowed For BOQ,Is Multi Currency Allowed For Fee,Allow Two Stage Bidding,Tender Stage,Committee Chairperson/Co-ordinator Name :,Committee Chairperson/Co-ordinator Type :,Committee Members :,Updated By :,Updated on :,Document :,Type :,Summary :,Updated By :.1,Updated On :,Document :.1,S.No,Bid Number,Bidder Name,Awarded Currency,Awarded Value,Type :.1,Summary :.1,Updated By :.2,Updated On :.1,Document :.2,BOQ Comparative Chart :,S.No.1,Bid Number.1,Bidder Name.1,Submitted Date,Status,Remarks,Status Updated On,Committee Chairperson/Co-ordinator Name :.1,Committee Chairperson/Co-ordinator Type :.1,Committee Members :.1,Updated By :.3,Updated On :.2,Financial Bid Opening Date:,Document :.3,Contract Date :,Contract Value :,Work Completion Period in days :,Updated By :.4,Updated on :.1,AOC document :,AOC Description :,Organisation Chain :,Tender ID :,Tender Ref No :,Tender Title :,Tender Stage
1.0,Fee/PreQual/Technical,.pdf,Cost and EMD,"Executive Officer, Bongaigaon Municipality","O/o the Executive Officer, Bongaigaon Municipality, Bongaigaon",03-Feb-2022 03:00 PM,17-Feb-2022 03:30 PM,03-Feb-2022 03:00 PM,17-Feb-2022 03:00 PM,03-Feb-2022 03:00 PM ,17-Feb-2022 03:00 PM ,03-Feb-2022 03:00 PM,17-Feb-2022 03:00 PM,27-Apr-2022 05:30 PM,1.0,Corrigendum,Technical Bid,,"1,23,160",Yes,percentage,2.0%,Bongaigaon Municipality,Bongaigaon,Construction of Market Complex at Swahid Bedi,Construction of Market Complex at Swahid Bedi,Please refer Tender documents. ,NA ,"61,58,000",Civil Works,NA ,Tender,180.0,365.0,Bongaigaon,783380.0,NA ,NA ,NA ,"O/o the Executive Officer, Bongaigaon Municipality",No ,No,1.0,BG - Bank Guarantee Irrevocable,"1,800",Bongaigaon Municipality,Bongaigaon,Yes,Urban Development Department||Directorate of Municipality Administration - UDD||Bongaigaon Municipal Board,BMB/01/2022,2022_UDD_24200_1,Yes,Open Tender,Works,Works,2.0,No,No,Offline,No,No,No,AOC,BHASKAR DAS,Internal,"BHARGAB KALITA, BIDYUT BIKASH PATHAK, AMINUL ISLAM, HITENDRA NATJ MEDHI",AJIT CHOUDHURY,01-Jun-2022 06:37 PM,finsummary_37148.pdf (863.46 KB),Technical,Technical Bid Opened,Bhargab Kalita,25-Apr-2022 03:59 PM,,1.0,133002.0,PARTHA PRATIM MAZUMDAR,INR,5542200.0,Finance,Financial Bid Opened.,AJIT CHOUDHURY,27-Apr-2022 06:11 PM,,BOQ Comparative Chart,1,132930,MANOJ KUMAR ROY,16-Feb-2022 07:36 PM,Rejected-Finance,JUSTIFICATION REPORT SUBMITTED,01-Jun-2022 06:37 PM,Bhaskar Das,Internal,"BHARGAB KALITA, DIPEN MEDHI, BIDYUT BIKASH PATHAK, AMINUL ISLAM",Bhargab Kalita,27-Apr-2022 05:25 PM,27-Apr-2022 05:30 PM,techsummary_37148.pdf (858.98 KB),01-Jun-2022,INR 5542200.0,180.0,AJIT CHOUDHURY,01-Jun-2022 06:44 PM,ParthaPratim.pdf (328.00 KB),Lowest Bidder with justification of rates.,Urban Development Department||Directorate of Municipality Administration - UDD||Bongaigaon Municipal Board,2022_UDD_24200_1,BMB/01/2022,Construction of Market Complex at Swahid Bedi,AOC
,,.pdf,Tech Qualification,,,,,,,,,,,,,,,,,,,,,,,,,,,,,,,,,,,,,,,,,,,,,,,,,,,,,,,,,,,,AOC,,,,,,,,,,,,,,,,,,,,,,,2,133002,PARTHA PRATIM MAZUMDAR,17-Feb-2022 12:20 PM,Accepted-AOC,Lowest Bidder with justification of rates.,01-Jun-2022 06:44 PM,,,,,,,,,,,,,,,,,,,AOC
,,.pdf,SBD,,,,,,,,,,,,,,,,,,,,,,,,,,,,,,,,,,,,,,,,,,,,,,,,,,,,,,,,,,,,AOC,,,,,,,,,,,,,,,,,,,,,,,3,132873,RABIN CHANDRA SARKAR,15-Feb-2022 04:03 PM,Rejected-Finance,JUSTIFICATION REPORT SUBMITTED,01-Jun-2022 06:37 PM,,,,,,,,,,,,,,,,,,,AOC
2.0,Finance,.xls,BOQ,,,,,,,,,,,,,,,,,,,,,,,,,,,,,,,,,,,,,,,,,,,,,,,,,,,,,,,,,,,,AOC,,,,,,,,,,,,,,,,,,,,,,,4,133004,SINGO ENGINEERING INDIA PRIVATE LIMITED,17-Feb-2022 12:41 PM,Rejected-Technical,Bongaigaon Municipality Registration not submitted,27-Apr-2022 05:25 PM,,,,,,,,,,,,,,,,,,,AOC
,,.pdf,FOB,,,,,,,,,,,,,,,,,,,,,,,,,,,,,,,,,,,,,,,,,,,,,,,,,,,,,,,,,,,,AOC,,,,,,,,,,,,,,,,,,,,,,,5,132885,Sri Bipul Choudhury,17-Feb-2022 10:58 AM,Rejected-Finance,JUSTIFICATION REPORT NOT SUBMITTED,01-Jun-2022 06:37 PM,,,,,,,,,,,,,,,,,,,AOC
,,,,,,,,,,,,,,,,,,,,,,,,,,,,,,,,,,,,,,,,,,,,,,,,,,,,,,,,,,,,,,,AOC,,,,,,,,,,,,,,,,,,,,,,,6,132992,Sri Kamal Bihari Das,17-Feb-2022 12:01 PM,Rejected-Technical,Work experience in similar nature not found,27-Apr-2022 05:25 PM,,,,,,,,,,,,,,,,,,,AOC
