Cover No,Cover,Document Type,Description,Publish Date,Bid Opening Date,Document Download / Sale Start Date,Document Download / Sale End Date,Clarification Start Date,Clarification End Date,Bid Submission Start Date,Bid Submission End Date,Financial Bid Opening Date,S.No,Corrigendum Title,Corrigendum Type,View,EMD Amount in ₹,EMD through BG/ST or EMD Exemption Allowed,EMD Fee Type,EMD Percentage,EMD Payable To,EMD Payable At,Title,Work Description,Pre Qualification Details,Independent External Monitor/Remarks,Tender Value in ₹,Product Category,Sub category,Contract Type,Bid Validity(Days),Period Of Work(Days),Location,Pincode,Pre Bid Meeting Place,Pre Bid Meeting Address,Pre Bid Meeting Date,Bid Opening Place,Should Allow NDA Tender,Allow Preferential Bidder,Name,Address,Tender Fee in ₹,Fee Payable To,Fee Payable At,Tender Fee Exemption Allowed,Organisation Chain,Tender Reference Number,Tender ID,Withdrawal Allowed,Tender Type,Form of contract,Tender Category,No. of Covers,General Technical Evaluation Allowed,ItemWise Technical Evaluation Allowed,Payment Mode,Is Multi Currency Allowed For BOQ,Is Multi Currency Allowed For Fee,Allow Two Stage Bidding,S.No.1,Instrument Type,Tender Stage,Committee Chairperson/Co-ordinator Name :,Committee Chairperson/Co-ordinator Type :,Committee Members :,Updated By :,Updated on :,Document :,Organisation Chain :,Tender ID :,Tender Ref No :,Tender Title :,Committee Chairperson/Co-ordinator Name :.1,Committee Chairperson/Co-ordinator Type :.1,Committee Members :.1,Updated By :.1,Updated On :,Financial Bid Opening Date:,Document :.1,S.No,Bid Number,Bidder Name,Submitted Date,Status,Remarks,Status Updated On,Contract Date :,Contract Value :,Work Completion Period in days :,Updated By :.2,Updated on :.1,AOC document :,AOC Description :,Type :,Summary :,Updated By :.3,Updated On :.1,Document :.2,S.No.1,Bid Number.1,Bidder Name.1,Awarded Currency,Awarded Value,Type :.1,Summary :.1,Updated By :.4,Updated On :.2,Document :.3,BOQ Comparative Chart :,Tender Stage
1.0,Fee/PreQual/Technical,.pdf,fees and prequalification,24-Apr-2020 09:00 AM,24-Jul-2020 03:00 PM,24-Apr-2020 09:00 AM,24-Jul-2020 02:00 PM,NA ,NA ,27-May-2020 02:00 PM,24-Jul-2020 02:00 PM,31-Mar-2021 12:00 PM,1.0,Corrigendum cum Extension of Bid Submission Date,Date,,"2,00,000",No,fixed,,Director of Medical Education Assam,"SBI, Dispur, Guwahati",supply Equipment and instrument for the Department of ENT for all Medical College Hospitals of Assam,supply Equipment and instrument for the Department of ENT for all Medical College Hospitals of Assam,Please refer Tender documents. ,NA ,,Medical Equipments/Waste,NA ,Rate Contract,365.0,25.0,Medical College Hospitals of Assam,781022.0,"DME Assam, Sixmile, Khanapara, Guwahati-22 ","DME Assam, Sixmile, Khanapara, Guwahati-22 ",27-May-2020 11:00 AM ,"DME Assam, Sixmile, Khanapara, Guwahati-22",No ,No,"DME Assam, Sixmile, Khanapara, Guwahati-22","DME Assam, Sixmile, Khanapara, Guwahati-22","5,000",Director of Medical Education Assam,"SBI, Dispur, Guwahati",No,Health and Family Welfare Department||Directorate of Medical Education-HFWD,DME/ENT/ 132/2019/5067 dt 20/04/2020,2020_HFWD_17359_1,Yes,Open Tender,Item Rate,Goods,2.0,No,No,Offline,No,No,No,1.0,DD - Demand Draft,AOC,Director of Medical Education Assam,Internal,,Bhupen Chandra Sarma,05-Apr-2022 03:48 PM,finsummary_26576.pdf (350.75 KB),Health and Family Welfare Department||Directorate of Medical Education-HFWD,2020_HFWD_17359_1,DME/ENT/ 132/2019/5067 dt 20/04/2020,supply Equipment and instrument for the Department of ENT for all Medical College Hospitals of Assam,Dr. Kalpana Sharma,Internal,,Bhupen Chandra Sarma,06-Mar-2021 12:12 PM,31-Mar-2021 12:00 PM,techsummary_26576.pdf (1627.24 KB),1,81931,HELIOS MEDICAL SYSTEMS,15-Jun-2020 01:42 PM,Accepted-AOC,Accepted,10-Jun-2022 11:54 AM,08-Jun-2022,INR 1086870.4,25.0,Horgobinda Nath,10-Jun-2022 11:54 AM,ENT.pdf (986.00 KB),Approved Rate list,Technical,Minutes of the Bid opening Committee meeting,Bhupen Chandra Sarma,10-Aug-2020 11:52 AM,technical_26576.pdf,1.0,81931.0,HELIOS MEDICAL SYSTEMS,INR,1086870.4,Finance,Accepted for financial evaluation,Bhupen Chandra Sarma,05-Apr-2022 03:39 PM,,BOQ Comparative Chart,AOC
,,.pdf,technical offer,,,,,,,,,,2.0,Notice to prospective bidders,Other,,,,,,,,,,,,,,,,,,,,,,,,,,,,,,,,,,,,,,,,,,,,,,2.0,BC - Bankers Cheque,AOC,,,,,,,,,,,,,,,,,,2,82158,India Medtronic Pvt Ltd,29-Jun-2020 01:00 PM,Rejected-Finance,to be re-tendered,05-Apr-2022 03:48 PM,,,,,,,,,,,,,,,,,,,,,,,,AOC
2.0,Finance,.xls,BOQ,,,,,,,,,,3.0,Corrigendum Notice regarding Specification,Technical Bid,,,,,,,,,,,,,,,,,,,,,,,,,,,,,,,,,,,,,,,,,,,,,,3.0,BG - Bank Guarantee Irrevocable,AOC,,,,,,,,,,,,,,,,,,3,84348,ITAS G. PHARMA,23-Jul-2020 07:00 PM,Rejected-Technical,As per Technical Committee meeting,06-Mar-2021 12:12 PM,,,,,,,,,,,,,,,,,,,,,,,,AOC
,,.pdf,Suppl. BOQ,,,,,,,,,,,,,,,,,,,,,,,,,,,,,,,,,,,,,,,,,,,,,,,,,,,,,,,,,,4.0,FDR - Fixed Deposit Receipt,AOC,,,,,,,,,,,,,,,,,,4,84392,M B Traders,15-Jul-2020 05:51 PM,Not Admitted-Finance,Not qualified for AOC,05-Apr-2022 03:39 PM,,,,,,,,,,,,,,,,,,,,,,,,AOC
,,,,,,,,,,,,,,,,,,,,,,,,,,,,,,,,,,,,,,,,,,,,,,,,,,,,,,,,,,,,,,,AOC,,,,,,,,,,,,,,,,,,5,84339,NJD TRADERS,27-Jun-2020 03:00 PM,Rejected-Technical,As per Technical Committee meeting,06-Mar-2021 12:12 PM,,,,,,,,,,,,,,,,,,,,,,,,AOC
,,,,,,,,,,,,,,,,,,,,,,,,,,,,,,,,,,,,,,,,,,,,,,,,,,,,,,,,,,,,,,,AOC,,,,,,,,,,,,,,,,,,6,83716,Vikas Medical Devices,21-Jun-2020 04:40 PM,Rejected-AOC,L2,10-Jun-2022 11:54 AM,,,,,,,,,,,,,,,,,,,,,,,,AOC
