EMD Amount in ₹,EMD Exemption Allowed,EMD Fee Type,EMD Percentage,EMD Payable To,EMD Payable At,S.No,Bank Name,Cover No,Cover,Document Type,Description,Name,Address,Organisation Chain,Tender Reference Number,Tender ID,Withdrawal Allowed,Tender Type,Form of contract,Tender Category,No. of Covers,General Technical Evaluation Allowed,ItemWise Technical Evaluation Allowed,Payment Mode,Is Multi Currency Allowed For BOQ,Is Multi Currency Allowed For Fee,Allow Two Stage Bidding,Tender Fee in ₹,Fee Payable To,Fee Payable At,Tender Fee Exemption Allowed,Title,Work Description,Pre Qualification Details,Independent External Monitor/Remarks,Tender Value in ₹,Product Category,Sub category,Contract Type,Bid Validity(Days),Period Of Work(Days),Location,Pincode,Pre Bid Meeting Place,Pre Bid Meeting Address,Pre Bid Meeting Date,Bid Opening Place,Should Allow NDA Tender,Allow Preferential Bidder,Publish Date,Bid Opening Date,Document Download / Sale Start Date,Document Download / Sale End Date,Clarification Start Date,Clarification End Date,Bid Submission Start Date,Bid Submission End Date,Financial Bid Opening Date,Tender Stage,Committee Chairperson/Co-ordinator Name :,Committee Chairperson/Co-ordinator Type :,Committee Members :,Updated By :,Updated On :,Financial Bid Opening Date:,Document :,S.No,Bid Number,Bidder Name,Submitted Date,Status,Remarks,Status Updated On,Type :,Summary :,Updated By :.1,Updated On :.1,Document :.1,BOQ Comparative Chart :,Type :.1,Summary :.1,Updated By :.2,Updated On :.2,Document :.2,Contract Date :,Contract Value :,Work Completion Period in days :,Updated By :.3,Updated on :,AOC document :,AOC Description :,Committee Chairperson/Co-ordinator Name :.1,Committee Chairperson/Co-ordinator Type :.1,Committee Members :.1,Updated By :.4,Updated on :.1,Document :.3,Organisation Chain :,Tender ID :,Tender Ref No :,Tender Title :,S.No.1,Bid Number.1,Bidder Name.1,Awarded Currency,Awarded Value,Tender Stage
"1,44,113",Yes,fixed,,EE Keylong,Keylong,1.0,ICICI BANK,1.0,Fee/PreQual/Technical,.pdf,Proof of earnest money as per NIT,Executive Engineer,EE JSV Division Keylong,"HP Irrigation and Public Health||Kullu Circle,Irrigation and Public Health,HP||Keylong,Irrigation and Public Health,HP",76837-7732,2022_HPIPH_56677_1,Yes,Open Tender,Item Wise,Works,2.0,No,No,Both(Online/Offline),No,No,No,"1,500",EE Keylong,Keylong,No,Providing Flood Protection to village Goushal in Chandra Bhaga River Distt L S (HP).,SH C o Crate work left side of confluence toward Goushal village from Rd 700 to 1000) Job. No.-III.,Please refer Tender documents. ,NA ,"1,11,61,290",Civil Works,NA ,Tender,120.0,180.0,Keylong,175132.0,NA ,NA ,NA ,Keylong,No ,No,11-Feb-2022 09:00 AM,18-Feb-2022 11:30 AM,11-Feb-2022 10:00 AM,17-Feb-2022 05:00 PM,NA ,NA ,11-Feb-2022 10:00 AM,17-Feb-2022 05:00 PM,13-Apr-2022 11:00 AM,AOC,Superintending Engineer,Internal,"EE (D), EE Keylong, AE (D), CHD, JDM, Sr. Asstt. (W)",Ravinder Kumar Sharma,12-Apr-2022 09:30 PM,13-Apr-2022 11:00 AM,techsummary_85395.pdf (1921.79 KB),1.0,264447.0,AKSHAY DHILLON,17-Feb-2022 12:14 PM,Rejected-Finance,Rates quoted by the cont. fund 3rd lowest,16-Jun-2022 12:52 PM,Finance,Sh. Rajesh Kumar Govt. Contractor has been found lowest quoted rates of the bid.,Ravinder Kumar Sharma,16-Jun-2022 12:14 PM,finance_85395.pdf,BOQ Comparative Chart,Technical,Eligibility,Ravinder Kumar Sharma,12-Apr-2022 09:14 PM,technical_85395.pdf,16-Jun-2022,"INR 11,161,290",180.0,Ravinder Kumar Sharma,16-Jun-2022 12:55 PM,AJIII.pdf (548.00 KB),The works has been awarded to Rajesh Kumar Govt. Contractor,Executive Engineer,Internal,Assistant Engineer SD Keylong Divisional Head Draftsman Superintendent Gr-II,Ravinder Kumar Sharma,16-Jun-2022 12:52 PM,finsummary_85395.pdf (432.85 KB),"HP Irrigation and Public Health||Kullu Circle,Irrigation and Public Health,HP||Keylong,Irrigation and Public Health,HP",2022_HPIPH_56677_1,76837-7732,Providing Flood Protection to village Goushal in Chandra Bhaga River Distt L S (HP).,1.0,263632.0,Rajesh Kumar,INR,"9,080,283",AOC
,,,,,,2.0,ICICI NEFT/RTGS,,,.pdf,Proof of cost of tender form as per NIT,,,,,,,,,,,,,,,,,,,,,,,,,,,,,,,,,,,,,,,,,,,,,,,,AOC,,,,,,,,2.0,264530.0,AMAR CHAND NEGI,17-Feb-2022 02:28 PM,Rejected-Finance,Rates quoted by the cont. fund 2nd lowest,16-Jun-2022 12:52 PM,,,,,,,,,,,,,,,,,,,,,,,,,,,,,,,,,,AOC
,,,,,,,,,,.pdf,Copy of registration with JSV as per NIT,,,,,,,,,,,,,,,,,,,,,,,,,,,,,,,,,,,,,,,,,,,,,,,,AOC,,,,,,,,3.0,264573.0,CHARAN DASS,17-Feb-2022 02:54 PM,Rejected-Finance,Rates quoted by the cont. fund 5th lowest,16-Jun-2022 12:52 PM,,,,,,,,,,,,,,,,,,,,,,,,,,,,,,,,,,AOC
,,,,,,,,,,.pdf,"Pan No., GST Registration and latest ITR as per NIT",,,,,,,,,,,,,,,,,,,,,,,,,,,,,,,,,,,,,,,,,,,,,,,,AOC,,,,,,,,4.0,264615.0,gagan ohri,17-Feb-2022 03:50 PM,Rejected-Finance,Rates quoted by the cont. fund 4th lowest,16-Jun-2022 12:52 PM,,,,,,,,,,,,,,,,,,,,,,,,,,,,,,,,,,AOC
,,,,,,,,,,.pdf,Form-6 with full address and signed by the contractor/ firm as per NIT,,,,,,,,,,,,,,,,,,,,,,,,,,,,,,,,,,,,,,,,,,,,,,,,AOC,,,,,,,,5.0,264588.0,Gulrez Mohammed,17-Feb-2022 03:45 PM,Not Admitted-Fee/PreQual/Technical,Not Complied with technical specification,12-Apr-2022 09:14 PM,,,,,,,,,,,,,,,,,,,,,,,,,,,,,,,,,,AOC
,,,,,,,,,,.pdf,Copy of undertaking as per NIT,,,,,,,,,,,,,,,,,,,,,,,,,,,,,,,,,,,,,,,,,,,,,,,,AOC,,,,,,,,6.0,263632.0,Rajesh Kumar,16-Feb-2022 07:37 PM,Accepted-AOC,accepted,16-Jun-2022 12:55 PM,,,,,,,,,,,,,,,,,,,,,,,,,,,,,,,,,,AOC
,,,,,,,,,,.pdf,Proof of regisgtration EPF as per NIT,,,,,,,,,,,,,,,,,,,,,,,,,,,,,,,,,,,,,,,,,,,,,,,,AOC,,,,,,,,7.0,264135.0,Thakur Constructions,17-Feb-2022 03:14 PM,Rejected-Finance,Rates quoted by the cont. fund 6th lowest,16-Jun-2022 12:52 PM,,,,,,,,,,,,,,,,,,,,,,,,,,,,,,,,,,AOC
,,,,,,,,2.0,Finance,.xls,BOQ,,,,,,,,,,,,,,,,,,,,,,,,,,,,,,,,,,,,,,,,,,,,,,,,AOC,,,,,,,,,,,,,,,,,,,,,,,,,,,,,,,,,,,,,,,,,,,,,,,,AOC
