Organisation Chain :,Tender ID :,Tender Ref No :,Tender Title :,Committee Chairperson/Co-ordinator Name :,Committee Chairperson/Co-ordinator Type :,Committee Members :,Updated By :,Updated on :,Document :,S.No,Bid Number,Bidder Name,Awarded Currency,Awarded Value,Contract Date :,Contract Value :,Work Completion Period in days :,Updated By :.1,Updated on :.1,AOC document :,AOC Description :,S.No.1,Bid Number.1,Bidder Name.1,Submitted Date,Status,Remarks,Status Updated On,Type :,Summary :,Updated By :.2,Updated On :,Document :.1,Committee Chairperson/Co-ordinator Name :.1,Committee Chairperson/Co-ordinator Type :.1,Committee Members :.1,Updated By :.3,Updated On :.1,Financial Bid Opening Date:,Document :.2,Type :.1,Summary :.1,Updated By :.4,Updated On :.2,Document :.3,BOQ Comparative Chart :,Tender Stage,Publish Date,Bid Opening Date,Document Download / Sale Start Date,Document Download / Sale End Date,Clarification Start Date,Clarification End Date,Bid Submission Start Date,Bid Submission End Date,Financial Bid Opening Date,Organisation Chain,Tender Reference Number,Tender ID,Withdrawal Allowed,Tender Type,Form of contract,Tender Category,No. of Covers,General Technical Evaluation Allowed,ItemWise Technical Evaluation Allowed,Payment Mode,Is Multi Currency Allowed For BOQ,Is Multi Currency Allowed For Fee,Allow Two Stage Bidding,Tender Fee in ₹,Fee Payable To,Fee Payable At,Tender Fee Exemption Allowed,S.No,Instrument Type,Title,Work Description,Pre Qualification Details,Independent External Monitor/Remarks,Tender Value in ₹,Product Category,Sub category,Contract Type,Bid Validity(Days),Period Of Work(Days),Location,Pincode,Pre Bid Meeting Place,Pre Bid Meeting Address,Pre Bid Meeting Date,Bid Opening Place,Should Allow NDA Tender,Allow Preferential Bidder,Cover No,Cover,Document Type,Description,Name,Address,EMD Amount in ₹,EMD Exemption Allowed,EMD Fee Type,EMD Percentage,EMD Payable To,EMD Payable At,Tender Stage
Department of Health and Family Welfare||Directorate of Health and Family Welfare||CMO BILASPUR,2020_DFHW_37813_1,HFW BLP (Diet/Sanitaion)1/2020,"Supply of cooked diet in CHC Bharari, Distt. Bilaspur HP","Chief Medical Officer, Bilaspur HP",Internal,Kindly see the attachment,Parkash Chand Daroch,30-Jul-2020 04:30 PM,finsummary_55729.pdf (646.17 KB),1.0,164617.0,MD UTILITY,INR,"2,240,000",30-Jul-2020,"INR 2,240,000",240.0,Parkash Chand Daroch,30-Jul-2020 04:40 PM,Award.PDF (1256.00 KB),Estimated contract value 2240000 for 31.03.2021 as per tender document. It will be very as per requirement of institution,1,164588,A TO Z SOLUTIONS,25-Jun-2020 10:12 AM,Rejected-Finance,Higher amount quoted with GST,30-Jul-2020 04:31 PM,Technical,Technical bid opening summary,Parkash Chand Daroch,18-Jul-2020 01:20 PM,technical_55729.pdf,"Chief Medical Officer, Bilaspur HP",Internal,please see the attachment,Parkash Chand Daroch,18-Jul-2020 01:33 PM,18-Jul-2020 02:00 PM,techsummary_55729.pdf (6057.74 KB),Finance,Kindly see attachment,Parkash Chand Daroch,30-Jul-2020 04:18 PM,finance_55729.pdf,BOQ Comparative Chart,AOC,04-Jun-2020 04:00 PM,25-Jun-2020 11:00 AM,04-Jun-2020 04:00 PM,25-Jun-2020 10:30 AM,NA ,NA ,10-Jun-2020 01:00 PM,25-Jun-2020 10:30 AM,18-Jul-2020 02:00 PM,Department of Health and Family Welfare||Directorate of Health and Family Welfare||CMO BILASPUR,HFW BLP (Diet/Sanitaion)1/2020,2020_DFHW_37813_1,Yes,Open Tender,Item Rate,Services,2.0,No,No,Offline,No,No,No,"1,000","Chief Medical Officer, Bilaspur HP",Bilaspur,No,1.0,DD - Demand Draft,"Supply of cooked diet in CHC Bharari, Distt. Bilaspur HP","Supply of cooked diet in CHC Bharari, Distt. Bilaspur HP for the FY 2020-21 wef 01/08/2020 to 31/03/2021",As per tender document ,NA ,0.0,Miscellaneous Services,Cooked diet ,Rate Contract,180.0,240.0,CHC Bharari,174027.0,NA ,NA ,NA ,"Office of the Chief Medical Officer, Bilaspur HP",No ,No,1.0,Fee/PreQual/Technical,.pdf,Documents required to be uploaded as per checklist of tender document.,"Chief Medical Officer, Bilaspur HP","Office of the Chief Medical Officer, Bilaspur HP","10,000",No,fixed,,"Chief Medical Officer, Bilaspur HP",Bilaspur,AOC
,,,,,,,,,,,,,,,,,,,,,,2,164605,Corporate Care,24-Jun-2020 07:21 PM,Rejected-Finance,Higher amount quoted with GST,30-Jul-2020 04:31 PM,,,,,,,,,,,,,,,,,,,AOC,,,,,,,,,,,,,,,,,,,,,,,,,,,,2.0,FDR - Fixed Deposit,,,,,,,,,,,,,,,,,,,,,.pdf,Documents required to be uploaded as per checklist of tender document,,,,,,,,,AOC
,,,,,,,,,,,,,,,,,,,,,,3,164617,MD UTILITY,24-Jun-2020 08:17 PM,Accepted-AOC,Estimated contract value 2240000 for 31.03.2021 as per tender document. It will be very as per requirement of institution,30-Jul-2020 04:41 PM,,,,,,,,,,,,,,,,,,,AOC,,,,,,,,,,,,,,,,,,,,,,,,,,,,,,,,,,,,,,,,,,,,,,,,,,.pdf,"Any other document required to be uploaded as per tender document, term and conditions",,,,,,,,,AOC
,,,,,,,,,,,,,,,,,,,,,,4,164479,RAMESH CHAND,25-Jun-2020 10:28 AM,Not Admitted-Fee/PreQual/Technical,Not Complied with technical specification,18-Jul-2020 01:21 PM,,,,,,,,,,,,,,,,,,,AOC,,,,,,,,,,,,,,,,,,,,,,,,,,,,,,,,,,,,,,,,,,,,,,,,2.0,Finance,.xls,Price Bid (BOQ),,,,,,,,,AOC
,,,,,,,,,,,,,,,,,,,,,,5,164268,Shimla Cleanways,24-Jun-2020 07:17 PM,Not Admitted-Fee/PreQual/Technical,Not Complied with technical specification,18-Jul-2020 01:21 PM,,,,,,,,,,,,,,,,,,,AOC,,,,,,,,,,,,,,,,,,,,,,,,,,,,,,,,,,,,,,,,,,,,,,,,,,,,,,,,,,,,AOC
,,,,,,,,,,,,,,,,,,,,,,6,164186,ZENITH EVENT AND SERVICES,25-Jun-2020 10:17 AM,Rejected-Finance,Higher amount quoted with GST,30-Jul-2020 04:31 PM,,,,,,,,,,,,,,,,,,,AOC,,,,,,,,,,,,,,,,,,,,,,,,,,,,,,,,,,,,,,,,,,,,,,,,,,,,,,,,,,,,AOC
