S.No,Instrument Type,Organisation Chain,Tender Reference Number,Tender ID,Withdrawal Allowed,Tender Type,Form of contract,Tender Category,No. of Covers,General Technical Evaluation Allowed,ItemWise Technical Evaluation Allowed,Payment Mode,Is Multi Currency Allowed For BOQ,Is Multi Currency Allowed For Fee,Allow Two Stage Bidding,Cover No,Cover,Document Type,Description,EMD Amount in ₹,EMD Exemption Allowed,EMD Fee Type,EMD Percentage,EMD Payable To,EMD Payable At,Tender Fee in ₹,Fee Payable To,Fee Payable At,Tender Fee Exemption Allowed,Publish Date,Bid Opening Date,Document Download / Sale Start Date,Document Download / Sale End Date,Clarification Start Date,Clarification End Date,Bid Submission Start Date,Bid Submission End Date,Financial Bid Opening Date,Title,Work Description,Pre Qualification Details,Independent External Monitor/Remarks,Tender Value in ₹,Product Category,Sub category,Contract Type,Bid Validity(Days),Period Of Work(Days),Location,Pincode,Pre Bid Meeting Place,Pre Bid Meeting Address,Pre Bid Meeting Date,Bid Opening Place,Should Allow NDA Tender,Allow Preferential Bidder,Name,Address,S.No.2,Bid Number,Bidder Name,Awarded Currency,Awarded Value,Contract Date :,Contract Value :,Work Completion Period in days :,Updated By :,Updated on :,AOC document :,AOC Description :,Organisation Chain :,Tender ID :,Tender Ref No :,Tender Title :,Committee Chairperson/Co-ordinator Name :,Committee Chairperson/Co-ordinator Type :,Committee Members :,Updated By :.1,Updated on :.1,Document :,Type :,Summary :,Updated By :.2,Updated On :,Document :.1,BOQ Comparative Chart :,S.No.1,Bid Number.1,Bidder Name.1,Submitted Date,Status,Remarks,Status Updated On,Committee Chairperson/Co-ordinator Name :.1,Committee Chairperson/Co-ordinator Type :.1,Committee Members :.1,Updated By :.3,Updated On :.1,Financial Bid Opening Date:,Document :.2,Type :.1,Summary :.1,Updated By :.4,Updated On :.2,Document :.3
1.0,DD - Demand Draft,Department of Health and Family Welfare||Directorate of Health and Family Welfare||MS RH UNA,MS-RH-UNA-23-24_Washing,2023_DFHW_70624_1,Yes,Open Tender,Item Rate,Services,2.0,No,No,Offline,No,No,No,1.0,Fee/PreQual/Technical,.pdf,Washing Tender Document for RH Una,"25,000",No,fixed,,"Medical Superintendent , Regional Hospital",Una,"1,000","Medical Superintendent , Regional Hospital",Una,No,11-Mar-2023 06:00 PM,28-Mar-2023 11:00 AM,12-Mar-2023 09:00 AM,27-Mar-2023 05:00 PM,13-Mar-2023 11:00 AM ,13-Mar-2023 05:00 PM ,16-Mar-2023 09:00 AM,27-Mar-2023 05:00 PM,31-Mar-2023 12:00 PM,Washing tender for RH Una,Washing tender for RH Una for the Financial Year 2023-24 and 2024-25,As per tender documents ,NA ,"40,00,000",Housekeeping/ Cleaning,Washing Linen articles ,Tender,180.0,730.0,Regional Hospital Una (HP),174303.0,"Room NO 111, Office of MS RH Una ","Room NO 111, Office of MS RH Una ",14-Mar-2023 11:00 AM ,"Room NO 111, Office of MS RH Una",No ,No,Medical Superintendent RH Una,"NO 111, Office of MS RH Una",1.0,338631.0,MUNISH THAKUR,INR,148.14,04-Apr-2023,"INR 4,000,000",730.0,Raman Kumar Sharma,04-Apr-2023 01:51 PM,Awardofcontract.pdf (740.00 KB),The contract will expire on 31-03-2025,Department of Health and Family Welfare||Directorate of Health and Family Welfare||MS RH UNA,2023_DFHW_70624_1,MS-RH-UNA-23-24_Washing,Washing tender for RH Una,"Dr Raman Kumar Sharma, MS Rh Una",Internal,"Dr Ravi Sharma SMO I/c RH Una Sh. Roshan Lal, ACF CMO Una, Sh Surinder Kumar, Supdt G-II, Smt. Aruna Sharma, Matron RH Una",Raman Kumar Sharma,04-Apr-2023 01:43 PM,finsummary_106456.pdf (59.52 KB),Finance,The Finance Bid opened today and total 7 bidder are admitted.,Manju Behl,31-Mar-2023 03:55 PM,,BOQ Comparative Chart,1,338779,Avinash Sharma,27-Mar-2023 04:47 PM,Rejected-AOC,Due to position at L6 the tender is not awarded,04-Apr-2023,DR Raman Kumar Sharma MS,Internal,Dr Ravi Kumar Sharma SMO Sh Roshan Lal ACF Sh Surinder Kumar Supdt Gr II Smt Krishan Kanta Matron,Raman Kumar Sharma,29-Mar-2023 11:38 AM,31-Mar-2023 12:00 PM,techsummary_106456.pdf (609.00 KB),Technical,On dated 28.03.2023 tender for washing of linen items has been opened and 8 firms / bidder has submitted online and offline tender documents.,Raman Kumar Sharma,29-Mar-2023 11:30 AM,technical_106456.pdf
2.0,FDR - Fixed Deposit,,,,,,,,,,,,,,,2.0,Finance,.xls,Bill of Quantity (BOQ) for washing tender,,,,,,,,,,,,,,,,,,,,,,,,,,,,,,,,,,,,,,,,,,,,,,,,,,,,,,,,,,,,,,,,,,,,2,336984,Everwards Human Resources Pvt. Ltd.,27-Mar-2023 03:13 PM,Rejected-AOC,Due to position at L3 the tender is not awarded,04-Apr-2023,,,,,,,,,,,,
,,,,,,,,,,,,,,,,,,,,,,,,,,,,,,,,,,,,,,,,,,,,,,,,,,,,,,,,,,,,,,,,,,,,,,,,,,,,,,,,,,,,,,,3,338863,Ganesh Kumar Bassi,27-Mar-2023 04:11 PM,Rejected-Technical,Not qualified,29-Mar-2023,,,,,,,,,,,,
,,,,,,,,,,,,,,,,,,,,,,,,,,,,,,,,,,,,,,,,,,,,,,,,,,,,,,,,,,,,,,,,,,,,,,,,,,,,,,,,,,,,,,,4,338724,M/S BALDEV KUMAR,27-Mar-2023 02:11 PM,Rejected-AOC,Due to position at L2 the tender is not awarded,04-Apr-2023,,,,,,,,,,,,
,,,,,,,,,,,,,,,,,,,,,,,,,,,,,,,,,,,,,,,,,,,,,,,,,,,,,,,,,,,,,,,,,,,,,,,,,,,,,,,,,,,,,,,5,338631,MUNISH THAKUR,27-Mar-2023 11:00 AM,Accepted-AOC,Due to L1 the tender awarded to Sh. Munish Thakur,04-Apr-2023,,,,,,,,,,,,
,,,,,,,,,,,,,,,,,,,,,,,,,,,,,,,,,,,,,,,,,,,,,,,,,,,,,,,,,,,,,,,,,,,,,,,,,,,,,,,,,,,,,,,6,338010,RK & CO,25-Mar-2023 04:32 PM,Rejected-AOC,Due to position at L7 the tender is not awarded,04-Apr-2023,,,,,,,,,,,,
,,,,,,,,,,,,,,,,,,,,,,,,,,,,,,,,,,,,,,,,,,,,,,,,,,,,,,,,,,,,,,,,,,,,,,,,,,,,,,,,,,,,,,,7,336815,S M Manpower Services Pvt. Ltd.,27-Mar-2023 03:07 PM,Rejected-AOC,Due to position at L4 the tender is not awarded,04-Apr-2023,,,,,,,,,,,,
,,,,,,,,,,,,,,,,,,,,,,,,,,,,,,,,,,,,,,,,,,,,,,,,,,,,,,,,,,,,,,,,,,,,,,,,,,,,,,,,,,,,,,,8,338833,Tania International Company,27-Mar-2023 03:05 PM,Rejected-AOC,Due to position at L5 the tender is not awarded,04-Apr-2023,,,,,,,,,,,,
