Type :,Summary :,Updated By :,Updated On :,Document :,Committee Chairperson/Co-ordinator Name :,Committee Chairperson/Co-ordinator Type :,Committee Members :,Updated By :.1,Updated On :.1,Financial Bid Opening Date:,Document :.1,Contract Date :,Contract Value :,Work Completion Period in days :,Updated By :.2,Updated on :,AOC document :,AOC Description :,Committee Chairperson/Co-ordinator Name :.1,Committee Chairperson/Co-ordinator Type :.1,Committee Members :.1,Updated By :.3,Updated on :.1,Document :.2,S.No,Bid Number,Bidder Name,Awarded Currency,Awarded Value,Type :.1,Summary :.1,Updated By :.4,Updated On :.2,Document :.3,BOQ Comparative Chart :,S.No.1,Bid Number.1,Bidder Name.1,Submitted Date,Status,Remarks,Status Updated On,Organisation Chain :,Tender ID :,Tender Ref No :,Tender Title :,Tender Stage,S.No,Bank Name,Publish Date,Bid Opening Date,Document Download / Sale Start Date,Document Download / Sale End Date,Clarification Start Date,Clarification End Date,Bid Submission Start Date,Bid Submission End Date,Financial Bid Opening Date,Organisation Chain,Tender Reference Number,Tender ID,Withdrawal Allowed,Tender Type,Form of contract,Tender Category,No. of Covers,General Technical Evaluation Allowed,ItemWise Technical Evaluation Allowed,Payment Mode,Is Multi Currency Allowed For BOQ,Is Multi Currency Allowed For Fee,Allow Two Stage Bidding,Title,Work Description,Pre Qualification Details,Independent External Monitor/Remarks,Tender Value in ₹,Product Category,Sub category,Contract Type,Bid Validity(Days),Period Of Work(Days),Location,Pincode,Pre Bid Meeting Place,Pre Bid Meeting Address,Pre Bid Meeting Date,Bid Opening Place,Should Allow NDA Tender,Allow Preferential Bidder,Name,Address,Tender Fee in ₹,Fee Payable To,Fee Payable At,Tender Fee Exemption Allowed,Cover No,Cover,Document Type,Description,EMD Amount in ₹,EMD through BG/ST or EMD Exemption Allowed,EMD Fee Type,EMD Percentage,EMD Payable To,EMD Payable At,Tender Stage
Technical,"In presence of the members of Tender Evaluation Committee and bidder(s), the online bids were opened and extracted for technical evaluation. Financial evaluation will be done once technical evaluation is finished, and selected bidders are finalized.",PRANJAL DAS,10-Mar-2023 01:28 PM,,Prof and HOD of Radiology Department,Internal,"Superintendent, Associate Prof of Radiology department, In charge Central Medical Store, Financial Adviser",Shyamal Kumar Das,02-Apr-2023 10:50 AM,03-Apr-2023 02:30 PM,techsummary_47076.pdf (1583.78 KB),01-May-2023,INR 0.0,365.0,Shyamal Kumar Das,26-Apr-2023 04:19 PM,AOC_ContrastFAAMCH.pdf (2162.00 KB),"Rate contract for Supply of Contrast at Fakhruddin Ali Ahmed Medical College and Hospital, Barpeta, Assam",Prof and HOD of Radiology,Internal,"Superintendent, Associate Prof of Radiology, In Charge CMS, Financial Adviser",Shyamal Kumar Das,26-Apr-2023 04:17 PM,finsummary_47076.pdf (682.96 KB),1.0,178492.0,P. B. DRUGS SURGICALS,INR,0.0,Finance,Financial bids have been opened. After financial evaluation the AOC is/are to be uploaded,Shyamal Kumar Das,03-Apr-2023 04:07 PM,,BOQ Comparative Chart,1,179332,MEDICAL FILM SURGICAL,09-Mar-2023 02:18 PM,Rejected-Technical,Technically disqualified,02-Apr-2023 10:50 AM,Health and Family Welfare Department||Directorate of Medical Education-HFWD||FAA Medical College and Hospital-Barpeta-HFWD,2023_HFWD_29239_1,Contrast/1848/2023/201,"Supply of Contrast at FAA Medical College Hospital, Barpeta, Assam",AOC,1.0,SBI Bank,13-Feb-2023 10:30 AM,10-Mar-2023 12:30 PM,13-Feb-2023 12:00 PM,09-Mar-2023 04:30 PM,NA ,NA ,28-Feb-2023 10:30 AM,09-Mar-2023 04:30 PM,03-Apr-2023 02:30 PM,Health and Family Welfare Department||Directorate of Medical Education-HFWD||FAA Medical College and Hospital-Barpeta-HFWD,Contrast/1848/2023/201,2023_HFWD_29239_1,Yes,Open Tender,Item Wise,Goods,2.0,No,No,Online,No,No,No,"Supply of Contrast at FAA Medical College Hospital, Barpeta, Assam","Supply of Contrast at FAA Medical College Hospital, Barpeta, Assam",Please refer Tender documents. ,NA ,,Miscellaneous Goods,NA ,Tender,365.0,365.0,Barpeta,781301.0,"Office of the Superintendent FAAMCH, Barpeta ","Office of the Superintendent FAAMCH, Barpeta, Assam-781301 ",22-Feb-2023 02:30 PM ,"Office of the Superintendent FAAMCH, Barpeta",No ,No,Superintendent,"Office of the Superintendent FAAMCH, Barpeta, Assam-781301","2,500",Nil,Nil,No,1.0,Fee/PreQual/Technical,.pdf,Technical Qualification Document,"50,000",Yes,fixed,,Nil,Nil,AOC
,,,,,,,,,,,,,,,,,,,,,,,,,2.0,178493.0,PEARL MED SCIENCES INDIA,INR,0.0,,,,,,,2,179377,North East Enterprise,09-Mar-2023 12:37 PM,Rejected-Technical,Technically disqualified,02-Apr-2023 10:50 AM,,,,,AOC,,,,,,,,,,,,,,,,,,,,,,,,,,,,,,,,,,,,,,,,,,,,,,,,,,,,.pdf,BID Document downloaded from the portal,,,,,,,AOC
,,,,,,,,,,,,,,,,,,,,,,,,,,,,,,,,,,,,3,178492,P. B. DRUGS SURGICALS,04-Mar-2023 04:33 PM,Accepted-AOC,Technically and Financially qualified,26-Apr-2023 04:20 PM,,,,,AOC,,,,,,,,,,,,,,,,,,,,,,,,,,,,,,,,,,,,,,,,,,,,,,,,,,2.0,Finance,.xls,BOQ,,,,,,,AOC
,,,,,,,,,,,,,,,,,,,,,,,,,,,,,,,,,,,,4,178493,PEARL MED SCIENCES INDIA,04-Mar-2023 04:43 PM,Accepted-AOC,Technically and Financially qualified,26-Apr-2023 04:20 PM,,,,,AOC,,,,,,,,,,,,,,,,,,,,,,,,,,,,,,,,,,,,,,,,,,,,,,,,,,,,,,,,,,,,AOC
,,,,,,,,,,,,,,,,,,,,,,,,,,,,,,,,,,,,5,178755,VINAYAK MEDISALES,06-Mar-2023 06:09 PM,Rejected-Technical,Technically disqualified,02-Apr-2023 10:50 AM,,,,,AOC,,,,,,,,,,,,,,,,,,,,,,,,,,,,,,,,,,,,,,,,,,,,,,,,,,,,,,,,,,,,AOC
