S.No,Bid Number,Bidder Name,Awarded Currency,Awarded Value,Type :,Summary :,Updated By :,Updated On :,Document :,BOQ Comparative Chart :,Type :.1,Summary :.1,Updated By :.1,Updated On :.1,Document :.1,S.No.1,Bid Number.1,Bidder Name.1,Submitted Date,Status,Remarks,Status Updated On,Committee Chairperson/Co-ordinator Name :,Committee Chairperson/Co-ordinator Type :,Committee Members :,Updated By :.2,Updated on :,Document :.2,Contract Date :,Contract Value :,Work Completion Period in days :,Updated By :.3,Updated on :.1,AOC document :,AOC Description :,Organisation Chain :,Tender ID :,Tender Ref No :,Tender Title :,Committee Chairperson/Co-ordinator Name :.1,Committee Chairperson/Co-ordinator Type :.1,Committee Members :.1,Updated By :.4,Updated On :.2,Financial Bid Opening Date:,Document :.3,Cover No,Cover,Document Type,Description,Publish Date,Bid Opening Date,Document Download / Sale Start Date,Document Download / Sale End Date,Clarification Start Date,Clarification End Date,Bid Submission Start Date,Bid Submission End Date,Financial Bid Opening Date,EMD Amount in ₹,EMD Exemption Allowed,EMD Fee Type,EMD Percentage,EMD Payable To,EMD Payable At,Name,Address,S.No.2,Instrument Type,Title,Work Description,Pre Qualification Details,Independent External Monitor/Remarks,Tender Value in ₹,Product Category,Sub category,Contract Type,Bid Validity(Days),Period Of Work(Days),Location,Pincode,Pre Bid Meeting Place,Pre Bid Meeting Address,Pre Bid Meeting Date,Bid Opening Place,Should Allow NDA Tender,Allow Preferential Bidder,Organisation Chain,Tender Reference Number,Tender ID,Withdrawal Allowed,Tender Type,Form of contract,Tender Category,No. of Covers,General Technical Evaluation Allowed,ItemWise Technical Evaluation Allowed,Payment Mode,Is Multi Currency Allowed For BOQ,Is Multi Currency Allowed For Fee,Allow Two Stage Bidding,Tender Fee in ₹,Fee Payable To,Fee Payable At,Tender Fee Exemption Allowed,S.No.1.1,Category,Sub Category,Sub Category Description,Format/File
1.0,276001.0,VARNAGCONSTRUCTIONS,INR,"4,082,367",Finance,As per opening summary attached,Chaman Singh,22-Apr-2022 05:36 PM,finance_89027.pdf,BOQ Comparative Chart,Technical,As per bid opening summary attached,Chaman Singh,11-Apr-2022 05:40 PM,technical_89027.pdf,1.0,276010.0,SANDEEP KUMAR SHARMA,06-Apr-2022 08:32 PM,Rejected-AOC,Not found in order,06-Apr-2023,Er. Chaman Singh Thakur Executive Engineer,Internal,Sh. Navneet Kumar Superintendent Sh.Vimal Kumar Head Draughtsman Sh. Nawang Dorje Divisional Accounts Officer,Chaman Singh,22-Apr-2022 05:40 PM,finsummary_89027.pdf (3271.83 KB),06-Apr-2023,"INR 4,082,367",30.0,Chaman Singh,06-Apr-2023 04:12 PM,award.pdf (6459.00 KB),As per award attached,PWD,2022_PWD_58853_1,18937-19036 Dated-15.03.2022,Annual Maintenance plan for the year 2022 23 on Bajaura Kandi road km 3-700 to 12-540,Er. Chaman Singh Thakur Executive Engineer,Internal,"Superintendent Gr.II Banjar division Head Draughtsman , Divisional Accounts Officer Banjar division",Chaman Singh,11-Apr-2022 05:43 PM,11-Apr-2022 05:50 PM,techsummary_89027.pdf (3588.17 KB),1.0,Fee/PreQual/Technical,.pdf,Scanned copy of Registration/ Enlistment with HPPWD,01-Apr-2022 10:00 AM,08-Apr-2022 11:00 AM,01-Apr-2022 10:00 AM,07-Apr-2022 05:00 PM,NA ,NA ,01-Apr-2022 10:00 AM,07-Apr-2022 05:00 PM,11-Apr-2022 05:50 PM,"78,500",No,fixed,,EE Banjar,Banjar,"Executive Engineer Banjar division HPPWD., Banjar",Near HPPWD Rest House Banjar Tehsil Banjar Distt.Kullu,1.0,DD - Demand Draft,Annual Maintenance plan for the year 2022 23 on Bajaura Kandi road km 3-700 to 12-540,Providing and laying BUSG for correction layer bituminous concrete in kilometer 3-700 ti 6-0 and construction of hill side drain at various reachesat kilometer 3-700 to 6-0,Please refer Tender documents. ,NA ,"39,25,324",Civil Works - Roads,NA ,Tender,75.0,30.0,Bajaura,175125.0,NA ,NA ,NA ,Banjar,No ,No,PWD,18937-19036 Dated-15.03.2022,2022_PWD_58853_1,Yes,Open Tender,Item Rate,Works,2.0,No,No,Offline,No,No,No,"1,500",EE Banjar,Banjar,No,1.0,Certificate Details ,Affidavit regarding correctness of bid ,Required in tender document in bidder file 1 ,
,,,,,,,,,,,,,,,,2.0,276001.0,VARNAGCONSTRUCTIONS,06-Apr-2022 08:01 PM,Accepted-AOC,Found in order,06-Apr-2023,,,,,,,,,,,,,,,,,,,,,,,,,,,.pdf,Scanned copy of proof of Registration under Employees Provident Fund,,,,,,,,,,,,,,,,,,2.0,FDR - Fixed Deposit,,,,,,,,,,,,,,,,,,,,,,,,,,,,,,,,,,,,,,,,,
,,,,,,,,,,,,,,,,,,,,,,,,,,,,,,,,,,,,,,,,,,,,,,,,,.pdf,Scanned copy of PAN GST Income tax clearance certificate,,,,,,,,,,,,,,,,,,,,,,,,,,,,,,,,,,,,,,,,,,,,,,,,,,,,,,,,,,,,
,,,,,,,,,,,,,,,,,,,,,,,,,,,,,,,,,,,,,,,,,,,,,,,,,.pdf,Scanned copy of Earnest money and cost of Form may be pledged in the name of EE Banjar division,,,,,,,,,,,,,,,,,,,,,,,,,,,,,,,,,,,,,,,,,,,,,,,,,,,,,,,,,,,,
,,,,,,,,,,,,,,,,,,,,,,,,,,,,,,,,,,,,,,,,,,,,,,,,,.pdf,Scanned copy of ownership of hot mix plant,,,,,,,,,,,,,,,,,,,,,,,,,,,,,,,,,,,,,,,,,,,,,,,,,,,,,,,,,,,,
,,,,,,,,,,,,,,,,,,,,,,,,,,,,,,,,,,,,,,,,,,,,,,,,,.pdf,"Scanned copy of machinery detail i.e. Bitumen Extraction Test Apparatus, Digital Thermometer, Thick",,,,,,,,,,,,,,,,,,,,,,,,,,,,,,,,,,,,,,,,,,,,,,,,,,,,,,,,,,,,
,,,,,,,,,,,,,,,,,,,,,,,,,,,,,,,,,,,,,,,,,,,,,,,,,.pdf,Form 7 and 8 duly signed,,,,,,,,,,,,,,,,,,,,,,,,,,,,,,,,,,,,,,,,,,,,,,,,,,,,,,,,,,,,
,,,,,,,,,,,,,,,,,,,,,,,,,,,,,,,,,,,,,,,,,,,,,,,2.0,Finance,.xls,BOQ,,,,,,,,,,,,,,,,,,,,,,,,,,,,,,,,,,,,,,,,,,,,,,,,,,,,,,,,,,,,
