Organisation Chain,Tender Reference Number,Tender ID,Withdrawal Allowed,Tender Type,Form of contract,Tender Category,No. of Covers,General Technical Evaluation Allowed,ItemWise Technical Evaluation Allowed,Payment Mode,Is Multi Currency Allowed For BOQ,Is Multi Currency Allowed For Fee,Allow Two Stage Bidding,Cover No,Cover,Document Type,Description,Publish Date,Bid Opening Date,Document Download / Sale Start Date,Document Download / Sale End Date,Clarification Start Date,Clarification End Date,Bid Submission Start Date,Bid Submission End Date,Financial Bid Opening Date,EMD Amount in ₹,EMD Exemption Allowed,EMD Fee Type,EMD Percentage,EMD Payable To,EMD Payable At,S.No,Bank Name,Tender Fee in ₹,Fee Payable To,Fee Payable At,Tender Fee Exemption Allowed,Name,Address,Title,Work Description,Pre Qualification Details,Independent External Monitor/Remarks,Tender Value in ₹,Product Category,Sub category,Contract Type,Bid Validity(Days),Period Of Work(Days),Location,Pincode,Pre Bid Meeting Place,Pre Bid Meeting Address,Pre Bid Meeting Date,Bid Opening Place,Should Allow NDA Tender,Allow Preferential Bidder,Tender Stage
"Himachal Urban Development Authority||Supdt. Engineer (N),HIMUDA||Executive Engineer Division,Mandi,HIMUDA",HIMUDA-MD-E-175-2024,2024_HIMUD_91929_1,Yes,Open Tender,Percentage,Works,2.0,No,No,Online,No,No,No,1.0,Fee/PreQual/Technical,.pdf,Contractor Registration  (As mentioned in NIT),19-Aug-2024 04:00 PM,29-Aug-2024 11:30 AM,20-Aug-2024 10:30 AM,28-Aug-2024 05:00 PM,,,20-Aug-2024 10:30 AM,28-Aug-2024 05:00 PM,31-Aug-2024 11:05 AM,"38,660",No,fixed,,Nil,Nil,1.0,ICICI BANK,"1,770",Nil,Nil,No,EE HIMUDA DIVISION MANDI,EE HIMUDA DIVISION MANDI,Construction of Sub Jail Complex at Kullu District Kullu HP SH Construction of encloser wall around the Male Barrack,Construction of Sub Jail Complex at Kullu District Kullu HP SH Construction of encloser wall around the Male Barrack,Please refer tender documents,,"19,33,114",Civil Works,,Tender,60.0,120.0,Kullu,175101.0,,,,EE HIMUDA DIVISION MANDI,No,No,AOC
,,,,,,,,,,,,,,,,.pdf,GST  Registration and acknowledgement of returns of GST.,,,,,,,,,,,,,,,,2.0,ICICI NEFT/RTGS,,,,,,,,,,,,,,,,,,,,,,,,,AOC
,,,,,,,,,,,,,,,,.pdf,Income tax Return/clearance and PAN and EPF (As mentioned in NIT),,,,,,,,,,,,,,,,,,,,,,,,,,,,,,,,,,,,,,,,,,AOC
,,,,,,,,,,,,,,,,.pdf,Affidavit regarding work in hand as per NIT condition (C ) V.,,,,,,,,,,,,,,,,,,,,,,,,,,,,,,,,,,,,,,,,,,AOC
,,,,,,,,,,,,,,,,.pdf,Detail of Machinery as shown in schedule F of tender form 7/8,,,,,,,,,,,,,,,,,,,,,,,,,,,,,,,,,,,,,,,,,,AOC
,,,,,,,,,,,,,,,,.pdf,Undertaking  as uploaded on the portal,,,,,,,,,,,,,,,,,,,,,,,,,,,,,,,,,,,,,,,,,,AOC
,,,,,,,,,,,,,,2.0,Finance,.xls,BOQ,,,,,,,,,,,,,,,,,,,,,,,,,,,,,,,,,,,,,,,,,,AOC
