2023_HPSEB_77174_1,NIT30/2023-24,30/2023-24,MINOR LT EXTENSION KOTHUNA,Services,Open Tender,Percentage,Supply and Erection,No,No,NA ,05-Aug-2023 10:00 AM,NA ,60.0,No ,No,Online,16-Aug-2023 12:00 PM,HPSEBL||CE(OP) CZ Mandi||SE(OP) Mandi||Sr. Xen (E) D/Pur,KOTHUWAN,176090.0,1.0,"1,77,790",AS ENTERPRISES,"177,509",Accepted-AOC,30-Sep-2023,HPSEBL||CE(OP) CZ Mandi||SE(OP) Mandi||Sr. Xen (E) D/Pur
2023_HPSEB_77175_1,NIT31/2023-24,31/2023-24,MINOR LT EXTENSION IN E SECTION SADHOT,Services,Open Tender,Percentage,Supply and Erection,No,No,NA ,05-Aug-2023 10:00 AM,NA ,60.0,No ,No,Online,16-Aug-2023 12:00 PM,HPSEBL||CE(OP) CZ Mandi||SE(OP) Mandi||Sr. Xen (E) D/Pur,SADHOT,175040.0,1.0,"1,48,241",KARTAR CHAND,"147,349",Rejected-Finance,30-Sep-2023,HPSEBL||CE(OP) CZ Mandi||SE(OP) Mandi||Sr. Xen (E) D/Pur
2023_HPSEB_77180_1,32/2023-24,32/2023-24,MINOT LT EXTENSION IN E SECTION GADIDHAR,Services,Open Tender,Percentage,Supply and Erection,No,No,NA ,05-Aug-2023 10:00 AM,NA ,60.0,No ,No,Online,16-Aug-2023 12:00 PM,HPSEBL||CE(OP) CZ Mandi||SE(OP) Mandi||Sr. Xen (E) D/Pur,GADDIDHAR,176090.0,1.0,"1,27,913",AS ENTERPRISES,"127,719",Accepted-AOC,30-Sep-2023,HPSEBL||CE(OP) CZ Mandi||SE(OP) Mandi||Sr. Xen (E) D/Pur
2023_HPSEB_77181_1,NIT33/2023-24,33/2023-24,MINOT LT EXTENSION IN E SECTION TIHRA,Services,Open Tender,Percentage,Supply and Erection,No,No,NA ,05-Aug-2023 10:00 AM,NA ,60.0,No ,No,Online,16-Aug-2023 12:00 PM,HPSEBL||CE(OP) CZ Mandi||SE(OP) Mandi||Sr. Xen (E) D/Pur,TIHRA,176090.0,1.0,"72,637",AS ENTERPRISES,"72,169",Rejected-Finance,30-Sep-2023,HPSEBL||CE(OP) CZ Mandi||SE(OP) Mandi||Sr. Xen (E) D/Pur
2023_HPSEB_77182_1,NIT34/2023-24,34/2023-24,MINOR LT EXTENSION IN E SECTION SAJYAO,Services,Open Tender,Percentage,Supply and Erection,No,No,NA ,05-Aug-2023 10:00 AM,NA ,60.0,No ,No,Online,16-Aug-2023 12:00 PM,HPSEBL||CE(OP) CZ Mandi||SE(OP) Mandi||Sr. Xen (E) D/Pur,SAJYAO,175040.0,1.0,"1,75,602",AS ENTERPRISES,"175,270",Accepted-AOC,30-Sep-2023,HPSEBL||CE(OP) CZ Mandi||SE(OP) Mandi||Sr. Xen (E) D/Pur
2023_HPSEB_77183_1,NIT 35/2023-24,35/2023-24,MINOR LT EXTENSION IN E SECTION SANDHOLE,Services,Open Tender,Percentage,Supply and Erection,No,No,NA ,05-Aug-2023 10:00 AM,NA ,60.0,No ,No,Online,16-Aug-2023 12:00 PM,HPSEBL||CE(OP) CZ Mandi||SE(OP) Mandi||Sr. Xen (E) D/Pur,SANDHOLE,176090.0,1.0,"1,49,116",AS ENTERPRISES,"148,927",Accepted-AOC,30-Sep-2023,HPSEBL||CE(OP) CZ Mandi||SE(OP) Mandi||Sr. Xen (E) D/Pur
2023_HPSEB_77184_1,NIT36/2023-24,36/2023-24,MINOR LT EXTENSION IN E SECTION KUJAbalh,Services,Open Tender,Percentage,Supply and Erection,No,No,NA ,05-Aug-2023 10:00 AM,NA ,60.0,No ,No,Online,16-Aug-2023 12:00 PM,HPSEBL||CE(OP) CZ Mandi||SE(OP) Mandi||Sr. Xen (E) D/Pur,KUJABALH,176090.0,1.0,"1,44,525",AS ENTERPRISES,"144,490",Accepted-AOC,30-Sep-2023,HPSEBL||CE(OP) CZ Mandi||SE(OP) Mandi||Sr. Xen (E) D/Pur
2023_HPSEB_77185_1,NIT37/2023-24,37/2023-24,MINOR LT EXTENSION IN E SECTION MARHI,Services,Open Tender,Percentage,Supply and Erection,No,No,NA ,05-Aug-2023 10:00 AM,NA ,60.0,No ,No,Online,16-Aug-2023 12:00 PM,HPSEBL||CE(OP) CZ Mandi||SE(OP) Mandi||Sr. Xen (E) D/Pur,MARHI,175040.0,1.0,"1,30,188",AS ENTERPRISES,"129,315",Rejected-Finance,30-Sep-2023,HPSEBL||CE(OP) CZ Mandi||SE(OP) Mandi||Sr. Xen (E) D/Pur
2023_HPSEB_77186_1,NIT38/2023-24,38/2023-24,MINOR LT EXTENSION IN E SECTION SIDHPUR,Services,Open Tender,Percentage,Supply and Erection,No,No,NA ,05-Aug-2023 10:00 AM,NA ,60.0,No ,No,Online,16-Aug-2023 12:00 PM,HPSEBL||CE(OP) CZ Mandi||SE(OP) Mandi||Sr. Xen (E) D/Pur,SIDHPUR,175040.0,1.0,"1,70,909",AS ENTERPRISES,"170,899",Rejected-Finance,30-Sep-2023,HPSEBL||CE(OP) CZ Mandi||SE(OP) Mandi||Sr. Xen (E) D/Pur
2023_HPSEB_77187_1,NIT39/2023-24,39/2023-24,AUGMENTATION OF DTR,Services,Open Tender,Percentage,Supply and Erection,No,No,NA ,05-Aug-2023 10:00 AM,NA ,60.0,No ,No,Online,16-Aug-2023 12:00 PM,HPSEBL||CE(OP) CZ Mandi||SE(OP) Mandi||Sr. Xen (E) D/Pur,CHANJYAR,175040.0,1.0,"81,464",AS ENTERPRISES,"81,459",Rejected-Finance,30-Sep-2023,HPSEBL||CE(OP) CZ Mandi||SE(OP) Mandi||Sr. Xen (E) D/Pur
2023_HPSEB_77200_1,NIT-31/2023-24,"Tender for providing LT extension to newly constructed housesfrom 100KVA, 11/0.4KV DTR Bhrain, 63KVA, 11/0.4KV DTR shat Gaon and 25KVA, 11/0.4KV DTR Ghanakla in (E) Section Shat under ESD, HPSEBL, Bhuntar.","Tender for providing LT extension to newly constructed housesfrom 100KVA, 11/0.4KV DTR Bhrain, 63KVA, 11/0.4KV DTR shat Gaon and 25KVA, 11/0.4KV DTR Ghanakla in (E) Section Shat under ESD, HPSEBL, Bhuntar.",Works,Open Tender,Percentage,Electrical Works,No,No,NA ,05-Aug-2023 12:30 PM,NA ,180.0,No ,No,Online,16-Aug-2023 11:30 AM,HPSEBL||CE(OP) CZ Mandi||SE(OP) Kullu||Sr. Xen (E) Kullu,"Shat, Kullu",175105.0,2.0,"1,84,607",Abha Electricals,"188,298",Accepted-AOC,22-Sep-2023,HPSEBL||CE(OP) CZ Mandi||SE(OP) Kullu||Sr. Xen (E) Kullu
2023_HPSEB_77202_1,NIT-32/2023-24,"Tender for replacement of lengthy PVC with overhead conductor from various DTRs in (E) Section Shat under ESD, HPSEBL, Bhuntar.","Tender for replacement of lengthy PVC with overhead conductor from various DTRs in (E) Section Shat under ESD, HPSEBL, Bhuntar.",Works,Open Tender,Percentage,Electrical Works,No,No,NA ,05-Aug-2023 12:30 PM,NA ,180.0,No ,No,Online,16-Aug-2023 11:30 AM,HPSEBL||CE(OP) CZ Mandi||SE(OP) Kullu||Sr. Xen (E) Kullu,"Shat, Kullu",175105.0,2.0,"1,32,735",Abha Electricals,"135,390",Accepted-AOC,25-Sep-2023,HPSEBL||CE(OP) CZ Mandi||SE(OP) Kullu||Sr. Xen (E) Kullu
2023_HPSEB_77205_1,NIT-33/2023-24,"Tender for providing LT extension to newly constructed houses at Village Kolibehar, Baggi, Kharka, Kawa, Lot from various DTRs in (E) Section Kolibehar under ESD NO.I, HPSEBL, Kullu.","Tender for providing LT extension to newly constructed houses at Village Kolibehar, Baggi, Kharka, Kawa, Lot from various DTRs in (E) Section Kolibehar under ESD NO.I, HPSEBL, Kullu.",Works,Open Tender,Percentage,Electrical Works,No,No,NA ,05-Aug-2023 12:30 PM,NA ,180.0,No ,No,Online,16-Aug-2023 11:30 AM,HPSEBL||CE(OP) CZ Mandi||SE(OP) Kullu||Sr. Xen (E) Kullu,Kolibehar,175126.0,2.0,"1,74,657",Abha Electricals,"178,149",Rejected-Finance,16-Sep-2023,HPSEBL||CE(OP) CZ Mandi||SE(OP) Kullu||Sr. Xen (E) Kullu
2023_HPSEB_77206_1,NoHPSEBL/KLED/NIT05/2023-24,Tender for hiring No. mahindra Bolero camper,"Tender for hiring 1 No. Mahindra Bolero Camper (Diesel driven) base Model having a valid permit of commercial/passenger vehicle (Yellow no. plate) maintenance vehicle for the use in ESD, HPSEBL, Udaipur.",Works,Open Tender,Item Rate,Electrical Works,No,No,NA ,07-Aug-2023 11:30 AM,NA ,120.0,No ,No,Online,18-Aug-2023 11:30 AM,HPSEBL||CE(OP) CZ Mandi||SE(OP) Kullu||Sr. Xen (E) Keylong,Tender for hiring 1 No. Mahindra Bolero Camper,175142.0,2.0,"3,46,500",Amar Nath,"336,001",Rejected-Finance,04-Sep-2023,HPSEBL||CE(OP) CZ Mandi||SE(OP) Kullu||Sr. Xen (E) Keylong
2023_HPSEB_77207_1,NIT-34/2023-24,"Tender for providing LT extension to leftout houses from existing 63KVA,11/0.4KV DTR Huran and25 KVA, 11/0.4KV DTR Dharla in (E) Section Jari under ESD, HPSEBL, Jari.","Tender for providing LT extension to leftout houses from existing 63KVA,11/0.4KV DTR Huran and25 KVA, 11/0.4KV DTR Dharla in (E) Section Jari under ESD, HPSEBL, Jari.",Works,Open Tender,Percentage,Electrical Works,No,No,NA ,05-Aug-2023 12:45 PM,NA ,180.0,No ,No,Online,16-Aug-2023 11:30 AM,HPSEBL||CE(OP) CZ Mandi||SE(OP) Kullu||Sr. Xen (E) Kullu,"Huran and Dharla, Jari, Kullu",175105.0,2.0,"1,67,883",DILE RAM,"165,366",Accepted-AOC,16-Sep-2023,HPSEBL||CE(OP) CZ Mandi||SE(OP) Kullu||Sr. Xen (E) Kullu
2023_HPSEB_77265_1,NED/01/2023-24,NED 01/2023-24,Tender for Providing 11/0.4KV 63KVA Sub-Station along with HT and LT line in village pacca tiala (New Basti) in electrical section kandhwal under ESD Nurpur.,Works,Open Tender,Percentage,Electrical Works,No,No,NA ,09-Aug-2023 11:30 AM,NA ,180.0,No ,No,Online,04-Sep-2023 03:30 PM,HPSEBL||CE (OP) North||SE (OP) Dalhousie||Sr. Xen Nurpur,Nurpur,176202.0,2.0,,,,,15-Sep-2023,HPSEBL||CE (OP) North||SE (OP) Dalhousie||Sr. Xen Nurpur
2023_HPSEB_77277_1,HPSEBL/SE/GCP-06/23-24,HPSEBL/SE/GCP-06/23-24,"Tender for Repair Rewinding, Erection, Testing and commissioning of damaged Generator (3.5 MW) of unit No-II of Gaj Power House under Resident Engineer, Gaj Power House Division, HPSEBL, Gharoh",Works,Open Tender,Item Rate,Electrical Works,No,No,NA ,08-Aug-2023 11:00 AM,NA ,180.0,No ,No,Online,28-Aug-2023 11:00 AM,HPSEBL||CE(Gen) Sundernagar||SE(Gen) Palampur,Gaj Power House Gharoh,176215.0,2.0,"41,30,000",G S Electrical Works,"3,528,200",Accepted-AOC,02-Sep-2023,HPSEBL||CE(Gen) Sundernagar||SE(Gen) Palampur
2023_HPSEB_77294_1,SED/SP-Tender No.40/2023-24,"Estimate for providing 63kVA,22/0.4kV s/stn, Construction of 22kV HT line,Re-organisation of LT line to proposed 63kVA,22/0.4kV Shilroo in ES Mashobra under ESD HPSEBL Mashobra under Electrical Division No.1","Estimate for providing 63kVA,22/0.4kV s/stn, Construction of 22kV HT line,Re-organisation of LT line to proposed 63kVA,22/0.4kV Shilroo in ES Mashobra under ESD HPSEBL Mashobra under Electrical Division No.1",Works,Open Tender,Percentage,Electrical Works,No,No,NA ,08-Aug-2023 04:00 PM,NA ,90.0,No ,No,Online,21-Aug-2023 12:00 PM,HPSEBL||CE(OP) South||SE(OP) Shimla||Sr. Xen (E)-1 Kasumpti,mashobra,171007.0,1.0,,,,,04-Sep-2023,HPSEBL||CE(OP) South||SE(OP) Shimla||Sr. Xen (E)-1 Kasumpti
2023_HPSEB_77306_1,SED/SP-Tender No.41/2023-24,"Estimate for providing 250kV,11/0.4kV S/stn, Construction of 11kV HT line, Re-organisation of LT line from proposed 250kV,11/0.4kV s/stn Anji Kayari in ES Kamlahi under ESD HPSEBL Khalini under Electrical Division No.1","Estimate for providing 250kV,11/0.4kV S/stn, Construction of 11kV HT line, Re-organisation of LT line from proposed 250kV,11/0.4kV s/stn Anji Kayari in ES Kamlahi under ESD HPSEBL Khalini under Electrical Division No.1",Works,Open Tender,Percentage,Electrical Works,No,No,NA ,08-Aug-2023 04:00 PM,NA ,90.0,No ,No,Online,18-Aug-2023 03:00 PM,HPSEBL||CE(OP) South||SE(OP) Shimla||Sr. Xen (E)-1 Kasumpti,khalini,171002.0,1.0,,,,,04-Sep-2023,HPSEBL||CE(OP) South||SE(OP) Shimla||Sr. Xen (E)-1 Kasumpti
2023_HPSEB_77307_1,BID NO- UED/69/2023-24,Bid No- UED/69/2023-24,"Tender for shifting of existing 11kV HT Line and 11/0.4Kv,100 kva Sub-Station and dismantling of existing 3ph LT Line for SOP to HPPCL Deptt. at Pekhubela under ESD HPSEBL Santokhgarh Bid No- UED/69/2023-24.(Deposit Work)",Works,Open Tender,Percentage,Electrical Works,No,No,NA ,08-Aug-2023 03:30 PM,NA ,90.0,No ,No,Online,17-Aug-2023 11:00 AM,HPSEBL||CE (OP) North||SE (OP) Una||Sr. Xen Una,VILLAGE PEKHUBELA,174303.0,3.0,"4,50,760",,,,04-Sep-2023,HPSEBL||CE (OP) North||SE (OP) Una||Sr. Xen Una
2023_HPSEB_77311_1,01/2023-24,01/2023-24,"E Tender on partial turnkey basis for prov 11 KV H.T Line and 11 04 KV 63 KVA SStn for prov. SOP to the Tubewell Bhatian under Electrical Sub Division, HPSEBL, No-II Nalagarh",Works,Open Tender,Turn-key,Electrical Works,No,No,NA ,10-Aug-2023 09:30 AM,NA ,180.0,No ,No,Online,19-Aug-2023 09:00 AM,HPSEBL||CE(OP) South||SE(OP) Solan||Sr.Xen (E) Nalagarh,Nalagarh,174101.0,2.0,"3,92,766",,,,20-Sep-2023,HPSEBL||CE(OP) South||SE(OP) Solan||Sr.Xen (E) Nalagarh
2023_HPSEB_77315_1,02/2023-24,02/2023-24,"E Tender on partial turnkey basis for prov 11 KV H.T Line and 11 04 KV 25 KVA SStn for prov. SOP to the Tubewell at Vill Gharoti Bas Mokriwala under Electrical Sub Division, HPSEBL, Joghon",Works,Open Tender,Turn-key,Electrical Works,No,No,NA ,10-Aug-2023 09:45 AM,NA ,180.0,No ,No,Online,19-Aug-2023 11:00 AM,HPSEBL||CE(OP) South||SE(OP) Solan||Sr.Xen (E) Nalagarh,Nalagarh,174101.0,2.0,"6,52,818",,,,20-Sep-2023,HPSEBL||CE(OP) South||SE(OP) Solan||Sr.Xen (E) Nalagarh
2023_HPSEB_77316_1,03/2023-24,03/2023-24,"E Tender on partial turnkey basis for prov 11 KV H.T Line and 11 04 KV 63 KVA SStn for prov. SOP to the Tubewell Dolan under Electrical Sub Division, HPSEBL, No-II Nalagarh",Works,Open Tender,Turn-key,Electrical Works,No,No,NA ,10-Aug-2023 09:45 AM,NA ,180.0,No ,No,Online,19-Aug-2023 11:00 AM,HPSEBL||CE(OP) South||SE(OP) Solan||Sr.Xen (E) Nalagarh,Nalagarh,174101.0,2.0,"5,41,066",,,,20-Sep-2023,HPSEBL||CE(OP) South||SE(OP) Solan||Sr.Xen (E) Nalagarh
2023_HPSEB_77321_1,04/2023-24,04/2023-24,"E Tender on partial turnkey basis for prov 11 KV H.T Line and 11 04 KV 63 KVA SStn for prov. SOP to the Tubewell Brahman Majra under Electrical Sub Division , HPSEBL, No-II Nalagarh",Works,Open Tender,Turn-key,Electrical Works,No,No,NA ,10-Aug-2023 09:00 AM,NA ,180.0,No ,No,Online,19-Aug-2023 11:00 AM,HPSEBL||CE(OP) South||SE(OP) Solan||Sr.Xen (E) Nalagarh,Nalagarh,174101.0,2.0,"7,91,358",,,,20-Sep-2023,HPSEBL||CE(OP) South||SE(OP) Solan||Sr.Xen (E) Nalagarh
2023_HPSEB_77324_1,05/2023-24,05/2023-24,"E Tender on partial turnkey basis for prov 11 KV H.T Line and 11 04 KV 63 KVA SStn for prov. SOP to the Tubewell Androla (Irrigation Scheme) at Vill Androla under Electrical Sub Division, HPSEBL, No-II Nalagarh",Works,Open Tender,Turn-key,Electrical Works,No,No,NA ,10-Aug-2023 09:45 AM,NA ,180.0,No ,No,Online,19-Aug-2023 11:00 AM,HPSEBL||CE(OP) South||SE(OP) Solan||Sr.Xen (E) Nalagarh,Nalagarh,174101.0,2.0,"3,89,469",,,,20-Sep-2023,HPSEBL||CE(OP) South||SE(OP) Solan||Sr.Xen (E) Nalagarh
2023_HPSEB_77326_1,06/2023-24,06/2023-24,"E Tender on partial turnkey basis for prov 11 KV H.T Line and 11 04 KV 63 KVA SStn for prov. SOP to the Tubewell Jhajra I (Irrigation Scheme) at Vill Jhajra under Electrical Sub Division, HPSEBL, No-II Nalagarh",Works,Open Tender,Turn-key,Electrical Works,No,No,NA ,10-Aug-2023 09:40 AM,NA ,180.0,No ,No,Online,19-Aug-2023 11:00 AM,HPSEBL||CE(OP) South||SE(OP) Solan||Sr.Xen (E) Nalagarh,Nalagarh,174101.0,2.0,"5,46,169",,,,20-Sep-2023,HPSEBL||CE(OP) South||SE(OP) Solan||Sr.Xen (E) Nalagarh
2023_HPSEB_77327_1,HPSEBL/CMD/WK-24/2023-24-13,"Clearing jungle i/c uprooting of ranks, vegetation, bushes from HPSEBL colony complex, colony road, Day by day cleaning of Bhaba Power House, field hostel and rest house at Bhabanagar for 40 days","Clearing jungle i/c uprooting of ranks, vegetation, bushes from HPSEBL colony complex, colony road, Day by day cleaning of Bhaba Power House, field hostel and rest house at Bhabanagar for 40 days",Works,Open Tender,Percentage,Civil Works - Others,No,No,NA ,08-Aug-2023 06:00 PM,NA ,120.0,No ,No,Online,22-Aug-2023 02:30 PM,HPSEBL||CE(Gen) Sundernagar||SE(Gen) Bhaba Nagar||Sr. Xen CMD Bhaba,Bhabanagar,172118.0,2.0,"2,89,127",BHUPENDER SHARMA,"268,599",Rejected-AOC,02-Sep-2023,HPSEBL||CE(Gen) Sundernagar||SE(Gen) Bhaba Nagar||Sr. Xen CMD Bhaba
2023_HPSEB_77331_1,DED-27/2023-24,DED-27/2023-24,"Tender for Prov. 3- Phase LT line from Hui Hui to Swami Kashi Ashram from existing 11/0.4 KV, 25 KVA Sub-Station Hui Hui under Electrical Sub-Division HPSEBL Sidhpur.",Works,Open Tender,Percentage,Electrical Works,No,No,NA ,08-Aug-2023 05:30 PM,NA ,90.0,No ,No,Online,23-Aug-2023 03:30 PM,HPSEBL||CE (OP) North||SE (OP) Kangra||Sr. Xen Dharamshala,Dharamshala,176215.0,2.0,"1,59,518",Novelty Enterprises,"164,847",Rejected-AOC,08-Sep-2023,HPSEBL||CE (OP) North||SE (OP) Kangra||Sr. Xen Dharamshala
2023_HPSEB_77335_1,DED-28/2023-24,DED-28/2023-24,Tender for conversion from 1 Phase to 3- Phase LT line with re conductoring of existing Phase line from bare conductor to AAAC 7/3.15 mm Sq. with additional poles fror strengthening from 63 KVA Sub-Station Bagiada-I UESD Sidhpur,Works,Open Tender,Percentage,Electrical Works,No,No,NA ,08-Aug-2023 05:45 PM,NA ,90.0,No ,No,Online,24-Aug-2023 03:30 PM,HPSEBL||CE (OP) North||SE (OP) Kangra||Sr. Xen Dharamshala,Dharamshala,176215.0,2.0,"91,896",M/s Dharamshala Electrical,"95,307",Rejected-Technical,30-Sep-2023,HPSEBL||CE (OP) North||SE (OP) Kangra||Sr. Xen Dharamshala
2023_HPSEB_77340_1,DED-29/2023-24,DED-29/2023-24,Tender for erection of new pole on 11 KV Kalapul Mcleodganj feeder to increase height/clearance of HT span above premises of Mr. Kuldeep Singh at Meethanala at Mcleodganj (E) Section under Electrical Sub-Division HPSEBL Mcleodganj.,Works,Open Tender,Percentage,Electrical Works,No,No,NA ,08-Aug-2023 05:50 PM,NA ,90.0,No ,No,Online,23-Aug-2023 03:30 PM,HPSEBL||CE (OP) North||SE (OP) Kangra||Sr. Xen Dharamshala,D,176215.0,2.0,"89,170",M/S DEVARYA ENGINEERING,"91,676",Rejected-AOC,10-Sep-2023,HPSEBL||CE (OP) North||SE (OP) Kangra||Sr. Xen Dharamshala
2023_HPSEB_77343_2,DED-30/2023-24,DED-30/2023-24,"Tender for shifting of 3-Ph. LT line which is passing overhead the Govt. Residence located in 2nd IRBN Battalian Sakoh, Dharamshala in local Section under Electrical Sub-Division No.II HPSEBL Dharamshala.",Works,Open Tender,Percentage,Electrical Works,No,No,NA ,18-Aug-2023 04:50 PM,NA ,90.0,No ,No,Online,24-Aug-2023 12:30 PM,HPSEBL||CE (OP) North||SE (OP) Kangra||Sr. Xen Dharamshala,Dharamshala,176215.0,2.0,"64,426",M/S ABHAY KUMAR,"66,481",Rejected-AOC,08-Sep-2023,HPSEBL||CE (OP) North||SE (OP) Kangra||Sr. Xen Dharamshala
2023_HPSEB_77346_1,DED-31/2023-24,DED-31/2023-24,Tender for installation of 63 KVA transformer along with HT and LT line at Chakla village at Bhagshu Nag Section under Electrical Sub-Division HPSEBL Mcleodganj.,Works,Open Tender,Percentage,Electrical Works,No,No,NA ,08-Aug-2023 06:20 PM,NA ,90.0,No ,No,Online,23-Aug-2023 03:30 PM,HPSEBL||CE (OP) North||SE (OP) Kangra||Sr. Xen Dharamshala,Dharamshala,176215.0,2.0,"2,58,162",M/S DEVARYA ENGINEERING,"260,273",Accepted-AOC,07-Sep-2023,HPSEBL||CE (OP) North||SE (OP) Kangra||Sr. Xen Dharamshala
2023_HPSEB_77357_2,SEOP 29/2023-24,SEOP 29/2023-24,Electrical/civil works,Works,Open Tender,Turn-key,Civil Works,No,No,NA ,22-Aug-2023 01:00 PM,NA ,90.0,No ,No,Online,29-Aug-2023 02:00 PM,HPSEBL||CE (OP) North||SE (OP) Kangra,SE Kangra,176001.0,2.0,"9,49,509",HIMTEK BUILDERS,"996,058",Rejected-Finance,06-Sep-2023,HPSEBL||CE (OP) North||SE (OP) Kangra
2023_HPSEB_77363_1,HPSEBL/ESDU-03/2023-24,HPSEBL/ESDU/03/2023-24,Repair work of CR Panel and Breaker,Works,Open Tender,Turn-key,Electrical Works,No,No,NA ,09-Aug-2023 01:00 PM,NA ,60.0,No ,No,Online,22-Aug-2023 11:00 AM,HPSEBL||CE(ES) Hamirpur||SE(ES) Hamirpur||Sr. Xen (ES) Una (Rakkar),"Sub-Stations Under ES Division, HPSEBL Una",174303.0,2.0,"4,94,143",ARUN ELECTRICALS INDIA,"308,932",Rejected-Finance,21-Sep-2023,HPSEBL||CE(ES) Hamirpur||SE(ES) Hamirpur||Sr. Xen (ES) Una (Rakkar)
2023_HPSEB_77375_1,BID NO-UED/67/2023-24,BID NO-UED/67/2023-24,"Tender for augmentation of existing 11/0.4kV,100 kva Sub-Station to 11/0.4kV,250Kva Sub-Station(HB) at village Sanouli TS NO-209/2022-23 Bid No- UED/67/2023-24.under ESD HPSEBL Santokhgarh (Schedule Cast Deplopment Plan )",Works,Open Tender,Percentage,Electrical Works,No,No,NA ,09-Aug-2023 02:30 PM,NA ,90.0,No ,No,Online,17-Aug-2023 11:40 AM,HPSEBL||CE (OP) North||SE (OP) Una||Sr. Xen Una,AT VILLAGE SANPULI SANTOKHGARH,174303.0,3.0,"4,19,989",,,,04-Sep-2023,HPSEBL||CE (OP) North||SE (OP) Una||Sr. Xen Una
2023_HPSEB_77400_1,BID NO-UED/68/2023-24,Bid No- UED/ 68/2023-24,"Tender for providing 11kV HT Line, augmentation of existing 1104kV63 Kva Sub-StationSJ4to 1104kV250kva Sub-Station alongwith CTPT Str for for SOP to submercible MC 112.50 HP and centrifugal MC 250100hp Total 112.50HP of Jal Shakti Vibhag at village D",Works,Open Tender,Percentage,Electrical Works,No,No,NA ,09-Aug-2023 03:30 PM,NA ,90.0,No ,No,Online,17-Aug-2023 11:45 AM,HPSEBL||CE (OP) North||SE (OP) Una||Sr. Xen Una,al Shakti Vibhag at village Dhamandri,174303.0,3.0,"1,47,593",,,,04-Sep-2023,HPSEBL||CE (OP) North||SE (OP) Una||Sr. Xen Una
2023_HPSEB_77436_1,HPSEBL/CEG/Bassi-Nozzle Feedback Transducers-II/23,Supply of Nozzle feedback transducers,Supply of Nozzle feedback transducers for Bassi HEP,Goods,Single,Item Rate,Electrical Work/ Equipment,No,No,NA ,11-Aug-2023 11:00 AM,NA ,120.0,No ,No,Online,26-Aug-2023 11:30 AM,HPSEBL||CE(Gen) Sundernagar,"Bassi HEP, HPSEBL Jogindernagar.",175015.0,1.0,,ANDRITZ HYDRO PRIVATE LIMITED,"1,864,400",Accepted-AOC,06-Sep-2023,HPSEBL||CE(Gen) Sundernagar
2023_HPSEB_77438_1,HPSEBL/BED/DB-Tender JOB.13,HPSEBL/BED/DB-Tender JOB.13,Tender for Handling And Custody of Store Central Divisional Store under Electrical Sub-Division HPSEBL Barotiwala under Electrical Division HPSEBL Baddi,Services,Open Tender,Turn-key,Miscellaneous Services,No,No,NA ,10-Aug-2023 03:00 PM,NA ,180.0,No ,No,Online,05-Sep-2023 02:00 PM,HPSEBL||CE(OP) South||SE(OP) Solan||Sr.Xen (E) Baddi,Baddi,173205.0,2.0,"4,38,960",,,,30-Sep-2023,HPSEBL||CE(OP) South||SE(OP) Solan||Sr.Xen (E) Baddi
2023_HPSEB_77448_1,REB/DB-Tender(E)-08/2023-24,Tender for renewal and replacement of existing tubelight fixtures with LED street light fixtures at Bassi P/H to Chhaprote along the Penstock Bassi Power House to Rest House and Surrounding area under Electrical Mtc. Sub-Division BASSI POWER HOUSE HP,Tender for renewal and replacement of existing tubelight fixtures with LED street light fixtures at Bassi P/H to Chhaprote along the Penstock Bassi Power House to Rest House and Surrounding area under Electrical Mtc. Sub-Division BASSI POWER HOUSE HP,Works,Open Tender,Item Rate,Electrical Works,No,No,NA ,10-Aug-2023 05:00 PM,NA ,180.0,No ,No,Online,22-Aug-2023 11:00 AM,"HPSEBL||CE(Gen) Sundernagar||SE(Gen) Palampur||RE, Bassi, J/Nagar",RE Bassi HEP Jogindernagar,175015.0,2.0,"2,84,668",Guleria Electric and Contracts,"227,976",Rejected-AOC,01-Sep-2023,"HPSEBL||CE(Gen) Sundernagar||SE(Gen) Palampur||RE, Bassi, J/Nagar"
2023_HPSEB_77451_1,REB/DB-Tender(E)-11/2023-24,Tender for Providing and fixing of electrical insulation Mat for 11kv panels IS 15652 2006 IES BS EN 61111 2009 in front of all panels in control room 2nd control room battery charger at Bassi Power House,Tender for Providing and fixing of electrical insulation Mat for 11kv panels IS 15652 2006 IES BS EN 61111 2009 in front of all panels in control room 2nd control room battery charger at Bassi Power House,Works,Open Tender,Item Rate,Electrical Works,No,No,NA ,10-Aug-2023 05:00 PM,NA ,180.0,No ,No,Online,22-Aug-2023 11:00 AM,"HPSEBL||CE(Gen) Sundernagar||SE(Gen) Palampur||RE, Bassi, J/Nagar",RE Bassi HEP Jogindernagar,175015.0,2.0,"1,96,982",Krishana Traders,"175,210",Accepted-AOC,01-Sep-2023,"HPSEBL||CE(Gen) Sundernagar||SE(Gen) Palampur||RE, Bassi, J/Nagar"
2023_HPSEB_77454_1,REB/DB-Tender(E)-12/2023-24,Tender for Renewal and replacement of ordinary tubelight fixture with LED flood light in Genertor Turbine floor and Switch yard of Bassi Power House,Tender for Renewal and replacement of ordinary tubelight fixture with LED flood light in Genertor Turbine floor and Switch yard of Bassi Power House,Works,Open Tender,Item Rate,Electrical Works,No,No,NA ,10-Aug-2023 05:00 PM,NA ,180.0,No ,No,Online,22-Aug-2023 11:00 AM,"HPSEBL||CE(Gen) Sundernagar||SE(Gen) Palampur||RE, Bassi, J/Nagar",RE Bassi HEP Jogindernagar,175015.0,2.0,"2,66,208",Guleria Electric and Contracts,"199,920",Rejected-AOC,01-Sep-2023,"HPSEBL||CE(Gen) Sundernagar||SE(Gen) Palampur||RE, Bassi, J/Nagar"
2023_HPSEB_77480_1,EDS-39/2023-24,Electrical Work,"Tender for Re-organization/strengthening of LT line from prop. 63kVA, 22/0.4kV S/stn. at parlog under ESD Jalog",Works,Limited,Percentage,Electrical Works,No,No,NA ,11-Aug-2023 03:00 PM,NA ,30.0,No ,No,Online,31-Aug-2023 02:00 PM,HPSEBL||CE(OP) South||SE(OP) Shimla||Sr. Xen (E) Sunni,Sunni,171301.0,1.0,,SUNEEL THAKUR ELECTRICAL,"84,847",Rejected-Finance,29-Sep-2023,HPSEBL||CE(OP) South||SE(OP) Shimla||Sr. Xen (E) Sunni
2023_HPSEB_77491_1,ED-DAL-E-11/2023-24,")Tender for Prov. 3phase and 2phase LT Line from63KVA Sstn at Devi-Dehra-III (ii) 3phase and 2phase LT Line from Sstn Reh Bhatoli-II(iii) 1phase line to LOH of village Tabela,Guniyala,Dharota, Farotka(iv) 1ph LOH u various Sstn in (E)Section Bathri","i)Tender for Prov. 3phase and 2phase LT Line from63KVA Sstn at Devi-Dehra-III (ii) 3phase and 2phase LT Line from Sstn Reh Bhatoli-II(iii) 1phase line to LOH of village Tabela,Guniyala,Dharota, Farotka(iv) 1ph LOH u various Sstn in (E)Section Bathri",Services,Open Tender,Percentage,Supply and Erection,No,No,NA ,14-Aug-2023 11:00 AM,NA ,180.0,No ,No,Online,22-Aug-2023 11:30 AM,HPSEBL||CE (OP) North||SE (OP) Dalhousie||Sr. Xen Dalhousie,Dalhousie,176304.0,2.0,"3,31,960",,,,02-Sep-2023,HPSEBL||CE (OP) North||SE (OP) Dalhousie||Sr. Xen Dalhousie
2023_HPSEB_77493_1,ED-DAL-E-12/2023-24,i) Tender for Prov.1ph LT Line for LOH (U) Various Sstn in Salooni (ii) Himgiri (iii) 1ph LT Line to LOH in village i.e. Shalai Mandrund Birwari from various Sstn in (E) Section Diur under ESD Salooni.,i) Tender for Prov.1ph LT Line for LOH (U) Various Sstn in Salooni (ii) Himgiri (iii) 1ph LT Line to LOH in village i.e. Shalai Mandrund Birwari from various Sstn in (E) Section Diur under ESD Salooni.,Services,Open Tender,Percentage,Supply and Erection,No,No,NA ,14-Aug-2023 11:00 AM,NA ,180.0,No ,No,Online,22-Aug-2023 11:30 AM,HPSEBL||CE (OP) North||SE (OP) Dalhousie||Sr. Xen Dalhousie,Dalhousie,176304.0,2.0,"2,65,904",,,,02-Sep-2023,HPSEBL||CE (OP) North||SE (OP) Dalhousie||Sr. Xen Dalhousie
2023_HPSEB_77503_1,ED-DAL-E-13/2023-24,"i)Tender for Prov. LT Extension strengthening of existing 3phase LT Line (u)Sihunta-4 (Choncharu) ii) Triyu iii) Repl. of 3phase LT Line with LT AB Cable (u) Tundi-1st (iv) Prov. Repl of wooden Pole with ST Poles u Surpura, Gudhal in Sihunta","i)Tender for Prov. LT Extension strengthening of existing 3phase LT Line (u)Sihunta-4 (Choncharu) ii) Triyu iii) Repl. of 3phase LT Line with LT AB Cable (u) Tundi-1st (iv) Prov. Repl of wooden Pole with ST Poles u Surpura, Gudhal in Sihunta",Services,Open Tender,Percentage,Supply and Erection,No,No,NA ,14-Aug-2023 11:00 AM,NA ,180.0,No ,No,Online,22-Aug-2023 11:30 AM,HPSEBL||CE (OP) North||SE (OP) Dalhousie||Sr. Xen Dalhousie,Dalhousie,176304.0,2.0,"2,15,269",,,,15-Sep-2023,HPSEBL||CE (OP) North||SE (OP) Dalhousie||Sr. Xen Dalhousie
