2023_DFHW_69260_1,HFW_Una (E-Tender Sanitation _CH Haroli),Sanitation tender for CH Haroli,Sanitation Tender for CH Haroli District Una for F.Y. 2023-2025,Services,Open Tender,Item Rate,Manpower Supply,No,No,NA ,20-Feb-2023 06:00 PM,24-Feb-2023 11:00 AM ,180.0,No ,No,Offline,14-Mar-2023 11:00 AM,Department of Health and Family Welfare||Directorate of Health and Family Welfare||CMO UNA,Civil Hospital Haroli District Una (HP),177220.0,2.0,"60,00,000",Maharishi Enterprises,"285,000",Accepted-AOC,01-Sep-2023,Department of Health and Family Welfare||Directorate of Health and Family Welfare||CMO UNA
2023_DFHW_69265_1,HFW_Una (E-Tender Sanitation _CHC Bhadsali),Sanitation tender for CHC Bhadsali,Sanitation Tender for CHC Bhadsali District Una for F.Y. 2023-2025,Services,Open Tender,Item Rate,Manpower Supply,No,No,NA ,20-Feb-2023 06:00 PM,24-Feb-2023 11:00 AM ,180.0,No ,No,Offline,14-Mar-2023 11:00 AM,Department of Health and Family Welfare||Directorate of Health and Family Welfare||CMO UNA,CHC Bhadsali District Una,174317.0,2.0,"60,00,000",S M Manpower Services Pvt. Ltd.,"210,000",Rejected-Finance,01-Sep-2023,Department of Health and Family Welfare||Directorate of Health and Family Welfare||CMO UNA
2023_DFHW_69285_1,HFW_Una (E-Tender Sanitation _CHC_Dulehar),Sanitation tender for CHC Dulehar,Sanitation Tender for CHC Dulehar District Una for F.Y. 2023-2025,Services,Open Tender,Item Rate,Manpower Supply,No,No,NA ,20-Feb-2023 06:00 PM,24-Feb-2023 11:00 AM ,180.0,No ,No,Offline,14-Mar-2023 11:00 AM,Department of Health and Family Welfare||Directorate of Health and Family Welfare||CMO UNA,CHC Dulehar District Una,176601.0,2.0,"60,00,000",S M Manpower Services Pvt. Ltd.,"210,000",Rejected-Finance,01-Sep-2023,Department of Health and Family Welfare||Directorate of Health and Family Welfare||CMO UNA
2023_DFHW_69288_1,HFW_Una (E-Tender Sanitation _CHC_Thanakalan),Sanitation tender for CHC Thanakalan,Sanitation Tender for CHC Thanakalan District Una for F.Y. 2023-2025,Services,Open Tender,Item Rate,Manpower Supply,No,No,NA ,20-Feb-2023 06:00 PM,24-Feb-2023 11:00 AM ,180.0,No ,No,Offline,14-Mar-2023 11:00 AM,Department of Health and Family Welfare||Directorate of Health and Family Welfare||CMO UNA,CHC Thanakalan District Una,174321.0,2.0,"60,00,000",A.B. ENTERPRISES,"210,000",Rejected-Technical,01-Sep-2023,Department of Health and Family Welfare||Directorate of Health and Family Welfare||CMO UNA
2023_DFHW_69292_1,HFW_Una (E-Tender Sanitation _PHC_Amlehar),Sanitation tender for PHC Amlehar,Sanitation Tender for PHC Amlehar District Una for F.Y. 2023-2025,Services,Open Tender,Item Rate,Manpower Supply,No,No,NA ,20-Feb-2023 06:00 PM,24-Feb-2023 11:00 AM ,180.0,No ,No,Offline,14-Mar-2023 11:00 AM,Department of Health and Family Welfare||Directorate of Health and Family Welfare||CMO UNA,PHC Amlehar District Una,177219.0,2.0,"60,00,000",Maharishi Enterprises,"210,000",Accepted-AOC,01-Sep-2023,Department of Health and Family Welfare||Directorate of Health and Family Welfare||CMO UNA
2023_DFHW_69450_2,HFW/NIT/SANITATION/2023,Provide Sanitation Services at ZH Mandi HP,Providing sanitation services at Zonal Hospital Mandi Distt Mandi HP,Services,Open Tender,Item Rate,Housekeeping/ Cleaning,No,No,NA ,23-Feb-2023 04:50 PM,27-Feb-2023 11:00 AM ,180.0,No ,No,Both(Online/Offline),18-Mar-2023 11:00 AM,Department of Health and Family Welfare||Directorate of Health and Family Welfare||MS ZH MANDI,Zonal Hospital Mandi H.P.,175001.0,2.0,"1,30,00,000",NUVISION COMMERCIAL & ESCORT SERVICES,"11,616,475.2",Rejected-Technical,08-Sep-2023,Department of Health and Family Welfare||Directorate of Health and Family Welfare||MS ZH MANDI
2023_DFHW_69545_1,HFW-SML/Hospital-items (e-Tender)/2023-10332,Rate Contract of Hospital Items/ Equipments/ Instruments at District Health Institutions in District Shimla,Rate Contract of Hospital Items/ Equipments/ Instruments at District Health Institutions in District Shimla under CMO Office Shimla for the year 2023 to 2025,Goods,Open Tender,Item Wise,Medical Equipments/Waste,No,No,NA ,24-Feb-2023 02:00 PM,06-Mar-2023 02:00 PM ,180.0,No ,No,Both(Online/Offline),21-Mar-2023 03:30 PM,Department of Health and Family Welfare||Directorate of Health and Family Welfare||CMO SHIMLA,Shimla,171001.0,2.0,,A S Pharma Private Limited,"25,000",Accepted-AOC,20-Sep-2023,Department of Health and Family Welfare||Directorate of Health and Family Welfare||CMO SHIMLA
2023_DFHW_71658_1,HFW/KLU/2023-,Cooked Diet Services for CHC Jari Kullu,Cooked Diet Services for CHC Jari Kullu,Services,Open Tender,Item Rate,Hotel/ Catering,No,No,NA ,27-Mar-2023 05:00 PM,04-Apr-2023 11:00 AM ,180.0,No ,No,Both(Online/Offline),11-Apr-2023 03:00 PM,Department of Health and Family Welfare||Directorate of Health and Family Welfare||CMO KULLU,CHC Jari,175105.0,2.0,,A TO Z SOLUTIONS,"1,391",Accepted-AOC,19-Sep-2023,Department of Health and Family Welfare||Directorate of Health and Family Welfare||CMO KULLU
2023_DFHW_72835_1,HFW/KLU/Cooked,Cooked Diet services for CH Anni Kullu HP,Cooked Diet Services for CH Anni Kullu HP,Services,Open Tender,Item Rate,Hotel/ Catering,No,No,NA ,08-May-2023 12:00 PM,12-May-2023 11:00 AM ,180.0,No ,No,Both(Online/Offline),16-May-2023 03:00 PM,Department of Health and Family Welfare||Directorate of Health and Family Welfare||CMO KULLU,CH Anni,172026.0,2.0,,A TO Z SOLUTIONS,"1,079",Accepted-AOC,19-Sep-2023,Department of Health and Family Welfare||Directorate of Health and Family Welfare||CMO KULLU
2023_DFHW_72887_1,HFW_Una(Sanitation_CH_Bangana),Sanitation Tender for CH Bangana District Una,Sanitation Tender for CH Bangana District Una for F.Y. 2023-2025,Services,Open Tender,Item Rate,Miscellaneous Services,No,No,NA ,06-May-2023 06:00 PM,NA ,180.0,No ,No,Both(Online/Offline),29-May-2023 11:00 AM,Department of Health and Family Welfare||Directorate of Health and Family Welfare||CMO UNA,Civil Hospital Bangana District Una (HP),174307.0,2.0,"60,00,000",M/S BALDEV KUMAR,"2,500,000",Rejected-Technical,01-Sep-2023,Department of Health and Family Welfare||Directorate of Health and Family Welfare||CMO UNA
2023_DFHW_72911_1,HFW-SML/Linen (e-Tender)/2022- 10330,Rate Contract of Hospital Linen items at District Health Institutions in District Shimla,Rate Contract of Hospital Linen items at District Health Institutions in District Shimla under CMO Office Shimla for the year 2023 to 2025.,Goods,Open Tender,Item Wise,Miscellaneous Goods,No,No,NA ,06-May-2023 05:00 PM,15-May-2023 02:00 PM ,180.0,No ,No,Both(Online/Offline),27-May-2023 02:00 PM,Department of Health and Family Welfare||Directorate of Health and Family Welfare||CMO SHIMLA,Shimla,171001.0,2.0,"15,00,000",Garg Textile Mills,"500,000",Rejected-Finance,20-Sep-2023,Department of Health and Family Welfare||Directorate of Health and Family Welfare||CMO SHIMLA
2023_DFHW_72925_1,HFW_Una(Sanitation_Daulatpur,Sanitation Tender for CHC Daulatpur Chowk District Una,Sanitation Tender for CHC Daulatpur Chowk District Una for F.Y. 2023-2025,Services,Open Tender,Item Rate,Miscellaneous Services,No,No,NA ,06-May-2023 06:00 PM,NA ,180.0,No ,No,Both(Online/Offline),29-May-2023 11:00 AM,Department of Health and Family Welfare||Directorate of Health and Family Welfare||CMO UNA,"CHC Daulatpur Chowk, District Una",177204.0,2.0,"60,00,000",REETA DEVI,"130,000",Rejected-Finance,01-Sep-2023,Department of Health and Family Welfare||Directorate of Health and Family Welfare||CMO UNA
2023_DFHW_72930_1,HFW_Una-Sanitation_Santoshgarh,Sanitation Tender for CHC Santoshgarh District Una (HP),Sanitation Tender for CHC Santoshgarh District Una for F.Y. 2023-2025,Services,Open Tender,Item Rate,Miscellaneous Services,No,No,NA ,06-May-2023 06:00 PM,NA ,180.0,No ,No,Both(Online/Offline),29-May-2023 11:00 AM,Department of Health and Family Welfare||Directorate of Health and Family Welfare||CMO UNA,CHC Santoshgarh District Una (HP),174301.0,2.0,"60,00,000",Corporate Care,"130,660.8",Rejected-AOC,01-Sep-2023,Department of Health and Family Welfare||Directorate of Health and Family Welfare||CMO UNA
2023_DFHW_72945_1,HFW/KLU/Banjar,Cooked Diet services for CH Banjar Kullu HP,Cooked Diet tender for CH Banjar Kullu HP,Services,Open Tender,Item Rate,Hotel/ Catering,No,No,NA ,08-May-2023 12:00 PM,12-May-2023 11:00 AM ,180.0,No ,No,Both(Online/Offline),16-May-2023 03:00 PM,Department of Health and Family Welfare||Directorate of Health and Family Welfare||CMO KULLU,CH Banjar,175125.0,2.0,,ZENITH EVENT AND SERVICES,992.5,Rejected-AOC,19-Sep-2023,Department of Health and Family Welfare||Directorate of Health and Family Welfare||CMO KULLU
2023_DFHW_72947_1,HFW/KLU/Nirmand,Cooked diet Services for CH Nirmand Kullu HP,Cooked Diet Services for CH Nirmand Kullu HP,Services,Open Tender,Item Rate,Housekeeping/ Cleaning,No,No,NA ,08-May-2023 12:00 PM,12-May-2023 11:00 AM ,180.0,No ,No,Both(Online/Offline),16-May-2023 03:00 PM,Department of Health and Family Welfare||Directorate of Health and Family Welfare||CMO KULLU,CH Nirmand,172023.0,2.0,,A TO Z SOLUTIONS,"1,391",Accepted-AOC,19-Sep-2023,Department of Health and Family Welfare||Directorate of Health and Family Welfare||CMO KULLU
2023_DFHW_73185_1,HFW_Una(Sanitation_CH_Gagret),Sanitation Tender for CH Gagret District Una,Sanitation Tender for CH Gagret District Una for F.Y. 2023-2025,Services,Open Tender,Item Rate,Miscellaneous Services,No,No,NA ,11-May-2023 06:00 PM,NA ,195.0,No ,No,Both(Online/Offline),29-May-2023 11:00 AM,Department of Health and Family Welfare||Directorate of Health and Family Welfare||CMO UNA,"Civil Hospital Gagret, District Una (HP)",177201.0,2.0,"60,00,000",M/S BALDEV KUMAR,"250,000",Rejected-Technical,01-Sep-2023,Department of Health and Family Welfare||Directorate of Health and Family Welfare||CMO UNA
2023_DFHW_73813_1,HFW_Una(Sanitation_Kungrat),Sanitation Tender for CHC Kungrath District Una,Sanitation Tender for CHC Kungrath District Una for F.Y. 2023-2025,Services,Open Tender,Item Rate,Miscellaneous Services,No,No,NA ,24-May-2023 03:00 PM,NA ,180.0,No ,No,Both(Online/Offline),09-Jun-2023 11:00 AM,Department of Health and Family Welfare||Directorate of Health and Family Welfare||CMO UNA,CHC Kungrath District Una (HP),176601.0,2.0,"60,00,000",A.B. ENTERPRISES,"183,000",Rejected-Technical,01-Sep-2023,Department of Health and Family Welfare||Directorate of Health and Family Welfare||CMO UNA
2023_DFHW_76061_1,HFW-KGR/C/Sani/2023-25/-794-96,Sanitation Servics at CH Jawalamukhi,NIT for Sanitation Services at CH Jawalamukhi,Services,Open Tender,Item Rate,Housekeeping/ Cleaning,No,No,NA ,12-Jul-2023 05:00 PM,18-Jul-2023 11:00 AM ,45.0,No ,No,Both(Online/Offline),27-Jul-2023 11:00 AM,Department of Health and Family Welfare||Directorate of Health and Family Welfare,Sanitation Services at CH Jawalamukhi,176031.0,2.0,"15,00,000",Maharishi Enterprises,"84,446",Rejected-Finance,01-Sep-2023,Department of Health and Family Welfare||Directorate of Health and Family Welfare
2023_DFHW_76064_1,HFW-KGR/C/Sani/2023-25/794-96,Sanitation Services at CH Thural,NIT for Sanitation Services at CH Thural,Services,Open Tender,Item Rate,Housekeeping/ Cleaning,No,No,NA ,12-Jul-2023 05:00 PM,18-Jul-2023 11:00 AM ,45.0,No ,No,Both(Online/Offline),27-Jul-2023 11:00 AM,Department of Health and Family Welfare||Directorate of Health and Family Welfare,Sanitation Services at CH Thural,176107.0,2.0,"15,00,000",Maharishi Enterprises,"84,828",Rejected-AOC,01-Sep-2023,Department of Health and Family Welfare||Directorate of Health and Family Welfare
2023_DFHW_76069_1,HFW-KGR/C/Sani/2023-25/794-96,Sanitation Services at CH Bhawarna,NIT for Sanitation Services at CH Bhawarna,Services,Open Tender,Item Rate,Housekeeping/ Cleaning,No,No,NA ,12-Jul-2023 05:00 PM,18-Jul-2023 11:00 AM ,45.0,No ,No,Both(Online/Offline),27-Jul-2023 11:00 AM,Department of Health and Family Welfare||Directorate of Health and Family Welfare,Sanitation Services at CH Bhawarna,176083.0,2.0,"15,00,000",SHYAMA ENTERPRISES,"71,544.8",Rejected-AOC,01-Sep-2023,Department of Health and Family Welfare||Directorate of Health and Family Welfare
2023_DTE4_75415_1,1764.0,Sanitary Services,Outsourcing Hiring Cleaning Sanitary Services,Services,Open Tender,Item Rate,Housekeeping/ Cleaning,No,No,NA ,24-Jun-2023 10:00 AM,NA ,90.0,No ,No,Offline,17-Jul-2023 11:00 AM,Directorate of Technical Education||ITI||Govt. Model ITI Nalagarh,Govt. Model ITI Nalagarh,174101.0,2.0,,Corporate Care,"141,243",Accepted-AOC,07-Sep-2023,Directorate of Technical Education||ITI||Govt. Model ITI Nalagarh
2023_FD_77284_1,E-Tender/JICA/Vol3/Man Power,RFP for Manpower,RFP proposal for providing Skilled/Non Skilled man power on out Source basis,Services,Open Tender,Percentage,Manpower Supply,No,No,NA ,08-Aug-2023 11:00 AM,26-Aug-2023 11:00 AM ,60.0,No ,No,Offline,11-Sep-2023 11:30 AM,Himachal Pradesh Forest Department||CPD JICA||PMU Shimla,"Summer Hill, Shimla",171005.0,2.0,,M/S PAANKHI,"402,159",Rejected-Finance,23-Sep-2023,Himachal Pradesh Forest Department||CPD JICA||PMU Shimla
2023_HIMUD_71531_1,HIMUDA/ND/CB/e-tender/2021 5090-99 dt 23.03.2023,Housing Colony Basal Solan,Special Repair of Damaged Water Supply Line in Housing Colony Basal Part II Distt Solan HP,Works,Open Tender,Item Rate,Civil Works,No,No,NA ,24-Mar-2023 04:30 PM,NA ,20.0,No ,No,Online,03-Apr-2023 12:00 PM,"Himachal Urban Development Authority||Supdt. Engineer (N),HIMUDA||Executive Engineer Division,Dharamsala,HIMUDA",Solan,173213.0,2.0,"2,35,618",MITHUN KUMAR,"367,200",Accepted-AOC,19-Sep-2023,"Himachal Urban Development Authority||Supdt. Engineer (N),HIMUDA||Executive Engineer Division,Dharamsala,HIMUDA"
2023_HIMUD_73416_1,HIMUDA/ND/CB/e tender/2023-513-22,Depty Commissioner of state Taxes and Excise Department at Nahan,Repair of Residence of the Depty Commissioner of state Taxes and Excise Department at Nahan Distt Sirmour HP SH repair of Toilets and white washing of entire residence complex including internal water supply Sanitary installation,Works,Open Tender,Item Rate,Civil Works,No,No,NA ,19-May-2023 12:35 PM,NA ,20.0,No ,No,Online,26-May-2023 12:00 PM,"Himachal Urban Development Authority||Supdt. Engineer (N),HIMUDA||Executive Engineer Division,Dharamsala,HIMUDA",Nahan,173001.0,2.0,"4,02,054",Ashwani kumar,"301,373.86",Rejected-AOC,19-Sep-2023,"Himachal Urban Development Authority||Supdt. Engineer (N),HIMUDA||Executive Engineer Division,Dharamsala,HIMUDA"
2023_HIMUD_73530_1,HIMUDA/ND/CB/e tender/2021- 513-22 dt. 12.05.2023,Model Central Jail Nahan,"Model Central Jail at Nahan, Distt Sirmour HP SH Providing Retaining Wall in front of D Block",Works,Open Tender,Item Rate,Civil Works,No,No,NA ,18-May-2023 04:30 PM,NA ,20.0,No ,No,Online,26-May-2023 12:00 PM,"Himachal Urban Development Authority||Supdt. Engineer (N),HIMUDA||Executive Engineer Division,Dharamsala,HIMUDA",Nahan,173001.0,2.0,"2,45,961",Ashwani kumar,"177,818.68",Accepted-AOC,19-Sep-2023,"Himachal Urban Development Authority||Supdt. Engineer (N),HIMUDA||Executive Engineer Division,Dharamsala,HIMUDA"
2023_HIMUD_73957_1,HIMUDA/ND/CB/e-Tender/2021 628-37,Housing Colony Devinagar Paonta Sahib,Housing Colony at Paonta Sahib Devi Nagar Distt Sirmour HP SH AR and MO road one fifth of total length of road for the year 2023 24 I e M T,Works,Open Tender,Item Wise,Civil Works,No,No,NA ,26-May-2023 12:50 PM,NA ,20.0,No ,No,Online,06-Jun-2023 12:00 PM,"Himachal Urban Development Authority||Supdt. Engineer (N),HIMUDA||Executive Engineer Division,Dharamsala,HIMUDA",Paonta Sahib,173025.0,2.0,"3,20,036",Bali Ram,"385,158.85",Rejected-AOC,19-Sep-2023,"Himachal Urban Development Authority||Supdt. Engineer (N),HIMUDA||Executive Engineer Division,Dharamsala,HIMUDA"
2023_HIMUD_74726_1,HIMUDA/ND/CB/e-tender/2021- 822-31,State Taxes and Excise Department at Solan,C o Residence Building for H no 58 State Taxes and Excise Department in HC at Solan Ph I Distt Solan HQ SH C O 4 nos type II quarters Ground and fist floor 1 no type IV quarter in top floor with parking floor including Internal Water Supply etc,Works,Open Tender,Item Wise,Civil Works,No,No,NA ,08-Jun-2023 05:00 PM,NA ,30.0,No ,No,Online,19-Jun-2023 12:00 PM,"Himachal Urban Development Authority||Supdt. Engineer (N),HIMUDA||Executive Engineer Division,Dharamsala,HIMUDA",Solan,173211.0,2.0,"1,45,64,149",Yogesh Awasthy,"15,204,899.3",Rejected-AOC,23-Sep-2023,"Himachal Urban Development Authority||Supdt. Engineer (N),HIMUDA||Executive Engineer Division,Dharamsala,HIMUDA"
2023_HIMUD_75255_1,HIMUDA/DD/CB/W-7/1430-54,Construction of Pong View residential Colony at Dehra Distt. Kangra HP,Providing and laying interlocking concrete Block road and construction of drains,Works,Open Tender,Item Rate,Civil Works,No,No,NA ,20-Jun-2023 11:05 AM,22-Jun-2023 12:00 PM ,30.0,No ,No,Online,30-Jun-2023 12:00 PM,"Himachal Urban Development Authority||Supdt. Engineer (N),HIMUDA||Executive Engineer Division,Dharamsala,HIMUDA",Dehra Distt. Kangra,177117.0,2.0,"1,86,18,668",SURESH KUMAR GUPTA,"11,578,536",Not Admitted-Fee/PreQual/Technical,13-Sep-2023,"Himachal Urban Development Authority||Supdt. Engineer (N),HIMUDA||Executive Engineer Division,Dharamsala,HIMUDA"
2023_HIMUD_75825_1,HIMUDA/DD/CB/W-7/1783-99,Construction of Pong View residential Colony at Dehra Distt. Kangra HP,SH Drilling of mini tube well 80 mtrs deep,Works,Open Tender,Item Rate,Civil Works,No,No,NA ,05-Jul-2023 04:00 PM,NA ,30.0,No ,No,Online,15-Jul-2023 12:00 PM,"Himachal Urban Development Authority||Supdt. Engineer (N),HIMUDA||Executive Engineer Division,Dharamsala,HIMUDA",Dehra Distt. Kangra,177117.0,2.0,"8,14,030",ankur mahajan,"755,530",Not Admitted-Fee/PreQual/Technical,19-Sep-2023,"Himachal Urban Development Authority||Supdt. Engineer (N),HIMUDA||Executive Engineer Division,Dharamsala,HIMUDA"
2023_HIMUD_76310_1,HIMUDA-MD-E-155-2023,Construction of Housing Colony at Rajwari Tehsil Balh Distt Mandi HP SH Providing and laying External Water Supply to Housing Colony,Construction of Housing Colony at Rajwari Tehsil Balh Distt Mandi HP SH Providing and laying External Water Supply to Housing Colony,Works,Open Tender,Item Rate,Civil Works,No,No,NA ,17-Jul-2023 04:00 PM,NA ,60.0,No ,No,Online,27-Jul-2023 11:30 AM,"Himachal Urban Development Authority||Supdt. Engineer (N),HIMUDA||Executive Engineer Division,Mandi,HIMUDA",Rajwari,175027.0,2.0,"46,14,214",ANIL KUMAR,"3,169,019.5",Rejected-AOC,05-Sep-2023,"Himachal Urban Development Authority||Supdt. Engineer (N),HIMUDA||Executive Engineer Division,Mandi,HIMUDA"
2023_HIMUD_76726_1,HIMUDA-MD-E-157-2023,Construction of Plant Health Clinic at Kuthera Distt Bilaspur HP including internal water supply and sanitary installation,Construction of Plant Health Clinic at Kuthera Distt Bilaspur HP including internal water supply and sanitary installation,Works,Open Tender,Item Rate,Civil Works,No,No,NA ,25-Jul-2023 04:00 PM,NA ,180.0,No ,No,Online,04-Aug-2023 11:30 AM,"Himachal Urban Development Authority||Supdt. Engineer (N),HIMUDA||Executive Engineer Division,Mandi,HIMUDA",Kuthera,174026.0,2.0,"20,78,349",ANJU DEVI,"1,702,550.8",Rejected-AOC,14-Sep-2023,"Himachal Urban Development Authority||Supdt. Engineer (N),HIMUDA||Executive Engineer Division,Mandi,HIMUDA"
2023_HIMUD_76819_1,NO HIMUDA SD E TENDER 2580-94 DATED 27.07.2023,HIMUDA Head Office building at Nigam Vihar Shimla 171002 SH Replacement roof of old building etc,HIMUDA Head Office building at Nigam Vihar Shimla 171002 SH Replacement roof of old building etc,Works,Open Tender,Item Rate,Civil Works,No,No,NA ,27-Jul-2023 04:00 PM,NA ,30.0,No ,No,Online,03-Aug-2023 02:00 PM,"Himachal Urban Development Authority||Supdt. Engineer (S),HIMUDA||Executive Engineer,Shimla Division-I,HIMUDA",Shimla,171002.0,2.0,"16,74,380",DEVENDER SINGH,"1,421,969.98",Rejected-AOC,11-Sep-2023,"Himachal Urban Development Authority||Supdt. Engineer (S),HIMUDA||Executive Engineer,Shimla Division-I,HIMUDA"
2023_HIMUD_77195_1,HIMUDA/PD/CB/Tndrntc/2023/2678,"C/o PSFS at Dharampur, District Solan (H.P) (Sub Head C/o Main Road from RD 0/0 to 0/1235, C/o Link road from RD 0/1104 ie RD 0/0 to 0/220 (Lane I), C/o Link Road from RD 0/42.50 i.e. RD 0/0 to 0/60 mtr (Lane-II) C/o PCC R/Wall, Developm","C/o PSFS at Dharampur, District Solan (H.P) (Sub Head C/o Main Road from RD 0/0 to 0/1235, C/o Link road from RD 0/1104 ie RD 0/0 to 0/220 (Lane I), C/o Link Road from RD 0/42.50 i.e. RD 0/0 to 0/60 mtr (Lane-II) C/o PCC R/Wall, Developm",Works,Open Tender,Item Rate,Civil Works,No,No,NA ,05-Aug-2023 12:00 PM,NA ,90.0,No ,No,Online,17-Aug-2023 11:30 AM,"Himachal Urban Development Authority||Supdt. Engineer (S),HIMUDA||Executive Engineer,Shimla Division-II,HIMUDA",Dharampur,173209.0,2.0,"5,36,05,627",achievement infrastructure pvt. limited,"37,950,099.12",Accepted-AOC,26-Sep-2023,"Himachal Urban Development Authority||Supdt. Engineer (S),HIMUDA||Executive Engineer,Shimla Division-II,HIMUDA"
2023_HIMUD_77254_1,HIMUDA/ND/CB/e-tender/2023 1619-28,Housing Colony Basal Ph I and II,HC at Basal Ph I and II Solan Distt Solan SH AR and MO External Water and Sewerage System Cleaning of Roads and Paths Septic Tank etc for one year,Works,Open Tender,Item Rate,Civil Works,No,No,NA ,07-Aug-2023 01:00 PM,NA ,20.0,No ,No,Online,14-Aug-2023 12:00 PM,"Himachal Urban Development Authority||Supdt. Engineer (N),HIMUDA||Executive Engineer Division,Dharamsala,HIMUDA",Solan,173211.0,2.0,"5,65,555",MITHUN KUMAR,"709,060",Rejected-AOC,19-Sep-2023,"Himachal Urban Development Authority||Supdt. Engineer (N),HIMUDA||Executive Engineer Division,Dharamsala,HIMUDA"
2023_HIMUD_77258_1,HIMUDA/ND/e-tender/2023 1619-28,Housing Colony Moginand PH I and II,Housing Colony Moginand PH I and II Teshil Nahan Distt Sirmour HP SH AR and MO Sewerage System Cleaning of Roads and Paths Septic Tank etc and External Water Supply for one year,Works,Open Tender,Item Rate,Civil Works,No,No,NA ,07-Aug-2023 01:20 PM,NA ,20.0,No ,No,Online,14-Aug-2023 12:00 PM,"Himachal Urban Development Authority||Supdt. Engineer (N),HIMUDA||Executive Engineer Division,Dharamsala,HIMUDA",Nahan,173001.0,2.0,"6,10,270",SAHIL,"796,600",Rejected-AOC,19-Sep-2023,"Himachal Urban Development Authority||Supdt. Engineer (N),HIMUDA||Executive Engineer Division,Dharamsala,HIMUDA"
2023_HIMUD_77333_1,NO HIMUDA SD E TENDER 2853-63 DATED 05.08.2023,Repair Renovation of AG Pool Staff Quarters 6 and 2 Nos basements 8 Nos flat Block No 8 below BCS Sec V Ph III New Shimla,Repair Renovation of AG Pool Staff Quarters 6 and 2 Nos basements 8 Nos flat Block No 8 below BCS Sec V Ph III New Shimla,Works,Open Tender,Item Rate,Civil Works,No,No,NA ,08-Aug-2023 06:00 PM,NA ,30.0,No ,No,Online,14-Aug-2023 02:00 PM,"Himachal Urban Development Authority||Supdt. Engineer (S),HIMUDA||Executive Engineer,Shimla Division-I,HIMUDA",Shimla,171009.0,2.0,"7,99,120",DALIP SINGH,"564,233.02",Accepted-AOC,02-Sep-2023,"Himachal Urban Development Authority||Supdt. Engineer (S),HIMUDA||Executive Engineer,Shimla Division-I,HIMUDA"
2023_HIMUD_77350_1,HIMUDA-MD-E-159-2023,Govt Sr Sec School Behna Jattan Distt Bilaspur HP SH Construction of Class rooms,Govt Sr Sec School Behna Jattan Distt Bilaspur HP SH Construction of Class rooms,Works,Open Tender,Item Rate,Civil Works,No,No,NA ,09-Aug-2023 04:00 PM,NA ,60.0,No ,No,Online,19-Aug-2023 11:30 AM,"Himachal Urban Development Authority||Supdt. Engineer (N),HIMUDA||Executive Engineer Division,Mandi,HIMUDA",Behna Jattan,174001.0,2.0,"43,09,694",Gaurav Singh,"3,230,442.58",Not Admitted-Fee/PreQual/Technical,14-Sep-2023,"Himachal Urban Development Authority||Supdt. Engineer (N),HIMUDA||Executive Engineer Division,Mandi,HIMUDA"
2023_HIMUD_77401_1,HIMUDA/EDD/W-7/657-66,Construction of building of Integrated Command and Control Centre for Dharamshala Smart City ltd at Dharamshala Distt Kangra,SH Providing installation Testing and Commissioning of 50 KW water proof Solar Panel roof top power plant in built mechanism therein,Works,Open Tender,Item Rate,Electrical Works,No,No,NA ,09-Aug-2023 04:00 PM,NA ,60.0,No ,No,Online,19-Aug-2023 10:00 AM,"Himachal Urban Development Authority||Supdt. Engineer (N),HIMUDA||Executive Engineer Electrical Dn,Dharamsala,HIMUDA",Dharamshala,176215.0,2.0,"36,95,656",Deepak Sood,"3,385,000",Not Admitted-Fee/PreQual/Technical,29-Sep-2023,"Himachal Urban Development Authority||Supdt. Engineer (N),HIMUDA||Executive Engineer Electrical Dn,Dharamsala,HIMUDA"
2023_HIMUD_78108_1,HIMUDA/ND/CB/e-Tender/2022- 1891-1900,Housing Colony at Barity and Rahon Solan,Housing Colony at Barity and Rahon near Solan Distt Solan SH Clearing of Jungal approxmately area 78.50 bighas 65965.00 sqm and marking feasibility,Works,Open Tender,Item Rate,Civil Works,No,No,NA ,29-Aug-2023 12:00 PM,NA ,20.0,No ,No,Online,06-Sep-2023 12:00 PM,"Himachal Urban Development Authority||Supdt. Engineer (N),HIMUDA||Executive Engineer Division,Dharamsala,HIMUDA",Solan,173212.0,2.0,"6,36,449",ajay sharma,"557,895",Accepted-AOC,28-Sep-2023,"Himachal Urban Development Authority||Supdt. Engineer (N),HIMUDA||Executive Engineer Division,Dharamsala,HIMUDA"
2023_HIMUD_78123_1,HIMUDA/ND/CB/e-Tender/2022- 1891-1900,Housing Colony at Moginand,Housing Colony Moginand Phase-I Tehsil Nahan Distt Sirmour HP SH AR and MO one fith of total length of Road for the year 2023-24 i. e MT,Works,Open Tender,Item Rate,Civil Works,No,No,NA ,29-Aug-2023 04:30 PM,NA ,20.0,No ,No,Online,06-Sep-2023 12:00 PM,"Himachal Urban Development Authority||Supdt. Engineer (N),HIMUDA||Executive Engineer Division,Dharamsala,HIMUDA",Nahan,173001.0,2.0,,ajay sharma,"648,147.44",Rejected-AOC,28-Sep-2023,"Himachal Urban Development Authority||Supdt. Engineer (N),HIMUDA||Executive Engineer Division,Dharamsala,HIMUDA"
