Organisation Chain,Tender Reference Number,Tender ID,Withdrawal Allowed,Tender Type,Form of contract,Tender Category,No. of Covers,General Technical Evaluation Allowed,ItemWise Technical Evaluation Allowed,Payment Mode,Is Multi Currency Allowed For BOQ,Is Multi Currency Allowed For Fee,Allow Two Stage Bidding,Cover No,Cover,Document Type,Description,Publish Date,Bid Opening Date,Document Download / Sale Start Date,Document Download / Sale End Date,Clarification Start Date,Clarification End Date,Bid Submission Start Date,Bid Submission End Date,Financial Bid Opening Date,EMD Amount in ₹,EMD Exemption Allowed,EMD Fee Type,EMD Percentage,EMD Payable To,EMD Payable At,S.No,Bank Name,Tender Fee in ₹,Fee Payable To,Fee Payable At,Tender Fee Exemption Allowed,Name,Address,Title,Work Description,Pre Qualification Details,Independent External Monitor/Remarks,Tender Value in ₹,Product Category,Sub category,Contract Type,Bid Validity(Days),Period Of Work(Days),Location,Pincode,Pre Bid Meeting Place,Pre Bid Meeting Address,Pre Bid Meeting Date,Bid Opening Place,Should Allow NDA Tender,Allow Preferential Bidder,Tender Stage
PWD,9605-54,2026_PWD_126193_5,Yes,Open Tender,Percentage,Works,2.0,No,No,Online,No,No,No,1.0,Fee/PreQual/Technical,.pdf,UTR nos of EMD and Cost of Tender Form,19-Jan-2026 06:00 PM,27-Jan-2026 11:00 AM,19-Jan-2026 06:00 PM,27-Jan-2026 10:30 AM,,,19-Jan-2026 06:00 PM,27-Jan-2026 10:30 AM,31-Jan-2026 01:15 PM,"4,100",Yes,fixed,,Nil,Nil,1.0,ICICI BANK,350.0,Nil,Nil,Yes,XEN K L Suman,Executive Engineer NH Division HPPWD Rampur,A.R and M.O on NH.05 Km 236.00 to 368.00 SH.  Construction of V.shape drain at RD 367.1000 to 367.1250,A.R and M.O on NH.05 Km 236.00 to 368.00 SH.  Construction of V.shape drain at RD 367.1000 to 367.1250,Please refer Tender documents.,,"2,04,890",Civil Works - Highways,,Tender,90.0,30.0,Nigulsari,172101.0,,,,EE NH Rampur,No,No,AOC
,,,,,,,,,,,,,,,,.pdf,"Contractors Registration, GST, EPF and PAN",,,,,,,,,,,,,,,,2.0,ICICI NEFT/RTGS,,,,,,,,,,,,,,,,,,,,,,,,,AOC
,,,,,,,,,,,,,,,,.pdf,"EPF, G.S.T. and Income tax clearance certificate.",,,,,,,,,,,,,,,,,,,,,,,,,,,,,,,,,,,,,,,,,,AOC
,,,,,,,,,,,,,,,,.pdf,Affidavit  machinery and all the information should be fill up by the bidder is true and correct,,,,,,,,,,,,,,,,,,,,,,,,,,,,,,,,,,,,,,,,,,AOC
,,,,,,,,,,,,,,,,.pdf,Other documents required as per SBD,,,,,,,,,,,,,,,,,,,,,,,,,,,,,,,,,,,,,,,,,,AOC
,,,,,,,,,,,,,,2.0,Finance,.xls,boq,,,,,,,,,,,,,,,,,,,,,,,,,,,,,,,,,,,,,,,,,,AOC
