Organisation Chain,Tender Reference Number,Tender ID,Withdrawal Allowed,Tender Type,Form of contract,Tender Category,No. of Covers,General Technical Evaluation Allowed,ItemWise Technical Evaluation Allowed,Payment Mode,Is Multi Currency Allowed For BOQ,Is Multi Currency Allowed For Fee,Allow Two Stage Bidding,Cover No,Cover,Document Type,Description,Publish Date,Bid Opening Date,Document Download / Sale Start Date,Document Download / Sale End Date,Clarification Start Date,Clarification End Date,Bid Submission Start Date,Bid Submission End Date,Financial Bid Opening Date,EMD Amount in ₹,EMD Exemption Allowed,EMD Fee Type,EMD Percentage,EMD Payable To,EMD Payable At,S.No,Bank Name,Tender Fee in ₹,Fee Payable To,Fee Payable At,Tender Fee Exemption Allowed,Name,Address,Title,Work Description,Pre Qualification Details,Independent External Monitor/Remarks,Tender Value in ₹,Product Category,Sub category,Contract Type,Bid Validity(Days),Period Of Work(Days),Location,Pincode,Pre Bid Meeting Place,Pre Bid Meeting Address,Pre Bid Meeting Date,Bid Opening Place,Should Allow NDA Tender,Allow Preferential Bidder,Tender Stage
"Himachal Urban Development Authority||Supdt. Engineer (N),HIMUDA||Ghumarwin (Civil)",E-4-2026,2026_HIMUD_125236_1,Yes,Open Tender,Percentage,Works,2.0,No,No,Online,No,No,No,1.0,Fee/PreQual/Technical,.pdf,Contractor Registration  (As mentioned in NIT),07-Jan-2026 04:00 PM,17-Jan-2026 11:30 AM,08-Jan-2026 10:30 AM,16-Jan-2026 05:00 PM,,,08-Jan-2026 10:30 AM,16-Jan-2026 05:00 PM,22-Jan-2026 09:40 AM,"12,910",No,fixed,,Nil,Nil,1.0,ICICI BANK,"1,770",Nil,Nil,No,EE HIMUDA DIVISION GHUMARWIN,EE HIMUDA DIVISION GHUMARWIN,Repair restoration of damages caused by heavy rain fall and flash flood in 2025  SH Co retaining wall on the back side of School building and minor repair work at Marottan Tehsil Jhandutta Distt  Bilaspur HP,Repair restoration of damages caused by heavy rain fall and flash flood in 2025  SH Co retaining wall on the back side of School building and minor repair work at Marottan Tehsil Jhandutta Distt  Bilaspur HP,Please refer tender docuemnts,,"6,45,274",Civil Works,,Tender,60.0,45.0,Marottan,174017.0,,,,EE HIMUDA DIVISION GHUMARWIN,No,No,AOC
,,,,,,,,,,,,,,,,.pdf,GST  Registration and acknowledgement of returns of GST.,,,,,,,,,,,,,,,,2.0,ICICI NEFT/RTGS,,,,,,,,,,,,,,,,,,,,,,,,,AOC
,,,,,,,,,,,,,,,,.pdf,Income tax Return/clearance and PAN and EPF (As mentioned in NIT),,,,,,,,,,,,,,,,,,,,,,,,,,,,,,,,,,,,,,,,,,AOC
,,,,,,,,,,,,,,,,.pdf,Affidavit regarding work in hand as per NIT condition (C ) V.,,,,,,,,,,,,,,,,,,,,,,,,,,,,,,,,,,,,,,,,,,AOC
,,,,,,,,,,,,,,,,.pdf,Detail of Machinery as shown in schedule F of tender form 7/8,,,,,,,,,,,,,,,,,,,,,,,,,,,,,,,,,,,,,,,,,,AOC
,,,,,,,,,,,,,,,,.pdf,Undertaking  as uploaded on the portal and Mobile Number,,,,,,,,,,,,,,,,,,,,,,,,,,,,,,,,,,,,,,,,,,AOC
,,,,,,,,,,,,,,2.0,Finance,.xls,BOQ,,,,,,,,,,,,,,,,,,,,,,,,,,,,,,,,,,,,,,,,,,AOC
