Organisation Chain :,Tender ID :,Tender Ref No :,Tender Title :,Committee Chairperson/Co-ordinator Name :,Committee Chairperson/Co-ordinator Type :,Committee Members :,Updated By :,Updated on :,Document :,S.No,Bid Number,Bidder Name,Awarded Currency,Awarded Value,Contract Date :,Contract Value :,Work Completion Period in days :,Updated By :.1,Updated on :.1,AOC document :,AOC Description :,S.No.1,Bid Number.1,Bidder Name.1,Submitted Date,Status,Remarks,Status Updated On,Type :,Summary :,Updated By :.2,Updated On :,Document :.1,Committee Chairperson/Co-ordinator Name :.1,Committee Chairperson/Co-ordinator Type :.1,Committee Members :.1,Updated By :.3,Updated On :.1,Financial Bid Opening Date:,Document :.2,Type :.1,Summary :.1,Updated By :.4,Updated On :.2,Document :.3,BOQ Comparative Chart :,Tender Stage,Title,Work Description,Pre Qualification Details,Independent External Monitor/Remarks,Tender Value in ₹,Product Category,Sub category,Contract Type,Bid Validity(Days),Period Of Work(Days),Location,Pincode,Pre Bid Meeting Place,Pre Bid Meeting Address,Pre Bid Meeting Date,Bid Opening Place,Should Allow NDA Tender,Allow Preferential Bidder,Cover No,Cover,Document Type,Description,EMD Amount in ₹,EMD Exemption Allowed,EMD Fee Type,EMD Percentage,EMD Payable To,EMD Payable At,Name,Address,Tender Fee in ₹,Fee Payable To,Fee Payable At,Tender Fee Exemption Allowed,Publish Date,Bid Opening Date,Document Download / Sale Start Date,Document Download / Sale End Date,Clarification Start Date,Clarification End Date,Bid Submission Start Date,Bid Submission End Date,Financial Bid Opening Date,S.No,Corrigendum Title,Corrigendum Type,View,Organisation Chain,Tender Reference Number,Tender ID,Withdrawal Allowed,Tender Type,Form of contract,Tender Category,No. of Covers,General Technical Evaluation Allowed,ItemWise Technical Evaluation Allowed,Payment Mode,Is Multi Currency Allowed For BOQ,Is Multi Currency Allowed For Fee,Allow Two Stage Bidding,S.No.1,Instrument Type,Tender Stage
Hp State Cooperative Milk Producers Fed Ltd,2020_MPFL_40699_1,436/PI-8/15-XXIII Sr No. 4,"AUTOMATIC CURD FILLING, PACKING, SEALING UNIT",Managing Director,Internal,"Sr.Manager(Plnats) AC(FA), Manager(Acctts/DDO)",Preeti Arya,23-Oct-2020 01:31 PM,finsummary_60044.pdf (180.45 KB),1.0,180809.0,GOMA ENGINEERING PVT. LTD.,INR,"1,298,000",20-Nov-2020,"INR 1,350,000",120.0,Preeti Arya,28-Nov-2020 05:11 PM,AutomaticcurdfillingSO.pdf (2371.00 KB),"AUTOMATIC CURD FILLING, PACKING, SEALING UNIT",1.0,180605.0,BALAJI PACKAGING SYSTEMS,17-Oct-2020 03:39 PM,Rejected-Finance,Rejected due to highest rate,23-Oct-2020 01:33 PM,Technical,"Pre technical bid summery of Automatic curd filling, packing and sealing unit",Preeti Arya,20-Oct-2020 03:58 PM,technical_60044.pdf,Managing Director,Internal,"Sr.Manager(plants), AC(FA), Manager(Acctts/DDO)",Preeti Arya,20-Oct-2020 04:01 PM,20-Oct-2020 04:05 PM,techsummary_60044.pdf (233.38 KB),Finance,"Pre BOQ summary of Automatic curd filling, packing, Sealing unit",lal mani negi,20-Oct-2020 05:03 PM,finance_60044.pdf,BOQ Comparative Chart,AOC,"AUTOMATIC CURD FILLING, PACKING, SEALING UNIT","AUTOMATIC CURD FILLING, PACKING, SEALING UNIT CAPACITY 2400 CUPS",Please refer Tender documents. ,NA ,"13,50,000",Machineries,NA ,Tender,120.0,120.0,H.P Milkfed Chakkar at Mandi,175021.0,NA ,NA ,NA ,SHIMLA,No ,No,1.0,Fee/PreQual/Technical,.pdf,Whether earnest money uploaded.,"33,750",No,percentage,2.5%,Managing Director,Shimla,Managing Director,H.P Milkfed Totu Shimla,"2,360",Managing Director,Shimla,No,15-Sep-2020 06:15 PM,20-Oct-2020 11:00 AM,15-Sep-2020 06:15 PM,19-Oct-2020 03:00 PM,NA ,NA ,15-Sep-2020 06:15 PM,19-Oct-2020 03:00 PM,20-Oct-2020 04:05 PM,1.0,Date extended,Date,,Hp State Cooperative Milk Producers Fed Ltd,436/PI-8/15-XXIII Sr No. 4,2020_MPFL_40699_1,Yes,Open Tender,Item Rate,Goods,2.0,No,No,Offline,No,No,No,1.0,DD - Demand Draft,AOC
,,,,,,,,,,,,,,,,,,,,,,2.0,180809.0,GOMA ENGINEERING PVT. LTD.,16-Oct-2020 07:28 PM,Accepted-AOC,"Accepted AUTOMATIC CURD FILLING, PACKING, SEALING UNIT",28-Nov-2020 05:14 PM,,,,,,,,,,,,,,,,,,,AOC,,,,,,,,,,,,,,,,,,,,,.pdf,Whether tender document cost uploaded.,,,,,,,,,,,,,,,,,,,,,,,,,,,,,,,,,,,,,,,,,,AOC
,,,,,,,,,,,,,,,,,,,,,,3.0,182997.0,IDMC Limited,19-Oct-2020 02:34 PM,Rejected-Technical,Balance sheet and ITR of last three year is not uploaded by the firm,20-Oct-2020 04:03 PM,,,,,,,,,,,,,,,,,,,AOC,,,,,,,,,,,,,,,,,,,,,.pdf,"Copies of GST, PAN and TAN No., Duly signed and stamp tender document submitted",,,,,,,,,,,,,,,,,,,,,,,,,,,,,,,,,,,,,,,,,,AOC
,,,,,,,,,,,,,,,,,,,,,,4.0,181210.0,PRASANNA PACKAGING MACHINERY PVT LTD,10-Oct-2020 04:11 PM,Rejected-Finance,Rejected due to highest rate,23-Oct-2020 01:33 PM,,,,,,,,,,,,,,,,,,,AOC,,,,,,,,,,,,,,,,,,,,,.pdf,Certificate of principal manufacturer and authorized dealer,,,,,,,,,,,,,,,,,,,,,,,,,,,,,,,,,,,,,,,,,,AOC
,,,,,,,,,,,,,,,,,,,,,,5.0,181064.0,SHANKAR ENTERPRISES,05-Oct-2020 12:09 PM,Rejected-Finance,Rejected due to highest rate,23-Oct-2020 01:33 PM,,,,,,,,,,,,,,,,,,,AOC,,,,,,,,,,,,,,,,,,,,,.pdf,Stock of spare parts(The list should be provided by the bidder.) along with price as on date.,,,,,,,,,,,,,,,,,,,,,,,,,,,,,,,,,,,,,,,,,,AOC
,,,,,,,,,,,,,,,,,,,,,,6.0,182884.0,VED ENGINEERING,19-Oct-2020 12:54 PM,Rejected-Finance,Rejected due to highest rate,23-Oct-2020 01:33 PM,,,,,,,,,,,,,,,,,,,AOC,,,,,,,,,,,,,,,,,,,,,.pdf,The list of suppliers to Co-oprative/dairy/Institution may be enclosed with the offer.,,,,,,,,,,,,,,,,,,,,,,,,,,,,,,,,,,,,,,,,,,AOC
,,,,,,,,,,,,,,,,,,,,,,,,,,,,,,,,,,,,,,,,,,,,,,,AOC,,,,,,,,,,,,,,,,,,,,,.pdf,copies of the proof/balance sheet returns of the last 03 year showing avg. turnover of 3 Crores min.,,,,,,,,,,,,,,,,,,,,,,,,,,,,,,,,,,,,,,,,,,AOC
,,,,,,,,,,,,,,,,,,,,,,,,,,,,,,,,,,,,,,,,,,,,,,,AOC,,,,,,,,,,,,,,,,,,,2.0,Finance,.xls,BOQAUTOMATICCURDFILLING,,,,,,,,,,,,,,,,,,,,,,,,,,,,,,,,,,,,,,,,,,AOC
