Contract Date :,Contract Value :,Work Completion Period in days :,Updated By :,Updated on :,AOC document :,AOC Description :,Committee Chairperson/Co-ordinator Name :,Committee Chairperson/Co-ordinator Type :,Committee Members :,Updated By :.1,Updated on :.1,Document :,Committee Chairperson/Co-ordinator Name :.1,Committee Chairperson/Co-ordinator Type :.1,Committee Members :.1,Updated By :.2,Updated On :,Financial Bid Opening Date:,Document :.1,Organisation Chain :,Tender ID :,Tender Ref No :,Tender Title :,Type :,Summary :,Updated By :.3,Updated On :.1,Document :.2,S.No,Bid Number,Bidder Name,Submitted Date,Status,Remarks,Status Updated On,S.No.1,Bid Number.1,Bidder Name.1,Awarded Currency,Awarded Value,Type :.1,Summary :.1,Updated By :.4,Updated On :.2,Document :.3,BOQ Comparative Chart :,Tender Stage,Tender Fee in ₹,Fee Payable To,Fee Payable At,Tender Fee Exemption Allowed,Cover No,Cover,Document Type,Description,Organisation Chain,Tender Reference Number,Tender ID,Withdrawal Allowed,Tender Type,Form of contract,Tender Category,No. of Covers,General Technical Evaluation Allowed,ItemWise Technical Evaluation Allowed,Payment Mode,Is Multi Currency Allowed For BOQ,Is Multi Currency Allowed For Fee,Allow Two Stage Bidding,Publish Date,Bid Opening Date,Document Download / Sale Start Date,Document Download / Sale End Date,Clarification Start Date,Clarification End Date,Bid Submission Start Date,Bid Submission End Date,Financial Bid Opening Date,Name,Address,S.No,Instrument Type,Title,Work Description,Pre Qualification Details,Independent External Monitor/Remarks,Tender Value in ₹,Product Category,Sub category,Contract Type,Bid Validity(Days),Period Of Work(Days),Location,Pincode,Pre Bid Meeting Place,Pre Bid Meeting Address,Pre Bid Meeting Date,Bid Opening Place,Should Allow NDA Tender,Allow Preferential Bidder,EMD Amount in ₹,EMD Exemption Allowed,EMD Fee Type,EMD Percentage,EMD Payable To,EMD Payable At,S.No.1,Corrigendum Title,Corrigendum Type,View,Tender Stage
02-Nov-2020,"INR 5,145,151",60.0,Ajay Kumar Sharma,02-Nov-2020 05:12 PM,AOC.27.pdf (318.00 KB),Award Letter,EE Chairman,Internal,ACMs,Ajay Kumar Sharma,02-Nov-2020 05:09 PM,finsummary_53549.pdf (86.10 KB),ee,Internal,committeemembers,Raj Kumar,11-May-2020 01:41 PM,11-May-2020 01:45 PM,techsummary_53549.pdf (72.07 KB),PWD,2020_PWD_36304_1,No.PW-NLD-EA-I-Tender Publication/2019-20-17032-36,PR Under AMP for Manjholi Lakhanpur JhiraN ROAD km 00 TO 5 0 Hp 1103 VR11034910,Technical,summary,Raj Kumar,11-May-2020 01:12 PM,technical_53549.pdf,1.0,157509.0,JARNAIL SINGH,04-May-2020 08:20 PM,Rejected-Finance,Non Responsive due to L2 bidder,02-Nov-2020 05:11 PM,1.0,157547.0,lrc builders privated ltd,INR,"4,853,678",Finance,summary,Raj Kumar,11-May-2020 02:46 PM,finance_53549.pdf,BOQ Comparative Chart,AOC,"2,500",EENalgarh,Nalagarh,Yes,1.0,Fee/PreQual/Technical,.pdf,Cost of tender Indicated in Schedule F of Bidding document,PWD,No.PW-NLD-EA-I-Tender Publication/2019-20-17032-36,2020_PWD_36304_1,Yes,Open Tender,Item Rate,Works,2.0,No,No,Offline,No,No,No,16-Mar-2020 05:00 PM,06-May-2020 11:30 AM,16-Mar-2020 05:05 PM,05-May-2020 05:00 PM,NA ,NA ,16-Mar-2020 05:10 PM,05-May-2020 05:00 PM,11-May-2020 01:45 PM,EE Nalagarh,Executive Engineer HPPWD Division Nalagarh HPPWD,1.0,DD - Demand Draft,PR Under AMP for Manjholi Lakhanpur JhiraN ROAD km 00 TO 5 0 Hp 1103 VR11034910,SH PL BC in K.M in KM 0 0 to 5 0,Please refer Tender documents. ,NA ,"51,45,151",Civil Works - Roads,NA ,Tender,90.0,60.0,Nalagarh,174101.0,NA ,NA ,NA ,Nalagarh,No ,No,"84,677",Yes,fixed,,EE Nalagarhr,Nalagarh,1.0,change in submission and opening dates,Date,,AOC
,,,,,,,,,,,,,,,,,,,,,,,,,,,,,2.0,157547.0,lrc builders privated ltd,05-May-2020 11:31 AM,Accepted-AOC,Responsive due to L1 bidder,02-Nov-2020 05:14 PM,,,,,,,,,,,,AOC,,,,,,,.pdf,Earnest Money Indicated in Schedule F of Bidding document,,,,,,,,,,,,,,,,,,,,,,,,,,2.0,FDR - Fixed Deposit,,,,,,,,,,,,,,,,,,,,,,,,,,,,,AOC
,,,,,,,,,,,,,,,,,,,,,,,,,,,,,3.0,157662.0,sujal,05-May-2020 03:42 PM,Rejected-Finance,Non Responsive due to L3 bidder,02-Nov-2020 05:11 PM,,,,,,,,,,,,AOC,,,,,,,.pdf,Contractor Registration Refer Gen. Rules and Direction Sr. No 23 and 26.3,,,,,,,,,,,,,,,,,,,,,,,,,,,,,,,,,,,,,,,,,,,,,,,,,,,,,,,,AOC
,,,,,,,,,,,,,,,,,,,,,,,,,,,,,,,,,,,,,,,,,,,,,,,AOC,,,,,,,.pdf,GST Registration Refer Gen. Rules and Direction Sr. No 21 and 26.4,,,,,,,,,,,,,,,,,,,,,,,,,,,,,,,,,,,,,,,,,,,,,,,,,,,,,,,,AOC
,,,,,,,,,,,,,,,,,,,,,,,,,,,,,,,,,,,,,,,,,,,,,,,AOC,,,,,,,.pdf,Similar work done certificate (As per 6.10 of Schedule F),,,,,,,,,,,,,,,,,,,,,,,,,,,,,,,,,,,,,,,,,,,,,,,,,,,,,,,,AOC
,,,,,,,,,,,,,,,,,,,,,,,,,,,,,,,,,,,,,,,,,,,,,,,AOC,,,,,,,.pdf,List of work in Hand More than two work above 10.00 lacs value for eligibility as per criteria Re,,,,,,,,,,,,,,,,,,,,,,,,,,,,,,,,,,,,,,,,,,,,,,,,,,,,,,,,AOC
,,,,,,,,,,,,,,,,,,,,,,,,,,,,,,,,,,,,,,,,,,,,,,,AOC,,,,,,,.pdf,"Proof of, Mandatory Machinery, Tool and Plant As per Schedule F at Sr. No.6.19.",,,,,,,,,,,,,,,,,,,,,,,,,,,,,,,,,,,,,,,,,,,,,,,,,,,,,,,,AOC
,,,,,,,,,,,,,,,,,,,,,,,,,,,,,,,,,,,,,,,,,,,,,,,AOC,,,,,,,.pdf,Duly filled and signed Form No 8 General Rule and Direction Sr. No 26.7,,,,,,,,,,,,,,,,,,,,,,,,,,,,,,,,,,,,,,,,,,,,,,,,,,,,,,,,AOC
,,,,,,,,,,,,,,,,,,,,,,,,,,,,,,,,,,,,,,,,,,,,,,,AOC,,,,,2.0,Finance,.xls,BOQ,,,,,,,,,,,,,,,,,,,,,,,,,,,,,,,,,,,,,,,,,,,,,,,,,,,,,,,,AOC
