Type :,Summary :,Updated By :,Updated On :,Document :,BOQ Comparative Chart :,Type :.1,Summary :.1,Updated By :.1,Updated On :.1,Document :.1,Contract Date :,Contract Value :,Work Completion Period in days :,Updated By :.2,Updated on :,AOC document :,AOC Description :,Committee Chairperson/Co-ordinator Name :,Committee Chairperson/Co-ordinator Type :,Committee Members :,Updated By :.3,Updated On :.2,Financial Bid Opening Date:,Document :.2,S.No,Bid Number,Bidder Name,Submitted Date,Status,Remarks,Status Updated On,Organisation Chain :,Tender ID :,Tender Ref No :,Tender Title :,S.No.1,Bid Number.1,Bidder Name.1,Awarded Currency,Awarded Value,Committee Chairperson/Co-ordinator Name :.1,Committee Chairperson/Co-ordinator Type :.1,Committee Members :.1,Updated By :.4,Updated on :.1,Document :.3,Publish Date,Bid Opening Date,Document Download / Sale Start Date,Document Download / Sale End Date,Clarification Start Date,Clarification End Date,Bid Submission Start Date,Bid Submission End Date,Financial Bid Opening Date,Organisation Chain,Tender Reference Number,Tender ID,Withdrawal Allowed,Tender Type,Form of contract,Tender Category,No. of Covers,General Technical Evaluation Allowed,ItemWise Technical Evaluation Allowed,Payment Mode,Is Multi Currency Allowed For BOQ,Is Multi Currency Allowed For Fee,Allow Two Stage Bidding,S.No.2,Bank Name,Title,Work Description,Pre Qualification Details,Independent External Monitor/Remarks,Tender Value in ₹,Product Category,Sub category,Contract Type,Bid Validity(Days),Period Of Work(Days),Location,Pincode,Pre Bid Meeting Place,Pre Bid Meeting Address,Pre Bid Meeting Date,Bid Opening Place,Should Allow NDA Tender,Allow Preferential Bidder,Tender Fee in ₹,Fee Payable To,Fee Payable At,Tender Fee Exemption Allowed,EMD Amount in ₹,EMD Exemption Allowed,EMD Fee Type,EMD Percentage,EMD Payable To,EMD Payable At,Name,Address,Cover No,Cover,Document Type,Description
Finance,Financial Bid Opening Summery,Deepak Verma,06-Mar-2024 04:54 PM,,BOQ Comparative Chart,Technical,Technical Evaluation,Deepak Verma,21-Feb-2024 03:33 PM,technical_126781.pdf,06-Mar-2024,"INR 316,167",45.0,Deepak Verma,06-Mar-2024 05:28 PM,Awardjobno38.pdf (5488.00 KB),Award of work,Er. Deepak Verma,Internal,Er. Trilok Sharma (AEE) Sh. Luv Kumar (Supdt. DA),Deepak Verma,21-Feb-2024 03:39 PM,21-Feb-2024 04:00 PM,techsummary_126781.pdf (622.62 KB),1.0,404423.0,Dhiman Enterprises,11-Feb-2024 02:31 PM,Rejected-Finance,Rates on higher side of L 1,06-Mar-2024,HPSEBL||CE(OP) South||SE(OP) Solan||Sr.Xen (E) Baddi,2024_HPSEB_85221_1,HPSEBL/BED/DB-Tender JOB.38,HPSEBL/BED/DB-Tender JOB.38,1.0,404576.0,GLOBAL ENGINEERING,INR,"316,167",Er. Deepak Verma,Internal,Er. Trilok Sharma (AEE) Sh. Luv Kumar (Supdt. DA),Deepak Verma,06-Mar-2024 05:26 PM,finsummary_126781.pdf (714.38 KB),06-Feb-2024 09:00 AM,12-Feb-2024 02:00 PM,06-Feb-2024 09:00 AM,12-Feb-2024 11:00 AM,NA ,NA ,06-Feb-2024 09:00 AM,12-Feb-2024 11:00 AM,21-Feb-2024 04:00 PM,HPSEBL||CE(OP) South||SE(OP) Solan||Sr.Xen (E) Baddi,HPSEBL/BED/DB-Tender JOB.38,2024_HPSEB_85221_1,Yes,Limited,Turn-key,Works,2.0,No,No,Online,No,No,No,1.0,ICICI BANK,HPSEBL/BED/DB-Tender JOB.38,E Tendering on turnkey basis for providing SOP to Tubewell Chakkan at Near Bricks Killan Under Electrical Sub Division HPSEBL Baddi Name of Scheme Deposit work,A Class Electrical License with Chief Electrical Inspector ,NA ,"3,11,495",Electrical Works,"HT Line, 63kva DTR ",Tender,180.0,45.0,Baddi,173205.0,NA ,NA ,NA ,Baddi,No ,No,590.0,Nil,Nil,No,"3,115",No,fixed,,Nil,Nil,Er. Deepak Verma,"Sr. Executive Engineer, Electrical Division, HPSEBL Baddi",1.0,Fee/PreQual/Technical,.pdf,Scanned copy of tender cost and earnest money
,,,,,,,,,,,,,,,,,,,,,,,,,2.0,404576.0,GLOBAL ENGINEERING,12-Feb-2024 12:01 AM,Accepted-AOC,Award of work,06-Mar-2024,,,,,,,,,,,,,,,,,,,,,,,,,,,,,,,,,,,,,,,2.0,ICICI NEFT/RTGS,,,,,,,,,,,,,,,,,,,,,,,,,,,,,,,,,.pdf,A Class Electrical License with Chief Electrical Inspector
,,,,,,,,,,,,,,,,,,,,,,,,,3.0,404212.0,rajinder singh,10-Feb-2024 05:29 PM,Rejected-Finance,Rates on higher side of L 1,06-Mar-2024,,,,,,,,,,,,,,,,,,,,,,,,,,,,,,,,,,,,,,,,,,,,,,,,,,,,,,,,,,,,,,,,,,,,,,,,,.pdf,Bid Capacity/turnover certificate with CA Certified
,,,,,,,,,,,,,,,,,,,,,,,,,,,,,,,,,,,,,,,,,,,,,,,,,,,,,,,,,,,,,,,,,,,,,,,,,,,,,,,,,,,,,,,,,,,,,,,,,,,,,,,,.pdf,GST No
,,,,,,,,,,,,,,,,,,,,,,,,,,,,,,,,,,,,,,,,,,,,,,,,,,,,,,,,,,,,,,,,,,,,,,,,,,,,,,,,,,,,,,,,,,,,,,,,,,,,,,,,.pdf,Pan Card
,,,,,,,,,,,,,,,,,,,,,,,,,,,,,,,,,,,,,,,,,,,,,,,,,,,,,,,,,,,,,,,,,,,,,,,,,,,,,,,,,,,,,,,,,,,,,,,,,,,,,,,,.pdf,Work Done Certificate/Completion Certificate as per SBD Volume I Section III Clause No 1
,,,,,,,,,,,,,,,,,,,,,,,,,,,,,,,,,,,,,,,,,,,,,,,,,,,,,,,,,,,,,,,,,,,,,,,,,,,,,,,,,,,,,,,,,,,,,,,,,,,,,,,,.pdf,Affidavit for Blacklisting/Change of Ownership/Litigation
,,,,,,,,,,,,,,,,,,,,,,,,,,,,,,,,,,,,,,,,,,,,,,,,,,,,,,,,,,,,,,,,,,,,,,,,,,,,,,,,,,,,,,,,,,,,,,,,,,,,,,,,.pdf,Joint Venture if Applicable
,,,,,,,,,,,,,,,,,,,,,,,,,,,,,,,,,,,,,,,,,,,,,,,,,,,,,,,,,,,,,,,,,,,,,,,,,,,,,,,,,,,,,,,,,,,,,,,,,,,,,,2.0,Finance,.xls,BOQ
