Tender Fee in ₹,Fee Payable To,Fee Payable At,Tender Fee Exemption Allowed,Publish Date,Bid Opening Date,Document Download / Sale Start Date,Document Download / Sale End Date,Clarification Start Date,Clarification End Date,Bid Submission Start Date,Bid Submission End Date,Financial Bid Opening Date,EMD Amount in ₹,EMD Exemption Allowed,EMD Fee Type,EMD Percentage,EMD Payable To,EMD Payable At,Name,Address,S.No,Instrument Type,Title,Work Description,Pre Qualification Details,Independent External Monitor/Remarks,Tender Value in ₹,Product Category,Sub category,Contract Type,Bid Validity(Days),Period Of Work(Days),Location,Pincode,Pre Bid Meeting Place,Pre Bid Meeting Address,Pre Bid Meeting Date,Bid Opening Place,Should Allow NDA Tender,Allow Preferential Bidder,Cover No,Cover,Document Type,Description,Organisation Chain,Tender Reference Number,Tender ID,Withdrawal Allowed,Tender Type,Form of contract,Tender Category,No. of Covers,General Technical Evaluation Allowed,ItemWise Technical Evaluation Allowed,Payment Mode,Is Multi Currency Allowed For BOQ,Is Multi Currency Allowed For Fee,Allow Two Stage Bidding,Organisation Chain :,Tender ID :,Tender Ref No :,Tender Title :,Committee Chairperson/Co-ordinator Name :,Committee Chairperson/Co-ordinator Type :,Committee Members :,Updated By :,Updated On :,Financial Bid Opening Date:,Document :,Committee Chairperson/Co-ordinator Name :.1,Committee Chairperson/Co-ordinator Type :.1,Committee Members :.1,Updated By :.1,Updated on :,Document :.1,Contract Date :,Contract Value :,Work Completion Period in days :,Updated By :.2,Updated on :.1,AOC document :,AOC Description :,Type :,Summary :,Updated By :.3,Updated On :.1,Document :.2,BOQ Comparative Chart :,S.No.2,Bid Number,Bidder Name,Awarded Currency,Awarded Value,S.No.1,Bid Number.1,Bidder Name.1,Submitted Date,Status,Remarks,Status Updated On,Type :.1,Summary :.1,Updated By :.4,Updated On :.2,Document :.3
350.0,Executive Engineer R B M C Shimla,shimla,No,07-Dec-2023 03:00 PM,16-Dec-2023 02:00 PM,07-Dec-2023 03:00 PM,15-Dec-2023 05:00 PM,NA ,NA ,07-Dec-2023 03:00 PM,15-Dec-2023 05:00 PM,28-Dec-2023 11:30 AM,"19,500",No,fixed,,Executive Engineer R B M C Shimla,shimla,Executive Engineer R B M C Shimla,Executive Engineer R B M C Shimla,1.0,DD - Demand Draft,Improvement of various places at Ridge Ground in ward No 15 Lower Bazar,Improvement of various places at Ridge Ground in ward No 15 Lower Bazar,Please refer to tender Document ,na ,"9,66,703",Civil Works,NA ,Tender,120.0,60.0,Shimla,171001.0,NA ,NA ,NA ,MC shimla,No ,No,1.0,Fee/PreQual/Technical,.pdf,Cost of form in shape of DD and Earnest money in shape of FDR as per E procurement notice,Municipal Corporation Shimla,2719dated02122023,2023_MC_82367_18,Yes,Open Tender,Item Rate,Works,2.0,No,No,Offline,No,No,No,Municipal Corporation Shimla,2023_MC_82367_18,2719dated02122023,Improvement of various places at Ridge Ground in ward No 15 Lower Bazar,EE,Internal,AO AE,Rajesh Thakur,28-Dec-2023 11:26 AM,28-Dec-2023 11:30 AM,techsummary_122477.pdf (1745.85 KB),EE,Internal,AO AE,Rajesh Thakur,20-Mar-2024 03:07 PM,finsummary_122477.pdf (318.87 KB),20-Mar-2024,"INR 1,034,328.6",60.0,Rajesh Thakur,20-Mar-2024 03:09 PM,2023_MC_82367_18.pdf (973.00 KB),AOC,Finance,BOS,Dinesh Thakur,28-Dec-2023 12:13 PM,finance_122477.pdf,BOQ Comparative Chart,1.0,391056.0,RAMESH KUMAR JAGTA,INR,"924,118",1.0,391056.0,RAMESH KUMAR JAGTA,14-Dec-2023 11:43 AM,Accepted-AOC,Accepted,20-Mar-2024,Technical,BOS,Dinesh Thakur,16-Dec-2023 03:40 PM,technical_122477.pdf
,,,,,,,,,,,,,,,,,,,,,2.0,FDR - Fixed Deposit,,,,,,,,,,,,,,,,,,,,,.pdf,Certificate of registration with HPPWD in appropriate class and latest renewal thereof,,,,,,,,,,,,,,,,,,,,,,,,,,,,,,,,,,,,,,,,,,,,,,,,,,2.0,391013.0,SATISH KUMAR JAGTA,14-Dec-2023 10:47 AM,Rejected-Technical,Rejected,28-Dec-2023,,,,,
,,,,,,,,,,,,,,,,,,,,,,,,,,,,,,,,,,,,,,,,,,,.pdf,Income Tax GST and EPF registration PAN Permanent Account No and GST No,,,,,,,,,,,,,,,,,,,,,,,,,,,,,,,,,,,,,,,,,,,,,,,,,,3.0,391032.0,SUNIL SHARMA,14-Dec-2023 11:11 AM,Rejected-Finance,Rejected,20-Mar-2024,,,,,
,,,,,,,,,,,,,,,,,,,,,,,,,,,,,,,,,,,,,,,,,,,.pdf,Scanned Copy of tender documents i.e. NIT (E-procurement notice) Performa and Form MW-7 duly signed,,,,,,,,,,,,,,,,,,,,,,,,,,,,,,,,,,,,,,,,,,,,,,,,,,4.0,391024.0,suresh jagta,14-Dec-2023 10:58 AM,Rejected-Finance,Rejected,20-Mar-2024,,,,,
,,,,,,,,,,,,,,,,,,,,,,,,,,,,,,,,,,,,,,,,,,,.pdf,Scanned copy of Letter Head with reference to condition No. 11.1,,,,,,,,,,,,,,,,,,,,,,,,,,,,,,,,,,,,,,,,,,,,,,,,,,,,,,,,,,,,,
,,,,,,,,,,,,,,,,,,,,,,,,,,,,,,,,,,,,,,,,,,,.pdf,Scanned copy of Affidavit duly signed with reference to condition No. 11.4,,,,,,,,,,,,,,,,,,,,,,,,,,,,,,,,,,,,,,,,,,,,,,,,,,,,,,,,,,,,,
,,,,,,,,,,,,,,,,,,,,,,,,,,,,,,,,,,,,,,,,,2.0,Finance,.xls,BOQ,,,,,,,,,,,,,,,,,,,,,,,,,,,,,,,,,,,,,,,,,,,,,,,,,,,,,,,,,,,,,
