Cover No,Cover,Document Type,Description,Publish Date,Bid Opening Date,Document Download / Sale Start Date,Document Download / Sale End Date,Clarification Start Date,Clarification End Date,Bid Submission Start Date,Bid Submission End Date,Financial Bid Opening Date,Name,Address,Tender Fee in ₹,Fee Payable To,Fee Payable At,Tender Fee Exemption Allowed,S.No,Bank Name,Title,Work Description,Pre Qualification Details,Independent External Monitor/Remarks,Tender Value in ₹,Product Category,Sub category,Contract Type,Bid Validity(Days),Period Of Work(Days),Location,Pincode,Pre Bid Meeting Place,Pre Bid Meeting Address,Pre Bid Meeting Date,Bid Opening Place,Should Allow NDA Tender,Allow Preferential Bidder,EMD Amount in ₹,EMD Exemption Allowed,EMD Fee Type,EMD Percentage,EMD Payable To,EMD Payable At,Organisation Chain,Tender Reference Number,Tender ID,Withdrawal Allowed,Tender Type,Form of contract,Tender Category,No. of Covers,General Technical Evaluation Allowed,ItemWise Technical Evaluation Allowed,Payment Mode,Is Multi Currency Allowed For BOQ,Is Multi Currency Allowed For Fee,Allow Two Stage Bidding,S.No.2,Bid Number,Bidder Name,Submitted Date,Status,Remarks,Status Updated On,Committee Chairperson/Co-ordinator Name :,Committee Chairperson/Co-ordinator Type :,Committee Members :,Updated By :,Updated On :,Financial Bid Opening Date:,Document :,Contract Date :,Contract Value :,Work Completion Period in days :,Updated By :.1,Updated on :,AOC document :,AOC Description :,Type :,Summary :,Updated By :.2,Updated On :.1,Document :.1,Type :.1,Summary :.1,Updated By :.3,Updated On :.2,Document :.2,BOQ Comparative Chart :,Committee Chairperson/Co-ordinator Name :.1,Committee Chairperson/Co-ordinator Type :.1,Committee Members :.1,Updated By :.4,Updated on :.1,Document :.3,Organisation Chain :,Tender ID :,Tender Ref No :,Tender Title :,S.No.1,Bid Number.1,Bidder Name.1,Awarded Currency,Awarded Value
1.0,Fee/PreQual/Technical,.pdf,Tender Fee and Earnest Money Deposit,26-Feb-2024 12:10 PM,02-Mar-2024 01:00 PM,26-Feb-2024 12:20 PM,02-Mar-2024 12:20 PM,NA ,NA ,26-Feb-2024 12:20 PM,02-Mar-2024 12:20 PM,07-Mar-2024 12:40 PM,Resident Engineer,"Bhaba Power House Division, HPSEBL, Bhabanagar",590.0,Nil,Nil,No,1.0,ICICI BANK,Repair of Water level telemetry system nd other works at BAP BAP Power House,"Repair of water level telemetry system, providing and replacement of OPU solenoid valves, indication lamps, faulty pressure gauges of DE NDE side, PT100 RTDs Orings brake pads of turbine assembly, AC DC to DC Converters, cooling water filter for",Please refer Tender documents. ,NA ,"4,83,800",Repair and Maintenance Works,NA ,Tender,120.0,45.0,BAP Kafnu Power House,172118.0,NA ,NA ,NA ,Bhaba,No ,No,"4,840",No,fixed,,Nil,Nil,"HPSEBL||CE(Gen) Sundernagar||SE(Gen) Bhaba Nagar||RE,Bhaba, PH",BPHD/2023-24-23,2024_HPSEB_87131_1,Yes,Limited,Item Rate,Works,2.0,No,No,Online,No,No,No,1.0,413069.0,Bhim Sain Negi,29-Feb-2024 05:16 PM,Rejected-AOC,Higher rates,16-Mar-2024,Er. Kehar Singh Kashyap,Internal,"RE, AE, JOA",Kehar Singh,07-Mar-2024 12:38 PM,07-Mar-2024 12:40 PM,techsummary_129547.pdf (294.24 KB),15-Mar-2024,"INR 482,549.2",45.0,Kehar Singh,16-Mar-2024 04:59 PM,AOCtelemetryswitch.pdf (1576.00 KB),Award of Contract,Technical,Techical Bid Opening Summary,Kehar Singh,07-Mar-2024 12:34 PM,technical_129547.pdf,Finance,Financial Bid Opening Summary,Kehar Singh,07-Mar-2024 01:21 PM,finance_129547.pdf,BOQ Comparative Chart,Er. Kehar Singh Kashyap,Internal,"RE,AE, JOA",Kehar Singh,07-Mar-2024 01:32 PM,finsummary_129547.pdf (263.43 KB),"HPSEBL||CE(Gen) Sundernagar||SE(Gen) Bhaba Nagar||RE,Bhaba, PH",2024_HPSEB_87131_1,BPHD/2023-24-23,Repair of Water level telemetry system nd other works at BAP BAP Power House,1.0,413082.0,Nitin Krate,INR,"482,549.2"
,,.pdf,Certificate of Non-Blacklisting,,,,,,,,,,,,,,,,2.0,ICICI NEFT/RTGS,,,,,,,,,,,,,,,,,,,,,,,,,,,,,,,,,,,,,,,2.0,413082.0,Nitin Krate,29-Feb-2024 05:34 PM,Accepted-AOC,Lowest rates,16-Mar-2024,,,,,,,,,,,,,,,,,,,,,,,,,,,,,,,,,,,,,,,,
,,.pdf,GST Registration and Income Tax Return,,,,,,,,,,,,,,,,,,,,,,,,,,,,,,,,,,,,,,,,,,,,,,,,,,,,,,,,3.0,413127.0,Sanjeev kumar,29-Feb-2024 08:09 PM,Rejected-AOC,Higher rates,16-Mar-2024,,,,,,,,,,,,,,,,,,,,,,,,,,,,,,,,,,,,,,,,
,,.pdf,Other Documents for technocommericial qualification as per SBD,,,,,,,,,,,,,,,,,,,,,,,,,,,,,,,,,,,,,,,,,,,,,,,,,,,,,,,,,,,,,,,,,,,,,,,,,,,,,,,,,,,,,,,,,,,,,,,,,,,,,,
2.0,Finance,.xls,Financial Bid,,,,,,,,,,,,,,,,,,,,,,,,,,,,,,,,,,,,,,,,,,,,,,,,,,,,,,,,,,,,,,,,,,,,,,,,,,,,,,,,,,,,,,,,,,,,,,,,,,,,,,
