Organisation Chain,Tender Reference Number,Tender ID,Withdrawal Allowed,Tender Type,Form of contract,Tender Category,No. of Covers,General Technical Evaluation Allowed,ItemWise Technical Evaluation Allowed,Payment Mode,Is Multi Currency Allowed For BOQ,Is Multi Currency Allowed For Fee,Allow Two Stage Bidding,Publish Date,Bid Opening Date,Document Download / Sale Start Date,Document Download / Sale End Date,Clarification Start Date,Clarification End Date,Bid Submission Start Date,Bid Submission End Date,Financial Bid Opening Date,S.No,Instrument Type,Tender Fee in ₹,Fee Payable To,Fee Payable At,Tender Fee Exemption Allowed,EMD Amount in ₹,EMD Exemption Allowed,EMD Fee Type,EMD Percentage,EMD Payable To,EMD Payable At,Cover No,Cover,Document Type,Description,Title,Work Description,Pre Qualification Details,Independent External Monitor/Remarks,Tender Value in ₹,Product Category,Sub category,Contract Type,Bid Validity(Days),Period Of Work(Days),Location,Pincode,Pre Bid Meeting Place,Pre Bid Meeting Address,Pre Bid Meeting Date,Bid Opening Place,Should Allow NDA Tender,Allow Preferential Bidder,Name,Address,Tender Stage,Type :,Summary :,Updated By :,Updated On :,Document :,BOQ Comparative Chart :,S.No,Bid Number,Bidder Name,Awarded Currency,Awarded Value,S.No.1,Bid Number.1,Bidder Name.1,Submitted Date,Status,Remarks,Status Updated On,Type :.1,Summary :.1,Updated By :.1,Updated On :.1,Document :.1,Committee Chairperson/Co-ordinator Name :,Committee Chairperson/Co-ordinator Type :,Committee Members :,Updated By :.2,Updated On :.2,Financial Bid Opening Date:,Document :.2,Organisation Chain :,Tender ID :,Tender Ref No :,Tender Title :,Contract Date :,Contract Value :,Work Completion Period in days :,Updated By :.3,Updated on :,AOC document :,AOC Description :,Committee Chairperson/Co-ordinator Name :.1,Committee Chairperson/Co-ordinator Type :.1,Committee Members :.1,Updated By :.4,Updated on :.1,Document :.3,Tender Stage
PWD,Job 9 Periodical maintenance of Gondpur turf Jaic,2020_PWD_35399_1,Yes,Open Tender,Item Rate,Works,2.0,No,No,Offline,No,No,No,24-Feb-2020 10:00 AM,29-Feb-2020 03:00 PM,24-Feb-2020 10:30 AM,29-Feb-2020 12:00 PM,NA ,NA ,24-Feb-2020 10:30 AM,29-Feb-2020 12:00 PM,12-Mar-2020 02:00 PM,1.0,FDR - Fixed Deposit,500.0,"Executive Engineer, Una Division, HPPWD, Una",Una,No,"33,600",No,fixed,,"Executive Engineer, Una Division, HPPWD, Una",Una,1.0,Fee/PreQual/Technical,.pdf,Cost of Tender ( Indicated in Schedule F),"Job 9 Periodical maintenance of Gondpur turf Jaichand to Haleran road km.0-0 to 0-500 Sub Head Patch work , 30mm thick bituminous concrete,zebra crossing in km. 0-0 to 0-500 VR137 , Link road Chetran Umrali via Laluwal","Job 9 Periodical maintenance of Gondpur turf Jaichand to Haleran road km.0-0 to 0-500 Sub Head Patch work , 30mm thick bituminous concrete,zebra crossing in km. 0-0 to 0-500 VR137 , Link road Chetran Umrali via Laluwal",Please refer to Bidding Documents ,NA ,"17,33,894",Civil Works - Roads,NA ,Tender,120.0,30.0,Una,174303.0,NA ,NA ,NA ,"Executive Engineer, Una Division, HPPWD, Una",No ,No,"Executive Engineer, Una Division, HPPWD, Una","Executive Engineer, Una Division, HPPWD, Una",AOC,Finance,Proceedingregardingopeningoffinancialbids,Ravi Dutt Sharma,14-Mar-2020 05:28 PM,finance_52014.pdf,BOQ Comparative Chart,1.0,151713.0,bakshiram govt contractor,INR,"2,107,830",1.0,151713.0,bakshiram govt contractor,28-Feb-2020 02:59 PM,Accepted-AOC,ok,17-May-2020 05:09 PM,Technical,TechnicalBidOpeningSummary,Bhupinder Singh,11-Mar-2020 03:47 PM,technical_52014.pdf,Er. B.S. Dehal E.E.,Internal,"Er. Kuldeep Singh AE to EE R.D. Sharma AE Harish Chander Head Draughtsman , Jagpal Singh Supdt. Gr-II Tara Singh Senior Assistant , Prem Chand, Sr. Assistant",Bhupinder Singh,11-Mar-2020 04:26 PM,12-Mar-2020 02:00 PM,techsummary_52014.pdf (855.42 KB),PWD,2020_PWD_35399_1,Job 9 Periodical maintenance of Gondpur turf Jaic,"Job 9 Periodical maintenance of Gondpur turf Jaichand to Haleran road km.0-0 to 0-500 Sub Head Patch work , 30mm thick bituminous concrete,zebra crossing in km. 0-0 to 0-500 VR137 , Link road Chetran Umrali via Laluwal",15-May-2020,"INR 1,733,894",30.0,Ravi Dutt Sharma,17-May-2020 05:09 PM,Awardletter.PDF (1644.00 KB),Awardletter,Er. B.S. Dehal E.E.,Internal,"Er. Kuldeep Singh AE to EE R.D. Sharma AE Harish Chander Head Draughtsman , Jagpal Singh Supdt. Gr-II Tara Singh Senior Assistant , Prem Chand, Sr. Assistant",Ravi Dutt Sharma,14-Mar-2020 05:54 PM,finsummary_52014.pdf (668.65 KB),AOC
,,,,,,,,,,,,,,,,,,,,,,,,,,,,,,,,,,,,,.pdf,Earnest Money ( Indicated In Schedule F),,,,,,,,,,,,,,,,,,,,,AOC,,,,,,,,,,,,2.0,151711.0,DCC BUILDCON PVT. LTD.,29-Feb-2020 09:49 AM,Rejected-Technical,As per Technical Bid Evaluation Proceeding,11-Mar-2020 04:26 PM,,,,,,,,,,,,,,,,,,,,,,,,,,,,,,AOC
,,,,,,,,,,,,,,,,,,,,,,,,,,,,,,,,,,,,,.pdf,Contractors Registration (Refer General Rule No.23 ),,,,,,,,,,,,,,,,,,,,,AOC,,,,,,,,,,,,,,,,,,,,,,,,,,,,,,,,,,,,,,,,,,,,,,,,AOC
,,,,,,,,,,,,,,,,,,,,,,,,,,,,,,,,,,,,,.pdf,G.S.T. No. and copy of the latest return filed.,,,,,,,,,,,,,,,,,,,,,AOC,,,,,,,,,,,,,,,,,,,,,,,,,,,,,,,,,,,,,,,,,,,,,,,,AOC
,,,,,,,,,,,,,,,,,,,,,,,,,,,,,,,,,,,,,.pdf,E.P.F. No. and copy of latest return filed,,,,,,,,,,,,,,,,,,,,,AOC,,,,,,,,,,,,,,,,,,,,,,,,,,,,,,,,,,,,,,,,,,,,,,,,AOC
,,,,,,,,,,,,,,,,,,,,,,,,,,,,,,,,,,,,,.pdf,"Work Done Certificate duly issued by the Engineer-in-Charge, not below the rank of an E.E or equival",,,,,,,,,,,,,,,,,,,,,AOC,,,,,,,,,,,,,,,,,,,,,,,,,,,,,,,,,,,,,,,,,,,,,,,,AOC
,,,,,,,,,,,,,,,,,,,,,,,,,,,,,,,,,,,,,.pdf,"Work in hand certificate duly issued by the Engineer-in-Charge, not below the rank of an E.E or equi",,,,,,,,,,,,,,,,,,,,,AOC,,,,,,,,,,,,,,,,,,,,,,,,,,,,,,,,,,,,,,,,,,,,,,,,AOC
,,,,,,,,,,,,,,,,,,,,,,,,,,,,,,,,,,,,,.pdf,An Affidavit of Machinery Tool Plant as per bid documents along with documentary proof.,,,,,,,,,,,,,,,,,,,,,AOC,,,,,,,,,,,,,,,,,,,,,,,,,,,,,,,,,,,,,,,,,,,,,,,,AOC
,,,,,,,,,,,,,,,,,,,,,,,,,,,,,,,,,,,,,.pdf,An Affidavit of Both Gazetted and non-Gazetted officer HPPWD employees related to him (General Rule,,,,,,,,,,,,,,,,,,,,,AOC,,,,,,,,,,,,,,,,,,,,,,,,,,,,,,,,,,,,,,,,,,,,,,,,AOC
,,,,,,,,,,,,,,,,,,,,,,,,,,,,,,,,,,,,,.pdf,An affidavit that information furnished with the bid (Name of works is correct in all respect).,,,,,,,,,,,,,,,,,,,,,AOC,,,,,,,,,,,,,,,,,,,,,,,,,,,,,,,,,,,,,,,,,,,,,,,,AOC
,,,,,,,,,,,,,,,,,,,,,,,,,,,,,,,,,,,,,.pdf,An affidavit showing that the site has been visited by the contractors/ firms and he has studies as,,,,,,,,,,,,,,,,,,,,,AOC,,,,,,,,,,,,,,,,,,,,,,,,,,,,,,,,,,,,,,,,,,,,,,,,AOC
,,,,,,,,,,,,,,,,,,,,,,,,,,,,,,,,,,,,,.pdf,An Affidavit regarding no litigation with the department,,,,,,,,,,,,,,,,,,,,,AOC,,,,,,,,,,,,,,,,,,,,,,,,,,,,,,,,,,,,,,,,,,,,,,,,AOC
,,,,,,,,,,,,,,,,,,,,,,,,,,,,,,,,,,,2.0,Finance,.xls,BOQ,,,,,,,,,,,,,,,,,,,,,AOC,,,,,,,,,,,,,,,,,,,,,,,,,,,,,,,,,,,,,,,,,,,,,,,,AOC
