S.No,Bid Number,Bidder Name,Awarded Currency,Awarded Value,S.No.1,Bid Number.1,Bidder Name.1,Submitted Date,Status,Remarks,Status Updated On,Committee Chairperson/Co-ordinator Name :,Committee Chairperson/Co-ordinator Type :,Committee Members :,Updated By :,Updated on :,Document :,Contract Date :,Contract Value :,Work Completion Period in days :,Updated By :.1,Updated on :.1,AOC document :,AOC Description :,Type :,Summary :,Updated By :.2,Updated On :,Document :.1,BOQ Comparative Chart :,Organisation Chain :,Tender ID :,Tender Ref No :,Tender Title :,Committee Chairperson/Co-ordinator Name :.1,Committee Chairperson/Co-ordinator Type :.1,Committee Members :.1,Updated By :.3,Updated On :.1,Document :.2,Tender Stage,S.No,Instrument Type,Title,Work Description,Pre Qualification Details,Independent External Monitor/Remarks,Tender Value in ₹,Product Category,Sub category,Contract Type,Bid Validity(Days),Period Of Work(Days),Location,Pincode,Pre Bid Meeting Place,Pre Bid Meeting Address,Pre Bid Meeting Date,Bid Opening Place,Should Allow NDA Tender,Allow Preferential Bidder,Publish Date,Bid Opening Date,Document Download / Sale Start Date,Document Download / Sale End Date,Clarification Start Date,Clarification End Date,Bid Submission Start Date,Bid Submission End Date,Tender Fee in ₹,Fee Payable To,Fee Payable At,Tender Fee Exemption Allowed,Cover No,Cover,Document Type,Description,EMD Amount in ₹,EMD Exemption Allowed,EMD Fee Type,EMD Percentage,EMD Payable To,EMD Payable At,Name,Address,Organisation Chain,Tender Reference Number,Tender ID,Withdrawal Allowed,Tender Type,Form of contract,Tender Category,No. of Covers,General Technical Evaluation Allowed,ItemWise Technical Evaluation Allowed,Payment Mode,Is Multi Currency Allowed For BOQ,Is Multi Currency Allowed For Fee,Allow Two Stage Bidding,Tender Stage
1.0,158098.0,Hemraj Verma,INR,"711,900",1.0,158098.0,Hemraj Verma,11-May-2020 11:33 AM,Accepted-AOC,Lowest,22-May-2020 03:02 PM,Divisional Manager,Internal,OM and Incharge Works,Krishan Bhag Negi,20-May-2020 12:58 PM,finsummary_54509.pdf (155.30 KB),22-May-2020,"INR 711,900",209.0,Krishan Bhag Negi,22-May-2020 03:02 PM,AOC.pdf (201.00 KB),Work allotted to Hem Raj Verma,Finance,Lowest rate quoted by Hem Raj Verma,Krishan Bhag Negi,20-May-2020 12:56 PM,finance_54509.pdf,BOQ Comparative Chart,"HP State Forest Development Corporation||Director south ,FDC,HP||DM,Rampur,Director South,FDC,HP",2020_FDC_36941_1,No.59-83 dated 04.05.2020,Lot No.01-2020 Ani Extraction and carriage of Resin upto RSD KazuKhad Averi and further TT to R and T Factory Nahan,Divisional Manager,Internal,OM and IC Works,Krishan Bhag Negi,20-May-2020 12:57 PM,techsummary_54509.pdf (155.30 KB),AOC,1.0,FDR - Fixed Deposit,Lot No.01-2020 Ani Extraction and carriage of Resin upto RSD KazuKhad Averi and further TT to R and T Factory Nahan,Extraction and Carriage of Resin,Please refer Tender documents. ,NA ,"7,01,903",Composite Works,NA ,Tender,45.0,209.0,Arsu Range,172002.0,NA ,NA ,NA ,FWD Rampur,No ,No,04-May-2020 02:00 PM,11-May-2020 02:30 PM,05-May-2020 10:00 AM,11-May-2020 02:00 PM,NA ,NA ,05-May-2020 10:00 AM,11-May-2020 02:00 PM,672.0,DM FWD Rampur,Rampur,Yes,1.0,Fee/PreQual/Technical/Finance,.pdf,Cost of tender form,"75,000",Yes,fixed,,DM FWD Rampur,Rampur,Divisional Manager,Forest Working Division Rampur,"HP State Forest Development Corporation||Director south ,FDC,HP||DM,Rampur,Director South,FDC,HP",No.59-83 dated 04.05.2020,2020_FDC_36941_1,Yes,Open Tender,Fixed-rate,Works,1.0,No,No,Offline,No,No,No,AOC
,,,,,,,,,,,,,,,,,,,,,,,,,,,,,,,,,,,,,,,,,AOC,,,,,,,,,,,,,,,,,,,,,,,,,,,,,,,,,,,.pdf,Earnest Money,,,,,,,,,,,,,,,,,,,,,,,AOC
,,,,,,,,,,,,,,,,,,,,,,,,,,,,,,,,,,,,,,,,,AOC,,,,,,,,,,,,,,,,,,,,,,,,,,,,,,,,,,,.pdf,Copy of Registration no,,,,,,,,,,,,,,,,,,,,,,,AOC
,,,,,,,,,,,,,,,,,,,,,,,,,,,,,,,,,,,,,,,,,AOC,,,,,,,,,,,,,,,,,,,,,,,,,,,,,,,,,,,.pdf,Copy of GST No,,,,,,,,,,,,,,,,,,,,,,,AOC
,,,,,,,,,,,,,,,,,,,,,,,,,,,,,,,,,,,,,,,,,AOC,,,,,,,,,,,,,,,,,,,,,,,,,,,,,,,,,,,.xls,BOQ tender form,,,,,,,,,,,,,,,,,,,,,,,AOC
