Type :,Summary :,Updated By :,Updated On :,Document :,BOQ Comparative Chart :,S.No,Bid Number,Bidder Name,Awarded Currency,Awarded Value,Type :.1,Summary :.1,Updated By :.1,Updated On :.1,Document :.1,S.No.1,Bid Number.1,Bidder Name.1,Submitted Date,Status,Remarks,Status Updated On,Contract Date :,Contract Value :,Work Completion Period in days :,Updated By :.2,Updated on :,AOC document :,AOC Description :,Committee Chairperson/Co-ordinator Name :,Committee Chairperson/Co-ordinator Type :,Committee Members :,Updated By :.3,Updated on :.1,Document :.2,Committee Chairperson/Co-ordinator Name :.1,Committee Chairperson/Co-ordinator Type :.1,Committee Members :.1,Updated By :.4,Updated On :.2,Financial Bid Opening Date:,Document :.3,Organisation Chain :,Tender ID :,Tender Ref No :,Tender Title :,Tender Stage,Tender Fee in ₹,Fee Payable To,Fee Payable At,Tender Fee Exemption Allowed,Name,Address,Title,Work Description,Pre Qualification Details,Independent External Monitor/Remarks,Tender Value in ₹,Product Category,Sub category,Contract Type,Bid Validity(Days),Period Of Work(Days),Location,Pincode,Pre Bid Meeting Place,Pre Bid Meeting Address,Pre Bid Meeting Date,Bid Opening Place,Should Allow NDA Tender,Allow Preferential Bidder,Cover No,Cover,Document Type,Description,EMD Amount in ₹,EMD Exemption Allowed,EMD Fee Type,EMD Percentage,EMD Payable To,EMD Payable At,S.No,Instrument Type,Organisation Chain,Tender Reference Number,Tender ID,Withdrawal Allowed,Tender Type,Form of contract,Tender Category,No. of Covers,General Technical Evaluation Allowed,ItemWise Technical Evaluation Allowed,Payment Mode,Is Multi Currency Allowed For BOQ,Is Multi Currency Allowed For Fee,Allow Two Stage Bidding,Publish Date,Bid Opening Date,Document Download / Sale Start Date,Document Download / Sale End Date,Clarification Start Date,Clarification End Date,Bid Submission Start Date,Bid Submission End Date,Financial Bid Opening Date,Tender Stage
Finance,Financial Bid Open Summary,Atma Ram Kalia,16-Nov-2019 11:10 AM,finance_46494.pdf,BOQ Comparative Chart,1.0,135875.0,M/s Geeta Ram Subhash Chand garg,INR,"1,078,807",Technical,Technical Bid Open Summary,Vishwa Nath Prasher,14-Nov-2019 01:36 PM,technical_46494.pdf,1.0,135875.0,M/s Geeta Ram Subhash Chand garg,08-Nov-2019 10:06 AM,Accepted-AOC,Due to L1,08-Mar-2020 03:33 PM,08-Mar-2020,"INR 888,354",90.0,Vishwa Nath Prasher,08-Mar-2020 03:33 PM,agreement253.PDF (1598.00 KB),Award Letter,Executive Engineer,Internal,SUPDT HDM AETOEE,Atma Ram Kalia,16-Nov-2019 11:11 AM,finsummary_46494.pdf (491.75 KB),Executive Engineer,Internal,SUPDT HDM AETOEE,Vishwa Nath Prasher,14-Nov-2019 01:39 PM,14-Nov-2019 02:00 PM,techsummary_46494.pdf (1394.03 KB),PWD,2019_PWD_32330_3,PW-NBT/CB/Tender/2018/10045-48 dated 28.09.2019,Performance based financial incentive scheme for 2018-2019 (during the year 2019-20) for periodic Maintenance etc. of PMGSY Rural Road to Village Ree km. 0/0 to 2/510,AOC,350.0,EE Bilaspur Division No. 2 HPPWD Bilaspur,Bilaspur,No,EE Bilaspur Division No. 2 HPPWD Bilaspur,EE Bilaspur Division No. 2 HPPWD Bilaspur,Performance based financial incentive scheme for 2018-2019 (during the year 2019-20) for periodic Maintenance etc. of PMGSY Rural Road to Village Ree km. 0/0 to 2/510,Providing and laying 25mm thick bituminous concrete 1/0 to 1/700 and 2/0 to 2/510(VR-037).,refer in SBD ,NA ,"8,88,354",Civil Works,NA ,Tender,120.0,90.0,Bilaspur,174001.0,NA ,NA ,NA ,EE Bilaspur Division No. 2 HPPWD Bilaspur,No ,No,1.0,Fee/PreQual/Technical,.pdf,Cost of Tender and Earnest Money refer in Schedule F,"18,000",No,fixed,,EE Bilaspur Division No. 2 HPPWD Bilaspur,Bilaspur,1.0,DD - Demand Draft,PWD,PW-NBT/CB/Tender/2018/10045-48 dated 28.09.2019,2019_PWD_32330_3,Yes,Open Tender,Item Rate,Works,2.0,No,No,Offline,No,No,No,29-Oct-2019 10:00 AM,08-Nov-2019 11:30 AM,29-Oct-2019 10:00 AM,08-Nov-2019 10:30 AM,NA ,NA ,29-Oct-2019 10:00 AM,08-Nov-2019 10:30 AM,14-Nov-2019 02:00 PM,AOC
,,,,,,,,,,,,,,,,2.0,135825.0,Ravinder Kumar Gupta,07-Nov-2019 02:28 PM,Rejected-Finance,Due to L2,16-Nov-2019 11:11 AM,,,,,,,,,,,,,,,,,,,,,,,,,AOC,,,,,,,,,,,,,,,,,,,,,,,,,,,.pdf,Contractor Registration refer General rule No 23,,,,,,,2.0,FDR - Fixed Deposit,,,,,,,,,,,,,,,,,,,,,,,,AOC
,,,,,,,,,,,,,,,,,,,,,,,,,,,,,,,,,,,,,,,,,,,,,,,AOC,,,,,,,,,,,,,,,,,,,,,,,,,,,.pdf,"GST, PAN and EPF refer General rule No 21",,,,,,,,,,,,,,,,,,,,,,,,,,,,,,,,AOC
,,,,,,,,,,,,,,,,,,,,,,,,,,,,,,,,,,,,,,,,,,,,,,,AOC,,,,,,,,,,,,,,,,,,,,,,,,,,,.pdf,"List of machinery, Tool, Plant refer in Schedule F with reference to clause 18",,,,,,,,,,,,,,,,,,,,,,,,,,,,,,,,AOC
,,,,,,,,,,,,,,,,,,,,,,,,,,,,,,,,,,,,,,,,,,,,,,,AOC,,,,,,,,,,,,,,,,,,,,,,,,,,,.pdf,Affidavit of Correctness of all documents by bidder,,,,,,,,,,,,,,,,,,,,,,,,,,,,,,,,AOC
,,,,,,,,,,,,,,,,,,,,,,,,,,,,,,,,,,,,,,,,,,,,,,,AOC,,,,,,,,,,,,,,,,,,,,,,,,,,,.pdf,Form No 8,,,,,,,,,,,,,,,,,,,,,,,,,,,,,,,,AOC
,,,,,,,,,,,,,,,,,,,,,,,,,,,,,,,,,,,,,,,,,,,,,,,AOC,,,,,,,,,,,,,,,,,,,,,,,,,,,.pdf,Work done certificate and work in hand certificate refer General rule No 19,,,,,,,,,,,,,,,,,,,,,,,,,,,,,,,,AOC
,,,,,,,,,,,,,,,,,,,,,,,,,,,,,,,,,,,,,,,,,,,,,,,AOC,,,,,,,,,,,,,,,,,,,,,,,,,2.0,Finance,.xls,BOQ,,,,,,,,,,,,,,,,,,,,,,,,,,,,,,,,AOC
