Organisation Chain,Tender Reference Number,Tender ID,Withdrawal Allowed,Tender Type,Form of contract,Tender Category,No. of Covers,General Technical Evaluation Allowed,ItemWise Technical Evaluation Allowed,Payment Mode,Is Multi Currency Allowed For BOQ,Is Multi Currency Allowed For Fee,Allow Two Stage Bidding,Cover No,Cover,Document Type,Description,Publish Date,Bid Opening Date,Document Download / Sale Start Date,Document Download / Sale End Date,Clarification Start Date,Clarification End Date,Bid Submission Start Date,Bid Submission End Date,Financial Bid Opening Date,EMD Amount in ₹,EMD Exemption Allowed,EMD Fee Type,EMD Percentage,EMD Payable To,EMD Payable At,S.No,Instrument Type,Tender Fee in ₹,Fee Payable To,Fee Payable At,Tender Fee Exemption Allowed,Name,Address,Title,Work Description,Pre Qualification Details,Independent External Monitor/Remarks,Tender Value in ₹,Product Category,Sub category,Contract Type,Bid Validity(Days),Period Of Work(Days),Location,Pincode,Pre Bid Meeting Place,Pre Bid Meeting Address,Pre Bid Meeting Date,Bid Opening Place,Should Allow NDA Tender,Allow Preferential Bidder,Tender Stage
Dr. Yashwant Singh Parmar University of Horticulture and Forestry,UHF/Const./ Tenders/2022/-2734 dtt 13.03.2025,2025_YSPU_101931_1,Yes,Open Tender,Turn-key,Works,2.0,No,No,Offline,No,No,No,1.0,Fee/PreQual/Technical,.pdf,Cost of tender form in shape of Demand Draft DD,13-Mar-2025 05:00 PM,25-Mar-2025 11:10 AM,13-Mar-2025 05:30 PM,25-Mar-2025 10:00 AM,,,13-Mar-2025 05:30 PM,25-Mar-2025 10:00 AM,29-Mar-2025 02:15 PM,"3,50,000",No,fixed,,Director of Extension Education,"Dr YSP UHF Nauni, Solan HP",1.0,DD - Demand Draft,"10,000",EE (Design),"Dr YSP UHF Nauni, Solan HP",No,Executive Engineer (Design),"Estate Organization, Dr YSP UHF Nauni, Solan - 173230",Establishing Incubation Centre for Vocational Education Students in the Agriculture Sector in Dr. Yashwant Singh Parmar University of Horticulture and Forestry Nauni Solan (HP).,Establishing Incubation Centre for Vocational Education Students in the Agriculture Sector in Dr. Yashwant Singh Parmar University of Horticulture and Forestry Nauni Solan (HP).,Please refer Tender documents.,Rate to be quoted by the bidder / firm,0.0,Civil Works - Others,,Tender,60.0,180.0,"Nauni, Solan",173230.0,,,,"Nauni, Solan",No,No,AOC
,,,,,,,,,,,,,,,,.pdf,Earnest money in shape of FDR,,,,,,,,,,,,,,,,2.0,FDR - Fixed Deposit,,,,,,,,,,,,,,,,,,,,,,,,,AOC
,,,,,,,,,,,,,,,,.pdf,Tender document along with drawing and specification duly signed by the bidder / firm,,,,,,,,,,,,,,,,,,,,,,,,,,,,,,,,,,,,,,,,,,AOC
,,,,,,,,,,,,,,,,.pdf,"Registration certificate / certificate of incorporation, PAN, GST and EPF Registration",,,,,,,,,,,,,,,,,,,,,,,,,,,,,,,,,,,,,,,,,,AOC
,,,,,,,,,,,,,,,,.pdf,"Affidavit regarding correctness of bid and certificate for technical evaluation, pre qualification",,,,,,,,,,,,,,,,,,,,,,,,,,,,,,,,,,,,,,,,,,AOC
,,,,,,,,,,,,,,2.0,Finance,.xls,BOQ,,,,,,,,,,,,,,,,,,,,,,,,,,,,,,,,,,,,,,,,,,AOC
