Organisation Chain,Tender Reference Number,Tender ID,Withdrawal Allowed,Tender Type,Form of contract,Tender Category,No. of Covers,General Technical Evaluation Allowed,ItemWise Technical Evaluation Allowed,Payment Mode,Is Multi Currency Allowed For BOQ,Is Multi Currency Allowed For Fee,Allow Two Stage Bidding,Cover No,Cover,Document Type,Description,Publish Date,Bid Opening Date,Document Download / Sale Start Date,Document Download / Sale End Date,Clarification Start Date,Clarification End Date,Bid Submission Start Date,Bid Submission End Date,Financial Bid Opening Date,EMD Amount in ₹,EMD Exemption Allowed,EMD Fee Type,EMD Percentage,EMD Payable To,EMD Payable At,S.No,Bank Name,Tender Fee in ₹,Fee Payable To,Fee Payable At,Tender Fee Exemption Allowed,Name,Address,Title,Work Description,Pre Qualification Details,Independent External Monitor/Remarks,Tender Value in ₹,Product Category,Sub category,Contract Type,Bid Validity(Days),Period Of Work(Days),Location,Pincode,Pre Bid Meeting Place,Pre Bid Meeting Address,Pre Bid Meeting Date,Bid Opening Place,Should Allow NDA Tender,Allow Preferential Bidder,Tender Stage
PWD,NIT 2093-97 dated 14-06-2024,2024_PWD_89238_1,Yes,Open Tender,Percentage,Works,2.0,No,No,Online,No,No,No,1.0,Fee/PreQual/Technical,.pdf,"Receipt of Cost of Tender, EMD and other terms and conditions as per indicated in SBD",18-Jun-2024 03:45 PM,26-Jun-2024 11:00 AM,18-Jun-2024 03:50 PM,26-Jun-2024 10:00 AM,,,18-Jun-2024 03:55 PM,26-Jun-2024 10:00 AM,28-Jun-2024 12:15 PM,"15,500",No,fixed,,Nil,Nil,1.0,ICICI BANK,350.0,Nil,Nil,No,EE Nalagarh,HPPWD Nalagarh,R/O rain damages on Bhud lehi Ghared road in km 0/0 to 14/00). (SH C/O wire crates at RD 13/350).,R/O rain damages on Bhud lehi Ghared road in km 0/0 to 14/00). (SH C/O wire crates at RD 13/350).,,,"7,74,464",Civil Works,,Tender,75.0,90.0,Nalagarh,174101.0,,,,EE Nalagarh,No,No,AOC
,,,,,,,,,,,,,,,,.pdf,Contractor Registration/GST/PAN/EPF and follow the other all conditions indicated in SBD,,,,,,,,,,,,,,,,2.0,ICICI NEFT/RTGS,,,,,,,,,,,,,,,,,,,,,,,,,AOC
,,,,,,,,,,,,,,,,.pdf,Duly filled and signed form No 7/8 General Rule and Direction,,,,,,,,,,,,,,,,,,,,,,,,,,,,,,,,,,,,,,,,,,AOC
,,,,,,,,,,,,,,,,.pdf,Affidavit reg. detail of Machinery/ Tool Plant) along with document of Machinery  as per contract da,,,,,,,,,,,,,,,,,,,,,,,,,,,,,,,,,,,,,,,,,,AOC
,,,,,,,,,,,,,,2.0,Finance,.xls,bill of quanity,,,,,,,,,,,,,,,,,,,,,,,,,,,,,,,,,,,,,,,,,,AOC
