Organisation Chain,Tender Reference Number,Tender ID,Withdrawal Allowed,Tender Type,Form of contract,Tender Category,No. of Covers,General Technical Evaluation Allowed,ItemWise Technical Evaluation Allowed,Payment Mode,Is Multi Currency Allowed For BOQ,Is Multi Currency Allowed For Fee,Allow Two Stage Bidding,Cover No,Cover,Document Type,Description,Publish Date,Bid Opening Date,Document Download / Sale Start Date,Document Download / Sale End Date,Clarification Start Date,Clarification End Date,Bid Submission Start Date,Bid Submission End Date,Financial Bid Opening Date,EMD Amount in ₹,EMD Exemption Allowed,EMD Fee Type,EMD Percentage,EMD Payable To,EMD Payable At,S.No,Bank Name,Tender Fee in ₹,Fee Payable To,Fee Payable At,Tender Fee Exemption Allowed,Name,Address,Title,Work Description,Pre Qualification Details,Independent External Monitor/Remarks,Tender Value in ₹,Product Category,Sub category,Contract Type,Bid Validity(Days),Period Of Work(Days),Location,Pincode,Pre Bid Meeting Place,Pre Bid Meeting Address,Pre Bid Meeting Date,Bid Opening Place,Should Allow NDA Tender,Allow Preferential Bidder,Tender Stage
PWD,PW-DPD-CB-Tender2024-25- 19595-97-dt-07.02.2025,2025_PWD_99799_1,Yes,Open Tender,Percentage,Works,2.0,No,No,Online,No,No,No,1.0,Fee/PreQual/Technical,.pdf,"Cost of tender form, earnest money, Contractor registration",14-Feb-2025 10:00 AM,21-Feb-2025 11:00 AM,14-Feb-2025 10:00 AM,20-Feb-2025 06:00 PM,,,14-Feb-2025 10:00 AM,20-Feb-2025 06:00 PM,24-Feb-2025 04:00 PM,"3,000",No,fixed,,Nil,Nil,1.0,ICICI BANK,350.0,Nil,Nil,No,Executive Engineer,HPPWD Division Office,Annual Repair and Maintenance of Foot bridge over Sun Khad at Kandappattan,Painting work in Super Structure,Please refer Tender documents.,,"1,29,376",Civil Works - Bridges,,Tender,30.0,30.0,Bridge,100001.0,,,,Bridge,No,No,AOC
,,,,,,,,,,,,,,,,.pdf,", Copy of GST EPF No. and, Pan No.",,,,,,,,,,,,,,,,2.0,ICICI NEFT/RTGS,,,,,,,,,,,,,,,,,,,,,,,,,AOC
,,,,,,,,,,,,,,,,.pdf,Work done certificate Work in hand countersigned by EE. as per CL.16 of General Rules of Directions,,,,,,,,,,,,,,,,,,,,,,,,,,,,,,,,,,,,,,,,,,AOC
,,,,,,,,,,,,,,,,.pdf,"Details  Affidavit of technical personnel in annexure VIII and V, Affidavit is true and correct.",,,,,,,,,,,,,,,,,,,,,,,,,,,,,,,,,,,,,,,,,,AOC
,,,,,,,,,,,,,,,,.pdf,All other document as per SBD requirements/contractor like to share,,,,,,,,,,,,,,,,,,,,,,,,,,,,,,,,,,,,,,,,,,AOC
,,,,,,,,,,,,,,2.0,Finance,.xls,BOQ,,,,,,,,,,,,,,,,,,,,,,,,,,,,,,,,,,,,,,,,,,AOC
